{"run":954,"commit":"3f2ee91","metric":0,"metrics":{"pending_checks":53,"passed_checks":4,"skipped_checks":0,"llgo_in_pr_diff":0},"status":"keep","description":"monitor PR after pushing newlib joinFileList optimization","timestamp":1777217639689,"segment":460,"confidence":null,"iterationTokens":454,"asi":{"hypothesis":"After pushing the newlib joinFileList optimization, the PR run should start without immediate failures and root llgo should remain absent from the diff.","result":"New PR run has 0 failures, 4 passed, 53 pending, and root llgo absent from PR diff."}}
{"type":"config","name":"Optimize compiler-rt file-list joining","metricName":"rtlib_config_ns_op","metricUnit":"","bestDirection":"lower"}
{"run":955,"commit":"353e1fd","metric":12787,"metrics":{"rtlib_config_allocs_op":161,"runs":7},"status":"keep","description":"baseline compiler-rt config joining","timestamp":1777217697976,"segment":461,"confidence":null,"iterationTokens":546,"asi":{"hypothesis":"compiler-rt uses the same joinFileList(filepath.Join per entry) pattern as newlib; benchmark RISCV config construction before applying the prefix-concatenation approach.","result":"BenchmarkCompilerRTCompileConfigRISCV median was 12787 ns/op and 161 allocs/op across 7 runs."}}
{"run":956,"commit":"45c93f3","metric":6339,"metrics":{"rtlib_config_allocs_op":163,"runs":7},"status":"keep","description":"use prefix concatenation in compiler-rt joinFileList","timestamp":1777217729747,"segment":461,"confidence":null,"iterationTokens":1411,"asi":{"hypothesis":"compiler-rt file-list joining should benefit from the same clean-root/prefix-concatenation optimization as newlib because its file entries are known relative slash-separated paths.","result":"rtlib tests passed. BenchmarkCompilerRTCompileConfigRISCV improved from 12787 ns/op and 161 allocs/op to 6339 ns/op and 163 allocs/op across 7 runs.","next_action_hint":"Add a joinFileList equivalence test in rtlib, run broad crosscompile validation, update ideas, then push if clean."}}
{"type":"config","name":"Validate compiler-rt joinFileList optimization","metricName":"validation_failures","metricUnit":"","bestDirection":"lower"}
{"run":957,"commit":"c7a8b90","metric":0,"metrics":{"packages_tested":4,"temp_builds":1},"status":"keep","description":"validate compiler-rt joinFileList optimization","timestamp":1777217830960,"segment":462,"confidence":null,"iterationTokens":247,"asi":{"hypothesis":"The compiler-rt joinFileList prefix-concatenation optimization should match filepath.Join for normal/trailing-separator roots and pass broad crosscompile validation.","result":"Added rtlib TestJoinFileList. go test ./internal/crosscompile/compile/rtlib, go test ./internal/crosscompile/..., and temp-path go build -tags=dev ./cmd/llgo passed; root llgo was not created."}}
{"type":"config","name":"Record kept compiler-rt joinFileList optimization","metricName":"validation_failures","metricUnit":"","bestDirection":"lower"}
{"run":958,"commit":"65f713f","metric":0,"metrics":{"ideas_updated":1},"status":"keep","description":"record kept compiler-rt joinFileList optimization","timestamp":1777217872964,"segment":463,"confidence":null,"iterationTokens":182,"asi":{"hypothesis":"Record the kept compiler-rt joinFileList optimization and benchmark so future loops know both large crosscompile file-list joiners are optimized.","result":"Ideas backlog now records the compiler-rt RISCV config benchmark improvement from 12787ns/op to 6339ns/op."}}
{"type":"config","name":"Monitor PR after pushing compiler-rt joinFileList optimization","metricName":"pr_check_failures","metricUnit":"","bestDirection":"lower"}
{"run":959,"commit":"c74f731","metric":0,"metrics":{"pending_checks":45,"passed_checks":2,"skipped_checks":0,"llgo_in_pr_diff":0},"status":"keep","description":"monitor PR after pushing compiler-rt joinFileList optimization","timestamp":1777217941914,"segment":464,"confidence":null,"iterationTokens":455,"asi":{"hypothesis":"After pushing the compiler-rt joinFileList optimization, the PR run should start without immediate failures and root llgo should remain absent from the diff.","result":"New PR run has 0 failures, 2 passed, 45 pending, and root llgo absent from PR diff."}}
{"run":960,"commit":"1cdc91c","metric":0,"metrics":{"pending_checks":13,"passed_checks":50,"skipped_checks":1,"llgo_in_pr_diff":0},"status":"keep","description":"monitor PR during compiler-rt joinFileList CI run","timestamp":1777219669101,"segment":464,"confidence":null,"iterationTokens":3076,"asi":{"hypothesis":"The PR run after compiler-rt joinFileList should continue without failures while longer macOS/embedded jobs complete, and root llgo should stay out of the diff.","result":"Current PR checks: 0 failures, 13 pending, 50 passed, 1 skipped; root llgo absent from PR diff.","next_action_hint":"Poll once remaining long jobs finish; do not infer performance from partial CI."}}
{"type":"config","name":"Avoid strings.Fields allocation in newlib file-list joining","metricName":"newlib_config_ns_op","metricUnit":"","bestDirection":"lower"}
{"run":961,"commit":"feeba67","metric":58607,"metrics":{"newlib_config_allocs_op":1424,"runs":9},"status":"keep","description":"baseline newlib joinFileList with strings.Fields","timestamp":1777219718773,"segment":465,"confidence":null,"iterationTokens":565,"asi":{"hypothesis":"The remaining newlib joinFileList cost may be dominated by strings.Fields allocation/scanning after the prefix-concatenation optimization; establish a fresh baseline before a one-pass ASCII field scanner.","result":"Current BenchmarkNewlibESP32CompileConfigRISCV median is 58607 ns/op and 1424 allocs/op across 9 runs."}}
{"run":962,"commit":"feeba67","metric":65131,"metrics":{"newlib_config_allocs_op":1418,"runs":9},"status":"discard","description":"replace newlib strings.Fields with ASCII scanner","timestamp":1777219760215,"segment":465,"confidence":null,"iterationTokens":2530,"asi":{"hypothesis":"A custom ASCII field scanner should avoid the temporary strings.Fields slice in newlib joinFileList, reducing allocations and perhaps runtime for large raw file lists.","result":"libc tests passed and allocations dropped from 1424 to 1418, but wall time regressed from 58607 ns/op to 65131 ns/op because the extra counting/scanning outweighed the allocation savings.","rollback_reason":"Primary benchmark regressed; allocation-only improvement is not worth slower config construction and extra scanner code.","next_action_hint":"Keep strings.Fields for newlib joinFileList; do not revisit one-pass/two-pass field scanners without an implementation that improves wall time."}}
{"type":"config","name":"Record rejected newlib field scanner experiment","metricName":"validation_failures","metricUnit":"","bestDirection":"lower"}
{"run":963,"commit":"7d81c67","metric":0,"metrics":{"ideas_updated":1},"status":"keep","description":"record rejected newlib field scanner experiment","timestamp":1777219778510,"segment":466,"confidence":null,"iterationTokens":173,"asi":{"hypothesis":"Record the rejected custom ASCII scanner so future loops do not repeat an allocation-only newlib joinFileList tweak that regressed wall time.","result":"Ideas backlog now records that replacing strings.Fields with a custom scanner moved newlib config construction from 58607ns/op to 65131ns/op despite a small allocation drop."}}
{"type":"config","name":"Avoid string-to-byte copy in manifest fingerprinting","metricName":"fingerprint_ns_op","metricUnit":"","bestDirection":"lower"}
{"run":964,"commit":"7ea48b7","metric":9156,"metrics":{"fingerprint_allocs_op":3,"runs":9},"status":"keep","description":"baseline large manifest fingerprinting","timestamp":1777219832778,"segment":467,"confidence":null,"iterationTokens":566,"asi":{"hypothesis":"fingerprintManifest currently hashes []byte(content), which copies the full manifest string; avoiding that copy may reduce build-cache fingerprint overhead for large manifests without changing YAML format or hash output.","result":"BenchmarkFingerprintManifestLarge median is 9156 ns/op, 24704 B/op, and 3 allocs/op across 9 runs for a ~23KB manifest string."}}
{"run":965,"commit":"cc7f9c8","metric":7773,"metrics":{"fingerprint_allocs_op":2,"runs":9},"status":"keep","description":"avoid manifest string copy during fingerprint hashing","timestamp":1777219905913,"segment":467,"confidence":null,"iterationTokens":3094,"asi":{"hypothesis":"Using unsafe.StringData to present the manifest string as read-only bytes avoids copying large YAML manifest strings before sha256.Sum256, preserving hash output while reducing fingerprint overhead.","result":"internal/build tests passed with a new SHA-256 equivalence test. BenchmarkFingerprintManifestLarge improved from 9156 ns/op and 3 allocs/op/24704 B/op to 7773 ns/op and 2 allocs/op/128 B/op across 9 runs.","next_action_hint":"Validate broader build/crosscompile tests and temp cmd/llgo build; consider benchmarking collectFingerprint end-to-end because YAML marshal may dominate smaller manifests."}}
{"type":"config","name":"Validate manifest fingerprint string-copy optimization","metricName":"validation_failures","metricUnit":"","bestDirection":"lower"}
{"run":966,"commit":"9408d33","metric":0,"metrics":{"packages_tested":5,"temp_builds":1,"ideas_updated":1},"status":"keep","description":"validate manifest fingerprint string-copy optimization","timestamp":1777219980562,"segment":468,"confidence":null,"iterationTokens":281,"asi":{"hypothesis":"The unsafe read-only string byte view in fingerprintManifest should preserve SHA-256 output, pass relevant build/crosscompile tests, not affect cmd/llgo build, and be recorded for future loops.","result":"go test ./internal/build, go test ./internal/crosscompile/..., and temp-path go build -tags=dev ./cmd/llgo passed; root llgo was not created; ideas backlog records the 9156ns/op to 7773ns/op large-manifest benchmark and allocation reduction."}}
{"type":"config","name":"Monitor PR after pushing fingerprint string-copy optimization","metricName":"pr_check_failures","metricUnit":"","bestDirection":"lower"}
{"run":967,"commit":"becb0bc","metric":0,"metrics":{"pending_checks":17,"passed_checks":3,"skipped_checks":0,"llgo_in_pr_diff":0},"status":"keep","description":"monitor PR after pushing fingerprint string-copy optimization","timestamp":1777220034989,"segment":469,"confidence":null,"iterationTokens":452,"asi":{"hypothesis":"After pushing the manifest fingerprint string-copy optimization, the PR run should start without immediate failures and root llgo should remain absent from the diff.","result":"New PR run has 0 failures, 3 passed, 17 pending, and root llgo absent from PR diff."}}
{"type":"config","name":"Re-evaluate picolibc file-list joining with optimized helper","metricName":"picolibc_config_ns_op","metricUnit":"","bestDirection":"lower"}
{"run":968,"commit":"33f7d39","metric":9085,"metrics":{"picolibc_config_allocs_op":129,"runs":9},"status":"keep","description":"baseline picolibc config with filepath.Join literals","timestamp":1777220091083,"segment":470,"confidence":null,"iterationTokens":563,"asi":{"hypothesis":"Although an earlier picolibc raw-list compile-speed attempt was rejected, the now-optimized libc joinFileList helper may reduce Picolibc target config construction overhead; establish a fresh runtime baseline before deciding.","result":"BenchmarkPicolibcCompileConfig median is 9085 ns/op and 129 allocs/op across 9 runs."}}
{"run":969,"commit":"7722cb8","metric":5686,"metrics":{"picolibc_config_allocs_op":131,"runs":9},"status":"keep","description":"use optimized joinFileList for picolibc file list","timestamp":1777220132465,"segment":470,"confidence":null,"iterationTokens":6831,"asi":{"hypothesis":"Now that libc joinFileList avoids per-entry filepath.Join cleanup, reusing it for Picolibc's 112 C source paths should improve target config construction despite an earlier compile-speed-only raw-list attempt being rejected.","result":"libc tests passed. BenchmarkPicolibcCompileConfig improved from 9085 ns/op and 129 allocs/op to 5686 ns/op and 131 allocs/op across 9 runs. Allocation count increased slightly due strings.Fields/prefix setup, but wall time improved by ~37%.","next_action_hint":"Validate Picolibc file list output against the previous filepath.Join semantics, then run broad crosscompile tests and temp cmd/llgo build before pushing."}}
{"type":"config","name":"Validate picolibc optimized file-list joining","metricName":"validation_failures","metricUnit":"","bestDirection":"lower"}
{"run":970,"commit":"a1f04df","metric":0,"metrics":{"packages_tested":4,"temp_builds":1},"status":"keep","description":"validate picolibc optimized file-list joining","timestamp":1777220208548,"segment":471,"confidence":null,"iterationTokens":247,"asi":{"hypothesis":"The Picolibc raw file list via joinFileList should preserve the same source count/sample paths and pass crosscompile validation and cmd/llgo build checks.","result":"Added an exact 112-file count assertion in TestGetPicolibcCompileConfig. go test ./internal/crosscompile/compile/libc, go test ./internal/crosscompile/..., and temp-path go build -tags=dev ./cmd/llgo passed; root llgo was not created."}}
{"type":"config","name":"Record kept picolibc file-list optimization","metricName":"validation_failures","metricUnit":"","bestDirection":"lower"}
{"run":971,"commit":"8b3e978","metric":0,"metrics":{"ideas_updated":1},"status":"keep","description":"record kept picolibc file-list optimization","timestamp":1777220231920,"segment":472,"confidence":null,"iterationTokens":183,"asi":{"hypothesis":"Record that the earlier rejected Picolibc raw-list direction became worthwhile after optimizing joinFileList, with a clear config-construction benchmark improvement.","result":"Ideas backlog now records the Picolibc 112-file config benchmark improvement from 9085ns/op to 5686ns/op."}}
{"type":"config","name":"Monitor PR after pushing picolibc file-list optimization","metricName":"pr_check_failures","metricUnit":"","bestDirection":"lower"}
{"run":972,"commit":"d3d67e7","metric":0,"metrics":{"pending_checks":53,"passed_checks":4,"skipped_checks":0,"llgo_in_pr_diff":0},"status":"keep","description":"monitor PR after pushing picolibc file-list optimization","timestamp":1777220316617,"segment":473,"confidence":null,"iterationTokens":455,"asi":{"hypothesis":"After pushing the Picolibc file-list optimization, the PR run should start without immediate failures and root llgo should remain absent from the diff.","result":"New PR run has 0 failures, 4 passed, 53 pending, and root llgo absent from PR diff."}}
{"type":"config","name":"Avoid YAML marshal byte-to-string copy in manifest build","metricName":"manifest_build_ns_op","metricUnit":"","bestDirection":"lower"}
{"run":973,"commit":"f4ef28d","metric":331975,"metrics":{"manifest_build_bytes_op":1080463,"manifest_build_allocs_op":3247,"runs":9},"status":"keep","description":"baseline large manifest YAML build","timestamp":1777220382831,"segment":474,"confidence":null,"iterationTokens":821,"asi":{"hypothesis":"buildManifestYAML currently converts yaml.Marshal's freshly allocated []byte to string with a full copy; a zero-copy byte-slice-to-string conversion may reduce manifest build overhead without changing YAML output.","result":"BenchmarkManifestBuildLargePackage median is 331975 ns/op, 1080463 B/op, and 3247 allocs/op across 9 runs."}}
{"run":974,"commit":"f4ef28d","metric":330859,"metrics":{"manifest_build_bytes_op":1064052,"manifest_build_allocs_op":3246,"runs":9},"status":"discard","description":"zero-copy yaml.Marshal bytes to manifest string","timestamp":1777220446867,"segment":474,"confidence":null,"iterationTokens":2057,"asi":{"hypothesis":"Converting yaml.Marshal's fresh []byte to string without copying should reduce manifest Build allocation/copy overhead while preserving YAML text.","result":"internal/build tests passed and allocations dropped by one, but large-manifest Build only moved from 331975 ns/op to 330859 ns/op (~0.3%), within noise for a new unsafe byte-slice-to-string lifetime assumption.","rollback_reason":"The wall-time gain is too small to justify expanding unsafe usage beyond the localized sha256 read-only string view.","next_action_hint":"Do not use unsafe.String for YAML marshal output unless an end-to-end collectFingerprint benchmark shows a clear material gain."}}
{"type":"config","name":"Record rejected YAML marshal zero-copy string experiment","metricName":"validation_failures","metricUnit":"","bestDirection":"lower"}
{"run":975,"commit":"e86b23f","metric":0,"metrics":{"ideas_updated":1},"status":"keep","description":"record rejected YAML marshal zero-copy string experiment","timestamp":1777220472560,"segment":475,"confidence":null,"iterationTokens":174,"asi":{"hypothesis":"Record that zero-copy yaml.Marshal []byte-to-string was rejected so future loops avoid broadening unsafe usage for a noise-level manifest Build gain.","result":"Ideas backlog now records the rejected 331975ns/op to 330859ns/op YAML marshal zero-copy experiment and reason."}}
{"type":"config","name":"Monitor PR while picolibc file-list CI run progresses","metricName":"pr_check_failures","metricUnit":"","bestDirection":"lower"}
{"run":976,"commit":"b2e519d","metric":0,"metrics":{"pending_checks":42,"passed_checks":15,"skipped_checks":0,"llgo_in_pr_diff":0},"status":"keep","description":"monitor PR while picolibc file-list CI progresses","timestamp":1777220500782,"segment":476,"confidence":null,"iterationTokens":452,"asi":{"hypothesis":"The PR run after Picolibc file-list optimization should continue without failures as Linux/embedded jobs complete, and root llgo should stay absent from the diff.","result":"Current PR checks: 0 failures, 42 pending, 15 passed, 0 skipped; root llgo absent from PR diff.","next_action_hint":"Poll later for final status; do not use partial CI as a performance benchmark."}}
{"type":"config","name":"Avoid readManifest byte-to-string copy","metricName":"read_manifest_ns_op","metricUnit":"","bestDirection":"lower"}
{"run":977,"commit":"4630718","metric":15039,"metrics":{"read_manifest_bytes_op":49577,"read_manifest_allocs_op":6,"runs":9},"status":"keep","description":"baseline readManifest string copy","timestamp":1777220529819,"segment":477,"confidence":null,"iterationTokens":700,"asi":{"hypothesis":"readManifest currently copies os.ReadFile's byte slice into a string; cache-hit metadata parsing may benefit from a zero-copy read-only string conversion for large manifests.","result":"BenchmarkReadManifestLarge median is 15039 ns/op, 49577 B/op, and 6 allocs/op across 9 runs for a ~23KB manifest file."}}
{"run":978,"commit":"5e32b6a","metric":13352,"metrics":{"read_manifest_bytes_op":25000,"read_manifest_allocs_op":5,"runs":9},"status":"keep","description":"avoid readManifest byte-to-string copy","timestamp":1777220596155,"segment":477,"confidence":null,"iterationTokens":1838,"asi":{"hypothesis":"os.ReadFile returns a fresh byte buffer for manifest contents; converting it to immutable string with unsafe.String avoids copying large manifest files on cache hits while preserving read-only semantics.","result":"internal/build tests passed. BenchmarkReadManifestLarge improved from 15039 ns/op, 49577 B/op, 6 allocs/op to 13352 ns/op, 25000 B/op, 5 allocs/op across 9 runs.","next_action_hint":"Validate with temp cmd/llgo build and record the unsafe helper scope clearly; keep zero-copy YAML marshal rejected because its wall-time gain was negligible."}}
{"type":"config","name":"Validate readManifest zero-copy string optimization","metricName":"validation_failures","metricUnit":"","bestDirection":"lower"}
{"run":979,"commit":"790e008","metric":0,"metrics":{"packages_tested":5,"temp_builds":1,"ideas_updated":1},"status":"keep","description":"validate readManifest zero-copy string optimization","timestamp":1777220663006,"segment":478,"confidence":null,"iterationTokens":279,"asi":{"hypothesis":"The readManifest zero-copy string conversion should preserve cache-manifest behavior, pass internal build/crosscompile tests, build cmd/llgo to a temp path, and be documented alongside the fingerprint unsafe read-only helper.","result":"go test ./internal/build, go test ./internal/crosscompile/..., and temp-path go build -tags=dev ./cmd/llgo passed; root llgo was not created; ideas backlog records the 15039ns/op to 13352ns/op read benchmark."}}
{"type":"config","name":"Monitor PR after pushing readManifest optimization","metricName":"pr_check_failures","metricUnit":"","bestDirection":"lower"}
{"run":980,"commit":"e1609b4","metric":0,"metrics":{"pending_checks":17,"passed_checks":1,"skipped_checks":0,"llgo_in_pr_diff":0},"status":"keep","description":"monitor PR after pushing readManifest optimization","timestamp":1777220713834,"segment":479,"confidence":null,"iterationTokens":451,"asi":{"hypothesis":"After pushing the readManifest zero-copy string optimization, the PR run should start without immediate failures and root llgo should remain absent from the diff.","result":"New PR run has 0 failures, 1 passed, 17 pending, and root llgo absent from PR diff."}}
{"type":"config","name":"Avoid repeated cache root cleaning in packageDir","metricName":"package_paths_ns_op","metricUnit":"","bestDirection":"lower"}
{"run":981,"commit":"523aca8","metric":728,"metrics":{"package_paths_bytes_op":672,"package_paths_allocs_op":7,"runs":9},"status":"keep","description":"baseline cache PackagePaths safe inputs","timestamp":1777220768363,"segment":480,"confidence":null,"iterationTokens":590,"asi":{"hypothesis":"cacheManager.packageDir calls filepath.Clean on cm.root every PackagePaths call even though buildCacheRootDir/newCacheManager can store a cleaned root; benchmark safe package path generation before hoisting root cleanup.","result":"BenchmarkPackagePathsSafe median is 728 ns/op, 672 B/op, and 7 allocs/op across 9 runs."}}
