{"run":1009,"commit":"5baa9f3","metric":0,"metrics":{"pending_checks":30,"passed_checks":31,"skipped_checks":0,"llgo_in_pr_diff":0},"status":"keep","description":"monitor PR after Readdirnames source run during continued loop","timestamp":1777222406073,"segment":501,"confidence":null,"iterationTokens":451,"asi":{"hypothesis":"The pushed Readdirnames/pkgSFiles source run should continue without failures while pending jobs complete, and root llgo should remain absent from the diff.","result":"Current PR checks: 0 failures, 30 pending, 31 passed, 0 skipped; root llgo absent from PR diff.","next_action_hint":"Poll later for final status; continue local experiments only with clear A/B evidence before pushing."}}
{"type":"config","name":"Fast path safe package paths in cache path sanitization","metricName":"package_paths_ns_op","metricUnit":"","bestDirection":"lower"}
{"run":1010,"commit":"f45bbf5","metric":644,"metrics":{"package_paths_bytes_op":672,"package_paths_allocs_op":7,"runs":9},"status":"keep","description":"baseline PackagePaths safe package path","timestamp":1777222475085,"segment":502,"confidence":null,"iterationTokens":592,"asi":{"hypothesis":"sanitizePkgPath currently splits common safe package paths into segments and filepath.Join's them; benchmark PackagePaths before adding a safe package path fast path.","result":"BenchmarkPackagePathsSafe median is 644 ns/op, 672 B/op, and 7 allocs/op across 9 runs."}}
{"run":1011,"commit":"c5495bb","metric":542,"metrics":{"package_paths_bytes_op":544,"package_paths_allocs_op":5,"runs":9},"status":"keep","description":"fast path safe package paths in sanitizePkgPath","timestamp":1777222539277,"segment":502,"confidence":null,"iterationTokens":1854,"asi":{"hypothesis":"Most cache package paths are already safe slash-separated import paths; detecting that without strings.Split and returning filepath.FromSlash should avoid segment slice allocation while preserving fallback sanitization for unsafe segments.","result":"internal/build tests passed. BenchmarkPackagePathsSafe improved from 644 ns/op, 672 B/op, 7 allocs/op to 542 ns/op, 544 B/op, 5 allocs/op across 9 runs.","next_action_hint":"Add/extend sanitizePkgPath tests for safe paths, empty/dot/dot segments, unsafe chars, and slash conversion semantics; run broad validation and temp cmd/llgo build before pushing."}}
{"type":"config","name":"Validate safe package path sanitization fast path","metricName":"validation_failures","metricUnit":"","bestDirection":"lower"}
{"run":1012,"commit":"9cbdfee","metric":0,"metrics":{"packages_tested":5,"temp_builds":1,"ideas_updated":1},"status":"keep","description":"validate safe package path sanitization fast path","timestamp":1777222613607,"segment":503,"confidence":null,"iterationTokens":279,"asi":{"hypothesis":"The sanitizePkgPath safe-path fast path should preserve existing empty/dot/dot/unsafe segment behavior, pass internal build/crosscompile tests, build cmd/llgo to a temp path, and be recorded in the ideas backlog.","result":"Extended TestSanitizePkgPath for safe dotted path, empty segment, dot, dotdot, and unsafe segment hashing. go test ./internal/build, go test ./internal/crosscompile/..., and temp-path go build -tags=dev ./cmd/llgo passed; root llgo was not created; ideas backlog records the 644ns/op to 542ns/op PackagePaths improvement."}}
{"type":"config","name":"Monitor PR after pushing sanitizePkgPath fast path","metricName":"pr_check_failures","metricUnit":"","bestDirection":"lower"}
{"run":1013,"commit":"f6b0d2f","metric":0,"metrics":{"pending_checks":17,"passed_checks":3,"skipped_checks":0,"llgo_in_pr_diff":0},"status":"keep","description":"monitor PR after pushing sanitizePkgPath fast path","timestamp":1777222666645,"segment":504,"confidence":null,"iterationTokens":453,"asi":{"hypothesis":"After pushing the sanitizePkgPath safe-path fast path, the PR run should start without immediate failures and root llgo should remain absent from the diff.","result":"New PR run has 0 failures, 3 passed, 17 pending, and root llgo absent from PR diff."}}
{"type":"config","name":"Fast path SHA-256 fingerprint cache filenames","metricName":"package_paths_ns_op","metricUnit":"","bestDirection":"lower"}
{"run":1014,"commit":"041a405","metric":540,"metrics":{"package_paths_bytes_op":544,"package_paths_allocs_op":5,"runs":9},"status":"keep","description":"baseline PackagePaths with safe package path fast path","timestamp":1777222698341,"segment":505,"confidence":null,"iterationTokens":590,"asi":{"hypothesis":"After the safe package path fast path, PackagePaths still sanitizes the known SHA-256 hex fingerprint with generic sanitizeComponent; benchmark before trying a 64-hex fast path.","result":"BenchmarkPackagePathsSafe median is 540 ns/op, 544 B/op, and 5 allocs/op across 9 runs."}}
{"run":1015,"commit":"041a405","metric":530,"metrics":{"package_paths_bytes_op":544,"package_paths_allocs_op":5,"runs":9},"status":"discard","description":"fast path 64-hex fingerprint cache filenames","timestamp":1777222760952,"segment":505,"confidence":null,"iterationTokens":1613,"asi":{"hypothesis":"Package cache fingerprints are SHA-256 hex strings, so a 64-hex fast path might avoid generic sanitizeComponent overhead in PackagePaths.","result":"internal/build tests passed and median moved from 540 ns/op to 530 ns/op with unchanged allocations, but the absolute ~10ns improvement is too small for an extra fingerprint-specific sanitizer and fallback code.","rollback_reason":"Noise-level micro-optimization; generic sanitizeComponent is simpler and safer for PackagePaths callers/tests that use short synthetic fingerprints.","next_action_hint":"Do not revisit fingerprint filename sanitizer unless PackagePaths appears in profiles with millions of calls."}}
{"type":"config","name":"Record rejected fingerprint filename sanitizer fast path","metricName":"validation_failures","metricUnit":"","bestDirection":"lower"}
{"run":1016,"commit":"361886e","metric":0,"metrics":{"ideas_updated":1},"status":"keep","description":"record rejected fingerprint filename sanitizer fast path","timestamp":1777222785833,"segment":506,"confidence":null,"iterationTokens":173,"asi":{"hypothesis":"Record the rejected 64-hex fingerprint cache filename sanitizer so future loops avoid a 10ns/no-allocation micro-optimization.","result":"Ideas backlog now records the 540ns/op to 530ns/op noise-level fingerprint filename fast path rejection."}}
{"type":"config","name":"Avoid redundant filepath.Clean after filepath.Join in packageDir","metricName":"package_paths_ns_op","metricUnit":"","bestDirection":"lower"}
{"run":1017,"commit":"e936594","metric":547,"metrics":{"package_paths_bytes_op":544,"package_paths_allocs_op":5,"runs":9},"status":"keep","description":"baseline PackagePaths before removing redundant Clean","timestamp":1777222834721,"segment":507,"confidence":null,"iterationTokens":593,"asi":{"hypothesis":"cacheManager.packageDir calls filepath.Clean immediately after filepath.Join, but Join already cleans its result. Establish a fresh PackagePaths baseline before removing the redundant Clean.","result":"BenchmarkPackagePathsSafe median is 547 ns/op, 544 B/op, and 5 allocs/op across 9 runs."}}
{"run":1018,"commit":"459a896","metric":493,"metrics":{"package_paths_bytes_op":544,"package_paths_allocs_op":5,"runs":9},"status":"keep","description":"remove redundant filepath.Clean after filepath.Join in packageDir","timestamp":1777222891938,"segment":507,"confidence":null,"iterationTokens":1255,"asi":{"hypothesis":"filepath.Join already cleans its result, so the subsequent filepath.Clean in cacheManager.packageDir is redundant and adds PackagePaths overhead.","result":"internal/build tests passed. BenchmarkPackagePathsSafe improved from 547 ns/op to 493 ns/op with unchanged allocations across 9 runs.","next_action_hint":"Add/confirm tests for packageDir traversal guard still pass; run broad validation and temp cmd/llgo build before pushing."}}
{"type":"config","name":"Validate packageDir redundant Clean removal","metricName":"validation_failures","metricUnit":"","bestDirection":"lower"}
{"run":1019,"commit":"33b8997","metric":0,"metrics":{"packages_tested":5,"temp_builds":1,"ideas_updated":1},"status":"keep","description":"validate packageDir redundant Clean removal","timestamp":1777222962769,"segment":508,"confidence":null,"iterationTokens":279,"asi":{"hypothesis":"Removing filepath.Clean after filepath.Join in packageDir should preserve cache path behavior because Join already cleans the result; tests and temp cmd/llgo build should remain green.","result":"go test ./internal/build, go test ./internal/crosscompile/..., and temp-path go build -tags=dev ./cmd/llgo passed; root llgo was not created; ideas backlog records the 547ns/op to 493ns/op PackagePaths improvement."}}
{"type":"config","name":"Monitor PR after pushing packageDir Clean removal","metricName":"pr_check_failures","metricUnit":"","bestDirection":"lower"}
{"run":1020,"commit":"abbbcf2","metric":0,"metrics":{"pending_checks":45,"passed_checks":1,"skipped_checks":0,"llgo_in_pr_diff":0},"status":"keep","description":"monitor PR after pushing packageDir Clean removal","timestamp":1777223018904,"segment":509,"confidence":null,"iterationTokens":452,"asi":{"hypothesis":"After pushing the packageDir redundant Clean removal, the PR run should start without immediate failures and root llgo should remain absent from the diff.","result":"New PR run has 0 failures, 1 passed, 45 pending, and root llgo absent from PR diff."}}
{"type":"config","name":"Avoid root separator string allocation in packageDir guard","metricName":"package_paths_ns_op","metricUnit":"","bestDirection":"lower"}
{"run":1021,"commit":"3d14ea6","metric":506,"metrics":{"package_paths_bytes_op":544,"package_paths_allocs_op":5,"runs":9},"status":"keep","description":"baseline PackagePaths before guard allocation removal","timestamp":1777223054101,"segment":510,"confidence":null,"iterationTokens":591,"asi":{"hypothesis":"packageDir's traversal guard allocates root+separator for strings.HasPrefix on every PackagePaths call; benchmark before replacing it with an index/path-separator check.","result":"BenchmarkPackagePathsSafe median is 506 ns/op, 544 B/op, and 5 allocs/op across 9 runs."}}
{"run":1022,"commit":"3d14ea6","metric":544,"metrics":{"package_paths_bytes_op":544,"package_paths_allocs_op":5,"runs":9},"status":"discard","description":"avoid root separator string allocation in packageDir guard","timestamp":1777223119285,"segment":510,"confidence":null,"iterationTokens":1362,"asi":{"hypothesis":"Replacing root+separator string construction with an indexed os.IsPathSeparator check should avoid an allocation in packageDir's traversal guard.","result":"internal/build tests passed, but BenchmarkPackagePathsSafe regressed/noised from 506 ns/op to 544 ns/op with unchanged allocations; the compiler did not expose the expected allocation reduction.","rollback_reason":"Primary benchmark worsened and helper abstraction adds code without benefit.","next_action_hint":"Keep the straightforward strings.HasPrefix(dir, root+separator) guard unless profiles prove it material."}}
{"type":"config","name":"Record rejected packageDir guard helper","metricName":"validation_failures","metricUnit":"","bestDirection":"lower"}
{"run":1023,"commit":"a20dc3a","metric":0,"metrics":{"ideas_updated":1},"status":"keep","description":"record rejected packageDir guard helper","timestamp":1777223145280,"segment":511,"confidence":null,"iterationTokens":172,"asi":{"hypothesis":"Record the rejected packageDir root separator guard helper so future loops do not repeat a no-allocation/no-improvement path-safety micro-optimization.","result":"Ideas backlog now records the 506ns/op to 544ns/op PackagePaths regression with unchanged allocations."}}
{"type":"config","name":"Collect and update latest PR runtime snapshot","metricName":"pr_check_failures","metricUnit":"","bestDirection":"lower"}
{"run":1024,"commit":"9e486fa","metric":0,"metrics":{"pending_checks":44,"passed_checks":13,"skipped_checks":0,"llgo_in_pr_diff":0},"status":"keep","description":"monitor PR before latest runtime snapshot","timestamp":1777223179049,"segment":512,"confidence":null,"iterationTokens":447,"asi":{"hypothesis":"Before collecting the latest PR runtime snapshot, the current PR head run should be monitored until all checks finish; root llgo must remain absent from the diff.","result":"Current PR checks for the latest pushed source head have 0 failures, 44 pending, 13 passed, 0 skipped, and root llgo absent from PR diff.","next_action_hint":"Wait for remaining jobs to finish before computing job timestamp-based runtime metrics and updating the PR body."}}
{"run":1025,"commit":"2f6947b","metric":0,"metrics":{"pending_checks":29,"passed_checks":32,"skipped_checks":0,"llgo_in_pr_diff":0},"status":"keep","description":"monitor PR after ten minutes before runtime snapshot","timestamp":1777223806895,"segment":512,"confidence":null,"iterationTokens":1096,"asi":{"hypothesis":"The latest PR head run should keep progressing without failures before collecting final runtime metrics.","result":"After waiting 10 minutes: 0 failures, 29 pending, 32 passed, 0 skipped, and root llgo absent from PR diff.","next_action_hint":"Continue waiting for remaining macOS/embedded/release jobs; compute runtime only after pending reaches zero."}}
{"run":1026,"commit":"46df89d","metric":0,"metrics":{"pending_checks":19,"passed_checks":44,"skipped_checks":0,"llgo_in_pr_diff":0},"status":"keep","description":"monitor PR after twenty minutes before runtime snapshot","timestamp":1777224427768,"segment":512,"confidence":null,"iterationTokens":1085,"asi":{"hypothesis":"The latest PR head run should continue completing without failures before final runtime metrics are collected.","result":"After another 10 minutes: 0 failures, 19 pending, 44 passed, 0 skipped, root llgo absent from PR diff.","next_action_hint":"Continue waiting until pending reaches zero before updating the PR body."}}
{"run":1027,"commit":"83f2c0d","metric":0,"metrics":{"pending_checks":14,"passed_checks":49,"skipped_checks":1,"llgo_in_pr_diff":0},"status":"keep","description":"monitor PR after thirty minutes before runtime snapshot","timestamp":1777225048293,"segment":512,"confidence":null,"iterationTokens":1048,"asi":{"hypothesis":"The latest PR head run should continue toward completion without failures before collecting final runtime metrics.","result":"After another 10 minutes: 0 failures, 14 pending, 49 passed, 1 skipped release job, root llgo absent from PR diff.","next_action_hint":"Continue waiting for remaining macOS llgo/host-demo jobs before updating PR runtime comparison."}}
{"run":1028,"commit":"2473f6b","metric":0,"metrics":{"pending_checks":5,"passed_checks":58,"skipped_checks":1,"llgo_in_pr_diff":0},"status":"keep","description":"monitor PR with five checks remaining before runtime snapshot","timestamp":1777225673205,"segment":512,"confidence":null,"iterationTokens":1085,"asi":{"hypothesis":"The latest PR head run should have only the longest macOS llgo/host-demo jobs remaining before final runtime metrics can be collected.","result":"After another 10 minutes: 0 failures, 5 pending, 58 passed, 1 skipped, root llgo absent from PR diff.","next_action_hint":"Continue polling until pending reaches zero, then compute job timestamp metrics for latest PR head."}}
{"run":1029,"commit":"2389c2c","metric":0,"metrics":{"pending_checks":1,"passed_checks":62,"skipped_checks":1,"llgo_in_pr_diff":0},"status":"keep","description":"monitor PR with one check remaining before runtime snapshot","timestamp":1777225994706,"segment":512,"confidence":null,"iterationTokens":1091,"asi":{"hypothesis":"The latest PR head run should be almost complete before final runtime metrics and PR body update.","result":"After five more minutes: 0 failures, 1 pending, 62 passed, 1 skipped, root llgo absent from PR diff; only llgo-host-demos-macos-intel (19, 1.24.2) remains pending.","next_action_hint":"Poll once more shortly, then collect runtime metrics from completed GitHub Actions job timestamps."}}
{"run":1030,"commit":"cd64448","metric":0,"metrics":{"pending_checks":0,"passed_checks":63,"skipped_checks":1,"llgo_in_pr_diff":0},"status":"keep","description":"monitor PR final state before runtime snapshot update","timestamp":1777226323841,"segment":512,"confidence":null,"iterationTokens":1070,"asi":{"hypothesis":"The latest PR head run should complete successfully before collecting runtime metrics and editing the PR body.","result":"All latest PR checks are complete: 0 failures, 0 pending, 63 passed, 1 skipped, root llgo absent from PR diff.","next_action_hint":"Collect run IDs/job timestamps for the latest head, compute non-skipped/skipped jobs, longest job, total runner time, and wall time, then add a new PR body comparison section preserving existing comparisons."}}
{"run":1031,"commit":"33b8997","metric":0,"metrics":{"pending_checks":0,"passed_checks":63,"skipped_checks":1,"llgo_in_pr_diff":0,"latest_non_skipped_jobs":0,"latest_skipped_jobs":0,"latest_longest_job_seconds":0,"latest_total_runner_seconds":0,"latest_wall_seconds":0},"status":"crash","description":"collect latest PR runtime metrics from Actions jobs","timestamp":1777226366757,"segment":512,"confidence":null,"iterationTokens":1948,"asi":{"hypothesis":"Use PR check action run IDs and GitHub Actions job timestamps to compute the latest PR runtime snapshot.","result":"The collector parsed run IDs but crashed because gh api was called with -F pagination parameters without forcing GET, causing a non-zero gh api call for /actions/runs/{id}/jobs.","rollback_reason":"Harness bug only; no source changes are involved.","next_action_hint":"Retry with gh api --method GET and query parameters, or use gh api --paginate."}}
{"run":1032,"commit":"6261856","metric":0,"metrics":{"pending_checks":0,"passed_checks":63,"skipped_checks":1,"llgo_in_pr_diff":0,"latest_non_skipped_jobs":61,"latest_skipped_jobs":1,"latest_longest_job_seconds":786,"latest_total_runner_seconds":19490,"latest_wall_seconds":3282},"status":"keep","description":"collect latest PR runtime metrics from Actions jobs","timestamp":1777226399951,"segment":512,"confidence":null,"iterationTokens":2052,"asi":{"hypothesis":"Use completed latest PR head GitHub Actions job timestamps to compute an additive runtime snapshot for the PR body while preserving existing comparison sections.","result":"Latest head 33b8997 run IDs from PR checks yielded 61 non-skipped jobs, 1 skipped job, longest job 13m06s, total runner time 5h24m50s, and end-to-end wall time 54m42s.","next_action_hint":"Update PR body by adding a new latest-head snapshot section/table and preserve the existing CI Runtime Comparison and Workflow-Level Comparison sections."}}
{"type":"config","name":"Update PR body with latest runtime snapshot","metricName":"pr_body_update_failures","metricUnit":"","bestDirection":"lower"}
{"run":1033,"commit":"ac318ed","metric":0,"metrics":{"latest_wall_seconds":3282,"latest_total_runner_seconds":19490,"latest_longest_job_seconds":786,"pr_sections_preserved":3},"status":"keep","description":"update PR body with latest runtime snapshot","timestamp":1777226468104,"segment":513,"confidence":null,"iterationTokens":1102,"asi":{"hypothesis":"The PR body can be updated additively with a new latest-head runtime snapshot while preserving the existing CI Runtime Comparison, Workflow-Level Comparison, and previous additional snapshot sections.","result":"Updated PR #1831 body with a new 'Latest PR Head Runtime (post cache-path snapshot)' section for head 33b8997. Metrics: 61 non-skipped jobs, 1 skipped, longest job 13m06s, total runner time 5h24m50s, wall time 54m42s. Verified original comparison sections and previous additional snapshot remain present."}}
{"type":"config","name":"Cache context target triple computation","metricName":"target_triple_ns_op","metricUnit":"","bestDirection":"lower"}
{"run":1034,"commit":"adfce7f","metric":62,"metrics":{"target_triple_bytes_op":48,"target_triple_allocs_op":3,"runs":9},"status":"keep","description":"baseline context targetTriple host computation","timestamp":1777226563700,"segment":514,"confidence":null,"iterationTokens":548,"asi":{"hypothesis":"context.targetTriple is called for cache load/save paths and uses fmt.Sprintf for host triples; caching the computed string in context may reduce repeated per-package cache-path overhead.","result":"BenchmarkContextTargetTripleHost median is 62 ns/op, 48 B/op, and 3 allocs/op across 9 runs."}}
{"run":1035,"commit":"644d211","metric":1,"metrics":{"target_triple_bytes_op":0,"target_triple_allocs_op":0,"runs":9},"status":"keep","description":"cache context targetTriple result","timestamp":1777226647256,"segment":514,"confidence":null,"iterationTokens":1981,"asi":{"hypothesis":"Caching context.targetTriple in the build context should avoid repeated fmt.Sprintf/string concatenation allocations on cache load/save paths for every package.","result":"internal/build tests passed. BenchmarkContextTargetTripleHost improved from 62 ns/op, 48 B/op, 3 allocs/op to about 1 ns/op, 0 B/op, 0 allocs/op across 9 runs.","next_action_hint":"Validate behavior with existing targetTriple tests and broad build/crosscompile/temp cmd build, then record in ideas before pushing."}}
{"type":"config","name":"Validate cached context targetTriple","metricName":"validation_failures","metricUnit":"","bestDirection":"lower"}
