{"run":384,"commit":"65a8c3d","metric":0,"metrics":{"pending_checks":3},"status":"keep","description":"monitor embedded demo parallel PR with three checks pending","timestamp":1777077549754,"segment":216,"confidence":null,"iterationTokens":843,"asi":{"hypothesis":"Continue monitoring after embedded demo parallelism; remaining pending checks include macOS Intel and macOS llgo jobs.","result":"No failed checks observed; 3 checks remain pending."}}
{"run":385,"commit":"1a547d2","metric":0,"metrics":{"pending_checks":1},"status":"keep","description":"monitor embedded demo parallel PR with only Go 1.21 Intel pending","timestamp":1777077872025,"segment":216,"confidence":null,"iterationTokens":1074,"asi":{"hypothesis":"Confirm embedded-demo-only parallelism continues to pass as the slow macOS Intel jobs finish.","result":"No failed checks observed; only macOS Intel Go 1.21 llgo job remains pending. macOS Intel Go 1.24 llgo passed in 22m47s, a large improvement over prior ~27-28m runs."}}
{"run":386,"commit":"505999d","metric":0,"metrics":{"pending_checks":0},"status":"keep","description":"monitor embedded demo parallel PR completed successfully","timestamp":1777078189818,"segment":216,"confidence":null,"iterationTokens":603,"asi":{"hypothesis":"Confirm the full PR run with macOS Intel embedded-demo-only parallelism completes without failures.","result":"No failed or pending checks observed; full PR run completed successfully."}}
{"type":"config","name":"Measure macOS Intel embedded parallelism impact","metricName":"macos_intel_llgo_max_seconds","metricUnit":"s","bestDirection":"lower"}
{"run":387,"commit":"e9ddc9c","metric":1853,"metrics":{"macos_intel_llgo_jobs":2,"macos_intel_llgo_total_seconds":3210},"status":"keep","description":"measure macOS Intel llgo durations after embedded parallelism","timestamp":1777078214969,"segment":217,"confidence":null,"iterationTokens":343,"asi":{"hypothesis":"Embedded-demo-only parallelism on macOS Intel should reduce scarce macOS runner minutes for the slow llgo matrix jobs without reducing coverage.","result":"Both macOS Intel llgo jobs passed. Go 1.24 improved substantially to 22m47s, while Go 1.21 was 30m53s; total for the two Intel llgo jobs was 3210s."}}
{"type":"config","name":"Compare macOS Intel llgo total runner time","metricName":"macos_intel_llgo_total_seconds","metricUnit":"s","bestDirection":"lower"}
{"run":388,"commit":"6207d3c","metric":3220,"metrics":{"previous_macos_intel_llgo_total_seconds":3426,"macos_intel_llgo_total_saved_seconds":206},"status":"keep","description":"compare macOS Intel llgo total runner time after embedded parallelism","timestamp":1777078262140,"segment":218,"confidence":null,"iterationTokens":256,"asi":{"hypothesis":"Because macOS runner scarcity is about runner-minutes, compare total time for both macOS Intel llgo jobs rather than only max job duration.","result":"Total macOS Intel llgo time decreased from prior 3426s to 3220s, saving about 206s of macOS Intel runner time, with full CI passing. Go 1.21 remains the critical path and should be investigated separately."}}
{"type":"config","name":"Monitor PR after pushing embedded parallel measurements","metricName":"pr_check_failures","metricUnit":"","bestDirection":"lower"}
{"run":389,"commit":"d627f2b","metric":0,"metrics":{"pending_checks":28},"status":"keep","description":"monitor PR immediately after pushing embedded parallel measurements","timestamp":1777078293238,"segment":219,"confidence":null,"iterationTokens":244,"asi":{"hypothesis":"After pushing monitoring/measurement commits for the already-passing embedded parallelism change, immediately check for CI failures.","result":"No failed checks observed; 28 checks pending after new push."}}
{"run":390,"commit":"980cb19","metric":0,"metrics":{"pending_checks":23},"status":"keep","description":"monitor PR after embedded parallel measurement push has started","timestamp":1777078489065,"segment":219,"confidence":null,"iterationTokens":908,"asi":{"hypothesis":"Continue monitoring the latest push for early failures after workflows start.","result":"No failed checks observed; 23 checks pending."}}
{"run":391,"commit":"8b85e54","metric":0,"metrics":{"pending_checks":15},"status":"keep","description":"monitor PR after embedded parallel measurement push has run longer","timestamp":1777078837561,"segment":219,"confidence":null,"iterationTokens":908,"asi":{"hypothesis":"Continue monitoring latest pushed run after embedded parallel measurement commits; no failures should appear because the underlying change already passed once.","result":"No failed checks observed; 15 checks remain pending."}}
{"run":392,"commit":"bb51627","metric":0,"metrics":{"pending_checks":11},"status":"keep","description":"monitor PR after embedded parallel measurement push with eleven pending","timestamp":1777079173224,"segment":219,"confidence":null,"iterationTokens":1977,"asi":{"hypothesis":"Continue monitoring the latest push; still no code changes after the known-passing embedded-demo-only parallelism change.","result":"No failed checks observed; 11 checks remain pending."}}
{"run":393,"commit":"bd22bb3","metric":0,"metrics":{"pending_checks":8},"status":"keep","description":"monitor PR after embedded parallel measurement push with eight pending","timestamp":1777079497918,"segment":219,"confidence":null,"iterationTokens":1238,"asi":{"hypothesis":"Continue monitoring until macOS-heavy checks from the latest push complete.","result":"No failed checks observed; 8 checks remain pending."}}
{"run":394,"commit":"b281379","metric":0,"metrics":{"pending_checks":5},"status":"keep","description":"monitor PR after embedded parallel measurement push with five pending","timestamp":1777079818379,"segment":219,"confidence":null,"iterationTokens":1555,"asi":{"hypothesis":"Continue monitoring the latest CI run; remaining pending checks are long macOS jobs.","result":"No failed checks observed; 5 checks remain pending."}}
{"run":395,"commit":"6477231","metric":0,"metrics":{"pending_checks":3},"status":"keep","description":"monitor PR after embedded parallel measurement push with three pending","timestamp":1777080135383,"segment":219,"confidence":null,"iterationTokens":743,"asi":{"hypothesis":"Continue monitoring the latest run until the remaining macOS Intel and macOS Go 1.21 jobs complete.","result":"No failed checks observed; 3 checks remain pending."}}
{"run":396,"commit":"bab7e3f","metric":0,"metrics":{"pending_checks":1},"status":"keep","description":"monitor PR after embedded parallel measurement push with one pending","timestamp":1777080449622,"segment":219,"confidence":null,"iterationTokens":647,"asi":{"hypothesis":"Only the macOS Intel Go 1.21 llgo job remains; continue monitoring to confirm completion or catch late failures.","result":"No failed checks observed; 1 check remains pending."}}
{"run":397,"commit":"b6fcc4b","metric":0,"metrics":{"pending_checks":1},"status":"keep","description":"monitor PR with macOS Intel Go 1.21 still pending","timestamp":1777080765625,"segment":219,"confidence":null,"iterationTokens":548,"asi":{"hypothesis":"The macOS Intel Go 1.21 llgo job remains the clear critical path after other checks completed.","result":"No failed checks observed; macOS Intel Go 1.21 llgo still pending after an additional wait."}}
{"type":"config","name":"Limit embedded demo parallelism to macOS Intel Go 1.24","metricName":"macos_intel_go121_parallel_jobs","metricUnit":"","bestDirection":"lower"}
{"run":398,"commit":"abbf89d","metric":2,"metrics":{"macos_intel_go124_parallel_jobs":2},"status":"keep","description":"baseline embedded parallelism also affects macOS Intel Go 1.21","timestamp":1777080809851,"segment":220,"confidence":null,"iterationTokens":210,"asi":{"hypothesis":"Embedded-demo-only parallelism helped macOS Intel Go 1.24 but made Go 1.21 remain the critical path and appears slower/more variable. Limit parallelism to the Go 1.24 leg while keeping Go 1.21 sequential."}}
{"run":399,"commit":"b7656f9","metric":1,"metrics":{"macos_intel_go124_parallel_jobs":2},"status":"keep","description":"limit embedded demo parallelism to macOS Intel Go 1.24","timestamp":1777080853501,"segment":220,"confidence":null,"iterationTokens":1182,"asi":{"hypothesis":"Keep the Go 1.24 macOS Intel embedded-demo parallelism that showed a large win, but restore Go 1.21 to sequential because live CI showed no win and high variance there.","result":"llgo.yml parses, test_demo.sh passes bash -n, Go 1.21 embedded demo job count drops from 2 to 1 while Go 1.24 remains 2."}}
{"type":"config","name":"Validate workflows before Go-version-limited embedded parallel push","metricName":"workflow_validation_failures","metricUnit":"","bestDirection":"lower"}
{"run":400,"commit":"e46bf65","metric":0,"metrics":{"workflow_files_checked":8,"action_files_checked":5,"shell_scripts_checked":1},"status":"keep","description":"validate workflows before Go-version-limited embedded parallel push","timestamp":1777080876791,"segment":221,"confidence":null,"iterationTokens":204,"asi":{"hypothesis":"Validate syntax before pushing Go-version-limited macOS Intel embedded demo parallelism.","result":"All workflow/action YAML parsed and test_demo.sh passed bash -n."}}
{"type":"config","name":"Monitor PR before Go-version-limited embedded parallel push","metricName":"pr_check_failures","metricUnit":"","bestDirection":"lower"}
{"run":401,"commit":"ea57dc5","metric":0,"metrics":{"pending_checks":1},"status":"keep","description":"monitor PR before Go-version-limited embedded parallel push","timestamp":1777080903082,"segment":222,"confidence":null,"iterationTokens":247,"asi":{"hypothesis":"Before pushing the Go-version-limited embedded parallelism adjustment, check whether the current macOS Intel Go 1.21 critical-path job has failed.","result":"No failed checks observed; current run still has macOS Intel Go 1.21 pending."}}
{"type":"config","name":"Monitor PR after Go-version-limited embedded parallel push","metricName":"pr_check_failures","metricUnit":"","bestDirection":"lower"}
{"run":402,"commit":"a8c86b0","metric":0,"metrics":{"pending_checks":33},"status":"keep","description":"monitor PR immediately after Go-version-limited embedded parallel push","timestamp":1777080937959,"segment":223,"confidence":null,"iterationTokens":247,"asi":{"hypothesis":"Immediately check CI after pushing embedded parallelism limited to macOS Intel Go 1.24.","result":"No failed checks observed; 33 checks pending immediately after push."}}
{"run":403,"commit":"5f3c062","metric":0,"metrics":{"pending_checks":22},"status":"keep","description":"monitor Go-version-limited embedded parallel PR after jobs started","timestamp":1777081136792,"segment":223,"confidence":null,"iterationTokens":914,"asi":{"hypothesis":"Wait for workflows to fan out after pushing Go-version-limited embedded parallelism and check for early failures.","result":"No failed checks observed; 22 checks pending."}}
{"run":404,"commit":"b85b15d","metric":0,"metrics":{"pending_checks":17},"status":"keep","description":"monitor Go-version-limited embedded parallel PR after more runtime","timestamp":1777081477852,"segment":223,"confidence":null,"iterationTokens":927,"asi":{"hypothesis":"Continue monitoring Go-version-limited embedded parallelism; user clarified future work should focus only on >20 minute tasks and target under 15 minutes.","result":"No failed checks observed; 17 checks remain pending.","next_action_hint":"Stop micro-optimizations and focus on jobs over 20 minutes: macOS Intel llgo demo jobs and macOS coverage/emulator job."}}
{"type":"config","name":"Split macOS coverage and embedded emulator CI job","metricName":"combined_macos_go_coverage_emulator_steps","metricUnit":"","bestDirection":"lower"}
{"run":405,"commit":"0a9ff06","metric":1,"metrics":{"over_20m_go_jobs_targeted":1},"status":"keep","description":"baseline macOS Go workflow combines coverage and embedded emulator","timestamp":1777081513834,"segment":224,"confidence":null,"iterationTokens":188,"asi":{"hypothesis":"The macOS Go workflow exceeds 20 minutes because it runs coverage and embedded emulator tests in one job. Splitting them preserves coverage while targeting sub-15-minute job durations."}}
{"run":406,"commit":"2a24cb6","metric":0,"metrics":{"over_20m_go_jobs_targeted":1,"split_macos_emulator_jobs":1},"status":"keep","description":"split macOS coverage and embedded emulator into separate jobs","timestamp":1777081543744,"segment":224,"confidence":null,"iterationTokens":1712,"asi":{"hypothesis":"Move the macOS embedded emulator test into its own job while leaving coverage in the original macOS test job. This preserves both checks but targets the formerly ~21m combined macOS Go job to become two sub-15m jobs.","result":"go.yml parses; combined macOS coverage+emulator marker dropped from 1 to 0 and one macOS emulator job was added."}}
{"type":"config","name":"Prune tried macOS Go split idea","metricName":"stale_ideas_pruned","metricUnit":"","bestDirection":"higher"}
{"run":407,"commit":"c3e583f","metric":1,"metrics":{"ideas_entries":8},"status":"keep","description":"record macOS Go coverage/emulator split in ideas backlog","timestamp":1777081571212,"segment":225,"confidence":null,"iterationTokens":122,"asi":{"hypothesis":"Prune the stale macOS coverage-job analysis idea now that the first coverage-preserving split has been implemented, and leave a monitor-before-further-changes note.","result":"Updated autoresearch.ideas.md to record the split and monitoring requirement."}}
{"type":"config","name":"Validate workflows after macOS Go split","metricName":"workflow_validation_failures","metricUnit":"","bestDirection":"lower"}
{"run":408,"commit":"f9096d4","metric":0,"metrics":{"workflow_files_checked":8,"action_files_checked":5},"status":"keep","description":"validate workflows after macOS Go coverage/emulator split","timestamp":1777081590519,"segment":226,"confidence":null,"iterationTokens":189,"asi":{"hypothesis":"Splitting the macOS Go workflow into coverage and emulator jobs should leave all workflow/action YAML valid before pushing.","result":"All workflow and action YAML files parsed successfully."}}
{"type":"config","name":"Monitor PR before macOS Go split push","metricName":"pr_check_failures","metricUnit":"","bestDirection":"lower"}
{"run":409,"commit":"9c7a20b","metric":0,"metrics":{"pending_checks":12},"status":"keep","description":"monitor PR before macOS Go split push","timestamp":1777081621198,"segment":227,"confidence":null,"iterationTokens":245,"asi":{"hypothesis":"Before pushing the macOS Go coverage/emulator split, check current CI for failures that would take priority.","result":"No failed checks observed; 12 checks still pending in the current run."}}
{"type":"config","name":"Monitor PR after macOS Go split push","metricName":"pr_check_failures","metricUnit":"","bestDirection":"lower"}
{"run":410,"commit":"c4a4678","metric":0,"metrics":{"pending_checks":16},"status":"keep","description":"monitor PR immediately after macOS Go split push","timestamp":1777081679125,"segment":228,"confidence":null,"iterationTokens":245,"asi":{"hypothesis":"Immediately check CI after pushing the macOS coverage/emulator split intended to bring the former 20+ minute Go macOS task under 15 minutes.","result":"No failed checks observed; 16 checks pending immediately after push, including the new test-embed-emulator-macos job."}}
{"run":411,"commit":"c4a4678","metric":1,"metrics":{"pending_checks":20},"status":"discard","description":"macOS Go split push produced an early PR failure","timestamp":1777081893579,"segment":228,"confidence":null,"iterationTokens":889,"asi":{"hypothesis":"Monitor the macOS Go coverage/emulator split after pushing; it should not introduce failures.","result":"PR checks report 1 failure shortly after the split push.","rollback_reason":"User asked to validate speed locally before submitting to CI; split was pushed prematurely and produced a failure signal. Revert local workflow split changes while preserving logs, then inspect CI failure and use local validation for future changes.","next_action_hint":"Inspect failed check with gh pr checks/gh run logs, revert or fix the macOS Go split, and only re-push after local validation of timing/coverage."}}
{"type":"config","name":"Revert premature macOS Go split and validate locally first","metricName":"macos_go_split_sites","metricUnit":"","bestDirection":"lower"}
{"run":412,"commit":"62934bb","metric":0,"metrics":{"ideas_dead_end_notes":1},"status":"keep","description":"revert premature macOS Go split and record local-validation requirement","timestamp":1777081990817,"segment":229,"confidence":null,"iterationTokens":217,"asi":{"hypothesis":"User correctly noted that speed changes should be locally validated before submitting to CI. Revert the premature macOS Go split, restore the known workflow, and record that any reattempt requires local timing/coverage validation and job-name semantics check.","result":"go.yml parses, split job marker is gone, and autoresearch.ideas.md records the dead-end/local-validation requirement."}}
{"type":"config","name":"Monitor PR after reverting premature macOS Go split","metricName":"pr_check_failures","metricUnit":"","bestDirection":"lower"}
{"run":413,"commit":"56750db","metric":0,"metrics":{"pending_checks":11},"status":"keep","description":"monitor PR immediately after reverting premature macOS Go split","timestamp":1777082027828,"segment":230,"confidence":null,"iterationTokens":246,"asi":{"hypothesis":"After reverting and pushing the premature macOS Go split, the new PR run should no longer have the split-job failure.","result":"No failed checks observed; 11 checks pending immediately after revert push."}}
{"run":414,"commit":"aece5c3","metric":0,"metrics":{"pending_checks":20},"status":"keep","description":"monitor revert run after premature macOS Go split","timestamp":1777082245281,"segment":230,"confidence":null,"iterationTokens":3510,"asi":{"hypothesis":"Continue monitoring the revert run to ensure the premature macOS Go split failure is gone before further experiments.","result":"No failed checks observed; 20 checks pending as workflows run."}}
{"type":"config","name":"Local timing for demo steps before CI changes","metricName":"local_demo_step_seconds","metricUnit":"s","bestDirection":"lower"}
{"run":415,"commit":"aece5c3","metric":0,"metrics":{"host_demo_cases":0,"embedded_demo_dirs":0},"status":"crash","description":"attempt local demo workload enumeration accidentally sourced runner script","timestamp":1777082337917,"segment":231,"confidence":null,"iterationTokens":348,"asi":{"hypothesis":"Enumerate local demo workload sizes before making CI changes for >20m llgo demo jobs.","error":"The command sourced test_demo.sh, which executed the script and timed out instead of just enumerating cases.","rollback_reason":"No intended code changes; crash caused by bad local validation command.","next_action_hint":"Use a standalone Python enumeration without sourcing/executing test_demo.sh."}}
{"run":416,"commit":"cc13c1b","metric":0,"metrics":{"host_demo_cases":86,"embedded_demo_dirs":90},"status":"keep","description":"local enumerate demo workload before CI changes","timestamp":1777082359178,"segment":231,"confidence":null,"iterationTokens":559,"asi":{"hypothesis":"Before changing CI for >20m llgo demo jobs, locally enumerate the workload to ensure any split/parallel plan preserves the same demo directories rather than reducing coverage.","result":"Local enumeration found 86 host demo cases and 90 embedded demo directories; this is preparatory validation only, not a speed claim."}}
{"type":"config","name":"Monitor revert run while planning local validations","metricName":"pr_check_failures","metricUnit":"","bestDirection":"lower"}
{"run":417,"commit":"8210c72","metric":0,"metrics":{"pending_checks":18},"status":"keep","description":"monitor revert run while planning local validations","timestamp":1777082393890,"segment":232,"confidence":null,"iterationTokens":244,"asi":{"hypothesis":"Ensure the revert run remains failure-free while planning only locally validated changes for >20m jobs.","result":"No failed checks observed; 18 checks remain pending."}}
{"type":"config","name":"Local timing of macOS Go coverage and emulator commands","metricName":"local_go_combined_seconds","metricUnit":"s","bestDirection":"lower"}
{"run":418,"commit":"8210c72","metric":0,"metrics":{"local_go_coverage_seconds":0,"local_go_emulator_seconds":0},"status":"crash","description":"local combined Go coverage/emulator timing failed on local QEMU esp32 support","timestamp":1777082918947,"segment":233,"confidence":null,"iterationTokens":261,"asi":{"hypothesis":"Locally time the macOS Go coverage and embedded emulator commands before considering any CI split or optimization for the >20m Go job.","error":"Local run failed in cl embedded emulator path: qemu-system-xtensa does not support machine type esp32 in this environment.","rollback_reason":"No code changes; local validation environment lacks required QEMU support for this timing workload.","next_action_hint":"Use local validation for non-emulator structural changes only, or install matching embed deps/QEMU locally before timing emulator optimizations. Do not submit CI changes based on this failed local timing."}}
{"type":"config","name":"Local coverage-only timing for >20m Go job","metricName":"local_go_coverage_seconds","metricUnit":"s","bestDirection":"lower"}
