{"run":779,"commit":"df5f7aa","metric":10430.6,"metrics":{"go_build_min_ms":10360.2,"go_build_max_ms":10588.6,"runs":3},"status":"keep","description":"check clean go build after removing fmt from CompileGroup","timestamp":1777199016963,"segment":347,"confidence":null,"iterationTokens":399,"asi":{"hypothesis":"Removing fmt from internal/crosscompile/compile should not regress clean cmd/llgo Go builds and may slightly reduce frontend work in the CompileGroup package.","result":"Median clean go build -a -tags=dev ./cmd/llgo was 10430.6ms over 3 runs (min 10360.2ms, max 10588.6ms), within recent noise and below the noisy archive-name baseline."}}
{"type":"config","name":"Pre-push local validation after CompileGroup fmt removal","metricName":"validation_failures","metricUnit":"","bestDirection":"lower"}
{"run":780,"commit":"bf00dc6","metric":0,"metrics":{"crosscompile_packages_tested":4,"cmd_llgo_build":1,"ideas_updated":1},"status":"keep","description":"local validation before pushing CompileGroup fmt removal","timestamp":1777199072261,"segment":348,"confidence":null,"iterationTokens":220,"asi":{"hypothesis":"Before pushing CompileGroup fmt-removal changes, run relevant crosscompile tests, a dev llgo build, and update notes per user request.","result":"go test ./internal/crosscompile/... passed, go build -tags=dev ./cmd/llgo passed, and ideas backlog records the small external-compile improvement."}}
{"type":"config","name":"Monitor PR after locally validated CompileGroup fmt removal push","metricName":"pr_check_failures","metricUnit":"","bestDirection":"lower"}
{"run":781,"commit":"bd1cc9b","metric":0,"metrics":{"pending_checks":11,"passed_checks":0,"skipped_checks":0},"status":"keep","description":"monitor PR after CompileGroup fmt removal push","timestamp":1777199110605,"segment":349,"confidence":null,"iterationTokens":385,"asi":{"hypothesis":"After local validation and push, CompileGroup fmt-removal changes should not show immediate CI failures.","result":"No failed PR checks immediately after push; 11 checks pending."}}
{"type":"config","name":"Monitor PR after CompileGroup fmt removal CI progresses","metricName":"pr_check_failures","metricUnit":"","bestDirection":"lower"}
{"run":782,"commit":"70f930a","metric":0,"metrics":{"pending_checks":45,"passed_checks":3,"skipped_checks":0},"status":"keep","description":"monitor PR while CompileGroup fmt removal CI progresses","timestamp":1777199144674,"segment":350,"confidence":null,"iterationTokens":384,"asi":{"hypothesis":"The latest locally validated CompileGroup fmt-removal push should continue to show no CI failures as checks start running.","result":"No failed PR checks; 3 passed and 45 pending."}}
{"type":"config","name":"Monitor PR after more CI progress","metricName":"pr_check_failures","metricUnit":"","bestDirection":"lower"}
{"run":783,"commit":"3600cc6","metric":0,"metrics":{"pending_checks":53,"passed_checks":4,"skipped_checks":0},"status":"keep","description":"monitor PR after more CI progress","timestamp":1777199172615,"segment":351,"confidence":null,"iterationTokens":381,"asi":{"hypothesis":"CI should remain failure-free as checks progress after latest pushed compile cleanup.","result":"No failed PR checks; 4 passed and 53 pending. Pending count fluctuates as GitHub reports multiple workflow check suites."}}
{"type":"config","name":"Optimize llgo generated version command dependencies","metricName":"go_build_ms","metricUnit":"ms","bestDirection":"lower"}
{"run":784,"commit":"e758764","metric":10648.8,"metrics":{"go_build_min_ms":10422,"go_build_max_ms":10699.8,"runs":3},"status":"keep","description":"baseline go build before generated version dependency change","timestamp":1777199332411,"segment":352,"confidence":null,"iterationTokens":397,"asi":{"hypothesis":"The generated llgo version command imports fmt and qiniu/stringutil only to print a simple version line. Establish a fresh clean go build baseline before trying to replace it with direct os.Stdout string concatenation.","result":"Median clean go build -a -tags=dev ./cmd/llgo was 10648.8ms over 3 runs (min 10422.0ms, max 10699.8ms)."}}
{"run":785,"commit":"e758764","metric":10900.7,"metrics":{"go_build_min_ms":10605.4,"go_build_max_ms":10994.3,"runs":3,"version_smoke_tests":1},"status":"discard","description":"remove fmt/stringutil from generated llgo version command","timestamp":1777199405474,"segment":352,"confidence":null,"iterationTokens":1207,"asi":{"hypothesis":"Replacing generated fmt.Println(stringutil.Concat(...)) version output with os.Stdout.WriteString string concatenation could remove qiniu/stringutil from cmd/llgo and improve clean go build while preserving output.","result":"Command tests and version smoke passed, but clean go build median regressed from 10648.8ms to 10900.7ms. The change also edits generated code, increasing maintenance risk.","rollback_reason":"Primary metric worsened and generated-file churn is not justified.","next_action_hint":"Do not pursue targeted generated version output changes unless regenerated from source and a repeatable build-time win appears."}}
{"type":"config","name":"Monitor PR for latest pushed fmt-removal checks","metricName":"pr_check_failures","metricUnit":"","bestDirection":"lower"}
{"run":786,"commit":"4a08368","metric":0,"metrics":{"pending_checks":42,"passed_checks":15,"skipped_checks":0},"status":"keep","description":"monitor PR for latest pushed fmt-removal checks","timestamp":1777199433054,"segment":353,"confidence":null,"iterationTokens":384,"asi":{"hypothesis":"The latest pushed and locally validated fmt-removal changes should remain CI-failure-free while checks progress.","result":"No failed PR checks; 15 passed and 42 pending."}}
{"type":"config","name":"Benchmark plan9asm manual signature map caching isolated","metricName":"plan9asm_translate_ms","metricUnit":"ms","bestDirection":"lower"}
{"run":787,"commit":"c4cb733","metric":5.651,"metrics":{"plan9asm_bench_runs":5,"plan9asm_translate_min_ms":5.552,"plan9asm_translate_max_ms":5.821},"status":"keep","description":"baseline isolated plan9asm bytealg translation benchmark","timestamp":1777199477050,"segment":354,"confidence":null,"iterationTokens":870,"asi":{"hypothesis":"A temporary in-package benchmark that loads internal/bytealg once and times only repeated plan9asm translations can isolate whether caching manual signature maps is useful, avoiding the noisy go test wall-time measurement that included recompilation.","result":"Baseline median was 5.651ms/op across 5 benchmark runs (min 5.552ms, max 5.821ms)."}}
{"run":788,"commit":"c4cb733","metric":5.802,"metrics":{"plan9asm_bench_runs":5,"plan9asm_translate_min_ms":5.483,"plan9asm_translate_max_ms":6.447},"status":"discard","description":"cache plan9asm manual signature map per translation with isolated benchmark","timestamp":1777199504610,"segment":354,"confidence":null,"iterationTokens":1709,"asi":{"hypothesis":"Caching extraAsmSigsAndDeclMap once per translation should avoid rebuilding the map on every ManualSig callback and improve asm-heavy translation when measured with an isolated benchmark.","result":"Temporary isolated benchmark passed but median regressed from 5.651ms/op to 5.802ms/op; min improved slightly but max worsened, so no repeatable primary improvement.","rollback_reason":"Primary metric worsened even with a better isolated benchmark.","next_action_hint":"Do not revisit manual signature map caching unless allocation profiles show this function is material; current translation cost is dominated elsewhere."}}
{"type":"config","name":"Record rejected plan9asm signature cache after isolated benchmark","metricName":"validation_failures","metricUnit":"","bestDirection":"lower"}
{"run":789,"commit":"3358a74","metric":0,"metrics":{"ideas_updated":1},"status":"keep","description":"record rejected plan9asm signature cache in ideas","timestamp":1777199531235,"segment":355,"confidence":null,"iterationTokens":183,"asi":{"hypothesis":"After an isolated benchmark also rejected manual signature map caching, update the ideas backlog to prevent revisiting it without allocation evidence.","result":"Ideas backlog now marks extraAsmSigsAndDeclMap caching as rejected with both wall-time and isolated benchmark results."}}
{"type":"config","name":"Monitor PR after plan9asm local-only experiments","metricName":"pr_check_failures","metricUnit":"","bestDirection":"lower"}
{"run":790,"commit":"892a279","metric":0,"metrics":{"pending_checks":37,"passed_checks":20,"skipped_checks":0},"status":"keep","description":"monitor PR after plan9asm local-only experiments","timestamp":1777199559064,"segment":356,"confidence":null,"iterationTokens":384,"asi":{"hypothesis":"Local-only plan9asm experiments were reverted, so pushed CI state should continue to progress without failures from the latest validated fmt-removal push.","result":"No failed PR checks; 20 passed and 37 pending."}}
{"type":"config","name":"Monitor PR as latest CI continues","metricName":"pr_check_failures","metricUnit":"","bestDirection":"lower"}
{"run":791,"commit":"76ee6b3","metric":0,"metrics":{"pending_checks":35,"passed_checks":22,"skipped_checks":0},"status":"keep","description":"monitor PR as latest CI continues","timestamp":1777199601759,"segment":357,"confidence":null,"iterationTokens":381,"asi":{"hypothesis":"CI should continue progressing without failures after the latest locally validated compile-performance push.","result":"No failed PR checks; 22 passed and 35 pending."}}
{"type":"config","name":"Monitor PR nearing completion after compile perf push","metricName":"pr_check_failures","metricUnit":"","bestDirection":"lower"}
{"run":792,"commit":"fbdfe5a","metric":0,"metrics":{"pending_checks":35,"passed_checks":26,"skipped_checks":0},"status":"keep","description":"monitor PR nearing completion after compile perf push","timestamp":1777199640176,"segment":358,"confidence":null,"iterationTokens":383,"asi":{"hypothesis":"CI should remain failure-free as more checks finish after latest compile-performance changes.","result":"No failed PR checks; 26 passed and 35 pending."}}
{"type":"config","name":"Confirm current clean go build performance","metricName":"go_build_ms","metricUnit":"ms","bestDirection":"lower"}
{"run":793,"commit":"11b7148","metric":10744.5,"metrics":{"go_build_min_ms":10587.9,"go_build_max_ms":10891.8,"runs":5},"status":"keep","description":"confirm current clean go build performance","timestamp":1777199733138,"segment":359,"confidence":null,"iterationTokens":396,"asi":{"hypothesis":"After several small external-compile cleanups, capture a current 5-run clean go build sample to monitor overall state against the original 10594.3ms baseline and recent noisy samples.","result":"5-run median was 10744.5ms (min 10587.9ms, max 10891.8ms), showing this workload is currently noisy/slower than prior 10341-10430ms samples. Do not infer a regression from this single sample without paired A/B because source changes were already locally validated and external-compile microbenchmarks improved."}}
{"type":"config","name":"Monitor PR after current go build confirmation","metricName":"pr_check_failures","metricUnit":"","bestDirection":"lower"}
{"run":794,"commit":"f98e8e9","metric":0,"metrics":{"pending_checks":29,"passed_checks":32,"skipped_checks":0},"status":"keep","description":"monitor PR after current go build confirmation","timestamp":1777199759177,"segment":360,"confidence":null,"iterationTokens":382,"asi":{"hypothesis":"Latest pushed compile-performance changes should continue to pass CI while local-only benchmark confirmations do not affect code.","result":"No failed PR checks; 32 passed and 29 pending."}}
{"type":"config","name":"Specialize single-group CompileConfig worker path","metricName":"compile_group_ms","metricUnit":"ms","bestDirection":"lower"}
{"run":795,"commit":"53aa0d4","metric":225.5,"metrics":{"compile_group_files":128},"status":"keep","description":"baseline single-group CompileConfig worker path","timestamp":1777199885119,"segment":361,"confidence":null,"iterationTokens":545,"asi":{"hypothesis":"CompileGroup.Compile now routes through CompileConfig.Compile and pays a per-task group-map lookup in the parallel worker path. Establish a 128-file single-group baseline before specializing that common path.","result":"Current 128-file single-group CompileGroup benchmark completed in 225.5ms."}}
{"run":796,"commit":"699c177","metric":208.8,"metrics":{"compile_group_files":128},"status":"keep","description":"specialize parallel CompileGroup single-group workers","timestamp":1777199917495,"segment":361,"confidence":null,"iterationTokens":2202,"asi":{"hypothesis":"Avoid the per-task group map lookup in the common CompileGroup.Compile path by detecting when all queued tasks belong to one group and using a simpler worker loop with one clang.Cmd per worker.","result":"compile package tests passed. 128-file single-group benchmark improved from 225.5ms to 208.8ms."}}
{"run":797,"commit":"d05473d","metric":213.4,"metrics":{"compile_group_files":128,"runs":3},"status":"keep","description":"confirm single-group worker specialization benchmark","timestamp":1777199938237,"segment":361,"confidence":3.6304347826086976,"iterationTokens":1101,"asi":{"hypothesis":"Repeat the 128-file single-group benchmark after specialization to reduce chance of keeping a one-off timing outlier.","result":"3-run median was 213.4ms (runs 214.8, 210.7, 213.4), still below the 225.5ms baseline."}}
{"type":"config","name":"Validate single-group CompileGroup specialization","metricName":"validation_failures","metricUnit":"","bestDirection":"lower"}
{"run":798,"commit":"af14131","metric":0,"metrics":{"crosscompile_packages_tested":4,"cmd_llgo_build":1,"ideas_updated":1},"status":"keep","description":"local validation for single-group CompileGroup specialization","timestamp":1777199996938,"segment":362,"confidence":null,"iterationTokens":240,"asi":{"hypothesis":"Before pushing the single-group worker specialization, run relevant crosscompile tests, sequential override tests, a dev llgo build, and update the ideas backlog per user request.","result":"go test ./internal/crosscompile/... passed, LLGO_COMPILE_JOBS=1 compile package tests passed, go build -tags=dev ./cmd/llgo passed, and ideas backlog was updated."}}
{"type":"config","name":"Remove accidentally tracked llgo binary","metricName":"tracked_llgo_bytes","metricUnit":"","bestDirection":"lower"}
{"run":799,"commit":"d99f6f0","metric":20125234,"metrics":{"tracked_llgo_present":1},"status":"keep","description":"baseline accidentally tracked llgo binary size","timestamp":1777200125857,"segment":363,"confidence":null,"iterationTokens":160,"asi":{"hypothesis":"The root llgo executable is accidentally tracked in the branch and should not be part of the PR. Establish its tracked size before removing it and ignoring future local build outputs.","result":"HEAD tracks llgo as a 20,125,234-byte executable."}}
{"run":800,"commit":"49e700b","metric":0,"metrics":{"tracked_llgo_present":0,"validation_failures":0,"cmd_llgo_build":1,"crosscompile_packages_tested":4},"status":"keep","description":"remove accidentally tracked llgo binary and ignore local output","timestamp":1777200196309,"segment":363,"confidence":null,"iterationTokens":1341,"asi":{"hypothesis":"Removing the committed root llgo executable and adding /llgo to .gitignore fixes the accidental binary submission without changing compiler behavior. Local validation should pass before pushing.","result":"Removed llgo from the index/tree, added /llgo to .gitignore, verified git ignores future root llgo build outputs, ran go test ./internal/crosscompile/... successfully, and built cmd/llgo to a temp path successfully.","local_validation":"go test ./internal/crosscompile/...; go build -o /tmp/llgo-local-check -tags=dev ./cmd/llgo","next_action_hint":"Push this cleanup only after confirming no other source changes are pending; future local builds should use -o temp or rely on /llgo ignore to avoid re-adding the binary."}}
{"type":"config","name":"Monitor PR after removing accidental llgo binary","metricName":"pr_check_failures","metricUnit":"","bestDirection":"lower"}
{"run":801,"commit":"9e2700f","metric":0,"metrics":{"pending_checks":11,"passed_checks":0,"skipped_checks":0},"status":"keep","description":"monitor PR after removing accidental llgo binary","timestamp":1777200238186,"segment":364,"confidence":null,"iterationTokens":383,"asi":{"hypothesis":"After local validation and pushing the binary cleanup, PR checks should not show immediate failures. This is CI health monitoring after a necessary cleanup, not a first-pass experiment.","result":"No failed PR checks immediately after push; 11 checks pending."}}
{"type":"config","name":"Direct single-group CompileGroup path","metricName":"compile_group_ms","metricUnit":"ms","bestDirection":"lower"}
{"run":802,"commit":"6883689","metric":216.1,"metrics":{"compile_group_files":128,"runs":3},"status":"keep","description":"baseline direct single-group CompileGroup path","timestamp":1777200283345,"segment":365,"confidence":null,"iterationTokens":591,"asi":{"hypothesis":"After fixing the accidental binary, establish a fresh 128-file single-group CompileGroup baseline before trying to avoid the CompileConfig task slice/state overhead for single-group calls.","result":"3-run median was 216.1ms (runs 228.9, 215.8, 216.1)."}}
{"run":803,"commit":"6883689","metric":220,"metrics":{"compile_group_files":128,"runs":3},"status":"discard","description":"direct CompileGroup path avoiding CompileConfig task slice","timestamp":1777200313986,"segment":365,"confidence":null,"iterationTokens":1980,"asi":{"hypothesis":"Have CompileGroup.Compile and single-group CompileConfig.Compile use a direct helper that avoids constructing the multi-group task slice and state slice, improving the common single-group path.","result":"compile package tests passed, but 128-file benchmark median regressed from 216.1ms to 220.0ms (runs 210.3, 220.0, 232.1). The added branching/helper did not produce a repeatable win.","rollback_reason":"Primary metric worsened; keep the existing simpler specialization.","next_action_hint":"Do not pursue direct single-group CompileGroup factoring unless a larger workload shows task construction overhead is material."}}
{"type":"config","name":"Prune stale autoresearch ideas after binary cleanup","metricName":"validation_failures","metricUnit":"","bestDirection":"lower"}
{"run":804,"commit":"4cf0469","metric":0,"metrics":{"ideas_updated":1},"status":"keep","description":"prune stale ideas and record llgo binary guardrail","timestamp":1777200507191,"segment":366,"confidence":null,"iterationTokens":216,"asi":{"hypothesis":"The ideas backlog should reflect the current pure-compile target, archive stale CI-only work, record the accidental llgo binary guardrail, and mark the direct single-group refactor as rejected so the loop does not repeat it.","result":"Ideas backlog was condensed to current target, archived/out-of-scope CI notes, kept useful compile work, recorded /llgo guardrail, and noted the rejected 216.1ms-to-220.0ms direct single-group refactor."}}
{"type":"config","name":"Optimize CompileGroup error stop checks","metricName":"compile_group_ms","metricUnit":"ms","bestDirection":"lower"}
{"run":805,"commit":"0bd494e","metric":218.6,"metrics":{"compile_group_files":128,"runs":3},"status":"keep","description":"baseline CompileGroup error stop checks","timestamp":1777200547294,"segment":367,"confidence":null,"iterationTokens":591,"asi":{"hypothesis":"The no-error worker scheduling hot path locks a mutex before sending each task just to check whether an error was seen. Establish a 128-file baseline before switching this check to an atomic flag.","result":"3-run median was 218.6ms (runs 237.9, 218.6, 214.3)."}}
{"run":806,"commit":"0bd494e","metric":221.9,"metrics":{"compile_group_files":128,"runs":3},"status":"discard","description":"use atomic stopped flag for CompileGroup worker errors","timestamp":1777200584097,"segment":367,"confidence":null,"iterationTokens":1849,"asi":{"hypothesis":"Replace the producer-side mutex check before each task send with an atomic.Bool stopped flag, keeping the mutex only for firstErr storage, to reduce no-error scheduling overhead.","result":"compile package tests passed, but 128-file benchmark regressed from 218.6ms to 221.9ms; atomic loads did not improve over the mutex pattern in this subprocess-dominated workload.","rollback_reason":"Primary metric worsened; keep existing mutex-based stop check.","next_action_hint":"Do not revisit worker stop-check micro-optimization unless scheduler overhead dominates in a much smaller/no-op task benchmark."}}
{"type":"config","name":"Verify PR after accidental binary removal","metricName":"pr_check_failures","metricUnit":"","bestDirection":"lower"}
{"run":807,"commit":"e5142fb","metric":0,"metrics":{"pending_checks":38,"passed_checks":19,"skipped_checks":0,"llgo_in_pr_diff":0},"status":"keep","description":"verify PR after accidental binary removal","timestamp":1777200623587,"segment":368,"confidence":null,"iterationTokens":473,"asi":{"hypothesis":"The cleanup push should remove the accidental root llgo binary from the PR diff and keep CI failure-free while checks progress.","result":"gh pr diff no longer lists llgo; no failed PR checks, 19 passed and 38 pending."}}
{"type":"config","name":"Parallelize CompileConfig archive creation","metricName":"compile_config_ms","metricUnit":"ms","bestDirection":"lower"}
