{"run":591,"commit":"16ecea6","metric":1,"metrics":{"macos_go_total_seconds":1256,"macos_go_coverage_seconds":665,"macos_go_emulator_seconds":491},"status":"keep","description":"baseline remaining macOS Go workflow combines coverage and emulator","timestamp":1777119665192,"segment":281,"confidence":null,"iterationTokens":362,"asi":{"hypothesis":"The latest complete PR run still has one >20m macOS Go job because coverage and embedded-emulator tests run sequentially in one job. Step timings show each component is independently under 15m, so a coverage-preserving job split should eliminate the >20m job.","result":"test (macos-latest, 19) took 1256s (~20m56s): coverage 665s (~11m05s), embedded emulator 491s (~8m11s)."}}
{"run":592,"commit":"f99f4dd","metric":0,"metrics":{"macos_go_total_seconds":665,"macos_go_coverage_seconds":665,"macos_go_emulator_seconds":491,"split_macos_emulator_jobs":1,"preserved_macos_coverage_step":1},"status":"keep","description":"split remaining macOS Go coverage and embedded emulator job","timestamp":1777119691083,"segment":281,"confidence":null,"iterationTokens":1486,"asi":{"hypothesis":"Move only the macOS embedded-emulator step into a separate job while keeping the original macOS test check as coverage-only. Latest CI step timings show both resulting jobs should be below 15m, and the strengthened QEMU retry budget addresses the previous early failure mode.","result":"go.yml parses. The original test matrix keeps macOS coverage, macOS emulator is skipped there, and one dedicated macOS emulator job is added. Predicted longest resulting macOS Go job is the 665s coverage step from the latest CI run."}}
{"type":"config","name":"Validate workflows after macOS Go split","metricName":"workflow_validation_failures","metricUnit":"","bestDirection":"lower"}
{"run":593,"commit":"c652a21","metric":0,"metrics":{"workflow_files_checked":9,"action_files_checked":5,"shell_scripts_checked":4},"status":"keep","description":"validate workflows after macOS Go split","timestamp":1777119711284,"segment":282,"confidence":null,"iterationTokens":403,"asi":{"hypothesis":"Before pushing the macOS Go coverage/emulator split, validate workflow/action YAML, edited shell scripts, and structural assertions that macOS coverage remains in the original test job while macOS emulator moves to its own job.","result":"All workflow/action YAML parsed; relevant shell scripts passed bash -n; go.yml contains the dedicated macOS emulator job, skips emulator in the macOS test matrix, and preserves the macOS coverage command."}}
{"type":"config","name":"Monitor PR after macOS Go split push","metricName":"pr_check_failures","metricUnit":"","bestDirection":"lower"}
{"run":594,"commit":"2476d89","metric":0,"metrics":{"pending_checks":45},"status":"keep","description":"monitor PR immediately after macOS Go split push","timestamp":1777119741274,"segment":283,"confidence":null,"iterationTokens":241,"asi":{"hypothesis":"After pushing the validated macOS Go coverage/emulator split, the new run should start without immediate failures and include the dedicated macOS emulator check.","result":"No failed checks observed; 45 checks pending, including test-embed-emulator-macos (19)."}}
{"run":595,"commit":"5c82cad","metric":0,"metrics":{"pending_checks":41,"macos_go_split_completed_jobs":0,"macos_go_split_over15_jobs":0,"macos_go_split_max_seconds":0},"status":"keep","description":"monitor macOS Go split run after workflow fan-out","timestamp":1777120053104,"segment":283,"confidence":null,"iterationTokens":1140,"asi":{"hypothesis":"After workflow fan-out, the macOS Go split run should remain failure-free while coverage and emulator jobs run separately.","result":"No failed checks observed; 41 checks pending. The two macOS Go split jobs are still pending."}}
{"run":596,"commit":"4256aae","metric":0,"metrics":{"pending_checks":31,"macos_go_split_completed_jobs":1,"macos_go_split_over15_jobs":0,"macos_go_split_max_seconds":518},"status":"keep","description":"monitor macOS Go split with emulator job completed","timestamp":1777120365935,"segment":283,"confidence":null,"iterationTokens":1256,"asi":{"hypothesis":"The dedicated macOS emulator job should complete under 15m based on latest combined-step timing.","result":"No failed checks observed; 31 checks pending. One of the two macOS Go split jobs completed under 15m at 518s."}}
{"run":597,"commit":"00a86d7","metric":0,"metrics":{"pending_checks":27,"macos_go_split_completed_jobs":2,"macos_go_split_over15_jobs":0,"macos_go_split_max_seconds":759,"split_macos_intel_over15_jobs":0,"split_macos_intel_completed_jobs":1,"split_macos_intel_max_seconds":525},"status":"keep","description":"monitor macOS Go split with both split jobs completed under 15m","timestamp":1777120682637,"segment":283,"confidence":null,"iterationTokens":1490,"asi":{"hypothesis":"Both macOS Go split jobs should complete under 15m, eliminating the former 20m56s combined job without reducing coverage.","result":"No failed checks observed; 27 checks pending. Both macOS Go split jobs completed under 15m; max 759s (~12m39s). MacOS Intel split jobs have one completed under 15m so far."}}
{"run":598,"commit":"340487c","metric":0,"metrics":{"pending_checks":22,"macos_go_split_completed_jobs":2,"macos_go_split_over15_jobs":0,"macos_go_split_max_seconds":759,"split_macos_intel_over15_jobs":0,"split_macos_intel_completed_jobs":4,"split_macos_intel_max_seconds":528,"all_completed_over15_jobs":1},"status":"keep","description":"monitor macOS Go split with 22 checks pending","timestamp":1777120998244,"segment":283,"confidence":null,"iterationTokens":1752,"asi":{"hypothesis":"Continue monitoring full PR after macOS Go split; no failures should appear and split jobs should stay below 15m.","result":"No failed checks observed; 22 checks pending. Both macOS Go split jobs completed under 15m, max 759s. Four macOS Intel split jobs completed under 15m."}}
{"run":599,"commit":"d32dbe7","metric":0,"metrics":{"pending_checks":19,"macos_go_split_completed_jobs":2,"macos_go_split_over15_jobs":0,"macos_go_split_max_seconds":759,"split_macos_intel_over15_jobs":0,"split_macos_intel_completed_jobs":7,"split_macos_intel_max_seconds":595,"all_completed_over15_jobs":1},"status":"keep","description":"monitor macOS Go split with 19 checks pending","timestamp":1777121311896,"segment":283,"confidence":null,"iterationTokens":1753,"asi":{"hypothesis":"Continue monitoring full PR after macOS Go split; no failures should appear while remaining macOS jobs complete.","result":"No failed checks observed; 19 checks pending. Both macOS Go split jobs remain under 15m. Seven macOS Intel split jobs completed under 15m."}}
{"run":600,"commit":"bfc28cb","metric":0,"metrics":{"pending_checks":16,"macos_go_split_completed_jobs":2,"macos_go_split_over15_jobs":0,"macos_go_split_max_seconds":759,"split_macos_intel_over15_jobs":0,"split_macos_intel_completed_jobs":9,"split_macos_intel_max_seconds":595,"all_completed_over15_jobs":1},"status":"keep","description":"monitor macOS Go split with 16 checks pending","timestamp":1777121628741,"segment":283,"confidence":null,"iterationTokens":1787,"asi":{"hypothesis":"Continue monitoring full PR after macOS Go split; no failures should appear and all targeted split jobs should remain under 15m.","result":"No failed checks observed; 16 checks pending. Both macOS Go split jobs completed under 15m. Nine macOS Intel split jobs completed under 15m."}}
{"run":601,"commit":"5e88483","metric":0,"metrics":{"pending_checks":13,"macos_go_split_completed_jobs":2,"macos_go_split_over15_jobs":0,"macos_go_split_max_seconds":759,"split_macos_intel_over15_jobs":0,"split_macos_intel_completed_jobs":11,"split_macos_intel_max_seconds":595,"all_completed_over15_jobs":1},"status":"keep","description":"monitor macOS Go split with 13 checks pending","timestamp":1777121942109,"segment":283,"confidence":null,"iterationTokens":1776,"asi":{"hypothesis":"Continue monitoring full PR after macOS Go split; targeted macOS split jobs should remain under 15m as pending jobs complete.","result":"No failed checks observed; 13 checks pending. Both macOS Go split jobs completed under 15m. Eleven macOS Intel split jobs completed under 15m."}}
{"run":602,"commit":"63f02ba","metric":0,"metrics":{"pending_checks":10,"macos_go_split_completed_jobs":2,"macos_go_split_over15_jobs":0,"macos_go_split_max_seconds":759,"split_macos_intel_over15_jobs":0,"split_macos_intel_completed_jobs":13,"split_macos_intel_max_seconds":595,"all_completed_over15_jobs":1},"status":"keep","description":"monitor macOS Go split with 10 checks pending","timestamp":1777122260320,"segment":283,"confidence":null,"iterationTokens":1788,"asi":{"hypothesis":"Continue monitoring full PR after macOS Go split; no failures should appear while remaining macOS jobs finish.","result":"No failed checks observed; 10 checks pending. Both macOS Go split jobs are under 15m. Thirteen macOS Intel split jobs completed under 15m."}}
{"run":603,"commit":"aaab7b5","metric":0,"metrics":{"pending_checks":7,"macos_go_split_completed_jobs":2,"macos_go_split_over15_jobs":0,"macos_go_split_max_seconds":759,"split_macos_intel_over15_jobs":0,"split_macos_intel_completed_jobs":16,"split_macos_intel_max_seconds":733,"all_completed_over15_jobs":1},"status":"keep","description":"monitor macOS Go split with seven checks pending","timestamp":1777122578509,"segment":283,"confidence":null,"iterationTokens":1777,"asi":{"hypothesis":"Continue monitoring full PR after macOS Go split; the last macOS Intel split jobs should remain below 15m.","result":"No failed checks observed; 7 checks pending. Both macOS Go split jobs are under 15m. Sixteen macOS Intel split jobs completed under 15m, max 733s."}}
{"run":604,"commit":"b118e0f","metric":0,"metrics":{"pending_checks":5,"macos_go_split_completed_jobs":2,"macos_go_split_over15_jobs":0,"macos_go_split_max_seconds":759,"split_macos_intel_over15_jobs":0,"split_macos_intel_completed_jobs":17,"split_macos_intel_max_seconds":733,"all_completed_over15_jobs":1},"status":"keep","description":"monitor macOS Go split with five checks pending","timestamp":1777122892468,"segment":283,"confidence":null,"iterationTokens":1684,"asi":{"hypothesis":"Continue monitoring full PR after macOS Go split; no failures should appear while the final pending macOS jobs finish.","result":"No failed checks observed; 5 checks pending. Both macOS Go split jobs are under 15m. Seventeen macOS Intel split jobs completed under 15m."}}
{"run":605,"commit":"9b62545","metric":0,"metrics":{"pending_checks":1,"macos_go_split_completed_jobs":2,"macos_go_split_over15_jobs":0,"macos_go_split_max_seconds":759,"split_macos_intel_over15_jobs":0,"split_macos_intel_completed_jobs":20,"split_macos_intel_max_seconds":786,"all_completed_over15_jobs":1},"status":"keep","description":"monitor macOS Go split with one check pending","timestamp":1777123208743,"segment":283,"confidence":null,"iterationTokens":1603,"asi":{"hypothesis":"Continue monitoring full PR after macOS Go split; final pending check should complete without failures while targeted jobs remain under 15m.","result":"No failed checks observed; 1 check pending. Both macOS Go split jobs completed under 15m. All 20 macOS Intel split jobs completed under 15m, max 786s."}}
{"run":606,"commit":"a3eedf2","metric":0,"metrics":{"pending_checks":0,"macos_go_split_completed_jobs":2,"macos_go_split_over15_jobs":0,"macos_go_split_max_seconds":759,"split_macos_intel_over15_jobs":0,"split_macos_intel_completed_jobs":20,"split_macos_intel_max_seconds":786,"all_completed_over15_jobs":1},"status":"keep","description":"monitor macOS Go split run completed without failures","timestamp":1777123524231,"segment":283,"confidence":null,"iterationTokens":1480,"asi":{"hypothesis":"The full PR run after the macOS Go split should complete without failures, with both new macOS Go jobs below 15m and all macOS Intel split jobs below 15m.","result":"Full PR run completed with zero failures and zero pending checks. Both macOS Go split jobs completed under 15m, max 759s (~12m39s). All 20 macOS Intel split jobs completed under 15m, max 786s (~13m06s). One unrelated completed job remains over 15m."}}
{"type":"config","name":"Split remaining Ubuntu Go test/emulator >15m job","metricName":"go_workflow_over15_jobs","metricUnit":"","bestDirection":"lower"}
{"run":607,"commit":"f35bc16","metric":1,"metrics":{"ubuntu_go_total_seconds":1091,"ubuntu_go_test_seconds":580,"ubuntu_go_emulator_seconds":473},"status":"keep","description":"baseline Ubuntu Go workflow combines go test and emulator","timestamp":1777123570937,"segment":284,"confidence":null,"iterationTokens":350,"asi":{"hypothesis":"After splitting macOS Go coverage/emulator, the only remaining completed >15m job is Ubuntu Go workflow because regular go test and embedded emulator still run sequentially in one job. Each step is independently under 15m, so a coverage-preserving split should eliminate the over-15 job.","result":"test (ubuntu-latest, 19) took 1091s (~18m11s): go test 580s (~9m40s), embedded emulator 473s (~7m53s)."}}
{"run":608,"commit":"1e1e02e","metric":0,"metrics":{"ubuntu_go_total_seconds":580,"ubuntu_go_test_seconds":580,"ubuntu_go_emulator_seconds":473,"split_ubuntu_emulator_jobs":1},"status":"keep","description":"split Ubuntu Go test and embedded emulator job","timestamp":1777123596294,"segment":284,"confidence":null,"iterationTokens":2201,"asi":{"hypothesis":"Move the Ubuntu embedded-emulator step into its own job, preserving regular go test in the original test (ubuntu-latest, 19) check and preserving emulator coverage in a dedicated check. Latest CI step timings predict both resulting jobs under 15m.","result":"go.yml parses. The original Go test matrix no longer contains LLGO_EMBED_TESTS, and dedicated macOS/Ubuntu emulator jobs exist. Predicted longest Ubuntu Go workflow job is the 580s regular go test step from latest CI."}}
{"type":"config","name":"Validate workflows after Ubuntu Go split","metricName":"workflow_validation_failures","metricUnit":"","bestDirection":"lower"}
{"run":609,"commit":"ce2afd1","metric":0,"metrics":{"workflow_files_checked":9,"action_files_checked":5,"shell_scripts_checked":4},"status":"keep","description":"validate workflows after Ubuntu Go split","timestamp":1777123616440,"segment":285,"confidence":null,"iterationTokens":427,"asi":{"hypothesis":"Before pushing the Ubuntu Go test/emulator split, validate workflow/action YAML, relevant shell scripts, and go.yml structural assertions for dedicated OS emulator jobs and no embedded emulator in the main Go test matrix.","result":"All workflow/action YAML parsed; relevant shell scripts passed bash -n; go.yml has exactly two dedicated embedded emulator commands and no LLGO_EMBED_TESTS in the main test matrix."}}
{"type":"config","name":"Monitor PR after Ubuntu Go split push","metricName":"pr_check_failures","metricUnit":"","bestDirection":"lower"}
{"run":610,"commit":"88d9d22","metric":0,"metrics":{"pending_checks":46},"status":"keep","description":"monitor PR immediately after Ubuntu Go split push","timestamp":1777123638022,"segment":286,"confidence":null,"iterationTokens":240,"asi":{"hypothesis":"After pushing the Ubuntu Go test/emulator split, the new run should start without immediate failures and include dedicated macOS and Ubuntu emulator checks.","result":"No failed checks observed; 46 checks pending, including test-embed-emulator-macos and test-embed-emulator-ubuntu."}}
{"run":611,"commit":"17263e0","metric":0,"metrics":{"pending_checks":42,"go_split_completed_jobs":0,"go_split_over15_jobs":0,"go_split_max_seconds":0,"split_macos_intel_over15_jobs":0,"split_macos_intel_completed_jobs":0,"split_macos_intel_max_seconds":0,"all_completed_over15_jobs":0},"status":"keep","description":"monitor Ubuntu Go split run after workflow fan-out","timestamp":1777123952389,"segment":286,"confidence":null,"iterationTokens":1387,"asi":{"hypothesis":"After workflow fan-out, the Ubuntu Go split run should remain failure-free while the four Go workflow split jobs run separately.","result":"No failed checks observed; 42 checks pending. Go split jobs are still pending."}}
{"run":612,"commit":"7dcaaeb","metric":0,"metrics":{"pending_checks":33,"go_split_completed_jobs":2,"go_split_over15_jobs":0,"go_split_max_seconds":586,"split_macos_intel_over15_jobs":0,"split_macos_intel_completed_jobs":1,"split_macos_intel_max_seconds":377,"all_completed_over15_jobs":0},"status":"keep","description":"monitor Ubuntu Go split with two Go split jobs completed","timestamp":1777124270905,"segment":286,"confidence":null,"iterationTokens":1639,"asi":{"hypothesis":"The separated Go workflow jobs should complete under 15m and remain failure-free.","result":"No failed checks observed; 33 checks pending. Two Go split jobs completed under 15m, max 586s. One macOS Intel split job completed under 15m."}}
{"run":613,"commit":"f331269","metric":0,"metrics":{"pending_checks":27,"go_split_completed_jobs":4,"go_split_over15_jobs":0,"go_split_max_seconds":664,"split_macos_intel_over15_jobs":0,"split_macos_intel_completed_jobs":2,"split_macos_intel_max_seconds":580,"all_completed_over15_jobs":0},"status":"keep","description":"monitor Ubuntu Go split with all Go split jobs completed","timestamp":1777124586049,"segment":286,"confidence":null,"iterationTokens":1719,"asi":{"hypothesis":"All four Go workflow split jobs should complete under 15m, eliminating the former Ubuntu over-15 combined job as well as the macOS over-20 combined job.","result":"No failed checks observed; 27 checks pending. All four Go workflow split jobs completed under 15m; max 664s (~11m04s). No completed job is over 15m yet."}}
{"run":614,"commit":"94b096e","metric":0,"metrics":{"pending_checks":23,"go_split_completed_jobs":4,"go_split_over15_jobs":0,"go_split_max_seconds":664,"split_macos_intel_over15_jobs":0,"split_macos_intel_completed_jobs":3,"split_macos_intel_max_seconds":624,"all_completed_over15_jobs":0},"status":"keep","description":"monitor Ubuntu Go split with 23 checks pending","timestamp":1777124907769,"segment":286,"confidence":null,"iterationTokens":1793,"asi":{"hypothesis":"Continue monitoring full PR after Ubuntu Go split; no over-15 completed jobs should appear while remaining macOS jobs finish.","result":"No failed checks observed; 23 checks pending. All four Go workflow split jobs completed under 15m, max 664s. Three macOS Intel split jobs completed under 15m."}}
{"run":615,"commit":"97076e3","metric":0,"metrics":{"pending_checks":20,"go_split_completed_jobs":4,"go_split_over15_jobs":0,"go_split_max_seconds":664,"split_macos_intel_over15_jobs":0,"split_macos_intel_completed_jobs":5,"split_macos_intel_max_seconds":624,"all_completed_over15_jobs":0},"status":"keep","description":"monitor Ubuntu Go split with 20 checks pending","timestamp":1777125248428,"segment":286,"confidence":null,"iterationTokens":1753,"asi":{"hypothesis":"Continue monitoring full PR after Ubuntu Go split; no failures or over-15 completed jobs should appear.","result":"No failed checks observed; 20 checks pending. All four Go workflow split jobs and five macOS Intel split jobs completed under 15m."}}
{"run":616,"commit":"a01e521","metric":0,"metrics":{"pending_checks":17,"go_split_completed_jobs":4,"go_split_over15_jobs":0,"go_split_max_seconds":664,"split_macos_intel_over15_jobs":0,"split_macos_intel_completed_jobs":7,"split_macos_intel_max_seconds":624,"all_completed_over15_jobs":0},"status":"keep","description":"monitor Ubuntu Go split with 17 checks pending","timestamp":1777125565510,"segment":286,"confidence":null,"iterationTokens":1758,"asi":{"hypothesis":"Finish current monitoring cycle before responding to user stop condition; if requirements are met for targeted jobs, stop further optimization.","result":"No failed checks observed; 17 checks pending. All four Go workflow split jobs completed under 15m, max 664s. Seven macOS Intel split jobs completed under 15m, max 624s. No completed job over 15m in this run so far."}}
{"run":617,"commit":"31749c8","metric":0,"metrics":{"pending_checks":17,"go_split_completed_jobs":4,"go_split_over15_jobs":0,"go_split_max_seconds":664,"split_macos_intel_over15_jobs":0,"split_macos_intel_completed_jobs":7,"split_macos_intel_max_seconds":624,"all_completed_over15_jobs":0},"status":"keep","description":"resume monitoring Ubuntu Go split with 17 checks pending","timestamp":1777125602993,"segment":286,"confidence":null,"iterationTokens":12133,"asi":{"hypothesis":"Resume after context-limit stop by reading ideas/logs and checking current PR state; targeted Go workflow split and macOS Intel split jobs should remain under 15m with no failures.","result":"No failed checks observed; 17 checks pending. All four Go workflow split jobs completed under 15m, max 664s. Seven macOS Intel split jobs completed under 15m. No completed jobs are over 15m."}}
{"run":618,"commit":"b6ceb4f","metric":0,"metrics":{"pending_checks":14,"go_split_completed_jobs":4,"go_split_over15_jobs":0,"go_split_max_seconds":664,"split_macos_intel_over15_jobs":0,"split_macos_intel_completed_jobs":9,"split_macos_intel_max_seconds":746,"all_completed_over15_jobs":0},"status":"keep","description":"monitor Ubuntu Go split with 14 checks pending","timestamp":1777125920690,"segment":286,"confidence":null,"iterationTokens":1777,"asi":{"hypothesis":"Continue monitoring resumed run; all completed jobs should remain under 15m while pending macOS jobs finish.","result":"No failed checks observed; 14 checks pending. All four Go workflow split jobs completed under 15m, max 664s. Nine macOS Intel split jobs completed under 15m, max 746s. No completed jobs over 15m."}}
