{"run":273,"commit":"807ca33","metric":0,"metrics":{"pending_checks":9},"status":"keep","description":"monitor PR checks before setup-deps consolidation push","timestamp":1777055803655,"segment":153,"confidence":null,"iterationTokens":172,"asi":{"hypothesis":"Before pushing setup-deps install consolidation, ensure current PR CI has no failures needing attention.","result":"No failed checks observed; 9 checks still pending in summary."}}
{"type":"config","name":"Monitor PR checks after setup-deps consolidation push","metricName":"pr_check_failures","metricUnit":"","bestDirection":"lower"}
{"run":274,"commit":"70f7ea3","metric":0,"metrics":{"pending_checks":9},"status":"keep","description":"monitor PR checks immediately after setup-deps consolidation push","timestamp":1777055851877,"segment":154,"confidence":null,"iterationTokens":172,"asi":{"hypothesis":"Immediately check CI after pushing setup-deps brew/apt install consolidation to catch early workflow/action failures.","result":"No failed checks observed; 9 checks pending immediately after push."}}
{"run":275,"commit":"b50441c","metric":0,"metrics":{"pending_checks":9},"status":"keep","description":"monitor PR checks after setup-deps consolidation has run longer","timestamp":1777056053732,"segment":154,"confidence":null,"iterationTokens":756,"asi":{"hypothesis":"Wait a few minutes after setup-deps consolidation push to catch early package setup failures.","result":"No failed checks observed; 9 checks still pending in summary."}}
{"type":"config","name":"Use no-install-recommends in Linux sysroot population","metricName":"sysroot_apt_installs_missing_no_recommends","metricUnit":"","bestDirection":"lower"}
{"run":276,"commit":"2b1d129","metric":1,"metrics":{"sysroot_scripts":1},"status":"keep","description":"baseline Linux sysroot population apt install omits no-install-recommends","timestamp":1777056099873,"segment":155,"confidence":null,"iterationTokens":185,"asi":{"hypothesis":"Adding --no-install-recommends to populate_linux_sysroot.sh can reduce package install work in the release sysroot job while preserving explicitly requested packages."}}
{"run":277,"commit":"1b66262","metric":0,"metrics":{"sysroot_scripts":1},"status":"keep","description":"use no-install-recommends in Linux sysroot population","timestamp":1777056123979,"segment":155,"confidence":null,"iterationTokens":466,"asi":{"hypothesis":"Adding --no-install-recommends to the sysroot population apt install keeps explicit build-essential/zlib/rsync dependencies while reducing recommended package installation.","result":"populate_linux_sysroot.sh passes bash -n and missing no-install-recommends count dropped from 1 to 0."}}
{"type":"config","name":"Remove verbose tar flags from release sysroot steps","metricName":"verbose_tar_release_steps","metricUnit":"","bestDirection":"lower"}
{"run":278,"commit":"b58b0df","metric":2,"metrics":{"release_tar_steps":2},"status":"keep","description":"baseline release sysroot tar steps use verbose mode","timestamp":1777056185196,"segment":156,"confidence":null,"iterationTokens":145,"asi":{"hypothesis":"The release sysroot tar create/extract steps use verbose tar flags, producing large logs without affecting artifacts. Removing v preserves archive behavior while reducing log overhead."}}
{"run":279,"commit":"ad325ba","metric":0,"metrics":{"release_tar_steps":2},"status":"keep","description":"remove verbose tar flags from release sysroot steps","timestamp":1777056222322,"segment":156,"confidence":null,"iterationTokens":543,"asi":{"hypothesis":"Dropping v from sysroot tar create/extract steps keeps archive contents and paths unchanged while reducing log output in release build setup.","result":"release workflow/action YAML parses and verbose tar release steps dropped from 2 to 0."}}
{"type":"config","name":"Validate CI YAML and shell after release sysroot changes","metricName":"ci_metadata_failures","metricUnit":"","bestDirection":"lower"}
{"run":280,"commit":"9739ce6","metric":0,"metrics":{"workflow_files_checked":8,"action_files_checked":5,"shell_scripts_checked":1},"status":"keep","description":"validate CI YAML and sysroot shell after release sysroot changes","timestamp":1777056265086,"segment":157,"confidence":null,"iterationTokens":194,"asi":{"hypothesis":"Parse workflow/action YAML and check populate_linux_sysroot.sh syntax after release sysroot no-install-recommends and non-verbose tar changes.","result":"YAML parse and bash -n passed."}}
{"type":"config","name":"Monitor PR checks after release sysroot local changes","metricName":"pr_check_failures","metricUnit":"","bestDirection":"lower"}
{"run":281,"commit":"25f41f0","metric":0,"metrics":{"pending_checks":9},"status":"keep","description":"monitor PR checks after local release sysroot changes","timestamp":1777056302410,"segment":158,"confidence":null,"iterationTokens":172,"asi":{"hypothesis":"Check currently pushed CI while local release sysroot changes accumulate; failures should be fixed before pushing more.","result":"No failed checks observed; 9 checks still pending in summary."}}
{"type":"config","name":"Remove macOS LLVM setup diagnostic commands","metricName":"macos_llvm_setup_diagnostic_commands","metricUnit":"","bestDirection":"lower"}
{"run":282,"commit":"98991fd","metric":4,"metrics":{"setup_deps_actions":1},"status":"keep","description":"baseline macOS setup-deps runs LLVM diagnostic commands","timestamp":1777056378108,"segment":159,"confidence":null,"iterationTokens":190,"asi":{"hypothesis":"The macOS setup-deps action runs several LLVM/LLD version/path diagnostic commands after brew link. Removing these avoids extra process launches and log output while preserving installed/link behavior."}}
{"run":283,"commit":"a58052d","metric":0,"metrics":{"setup_deps_actions":1},"status":"keep","description":"remove macOS LLVM setup diagnostic commands","timestamp":1777056407233,"segment":159,"confidence":null,"iterationTokens":577,"asi":{"hypothesis":"Dropping post-link LLVM/LLD diagnostic commands keeps the brew install/link behavior unchanged while reducing process launches and log output on macOS setup-deps jobs.","result":"setup-deps YAML parses and macOS LLVM diagnostic command count dropped from 4 to 0."}}
{"type":"config","name":"Validate setup-deps shell and CI YAML before push","metricName":"ci_validation_failures","metricUnit":"","bestDirection":"lower"}
{"run":284,"commit":"3b909d0","metric":0,"metrics":{"workflow_files_checked":8,"action_files_checked":5,"setup_shell_blocks_checked":5},"status":"keep","description":"validate setup-deps shell and CI YAML before push","timestamp":1777056439334,"segment":160,"confidence":null,"iterationTokens":397,"asi":{"hypothesis":"Before pushing setup-deps consolidation/diagnostic changes, parse all workflow/action YAML and run bash -n over modified setup shell blocks.","result":"All YAML and setup shell syntax checks passed."}}
{"type":"config","name":"Monitor PR checks before setup-deps diagnostic push","metricName":"pr_check_failures","metricUnit":"","bestDirection":"lower"}
{"run":285,"commit":"807974f","metric":0,"metrics":{"pending_checks":9},"status":"keep","description":"monitor PR checks before setup-deps diagnostic push","timestamp":1777056463291,"segment":161,"confidence":null,"iterationTokens":172,"asi":{"hypothesis":"Before pushing the setup-deps consolidation/diagnostic batch, ensure current PR CI has no failures requiring attention.","result":"No failed checks observed; 9 checks still pending in summary."}}
{"type":"config","name":"Monitor PR checks after setup-deps diagnostic push","metricName":"pr_check_failures","metricUnit":"","bestDirection":"lower"}
{"run":286,"commit":"68689a7","metric":0,"metrics":{"pending_checks":9},"status":"keep","description":"monitor PR checks immediately after setup-deps diagnostic push","timestamp":1777056510675,"segment":162,"confidence":null,"iterationTokens":172,"asi":{"hypothesis":"Immediately check CI after pushing setup-deps consolidation and diagnostic-trimming changes to catch early setup failures.","result":"No failed checks observed; 9 checks pending immediately after push."}}
{"run":287,"commit":"6565109","metric":0,"metrics":{"pending_checks":9},"status":"keep","description":"monitor PR checks after setup-deps diagnostic push has run longer","timestamp":1777056725423,"segment":162,"confidence":null,"iterationTokens":738,"asi":{"hypothesis":"Wait a few minutes after setup-deps consolidation/diagnostic push to catch early setup failures.","result":"No failed checks observed; 9 checks still pending in summary."}}
{"type":"config","name":"Avoid unrelated release workflow edits invalidating Linux sysroot cache","metricName":"linux_sysroot_cache_unrelated_hash_inputs","metricUnit":"","bestDirection":"lower"}
{"run":288,"commit":"94df806","metric":1,"metrics":{"release_cache_keys":1},"status":"keep","description":"baseline Linux sysroot cache key hashes whole release workflow","timestamp":1777056768653,"segment":163,"confidence":null,"iterationTokens":164,"asi":{"hypothesis":"The Linux sysroot cache content is produced by populate_linux_sysroot.sh, but the cache key also hashes release-build.yml. Removing the workflow file from the hash avoids cache invalidation from unrelated release workflow edits while preserving explicit v1.0.0 key versioning for manual invalidation."}}
{"run":289,"commit":"11acba9","metric":0,"metrics":{"release_cache_keys":1},"status":"keep","description":"key Linux sysroot cache only by population script","timestamp":1777056810596,"segment":163,"confidence":null,"iterationTokens":504,"asi":{"hypothesis":"Hashing only populate_linux_sysroot.sh for the Linux sysroot cache key prevents unrelated release-build.yml edits from forcing cache misses, while the explicit suffix still allows manual invalidation when needed.","result":"release-build workflow YAML parses and unrelated workflow hash input metric dropped from 1 to 0."}}
{"type":"config","name":"Validate release workflow after sysroot cache key change","metricName":"release_yaml_failures","metricUnit":"","bestDirection":"lower"}
{"run":290,"commit":"b25e5d3","metric":0,"metrics":{"release_workflows_checked":1},"status":"keep","description":"validate release workflow after sysroot cache key change","timestamp":1777056832178,"segment":164,"confidence":null,"iterationTokens":128,"asi":{"hypothesis":"Parse release-build.yml after narrowing the Linux sysroot cache key hash input.","result":"release-build workflow YAML parsed successfully."}}
{"type":"config","name":"Remove redundant chmod for executable CI scripts","metricName":"redundant_chmod_executable_scripts","metricUnit":"","bestDirection":"lower"}
{"run":291,"commit":"253e0f1","metric":5,"metrics":{"executable_scripts_checked":5},"status":"keep","description":"baseline CI chmods scripts already executable in repository","timestamp":1777056968795,"segment":165,"confidence":null,"iterationTokens":249,"asi":{"hypothesis":"Several CI steps run chmod +x on scripts that already have executable bits in the repository. Removing those chmods avoids extra shell commands while preserving script execution."}}
{"run":292,"commit":"cabacbe","metric":0,"metrics":{"executable_scripts_checked":5},"status":"keep","description":"remove redundant chmods for executable CI scripts","timestamp":1777057005639,"segment":165,"confidence":null,"iterationTokens":743,"asi":{"hypothesis":"Scripts invoked by these CI steps are already executable in git, so removing chmod +x commands preserves execution and saves redundant shell commands.","result":"Relevant workflow/action YAML parses and redundant chmod sites dropped from 5 to 0."}}
{"type":"config","name":"Validate workflow/action YAML and executable bits after chmod removal","metricName":"chmod_removal_validation_failures","metricUnit":"","bestDirection":"lower"}
{"run":293,"commit":"06f1eec","metric":0,"metrics":{"workflow_files_checked":8,"action_files_checked":5,"executable_scripts_checked":5},"status":"keep","description":"validate YAML and executable bits after chmod removal","timestamp":1777057053974,"segment":166,"confidence":null,"iterationTokens":249,"asi":{"hypothesis":"After removing redundant chmod commands, verify all workflow/action YAML parses and the invoked scripts are executable in the working tree.","result":"YAML parse passed and all five scripts have executable bits."}}
{"type":"config","name":"Monitor PR checks after chmod removal","metricName":"pr_check_failures","metricUnit":"","bestDirection":"lower"}
{"run":294,"commit":"74af55b","metric":0,"metrics":{"pending_checks":9},"status":"keep","description":"monitor PR checks after local chmod removal","timestamp":1777057099790,"segment":167,"confidence":null,"iterationTokens":169,"asi":{"hypothesis":"Check currently pushed CI while local chmod removal and release cache-key changes accumulate; failures should be fixed before pushing.","result":"No failed checks observed; 9 checks still pending in summary."}}
{"type":"config","name":"Monitor PR checks after cache-key and chmod push","metricName":"pr_check_failures","metricUnit":"","bestDirection":"lower"}
{"run":295,"commit":"e380a6a","metric":0,"metrics":{"pending_checks":9},"status":"keep","description":"monitor PR checks immediately after cache-key and chmod push","timestamp":1777057144866,"segment":168,"confidence":null,"iterationTokens":172,"asi":{"hypothesis":"Immediately check CI after pushing release cache-key, sysroot, chmod, and setup-deps refinements to catch early workflow failures.","result":"No failed checks observed; 9 checks pending immediately after push."}}
{"run":296,"commit":"dbef492","metric":0,"metrics":{"pending_checks":9},"status":"keep","description":"monitor PR checks after cache-key and chmod push has run longer","timestamp":1777057348211,"segment":168,"confidence":null,"iterationTokens":757,"asi":{"hypothesis":"Wait a few minutes after cache-key/chmod/setup-deps refinements to catch early CI setup failures.","result":"No failed checks observed; 9 checks still pending in summary."}}
{"type":"config","name":"Track overall PR pending count after latest push","metricName":"pending_pr_checks","metricUnit":"","bestDirection":"lower"}
{"run":297,"commit":"599ae14","metric":1,"metrics":{"pr_check_failures":0},"status":"keep","description":"track overall pending PR checks after latest push","timestamp":1777057405884,"segment":169,"confidence":null,"iterationTokens":173,"asi":{"hypothesis":"Track how close the latest pushed CI run is to completion and ensure no failures are present before further changes.","result":"Only 1 pending check remains and no failed checks are present."}}
{"run":298,"commit":"078fe63","metric":9,"metrics":{"pr_check_failures":0},"status":"keep","description":"monitor pending PR checks after waiting","timestamp":1777057563701,"segment":169,"confidence":null,"iterationTokens":395,"asi":{"hypothesis":"Wait longer to see whether the latest PR checks finish or reveal failures.","result":"No failed checks observed; several long-running llgo/test checks remain pending."}}
{"type":"config","name":"Monitor PR failures while continuing optimization","metricName":"pr_check_failures","metricUnit":"","bestDirection":"lower"}
{"run":299,"commit":"b018b86","metric":0,"metrics":{"pending_checks":9},"status":"keep","description":"monitor PR failures while continuing optimization","timestamp":1777057628334,"segment":170,"confidence":null,"iterationTokens":196,"asi":{"hypothesis":"Check for PR failures before continuing; pending checks can continue in parallel but failures should preempt optimization.","result":"No failed checks observed; 9 checks remain pending."}}
{"type":"config","name":"Remove diagnostic ls subprocess from crosscompile fetch test","metricName":"fetch_test_diagnostic_subprocesses","metricUnit":"","bestDirection":"lower"}
{"run":300,"commit":"82829d6","metric":2,"metrics":{"crosscompile_fetch_tests":1},"status":"keep","description":"baseline crosscompile fetch test has diagnostic ls/println","timestamp":1777057718636,"segment":171,"confidence":null,"iterationTokens":160,"asi":{"hypothesis":"internal/crosscompile/fetch_test.go runs a diagnostic ls subprocess and prints file paths during a successful extraction test. Removing these diagnostics preserves assertions while avoiding subprocess/log overhead."}}
{"run":301,"commit":"07c3a02","metric":0,"metrics":{"crosscompile_fetch_tests":1,"focused_test_seconds":1.1},"status":"keep","description":"remove diagnostic ls subprocess from crosscompile fetch test","timestamp":1777057764232,"segment":171,"confidence":null,"iterationTokens":505,"asi":{"hypothesis":"Removing the diagnostic ls subprocess and println from the extraction test keeps content assertions unchanged while reducing subprocess/log overhead.","result":"Focused crosscompile fetch test passed and diagnostic subprocess/print sites dropped from 2 to 0."}}
{"type":"config","name":"Validate crosscompile package after fetch test cleanup","metricName":"crosscompile_failures","metricUnit":"","bestDirection":"lower"}
{"run":302,"commit":"d0335f9","metric":0,"metrics":{"crosscompile_s":3.401,"compile_s":3.599,"libc_s":3.18,"rtlib_s":3.482},"status":"keep","description":"validate crosscompile packages after fetch test cleanup","timestamp":1777057830645,"segment":172,"confidence":null,"iterationTokens":122,"asi":{"hypothesis":"Run all internal/crosscompile packages after removing diagnostic output from fetch_test.go to catch regressions.","result":"All internal/crosscompile packages passed."}}
{"type":"config","name":"Validate stable core before next push","metricName":"stable_core_failures","metricUnit":"","bestDirection":"lower"}
{"run":303,"commit":"3ee8993","metric":0,"metrics":{"internal_build_s":23.798,"crosscompile_s":2.184,"compile_s":1.127,"libc_s":1.92,"rtlib_s":0.36,"goembed_s":1.398},"status":"keep","description":"validate stable core before next push","timestamp":1777057884557,"segment":173,"confidence":null,"iterationTokens":127,"asi":{"hypothesis":"Run the stable core subset before pushing the latest workflow/cache/test cleanup batch.","result":"Stable core subset passed."}}
{"type":"config","name":"Monitor PR checks before stable-core push","metricName":"pr_check_failures","metricUnit":"","bestDirection":"lower"}
{"run":304,"commit":"31db211","metric":0,"metrics":{"pending_checks":9},"status":"keep","description":"monitor PR checks before stable-core push","timestamp":1777057932112,"segment":174,"confidence":null,"iterationTokens":170,"asi":{"hypothesis":"Before pushing the latest stable-core-validated batch, ensure the current PR run has no failures requiring attention.","result":"No failed checks observed; 9 checks still pending in summary."}}
{"type":"config","name":"Monitor PR checks after stable-core-validated push","metricName":"pr_check_failures","metricUnit":"","bestDirection":"lower"}
{"run":305,"commit":"3bdf66b","metric":0,"metrics":{"pending_checks":9},"status":"keep","description":"monitor PR checks immediately after stable-core-validated push","timestamp":1777057989635,"segment":175,"confidence":null,"iterationTokens":172,"asi":{"hypothesis":"Immediately check CI after pushing workflow/cache/test cleanup batch validated by stable core tests.","result":"No failed checks observed; 9 checks pending immediately after push."}}
{"run":306,"commit":"3bff751","metric":0,"metrics":{"pending_checks":9},"status":"keep","description":"monitor PR checks after stable-core-validated push has run longer","timestamp":1777058232718,"segment":175,"confidence":null,"iterationTokens":774,"asi":{"hypothesis":"Wait a few minutes after stable-core-validated push to catch early failures from workflow/cache/test cleanup changes.","result":"No failed checks observed; 9 checks still pending in summary."}}
{"type":"config","name":"Use preinstalled PATH iwasm in buildcache tests","metricName":"buildcache_iwasm_path_fallback_missing","metricUnit":"","bestDirection":"lower"}
{"run":307,"commit":"ceba153","metric":1,"metrics":{"buildcache_scripts":1},"status":"keep","description":"baseline buildcache script ignores preinstalled PATH iwasm","timestamp":1777058317754,"segment":176,"confidence":null,"iterationTokens":152,"asi":{"hypothesis":"The build-cache workflow already builds WAMR and adds iwasm to PATH, but test/buildcache/test.sh only checks the llgo cache path and may build iwasm again. Letting the script use PATH iwasm when the cache copy is absent should avoid a redundant WAMR build while preserving local fallback behavior."}}
{"run":308,"commit":"f17f545","metric":0,"metrics":{"buildcache_scripts":1},"status":"keep","description":"use preinstalled PATH iwasm in buildcache tests","timestamp":1777058352498,"segment":176,"confidence":null,"iterationTokens":980,"asi":{"hypothesis":"Checking command -v iwasm before invoking dev/build_iwasm.sh lets CI reuse the WAMR binary built by the workflow and avoids a redundant WAMR clone/cmake/make, while preserving the local fallback build path.","result":"test/buildcache/test.sh passes bash -n and PATH iwasm fallback marker dropped from 1 to 0."}}
{"type":"config","name":"Monitor PR checks after buildcache iwasm script change","metricName":"pr_check_failures","metricUnit":"","bestDirection":"lower"}
{"run":309,"commit":"8de3d37","metric":0,"metrics":{"pending_checks":9},"status":"keep","description":"monitor PR checks after local buildcache iwasm script change","timestamp":1777058410442,"segment":177,"confidence":null,"iterationTokens":174,"asi":{"hypothesis":"Check currently pushed CI while local buildcache iwasm script change accumulates; failures should be fixed before pushing more.","result":"No failed checks observed; 9 checks still pending in summary."}}
{"type":"config","name":"Validate scripts and YAML before buildcache iwasm push","metricName":"script_yaml_failures","metricUnit":"","bestDirection":"lower"}
