{"run":162,"commit":"6b1396f","metric":1,"metrics":{"build_cache_workflows":1},"status":"keep","description":"combine macOS and Ubuntu WAMR install steps","timestamp":1777048887635,"segment":75,"confidence":null,"iterationTokens":4179,"asi":{"hypothesis":"A single WAMR install step can select the platform directory from runner.os, preserving the same clone/cmake/make behavior while reducing duplicate workflow steps.","result":"build-cache workflow YAML parses and WAMR install steps dropped from 2 to 1."}}
{"type":"config","name":"Validate build-cache WAMR shell syntax","metricName":"build_cache_shell_syntax_failures","metricUnit":"","bestDirection":"lower"}
{"run":163,"commit":"fb7668e","metric":0,"metrics":{"build_cache_shell_blocks_checked":1},"status":"keep","description":"validate combined WAMR install shell syntax","timestamp":1777048921569,"segment":76,"confidence":null,"iterationTokens":272,"asi":{"hypothesis":"Validate the combined WAMR install shell step with bash -n after substituting runner.os to catch syntax issues in the new conditional step.","result":"Combined WAMR shell step passed bash -n."}}
{"type":"config","name":"Monitor PR checks before more workflow consolidation","metricName":"pr_check_failures","metricUnit":"","bestDirection":"lower"}
{"run":164,"commit":"5c8cb68","metric":0,"metrics":{"pending_checks":9},"status":"keep","description":"monitor PR checks before further workflow consolidation","timestamp":1777048963823,"segment":77,"confidence":null,"iterationTokens":170,"asi":{"hypothesis":"Before more workflow edits, check whether the latest pushed batch has produced CI failures that should be fixed first.","result":"No failed checks observed; 9 checks still pending."}}
{"type":"config","name":"Inline build-cache esptool install into test step","metricName":"build_cache_esptool_setup_steps","metricUnit":"","bestDirection":"lower"}
{"run":165,"commit":"eca9598","metric":1,"metrics":{"build_cache_workflows":1},"status":"keep","description":"baseline build-cache has separate esptool setup step","timestamp":1777048992000,"segment":78,"confidence":null,"iterationTokens":146,"asi":{"hypothesis":"The build-cache workflow uses a separate Ubuntu-only esptool install step immediately before running the build cache tests. Inlining that install into the test step preserves behavior while reducing workflow step overhead."}}
{"run":166,"commit":"6bba97d","metric":0,"metrics":{"build_cache_workflows":1},"status":"keep","description":"inline build-cache esptool install into test step","timestamp":1777049025354,"segment":78,"confidence":null,"iterationTokens":524,"asi":{"hypothesis":"Moving the Ubuntu esptool install into the build-cache test step removes a separate GitHub Actions step while preserving Linux-only installation before test/buildcache/test.sh.","result":"build-cache workflow YAML parses and separate esptool setup steps dropped from 1 to 0."}}
{"type":"config","name":"Validate build-cache workflow shell blocks after step consolidation","metricName":"build_cache_shell_syntax_failures","metricUnit":"","bestDirection":"lower"}
{"run":167,"commit":"1f385b9","metric":0,"metrics":{"build_cache_shell_blocks_checked":2},"status":"keep","description":"validate build-cache conditional shell blocks after consolidation","timestamp":1777049056977,"segment":79,"confidence":null,"iterationTokens":294,"asi":{"hypothesis":"Run bash -n on build-cache workflow shell blocks containing runner.os after consolidating WAMR and esptool steps to catch syntax errors.","result":"Both build-cache conditional shell blocks passed bash -n."}}
{"type":"config","name":"Validate all CI YAML before next push","metricName":"ci_yaml_failures","metricUnit":"","bestDirection":"lower"}
{"run":168,"commit":"9ed53ce","metric":0,"metrics":{"workflow_files_checked":8,"action_files_checked":5},"status":"keep","description":"validate all CI YAML before pushing workflow consolidation batch","timestamp":1777049083787,"segment":80,"confidence":null,"iterationTokens":176,"asi":{"hypothesis":"Parse all workflow and composite action YAML before pushing the latest workflow consolidation optimizations.","result":"All workflow/action YAML parsed successfully."}}
{"type":"config","name":"Monitor PR checks after workflow consolidation push","metricName":"pr_check_failures","metricUnit":"","bestDirection":"lower"}
{"run":169,"commit":"196b343","metric":0,"metrics":{"pending_checks":9},"status":"keep","description":"monitor PR checks immediately after workflow consolidation push","timestamp":1777049126139,"segment":81,"confidence":null,"iterationTokens":170,"asi":{"hypothesis":"Immediately check PR CI after pushing workflow consolidation changes; if failures appear, stop and fix them first.","result":"No failed checks observed; 9 checks pending immediately after push."}}
{"run":170,"commit":"3403787","metric":0,"metrics":{"pending_checks":9},"status":"keep","description":"monitor PR checks after workflow consolidation push has run longer","timestamp":1777049358089,"segment":81,"confidence":null,"iterationTokens":2182,"asi":{"hypothesis":"Continue monitoring the latest pushed workflow consolidation batch for failures before accumulating many more local commits.","result":"No failed checks observed; 9 checks still pending in summary."}}
{"type":"config","name":"Cache compiler path resolution for LLVM version lookup","metricName":"llvm_compiler_path_cache_missing","metricUnit":"","bestDirection":"lower"}
{"run":171,"commit":"3507318","metric":1,"metrics":{"llvm_version_cache_globals":1},"status":"keep","description":"baseline LLVM version lookup resolves compiler path each context","timestamp":1777049439286,"segment":82,"confidence":null,"iterationTokens":144,"asi":{"hypothesis":"The LLVM version cache avoids repeated clang --version calls, but getLLVMVersion still runs exec.LookPath for each new context. Cache compiler path resolution by compiler name and PATH to reduce repeated filesystem PATH searches without changing version cache safety."}}
{"run":172,"commit":"b4205bc","metric":0,"metrics":{"llvm_version_cache_globals":2,"focused_test_seconds":1.6},"status":"keep","description":"cache compiler path resolution for LLVM version lookup","timestamp":1777049498323,"segment":82,"confidence":null,"iterationTokens":910,"asi":{"hypothesis":"Caching the resolved compiler path by compiler name and PATH avoids repeated exec.LookPath filesystem searches across build contexts, while preserving correctness when PATH changes and when absolute compiler paths are used.","result":"Focused LLVM version tests passed; compiler path cache marker missing metric dropped from 1 to 0."}}
{"type":"config","name":"Validate internal/build after compiler path cache","metricName":"internal_build_failures","metricUnit":"","bestDirection":"lower"}
{"run":173,"commit":"2d42019","metric":0,"metrics":{"internal_build_s":24.464},"status":"keep","description":"validate internal/build after LLVM compiler path cache","timestamp":1777049546213,"segment":83,"confidence":null,"iterationTokens":118,"asi":{"hypothesis":"Run the full internal/build test package after adding compiler path caching to catch cache key or global state regressions.","result":"internal/build passed."}}
{"type":"config","name":"Monitor PR checks after LLVM path cache validation","metricName":"pr_check_failures","metricUnit":"","bestDirection":"lower"}
{"run":174,"commit":"3e24df3","metric":0,"metrics":{"pending_checks":9},"status":"keep","description":"monitor PR checks after local LLVM path cache validation","timestamp":1777049580775,"segment":84,"confidence":null,"iterationTokens":171,"asi":{"hypothesis":"Check the currently pushed CI while local LLVM path cache changes are accumulating; fix CI failures before pushing more if any appear.","result":"No failed checks observed; 9 checks still pending in summary."}}
{"type":"config","name":"Vet internal/build after compiler path cache","metricName":"internal_build_vet_failures","metricUnit":"","bestDirection":"lower"}
{"run":175,"commit":"2d6d348","metric":0,"metrics":{"vet_packages":1},"status":"keep","description":"go vet internal/build after compiler path cache","timestamp":1777049605911,"segment":85,"confidence":null,"iterationTokens":106,"asi":{"hypothesis":"Run go vet on internal/build after adding another sync.Map global and test resets to catch copy-lock or related issues.","result":"go vet ./internal/build passed."}}
{"type":"config","name":"Allow release artifact tests to skip demo-only setup deps","metricName":"release_setup_demo_deps_enabled","metricUnit":"","bestDirection":"lower"}
{"run":176,"commit":"d4ee833","metric":1,"metrics":{"release_setup_deps_sites":1},"status":"keep","description":"baseline release artifact tests install demo-only setup deps","timestamp":1777049681904,"segment":86,"confidence":null,"iterationTokens":175,"asi":{"hypothesis":"Release artifact smoke tests only run the Hello World action and an ESP32 build, but setup-deps still installs demo-only dependencies such as cjson/sqlite/python. Add an opt-out input so release artifact tests can skip demo-only package setup without reducing smoke coverage."}}
{"run":177,"commit":"b59bea0","metric":0,"metrics":{"release_setup_deps_sites":1},"status":"keep","description":"skip demo-only setup deps for release artifact smoke tests","timestamp":1777049756006,"segment":86,"confidence":null,"iterationTokens":1227,"asi":{"hypothesis":"An install-demo-deps input lets the release artifact test job skip cjson/sqlite/python package setup while preserving the dependencies needed for its Hello World and ESP32 smoke tests; other workflows keep the default demo deps.","result":"setup-deps action and release workflow YAML parse; release setup demo deps enabled metric dropped from 1 to 0."}}
{"type":"config","name":"Validate setup-deps shell syntax after demo deps opt-out","metricName":"setup_deps_shell_syntax_failures","metricUnit":"","bestDirection":"lower"}
{"run":178,"commit":"d22b946","metric":0,"metrics":{"setup_deps_shell_blocks_checked":2},"status":"keep","description":"validate setup-deps shell blocks after demo deps opt-out","timestamp":1777049791873,"segment":87,"confidence":null,"iterationTokens":325,"asi":{"hypothesis":"Run bash -n on setup-deps shell blocks after adding install-demo-deps conditionals to validate Bash syntax for both macOS and Ubuntu branches.","result":"Both setup-deps shell blocks passed bash -n."}}
{"type":"config","name":"Validate core and CI metadata before push","metricName":"prepush_failures","metricUnit":"","bestDirection":"lower"}
{"run":179,"commit":"27ac72a","metric":0,"metrics":{"workflow_files_checked":8,"action_files_checked":5,"focused_internal_build_s":0.624},"status":"keep","description":"validate YAML and LLVM cache tests before push","timestamp":1777049836092,"segment":88,"confidence":null,"iterationTokens":205,"asi":{"hypothesis":"Before pushing the current batch, validate workflow/action YAML and rerun focused LLVM cache tests touched by local code changes.","result":"YAML parse and focused internal/build LLVM version tests passed."}}
{"type":"config","name":"Monitor PR checks after code and workflow push","metricName":"pr_check_failures","metricUnit":"","bestDirection":"lower"}
{"run":180,"commit":"9c9c616","metric":0,"metrics":{"pending_checks":9},"status":"keep","description":"monitor PR checks immediately after code and workflow push","timestamp":1777049878631,"segment":89,"confidence":null,"iterationTokens":171,"asi":{"hypothesis":"Check immediately after pushing the LLVM path cache and workflow setup optimizations to catch early CI failures.","result":"No failed checks observed; 9 checks pending immediately after push."}}
{"run":181,"commit":"6796b09","metric":0,"metrics":{"pending_checks":9},"status":"keep","description":"monitor PR checks after latest push has run longer","timestamp":1777050086021,"segment":89,"confidence":null,"iterationTokens":869,"asi":{"hypothesis":"Continue monitoring after the latest push for failures from workflow/action changes before additional optimization.","result":"No failed checks observed; 9 checks still pending in summary."}}
{"type":"config","name":"Skip demo-only deps in non-demo CI jobs","metricName":"non_demo_setup_demo_deps_enabled","metricUnit":"","bestDirection":"lower"}
{"run":182,"commit":"8874b75","metric":4,"metrics":{"non_demo_setup_deps_sites":4},"status":"keep","description":"baseline non-demo CI jobs still install demo-only setup deps","timestamp":1777050145590,"segment":90,"confidence":null,"iterationTokens":294,"asi":{"hypothesis":"Build-cache, targets, hello, and cross-compile jobs do not run the broad host demo suite requiring cjson/sqlite/python setup-deps. Opting them out of demo-only deps should preserve their coverage while reducing package install work."}}
{"run":183,"commit":"dfbbeea","metric":0,"metrics":{"non_demo_setup_deps_sites":4},"status":"keep","description":"skip demo-only setup deps in non-demo CI jobs","timestamp":1777050260290,"segment":90,"confidence":null,"iterationTokens":511,"asi":{"hypothesis":"Build-cache, targets, hello, and cross-compile jobs can opt out of cjson/sqlite/python demo setup because they do not run the broad host demo suite; release artifact tests were already opted out.","result":"Relevant workflow YAML parses and all intended non-demo setup-deps call sites now include install-demo-deps: false."}}
{"type":"config","name":"Validate CI YAML after non-demo deps opt-outs","metricName":"ci_yaml_failures","metricUnit":"","bestDirection":"lower"}
{"run":184,"commit":"cc461ed","metric":0,"metrics":{"workflow_files_checked":8,"action_files_checked":5},"status":"keep","description":"validate CI YAML after non-demo setup deps opt-outs","timestamp":1777050293237,"segment":91,"confidence":null,"iterationTokens":178,"asi":{"hypothesis":"Parse all workflow/action YAML after adding install-demo-deps opt-outs to multiple non-demo jobs.","result":"All workflow/action YAML parsed successfully."}}
{"type":"config","name":"Monitor PR checks after demo deps opt-outs","metricName":"pr_check_failures","metricUnit":"","bestDirection":"lower"}
{"run":185,"commit":"21e49cd","metric":0,"metrics":{"pending_checks":9},"status":"keep","description":"monitor PR checks while local demo deps opt-outs accumulate","timestamp":1777050329200,"segment":92,"confidence":null,"iterationTokens":171,"asi":{"hypothesis":"Check pushed CI before continuing; any failure should be fixed before pushing additional demo-deps opt-out changes.","result":"No failed checks observed; 9 checks still pending in summary."}}
{"type":"config","name":"Skip demo-only setup deps in llgo test shards","metricName":"llgo_test_shard_demo_deps_enabled","metricUnit":"","bestDirection":"lower"}
{"run":186,"commit":"c3e1a13","metric":1,"metrics":{"llgo_test_shard_jobs":8},"status":"keep","description":"baseline llgo test shards install demo-only setup deps","timestamp":1777050391837,"segment":93,"confidence":null,"iterationTokens":179,"asi":{"hypothesis":"The llgo test shard job runs llgo test ./test/... rather than the host demo suite, and earlier experiments already removed demo-only pip installs from this shard. It should also opt out of setup-deps demo packages cjson/sqlite/python to save package install time across 8 shard jobs."}}
{"run":187,"commit":"1945597","metric":0,"metrics":{"llgo_test_shard_jobs":8},"status":"keep","description":"skip demo-only setup deps in llgo test shards","timestamp":1777050458191,"segment":93,"confidence":null,"iterationTokens":1184,"asi":{"hypothesis":"Adding install-demo-deps: false to the llgo test shard setup-deps call skips demo-only package installs across 8 shard jobs while preserving llgo test ./test/... coverage.","result":"llgo workflow YAML parses; test shard demo deps enabled metric dropped from 1 to 0."}}
{"type":"config","name":"Validate CI YAML after llgo test shard opt-out","metricName":"ci_yaml_failures","metricUnit":"","bestDirection":"lower"}
{"run":188,"commit":"c317928","metric":0,"metrics":{"workflow_files_checked":8,"action_files_checked":5},"status":"keep","description":"validate CI YAML after llgo test shard demo deps opt-out","timestamp":1777050505878,"segment":94,"confidence":null,"iterationTokens":179,"asi":{"hypothesis":"Parse all workflow/action YAML after adding install-demo-deps false to the llgo test shard job.","result":"All workflow/action YAML parsed successfully."}}
{"type":"config","name":"Monitor PR checks before pushing demo deps opt-out batch","metricName":"pr_check_failures","metricUnit":"","bestDirection":"lower"}
{"run":189,"commit":"4e0d067","metric":0,"metrics":{"pending_checks":9},"status":"keep","description":"monitor PR checks before pushing demo deps opt-out batch","timestamp":1777050543393,"segment":95,"confidence":null,"iterationTokens":173,"asi":{"hypothesis":"Before pushing another batch, ensure existing PR CI has no failures that need attention.","result":"No failed checks observed; 9 checks still pending in summary."}}
{"type":"config","name":"Monitor PR checks after demo deps opt-out push","metricName":"pr_check_failures","metricUnit":"","bestDirection":"lower"}
{"run":190,"commit":"bcfeaa2","metric":0,"metrics":{"pending_checks":9},"status":"keep","description":"monitor PR checks immediately after demo deps opt-out push","timestamp":1777050586518,"segment":96,"confidence":null,"iterationTokens":172,"asi":{"hypothesis":"Immediately check CI after pushing demo-deps opt-outs to catch early workflow failures.","result":"No failed checks observed; 9 checks pending immediately after push."}}
{"run":191,"commit":"0c2ed65","metric":0,"metrics":{"pending_checks":9},"status":"keep","description":"monitor PR checks after demo deps opt-out push has run longer","timestamp":1777050816044,"segment":96,"confidence":null,"iterationTokens":2270,"asi":{"hypothesis":"Continue monitoring the pushed demo-deps opt-out batch for CI failures before further optimization.","result":"No failed checks observed; 9 checks still pending in summary."}}
{"type":"config","name":"Combine Ubuntu setup-deps common and demo apt installs","metricName":"ubuntu_setup_deps_apt_install_commands","metricUnit":"","bestDirection":"lower"}
{"run":192,"commit":"ffae78b","metric":3,"metrics":{"setup_deps_actions":1},"status":"keep","description":"baseline Ubuntu setup-deps uses separate common and demo apt installs","timestamp":1777050884124,"segment":97,"confidence":null,"iterationTokens":160,"asi":{"hypothesis":"In setup-deps Ubuntu branch, common and demo packages are installed with separate apt-get install invocations. Building one package array and appending demo deps when enabled should preserve package coverage while reducing apt invocation overhead."}}
{"run":193,"commit":"60f78fe","metric":2,"metrics":{"setup_deps_actions":1},"status":"keep","description":"combine Ubuntu setup-deps common and demo apt installs","timestamp":1777050934350,"segment":97,"confidence":null,"iterationTokens":1197,"asi":{"hypothesis":"Using one deps array for common packages and appending demo packages when enabled reduces Ubuntu setup-deps apt-get install invocations while keeping the same package set for both demo and non-demo jobs.","result":"setup-deps YAML parses and Ubuntu apt-get install commands dropped from 3 to 2."}}
{"type":"config","name":"Validate setup-deps shell syntax after apt install combine","metricName":"setup_deps_shell_syntax_failures","metricUnit":"","bestDirection":"lower"}
{"run":194,"commit":"0d27df6","metric":0,"metrics":{"setup_deps_shell_blocks_checked":2},"status":"keep","description":"validate setup-deps shell syntax after apt install combine","timestamp":1777050972692,"segment":98,"confidence":null,"iterationTokens":324,"asi":{"hypothesis":"Run bash -n over setup-deps shell blocks after combining Ubuntu apt package arrays to catch shell syntax errors.","result":"Both setup-deps shell blocks passed bash -n."}}
{"run":195,"commit":"8eb7e73","metric":0,"metrics":{"setup_deps_shell_blocks_checked":0,"pending_checks":9},"status":"keep","description":"incidental PR check monitor during setup-deps shell validation segment","timestamp":1777051204499,"segment":98,"confidence":null,"iterationTokens":784,"asi":{"hypothesis":"Check pushed CI while local setup-deps changes are accumulating; this run was under the current setup-deps validation segment and is logged accordingly.","result":"No failed PR checks observed; 9 checks still pending."}}
{"type":"config","name":"Disable pip version checks in CI installs","metricName":"pip_installs_with_version_check","metricUnit":"","bestDirection":"lower"}
{"run":196,"commit":"5475a57","metric":4,"metrics":{"workflow_pip_install_sites":4},"status":"keep","description":"baseline CI pip installs allow version checks","timestamp":1777051243308,"segment":99,"confidence":null,"iterationTokens":186,"asi":{"hypothesis":"Adding --disable-pip-version-check to CI pip install commands avoids unnecessary version-check overhead and log noise while installing the same packages."}}
{"run":197,"commit":"99dcbfc","metric":0,"metrics":{"workflow_pip_install_sites":4},"status":"keep","description":"disable pip version checks in CI installs","timestamp":1777051304800,"segment":99,"confidence":null,"iterationTokens":910,"asi":{"hypothesis":"Adding --disable-pip-version-check to all CI pip install commands avoids pip's version-check overhead without changing installed packages.","result":"Affected workflow YAML parses; pip install sites without disable-pip-version-check dropped from 4 to 0."}}
{"type":"config","name":"Validate all CI YAML after pip/setup-deps changes","metricName":"ci_yaml_failures","metricUnit":"","bestDirection":"lower"}
