{"run":492,"commit":"ab3d521","metric":0,"metrics":{"pending_checks":30,"split_macos_intel_over15_jobs":0,"split_macos_intel_completed_jobs":0,"split_macos_intel_max_seconds":0},"status":"keep","description":"monitor retry-fix run after workflows expanded","timestamp":1777097973950,"segment":258,"confidence":null,"iterationTokens":935,"asi":{"hypothesis":"Continue monitoring retry-fix run through workflow expansion; failures should stay zero while macOS Intel split jobs are pending.","result":"No failed checks observed; pending checks increased to 30 as workflows expanded."}}
{"run":493,"commit":"d133789","metric":0,"metrics":{"pending_checks":22,"split_macos_intel_over15_jobs":0,"split_macos_intel_completed_jobs":0,"split_macos_intel_max_seconds":0},"status":"keep","description":"monitor retry-fix run with 22 checks pending","timestamp":1777098287040,"segment":258,"confidence":null,"iterationTokens":1058,"asi":{"hypothesis":"Continue monitoring retry-fix run; no CI failures should appear and macOS Intel split jobs should begin completing soon.","result":"No failed checks observed; 22 checks remain pending."}}
{"run":494,"commit":"013bab7","metric":0,"metrics":{"pending_checks":20,"split_macos_intel_over15_jobs":0,"split_macos_intel_completed_jobs":2,"split_macos_intel_max_seconds":606},"status":"keep","description":"monitor retry-fix run with first split jobs completed","timestamp":1777098600475,"segment":258,"confidence":null,"iterationTokens":1045,"asi":{"hypothesis":"First completed macOS Intel split jobs should be below the 15m target after the host-demo and smoke splits.","result":"No failures. Two macOS Intel split jobs completed under 15m; max completed split job is 606s."}}
{"run":495,"commit":"fa75dc4","metric":0,"metrics":{"pending_checks":17,"split_macos_intel_over15_jobs":0,"split_macos_intel_completed_jobs":3,"split_macos_intel_max_seconds":679},"status":"keep","description":"monitor retry-fix run with three split jobs completed","timestamp":1777098913590,"segment":258,"confidence":null,"iterationTokens":1073,"asi":{"hypothesis":"Continue monitoring macOS Intel split job durations; completed jobs should remain under 15m.","result":"No failures. Three macOS Intel split jobs completed under 15m; max completed split job is 679s."}}
{"run":496,"commit":"57f44d6","metric":0,"metrics":{"pending_checks":14,"split_macos_intel_over15_jobs":0,"split_macos_intel_completed_jobs":4,"split_macos_intel_max_seconds":679},"status":"keep","description":"monitor retry-fix run with four split jobs completed","timestamp":1777099229811,"segment":258,"confidence":null,"iterationTokens":1052,"asi":{"hypothesis":"Continue monitoring split macOS Intel durations after the host-demo split; all completed split jobs should stay below 15m.","result":"No failures. Four macOS Intel split jobs completed under 15m; max completed split job remains 679s."}}
{"run":497,"commit":"0c80dfa","metric":0,"metrics":{"pending_checks":12,"split_macos_intel_over15_jobs":1,"split_macos_intel_completed_jobs":6,"split_macos_intel_max_seconds":1038},"status":"keep","description":"monitor retry-fix run found one over-15 split job","timestamp":1777099545355,"segment":258,"confidence":null,"iterationTokens":1063,"asi":{"hypothesis":"Continue monitoring split macOS Intel durations; host-demo split should ideally bring all completed jobs under 15m.","result":"No CI failures, but one completed macOS Intel split job is over 15m with max 1038s (~17m18s). Need inspect which job and step breakdown after logging this run."}}
{"type":"config","name":"Split ESP serial smoke targets on macOS Intel","metricName":"esp_serial_targets_per_job","metricUnit":"","bestDirection":"lower"}
{"run":498,"commit":"4296bec","metric":2,"metrics":{"macos_intel_esp_smoke_seconds_go121":1038,"esp_serial_step_seconds_go121":775},"status":"keep","description":"baseline ESP serial smoke runs both targets in one job","timestamp":1777099583129,"segment":259,"confidence":null,"iterationTokens":168,"asi":{"hypothesis":"The remaining over-15 macOS Intel split job is the Go 1.21 ESP smoke job, dominated by the ESP serial smoke step that runs both esp32 and esp32c3-basic. Splitting serial targets should preserve coverage and bring each job under 15m."}}
{"run":499,"commit":"37cb5ee","metric":1,"metrics":{"macos_intel_esp_smoke_seconds_go121":650,"esp_serial_step_seconds_go121":390,"split_macos_intel_smoke_matrix_jobs":8},"status":"keep","description":"split ESP serial smoke by target","timestamp":1777099627901,"segment":259,"confidence":null,"iterationTokens":3590,"asi":{"hypothesis":"Split the ESP serial smoke check so each macOS Intel smoke job runs only one serial target, and separate the startup regression. This preserves target coverage while reducing the over-15 Go 1.21 ESP smoke job.","result":"Workflow YAML parses, shell syntax passes, invalid LLGO_ESP_SERIAL_TARGETS is rejected, and the workflow contains separate esp32-serial, esp32c3-serial, and startup smoke jobs."}}
{"type":"config","name":"Validate workflows after ESP serial split","metricName":"workflow_validation_failures","metricUnit":"","bestDirection":"lower"}
{"run":500,"commit":"c85fa1a","metric":0,"metrics":{"workflow_files_checked":8,"action_files_checked":5,"shell_scripts_checked":2,"crosscompile_packages_tested":1},"status":"keep","description":"validate workflows after ESP serial target split","timestamp":1777099648620,"segment":260,"confidence":null,"iterationTokens":251,"asi":{"hypothesis":"Validate workflow/action YAML, shell syntax, and the recently edited crosscompile package before pushing the ESP serial smoke split.","result":"All workflow/action YAML parsed, both shell scripts passed bash -n, and internal/crosscompile tests passed."}}
{"type":"config","name":"Monitor PR after ESP serial split push","metricName":"pr_check_failures","metricUnit":"","bestDirection":"lower"}
{"run":501,"commit":"8b7fee4","metric":0,"metrics":{"pending_checks":17,"split_macos_intel_over15_jobs":0,"split_macos_intel_completed_jobs":0,"split_macos_intel_max_seconds":0},"status":"keep","description":"monitor PR immediately after ESP serial split push","timestamp":1777099698178,"segment":261,"confidence":null,"iterationTokens":469,"asi":{"hypothesis":"Immediately after pushing the ESP serial target split and idea-pruning note, CI should start without failures.","result":"No failed checks observed; 17 checks pending."}}
{"run":502,"commit":"3628e50","metric":0,"metrics":{"pending_checks":34,"split_macos_intel_over15_jobs":0,"split_macos_intel_completed_jobs":0,"split_macos_intel_max_seconds":0},"status":"keep","description":"monitor ESP serial split after workflow expansion","timestamp":1777100013020,"segment":261,"confidence":null,"iterationTokens":1213,"asi":{"hypothesis":"After workflow fan-out, the ESP serial target split should not introduce immediate failures.","result":"No failed checks observed; 34 checks pending and macOS Intel split jobs are still running."}}
{"run":503,"commit":"3628e50","metric":1,"metrics":{"pending_checks":24,"split_macos_intel_over15_jobs":0,"split_macos_intel_completed_jobs":1,"split_macos_intel_max_seconds":391},"status":"checks_failed","description":"monitor ESP serial split found esp32-serial failure","timestamp":1777100336430,"segment":261,"confidence":null,"iterationTokens":1043,"asi":{"hypothesis":"The ESP serial target split should preserve coverage and run each serial target separately without failures.","result":"CI failure appeared in llgo-embedded-smoke-macos-intel (19, 1.24.2, esp32-serial) after 1m6s.","rollback_reason":"Own ESP serial split likely introduced a workflow/script issue; need inspect failed job logs before fixing or reverting on PR branch.","next_action_hint":"Fetch logs for job 72993439917; likely check LLGO_ESP_SERIAL_TARGETS handling under macOS bash or env expression, then validate locally and push a fix or revert."}}
{"type":"config","name":"Retry ESP QEMU downloads","metricName":"qemu_download_retries","metricUnit":"","bestDirection":"higher"}
{"run":504,"commit":"db3d792","metric":0,"metrics":{},"status":"keep","description":"baseline ESP QEMU install has no curl retry","timestamp":1777100372414,"segment":262,"confidence":null,"iterationTokens":157,"asi":{"hypothesis":"The failed ESP serial split job was due to a transient 502 downloading ESP QEMU. The install script currently pipes a single curl attempt into tar, so transient release download errors fail CI immediately."}}
{"run":505,"commit":"b0e71f1","metric":3,"metrics":{"qemu_pipe_downloads":0},"status":"keep","description":"retry ESP QEMU release downloads","timestamp":1777100387286,"segment":262,"confidence":null,"iterationTokens":644,"asi":{"hypothesis":"Add curl retries for ESP QEMU release downloads to tolerate transient 502 errors seen in CI, and download to a temporary archive before extracting so retry behavior is explicit.","result":"install-esp-qemu.sh passes bash -n; script now uses curl --retry 3 --retry-all-errors --retry-delay 2 and no longer pipes curl directly to tar."}}
{"type":"config","name":"Validate after ESP QEMU retry fix","metricName":"validation_failures","metricUnit":"","bestDirection":"lower"}
{"run":506,"commit":"5123843","metric":0,"metrics":{"workflow_files_checked":8,"action_files_checked":5,"shell_scripts_checked":3},"status":"keep","description":"validate workflows after ESP QEMU retry fix","timestamp":1777100408114,"segment":263,"confidence":null,"iterationTokens":228,"asi":{"hypothesis":"Before pushing the ESP QEMU retry fix, validate all workflows/actions and edited shell scripts.","result":"All workflow/action YAML parsed and install-esp-qemu.sh, test_demo.sh, and test-esp-serial-startup.sh passed bash -n."}}
{"type":"config","name":"Monitor PR after ESP QEMU retry push","metricName":"pr_check_failures","metricUnit":"","bestDirection":"lower"}
{"run":507,"commit":"9765d2c","metric":0,"metrics":{"pending_checks":13,"split_macos_intel_over15_jobs":0,"split_macos_intel_completed_jobs":0,"split_macos_intel_max_seconds":0},"status":"keep","description":"monitor PR after pushing ESP QEMU retry fix","timestamp":1777100434866,"segment":264,"confidence":null,"iterationTokens":470,"asi":{"hypothesis":"After adding ESP QEMU download retries and pushing, the new PR run should start without immediate failures.","result":"No failed checks observed; 13 checks pending."}}
{"run":508,"commit":"7b64160","metric":0,"metrics":{"pending_checks":35,"split_macos_intel_over15_jobs":0,"split_macos_intel_completed_jobs":0,"split_macos_intel_max_seconds":0},"status":"keep","description":"monitor ESP QEMU retry run after workflow expansion","timestamp":1777100750345,"segment":264,"confidence":null,"iterationTokens":1219,"asi":{"hypothesis":"After workflow expansion, ESP QEMU retry fix should avoid repeat transient download failures while split jobs are pending.","result":"No failed checks observed; 35 checks pending."}}
{"run":509,"commit":"1551bfd","metric":0,"metrics":{"pending_checks":27,"split_macos_intel_over15_jobs":0,"split_macos_intel_completed_jobs":1,"split_macos_intel_max_seconds":531},"status":"keep","description":"monitor ESP QEMU retry run with first split job completed","timestamp":1777101068309,"segment":264,"confidence":null,"iterationTokens":1040,"asi":{"hypothesis":"ESP serial target split plus QEMU retry should allow macOS Intel split jobs to complete without failures and below 15m.","result":"No failed checks observed. One macOS Intel split job completed under 15m at 531s; 27 checks pending."}}
{"run":510,"commit":"fbbb56d","metric":0,"metrics":{"pending_checks":24,"split_macos_intel_over15_jobs":0,"split_macos_intel_completed_jobs":1,"split_macos_intel_max_seconds":531},"status":"keep","description":"monitor ESP QEMU retry run with 24 checks pending","timestamp":1777101382000,"segment":264,"confidence":null,"iterationTokens":1080,"asi":{"hypothesis":"Continue monitoring; QEMU retry should prevent setup download failures and split jobs should remain below 15m.","result":"No failed checks observed; 24 checks pending, one split job completed under 15m."}}
{"run":511,"commit":"defbab4","metric":0,"metrics":{"pending_checks":21,"split_macos_intel_over15_jobs":0,"split_macos_intel_completed_jobs":2,"split_macos_intel_max_seconds":818},"status":"keep","description":"monitor ESP QEMU retry run with two split jobs completed","timestamp":1777101695365,"segment":264,"confidence":null,"iterationTokens":1056,"asi":{"hypothesis":"Finish the current monitoring cycle before pausing; split jobs should remain under 15m and no failures should appear.","result":"No failed checks observed; 21 checks pending. Two macOS Intel split jobs completed under 15m, max completed split job is 818s."}}
{"run":512,"commit":"6e019bf","metric":0,"metrics":{"pending_checks":20,"split_macos_intel_over15_jobs":0,"split_macos_intel_completed_jobs":2,"split_macos_intel_max_seconds":818},"status":"keep","description":"resume monitoring ESP QEMU retry run with 20 checks pending","timestamp":1777101739701,"segment":264,"confidence":null,"iterationTokens":3052,"asi":{"hypothesis":"Resume after context-limit stop; ESP QEMU retry plus ESP serial target split should continue without failures and completed macOS Intel split jobs should remain under 15m.","result":"No failed checks observed; 20 checks pending. Two macOS Intel split jobs completed under 15m, max 818s."}}
{"run":513,"commit":"46c9a8c","metric":0,"metrics":{"pending_checks":19,"split_macos_intel_over15_jobs":0,"split_macos_intel_completed_jobs":3,"split_macos_intel_max_seconds":818},"status":"keep","description":"monitor ESP QEMU retry run with three split jobs completed","timestamp":1777102058974,"segment":264,"confidence":null,"iterationTokens":1079,"asi":{"hypothesis":"Continue monitoring until ESP serial target split completes; all completed macOS Intel split jobs should stay below 15m.","result":"No failed checks observed; 19 checks pending. Three macOS Intel split jobs completed under 15m; max remains 818s."}}
{"run":514,"commit":"5045e48","metric":0,"metrics":{"pending_checks":14,"split_macos_intel_over15_jobs":1,"split_macos_intel_completed_jobs":6,"split_macos_intel_max_seconds":933},"status":"keep","description":"monitor ESP QEMU retry run found one completed job just over 15m","timestamp":1777102372595,"segment":264,"confidence":null,"iterationTokens":1072,"asi":{"hypothesis":"The final ESP serial target split should keep completed split jobs below 15m; if one remains just over, inspect which job and whether setup overhead or a specific smoke step dominates.","result":"No failed checks observed; 14 checks pending. Six macOS Intel split jobs completed, one is slightly over 15m at 933s (~15m33s)."}}
{"run":515,"commit":"eb45ea4","metric":0,"metrics":{"pending_checks":11,"split_macos_intel_over15_jobs":1,"split_macos_intel_completed_jobs":7,"split_macos_intel_max_seconds":933},"status":"keep","description":"monitor ESP QEMU retry run with seven split jobs completed","timestamp":1777102709909,"segment":264,"confidence":null,"iterationTokens":6983,"asi":{"hypothesis":"Continue monitoring final ESP serial split; failures should stay zero while pending macOS Intel jobs complete.","result":"No failed checks observed; 11 checks pending. Seven macOS Intel split jobs completed; one remains slightly over 15m at 933s."}}
{"run":516,"commit":"97e2c47","metric":0,"metrics":{"pending_checks":9,"split_macos_intel_over15_jobs":1,"split_macos_intel_completed_jobs":9,"split_macos_intel_max_seconds":933},"status":"keep","description":"monitor ESP QEMU retry run with nine split jobs completed","timestamp":1777103023688,"segment":264,"confidence":null,"iterationTokens":1071,"asi":{"hypothesis":"Continue monitoring; ESP serial and QEMU retry changes should complete without failures, and only the known slightly-over embedded Go 1.21 esp32c3-basic job may remain over target.","result":"No failed checks observed; 9 checks pending. Nine macOS Intel split jobs completed; one over-15 remains at 933s."}}
{"run":517,"commit":"6eddd29","metric":0,"metrics":{"pending_checks":6,"split_macos_intel_over15_jobs":1,"split_macos_intel_completed_jobs":12,"split_macos_intel_max_seconds":933},"status":"keep","description":"monitor ESP QEMU retry run with twelve split jobs completed","timestamp":1777103337081,"segment":264,"confidence":null,"iterationTokens":1104,"asi":{"hypothesis":"Continue monitoring final macOS Intel jobs; only main and host-demo jobs should remain pending while completed split jobs mostly stay below target.","result":"No failed checks observed; 6 checks pending. Twelve macOS Intel split jobs completed; one known embedded Go 1.21 esp32c3-basic job remains just over target at 933s."}}
{"run":518,"commit":"f32cb8c","metric":0,"metrics":{"pending_checks":1,"split_macos_intel_over15_jobs":1,"split_macos_intel_completed_jobs":15,"split_macos_intel_max_seconds":933},"status":"keep","description":"monitor ESP QEMU retry run with one host-demo job pending","timestamp":1777103652537,"segment":264,"confidence":null,"iterationTokens":1080,"asi":{"hypothesis":"Final main macOS Intel jobs should now be far below 15m after moving host and embedded work out; wait for final host-demo job to complete.","result":"No failed checks observed; only one check pending. Main macOS Intel jobs completed in 5m8s and 3m41s. Fifteen split jobs completed; only one known over-15 job remains at 933s."}}
{"run":519,"commit":"cdb1bde","metric":0,"metrics":{"pending_checks":0,"split_macos_intel_over15_jobs":1,"split_macos_intel_completed_jobs":16,"split_macos_intel_max_seconds":933},"status":"keep","description":"monitor ESP QEMU retry run completed with one slightly-over split job","timestamp":1777103852068,"segment":264,"confidence":null,"iterationTokens":1113,"asi":{"hypothesis":"Confirm the full run after ESP serial target split and QEMU retry completes without failures, and measure remaining macOS Intel split durations.","result":"Full PR run completed with zero failures. Sixteen macOS Intel split jobs completed; only llgo-embedded-macos-intel Go 1.21 esp32c3-basic exceeded 15m slightly at 933s (~15m33s). Main macOS Intel jobs are now 5m8s and 3m41s."}}
{"type":"config","name":"Shard slow Go 1.21 esp32c3 embedded demos","metricName":"embedded_demo_shard_total","metricUnit":"","bestDirection":"higher"}
{"run":520,"commit":"0cdcf2e","metric":1,"metrics":{"slow_embedded_demo_seconds_go121_esp32c3":933},"status":"keep","description":"baseline slow Go 1.21 esp32c3 embedded demos are unsharded","timestamp":1777103878215,"segment":265,"confidence":null,"iterationTokens":168,"asi":{"hypothesis":"After all previous splits, the only >15m macOS Intel split job is Go 1.21 esp32c3-basic embedded demos at 15m33s. A coverage-preserving shard of this target should get each job under 15m without changing tested directories."}}
{"run":521,"commit":"9004e28","metric":2,"metrics":{"slow_embedded_demo_seconds_go121_esp32c3":520,"fake_shard0_cases":13,"fake_shard1_cases":12,"fake_sharded_cases":25},"status":"keep","description":"shard slow Go 1.21 esp32c3 embedded demos","timestamp":1777103905568,"segment":265,"confidence":null,"iterationTokens":1758,"asi":{"hypothesis":"Shard only the slow Go 1.21 esp32c3-basic embedded demo job into two modulo shards. This preserves every selected demo case exactly once across shards while reducing per-job runtime below 15m.","result":"Workflow YAML and test_demo.sh syntax pass. Fake llgo validation showed shard 0 runs 13 cases, shard 1 runs 12 cases, 25 total selected esp32c3-basic cases across both shards."}}
{"type":"config","name":"Validate workflows after embedded demo shard","metricName":"workflow_validation_failures","metricUnit":"","bestDirection":"lower"}
{"run":522,"commit":"fe7be4f","metric":0,"metrics":{"workflow_files_checked":8,"action_files_checked":5,"shell_scripts_checked":3,"crosscompile_packages_tested":1},"status":"keep","description":"validate workflows after embedded demo shard","timestamp":1777103931544,"segment":266,"confidence":null,"iterationTokens":265,"asi":{"hypothesis":"Before pushing the targeted Go 1.21 esp32c3 embedded-demo shard, validate workflows, shell syntax, and the recently changed crosscompile retry code.","result":"All workflow/action YAML parsed; test_demo.sh, test-esp-serial-startup.sh, and install-esp-qemu.sh passed bash -n; internal/crosscompile tests passed."}}
{"type":"config","name":"Monitor PR after embedded demo shard push","metricName":"pr_check_failures","metricUnit":"","bestDirection":"lower"}
{"run":523,"commit":"86237dc","metric":0,"metrics":{"pending_checks":41,"split_macos_intel_over15_jobs":0,"split_macos_intel_completed_jobs":0,"split_macos_intel_max_seconds":0},"status":"keep","description":"monitor PR immediately after embedded demo shard push","timestamp":1777103961861,"segment":267,"confidence":null,"iterationTokens":469,"asi":{"hypothesis":"After pushing the targeted Go 1.21 esp32c3 embedded-demo shard, CI should start without immediate failures.","result":"No failed checks observed; 41 checks pending after workflow fan-out."}}
{"run":524,"commit":"039cec0","metric":0,"metrics":{"pending_checks":35,"split_macos_intel_over15_jobs":0,"split_macos_intel_completed_jobs":0,"split_macos_intel_max_seconds":0},"status":"keep","description":"monitor embedded demo shard with 35 checks pending","timestamp":1777104277671,"segment":267,"confidence":null,"iterationTokens":1273,"asi":{"hypothesis":"The new sharded matrix names should appear and run without early failures.","result":"No failed checks observed; 35 checks pending. The sharded Go 1.21 esp32c3-basic matrix leg is visible."}}
