{"run":1089,"commit":"8323f4e","metric":0,"metrics":{"packages_tested":5,"temp_builds":1},"status":"keep","description":"validate cached environment manifest inputs","timestamp":1777229727973,"segment":552,"confidence":null,"iterationTokens":281,"asi":{"hypothesis":"Cached env manifest inputs should preserve per-build semantics, pass focused tests, crosscompile tests, and temp cmd/llgo build without creating a root llgo artifact.","result":"go test ./internal/build, go test ./internal/crosscompile/..., and temp-path go build -tags=dev ./cmd/llgo passed; root llgo was not created."}}
{"type":"config","name":"Record cached environment manifest inputs","metricName":"validation_failures","metricUnit":"","bestDirection":"lower"}
{"run":1090,"commit":"4df773c","metric":0,"metrics":{"ideas_updated":1},"status":"keep","description":"record cached environment manifest inputs","timestamp":1777229749000,"segment":553,"confidence":null,"iterationTokens":182,"asi":{"hypothesis":"Record the kept per-build env manifest section cache so future loops do not repeat smaller env-var-list hoist variants.","result":"Ideas backlog records the 608ns/op to 13ns/op collectEnvInputs improvement and the 10210ns/op to 9503ns/op collect+Build improvement."}}
{"type":"config","name":"Monitor PR after pushing cached env inputs","metricName":"pr_check_failures","metricUnit":"","bestDirection":"lower"}
{"run":1091,"commit":"f1599c3","metric":0,"metrics":{"pending_checks":45,"passed_checks":3,"skipped_checks":0,"llgo_in_pr_diff":0},"status":"keep","description":"monitor PR after pushing cached env inputs","timestamp":1777229811212,"segment":554,"confidence":null,"iterationTokens":451,"asi":{"hypothesis":"After pushing cached env manifest inputs, the new PR run should start without immediate failures and root llgo should remain absent from the diff.","result":"New PR checks: 0 failures, 45 pending, 3 passed, 0 skipped; root llgo absent from PR diff.","next_action_hint":"Poll later for final status; continue local A/B experiments before any further source push."}}
{"type":"config","name":"Cache common manifest inputs per build","metricName":"collect_common_full_ns_op","metricUnit":"","bestDirection":"lower"}
{"run":1092,"commit":"22cc2ea","metric":85,"metrics":{"collect_common_full_bytes_op":176,"collect_common_full_allocs_op":3,"collect_common_full_build_ns_op":14773,"collect_common_full_build_bytes_op":42962,"collect_common_full_build_allocs_op":245,"runs":9},"status":"keep","description":"baseline full common manifest inputs","timestamp":1777229858237,"segment":555,"confidence":null,"iterationTokens":1161,"asi":{"hypothesis":"The whole common manifest section is also per-build constant; caching a copied commonSection once may avoid repeated fmt/tag/flag-copy/extra-file-digest work while avoiding direct aliasing of crosscompile config slices.","result":"Baseline full collectCommonInputs with representative tags/flags median: 85 ns/op, 176 B/op, 3 allocs/op. collectEnv+Common+Build median: 14773 ns/op, 42962 B/op, 245 allocs/op."}}
{"run":1093,"commit":"22cc2ea","metric":16,"metrics":{"collect_common_full_bytes_op":0,"collect_common_full_allocs_op":0,"collect_common_full_build_ns_op":14991,"collect_common_full_build_bytes_op":42753,"collect_common_full_build_allocs_op":242,"runs":9},"status":"discard","description":"cache common manifest inputs per build","timestamp":1777230005028,"segment":555,"confidence":null,"iterationTokens":5563,"asi":{"hypothesis":"Caching a copied commonSection once per build can avoid repeated fmt/tag/flag-copy/extra-file work without directly aliasing crosscompile config slices.","result":"internal/build tests passed and collectCommonInputsFull improved from 85 ns/op, 176 B/op, 3 allocs/op to 16 ns/op, 0 B/op, 0 allocs/op, but collectEnv+Common+Build regressed/noised from 14773 ns/op to 14991 ns/op despite slightly fewer allocations.","rollback_reason":"The primary microbenchmark improved, but the fuller manifest-build workload worsened and the cache adds shared-section aliasing/immutability assumptions; not worth keeping for current YAML-dominated path.","next_action_hint":"Do not cache full commonSection unless ExtraFiles digesting shows up as a real per-package profile hotspot; keep narrower build-tag/env caches."}}
{"type":"config","name":"Record rejected full commonSection cache","metricName":"validation_failures","metricUnit":"","bestDirection":"lower"}
{"run":1094,"commit":"0025c5c","metric":0,"metrics":{"ideas_updated":1},"status":"keep","description":"record rejected full commonSection cache","timestamp":1777230039998,"segment":556,"confidence":null,"iterationTokens":186,"asi":{"hypothesis":"Record the rejected full commonSection cache so future loops do not add shared-section aliasing for a flags-only/full-common microbenchmark win that did not improve full manifest Build.","result":"Ideas backlog records the 85ns->16ns collectCommonInputsFull win, 3->0 alloc reduction, 14773ns->14991ns collectEnv+Common+Build non-improvement, and aliasing-risk rationale."}}
{"type":"config","name":"Monitor PR while cached env CI progresses","metricName":"pr_check_failures","metricUnit":"","bestDirection":"lower"}
{"run":1095,"commit":"a534ec6","metric":0,"metrics":{"pending_checks":41,"passed_checks":16,"skipped_checks":0,"llgo_in_pr_diff":0},"status":"keep","description":"monitor PR while cached env CI progresses","timestamp":1777230065685,"segment":557,"confidence":null,"iterationTokens":447,"asi":{"hypothesis":"The PR run after cached env manifest inputs should continue progressing without failures, and root llgo should stay absent from the diff.","result":"Current PR checks: 0 failures, 41 pending, 16 passed, 0 skipped; root llgo absent from PR diff.","next_action_hint":"Poll later for final status; continue only local A/B experiments before pushing."}}
{"type":"config","name":"Avoid manifestBuilder Build section copies","metricName":"manifest_build_simple_ns_op","metricUnit":"","bestDirection":"lower"}
{"run":1096,"commit":"02e8ccb","metric":8642,"metrics":{"manifest_build_simple_bytes_op":38840,"manifest_build_simple_allocs_op":121,"runs":9},"status":"keep","description":"baseline manifestBuilder Build section copies","timestamp":1777230107117,"segment":558,"confidence":null,"iterationTokens":659,"asi":{"hypothesis":"manifestBuilder.Build copies env/common/package sections into local variables before taking their addresses for yaml.Marshal; pointing manifestData at the builder fields directly might reduce escaping/copy overhead without changing YAML output.","result":"Baseline simple manifest Build median: 8642 ns/op, 38840 B/op, 121 allocs/op across 9 runs."}}
{"run":1097,"commit":"02e8ccb","metric":8543,"metrics":{"manifest_build_simple_bytes_op":38392,"manifest_build_simple_allocs_op":118,"runs":9},"status":"discard","description":"avoid manifestBuilder Build section copies","timestamp":1777230165653,"segment":558,"confidence":null,"iterationTokens":1499,"asi":{"hypothesis":"Pointing manifestData at manifestBuilder fields directly should avoid escaping local section copies and reduce allocations in manifest Build.","result":"internal/build tests passed and simple manifest Build moved from 8642 ns/op, 38840 B/op, 121 allocs/op to 8543 ns/op, 38392 B/op, 118 allocs/op, but wall-time gain is only ~1.1%/~0.1µs and mutates the builder's common BuildTags slice directly instead of a local header.","rollback_reason":"Absolute wall-time improvement is too small for the semantic churn of changing Build to operate directly on builder fields.","next_action_hint":"Do not revisit section-copy removal unless a broader manifest-builder allocation profile shows these three allocations are material."}}
{"type":"config","name":"Record rejected manifest section-copy removal","metricName":"validation_failures","metricUnit":"","bestDirection":"lower"}
{"run":1098,"commit":"a787a1f","metric":0,"metrics":{"ideas_updated":1},"status":"keep","description":"record rejected manifest section-copy removal","timestamp":1777230184196,"segment":559,"confidence":null,"iterationTokens":180,"asi":{"hypothesis":"Record the rejected manifestBuilder section-copy removal so future loops do not trade Build mutation semantics for a ~0.1µs microbenchmark win.","result":"Ideas backlog records the 8642ns->8543ns result, 121->118 allocation reduction, and rejection rationale."}}
{"type":"config","name":"Check clean cmd llgo go-build after env/cache optimizations","metricName":"clean_go_build_ms","metricUnit":"ms","bestDirection":"lower"}
{"run":1099,"commit":"92d1fe9","metric":10070,"metrics":{"runs":3},"status":"keep","description":"check clean cmd/llgo go-build after env/cache optimizations","timestamp":1777230245683,"segment":560,"confidence":null,"iterationTokens":418,"asi":{"hypothesis":"After cached build-tag/env manifest input optimizations, isolated clean go build of cmd/llgo should remain healthy and plausibly in the improved/noise band without creating a root llgo binary.","result":"Three isolated clean go build samples were 11350ms, 9970ms, and 10070ms; median 10070ms. This is below original 10594ms and previous 10170ms health check but remains noisy, so use as a health/plausibility check rather than sole proof. Root llgo was not created."}}
{"type":"config","name":"Monitor PR after clean build env health check","metricName":"pr_check_failures","metricUnit":"","bestDirection":"lower"}
{"run":1100,"commit":"4bedaf5","metric":0,"metrics":{"pending_checks":36,"passed_checks":21,"skipped_checks":0,"llgo_in_pr_diff":0},"status":"keep","description":"monitor PR after clean build env health check","timestamp":1777230267088,"segment":561,"confidence":null,"iterationTokens":448,"asi":{"hypothesis":"The PR run after cached env inputs should continue progressing without failures after the local clean-build health check, and root llgo should stay absent from the PR diff.","result":"Current PR checks: 0 failures, 36 pending, 21 passed, 0 skipped; root llgo absent from PR diff.","next_action_hint":"Poll later for final status; continue local build-performance experiments."}}
{"type":"config","name":"Stack allocate manifestBuilder in collectFingerprint","metricName":"collect_fingerprint_empty_ns_op","metricUnit":"","bestDirection":"lower"}
{"run":1101,"commit":"9db2fd5","metric":9601,"metrics":{"collect_fingerprint_empty_bytes_op":39144,"collect_fingerprint_empty_allocs_op":129,"runs":9},"status":"keep","description":"baseline collectFingerprint empty package","timestamp":1777230311520,"segment":562,"confidence":null,"iterationTokens":725,"asi":{"hypothesis":"collectFingerprint allocates a new manifestBuilder pointer for every package; using a stack local builder may reduce allocation overhead if the builder escapes through newManifestBuilder.","result":"Baseline collectFingerprint for an empty package median: 9601 ns/op, 39144 B/op, 129 allocs/op across 9 runs."}}
{"run":1102,"commit":"9db2fd5","metric":9732,"metrics":{"collect_fingerprint_empty_bytes_op":39144,"collect_fingerprint_empty_allocs_op":129,"runs":9},"status":"discard","description":"stack allocate manifestBuilder in collectFingerprint","timestamp":1777230364353,"segment":562,"confidence":null,"iterationTokens":1561,"asi":{"hypothesis":"Replacing newManifestBuilder() with a local manifestBuilder value in collectFingerprint might avoid a builder heap allocation.","result":"internal/build tests passed, but collectFingerprint empty-package benchmark regressed/noised from 9601 ns/op to 9732 ns/op with unchanged bytes and allocs, so newManifestBuilder was already not a material allocation source.","rollback_reason":"Primary metric worsened with no allocation improvement.","next_action_hint":"Keep newManifestBuilder in collectFingerprint; focus on YAML/digest costs instead."}}
{"type":"config","name":"Record rejected collectFingerprint stack builder","metricName":"validation_failures","metricUnit":"","bestDirection":"lower"}
{"run":1103,"commit":"7c5ec54","metric":0,"metrics":{"ideas_updated":1},"status":"keep","description":"record rejected collectFingerprint stack builder","timestamp":1777230386159,"segment":563,"confidence":null,"iterationTokens":174,"asi":{"hypothesis":"Record the rejected collectFingerprint stack-local manifestBuilder experiment to avoid repeating it.","result":"Ideas backlog records the 9601ns->9732ns regression/noise and unchanged allocations."}}
{"type":"config","name":"Monitor PR after additional local experiments","metricName":"pr_check_failures","metricUnit":"","bestDirection":"lower"}
{"run":1104,"commit":"f5462b0","metric":0,"metrics":{"pending_checks":32,"passed_checks":29,"skipped_checks":0,"llgo_in_pr_diff":0},"status":"keep","description":"monitor PR after additional local experiments","timestamp":1777230420954,"segment":564,"confidence":null,"iterationTokens":446,"asi":{"hypothesis":"The PR run for pushed cached env inputs should keep progressing without failures while local-only experiments remain unpushed, and root llgo should remain absent from diff.","result":"Current PR checks: 0 failures, 32 pending, 29 passed, 0 skipped; root llgo absent from PR diff.","next_action_hint":"Continue local A/B work; poll PR later for completion."}}
{"type":"config","name":"Cache build-cache enabled flag on context","metricName":"try_load_no_fingerprint_ns_op","metricUnit":"","bestDirection":"lower"}
{"run":1105,"commit":"3d21474","metric":12,"metrics":{"try_load_no_fingerprint_bytes_op":0,"try_load_no_fingerprint_allocs_op":0,"cache_enabled_ns_op":11,"cache_enabled_bytes_op":0,"cache_enabled_allocs_op":0,"runs":9},"status":"keep","description":"baseline build cache enabled checks","timestamp":1777230498771,"segment":565,"confidence":null,"iterationTokens":670,"asi":{"hypothesis":"tryLoadFromCache/saveToCache call cacheEnabled for every package; caching the per-build LLGO_BUILD_CACHE result on context might avoid repeated environment checks.","result":"Baseline tryLoadFromCache without fingerprint is already only 12 ns/op and cacheEnabled itself is 11 ns/op with zero allocations, so this path is likely too small before editing."}}
{"type":"config","name":"Record skipped context cacheEnabled experiment","metricName":"validation_failures","metricUnit":"","bestDirection":"lower"}
{"run":1106,"commit":"b36da12","metric":0,"metrics":{"ideas_updated":1},"status":"keep","description":"record skipped context cacheEnabled experiment","timestamp":1777230526469,"segment":566,"confidence":null,"iterationTokens":177,"asi":{"hypothesis":"Record that context-caching cacheEnabled was not worth implementing after baseline measurement showed only ~11ns/op and zero allocations.","result":"Ideas backlog records the ~11ns/op cacheEnabled baseline and ~12ns/op tryLoadFromCache no-fingerprint baseline."}}
{"type":"config","name":"Monitor PR cached env run progress","metricName":"pr_check_failures","metricUnit":"","bestDirection":"lower"}
{"run":1107,"commit":"d01c80a","metric":0,"metrics":{"pending_checks":29,"passed_checks":32,"skipped_checks":0,"llgo_in_pr_diff":0},"status":"keep","description":"monitor PR cached env run progress","timestamp":1777230550585,"segment":567,"confidence":null,"iterationTokens":446,"asi":{"hypothesis":"The pushed cached env inputs PR run should continue progressing without failures; root llgo should remain absent from the diff.","result":"Current PR checks: 0 failures, 29 pending, 32 passed, 0 skipped; root llgo absent from PR diff.","next_action_hint":"Poll later for completion; continue local experiments."}}
{"type":"config","name":"Fast parse simple YAML cache metadata","metricName":"parse_simple_metadata_ns_op","metricUnit":"","bestDirection":"lower"}
{"run":1108,"commit":"66e54cd","metric":3130,"metrics":{"parse_simple_metadata_bytes_op":8104,"parse_simple_metadata_allocs_op":65,"runs":9},"status":"keep","description":"baseline simple YAML metadata parse","timestamp":1777230626102,"segment":568,"confidence":null,"iterationTokens":627,"asi":{"hypothesis":"Cache-hit metadata blocks often contain only simple booleans (need_rt/need_py_init); parseManifestMetadata currently unmarshals YAML even for this simple generated shape. A narrow fast parser with YAML fallback may speed cache hits without changing manifest format.","result":"Baseline parseManifestMetadata for a simple boolean metadata block median: 3130 ns/op, 8104 B/op, 65 allocs/op across 9 runs."}}
{"run":1109,"commit":"fc9a8e2","metric":138,"metrics":{"parse_simple_metadata_bytes_op":64,"parse_simple_metadata_allocs_op":2,"runs":9},"status":"keep","description":"fast parse simple YAML cache metadata","timestamp":1777230721385,"segment":568,"confidence":null,"iterationTokens":3845,"asi":{"hypothesis":"A narrow parser for generated metadata blocks containing only need_rt/need_py_init booleans can avoid YAML unmarshal on common cache-hit metadata, while falling back to YAML for link_args or complex scalars to preserve semantics.","result":"internal/build tests passed. Simple boolean metadata parse improved from 3130 ns/op, 8104 B/op, 65 allocs/op to 138 ns/op, 64 B/op, 2 allocs/op.","next_action_hint":"Validate broader tests and temp cmd/llgo build before pushing; consider whether the 2 allocations can be removed only if not adding complexity."}}
{"type":"config","name":"Validate fast simple metadata parser","metricName":"validation_failures","metricUnit":"","bestDirection":"lower"}
{"run":1110,"commit":"fc9a8e2","metric":1,"metrics":{"packages_tested":5,"temp_builds":1},"status":"crash","description":"validate fast simple metadata parser","timestamp":1777230781155,"segment":569,"confidence":null,"iterationTokens":259,"asi":{"hypothesis":"Fast simple metadata parser should pass build/crosscompile tests and temp cmd/llgo build.","result":"go test ./internal/build, go test ./internal/crosscompile/..., and temp cmd/llgo build passed, but the final Python validation assertion looked for the literal token 'link_args' in collect.go and failed because the implementation comment uses 'Link args'; this is a harness assertion bug, not a source failure.","rollback_reason":"Harness assertion checked the wrong literal after tests/build passed.","next_action_hint":"Retry validation with an assertion for parseSimpleManifestMetadata and 'NeedPyInit' or use collect_test.go for link_args fallback coverage."}}
{"run":1111,"commit":"4726138","metric":0,"metrics":{"packages_tested":5,"temp_builds":1},"status":"keep","description":"validate fast simple metadata parser","timestamp":1777230802797,"segment":569,"confidence":null,"iterationTokens":1580,"asi":{"hypothesis":"Fast simple metadata parser should preserve YAML fallback for link_args, pass build/crosscompile tests, and build cmd/llgo without producing root llgo.","result":"go test ./internal/build, go test ./internal/crosscompile/..., and temp-path go build -tags=dev ./cmd/llgo passed; root llgo was not created. Validation also confirmed collect_test covers link_args fallback to YAML parser."}}
{"type":"config","name":"Record fast simple metadata parser","metricName":"validation_failures","metricUnit":"","bestDirection":"lower"}
{"run":1112,"commit":"2372ff5","metric":0,"metrics":{"ideas_updated":1},"status":"keep","description":"record fast simple metadata parser","timestamp":1777230833764,"segment":570,"confidence":null,"iterationTokens":176,"asi":{"hypothesis":"Record the kept fast simple metadata parser and its YAML fallback scope in ideas backlog.","result":"Ideas backlog records the simple need_rt/need_py_init metadata parser improvement from 3130ns/op to 138ns/op and the link_args/complex YAML fallback."}}
{"type":"config","name":"Monitor PR after pushing fast metadata parser","metricName":"pr_check_failures","metricUnit":"","bestDirection":"lower"}
{"run":1113,"commit":"dc654d0","metric":0,"metrics":{"pending_checks":17,"passed_checks":2,"skipped_checks":0,"llgo_in_pr_diff":0},"status":"keep","description":"monitor PR after pushing fast metadata parser","timestamp":1777230904482,"segment":571,"confidence":null,"iterationTokens":451,"asi":{"hypothesis":"After pushing the fast simple metadata parser, the new PR run should start without immediate failures and root llgo should remain absent from the diff.","result":"New PR checks: 0 failures, 17 pending, 2 passed, 0 skipped; root llgo absent from PR diff.","next_action_hint":"Poll later for completion; continue local A/B experiments before any further source push."}}
{"type":"config","name":"Delay metadata allocation in parseManifestMetadata simple path","metricName":"parse_simple_metadata_ns_op","metricUnit":"","bestDirection":"lower"}
{"run":1114,"commit":"fe3ef53","metric":134,"metrics":{"parse_simple_metadata_bytes_op":64,"parse_simple_metadata_allocs_op":2,"runs":9},"status":"keep","description":"baseline simple metadata allocation follow-up","timestamp":1777230941712,"segment":572,"confidence":null,"iterationTokens":630,"asi":{"hypothesis":"parseManifestMetadata currently allocates an empty meta before checking the simple metadata fast path; delaying that allocation may reduce simple metadata parsing from two allocations to one.","result":"Current baseline after fast parser: 134 ns/op, 64 B/op, 2 allocs/op across 9 runs."}}
