{"run":808,"commit":"e44c7e5","metric":257.9,"metrics":{"compile_config_groups":8,"compile_config_files":128,"runs":3},"status":"keep","description":"baseline sequential CompileConfig archive creation","timestamp":1777200727492,"segment":369,"confidence":null,"iterationTokens":650,"asi":{"hypothesis":"CompileConfig compiles groups using a shared worker pool but still archives groups sequentially. Establish an 8-group/128-file baseline before trying parallel archive creation with independent llvm-ar subprocesses.","result":"3-run median was 257.9ms (runs 263.8, 257.9, 257.6)."}}
{"run":809,"commit":"6876bb2","metric":215.7,"metrics":{"compile_config_groups":8,"compile_config_files":128,"runs":3},"status":"keep","description":"parallelize CompileConfig archive creation","timestamp":1777200768401,"segment":369,"confidence":null,"iterationTokens":3898,"asi":{"hypothesis":"After source files are compiled, archive creation for independent CompileConfig groups can run in parallel using separate llvm-ar subprocesses while preserving deterministic error selection and linker flag order.","result":"compile package tests passed. 8-group/128-file CompileConfig benchmark improved from 257.9ms to 215.7ms (runs 215.7, 217.0, 204.7)."}}
{"type":"config","name":"Validate parallel CompileConfig archive creation","metricName":"validation_failures","metricUnit":"","bestDirection":"lower"}
{"run":810,"commit":"1f3016f","metric":0,"metrics":{"crosscompile_packages_tested":4,"cmd_llgo_build":1,"ideas_updated":1},"status":"keep","description":"local validation for parallel CompileConfig archives","timestamp":1777200838493,"segment":370,"confidence":null,"iterationTokens":281,"asi":{"hypothesis":"Before pushing parallel archive creation, run relevant crosscompile tests including sequential override, build cmd/llgo to a temp path to avoid root binary, and update the ideas backlog as requested.","result":"go test ./internal/crosscompile/... passed, LLGO_COMPILE_JOBS=1 compile package tests passed, go build -o temp -tags=dev ./cmd/llgo passed, no root llgo was created, and ideas backlog records the 257.9ms-to-215.7ms benchmark."}}
{"type":"config","name":"Monitor PR after locally validated parallel archive push","metricName":"pr_check_failures","metricUnit":"","bestDirection":"lower"}
{"run":811,"commit":"88f5a64","metric":0,"metrics":{"pending_checks":14,"passed_checks":1,"skipped_checks":0,"llgo_in_pr_diff":0},"status":"keep","description":"monitor PR after parallel archive push","timestamp":1777200888682,"segment":371,"confidence":null,"iterationTokens":475,"asi":{"hypothesis":"After local validation and a clear 8-group benchmark improvement, pushing parallel archive creation should not show immediate PR failures or reintroduce the root llgo binary.","result":"No failed PR checks immediately after push; 1 passed, 14 pending, and gh pr diff does not include llgo."}}
{"type":"config","name":"Optimize multi-group CompileConfig compiler lookup","metricName":"compile_config_ms","metricUnit":"ms","bestDirection":"lower"}
{"run":812,"commit":"47f79a7","metric":222.4,"metrics":{"compile_config_groups":8,"compile_config_files":128,"runs":5},"status":"keep","description":"baseline multi-group compiler lookup map","timestamp":1777200940658,"segment":372,"confidence":null,"iterationTokens":651,"asi":{"hypothesis":"Multi-group CompileConfig workers currently keep per-worker clang.Cmd instances in a map keyed by group index. Establish a current 8-group/128-file baseline before replacing that map with an index-addressed slice.","result":"5-run median was 222.4ms (runs 226.3, 222.4, 222.4, 229.3, 215.1)."}}
{"run":813,"commit":"24a4acb","metric":219.2,"metrics":{"compile_config_groups":8,"compile_config_files":128,"runs":5},"status":"keep","description":"use slice for per-worker multi-group compilers","timestamp":1777200963930,"segment":372,"confidence":null,"iterationTokens":1381,"asi":{"hypothesis":"Group indexes are dense, so a per-worker slice of clang.Cmd pointers should avoid map lookup/allocation overhead in multi-group CompileConfig workers without changing concurrency or ordering.","result":"compile package tests passed. 8-group/128-file benchmark improved from 222.4ms to 219.2ms over 5 runs, a small improvement within some noise but directionally plausible."}}
{"run":814,"commit":"76fac0b","metric":215.8,"metrics":{"compile_config_groups":8,"compile_config_files":128,"runs":9},"status":"keep","description":"confirm slice compiler lookup benchmark","timestamp":1777200983800,"segment":372,"confidence":2.062499999999987,"iterationTokens":1228,"asi":{"hypothesis":"The map-to-slice compiler lookup change was a small 1.4% win in the first sample; rerun with 9 samples to determine whether it is clear enough to keep before any CI push.","result":"9-run median was 215.8ms (runs 220.0, 215.2, 214.8, 215.5, 215.4, 218.6, 216.1, 215.8, 217.6), 3.0% below the 222.4ms 5-run baseline. This is still a modest optimization but more consistent than the first sample."}}
{"type":"config","name":"Validate slice compiler lookup change","metricName":"validation_failures","metricUnit":"","bestDirection":"lower"}
{"run":815,"commit":"b4c9a1e","metric":0,"metrics":{"crosscompile_packages_tested":4,"cmd_llgo_build":1,"ideas_updated":1},"status":"keep","description":"local validation for slice compiler lookup change","timestamp":1777201054164,"segment":373,"confidence":null,"iterationTokens":286,"asi":{"hypothesis":"Before pushing the modest but confirmed map-to-slice compiler lookup optimization, run relevant crosscompile tests, sequential override tests, a temp-path cmd/llgo build, and update notes.","result":"go test ./internal/crosscompile/... passed, LLGO_COMPILE_JOBS=1 compile package tests passed, go build -o temp -tags=dev ./cmd/llgo passed without creating root llgo, and ideas backlog records the 222.4ms-to-215.8ms confirmed result."}}
{"type":"config","name":"Monitor PR after slice compiler lookup push","metricName":"pr_check_failures","metricUnit":"","bestDirection":"lower"}
{"run":816,"commit":"692ee6c","metric":0,"metrics":{"pending_checks":11,"passed_checks":0,"skipped_checks":0,"llgo_in_pr_diff":0},"status":"keep","description":"monitor PR after slice compiler lookup push","timestamp":1777201119930,"segment":374,"confidence":null,"iterationTokens":474,"asi":{"hypothesis":"After local validation and a confirmed multi-group benchmark improvement, pushing the slice compiler lookup change should not show immediate PR failures or reintroduce the root llgo binary.","result":"No failed PR checks immediately after push; 11 pending, and gh pr diff does not include llgo."}}
{"type":"config","name":"Optimize CompileConfig skipped group setup","metricName":"compile_skip_us","metricUnit":"µs","bestDirection":"lower"}
{"run":817,"commit":"fea4e6a","metric":2483.2,"metrics":{"compile_skip_groups":1000,"runs":9},"status":"keep","description":"baseline skipped CompileConfig group setup","timestamp":1777201184830,"segment":375,"confidence":null,"iterationTokens":602,"asi":{"hypothesis":"CompileConfig currently builds compiler configs and output slices before checking whether an archive group is already compiled. Establish a skipped-group benchmark before moving the IsCompiled check earlier.","result":"1000 pre-existing archive groups skipped in 2483.2µs median over 9 runs, with substantial filesystem noise."}}
{"run":818,"commit":"fea4e6a","metric":2539,"metrics":{"compile_skip_groups":1000,"runs":9},"status":"discard","description":"check IsCompiled before compiler config setup","timestamp":1777201212657,"segment":375,"confidence":null,"iterationTokens":1219,"asi":{"hypothesis":"For pre-existing archive groups, check IsCompiled before building group compiler configs and object slices to reduce cache-hit/skip overhead.","result":"compile package tests passed, but 1000-group skip benchmark regressed/noised from 2483.2µs to 2539.0µs median. Filesystem stat noise dominates and the source change is not worth keeping.","rollback_reason":"Primary metric did not improve; avoid adding churn for a non-measurable skip-path optimization.","next_action_hint":"Only revisit skipped-group setup if a larger real cache-hit workload shows this path is material."}}
{"type":"config","name":"Monitor PR after slice lookup CI starts","metricName":"pr_check_failures","metricUnit":"","bestDirection":"lower"}
{"run":819,"commit":"3336593","metric":0,"metrics":{"pending_checks":46,"passed_checks":11,"skipped_checks":0,"llgo_in_pr_diff":0},"status":"keep","description":"monitor PR after slice lookup CI starts","timestamp":1777201240516,"segment":376,"confidence":null,"iterationTokens":460,"asi":{"hypothesis":"The latest locally validated slice-lookup and parallel-archive changes should continue to show no CI failures as checks start running, and the accidental llgo binary should remain out of the PR diff.","result":"No failed PR checks; 11 passed, 46 pending, and gh pr diff does not include llgo."}}
{"type":"config","name":"Precompute llvm-ar path for CompileConfig archives","metricName":"compile_config_ms","metricUnit":"ms","bestDirection":"lower"}
{"run":820,"commit":"f0b8225","metric":218.2,"metrics":{"compile_config_groups":8,"compile_config_files":128,"runs":5},"status":"keep","description":"baseline archive llvm-ar path setup","timestamp":1777201279056,"segment":377,"confidence":null,"iterationTokens":653,"asi":{"hypothesis":"Each archiveObjects call recomputes the llvm-ar path from options.CC. Establish a current 8-group/128-file baseline before precomputing that path once per CompileConfig archive phase.","result":"5-run median was 218.2ms (runs 224.8, 218.2, 209.4, 214.5, 226.3)."}}
{"run":821,"commit":"782ed0b","metric":213.3,"metrics":{"compile_config_groups":8,"compile_config_files":128,"runs":5},"status":"keep","description":"precompute llvm-ar path once per archive phase","timestamp":1777201310285,"segment":377,"confidence":null,"iterationTokens":1638,"asi":{"hypothesis":"Precomputing the llvm-ar path once in archiveGroups avoids repeated filepath.Dir/Join work for multi-group archive phases without changing subprocess behavior.","result":"compile package tests passed. 8-group/128-file benchmark improved from 218.2ms to 213.3ms over 5 runs, but run variance is still notable."}}
{"run":822,"commit":"c19143d","metric":209.7,"metrics":{"compile_config_groups":8,"compile_config_files":128,"runs":9},"status":"keep","description":"confirm precomputed llvm-ar path benchmark","timestamp":1777201333580,"segment":377,"confidence":2.361111111111096,"iterationTokens":1080,"asi":{"hypothesis":"The first llvm-ar path precompute sample was a modest win with variance; rerun with 9 samples before considering a push.","result":"9-run median was 209.7ms (runs 211.5, 206.2, 205.6, 224.5, 199.6, 212.2, 209.7, 214.5, 208.2), 3.9% below the 218.2ms baseline. Improvement appears modest but repeatable in this synthetic multi-group archive workload."}}
{"type":"config","name":"Validate precomputed llvm-ar path change","metricName":"validation_failures","metricUnit":"","bestDirection":"lower"}
{"run":823,"commit":"f29ffc0","metric":0,"metrics":{"crosscompile_packages_tested":4,"cmd_llgo_build":1,"ideas_updated":1},"status":"keep","description":"local validation for precomputed llvm-ar path","timestamp":1777201397050,"segment":378,"confidence":null,"iterationTokens":284,"asi":{"hypothesis":"Before pushing the modest but confirmed llvm-ar path precompute optimization, run relevant crosscompile tests, sequential override tests, a temp-path cmd/llgo build, and update notes.","result":"go test ./internal/crosscompile/... passed, LLGO_COMPILE_JOBS=1 compile package tests passed, go build -o temp -tags=dev ./cmd/llgo passed without creating root llgo, and ideas backlog records the 218.2ms-to-209.7ms confirmed result."}}
{"type":"config","name":"Monitor PR after llvm-ar path precompute push","metricName":"pr_check_failures","metricUnit":"","bestDirection":"lower"}
{"run":824,"commit":"7a28a1e","metric":0,"metrics":{"pending_checks":10,"passed_checks":1,"skipped_checks":0,"llgo_in_pr_diff":0},"status":"keep","description":"monitor PR after llvm-ar path precompute push","timestamp":1777201445024,"segment":379,"confidence":null,"iterationTokens":462,"asi":{"hypothesis":"After local validation and confirmed multi-group archive benchmark improvement, pushing the llvm-ar path precompute should not show immediate PR failures or reintroduce the root llgo binary.","result":"No failed PR checks immediately after push; 1 passed, 10 pending, and gh pr diff does not include llgo."}}
{"type":"config","name":"Precompute CompileGroup object paths","metricName":"compile_group_ms","metricUnit":"ms","bestDirection":"lower"}
{"run":825,"commit":"60bf680","metric":203.9,"metrics":{"compile_group_files":128,"runs":7},"status":"keep","description":"baseline CompileGroup object path construction","timestamp":1777201480007,"segment":380,"confidence":null,"iterationTokens":590,"asi":{"hypothesis":"compileOneFile constructs each object path in worker goroutines with filepath.Join and strconv.Itoa. Establish a 128-file single-group baseline before precomputing object paths when the temp directory is created.","result":"7-run median was 203.9ms (runs 210.9, 205.1, 208.0, 203.9, 202.5, 198.3, 199.3)."}}
{"run":826,"commit":"60bf680","metric":208.1,"metrics":{"compile_group_files":128,"runs":7},"status":"discard","description":"precompute object paths outside compile workers","timestamp":1777201516283,"segment":380,"confidence":null,"iterationTokens":1874,"asi":{"hypothesis":"Precomputing each object path when creating the group temp directory should remove filepath.Join/strconv.Itoa work from compile worker goroutines.","result":"compile package tests passed, but 128-file benchmark regressed from 203.9ms to 208.1ms. Moving path construction earlier did not improve the subprocess-dominated workload and may worsen cache/locality/noise.","rollback_reason":"Primary metric worsened; keep current worker-local object path construction.","next_action_hint":"Do not revisit object path precomputation unless a no-op compiler benchmark shows path construction is material."}}
{"type":"config","name":"Monitor PR after llvm-ar path CI progresses","metricName":"pr_check_failures","metricUnit":"","bestDirection":"lower"}
{"run":827,"commit":"b7804f8","metric":0,"metrics":{"pending_checks":47,"passed_checks":10,"skipped_checks":0,"llgo_in_pr_diff":0},"status":"keep","description":"monitor PR while llvm-ar path CI progresses","timestamp":1777201545452,"segment":381,"confidence":null,"iterationTokens":461,"asi":{"hypothesis":"The latest locally validated archive/lookup changes should remain CI-failure-free as checks progress, and the root llgo binary should remain absent from the PR diff.","result":"No failed PR checks; 10 passed, 47 pending, and gh pr diff does not include llgo."}}
{"type":"config","name":"Optimize llvm-ar archive mode","metricName":"archive_ms","metricUnit":"ms","bestDirection":"lower"}
{"run":828,"commit":"07e0296","metric":8.561,"metrics":{"archive_bench_runs":7,"archive_min_ms":8.231,"archive_max_ms":8.983},"status":"keep","description":"baseline llvm-ar rcs archive mode","timestamp":1777201585953,"segment":382,"confidence":null,"iterationTokens":699,"asi":{"hypothesis":"archiveObjects uses llvm-ar rcs even though archives are newly created after IsCompiled checks. Establish an isolated archive benchmark before trying quick-append mode.","result":"Temporary in-package archive benchmark median was 8.561ms/op over 7 runs for a 128-object archive."}}
{"run":829,"commit":"05a358e","metric":8.436,"metrics":{"archive_bench_runs":7,"archive_min_ms":8.324,"archive_max_ms":8.974},"status":"keep","description":"try llvm-ar qcs quick append archive mode","timestamp":1777201643414,"segment":382,"confidence":null,"iterationTokens":1412,"asi":{"hypothesis":"Because archives are created only when not already compiled, llvm-ar qcs quick append should avoid replacement work versus rcs while still creating an archive and symbol table.","result":"compile package tests passed. Archive microbenchmark improved only from 8.561ms to 8.436ms (~1.5%) and used a slightly different benchmark setup with real objects, so evidence is weak; needs a paired compile-config benchmark before keeping."}}
{"type":"config","name":"Validate llvm-ar qcs on CompileConfig workload","metricName":"compile_config_ms","metricUnit":"ms","bestDirection":"lower"}
{"run":830,"commit":"05a358e","metric":210.8,"metrics":{"compile_config_groups":8,"compile_config_files":128,"runs":9},"status":"discard","description":"validate llvm-ar qcs on CompileConfig workload","timestamp":1777201675293,"segment":383,"confidence":null,"iterationTokens":650,"asi":{"hypothesis":"If llvm-ar qcs is meaningfully faster than rcs, the end-to-end 8-group CompileConfig workload should improve beyond the 209.7ms confirmed rcs/precomputed-ar baseline.","result":"9-run CompileConfig median was 210.8ms, slightly worse than the 209.7ms confirmed rcs/precomputed-ar baseline. The isolated archive microbenchmark win was too small/noisy and qcs changes archive mode semantics.","rollback_reason":"No end-to-end improvement and semantic churn is not justified.","next_action_hint":"Keep llvm-ar rcs. Do not revisit archive mode unless a real target archive benchmark shows a clear win and identical archive behavior is proven."}}
{"type":"config","name":"Record rejected llvm-ar qcs idea","metricName":"validation_failures","metricUnit":"","bestDirection":"lower"}
{"run":831,"commit":"1c06831","metric":0,"metrics":{"ideas_updated":1},"status":"keep","description":"record rejected llvm-ar qcs idea","timestamp":1777201705771,"segment":384,"confidence":null,"iterationTokens":179,"asi":{"hypothesis":"Record the rejected qcs archive-mode experiment so future iterations keep rcs unless real target archive benchmarks prove otherwise.","result":"Ideas backlog now notes qcs was rejected due no end-to-end improvement and semantic churn."}}
{"type":"config","name":"Restore llvm-ar rcs after qcs validation failed","metricName":"compile_config_ms","metricUnit":"ms","bestDirection":"lower"}
{"run":832,"commit":"fa08bcd","metric":211.1,"metrics":{"compile_config_groups":8,"compile_config_files":128,"runs":5},"status":"keep","description":"restore llvm-ar rcs after qcs failed validation","timestamp":1777201764172,"segment":385,"confidence":null,"iterationTokens":678,"asi":{"hypothesis":"Because qcs did not improve the end-to-end CompileConfig workload and changes archive-mode semantics, restore the prior llvm-ar rcs mode while keeping the validated precomputed llvm-ar path optimization.","result":"compile package tests passed. 5-run rcs restoration median was 211.1ms, in line with the prior 209.7ms rcs/precomputed-ar confirmation and avoiding qcs semantic churn."}}
{"type":"config","name":"Optimize monitor target resolution dependency","metricName":"go_build_ms","metricUnit":"ms","bestDirection":"lower"}
{"run":833,"commit":"11d29b4","metric":10647.2,"metrics":{"go_build_min_ms":10591.4,"go_build_max_ms":10667.8,"runs":3},"status":"keep","description":"baseline go build before monitor target resolution split","timestamp":1777201867867,"segment":386,"confidence":null,"iterationTokens":402,"asi":{"hypothesis":"cmd/internal/monitor imports internal/crosscompile just to resolve target serial ports, which can force extra dependencies and even ESP clang lookup. Establish a clean cmd/llgo build baseline before resolving monitor targets directly via internal/targets.","result":"Median clean go build -o /dev/null -a -tags=dev ./cmd/llgo was 10647.2ms over 3 runs."}}
{"run":834,"commit":"11d29b4","metric":10678.2,"metrics":{"go_build_min_ms":10634.5,"go_build_max_ms":10775.2,"runs":3,"monitor_tests":1},"status":"discard","description":"resolve monitor target serial ports without crosscompile.UseTarget","timestamp":1777201973602,"segment":386,"confidence":null,"iterationTokens":3439,"asi":{"hypothesis":"cmd/internal/monitor only needs target serial-port metadata; resolving targets directly via internal/targets avoids crosscompile.UseTarget and its ESP clang lookup, possibly reducing cmd/llgo build dependencies and improving monitor startup behavior.","result":"monitor helper tests and cmd/llgo package build passed, but clean go build median regressed from 10647.2ms to 10678.2ms. The behavior improvement is plausible but outside the current primary metric and not worth changing command behavior in this loop.","rollback_reason":"Primary metric worsened and the change alters target validation/side effects of llgo monitor; not justified for pure go build efficiency.","next_action_hint":"If monitor startup behavior becomes a target, revisit with explicit functional tests and a monitor-specific benchmark. For current go build target, do not pursue."}}
{"type":"config","name":"Record rejected monitor dependency experiment","metricName":"validation_failures","metricUnit":"","bestDirection":"lower"}
{"run":835,"commit":"3e0eb4e","metric":0,"metrics":{"ideas_updated":1},"status":"keep","description":"record rejected monitor dependency experiment","timestamp":1777202009880,"segment":387,"confidence":null,"iterationTokens":172,"asi":{"hypothesis":"Record the rejected monitor target-resolution dependency experiment so future go-build work does not repeat it unless the target changes to monitor startup behavior.","result":"Ideas backlog now notes the monitor dependency experiment regressed go-build from 10647.2ms to 10678.2ms and changed monitor behavior, so it is out of scope for current target."}}
{"type":"config","name":"Monitor PR after local dependency experiment reverted","metricName":"pr_check_failures","metricUnit":"","bestDirection":"lower"}
