{"run":91,"commit":"63644c3","metric":1,"metrics":{"collect_test_files":1,"focused_test_seconds":1.8},"status":"keep","description":"add lightweight cross-context LLVM version cache test","timestamp":1777041507012,"segment":27,"confidence":null,"iterationTokens":1734,"asi":{"hypothesis":"Injecting the LLVM version detector lets us directly test cross-context cache behavior without spawning subprocess helpers, improving coverage of the cache optimization with minimal test overhead.","result":"Focused TestGetLLVMVersion tests passed and explicit cache coverage count increased from 0 to 1."}}
{"type":"config","name":"Validate internal build after LLVM cache test","metricName":"internal_build_failures","metricUnit":"","bestDirection":"lower"}
{"run":92,"commit":"86e1576","metric":0,"metrics":{"internal_build_s":22.495},"status":"keep","description":"validate full internal/build after LLVM cache test injection","timestamp":1777041574217,"segment":28,"confidence":null,"iterationTokens":118,"asi":{"hypothesis":"Run the full internal/build test package to ensure the injected LLVM version detector test and cache changes do not regress existing build tests.","result":"internal/build passed."}}
{"type":"config","name":"Remove unused singleton LLVM matrix dimensions","metricName":"singleton_llvm_matrix_dims","metricUnit":"","bestDirection":"lower"}
{"run":93,"commit":"9408c3e","metric":7,"metrics":{"workflow_files_checked":8},"status":"keep","description":"baseline singleton LLVM matrix dimensions in workflows","timestamp":1777041631146,"segment":29,"confidence":null,"iterationTokens":159,"asi":{"hypothesis":"Several workflows define a matrix dimension llvm: [19] with only one value. Since it does not multiply coverage, replacing matrix.llvm with a literal can reduce workflow matrix complexity without reducing executed jobs."}}
{"run":94,"commit":"bf43629","metric":0,"metrics":{"workflow_files_checked":8},"status":"keep","description":"replace singleton LLVM matrix dimensions with literal LLVM version","timestamp":1777041675545,"segment":29,"confidence":null,"iterationTokens":860,"asi":{"hypothesis":"Replacing llvm: [19] singleton matrix dimensions with literal llvm-version: 19 preserves the same LLVM version and job coverage while simplifying workflow matrices and job expansion.","result":"singleton_llvm_matrix_dims dropped from 7 to 0 and workflow YAML parsed successfully."}}
{"type":"config","name":"Preserve CI check names while optimizing","metricName":"removed_llvm_matrix_dims","metricUnit":"","bestDirection":"lower"}
{"run":95,"commit":"f1d5b58","metric":7,"metrics":{"workflow_files_checked":8},"status":"keep","description":"baseline removed singleton LLVM matrix dimensions that may alter check names","timestamp":1777041730690,"segment":30,"confidence":null,"iterationTokens":179,"asi":{"hypothesis":"Although removing singleton llvm matrix dimensions simplifies workflows, it can change GitHub check names on an active PR and risk branch protection/status expectations. Count removed dimensions as a compatibility risk to reduce."}}
{"run":96,"commit":"95200b7","metric":0,"metrics":{"workflow_files_checked":8},"status":"keep","description":"restore singleton LLVM matrices to preserve existing check names","timestamp":1777041878867,"segment":30,"confidence":null,"iterationTokens":2986,"asi":{"hypothesis":"Restoring llvm: [19] singleton matrices preserves the existing GitHub Actions check names on the active PR while retaining all functional optimizations; this avoids risking branch-protection/status-name churn for negligible matrix simplification benefit.","result":"removed_llvm_matrix_dims dropped from 7 to 0 and workflow YAML parsed successfully."}}
{"type":"config","name":"Add lightweight pkg-config cache coverage","metricName":"pkg_config_cache_tests","metricUnit":"","bestDirection":"higher"}
{"run":97,"commit":"7bc5bad","metric":0,"metrics":{"cgo_test_files":1},"status":"keep","description":"baseline no explicit pkg-config cache unit coverage","timestamp":1777041927822,"segment":31,"confidence":null,"iterationTokens":144,"asi":{"hypothesis":"The pkg-config cgo flag cache optimization lacks direct unit coverage. Baseline count of explicit pkg-config cache tests is zero."}}
{"run":98,"commit":"a06d636","metric":1,"metrics":{"cgo_test_files":1,"focused_test_seconds":1.4},"status":"keep","description":"add lightweight pkg-config cache reuse unit test","timestamp":1777042012958,"segment":31,"confidence":null,"iterationTokens":1885,"asi":{"hypothesis":"Injecting pkg-config command output lets us directly test that repeated #cgo pkg-config directives reuse cached cflags/ldflags without spawning subprocesses, increasing coverage of the cache optimization without weakening existing tests.","result":"Focused pkg-config cache test passed and explicit cache test count increased from 0 to 1."}}
{"type":"config","name":"Validate internal build after cache coverage tests","metricName":"internal_build_failures","metricUnit":"","bestDirection":"lower"}
{"run":99,"commit":"5ad7a3c","metric":0,"metrics":{"internal_build_s":22.79},"status":"keep","description":"validate full internal/build after cache coverage tests","timestamp":1777042064445,"segment":32,"confidence":null,"iterationTokens":118,"asi":{"hypothesis":"Run full internal/build tests after adding injectable pkg-config and LLVM cache unit tests to ensure no regression in build package behavior.","result":"internal/build passed."}}
{"type":"config","name":"Enable parallel demo tests in CI","metricName":"llgo_demo_jobs","metricUnit":"","bestDirection":"higher"}
{"run":100,"commit":"20a736d","metric":1,"metrics":{"host_demo_invocations":1},"status":"keep","description":"baseline llgo workflow host demo job parallelism","timestamp":1777042208234,"segment":33,"confidence":null,"iterationTokens":157,"asi":{"hypothesis":"The demo test script supports LLGO_DEMO_JOBS parallelism, but the LLGo workflow host demo step currently runs it sequentially. Increasing jobs can preserve coverage while reducing CI wall time."}}
{"run":101,"commit":"fb8cea9","metric":4,"metrics":{"host_demo_invocations":1},"status":"keep","description":"run host demo tests with four parallel jobs in LLGo workflow","timestamp":1777042248874,"segment":33,"confidence":null,"iterationTokens":459,"asi":{"hypothesis":"Using LLGO_DEMO_JOBS=4 in the host demo step exercises the same demo set while overlapping independent llgo run invocations; the script already aggregates failures and logs, so coverage is preserved.","result":"Static workflow check confirms host demo parallelism increased from 1 to 4 and YAML parses."}}
{"type":"config","name":"Optimize optional torch dependency probe","metricName":"torch_probe_ms","metricUnit":"ms","bestDirection":"lower"}
{"run":102,"commit":"b54dacd","metric":24.6,"metrics":{"probe_runs":3},"status":"keep","description":"baseline optional torch dependency probe using import torch","timestamp":1777042332819,"segment":34,"confidence":null,"iterationTokens":186,"asi":{"hypothesis":"test_demo.sh probes optional torch support by importing torch, which may be slow when torch is installed. Measure local probe cost before considering a faster availability check."}}
{"run":103,"commit":"b54dacd","metric":16.7,"metrics":{"probe_runs":3},"status":"discard","description":"use importlib.find_spec for optional torch demo probe","timestamp":1777042384673,"segment":34,"confidence":null,"iterationTokens":556,"asi":{"hypothesis":"Checking importlib.util.find_spec('torch') avoids importing torch just to decide whether to skip the optional tensor demo, reducing demo setup overhead while still detecting installation presence.","result":"Local probe improved from 24.6ms to 16.7ms, but this weakens the probe: a broken torch installation would now run the demo and fail instead of being skipped as missing optional dependency.","rollback_reason":"Potential semantic/coverage change for broken optional dependency environments is not worth the small local speedup.","next_action_hint":"Keep import torch probe unless CI setup time shows torch import is a major bottleneck and broken-install behavior is acceptable."}}
{"type":"config","name":"Make demo parallel runner portable to macOS bash","metricName":"portable_parallel_demo_jobs","metricUnit":"","bestDirection":"higher"}
{"run":104,"commit":"8e4c282","metric":1,"metrics":{"requested_demo_jobs":4},"status":"keep","description":"baseline macOS demo parallelism falls back to sequential bash","timestamp":1777042487165,"segment":35,"confidence":null,"iterationTokens":183,"asi":{"hypothesis":"On macOS, /bin/bash is often 3.2 and lacks wait -n -p, so the demo script falls back to jobs=1 even when CI requests LLGO_DEMO_JOBS=4."}}
{"run":105,"commit":"eb49197","metric":4,"metrics":{"requested_demo_jobs":4},"status":"keep","description":"use portable FIFO wait loop for parallel demo runner","timestamp":1777042587376,"segment":35,"confidence":null,"iterationTokens":1608,"asi":{"hypothesis":"Replacing wait -n -p with a portable FIFO wait loop lets LLGO_DEMO_JOBS work on older Bash versions such as macOS /bin/bash 3.2. It still runs the same demo cases and aggregates all failures, preserving coverage while enabling parallel host demo CI on macOS too.","result":"Static effective macOS demo jobs increased from 1 to 4 and shell syntax validates."}}
{"run":106,"commit":"eb49197","metric":4,"metrics":{"requested_demo_jobs":4},"status":"discard","description":"validate portable demo runner with fake llgo","timestamp":1777042640499,"segment":35,"confidence":null,"iterationTokens":869,"asi":{"hypothesis":"Run the demo script with a fake llgo binary to validate the portable parallel runner launches and aggregates all discovered host demo cases without relying on wait -n -p.","result":"Fake runner reported 84/84 tests passed with LLGO_DEMO_JOBS=4.","rollback_reason":"Validation-only run ties the current best metric; no new code change to keep.","next_action_hint":"Keep portable FIFO wait loop; consider real demo CI feedback after next push."}}
{"type":"config","name":"Validate stable core after cache coverage and demo runner changes","metricName":"stable_core_failures","metricUnit":"","bestDirection":"lower"}
{"run":107,"commit":"bee927e","metric":0,"metrics":{"internal_build_s":23.204,"crosscompile_s":1.201,"compile_s":1.55,"libc_s":2.651,"rtlib_s":1.837,"goembed_s":2.215},"status":"keep","description":"validate stable core after cache coverage and demo runner changes","timestamp":1777042733870,"segment":36,"confidence":null,"iterationTokens":131,"asi":{"hypothesis":"Run the stable core subset after adding lightweight cache coverage tests and the portable demo runner to catch regressions before the next push.","result":"Stable core subset passed."}}
{"type":"config","name":"Preserve efficient wait-n demo scheduling on modern bash","metricName":"wait_n_parallel_scheduler","metricUnit":"","bestDirection":"higher"}
{"run":108,"commit":"5888871","metric":0,"metrics":{"portable_fifo_present":1},"status":"keep","description":"baseline portable demo runner lacks wait-n fast path","timestamp":1777042772714,"segment":37,"confidence":null,"iterationTokens":156,"asi":{"hypothesis":"The portable FIFO demo scheduler enables macOS parallelism but no longer uses wait -n -p on modern Bash, which can leave slots idle on Linux. Add a hybrid fast path to preserve efficient scheduling where available."}}
{"run":109,"commit":"4832a3f","metric":1,"metrics":{"portable_fifo_present":1,"fake_demo_cases":84},"status":"keep","description":"add wait-n fast path with FIFO fallback to demo runner","timestamp":1777042886966,"segment":37,"confidence":null,"iterationTokens":1613,"asi":{"hypothesis":"Use wait -n -p on Bash >=5.1 for efficient slot reuse, while falling back to portable FIFO waiting on older macOS Bash. This preserves coverage and macOS compatibility without regressing Linux scheduling efficiency.","result":"Hybrid runner syntax validates, fake llgo run reported 84/84 demo cases passed, and wait-n fast path is present."}}
{"type":"config","name":"Validate changed shell scripts after demo runner updates","metricName":"shell_syntax_failures","metricUnit":"","bestDirection":"lower"}
{"run":110,"commit":"66c470c","metric":0,"metrics":{"scripts_checked":2},"status":"keep","description":"validate shell syntax after demo runner updates","timestamp":1777042929037,"segment":38,"confidence":null,"iterationTokens":150,"asi":{"hypothesis":"Validate syntax of changed shell CI scripts after adding the hybrid wait-n/FIFO demo runner."}}
{"type":"config","name":"Validate workflow YAML after latest CI edits","metricName":"workflow_yaml_failures","metricUnit":"","bestDirection":"lower"}
{"run":111,"commit":"8b565e1","metric":0,"metrics":{"workflow_files_checked":8},"status":"keep","description":"validate workflow YAML after latest CI edits","timestamp":1777042961205,"segment":39,"confidence":null,"iterationTokens":163,"asi":{"hypothesis":"Validate GitHub workflow YAML syntax after enabling parallel host demos and keeping workflow matrix/check-name compatibility."}}
{"type":"config","name":"Avoid copying sync.Map in cache tests","metricName":"sync_map_copy_sites","metricUnit":"","bestDirection":"lower"}
{"run":112,"commit":"877f54c","metric":2,"metrics":{"cache_tests":2},"status":"keep","description":"baseline sync.Map copies in cache tests","timestamp":1777043070679,"segment":40,"confidence":null,"iterationTokens":128,"asi":{"hypothesis":"The new lightweight cache tests save sync.Map values with oldCache := cache, but sync.Map should not be copied after use. Count copy sites before fixing."}}
{"run":113,"commit":"04a6e8b","metric":0,"metrics":{"cache_tests":2,"focused_test_seconds":1.4},"status":"keep","description":"reset sync.Map caches in tests without copying them","timestamp":1777043140729,"segment":40,"confidence":null,"iterationTokens":1065,"asi":{"hypothesis":"Avoid copying sync.Map values in tests by resetting the global cache to a fresh sync.Map before and after each cache test; this preserves test isolation without violating sync.Map's no-copy-after-use rule.","result":"Focused cache tests passed and sync_map_copy_sites dropped from 2 to 0."}}
{"type":"config","name":"Fix LLGo demo CI failure from parallel host demos","metricName":"known_demo_ci_failures","metricUnit":"","bestDirection":"lower"}
{"run":114,"commit":"3aefaab","metric":1,"metrics":{"demo_jobs":4},"status":"keep","description":"baseline host demo CI uses parallel jobs and hit sync segfault","timestamp":1777043725572,"segment":41,"confidence":null,"iterationTokens":162,"asi":{"hypothesis":"The latest PR CI run failed in llgo (ubuntu-latest, 19, 1.21.13) during the host demo step with _demo/go/sync segmentation fault after enabling LLGO_DEMO_JOBS=4. Treat this known CI failure as baseline to fix without reducing demo coverage."}}
{"run":115,"commit":"85b5fe9","metric":0,"metrics":{"demo_jobs":1},"status":"keep","description":"restore sequential host demo CI while retaining portable opt-in runner","timestamp":1777043775590,"segment":41,"confidence":null,"iterationTokens":495,"asi":{"hypothesis":"Sequential host demo execution was previously passing and preserves the full demo coverage set. Reverting the CI LLGO_DEMO_JOBS=4 opt-in should fix the observed _demo/go/sync segfault, while keeping the portable runner available for explicit/local use.","result":"Workflow no longer sets LLGO_DEMO_JOBS=4 and YAML parses."}}
{"type":"config","name":"Improve LLVM version cache key safety","metricName":"raw_llvm_cache_key_sites","metricUnit":"","bestDirection":"lower"}
{"run":116,"commit":"5fe2f5d","metric":1,"metrics":{"get_llvm_version_sites":1},"status":"keep","description":"baseline LLVM version cache keyed by raw compiler string","timestamp":1777044042367,"segment":42,"confidence":null,"iterationTokens":171,"asi":{"hypothesis":"The LLVM version global cache is keyed by the raw compiler string. If cc is 'clang' and PATH changes within a process, a stale cached version could be reused. Count raw-key sites before improving safety."}}
{"run":117,"commit":"3983508","metric":0,"metrics":{"get_llvm_version_sites":1,"focused_test_seconds":1.5},"status":"keep","description":"key LLVM version cache by resolved compiler path when available","timestamp":1777044100972,"segment":42,"confidence":null,"iterationTokens":611,"asi":{"hypothesis":"Resolving the compiler with exec.LookPath before accessing the global LLVM version cache prevents stale cache reuse if PATH changes while retaining the raw string fallback for unavailable/custom compiler names. This improves correctness of the cache optimization without reducing coverage.","result":"Focused LLVM version tests passed and raw_llvm_cache_key_sites dropped from 1 to 0."}}
{"type":"config","name":"Prevent pkg-config cache slice aliasing","metricName":"pkg_config_cache_alias_sites","metricUnit":"","bestDirection":"lower"}
{"run":118,"commit":"b1d837a","metric":1,"metrics":{"pkg_config_cache_tests":1},"status":"keep","description":"baseline pkg-config cache returns cached slices directly","timestamp":1777044195167,"segment":43,"confidence":null,"iterationTokens":178,"asi":{"hypothesis":"cachedPkgConfig returns cached []string slices directly. If a future caller mutates returned cflags/ldflags, it could corrupt the shared cache. Count direct cached-return alias sites before making returns defensive."}}
{"run":119,"commit":"ec0a73d","metric":0,"metrics":{"pkg_config_cache_tests":1,"focused_test_seconds":1.5},"status":"keep","description":"return defensive copies from pkg-config cache","timestamp":1777044279958,"segment":43,"confidence":null,"iterationTokens":1189,"asi":{"hypothesis":"Returning cloned cflags/ldflags slices from cached pkg-config results prevents future caller mutation from corrupting the shared cache, preserving correctness of the cache optimization. Extend the cache test to mutate the first result and verify the second result remains intact.","result":"Focused pkg-config cache test passed and direct alias return sites dropped from 1 to 0."}}
{"type":"config","name":"Validate internal build after cache safety fixes","metricName":"internal_build_failures","metricUnit":"","bestDirection":"lower"}
{"run":120,"commit":"dc129a4","metric":0,"metrics":{"internal_build_s":23.921},"status":"keep","description":"validate full internal/build after cache safety fixes","timestamp":1777044354151,"segment":44,"confidence":null,"iterationTokens":118,"asi":{"hypothesis":"Run full internal/build after LLVM cache key safety and pkg-config defensive-copy changes to catch regressions.","result":"internal/build passed."}}
{"type":"config","name":"Validate internal build vet after cache changes","metricName":"internal_build_vet_failures","metricUnit":"","bestDirection":"lower"}
{"run":121,"commit":"0a7e735","metric":0,"metrics":{"vet_packages":1},"status":"keep","description":"go vet internal/build after cache safety changes","timestamp":1777044637372,"segment":45,"confidence":null,"iterationTokens":106,"asi":{"hypothesis":"Run go vet on internal/build to catch issues such as copying lock-like values after adding cache tests and sync.Map globals.","result":"go vet ./internal/build passed."}}
{"type":"config","name":"Validate no broad go install remains in CI workflows","metricName":"broad_go_install_sites","metricUnit":"","bestDirection":"lower"}
{"run":122,"commit":"7edee19","metric":0,"metrics":{"workflow_files_checked":8},"status":"keep","description":"validate workflows no longer use broad go install all","timestamp":1777044700283,"segment":46,"confidence":null,"iterationTokens":128,"asi":{"hypothesis":"Check that CI workflow install steps no longer use go install ./..., preserving the narrower llgo-only install optimization across workflows."}}
{"type":"config","name":"Validate llgo test shard avoids demo Python deps","metricName":"test_shard_demo_python_deps","metricUnit":"","bestDirection":"lower"}
{"run":123,"commit":"69c78cc","metric":0,"metrics":{"test_shard_blocks":1},"status":"keep","description":"validate llgo test shard has no demo-only Python dependency install","timestamp":1777044735111,"segment":47,"confidence":null,"iterationTokens":182,"asi":{"hypothesis":"Check that the llgo test shard job still avoids demo-only numpy/torch pip installation, preserving CI setup speed without reducing ./test/... coverage."}}
{"type":"config","name":"Validate all current workflow YAML before push","metricName":"workflow_yaml_failures","metricUnit":"","bestDirection":"lower"}
{"run":124,"commit":"41a5028","metric":0,"metrics":{"workflow_files_checked":8},"status":"keep","description":"validate all current workflow YAML before next push","timestamp":1777044782026,"segment":48,"confidence":null,"iterationTokens":163,"asi":{"hypothesis":"Run a final YAML syntax check across workflows before pushing the next batch of CI/build performance changes."}}
{"type":"config","name":"Validate stable core before next push","metricName":"stable_core_failures","metricUnit":"","bestDirection":"lower"}
{"run":125,"commit":"5936866","metric":0,"metrics":{"internal_build_s":25.175,"crosscompile_s":0.929,"compile_s":1.462,"libc_s":1.853,"rtlib_s":3.379,"goembed_s":2.886},"status":"keep","description":"validate stable core before next push","timestamp":1777044837399,"segment":49,"confidence":null,"iterationTokens":127,"asi":{"hypothesis":"Run the stable core subset before pushing the next batch to ensure cache-safety and demo-runner changes do not regress core tests.","result":"Stable core subset passed."}}
{"type":"config","name":"Validate demo runner failure aggregation","metricName":"fake_demo_failed_cases","metricUnit":"","bestDirection":"lower"}
