{"run":674,"commit":"bb5c1b7","metric":0,"metrics":{"pending_checks":0,"build_cache_completed_jobs":2,"build_cache_max_seconds":178,"go_split_completed_jobs":4,"go_split_over15_jobs":0,"split_macos_intel_completed_jobs":21,"split_macos_intel_over15_jobs":1,"all_completed_over15_jobs":1,"max_over15_seconds":962},"status":"keep","description":"monitor larger retry run completed with one over-15 macOS smoke job","timestamp":1777156794719,"segment":299,"confidence":null,"iterationTokens":1373,"asi":{"hypothesis":"The larger crosscompile retry and iwasm cache run should complete without failures; timing should remain near target but single macOS runner outliers are possible.","result":"All checks completed with zero failures and zero pending. Build-cache jobs passed in max 178s and Go split jobs had no over-15 jobs. One macOS Intel split job exceeded 15m: llgo-embedded-smoke-macos-intel (19, 1.21.13, startup) at 16m02s.","next_action_hint":"Do not immediately split based on a single 16m macOS outlier; inspect repeated history before changing coverage/fan-out."}}
{"run":675,"commit":"4ba0971","metric":0,"metrics":{"pending_checks":0,"build_cache_completed_jobs":2,"build_cache_max_seconds":178,"go_split_completed_jobs":4,"go_split_over15_jobs":0,"split_macos_intel_completed_jobs":21,"split_macos_intel_over15_jobs":1,"all_completed_over15_jobs":1,"max_over15_seconds":962,"startup_history_runs":6,"startup_over15_count":1,"startup_max_seconds":962,"history_failures":0},"status":"keep","description":"inspect recent startup smoke timing history before splitting","timestamp":1777156839298,"segment":299,"confidence":null,"iterationTokens":2739,"asi":{"hypothesis":"The 16m startup smoke job may be a one-off macOS runner outlier; avoid adding CI fan-out unless repeated history shows stable over-target behavior.","result":"Recent successful llgo runs show startup smoke durations: 962s, 638s, 660s, 546s, 612s, 576s. Only 1 of 6 exceeded 15m, so further splitting would be overfitting for now.","next_action_hint":"Record in ideas and continue focusing on safe cache/resilience changes instead of splitting startup smoke again."}}
{"run":676,"commit":"bc6a2ea","metric":0,"metrics":{"pending_checks":0,"build_cache_completed_jobs":2,"build_cache_max_seconds":178,"go_split_completed_jobs":4,"go_split_over15_jobs":0,"split_macos_intel_completed_jobs":21,"split_macos_intel_over15_jobs":1,"all_completed_over15_jobs":1,"max_over15_seconds":962,"startup_history_runs":6,"startup_over15_count":1,"startup_max_seconds":962,"history_failures":0,"ideas_pruned":1},"status":"keep","description":"prune ideas after iwasm and startup timing validation","timestamp":1777156852072,"segment":299,"confidence":null,"iterationTokens":1750,"asi":{"hypothesis":"Prune stale ideas so future iterations do not re-try completed iwasm monitoring or overfit the single startup smoke outlier.","result":"Ideas now note iwasm cache validation and that startup smoke had only 1/6 recent runs over 15m, discouraging further splitting on one outlier."}}
{"type":"config","name":"Cache iwasm in llgo cross-compile workflow","metricName":"explicit_wamr_clone_steps","metricUnit":"","bestDirection":"lower"}
{"run":677,"commit":"1499eb4","metric":1,"metrics":{"iwasm_cache_steps":0,"build_iwasm_script_uses":0},"status":"keep","description":"baseline llgo cross-compile still clones and builds WAMR inline","timestamp":1777156890068,"segment":300,"confidence":null,"iterationTokens":219,"asi":{"hypothesis":"The llgo cross-compile job still duplicates WAMR clone/cmake/make inline despite build-cache workflow now using dev/build_iwasm.sh with actions/cache. Reusing that cache pattern should reduce macOS cross-compile setup time without reducing coverage."}}
{"run":678,"commit":"135db42","metric":0,"metrics":{"iwasm_cache_steps":1,"build_iwasm_script_uses":1,"workflow_parse_failures":0},"status":"keep","description":"cache iwasm in llgo cross-compile workflow","timestamp":1777156907476,"segment":300,"confidence":null,"iterationTokens":990,"asi":{"hypothesis":"Replace the llgo cross-compile job's inline WAMR clone/cmake/make with the shared dev/build_iwasm.sh plus actions/cache. This keeps wasm smoke coverage but avoids rebuilding iwasm on cache hits and avoids duplicated build flags.","result":"llgo.yml parses, dev/build_iwasm.sh syntax is valid, explicit WAMR clone steps in llgo.yml dropped from 1 to 0."}}
{"type":"config","name":"Validate llgo cross-compile iwasm cache workflow","metricName":"validation_failures","metricUnit":"","bestDirection":"lower"}
{"run":679,"commit":"135db42","metric":1,"metrics":{"yaml_files_checked":0,"shell_scripts_checked":0},"status":"crash","description":"validate llgo cross-compile iwasm cache workflow using missing python yaml","timestamp":1777156921812,"segment":301,"confidence":null,"iterationTokens":326,"asi":{"hypothesis":"Validate all workflow/action YAML and scripts after adding iwasm cache to the llgo cross-compile workflow.","result":"Validation command failed before testing changes because local Python lacks the yaml module.","rollback_reason":"Tooling issue in validation command, not a code failure.","next_action_hint":"Re-run validation with Ruby YAML parser, which is available in this repo environment."}}
{"run":680,"commit":"99307fd","metric":0,"metrics":{"yaml_files_checked":14,"shell_scripts_checked":6},"status":"keep","description":"validate llgo cross-compile iwasm cache workflow with ruby yaml","timestamp":1777156935103,"segment":301,"confidence":null,"iterationTokens":775,"asi":{"hypothesis":"Re-run workflow validation with Ruby YAML after the previous command failed due missing Python yaml module.","result":"14 workflow/action YAML files parsed, workflow shell scripts and dev/build_iwasm.sh passed bash -n, and structural assertions for the llgo cross-compile iwasm cache passed."}}
{"run":681,"commit":"3fd4bd2","metric":0,"metrics":{"yaml_files_checked":14,"shell_scripts_checked":6,"ideas_updated":1},"status":"keep","description":"record cross-compile iwasm cache monitoring idea","timestamp":1777156948475,"segment":301,"confidence":null,"iterationTokens":694,"asi":{"hypothesis":"Update the ideas backlog so the implemented cross-compile iwasm cache is tracked for live CI monitoring rather than rediscovered as a future idea.","result":"Ideas now mention that LLGo cross-compile uses the shared iwasm cache/script pattern and needs next-run monitoring."}}
{"type":"config","name":"Monitor PR after cross-compile iwasm cache push","metricName":"pr_check_failures","metricUnit":"","bestDirection":"lower"}
{"run":682,"commit":"98c06d8","metric":0,"metrics":{"pending_checks":46},"status":"keep","description":"monitor PR immediately after cross-compile iwasm cache push","timestamp":1777156969812,"segment":302,"confidence":null,"iterationTokens":244,"asi":{"hypothesis":"After pushing LLGo cross-compile iwasm caching, the new PR run should start without immediate workflow syntax/action failures.","result":"No failed checks observed immediately after push; 46 checks pending."}}
{"run":683,"commit":"2807dd3","metric":0,"metrics":{"pending_checks":43,"build_cache_completed_jobs":1,"build_cache_max_seconds":169,"cross_compile_completed_jobs":1,"cross_compile_max_seconds":101,"go_split_completed_jobs":0,"go_split_over15_jobs":0,"split_macos_intel_completed_jobs":0,"split_macos_intel_over15_jobs":0,"all_completed_over15_jobs":0},"status":"keep","description":"monitor cross-compile iwasm cache run after first completions","timestamp":1777157282610,"segment":302,"confidence":null,"iterationTokens":1498,"asi":{"hypothesis":"The cross-compile iwasm cache should allow the macOS cross-compile job to complete quickly when cache is available and should not introduce workflow failures.","result":"No failed checks; 43 pending. One cross-compile job completed in 101s, suggesting iwasm cache hit/fast path worked. One build-cache job completed in 169s."}}
{"run":684,"commit":"056b8d8","metric":0,"metrics":{"pending_checks":43,"build_cache_completed_jobs":1,"build_cache_max_seconds":169,"cross_compile_completed_jobs":1,"cross_compile_max_seconds":101,"go_split_completed_jobs":0,"go_split_over15_jobs":0,"split_macos_intel_completed_jobs":0,"split_macos_intel_over15_jobs":0,"all_completed_over15_jobs":0,"cross_compile_cache_hit":0,"cross_compile_built_iwasm":1},"status":"keep","description":"inspect cross-compile iwasm cache log on first run","timestamp":1777157297156,"segment":302,"confidence":null,"iterationTokens":1502,"asi":{"hypothesis":"Inspect the completed cross-compile job log to confirm whether the new iwasm cache hit or performed the expected first-run build/save.","result":"The cross-compile job built iwasm and saved cache key macOS-ARM64-iwasm-WAMR-2.4.4-..., so this was a cache miss/save first run. It still completed in 101s, and future runs should hit the cache. The parsed cache-hit line belonged to a separate Go cache post step, so the metric was corrected to cross_compile_cache_hit=0."}}
{"run":685,"commit":"a2b3f8d","metric":0,"metrics":{"pending_checks":34,"build_cache_completed_jobs":1,"build_cache_max_seconds":169,"cross_compile_completed_jobs":1,"cross_compile_max_seconds":101,"go_split_completed_jobs":0,"go_split_over15_jobs":0,"split_macos_intel_completed_jobs":2,"split_macos_intel_over15_jobs":0,"all_completed_over15_jobs":0,"cross_compile_cache_hit":0,"cross_compile_built_iwasm":1},"status":"keep","description":"monitor cross-compile cache run with first macOS Intel completions","timestamp":1777157610770,"segment":302,"confidence":null,"iterationTokens":1955,"asi":{"hypothesis":"Continue monitoring cross-compile iwasm cache push for failures or over-15 jobs while slower macOS Intel jobs complete.","result":"No failures; 34 checks pending. Cross-compile remains completed at 101s; two macOS Intel split jobs completed and none over 15m."}}
{"run":686,"commit":"9b3b726","metric":0,"metrics":{"pending_checks":29,"build_cache_completed_jobs":1,"build_cache_max_seconds":169,"cross_compile_completed_jobs":1,"cross_compile_max_seconds":101,"go_split_completed_jobs":2,"go_split_over15_jobs":0,"split_macos_intel_completed_jobs":3,"split_macos_intel_over15_jobs":0,"all_completed_over15_jobs":0,"cross_compile_cache_hit":0,"cross_compile_built_iwasm":1},"status":"keep","description":"monitor cross-compile cache run with two Go split jobs done","timestamp":1777157924592,"segment":302,"confidence":null,"iterationTokens":1956,"asi":{"hypothesis":"Continue monitoring cross-compile iwasm cache push; as Go split jobs complete they should remain under 15m and no CI failures should appear.","result":"No failures; 29 pending. Two Go split jobs completed under 15m, three macOS Intel split jobs completed under 15m, cross-compile remains 101s."}}
{"run":687,"commit":"a33deae","metric":0,"metrics":{"pending_checks":24,"build_cache_completed_jobs":1,"build_cache_max_seconds":169,"cross_compile_completed_jobs":1,"cross_compile_max_seconds":101,"go_split_completed_jobs":4,"go_split_over15_jobs":0,"split_macos_intel_completed_jobs":5,"split_macos_intel_over15_jobs":0,"all_completed_over15_jobs":0,"cross_compile_cache_hit":0,"cross_compile_built_iwasm":1},"status":"keep","description":"monitor cross-compile cache run with all Go split jobs done","timestamp":1777158244862,"segment":302,"confidence":null,"iterationTokens":1965,"asi":{"hypothesis":"Continue monitoring cross-compile iwasm cache push; all Go split jobs should finish under 15m and macOS Intel jobs should continue progressing.","result":"No failures; 24 pending. All four Go split jobs completed with none over 15m; five macOS Intel split jobs completed with none over 15m; cross-compile remains 101s."}}
{"run":688,"commit":"08b1f38","metric":0,"metrics":{"pending_checks":21,"build_cache_completed_jobs":2,"build_cache_max_seconds":169,"cross_compile_completed_jobs":1,"cross_compile_max_seconds":101,"go_split_completed_jobs":4,"go_split_over15_jobs":0,"split_macos_intel_completed_jobs":5,"split_macos_intel_over15_jobs":0,"all_completed_over15_jobs":0,"cross_compile_cache_hit":0,"cross_compile_built_iwasm":1},"status":"keep","description":"monitor cross-compile cache run with both build-cache jobs done","timestamp":1777158561004,"segment":302,"confidence":null,"iterationTokens":2002,"asi":{"hypothesis":"Continue monitoring cross-compile iwasm cache push; build-cache jobs should both finish quickly and no failures should appear.","result":"No failures; 21 pending. Both build-cache jobs completed with max 169s, cross-compile completed at 101s, all four Go split jobs completed with none over 15m."}}
{"run":689,"commit":"bb30d8a","metric":0,"metrics":{"pending_checks":17,"build_cache_completed_jobs":2,"build_cache_max_seconds":169,"cross_compile_completed_jobs":1,"cross_compile_max_seconds":101,"go_split_completed_jobs":4,"go_split_over15_jobs":0,"split_macos_intel_completed_jobs":8,"split_macos_intel_over15_jobs":0,"all_completed_over15_jobs":0,"cross_compile_cache_hit":0,"cross_compile_built_iwasm":1},"status":"keep","description":"monitor cross-compile cache run with eight macOS Intel jobs done","timestamp":1777158874271,"segment":302,"confidence":null,"iterationTokens":2001,"asi":{"hypothesis":"Continue monitoring cross-compile iwasm cache push; macOS Intel split jobs should stay below 15m as they complete.","result":"No failures; 17 pending. Eight macOS Intel split jobs completed with none over 15m; no completed job over 15m across all checks."}}
{"run":690,"commit":"faa3b52","metric":0,"metrics":{"pending_checks":16,"build_cache_completed_jobs":2,"build_cache_max_seconds":169,"cross_compile_completed_jobs":1,"cross_compile_max_seconds":101,"go_split_completed_jobs":4,"go_split_over15_jobs":0,"split_macos_intel_completed_jobs":9,"split_macos_intel_over15_jobs":0,"all_completed_over15_jobs":0,"cross_compile_cache_hit":0,"cross_compile_built_iwasm":1},"status":"keep","description":"monitor cross-compile cache run with nine macOS Intel jobs done","timestamp":1777159188574,"segment":302,"confidence":null,"iterationTokens":1996,"asi":{"hypothesis":"Continue monitoring cross-compile iwasm cache push; no failures should appear while remaining macOS Intel/host-demo jobs run.","result":"No failures; 16 pending. Nine macOS Intel split jobs completed with none over 15m; no completed job over 15m across all checks."}}
{"run":691,"commit":"1e49a1b","metric":0,"metrics":{"pending_checks":12,"build_cache_completed_jobs":2,"build_cache_max_seconds":169,"cross_compile_completed_jobs":1,"cross_compile_max_seconds":101,"go_split_completed_jobs":4,"go_split_over15_jobs":0,"split_macos_intel_completed_jobs":12,"split_macos_intel_over15_jobs":0,"all_completed_over15_jobs":0,"cross_compile_cache_hit":0,"cross_compile_built_iwasm":1},"status":"keep","description":"monitor cross-compile cache run with twelve macOS Intel jobs done","timestamp":1777159505270,"segment":302,"confidence":null,"iterationTokens":1995,"asi":{"hypothesis":"Continue monitoring cross-compile iwasm cache push; remaining macOS Intel jobs should not reveal regressions.","result":"No failures; 12 pending. Twelve macOS Intel split jobs completed with none over 15m; no completed job over 15m across all checks."}}
{"run":692,"commit":"4861ea9","metric":0,"metrics":{"pending_checks":12,"build_cache_completed_jobs":2,"build_cache_max_seconds":169,"cross_compile_completed_jobs":1,"cross_compile_max_seconds":101,"go_split_completed_jobs":4,"go_split_over15_jobs":0,"split_macos_intel_completed_jobs":12,"split_macos_intel_over15_jobs":0,"all_completed_over15_jobs":0,"cross_compile_cache_hit":0,"cross_compile_built_iwasm":1},"status":"keep","description":"monitor cross-compile cache run with pending jobs unchanged","timestamp":1777159823223,"segment":302,"confidence":null,"iterationTokens":2002,"asi":{"hypothesis":"Continue monitoring rather than change CI while remaining long-running macOS jobs finish.","result":"No failures; 12 pending. Counts unchanged over this interval, likely due queued/running macOS jobs; no completed jobs over 15m."}}
{"run":693,"commit":"b838b3e","metric":0,"metrics":{"pending_checks":7,"build_cache_completed_jobs":2,"build_cache_max_seconds":169,"cross_compile_completed_jobs":1,"cross_compile_max_seconds":101,"go_split_completed_jobs":4,"go_split_over15_jobs":0,"split_macos_intel_completed_jobs":16,"split_macos_intel_over15_jobs":0,"all_completed_over15_jobs":0,"cross_compile_cache_hit":0,"cross_compile_built_iwasm":1},"status":"keep","description":"monitor cross-compile cache run with seven pending checks","timestamp":1777160138274,"segment":302,"confidence":null,"iterationTokens":2010,"asi":{"hypothesis":"Continue monitoring cross-compile iwasm cache push; remaining pending checks should be mostly full llgo/host-demo jobs and should complete without failures.","result":"No failures; 7 pending. Sixteen macOS Intel split jobs completed with none over 15m; no completed jobs over 15m across all checks."}}
{"run":694,"commit":"7dc8d1c","metric":0,"metrics":{"pending_checks":3,"build_cache_completed_jobs":2,"build_cache_max_seconds":169,"cross_compile_completed_jobs":1,"cross_compile_max_seconds":101,"go_split_completed_jobs":4,"go_split_over15_jobs":0,"split_macos_intel_completed_jobs":19,"split_macos_intel_over15_jobs":0,"all_completed_over15_jobs":0,"cross_compile_cache_hit":0,"cross_compile_built_iwasm":1},"status":"keep","description":"monitor cross-compile cache run with three pending checks","timestamp":1777160455067,"segment":302,"confidence":null,"iterationTokens":1906,"asi":{"hypothesis":"Continue monitoring until final checks complete; remaining pending jobs are long-running llgo/host-demo checks and should not fail due to the cross-compile iwasm cache change.","result":"No failures; 3 pending. Nineteen macOS Intel split jobs completed with none over 15m; no completed jobs over 15m across all checks."}}
{"run":695,"commit":"05593d2","metric":0,"metrics":{"pending_checks":1,"build_cache_completed_jobs":2,"build_cache_max_seconds":169,"cross_compile_completed_jobs":1,"cross_compile_max_seconds":101,"go_split_completed_jobs":4,"go_split_over15_jobs":0,"split_macos_intel_completed_jobs":20,"split_macos_intel_over15_jobs":0,"all_completed_over15_jobs":0,"cross_compile_cache_hit":0,"cross_compile_built_iwasm":1},"status":"keep","description":"monitor cross-compile cache run with one pending host-demo check","timestamp":1777160772483,"segment":302,"confidence":null,"iterationTokens":1749,"asi":{"hypothesis":"Continue monitoring until final host-demo check completes; all completed checks should remain failure-free and under 15m.","result":"No failures; 1 pending: llgo-host-demos-macos-intel (19, 1.24.2). Twenty macOS Intel split jobs completed with none over 15m; no completed jobs over 15m across all checks."}}
{"run":696,"commit":"412c3d0","metric":0,"metrics":{"pending_checks":0,"build_cache_completed_jobs":2,"build_cache_max_seconds":169,"cross_compile_completed_jobs":1,"cross_compile_max_seconds":101,"go_split_completed_jobs":4,"go_split_over15_jobs":0,"split_macos_intel_completed_jobs":21,"split_macos_intel_over15_jobs":0,"all_completed_over15_jobs":0,"cross_compile_cache_hit":0,"cross_compile_built_iwasm":1},"status":"keep","description":"monitor cross-compile cache run completed cleanly","timestamp":1777161086706,"segment":302,"confidence":null,"iterationTokens":1685,"asi":{"hypothesis":"Final monitoring should confirm the cross-compile iwasm cache workflow change did not break CI and all key split jobs remain under 15m.","result":"All checks completed with zero failures and zero pending. Build-cache max 169s; cross-compile completed in 101s after first-run iwasm build/save; all four Go split jobs had no over-15 jobs; all 21 macOS Intel split/targeted jobs had no over-15 jobs; no completed job exceeded 15m."}}
{"run":697,"commit":"0af4975","metric":0,"metrics":{"pending_checks":0,"build_cache_completed_jobs":2,"build_cache_max_seconds":169,"cross_compile_completed_jobs":1,"cross_compile_max_seconds":101,"go_split_completed_jobs":4,"go_split_over15_jobs":0,"split_macos_intel_completed_jobs":21,"split_macos_intel_over15_jobs":0,"all_completed_over15_jobs":0,"cross_compile_cache_hit":0,"cross_compile_built_iwasm":1,"ideas_pruned":1},"status":"keep","description":"prune cross-compile iwasm monitoring idea after clean run","timestamp":1777161101798,"segment":302,"confidence":null,"iterationTokens":1249,"asi":{"hypothesis":"After a clean full PR run, prune the stale instruction to monitor the cross-compile iwasm cache change.","result":"Ideas now record the clean outcome: build-cache max 169s, cross-compile first-run build/save 101s, and zero CI failures."}}
{"type":"config","name":"Monitor PR after pushing completed monitoring commits","metricName":"pr_check_failures","metricUnit":"","bestDirection":"lower"}
{"run":698,"commit":"26ce4c0","metric":0,"metrics":{"pending_checks":46},"status":"keep","description":"monitor PR immediately after pushing monitoring commits","timestamp":1777161124985,"segment":303,"confidence":null,"iterationTokens":240,"asi":{"hypothesis":"Pushing completed monitoring/ideas commits should not cause immediate CI failures; this rerun can also confirm the cross-compile iwasm cache hit on a subsequent run.","result":"No immediate failed checks; 46 pending."}}
