{"run":750,"commit":"0e880d5","metric":0,"metrics":{"compile_invocations":0,"top_compile_ms":0},"status":"crash","description":"profile clean go build failed due relative GOMODCACHE","timestamp":1777197619407,"segment":326,"confidence":null,"iterationTokens":644,"asi":{"hypothesis":"Use a toolexec wrapper to identify current clean go build compile hotspots for the next dependency-reduction experiment.","result":"Profiling command failed before build because GOMODCACHE was set to a relative path under the repo temp directory.","rollback_reason":"Invalid diagnostic harness; no source code change.","next_action_hint":"Retry with absolute temp paths for GOCACHE and GOMODCACHE, and emit a real wall-clock metric."}}
{"type":"config","name":"Profile clean go build package compile hotspots retry","metricName":"profile_wall_ms","metricUnit":"ms","bestDirection":"lower"}
{"run":751,"commit":"0e880d5","metric":0,"metrics":{"compile_invocations":0,"top_compile_ms":0},"status":"crash","description":"profile clean go build failed during temp gomodcache cleanup","timestamp":1777197663892,"segment":327,"confidence":null,"iterationTokens":638,"asi":{"hypothesis":"Retry toolexec profile with absolute GOMODCACHE paths to find compile hotspots.","result":"The build/profiling ran long enough to generate output, but the command exited nonzero because rm -rf failed on read-only module-cache files during trap cleanup.","rollback_reason":"Diagnostic harness cleanup failed; no source code change.","next_action_hint":"Retry using temporary cache directories outside the repo and chmod -R u+w before cleanup, or disable cleanup until after parsing results."}}
{"type":"config","name":"Profile clean go build package compile hotspots successful","metricName":"profile_wall_ms","metricUnit":"ms","bestDirection":"lower"}
{"run":752,"commit":"175fccb","metric":12618.5,"metrics":{"compile_invocations":310,"top_compile_ms":556},"status":"keep","description":"profile clean go build compile hotspots with toolexec","timestamp":1777197708900,"segment":328,"confidence":null,"iterationTokens":653,"asi":{"hypothesis":"A successful toolexec profile can identify non-YAML, non-dispatcher candidates for further clean go build reductions.","result":"Profile wall 12618.5ms with instrumentation. Top compile packages: runtime 556ms, net 486.8ms, github.com/goplus/plan9asm 462.0ms, net/http 406.2ms, go/types 397.5ms, math/big 383.7ms, golang.org/x/tools/internal/stdlib 381.6ms, crypto/tls 246.1ms, text/template 239.6ms, x/sys/unix 213.1ms, go/ssa 208.5ms, archive/tar 203.0ms, encoding/json 202.1ms, llgo/ssa 196.0ms, github.com/goplus/llvm 191.0ms, pflag 180.2ms, yaml.v3 138.6ms (do not replace YAML).","next_action_hint":"Investigate dependency-reducing changes that avoid net/http/archive/tar/zip or plan9asm cost without changing user-visible behavior; keep YAML manifest unchanged."}}
{"type":"config","name":"Optimize CompileGroup object temp naming","metricName":"compile_group_ms","metricUnit":"ms","bestDirection":"lower"}
{"run":753,"commit":"f22bdf4","metric":167.1,"metrics":{"compile_group_files":96},"status":"keep","description":"baseline CompileGroup temp object naming","timestamp":1777197753420,"segment":329,"confidence":null,"iterationTokens":526,"asi":{"hypothesis":"Before replacing per-file os.CreateTemp object allocation with deterministic object paths, establish a current 96-file CompileGroup baseline.","result":"Current 96-file CompileGroup benchmark completed in 167.1ms."}}
{"run":754,"commit":"ad3055e","metric":158,"metrics":{"compile_group_files":96},"status":"keep","description":"use deterministic object paths in CompileGroup","timestamp":1777197801141,"segment":329,"confidence":null,"iterationTokens":4867,"asi":{"hypothesis":"Avoiding os.CreateTemp/Close and long sanitized path prefixes for each object file should reduce external CompileGroup overhead without changing archive contents or order, because each group already has an isolated temp directory and stable file indexes.","result":"compile package tests passed. 96-file CompileGroup benchmark improved from 167.1ms to 158.0ms."}}
{"type":"config","name":"Optimize sequential CompileConfig compiler reuse","metricName":"compile_group_ms","metricUnit":"ms","bestDirection":"lower"}
{"run":755,"commit":"2b362b5","metric":1316.6,"metrics":{"compile_group_files":96},"status":"keep","description":"baseline sequential CompileGroup compiler allocation","timestamp":1777197827337,"segment":330,"confidence":null,"iterationTokens":534,"asi":{"hypothesis":"When LLGO_COMPILE_JOBS=1 is used for constrained environments, reusing a compiler command wrapper per group may slightly reduce overhead versus allocating one per source file. Establish current sequential 96-file baseline.","result":"LLGO_COMPILE_JOBS=1 96-file CompileGroup benchmark completed in 1316.6ms."}}
{"run":756,"commit":"2b362b5","metric":1350.2,"metrics":{"compile_group_files":96},"status":"discard","description":"reuse compiler wrappers in sequential CompileConfig path","timestamp":1777197849040,"segment":330,"confidence":null,"iterationTokens":1324,"asi":{"hypothesis":"Reuse one clang.Cmd wrapper per group when LLGO_COMPILE_JOBS=1 to avoid per-file wrapper allocation overhead.","result":"compile package tests passed but sequential 96-file benchmark regressed from 1316.6ms to 1350.2ms; clang subprocess time dominates and the map lookup adds no benefit.","rollback_reason":"Primary metric worsened; optimization is not worthwhile.","next_action_hint":"Keep the simpler sequential path. Focus on external subprocess scheduling or dependency reductions instead."}}
{"type":"config","name":"Record deterministic CompileGroup object naming notes","metricName":"validation_failures","metricUnit":"","bestDirection":"lower"}
{"run":757,"commit":"ec1ceee","metric":0,"metrics":{"ideas_updated":1},"status":"keep","description":"record deterministic object naming in ideas","timestamp":1777197873946,"segment":331,"confidence":null,"iterationTokens":199,"asi":{"hypothesis":"Document the deterministic object-path optimization and the rejected sequential compiler-wrapper reuse so future work does not repeat the same microbenchmarks.","result":"Ideas backlog now records 167.1ms-to-158.0ms object naming improvement and 1316.6ms-to-1350.2ms rejected sequential wrapper reuse."}}
{"type":"config","name":"Pre-push local validation after deterministic object paths","metricName":"validation_failures","metricUnit":"","bestDirection":"lower"}
{"run":758,"commit":"233f8a5","metric":0,"metrics":{"crosscompile_packages_tested":4,"cmd_llgo_build":1},"status":"keep","description":"local validation before pushing deterministic object paths","timestamp":1777197927990,"segment":332,"confidence":null,"iterationTokens":173,"asi":{"hypothesis":"Before pushing deterministic object path changes, run local relevant tests and a dev llgo command build per user request.","result":"go test ./internal/crosscompile/... passed and go build -tags=dev ./cmd/llgo passed locally."}}
{"type":"config","name":"Monitor PR after locally validated deterministic object path push","metricName":"pr_check_failures","metricUnit":"","bestDirection":"lower"}
{"run":759,"commit":"ce7418d","metric":0,"metrics":{"pending_checks":11,"passed_checks":0,"skipped_checks":0},"status":"keep","description":"monitor PR after deterministic object path push","timestamp":1777197964865,"segment":333,"confidence":null,"iterationTokens":348,"asi":{"hypothesis":"After local validation and push, deterministic object path changes should not show immediate CI check failures.","result":"No failed PR checks immediately after push; 11 checks pending."}}
{"type":"config","name":"Optimize plan9asm manual signature lookup","metricName":"plan9asm_test_ms","metricUnit":"ms","bestDirection":"lower"}
{"run":760,"commit":"ad67406","metric":1184.8,"metrics":{"plan9asm_test_count":10},"status":"keep","description":"baseline plan9asm bytealg signature translation test","timestamp":1777198010349,"segment":334,"confidence":null,"iterationTokens":210,"asi":{"hypothesis":"TranslateSourceModuleForPkgWithOptions currently rebuilds manual asm signature maps inside the ManualSig callback. Establish a bytealg plan9asm translation test baseline before caching that map per translation.","result":"go test ./internal/plan9asm -run TestSigsForStdlibInternalBytealgArm64 -count=10 completed in 1184.8ms wall time."}}
{"run":761,"commit":"ad67406","metric":1391,"metrics":{"plan9asm_test_count":10},"status":"discard","description":"cache plan9asm manual asm signatures per translation","timestamp":1777198036512,"segment":334,"confidence":null,"iterationTokens":797,"asi":{"hypothesis":"Build the extra asm signature map once per TranslateSourceModuleForPkgWithOptions call instead of once per ManualSig callback lookup to reduce allocations in asm-heavy translation.","result":"Targeted plan9asm bytealg test passed but wall time worsened from 1184.8ms to 1391.0ms, likely including recompilation/noise; primary metric did not improve.","rollback_reason":"Primary metric worsened under the current benchmark, so do not keep despite the plausible allocation reduction.","next_action_hint":"If revisiting, use a prebuilt test binary or an in-package benchmark that isolates TranslateSourceModuleForPkgWithOptions runtime from Go test recompilation overhead."}}
{"type":"config","name":"Record deferred plan9asm signature cache benchmark idea","metricName":"validation_failures","metricUnit":"","bestDirection":"lower"}
{"run":762,"commit":"f72381d","metric":0,"metrics":{"ideas_updated":1},"status":"keep","description":"record deferred plan9asm signature cache idea","timestamp":1777198062445,"segment":335,"confidence":null,"iterationTokens":178,"asi":{"hypothesis":"The plan9asm manual signature cache change was plausible but had a noisy/worse wall-time benchmark; preserve the idea with a better benchmark requirement instead of repeating it blindly.","result":"Ideas backlog now records the deferred extraAsmSigsAndDeclMap caching idea and notes to revisit only with a prebuilt test binary or isolated benchmark."}}
{"type":"config","name":"Monitor PR after deterministic object path CI progresses","metricName":"pr_check_failures","metricUnit":"","bestDirection":"lower"}
{"run":763,"commit":"008889e","metric":0,"metrics":{"pending_checks":47,"passed_checks":10,"skipped_checks":0},"status":"keep","description":"monitor PR while deterministic object path CI progresses","timestamp":1777198091645,"segment":336,"confidence":null,"iterationTokens":383,"asi":{"hypothesis":"The locally validated deterministic object path push should continue to show no CI failures as checks progress.","result":"No failed PR checks; 10 passed and 47 pending. Pending count includes multiple workflows/check suites after recent pushes."}}
{"type":"config","name":"Check clean go build after deterministic object paths","metricName":"go_build_ms","metricUnit":"ms","bestDirection":"lower"}
{"run":764,"commit":"57fd371","metric":10341.5,"metrics":{"go_build_min_ms":10300.8,"go_build_max_ms":10941.1,"runs":3},"status":"keep","description":"check clean go build after deterministic object paths","timestamp":1777198174991,"segment":337,"confidence":null,"iterationTokens":398,"asi":{"hypothesis":"Deterministic object path changes primarily improve external C/ASM compile runtime, but should not regress clean Go build of cmd/llgo and may slightly reduce compile package work by removing strings.ReplaceAll use.","result":"Median clean go build -a -tags=dev ./cmd/llgo was 10341.5ms over 3 runs (min 10300.8ms, max 10941.1ms), similar to the previous 10349.9ms check and below the 10382.9ms dispatcher baseline."}}
{"type":"config","name":"Optimize archive name formatting in crosscompile configs","metricName":"go_build_ms","metricUnit":"ms","bestDirection":"lower"}
{"run":765,"commit":"bd60543","metric":10911.7,"metrics":{"go_build_min_ms":10718.2,"go_build_max_ms":11191.6,"runs":3},"status":"keep","description":"baseline go build before archive name formatting change","timestamp":1777198284297,"segment":338,"confidence":null,"iterationTokens":398,"asi":{"hypothesis":"Replacing simple fmt.Sprintf archive-name construction in crosscompile file-list config packages with string concatenation could reduce Go frontend work slightly. Establish a fresh clean go build baseline first.","result":"Median clean go build -a -tags=dev ./cmd/llgo was 10911.7ms over 3 runs (min 10718.2ms, max 11191.6ms), noticeably noisier/slower than recent samples."}}
{"run":766,"commit":"95ec85d","metric":10551.5,"metrics":{"go_build_min_ms":10505,"go_build_max_ms":10584.7,"runs":3},"status":"keep","description":"replace fmt.Sprintf archive names with concatenation","timestamp":1777198389395,"segment":338,"confidence":null,"iterationTokens":4537,"asi":{"hypothesis":"Simple archive filenames in libc/rtlib config can use string concatenation instead of fmt.Sprintf, slightly reducing package frontend work and removing fmt imports from these generated-style file-list packages without changing outputs.","result":"libc and rtlib compile package tests passed. Clean go build median improved versus the noisy fresh baseline from 10911.7ms to 10551.5ms, though this likely includes substantial environmental noise; output filenames are semantically identical."}}
{"run":767,"commit":"085ff0b","metric":10573.8,"metrics":{"go_build_min_ms":10431.3,"go_build_max_ms":10951.4,"runs":5},"status":"keep","description":"confirm archive name concatenation go build impact","timestamp":1777198497092,"segment":338,"confidence":16.152466367713565,"iterationTokens":3926,"asi":{"hypothesis":"Because the fresh baseline for fmt.Sprintf removal was noisy, rerun a 5-sample clean go build confirmation before treating the small source change as useful.","result":"5-run median was 10573.8ms (min 10431.3ms, max 10951.4ms), close to the first post-change median 10551.5ms and below the noisy 10911.7ms baseline, but not clearly better than earlier unrelated 10341.5ms samples. Treat as a small safe cleanup rather than a major build-speed win."}}
{"type":"config","name":"Pre-push local validation after archive name concatenation","metricName":"validation_failures","metricUnit":"","bestDirection":"lower"}
{"run":768,"commit":"d36359f","metric":0,"metrics":{"crosscompile_packages_tested":4,"cmd_llgo_build":1,"ideas_updated":1},"status":"keep","description":"local validation before pushing archive name concatenation","timestamp":1777198578658,"segment":339,"confidence":null,"iterationTokens":222,"asi":{"hypothesis":"Before pushing archive-name concatenation changes, run relevant crosscompile tests, a dev llgo build, and verify notes per user request.","result":"go test ./internal/crosscompile/... passed, go build -tags=dev ./cmd/llgo passed, and ideas backlog records the small/noisy nature of the change."}}
{"type":"config","name":"Monitor PR after locally validated archive name concatenation push","metricName":"pr_check_failures","metricUnit":"","bestDirection":"lower"}
{"run":769,"commit":"6da0fed","metric":0,"metrics":{"pending_checks":12,"passed_checks":0,"skipped_checks":0},"status":"keep","description":"monitor PR after archive name concatenation push","timestamp":1777198622158,"segment":340,"confidence":null,"iterationTokens":385,"asi":{"hypothesis":"After local validation and push, archive-name concatenation changes should not show immediate CI failures.","result":"No failed PR checks immediately after push; 12 checks pending."}}
{"type":"config","name":"Monitor PR after archive name CI progresses","metricName":"pr_check_failures","metricUnit":"","bestDirection":"lower"}
{"run":770,"commit":"00af102","metric":0,"metrics":{"pending_checks":53,"passed_checks":4,"skipped_checks":0},"status":"keep","description":"monitor PR while archive name CI progresses","timestamp":1777198664717,"segment":341,"confidence":null,"iterationTokens":382,"asi":{"hypothesis":"The locally validated archive-name concatenation push should continue to show no CI failures as checks progress.","result":"No failed PR checks; 4 passed and 53 pending. Pending count includes multiple active workflow suites from recent pushes."}}
{"type":"config","name":"Precompute clang compiler flags for CompileGroup","metricName":"compile_group_ms","metricUnit":"ms","bestDirection":"lower"}
{"run":771,"commit":"be1c68a","metric":159.7,"metrics":{"compile_group_files":96},"status":"keep","description":"baseline CompileGroup before compiler flag precompute","timestamp":1777198691838,"segment":342,"confidence":null,"iterationTokens":528,"asi":{"hypothesis":"clang.Cmd.Compile merges environment/config flags for every source file. Establish a current 96-file CompileGroup baseline before adding a way to precompute merged compiler flags once per group.","result":"Current 96-file CompileGroup benchmark completed in 159.7ms."}}
{"run":772,"commit":"be1c68a","metric":166.8,"metrics":{"compile_group_files":96},"status":"discard","description":"precompute clang compiler flags per CompileGroup","timestamp":1777198739254,"segment":342,"confidence":null,"iterationTokens":3109,"asi":{"hypothesis":"Expose clang.Cmd.CompilerFlags/CompileWithFlags and precompute merged compiler flags once per CompileGroup to avoid environment flag parsing for every source file.","result":"internal/clang and compile package tests passed, but 96-file CompileGroup benchmark regressed from 159.7ms to 166.8ms; the extra API/state path did not help the dominant subprocess workload.","rollback_reason":"Primary metric worsened and the API expansion is not justified without a win.","next_action_hint":"Do not precompute clang flags unless a workload with very large env flags or an isolated benchmark shows a repeatable improvement."}}
{"type":"config","name":"Buffer CompileConfig task dispatch channel","metricName":"compile_group_ms","metricUnit":"ms","bestDirection":"lower"}
{"run":773,"commit":"d6d7c8c","metric":162.5,"metrics":{"compile_group_files":96},"status":"keep","description":"baseline CompileGroup before buffered task channel","timestamp":1777198760863,"segment":343,"confidence":null,"iterationTokens":526,"asi":{"hypothesis":"A small buffer on the CompileConfig task channel might reduce scheduler handoff overhead. Establish a current 96-file CompileGroup baseline before changing channel buffering.","result":"Current 96-file CompileGroup benchmark completed in 162.5ms."}}
{"run":774,"commit":"d6d7c8c","metric":172.6,"metrics":{"compile_group_files":96},"status":"discard","description":"buffer CompileConfig task channel by job count","timestamp":1777198780139,"segment":343,"confidence":null,"iterationTokens":985,"asi":{"hypothesis":"Buffering the CompileConfig worker task channel by the job count may reduce goroutine handoff overhead while preserving cancellation behavior.","result":"compile package tests passed, but 96-file CompileGroup benchmark regressed from 162.5ms to 172.6ms.","rollback_reason":"Primary metric worsened; unbuffered channel is already fine for this workload.","next_action_hint":"Do not add channel buffering without a workload that shows producer/consumer handoff overhead."}}
{"type":"config","name":"Monitor PR after latest pushed compile cleanups","metricName":"pr_check_failures","metricUnit":"","bestDirection":"lower"}
{"run":775,"commit":"1422748","metric":0,"metrics":{"pending_checks":44,"passed_checks":13,"skipped_checks":0},"status":"keep","description":"monitor PR while latest compile cleanups progress","timestamp":1777198798268,"segment":344,"confidence":null,"iterationTokens":383,"asi":{"hypothesis":"The latest locally validated pushed compile cleanups should continue to show no CI failures while checks progress.","result":"No failed PR checks; 13 passed and 44 pending."}}
{"type":"config","name":"Monitor PR for failures after compile cleanup pushes","metricName":"pr_check_failures","metricUnit":"","bestDirection":"lower"}
{"run":776,"commit":"acbb568","metric":0,"metrics":{"pending_checks":43,"passed_checks":14,"skipped_checks":0},"status":"keep","description":"monitor PR for failures after compile cleanup pushes","timestamp":1777198835572,"segment":345,"confidence":null,"iterationTokens":383,"asi":{"hypothesis":"CI should remain failure-free as latest locally validated compile cleanup checks progress.","result":"No failed PR checks; 14 passed and 43 pending."}}
{"type":"config","name":"Remove fmt from CompileGroup hot package","metricName":"compile_group_ms","metricUnit":"ms","bestDirection":"lower"}
{"run":777,"commit":"4745cf2","metric":162.9,"metrics":{"compile_group_files":96},"status":"keep","description":"baseline CompileGroup before removing fmt import","timestamp":1777198900272,"segment":346,"confidence":null,"iterationTokens":527,"asi":{"hypothesis":"CompileGroup hot code uses fmt for one env error, one progress line, and LibConfig.String. Replacing these with strconv/string concatenation may reduce package compile/runtime overhead. Establish current 96-file baseline.","result":"Current 96-file CompileGroup benchmark completed in 162.9ms."}}
{"run":778,"commit":"702bdea","metric":159.7,"metrics":{"compile_group_files":96},"status":"keep","description":"remove fmt from CompileGroup hot package","timestamp":1777198928880,"segment":346,"confidence":null,"iterationTokens":1216,"asi":{"hypothesis":"Replace simple fmt usage in internal/crosscompile/compile with errors/strconv and string concatenation to reduce package overhead while preserving messages and output strings.","result":"compile package tests passed. 96-file CompileGroup benchmark improved from 162.9ms to 159.7ms."}}
{"type":"config","name":"Check go build after removing fmt from CompileGroup","metricName":"go_build_ms","metricUnit":"ms","bestDirection":"lower"}
