{"run":836,"commit":"1cf5155","metric":0,"metrics":{"pending_checks":32,"passed_checks":29,"skipped_checks":0,"llgo_in_pr_diff":0},"status":"keep","description":"monitor PR after local dependency experiment reverted","timestamp":1777202046401,"segment":388,"confidence":null,"iterationTokens":460,"asi":{"hypothesis":"Local dependency experiments were reverted, so pushed CI should continue progressing without failures and without the root llgo binary in the PR diff.","result":"No failed PR checks; 29 passed, 32 pending, and gh pr diff does not include llgo."}}
{"type":"config","name":"Monitor PR after more archive optimization CI progress","metricName":"pr_check_failures","metricUnit":"","bestDirection":"lower"}
{"run":837,"commit":"49ea3d3","metric":0,"metrics":{"pending_checks":29,"passed_checks":32,"skipped_checks":0,"llgo_in_pr_diff":0},"status":"keep","description":"monitor PR after more archive optimization CI progress","timestamp":1777202099284,"segment":389,"confidence":null,"iterationTokens":461,"asi":{"hypothesis":"Latest pushed archive/lookup optimizations should continue to progress through CI without failures and without the root llgo binary in the PR diff.","result":"No failed PR checks; 32 passed, 29 pending, and gh pr diff does not include llgo."}}
{"type":"config","name":"Monitor PR after latest checks progress further","metricName":"pr_check_failures","metricUnit":"","bestDirection":"lower"}
{"run":838,"commit":"3e0eb4e","metric":1,"metrics":{"pending_checks":27,"passed_checks":33,"skipped_checks":0,"llgo_in_pr_diff":0},"status":"checks_failed","description":"monitor PR detected embedded macOS Intel esp32 failure","timestamp":1777202175906,"segment":390,"confidence":null,"iterationTokens":460,"asi":{"hypothesis":"Latest pushed archive/lookup optimizations should remain CI-failure-free as checks progress.","result":"PR monitoring found 1 failed check: llgo-embedded-macos-intel (19, 1.24.2, esp32), job 73071746501. gh pr diff still does not include llgo.","rollback_reason":"CI health check failed; need inspect job logs before any further optimization or push. Do not assume source regression until logs show failure cause.","next_action_hint":"Fetch the failed job log with gh run view/log and identify whether failure is related to CompileConfig/CompileGroup changes, external downloads, or a known transient."}}
{"type":"config","name":"Diagnose failed embedded macOS Intel esp32 check","metricName":"failure_related_to_changes","metricUnit":"","bestDirection":"lower"}
{"run":839,"commit":"fe27047","metric":0,"metrics":{"gh_log_status":0,"failed_job_logs":1},"status":"keep","description":"failed job logs not yet available","timestamp":1777202214306,"segment":391,"confidence":null,"iterationTokens":465,"asi":{"hypothesis":"Fetch failed macOS embedded esp32 job logs to determine whether the CI failure is related to recent CompileConfig/CompileGroup changes.","result":"gh run view reported the workflow run is still in progress and logs will be available when complete, so no diagnostic content was available yet. The failure relationship remains unknown despite the placeholder metric.","next_action_hint":"Wait and retry fetching job 73071746501 logs after the workflow run completes or GitHub makes logs available."}}
{"type":"config","name":"Poll PR failure state after log unavailable","metricName":"pr_check_failures","metricUnit":"","bestDirection":"lower"}
{"run":840,"commit":"fe27047","metric":2,"metrics":{"pending_checks":26,"passed_checks":35,"skipped_checks":0},"status":"checks_failed","description":"poll PR failure state after logs unavailable","timestamp":1777202272537,"segment":392,"confidence":null,"iterationTokens":378,"asi":{"hypothesis":"After waiting, determine whether the macOS embedded failure is still present and whether additional failures appeared.","result":"PR now reports 2 failed checks: llgo-embedded-macos-intel (19, 1.24.2, esp32) and codecov/patch. 35 checks passed and 26 are pending.","rollback_reason":"CI still has failures; inspect the macOS job log as soon as available before further code changes. Codecov patch failure may be secondary/noise from coverage reporting but should be checked after primary job diagnosis.","next_action_hint":"Retry gh run view --job 73071746501 --log; if unavailable, inspect run summary or wait until workflow completion."}}
{"type":"config","name":"Retry failed macOS embedded job log fetch","metricName":"failure_related_to_changes","metricUnit":"","bestDirection":"lower"}
{"run":841,"commit":"f340e5d","metric":0,"metrics":{"gh_log_fetched":0,"failed_job_logs":1},"status":"keep","description":"retry failed macOS job log fetch still unavailable","timestamp":1777202303990,"segment":393,"confidence":null,"iterationTokens":502,"asi":{"hypothesis":"Retry fetching the failed macOS embedded esp32 job log to classify whether it is related to CompileConfig/CompileGroup changes.","result":"Logs are still unavailable because GitHub reports run 24955050737 is still in progress. No classification possible yet.","next_action_hint":"Poll again after more checks complete, or use gh api job endpoint if logs remain unavailable after run completion."}}
{"type":"config","name":"Classify macOS embedded dependency setup failure","metricName":"failure_related_to_changes","metricUnit":"","bestDirection":"lower"}
{"run":842,"commit":"2bdffc6","metric":0,"metrics":{"gh_log_fetched":1,"failed_job_logs":1},"status":"keep","description":"classify macOS embedded failure as external qemu 502","timestamp":1777202387413,"segment":394,"confidence":null,"iterationTokens":901,"asi":{"hypothesis":"Use GitHub job logs API to classify the failed macOS embedded esp32 job after gh run view logs remained unavailable.","result":"Logs show failure in Install embedded dependencies while downloading Espressif QEMU x86_64-apple-darwin tarball: repeated curl 502 errors, then exit code 22. No llvm-ar, CompileGroup, archive, or compiler output appears before the failure.","classification":"unrelated external download failure (Espressif QEMU 502), not caused by recent CompileConfig/CompileGroup changes.","next_action_hint":"Do not revert compile optimizations for this failure. Continue monitoring; if this 502 recurs, consider retry/backoff for install-esp-qemu.sh as a separate resilience improvement, not a compile-speed optimization."}}
{"type":"config","name":"Monitor PR after classifying QEMU 502 failure","metricName":"pr_check_failures","metricUnit":"","bestDirection":"lower"}
{"run":843,"commit":"7a69b0b","metric":2,"metrics":{"pending_checks":25,"passed_checks":36,"skipped_checks":0},"status":"keep","description":"monitor PR after classifying QEMU 502 failure","timestamp":1777202420621,"segment":395,"confidence":null,"iterationTokens":377,"asi":{"hypothesis":"After classifying the macOS embedded failure as unrelated QEMU 502, continue monitoring to see whether additional failures appear.","result":"Still 2 failed checks: the known llgo-embedded-macos-intel esp32 QEMU 502 failure and codecov/patch; 36 passed and 25 pending.","classification":"Known failed job remains unrelated external download failure; codecov/patch likely reflects coverage service/check status rather than compile changes, but final PR state still needs monitoring."}}
{"type":"config","name":"Record deferred QEMU 502 resilience idea","metricName":"validation_failures","metricUnit":"","bestDirection":"lower"}
{"run":844,"commit":"388189b","metric":0,"metrics":{"ideas_updated":1},"status":"keep","description":"record deferred QEMU 502 resilience idea","timestamp":1777202478991,"segment":396,"confidence":null,"iterationTokens":171,"asi":{"hypothesis":"The recurring Espressif QEMU 502 failure is unrelated to the compile optimization target, but should be captured as deferred CI-resilience work if the target changes back.","result":"Ideas backlog now records the macOS Intel esp32 Install embedded dependencies failure caused by repeated QEMU download 502 responses and suggests retry/backoff, mirror, or cache handling only for a future CI-resilience target."}}
{"type":"config","name":"Check clean go build after archive worker optimizations","metricName":"go_build_ms","metricUnit":"ms","bestDirection":"lower"}
{"run":845,"commit":"e7cc7a1","metric":10802.9,"metrics":{"go_build_min_ms":10657.3,"go_build_max_ms":11253.3,"runs":3},"status":"keep","description":"check clean go build after archive worker optimizations","timestamp":1777202549149,"segment":397,"confidence":null,"iterationTokens":406,"asi":{"hypothesis":"Archive worker optimizations target LLGo external C/ASM builds, but should not materially regress clean cmd/llgo Go builds; capture a noisy 3-run sample using -o /dev/null to avoid root llgo output.","result":"Median clean go build -o /dev/null -a -tags=dev ./cmd/llgo was 10802.9ms (min 10657.3ms, max 11253.3ms), within the recent noisy range and not a basis for additional source changes without paired A/B."}}
{"type":"config","name":"Monitor PR after go build check","metricName":"pr_check_failures","metricUnit":"","bestDirection":"lower"}
{"run":846,"commit":"e65ce51","metric":2,"metrics":{"pending_checks":23,"passed_checks":38,"skipped_checks":0},"status":"keep","description":"monitor PR after go build check","timestamp":1777202581334,"segment":398,"confidence":null,"iterationTokens":373,"asi":{"hypothesis":"Continue monitoring PR health after local go-build check; known failures should remain the classified external QEMU 502 and codecov patch.","result":"Still 2 failed checks: known macOS Intel esp32 QEMU 502 failure and codecov/patch. 38 passed, 23 pending."}}
{"type":"config","name":"Preallocate CompileConfig task list","metricName":"compile_config_ms","metricUnit":"ms","bestDirection":"lower"}
{"run":847,"commit":"d36005e","metric":244.9,"metrics":{"compile_config_groups":8,"compile_config_files":128,"runs":7},"status":"keep","description":"baseline CompileConfig task list allocation","timestamp":1777202617910,"segment":399,"confidence":null,"iterationTokens":649,"asi":{"hypothesis":"CompileConfig appends one compileTask per source without preallocating capacity. Establish a current 8-group/128-file baseline before preallocating the task list.","result":"7-run median was 244.9ms, but one 435.1ms outlier indicates high local noise in this sample."}}
{"run":848,"commit":"d36005e","metric":275.8,"metrics":{"compile_config_groups":8,"compile_config_files":128,"runs":7},"status":"discard","description":"preallocate CompileConfig compileTask slice","timestamp":1777202646098,"segment":399,"confidence":null,"iterationTokens":1241,"asi":{"hypothesis":"Preallocating the compileTask slice to the total source-file count should avoid append growth allocations in CompileConfig.Compile.","result":"compile package tests passed, but 8-group/128-file benchmark regressed from a noisy 244.9ms baseline to 275.8ms. Allocation saving is not material in the subprocess-dominated workload.","rollback_reason":"Primary metric worsened; avoid code churn for task slice preallocation.","next_action_hint":"Do not revisit task-list preallocation unless an allocation profile shows it matters outside external process time."}}
{"type":"config","name":"Record rejected task preallocation idea","metricName":"validation_failures","metricUnit":"","bestDirection":"lower"}
{"run":849,"commit":"b2a8e48","metric":0,"metrics":{"ideas_updated":1},"status":"keep","description":"record rejected task preallocation idea","timestamp":1777202681970,"segment":400,"confidence":null,"iterationTokens":169,"asi":{"hypothesis":"Record the rejected CompileConfig task-slice preallocation experiment so future iterations do not repeat it without allocation evidence.","result":"Ideas backlog now notes task-slice preallocation was rejected because allocation savings were not visible in the subprocess-dominated benchmark."}}
{"type":"config","name":"Monitor PR after local task preallocation discard","metricName":"pr_check_failures","metricUnit":"","bestDirection":"lower"}
{"run":850,"commit":"ee3ac44","metric":2,"metrics":{"pending_checks":19,"passed_checks":42,"skipped_checks":0},"status":"keep","description":"monitor PR after local task preallocation discard","timestamp":1777202713937,"segment":401,"confidence":null,"iterationTokens":375,"asi":{"hypothesis":"Local task-preallocation experiment was discarded, so pushed CI state should be unchanged except for known failures.","result":"Still 2 failed checks: known unrelated macOS Intel esp32 QEMU 502 and codecov/patch. 42 passed, 19 pending."}}
{"type":"config","name":"Race validate CompileConfig parallel archive changes","metricName":"validation_failures","metricUnit":"","bestDirection":"lower"}
{"run":851,"commit":"c9fecd0","metric":0,"metrics":{"race_packages_tested":1},"status":"keep","description":"race validate CompileConfig parallel archive changes","timestamp":1777202751599,"segment":402,"confidence":null,"iterationTokens":148,"asi":{"hypothesis":"The parallel archive and multi-group worker changes use goroutines and per-index result slices; run the race detector on the compile package to validate there are no data races.","result":"go test -race ./internal/crosscompile/compile passed."}}
{"type":"config","name":"Avoid single-group task scan","metricName":"compile_group_ms","metricUnit":"ms","bestDirection":"lower"}
{"run":852,"commit":"910b2d7","metric":208.4,"metrics":{"compile_group_files":128,"runs":9},"status":"keep","description":"baseline single-group task scan overhead","timestamp":1777206776911,"segment":403,"confidence":null,"iterationTokens":573,"asi":{"hypothesis":"There may still be avoidable overhead in the common CompileGroup path from building a one-group task list and scanning it in singleTaskGroup; establish a current 128-file baseline before considering a narrower change.","result":"9-run median was 208.4ms, with one first-run outlier at 454.2ms. This matches the prior kept single-group specialization range, so any follow-up must show repeatable improvement and avoid redoing the already-rejected direct single-group helper refactor."}}
{"run":853,"commit":"910b2d7","metric":211.8,"metrics":{"compile_group_files":128,"runs":9},"status":"discard","description":"avoid singleTaskGroup scan by tracking active group","timestamp":1777206807318,"segment":403,"confidence":null,"iterationTokens":1823,"asi":{"hypothesis":"Tracking whether tasks come from only one active group while constructing the task list should avoid the O(n) singleTaskGroup scan in the common CompileGroup path.","result":"compile package tests passed, but 128-file CompileGroup median regressed from 208.4ms to 211.8ms. The scan is not a material bottleneck relative to external clang/archive work; added branch state is not worth it.","rollback_reason":"Primary benchmark worsened and change duplicates a previously rejected direction around direct/special single-group path overhead.","next_action_hint":"Avoid more micro-optimizations around task scanning/single-group dispatch unless an allocation/profile trace shows this specific overhead dominates."}}
{"type":"config","name":"Record rejected singleTaskGroup scan idea","metricName":"validation_failures","metricUnit":"","bestDirection":"lower"}
{"run":854,"commit":"9ff2bb2","metric":0,"metrics":{"ideas_updated":1},"status":"keep","description":"record rejected singleTaskGroup scan idea","timestamp":1777206821123,"segment":404,"confidence":null,"iterationTokens":171,"asi":{"hypothesis":"Record the rejected active-group tracking experiment so future loops do not repeat the task-scan micro-optimization.","result":"Ideas backlog now notes the singleTaskGroup scan avoidance experiment regressed 128-file CompileGroup median from 208.4ms to 211.8ms."}}
{"type":"config","name":"Monitor PR after QEMU 502 rerun progress","metricName":"pr_check_failures","metricUnit":"","bestDirection":"lower"}
{"run":855,"commit":"518af19","metric":1,"metrics":{"pending_checks":1,"passed_checks":61,"skipped_checks":1,"llgo_in_pr_diff":0},"status":"keep","description":"monitor PR after QEMU 502 rerun progress","timestamp":1777206848218,"segment":405,"confidence":null,"iterationTokens":450,"asi":{"hypothesis":"The classified external QEMU 502 failure should clear on rerun, leaving no source-related failures; root llgo should remain absent from PR diff.","result":"PR now has 61 passed, 1 pending (llgo-embedded-macos-intel esp32 rerun), 1 skipped release, and only codecov/patch failing. gh pr diff still does not include root llgo.","classification":"No source-related CI failure observed; codecov/patch is a coverage-service status to monitor separately."}}
{"type":"config","name":"Profile current clean go build compile hotspots","metricName":"go_build_profile_ms","metricUnit":"ms","bestDirection":"lower"}
{"run":856,"commit":"518af19","metric":0,"metrics":{"compile_invocations":0},"status":"crash","description":"profile current clean go build compile hotspots with toolexec","timestamp":1777206930304,"segment":406,"confidence":null,"iterationTokens":694,"asi":{"hypothesis":"Use a temporary -toolexec wrapper to identify current clean cmd/llgo compile hotspots after recent source changes.","result":"The build/profiling command likely completed but the experiment exited nonzero because cleanup tried to remove read-only module-cache files under the temporary GOMODCACHE. This repeats the known read-only module-cache cleanup pitfall.","rollback_reason":"Harness failure, not a source failure; no code changes should be inferred from this run.","next_action_hint":"Retry with cleanup that chmods the temp module cache before removal or leaves cleanup to /tmp, and capture top compile package timings."}}
{"run":857,"commit":"6b10a6a","metric":12528.4,"metrics":{"compile_invocations":310,"total_compile_tool_ms":14042.4},"status":"keep","description":"profile current clean go build compile hotspots","timestamp":1777206962936,"segment":406,"confidence":null,"iterationTokens":1729,"asi":{"hypothesis":"Use a fixed temporary -toolexec wrapper to identify current clean cmd/llgo compile hotspots after recent source changes.","result":"Instrumented clean build wall time was 12528.4ms with 310 compile invocations. Top package compile times: net 715ms, runtime 557ms, github.com/goplus/plan9asm 468ms, golang.org/x/tools/internal/stdlib 453ms, go/types 440ms, net/http 413ms, archive/tar 255ms, crypto/tls 247ms, math/big 238ms, text/template 219ms, x/sys/unix 217ms, go/ssa 208ms, llgo/ssa 201ms, llvm 197ms, archive/zip 185ms, yaml.v3 170ms, encoding/json 164ms, llgo/internal/build 132ms.","next_action_hint":"Promising pure go-build work remains dependency-graph reduction: avoid cmd/llgo depending on net/http/archive/tar/archive/zip/crypto/tls if possible without changing cache formats or command behavior. Be cautious: moving fetch logic to another package only helps if cmd/llgo no longer imports it on the normal build path."}}
{"type":"config","name":"Preallocate archiveObjects argument slice","metricName":"compile_config_ms","metricUnit":"ms","bestDirection":"lower"}
{"run":858,"commit":"1bc30bd","metric":209.3,"metrics":{"compile_config_groups":8,"compile_config_files":128,"runs":9},"status":"keep","description":"baseline archiveObjects arg slice allocation","timestamp":1777207026485,"segment":407,"confidence":null,"iterationTokens":654,"asi":{"hypothesis":"archiveObjects allocates a two-element args slice and then appends all object files, likely forcing a second allocation per archive. Establish 8-group/128-file baseline before preallocating the args capacity.","result":"9-run CompileConfig median was 209.3ms, matching the recent confirmed 209.7ms range."}}
{"run":859,"commit":"1bc30bd","metric":208.8,"metrics":{"compile_config_groups":8,"compile_config_files":128,"runs":9},"status":"discard","description":"preallocate archiveObjects args slice","timestamp":1777207056882,"segment":407,"confidence":null,"iterationTokens":1190,"asi":{"hypothesis":"Preallocating archiveObjects command arguments to len(objFiles)+2 should avoid one slice growth allocation per archive in multi-group CompileConfig builds.","result":"compile package tests passed and median moved from 209.3ms to 208.8ms, but the 0.5ms delta is far below run-to-run noise (change runs ranged 203.2–223.1ms). This is not an obvious/repeatable build-speed improvement.","rollback_reason":"Improvement is too small/noisy for user requirement of clear local gains before pushing; avoid code churn for a micro-allocation optimization.","next_action_hint":"Only revisit archive argument allocation if a focused allocation profile shows archiveObjects slice growth matters."}}
{"type":"config","name":"Record rejected archive argv preallocation","metricName":"validation_failures","metricUnit":"","bestDirection":"lower"}
{"run":860,"commit":"bc35745","metric":0,"metrics":{"ideas_updated":1},"status":"keep","description":"record rejected archive argv preallocation","timestamp":1777207076397,"segment":408,"confidence":null,"iterationTokens":169,"asi":{"hypothesis":"Record the archiveObjects argv preallocation result to prevent repeating a noise-level micro-optimization.","result":"Ideas backlog now states archiveObjects argv preallocation showed only a 0.5ms/noise-level delta and was rejected as non-obvious code churn."}}
{"type":"config","name":"Monitor PR after QEMU rerun likely complete","metricName":"pr_check_failures","metricUnit":"","bestDirection":"lower"}
