{"run":1115,"commit":"fe3ef53","metric":129,"metrics":{"parse_simple_metadata_bytes_op":32,"parse_simple_metadata_allocs_op":1,"runs":9},"status":"discard","description":"delay metadata allocation in parseManifestMetadata simple path","timestamp":1777231002157,"segment":572,"confidence":null,"iterationTokens":1851,"asi":{"hypothesis":"Delaying the empty cacheArchiveMetadata allocation until after the simple metadata fast path can remove one allocation for simple generated metadata blocks.","result":"internal/build tests passed and simple metadata parse improved from 134 ns/op, 64 B/op, 2 allocs/op to 129 ns/op, 32 B/op, 1 alloc/op, but wall-time gain is only ~5ns beyond the already-kept fast parser.","rollback_reason":"Allocation improvement is real but the absolute wall-time gain is too small to justify extra branching/duplication in parseManifestMetadata.","next_action_hint":"Keep the main simple metadata parser; do not chase the remaining single allocation unless cache-hit profiles show metadata parse dominates."}}
{"type":"config","name":"Record rejected delayed metadata allocation","metricName":"validation_failures","metricUnit":"","bestDirection":"lower"}
{"run":1116,"commit":"9913394","metric":0,"metrics":{"ideas_updated":1},"status":"keep","description":"record rejected delayed metadata allocation","timestamp":1777231028346,"segment":573,"confidence":null,"iterationTokens":172,"asi":{"hypothesis":"Record the rejected delayed cacheArchiveMetadata allocation so future loops do not chase a 5ns improvement after the main simple metadata parser win.","result":"Ideas backlog records the 134ns->129ns and 2->1 alloc result plus too-small rejection rationale."}}
{"type":"config","name":"Monitor PR fast metadata parser progress","metricName":"pr_check_failures","metricUnit":"","bestDirection":"lower"}
{"run":1117,"commit":"1ea2d34","metric":0,"metrics":{"pending_checks":42,"passed_checks":15,"skipped_checks":0,"llgo_in_pr_diff":0},"status":"keep","description":"monitor PR fast metadata parser progress","timestamp":1777231049336,"segment":574,"confidence":null,"iterationTokens":446,"asi":{"hypothesis":"The PR run after the fast metadata parser push should continue progressing without failures and root llgo should stay absent from the diff.","result":"Current PR checks: 0 failures, 42 pending, 15 passed, 0 skipped; root llgo absent from PR diff.","next_action_hint":"Poll later for completion; continue local A/B experiments."}}
{"type":"config","name":"Fast parse simple YAML metadata link args","metricName":"parse_linkargs_metadata_ns_op","metricUnit":"","bestDirection":"lower"}
{"run":1118,"commit":"a48ff60","metric":4852,"metrics":{"parse_linkargs_metadata_bytes_op":9687,"parse_linkargs_metadata_allocs_op":105,"runs":9},"status":"keep","description":"baseline metadata link_args parse","timestamp":1777231095948,"segment":575,"confidence":null,"iterationTokens":670,"asi":{"hypothesis":"Generated metadata with simple unquoted link_args still falls back to YAML after the boolean-only fast parser; a conservative simple-list parser could speed cache hits for external-link packages while preserving YAML fallback for quoted/complex args.","result":"Baseline parseManifestMetadata for simple link_args metadata median: 4852 ns/op, 9687 B/op, 105 allocs/op."}}
{"run":1119,"commit":"ad242cd","metric":279,"metrics":{"parse_linkargs_metadata_bytes_op":128,"parse_linkargs_metadata_allocs_op":3,"parse_simple_metadata_ns_op":98,"parse_simple_metadata_bytes_op":64,"parse_simple_metadata_allocs_op":2,"runs":9},"status":"keep","description":"fast parse simple YAML metadata link args","timestamp":1777231185315,"segment":575,"confidence":null,"iterationTokens":3115,"asi":{"hypothesis":"Extending the generated-metadata fast parser to simple unquoted link_args list items can avoid YAML unmarshal for common external-link cache metadata while falling back for quoted/complex scalars.","result":"internal/build tests passed. Simple link_args metadata parse improved from 4852 ns/op, 9687 B/op, 105 allocs/op to 279 ns/op, 128 B/op, 3 allocs/op. Boolean-only metadata stayed fast at 98 ns/op, 64 B/op, 2 allocs/op.","next_action_hint":"Validate broad tests and temp cmd/llgo build before pushing; consider whether scalar fallback rules are conservative enough."}}
{"type":"config","name":"Validate fast simple link_args metadata parser","metricName":"validation_failures","metricUnit":"","bestDirection":"lower"}
{"run":1120,"commit":"875ab35","metric":0,"metrics":{"packages_tested":5,"temp_builds":1},"status":"keep","description":"validate fast simple link_args metadata parser","timestamp":1777231231770,"segment":576,"confidence":null,"iterationTokens":293,"asi":{"hypothesis":"The fast link_args parser should preserve fallback for quoted/complex link args, pass package tests and crosscompile tests, and build cmd/llgo without root artifact.","result":"go test ./internal/build, go test ./internal/crosscompile/..., and temp-path go build -tags=dev ./cmd/llgo passed; root llgo was not created. Tests cover simple -lm/-lpthread parsing and quoted link_args fallback to YAML."}}
{"type":"config","name":"Record fast simple link_args metadata parser","metricName":"validation_failures","metricUnit":"","bestDirection":"lower"}
{"run":1121,"commit":"87d44ca","metric":0,"metrics":{"ideas_updated":1},"status":"keep","description":"record fast simple link_args metadata parser","timestamp":1777231260565,"segment":577,"confidence":null,"iterationTokens":181,"asi":{"hypothesis":"Record the kept simple link_args metadata parser and its conservative YAML fallback in ideas backlog.","result":"Ideas backlog records the link_args metadata parse improvement from 4852ns/op to 279ns/op and fallback for quoted/complex scalars."}}
{"type":"config","name":"Monitor PR after pushing fast link_args parser","metricName":"pr_check_failures","metricUnit":"","bestDirection":"lower"}
{"run":1122,"commit":"938872c","metric":0,"metrics":{"pending_checks":18,"passed_checks":1,"skipped_checks":0,"llgo_in_pr_diff":0},"status":"keep","description":"monitor PR after pushing fast link_args parser","timestamp":1777231319771,"segment":578,"confidence":null,"iterationTokens":452,"asi":{"hypothesis":"After pushing the fast simple link_args metadata parser, the new PR run should start without immediate failures and root llgo should remain absent from the diff.","result":"New PR checks: 0 failures, 18 pending, 1 passed, 0 skipped; root llgo absent from PR diff.","next_action_hint":"Poll later for completion; continue local A/B experiments before further source pushes."}}
{"type":"config","name":"Allow comma in simple metadata link_args parser","metricName":"parse_comma_linkargs_metadata_ns_op","metricUnit":"","bestDirection":"lower"}
{"run":1123,"commit":"3224b66","metric":4269,"metrics":{"parse_comma_linkargs_metadata_bytes_op":9295,"parse_comma_linkargs_metadata_allocs_op":96,"runs":9},"status":"keep","description":"baseline comma link_args metadata parse","timestamp":1777231366682,"segment":579,"confidence":null,"iterationTokens":643,"asi":{"hypothesis":"The simple metadata scalar guard currently rejects commas, causing common linker-style args like -Wl,--gc-sections to fall back to YAML. Plain YAML scalars can contain commas, so allowing comma may safely extend the fast path.","result":"Baseline comma link_args metadata parse falls back to YAML: 4269 ns/op, 9295 B/op, 96 allocs/op."}}
{"run":1124,"commit":"7bef397","metric":190,"metrics":{"parse_comma_linkargs_metadata_bytes_op":128,"parse_comma_linkargs_metadata_allocs_op":3,"runs":9},"status":"keep","description":"allow comma in simple metadata link_args parser","timestamp":1777231432016,"segment":579,"confidence":null,"iterationTokens":1582,"asi":{"hypothesis":"Comma is safe in plain YAML scalars and common in linker args; removing it from the conservative reject set should let -Wl style link_args use the fast metadata parser while retaining fallback for quotes/brackets/comments/etc.","result":"internal/build tests passed. Comma link_args metadata parse improved from 4269 ns/op, 9295 B/op, 96 allocs/op to 190 ns/op, 128 B/op, 3 allocs/op."}}
{"type":"config","name":"Validate comma link_args metadata fast path","metricName":"validation_failures","metricUnit":"","bestDirection":"lower"}
{"run":1125,"commit":"e9f3d7f","metric":0,"metrics":{"packages_tested":5,"temp_builds":1},"status":"keep","description":"validate comma link_args metadata fast path","timestamp":1777231487888,"segment":580,"confidence":null,"iterationTokens":294,"asi":{"hypothesis":"Allowing comma in simple metadata link_args should remain covered by tests, pass build/crosscompile suites, and build cmd/llgo without root artifact.","result":"go test ./internal/build, go test ./internal/crosscompile/..., and temp-path go build -tags=dev ./cmd/llgo passed; root llgo was not created. Tests include -Wl,--gc-sections parsing."}}
{"type":"config","name":"Record comma link_args metadata fast path","metricName":"validation_failures","metricUnit":"","bestDirection":"lower"}
{"run":1126,"commit":"60d7b0d","metric":0,"metrics":{"ideas_updated":1},"status":"keep","description":"record comma link_args metadata fast path","timestamp":1777231515928,"segment":581,"confidence":null,"iterationTokens":178,"asi":{"hypothesis":"Record the kept comma link_args metadata fast-path extension so future loops understand the scalar guard choice.","result":"Ideas backlog records the -Wl comma link_args improvement from 4269ns/op to 190ns/op and allocation drop from 96 to 3."}}
{"type":"config","name":"Monitor PR after pushing comma link_args fast path","metricName":"pr_check_failures","metricUnit":"","bestDirection":"lower"}
{"run":1127,"commit":"244bed0","metric":0,"metrics":{"pending_checks":46,"passed_checks":2,"skipped_checks":0,"llgo_in_pr_diff":0},"status":"keep","description":"monitor PR after pushing comma link_args fast path","timestamp":1777231568293,"segment":582,"confidence":null,"iterationTokens":453,"asi":{"hypothesis":"After pushing comma support in the simple link_args metadata parser, the new PR run should start without immediate failures and root llgo should remain absent from the diff.","result":"New PR checks: 0 failures, 46 pending, 2 passed, 0 skipped; root llgo absent from PR diff.","next_action_hint":"Poll later for completion; continue local experiments before further source pushes."}}
{"type":"config","name":"Fast append simple YAML cache metadata","metricName":"append_simple_metadata_ns_op","metricUnit":"","bestDirection":"lower"}
{"run":1128,"commit":"d0b0c0e","metric":3693,"metrics":{"append_simple_metadata_bytes_op":17349,"append_simple_metadata_allocs_op":56,"runs":9},"status":"keep","description":"baseline append simple YAML metadata","timestamp":1777231604933,"segment":583,"confidence":null,"iterationTokens":656,"asi":{"hypothesis":"saveToCache still uses yaml.Marshal to append simple generated metadata. A conservative manual YAML emitter for simple link_args/need_rt/need_py_init with fallback for complex scalars may speed cache saves while keeping YAML format.","result":"Baseline appendManifestMetadata for simple metadata median: 3693 ns/op, 17349 B/op, 56 allocs/op."}}
{"run":1129,"commit":"b801c4a","metric":146,"metrics":{"append_simple_metadata_bytes_op":368,"append_simple_metadata_allocs_op":2,"runs":9},"status":"keep","description":"fast append simple YAML cache metadata","timestamp":1777231700101,"segment":583,"confidence":null,"iterationTokens":4426,"asi":{"hypothesis":"A manual YAML emitter for simple generated metadata can avoid yaml.Marshal during saveToCache while falling back for complex link args to preserve semantics and YAML cache format.","result":"internal/build tests passed. appendManifestMetadata for simple metadata improved from 3693 ns/op, 17349 B/op, 56 allocs/op to 146 ns/op, 368 B/op, 2 allocs/op.","next_action_hint":"Run broad validation and temp cmd/llgo build; verify metadata-before-deps behavior remains covered."}}
{"type":"config","name":"Validate fast append simple metadata","metricName":"validation_failures","metricUnit":"","bestDirection":"lower"}
{"run":1130,"commit":"edfc736","metric":0,"metrics":{"packages_tested":5,"temp_builds":1},"status":"keep","description":"validate fast append simple metadata","timestamp":1777231750788,"segment":584,"confidence":null,"iterationTokens":297,"asi":{"hypothesis":"Fast simple metadata emission should preserve parseability, metadata-before-deps insertion, fallback coverage, and cmd/llgo build health.","result":"go test ./internal/build, go test ./internal/crosscompile/..., and temp-path go build -tags=dev ./cmd/llgo passed; root llgo was not created. Existing tests cover metadata-before-deps placement and parsing; new tests cover simple emitter and complex fallback."}}
{"type":"config","name":"Record fast append simple metadata","metricName":"validation_failures","metricUnit":"","bestDirection":"lower"}
{"run":1131,"commit":"bcb7476","metric":0,"metrics":{"ideas_updated":1},"status":"keep","description":"record fast append simple metadata","timestamp":1777231781749,"segment":585,"confidence":null,"iterationTokens":177,"asi":{"hypothesis":"Record the kept fast simple metadata emitter and its fallback scope so future loops know saveToCache metadata YAML emission is already optimized for simple generated metadata.","result":"Ideas backlog records appendManifestMetadata improvement from 3693ns/op to 146ns/op and allocation drop from 56 to 2."}}
{"type":"config","name":"Monitor PR after pushing fast metadata append","metricName":"pr_check_failures","metricUnit":"","bestDirection":"lower"}
{"run":1132,"commit":"ae309a2","metric":0,"metrics":{"pending_checks":18,"passed_checks":2,"skipped_checks":0,"llgo_in_pr_diff":0},"status":"keep","description":"monitor PR after pushing fast metadata append","timestamp":1777231840411,"segment":586,"confidence":null,"iterationTokens":451,"asi":{"hypothesis":"After pushing the fast simple metadata emitter, the new PR run should start without immediate failures and root llgo should remain absent from the diff.","result":"New PR checks: 0 failures, 18 pending, 2 passed, 0 skipped; root llgo absent from PR diff.","next_action_hint":"Poll later for completion; continue local A/B experiments before further source pushes."}}
{"type":"config","name":"Monitor PR fast metadata append progress","metricName":"pr_check_failures","metricUnit":"","bestDirection":"lower"}
{"run":1133,"commit":"5443e1c","metric":0,"metrics":{"pending_checks":52,"passed_checks":6,"skipped_checks":0,"llgo_in_pr_diff":0},"status":"keep","description":"monitor PR fast metadata append progress","timestamp":1777231876271,"segment":587,"confidence":null,"iterationTokens":446,"asi":{"hypothesis":"The PR run after fast metadata append should continue progressing without failures and root llgo should remain absent from the diff.","result":"Current PR checks: 0 failures, 52 pending, 6 passed, 0 skipped; root llgo absent from PR diff.","next_action_hint":"Poll later for completion; continue local build-performance experiments."}}
{"type":"config","name":"Avoid copying link args when appending cache metadata","metricName":"save_to_cache_metadata_ns_op","metricUnit":"","bestDirection":"lower"}
{"run":1134,"commit":"5660ccc","metric":294400,"metrics":{"save_to_cache_metadata_bytes_op":38517,"save_to_cache_metadata_allocs_op":41,"runs":9},"status":"keep","description":"baseline saveToCache metadata link arg copy","timestamp":1777231919263,"segment":588,"confidence":null,"iterationTokens":949,"asi":{"hypothesis":"saveToCache copies pkg.LinkArgs into a short-lived manifestMetadata before appending metadata; since metadata emission only reads the slice, using pkg.LinkArgs directly may save an allocation in cache saves with link args.","result":"Baseline saveToCache with simple metadata and small archive: 294400 ns/op, 38517 B/op, 41 allocs/op. File copy dominates, so any link-args copy win may be small."}}
{"run":1135,"commit":"5660ccc","metric":297562,"metrics":{"save_to_cache_metadata_bytes_op":38485,"save_to_cache_metadata_allocs_op":40,"runs":9},"status":"discard","description":"avoid copying link args when appending cache metadata","timestamp":1777231986217,"segment":588,"confidence":null,"iterationTokens":1709,"asi":{"hypothesis":"Using pkg.LinkArgs directly in the short-lived manifestMetadata should save one allocation in saveToCache metadata writes.","result":"internal/build tests passed and one allocation/32B was saved, but saveToCache benchmark worsened/noised from 294400 ns/op to 297562 ns/op because file copy/atomic write dominates.","rollback_reason":"Primary saveToCache wall time worsened; aliasing pkg.LinkArgs is not worth a tiny allocation reduction.","next_action_hint":"Keep the defensive LinkArgs copy in saveToCache; focus on larger cache I/O or manifest serialization costs."}}
{"type":"config","name":"Record rejected saveToCache LinkArgs aliasing","metricName":"validation_failures","metricUnit":"","bestDirection":"lower"}
{"run":1136,"commit":"93c7b1e","metric":0,"metrics":{"ideas_updated":1},"status":"keep","description":"record rejected saveToCache LinkArgs aliasing","timestamp":1777232028239,"segment":589,"confidence":null,"iterationTokens":176,"asi":{"hypothesis":"Record the rejected saveToCache LinkArgs aliasing experiment so future loops keep the defensive copy unless profiles show it matters.","result":"Ideas backlog records the one-allocation saving and 294400ns->297562ns wall-time non-improvement."}}
{"type":"config","name":"Monitor PR fast metadata append continued","metricName":"pr_check_failures","metricUnit":"","bestDirection":"lower"}
{"run":1137,"commit":"747b98b","metric":0,"metrics":{"pending_checks":42,"passed_checks":16,"skipped_checks":0,"llgo_in_pr_diff":0},"status":"keep","description":"monitor PR fast metadata append continued","timestamp":1777232059071,"segment":590,"confidence":null,"iterationTokens":446,"asi":{"hypothesis":"The PR run after fast metadata append should continue without failures and root llgo should remain absent from the diff.","result":"Current PR checks: 0 failures, 42 pending, 16 passed, 0 skipped; root llgo absent from PR diff.","next_action_hint":"Poll later for completion; continue local A/B experiments."}}
{"type":"config","name":"Race-check internal build after manifest caches","metricName":"validation_failures","metricUnit":"","bestDirection":"lower"}
{"run":1138,"commit":"2ae1b86","metric":0,"metrics":{"race_packages":1},"status":"keep","description":"race-check internal build after manifest caches","timestamp":1777232160215,"segment":591,"confidence":null,"iterationTokens":142,"asi":{"hypothesis":"The manifest env/build-tag caches and metadata parser/emitter changes should not introduce races in internal/build tests.","result":"go test -race ./internal/build passed. Linker emitted a local macOS LC_DYSYMTAB warning, but tests succeeded."}}
{"type":"config","name":"Monitor PR after internal build race check","metricName":"pr_check_failures","metricUnit":"","bestDirection":"lower"}
{"run":1139,"commit":"80523cf","metric":0,"metrics":{"pending_checks":40,"passed_checks":18,"skipped_checks":0,"llgo_in_pr_diff":0},"status":"keep","description":"monitor PR after internal build race check","timestamp":1777232191199,"segment":592,"confidence":null,"iterationTokens":447,"asi":{"hypothesis":"The PR run after fast metadata append should continue without failures while local race-check/metadata-only commits remain unpushed, and root llgo should stay absent from the diff.","result":"Current PR checks: 0 failures, 40 pending, 18 passed, 0 skipped; root llgo absent from PR diff.","next_action_hint":"Poll later for completion; continue local optimization loop."}}
{"type":"config","name":"Monitor PR fast metadata append later progress","metricName":"pr_check_failures","metricUnit":"","bestDirection":"lower"}
{"run":1140,"commit":"a697903","metric":0,"metrics":{"pending_checks":39,"passed_checks":19,"skipped_checks":0,"llgo_in_pr_diff":0},"status":"keep","description":"monitor PR fast metadata append later progress","timestamp":1777232245955,"segment":593,"confidence":null,"iterationTokens":447,"asi":{"hypothesis":"The PR run after fast metadata append should keep progressing without failures, and root llgo should remain absent from the diff.","result":"Current PR checks: 0 failures, 39 pending, 19 passed, 0 skipped; root llgo absent from PR diff.","next_action_hint":"Poll later for completion; avoid further source pushes without clear local improvements."}}
{"run":1141,"commit":"6806577","metric":0,"metrics":{"pending_checks":36,"passed_checks":22,"skipped_checks":0,"llgo_in_pr_diff":0},"status":"keep","description":"monitor PR fast metadata append after resume","timestamp":1777232311806,"segment":593,"confidence":null,"iterationTokens":447,"asi":{"hypothesis":"The pushed fast metadata append PR run should continue progressing without failures after resuming the loop, and root llgo should remain absent from the diff.","result":"Current PR checks: 0 failures, 36 pending, 22 passed, 0 skipped; root llgo absent from PR diff.","next_action_hint":"Continue local build/cache optimization experiments; poll PR later for completion."}}
{"type":"config","name":"Build final manifest directly for simple metadata append","metricName":"append_simple_metadata_ns_op","metricUnit":"","bestDirection":"lower"}
