{"run":647,"commit":"1f67786","metric":0,"metrics":{"pending_checks":20,"go_split_completed_jobs":4,"go_split_over15_jobs":0,"go_split_max_seconds":669,"split_macos_intel_over15_jobs":0,"split_macos_intel_completed_jobs":5,"split_macos_intel_max_seconds":682,"macos_host_demo_over15_jobs":0,"macos_host_demo_completed_jobs":0,"macos_host_demo_max_seconds":0,"all_completed_over15_jobs":0},"status":"keep","description":"monitor host demo shard run with 20 checks pending","timestamp":1777132607970,"segment":292,"confidence":null,"iterationTokens":2015,"asi":{"hypothesis":"Continue monitoring host demo shard run; pending macOS jobs may be queued/running with no new targeted completions this interval.","result":"No failed checks observed; 20 checks pending. All completed targeted jobs remain under 15m; host-demo shards are still pending."}}
{"run":648,"commit":"119486f","metric":0,"metrics":{"pending_checks":17,"go_split_completed_jobs":4,"go_split_over15_jobs":0,"go_split_max_seconds":669,"split_macos_intel_over15_jobs":0,"split_macos_intel_completed_jobs":7,"split_macos_intel_max_seconds":682,"macos_host_demo_over15_jobs":0,"macos_host_demo_completed_jobs":0,"macos_host_demo_max_seconds":0,"all_completed_over15_jobs":0},"status":"keep","description":"monitor host demo shard run with 17 checks pending","timestamp":1777132928909,"segment":292,"confidence":null,"iterationTokens":2012,"asi":{"hypothesis":"Continue monitoring host demo shard run; no failures or over-15 completed jobs should appear.","result":"No failed checks observed; 17 checks pending. All four Go split jobs and seven macOS Intel split jobs completed under 15m; host-demo shards are still pending."}}
{"run":649,"commit":"0892005","metric":0,"metrics":{"pending_checks":15,"go_split_completed_jobs":4,"go_split_over15_jobs":0,"go_split_max_seconds":669,"split_macos_intel_over15_jobs":0,"split_macos_intel_completed_jobs":9,"split_macos_intel_max_seconds":803,"macos_host_demo_over15_jobs":0,"macos_host_demo_completed_jobs":0,"macos_host_demo_max_seconds":0,"all_completed_over15_jobs":0},"status":"keep","description":"monitor host demo shard run with 15 checks pending","timestamp":1777133251338,"segment":292,"confidence":null,"iterationTokens":2024,"asi":{"hypothesis":"Continue monitoring host demo shard run; targeted jobs should remain under 15m as more complete.","result":"No failed checks observed; 15 checks pending. All four Go split jobs and nine macOS Intel split jobs completed under 15m; host-demo shard 0 completed under 15m but parsing by prefix still counts host-specific completions separately once all rows settle."}}
{"run":650,"commit":"468f511","metric":0,"metrics":{"pending_checks":13,"go_split_completed_jobs":4,"go_split_over15_jobs":0,"go_split_max_seconds":669,"split_macos_intel_over15_jobs":0,"split_macos_intel_completed_jobs":11,"split_macos_intel_max_seconds":818,"macos_host_demo_over15_jobs":0,"macos_host_demo_completed_jobs":0,"macos_host_demo_max_seconds":0,"all_completed_over15_jobs":0},"status":"keep","description":"monitor host demo shard run with 13 checks pending","timestamp":1777133577988,"segment":292,"confidence":null,"iterationTokens":2138,"asi":{"hypothesis":"Continue monitoring host demo shard run; no failures or over-15 completed jobs should appear as macOS jobs progress.","result":"No failed checks observed; 13 checks pending. All four Go split jobs and eleven macOS Intel split jobs completed under 15m; host-demo shards remain pending."}}
{"run":651,"commit":"8eb5e4b","metric":0,"metrics":{"pending_checks":10,"go_split_completed_jobs":4,"go_split_over15_jobs":0,"go_split_max_seconds":669,"split_macos_intel_over15_jobs":0,"split_macos_intel_completed_jobs":14,"split_macos_intel_max_seconds":818,"macos_host_demo_over15_jobs":0,"macos_host_demo_completed_jobs":0,"macos_host_demo_max_seconds":0,"all_completed_over15_jobs":0},"status":"keep","description":"monitor host demo shard run with 10 checks pending","timestamp":1777133900614,"segment":292,"confidence":null,"iterationTokens":2027,"asi":{"hypothesis":"Continue monitoring host demo shard run; no failures or over-15 completed jobs should appear as final macOS jobs progress.","result":"No failed checks observed; 10 checks pending. All four Go split jobs and fourteen macOS Intel split jobs completed under 15m; host-demo shards are still pending."}}
{"run":652,"commit":"0c15f90","metric":0,"metrics":{"pending_checks":6,"go_split_completed_jobs":4,"go_split_over15_jobs":0,"go_split_max_seconds":669,"split_macos_intel_over15_jobs":0,"split_macos_intel_completed_jobs":18,"split_macos_intel_max_seconds":818,"macos_host_demo_over15_jobs":0,"macos_host_demo_completed_jobs":2,"macos_host_demo_max_seconds":454,"all_completed_over15_jobs":0},"status":"keep","description":"monitor host demo shard run with two host shards completed","timestamp":1777134228253,"segment":292,"confidence":null,"iterationTokens":2024,"asi":{"hypothesis":"The two Go 1.21 host-demo shards should complete well under 15m while preserving coverage.","result":"No failed checks observed; 6 checks pending. Two host-demo jobs completed under 15m, max 454s. Eighteen macOS Intel split jobs completed under 15m; no completed jobs over 15m."}}
{"run":653,"commit":"cffbc37","metric":0,"metrics":{"pending_checks":1,"go_split_completed_jobs":4,"go_split_over15_jobs":0,"go_split_max_seconds":669,"split_macos_intel_over15_jobs":0,"split_macos_intel_completed_jobs":20,"split_macos_intel_max_seconds":818,"macos_host_demo_over15_jobs":0,"macos_host_demo_completed_jobs":2,"macos_host_demo_max_seconds":454,"all_completed_over15_jobs":0},"status":"keep","description":"monitor host demo shard run with one Go 1.24 host demo pending","timestamp":1777134644315,"segment":292,"confidence":null,"iterationTokens":1896,"asi":{"hypothesis":"Finish the current monitoring cycle before responding to resume request; host-demo shards and all targeted jobs should remain under 15m.","result":"No failed checks observed; 1 check pending: Go 1.24 host demos. All four Go split jobs and all 20 macOS Intel split jobs completed under 15m so far; Go 1.21 host demo shards completed under 15m, max 454s."}}
{"run":654,"commit":"d0e2be3","metric":0,"metrics":{"pending_checks":1,"go_split_completed_jobs":4,"go_split_over15_jobs":0,"go_split_max_seconds":669,"split_macos_intel_over15_jobs":0,"split_macos_intel_completed_jobs":20,"split_macos_intel_max_seconds":818,"macos_host_demo_over15_jobs":0,"macos_host_demo_completed_jobs":2,"macos_host_demo_max_seconds":454,"all_completed_over15_jobs":0},"status":"keep","description":"resume monitoring host demo shard run with one check pending","timestamp":1777134727433,"segment":292,"confidence":null,"iterationTokens":11719,"asi":{"hypothesis":"Resume after context-limit stop by reading ideas/logs and checking current PR state; host-demo shards and targeted jobs should remain under 15m with no failures.","result":"No failed checks observed; 1 check pending: Go 1.24 host demos. All four Go split jobs and all 20 macOS Intel split jobs completed under 15m so far; Go 1.21 host demo shards completed under 15m, max 454s."}}
{"run":655,"commit":"1cec11c","metric":0,"metrics":{"pending_checks":0,"go_split_completed_jobs":4,"go_split_over15_jobs":0,"go_split_max_seconds":669,"split_macos_intel_over15_jobs":0,"split_macos_intel_completed_jobs":21,"split_macos_intel_max_seconds":818,"macos_host_demo_over15_jobs":0,"macos_host_demo_completed_jobs":3,"macos_host_demo_max_seconds":669,"all_completed_over15_jobs":0},"status":"keep","description":"monitor host demo shard run completed without failures","timestamp":1777135056357,"segment":292,"confidence":null,"iterationTokens":1727,"asi":{"hypothesis":"The full host-demo-sharded PR run should complete failure-free with Go workflow, macOS Intel split, and host demo jobs all under 15m.","result":"Full PR run completed with zero failures and zero pending checks. All completed jobs are under 15m. Four Go split jobs max 669s (~11m09s). Twenty-one macOS Intel split jobs max 818s (~13m38s). Three host demo jobs max 669s (~11m09s)."}}
{"type":"config","name":"Prune ideas after all CI jobs under 15m","metricName":"stale_ci_ideas","metricUnit":"","bestDirection":"lower"}
{"run":656,"commit":"c06a08c","metric":0,"metrics":{"ideas_entries":6},"status":"keep","description":"prune stale CI ideas after all jobs under 15m","timestamp":1777135181928,"segment":293,"confidence":null,"iterationTokens":218,"asi":{"hypothesis":"After the full host-demo-sharded run completed with zero failures and all jobs under 15m, prune stale ideas that still describe remaining >15m/>20m targets and leave only cautious future paths.","result":"Ideas backlog now records the achieved all-under-15 result and retains only non-stale future optimization ideas."}}
{"type":"config","name":"Cache iwasm in build-cache workflow","metricName":"wamr_build_on_cache_hit","metricUnit":"","bestDirection":"lower"}
{"run":657,"commit":"17658ad","metric":1,"metrics":{"explicit_wamr_clone_steps":1},"status":"keep","description":"baseline build-cache workflow always builds WAMR iwasm","timestamp":1777135252409,"segment":294,"confidence":null,"iterationTokens":237,"asi":{"hypothesis":"The build-cache workflow always clones and builds WAMR iwasm even though test/buildcache/test.sh can use the llgo cache copy. Caching iwasm by WAMR version and build script should skip this work on cache hits without reducing coverage."}}
{"run":658,"commit":"497bdf3","metric":0,"metrics":{"explicit_wamr_clone_steps":0,"iwasm_cache_steps":1},"status":"keep","description":"cache iwasm in build-cache workflow","timestamp":1777135306091,"segment":294,"confidence":null,"iterationTokens":1060,"asi":{"hypothesis":"Cache the WAMR iwasm binary at the llgo cache path keyed by OS/arch/WAMR version/build script, then skip WAMR clone/cmake/make on cache hits. test/buildcache/test.sh already prefers this cached iwasm path, so coverage is preserved.","result":"build-cache.yml parses; dev/build_iwasm.sh passes bash -n. Workflow now restores/caches iwasm, builds it via the shared script only on cache miss, and adds the cache bin dir to PATH."}}
{"type":"config","name":"Validate workflows after iwasm cache","metricName":"workflow_validation_failures","metricUnit":"","bestDirection":"lower"}
{"run":659,"commit":"390bb70","metric":0,"metrics":{"workflow_files_checked":9,"action_files_checked":5,"shell_scripts_checked":5},"status":"keep","description":"validate workflows after iwasm cache","timestamp":1777135371034,"segment":295,"confidence":null,"iterationTokens":398,"asi":{"hypothesis":"Before pushing iwasm cache workflow change, validate all workflow/action YAML, relevant shell scripts, dev/build_iwasm.sh, and structural assertions for cache-hit skip behavior.","result":"All workflow/action YAML parsed; relevant shell scripts passed bash -n; build-cache.yml contains cache-iwasm and cache-hit conditional build."}}
{"type":"config","name":"Monitor PR after iwasm cache push","metricName":"pr_check_failures","metricUnit":"","bestDirection":"lower"}
{"run":660,"commit":"f434ad8","metric":0,"metrics":{"pending_checks":3},"status":"keep","description":"monitor PR immediately after iwasm cache push","timestamp":1777135401373,"segment":296,"confidence":null,"iterationTokens":241,"asi":{"hypothesis":"After pushing iwasm cache workflow change, the new PR run should start without immediate failures.","result":"No failed checks observed; 3 checks pending immediately after push."}}
{"run":661,"commit":"f6dc53a","metric":0,"metrics":{"pending_checks":43,"build_cache_completed_jobs":2,"build_cache_max_seconds":223,"all_completed_over15_jobs":0},"status":"keep","description":"monitor iwasm cache run after workflow fan-out","timestamp":1777135732381,"segment":296,"confidence":null,"iterationTokens":820,"asi":{"hypothesis":"After workflow fan-out, iwasm cache run should remain failure-free; build-cache jobs should complete and retain coverage.","result":"No failed checks observed; 43 checks pending. Both build-cache jobs completed under 4m, max 223s; likely benefited from warm or direct iwasm cache path."}}
{"run":662,"commit":"117547b","metric":0,"metrics":{"pending_checks":34,"build_cache_completed_jobs":2,"build_cache_max_seconds":223,"go_split_completed_jobs":1,"go_split_over15_jobs":0,"split_macos_intel_completed_jobs":1,"split_macos_intel_over15_jobs":0,"all_completed_over15_jobs":0},"status":"keep","description":"monitor iwasm cache run with first targeted completions","timestamp":1777136064368,"segment":296,"confidence":null,"iterationTokens":1570,"asi":{"hypothesis":"Continue monitoring iwasm cache run; no failures or over-15 completed jobs should appear.","result":"No failed checks observed; 34 checks pending. Both build-cache jobs completed under 4m. One Go split job and one macOS Intel split job completed under 15m; no completed jobs over 15m."}}
{"run":663,"commit":"78a229a","metric":0,"metrics":{"pending_checks":29,"build_cache_completed_jobs":2,"build_cache_max_seconds":223,"go_split_completed_jobs":3,"go_split_over15_jobs":0,"split_macos_intel_completed_jobs":2,"split_macos_intel_over15_jobs":0,"all_completed_over15_jobs":0},"status":"keep","description":"monitor iwasm cache run with 29 checks pending","timestamp":1777136395718,"segment":296,"confidence":null,"iterationTokens":1730,"asi":{"hypothesis":"Continue monitoring iwasm cache run; completed build-cache and split jobs should remain under 15m with no failures.","result":"No failed checks observed; 29 checks pending. Both build-cache jobs completed under 4m. Three Go split jobs and two macOS Intel split jobs completed under 15m; no completed jobs over 15m."}}
{"run":664,"commit":"009b78c","metric":0,"metrics":{"pending_checks":23,"build_cache_completed_jobs":2,"build_cache_max_seconds":223,"go_split_completed_jobs":4,"go_split_over15_jobs":0,"split_macos_intel_completed_jobs":4,"split_macos_intel_over15_jobs":0,"all_completed_over15_jobs":0},"status":"keep","description":"monitor iwasm cache run with all Go split jobs completed","timestamp":1777136814974,"segment":296,"confidence":null,"iterationTokens":1747,"asi":{"hypothesis":"Continue monitoring iwasm cache run; all Go split jobs should complete under 15m and no failures should appear.","result":"No failed checks observed; 23 checks pending. Both build-cache jobs completed under 4m. All four Go split jobs and four macOS Intel split jobs completed under 15m; no completed jobs over 15m."}}
{"run":665,"commit":"3d6bd86","metric":0,"metrics":{"pending_checks":20,"build_cache_completed_jobs":2,"build_cache_max_seconds":223,"go_split_completed_jobs":4,"go_split_over15_jobs":0,"split_macos_intel_completed_jobs":5,"split_macos_intel_over15_jobs":0,"all_completed_over15_jobs":0},"status":"keep","description":"monitor iwasm cache run with 20 checks pending","timestamp":1777137141512,"segment":296,"confidence":null,"iterationTokens":1805,"asi":{"hypothesis":"Continue monitoring iwasm cache run; completed jobs should remain under 15m with no failures.","result":"No failed checks observed; 20 checks pending. Both build-cache jobs, all four Go split jobs, and five macOS Intel split jobs completed under 15m; no completed jobs over 15m."}}
{"run":666,"commit":"eb5a112","metric":0,"metrics":{"pending_checks":17,"build_cache_completed_jobs":2,"build_cache_max_seconds":223,"go_split_completed_jobs":4,"go_split_over15_jobs":0,"split_macos_intel_completed_jobs":5,"split_macos_intel_over15_jobs":0,"all_completed_over15_jobs":0},"status":"keep","description":"monitor iwasm cache run with 17 checks pending","timestamp":1777137472427,"segment":296,"confidence":null,"iterationTokens":1820,"asi":{"hypothesis":"Continue monitoring iwasm cache run; no failures should appear while remaining macOS jobs finish.","result":"No failed checks observed; 17 checks pending. Both build-cache jobs, all four Go split jobs, and five macOS Intel split jobs completed under 15m; no completed jobs over 15m."}}
{"run":667,"commit":"eb5a112","metric":1,"metrics":{"pending_checks":13,"build_cache_completed_jobs":2,"build_cache_max_seconds":223,"go_split_completed_jobs":4,"go_split_over15_jobs":0,"split_macos_intel_completed_jobs":8,"split_macos_intel_over15_jobs":0,"all_completed_over15_jobs":0},"status":"checks_failed","description":"monitor iwasm cache run found one CI failure","timestamp":1777137805097,"segment":296,"confidence":null,"iterationTokens":1819,"asi":{"hypothesis":"Continue monitoring iwasm cache run; no failures should appear while remaining macOS jobs finish.","result":"One failed check appeared while build-cache jobs had already passed under 4m. Need inspect failed job to determine whether it is related to iwasm cache or a transient unrelated setup/download failure.","rollback_reason":"CI failure appeared after iwasm cache push; must inspect logs before making further changes.","next_action_hint":"Use gh pr checks to identify the failed job and fetch logs. If build-cache failed due iwasm cache, fix or revert; if unrelated transient, rerun/monitor."}}
{"run":668,"commit":"eb5a112","metric":1,"metrics":{"pending_checks":13,"build_cache_completed_jobs":2,"build_cache_max_seconds":223,"go_split_completed_jobs":4,"go_split_over15_jobs":0,"split_macos_intel_completed_jobs":8,"split_macos_intel_over15_jobs":0,"all_completed_over15_jobs":0},"status":"checks_failed","description":"monitor iwasm cache run found compiler-rt 502 failure","timestamp":1777137836122,"segment":296,"confidence":null,"iterationTokens":1819,"asi":{"hypothesis":"Continue monitoring iwasm cache run; no failures should appear while remaining macOS jobs finish.","result":"One failure appeared in llgo-embedded-smoke-macos-intel (19, 1.24.2, esp32c3-serial). Logs show compiler-rt xtensa_release_19.1.2 download returned 502 Bad Gateway for all five attempts. Build-cache iwasm jobs had already passed, so failure is unrelated to iwasm cache change.","rollback_reason":"CI failure caused by repeated transient GitHub/compiler-rt 502 despite existing retry budget, not by the iwasm cache workflow change.","next_action_hint":"Consider increasing crosscompile download retry budget or adding longer backoff, then validate internal/crosscompile tests and rerun PR checks."}}
{"type":"config","name":"Increase crosscompile download retry budget further","metricName":"crosscompile_download_attempts","metricUnit":"","bestDirection":"higher"}
{"run":669,"commit":"89873e2","metric":5,"metrics":{"crosscompile_retry_delay_seconds":2},"status":"keep","description":"baseline crosscompile retry budget still exhausted by 502 burst","timestamp":1777137868762,"segment":297,"confidence":null,"iterationTokens":210,"asi":{"hypothesis":"The latest embedded smoke failure exhausted the current 5-attempt crosscompile archive retry budget against repeated GitHub 502s. Increasing the budget should improve CI resilience without changing coverage or successful-path behavior."}}
{"run":670,"commit":"568935e","metric":7,"metrics":{"crosscompile_retry_delay_seconds":5},"status":"keep","description":"increase crosscompile download retry budget after repeated 502s","timestamp":1777137925402,"segment":297,"confidence":null,"iterationTokens":573,"asi":{"hypothesis":"Increase crosscompile archive download attempts from 5 to 7 and retry delay from 2s to 5s to survive longer GitHub release/compiler-rt 502 bursts. This only affects failure/retry paths and preserves coverage.","result":"internal/crosscompile tests pass; retry constants now allow 7 attempts with 5s delay."}}
{"type":"config","name":"Validate increased crosscompile retry after 502","metricName":"validation_failures","metricUnit":"","bestDirection":"lower"}
{"run":671,"commit":"38408ca","metric":0,"metrics":{"crosscompile_packages_tested":4,"workflow_files_checked":2},"status":"keep","description":"validate increased crosscompile retry after 502","timestamp":1777137983045,"segment":298,"confidence":null,"iterationTokens":214,"asi":{"hypothesis":"Before pushing the larger crosscompile retry budget, validate all crosscompile packages and parse affected CI workflow YAML.","result":"internal/crosscompile/... tests passed; llgo.yml and build-cache.yml parsed."}}
{"type":"config","name":"Monitor PR after larger crosscompile retry push","metricName":"pr_check_failures","metricUnit":"","bestDirection":"lower"}
{"run":672,"commit":"8990bc9","metric":0,"metrics":{"pending_checks":18},"status":"keep","description":"monitor PR immediately after larger crosscompile retry push","timestamp":1777138019801,"segment":299,"confidence":null,"iterationTokens":241,"asi":{"hypothesis":"After pushing the larger crosscompile retry budget, the new PR run should start without immediate failures and should better tolerate compiler-rt/GitHub 502 bursts.","result":"No failed checks observed; 18 checks pending immediately after push."}}
{"run":673,"commit":"007aac5","metric":0,"metrics":{"pending_checks":44,"build_cache_completed_jobs":2,"build_cache_max_seconds":178,"go_split_completed_jobs":0,"go_split_over15_jobs":0,"split_macos_intel_completed_jobs":0,"split_macos_intel_over15_jobs":0,"all_completed_over15_jobs":0},"status":"keep","description":"monitor larger retry run after workflow fan-out","timestamp":1777138347762,"segment":299,"confidence":null,"iterationTokens":1373,"asi":{"hypothesis":"After workflow fan-out, larger retry run should remain failure-free; build-cache iwasm cache jobs should still pass.","result":"No failed checks observed; 44 checks pending. Both build-cache jobs completed under 3m, max 178s, faster than previous 223s."}}
