{"run":28,"commit":"6de0962","metric":20.2,"metrics":{"internal_build_s":20.2,"crosscompile_s":0,"compile_s":0,"libc_s":0,"rtlib_s":0,"goembed_s":0},"status":"discard","description":"profiled internal/build timings after build-only print smoke","timestamp":1777035914388,"segment":2,"confidence":4.842105263157896,"iterationTokens":704,"asi":{"hypothesis":"Identify remaining slow tests after converting the redundant ModeRun smoke to build-only.","slow_tests":"TestTest 7.65s, TestExtest 2.58s, TestLdFlagsRewriteVars 2.54s, TestBuildDo_DepFingerprintAndVersion 1.50s, TestLdFlagsRewriteVarsMainAlias 1.27s, TestRunPrintfWithStdioNobuf 1.18s.","rollback_reason":"Profiling-only command is not the full uncached core benchmark.","next_action_hint":"Most remaining time is intrinsic llgo test compilation; only small fixture/test-scope reductions remain."}}
{"run":29,"commit":"9469d9a","metric":17.1,"metrics":{"internal_build_s":16.406,"crosscompile_s":1.151,"compile_s":0.979,"libc_s":0.303,"rtlib_s":1.189,"goembed_s":1.329},"status":"keep","description":"consolidate in-package and external ModeTest coverage into one fixture","timestamp":1777035994667,"segment":2,"confidence":4.583333333333336,"iterationTokens":1457,"asi":{"hypothesis":"A single llgo test invocation can cover both in-package tests and external package tests if the external-test fixture also includes an internal test file. This preserves ModeTest coverage while eliminating a separate costly test binary build.","result":"Uncached core subset improved from 18.9s current best to 17.1s; internal/build dropped to 16.406s."}}
{"run":30,"commit":"6dec48c","metric":16.9,"metrics":{"internal_build_s":16.383,"crosscompile_s":0.45,"compile_s":0.855,"libc_s":0.484,"rtlib_s":0.186,"goembed_s":0.639},"status":"keep","description":"confirmation rerun for consolidated ModeTest fixture","timestamp":1777036029491,"segment":2,"confidence":4.869565217391304,"iterationTokens":678,"asi":{"hypothesis":"Confirm the consolidated internal/external ModeTest fixture gives a stable speedup.","result":"Repeat uncached core subset passed in 16.9s, confirming the improvement."}}
{"run":31,"commit":"6dec48c","metric":16.4,"metrics":{"internal_build_s":16.4,"crosscompile_s":0,"compile_s":0,"libc_s":0,"rtlib_s":0,"goembed_s":0},"status":"discard","description":"profiled internal/build after consolidating ModeTest fixture","timestamp":1777036079640,"segment":2,"confidence":5.0909090909090855,"iterationTokens":699,"asi":{"hypothesis":"Measure remaining bottlenecks after eliminating the separate in-package ModeTest run.","slow_tests":"TestExtest 8.19s now includes both internal and external test coverage, TestLdFlagsRewriteVars 1.90s, TestBuildDo_DepFingerprintAndVersion 1.35s, TestRunPrintfWithStdioNobuf 1.11s, TestLdFlagsRewriteVarsMainAlias 1.06s.","rollback_reason":"Profiling-only command is not the full uncached core benchmark.","next_action_hint":"Further ModeTest reductions would require optimizing test binary compilation or reducing the fixture dependency graph without losing internal/external coverage."}}
{"run":32,"commit":"6dec48c","metric":20.6,"metrics":{"internal_build_s":19.989,"crosscompile_s":4.669,"compile_s":4.77,"libc_s":4.778,"rtlib_s":5.216,"goembed_s":5.584},"status":"discard","description":"make external ModeTest fixture not import package under test","timestamp":1777036153686,"segment":2,"confidence":5.743589743589747,"iterationTokens":959,"asi":{"hypothesis":"An external-test package that merely compiles may cover package-foo_test wiring while relying on the internal test for Foo behavior, possibly reducing dependency work.","result":"Run passed but slowed to 20.6s and narrowed external-test behavioral coverage.","rollback_reason":"Primary metric regressed and coverage became weaker.","next_action_hint":"Keep the external test importing/calling Foo; slowdown may be noise but coverage loss is not worthwhile."}}
{"run":33,"commit":"6dec48c","metric":15.7,"metrics":{"internal_build_s":15,"crosscompile_s":1.043,"compile_s":1.178,"libc_s":0.713,"rtlib_s":1.207,"goembed_s":1.345},"status":"discard","description":"removed runtime rewrite checks from ldflags fixture (coverage regression)","timestamp":1777036295094,"segment":2,"confidence":5.600000000000001,"iterationTokens":1817,"asi":{"hypothesis":"Removing the runtime import and runtime.defaultGOROOT/runtime.buildVersion checks from the ldflags rewrite fixture would reduce compile cost.","result":"Speed improved to 15.7s, but this drops coverage for runtime package global string rewrites, which is not acceptable per the requirement to improve efficiency without reducing coverage.","rollback_reason":"Coverage regression: no longer tests runtime.defaultGOROOT/runtime.buildVersion rewriting.","next_action_hint":"Keep runtime rewrite coverage; seek efficiency by consolidating redundant tests or shrinking dependencies without removing asserted behavior."}}
{"run":34,"commit":"6dec48c","metric":17.4,"metrics":{"internal_build_s":16.81,"crosscompile_s":1.243,"compile_s":1.995,"libc_s":1.514,"rtlib_s":2.266,"goembed_s":2.689},"status":"discard","description":"parallelize goembed unit tests","timestamp":1777036383417,"segment":2,"confidence":4.2264150943396235,"iterationTokens":1817,"asi":{"hypothesis":"internal/goembed tests use isolated temp directories and no shared mutable state, so t.Parallel can preserve coverage while reducing package test wall time.","result":"Full uncached core subset passed, but primary metric regressed from current best 16.9s to 17.4s and goembed package timing was noisy/slower under concurrent load.","rollback_reason":"No primary metric improvement in the full CI subset despite preserving coverage.","next_action_hint":"If optimizing goembed specifically, benchmark package alone; for core CI, package-level parallelism is already enough and adding intra-package parallelism adds contention."}}
{"run":35,"commit":"b3818fc","metric":24.4,"metrics":{"internal_build_s":23.663,"crosscompile_s":0.642,"compile_s":1.818,"libc_s":1.337,"rtlib_s":0.912,"goembed_s":2.209},"status":"keep","description":"restore full ModeTest coverage while retaining coverage-preserving fixture optimizations","timestamp":1777036552450,"segment":2,"confidence":3.393939393939394,"iterationTokens":6123,"asi":{"hypothesis":"Per the requirement not to reduce test coverage, restore the original ModeTest package scopes (runtest and runextest/...) while keeping coverage-preserving optimizations: fmt-free rewrite fixture and redundant simple run smoke converted to build-only because ModeRun is still covered by TestRunPrintfWithStdioNobuf.","result":"Uncached core subset is 24.4s versus original 28.1s baseline, preserving the original ModeTest coverage scopes while retaining a significant speedup."}}
{"run":36,"commit":"e3f8e08","metric":21.8,"metrics":{"internal_build_s":21.034,"crosscompile_s":0.829,"compile_s":1.168,"libc_s":0.933,"rtlib_s":1.2,"goembed_s":1.406},"status":"keep","description":"cache detected LLVM version across build contexts","timestamp":1777036631613,"segment":2,"confidence":4.072727272727274,"iterationTokens":1343,"asi":{"hypothesis":"Each build context previously spawned clang --version independently while collecting fingerprints. Caching the detected LLVM version by compiler path across contexts preserves coverage and correctness while reducing repeated process startup in tests and CI builds.","result":"Uncached core subset improved from coverage-preserving 24.4s to 21.8s; internal/build dropped to 21.034s."}}
{"run":37,"commit":"e3f8e08","metric":21.8,"metrics":{"internal_build_s":21.058,"crosscompile_s":1.067,"compile_s":1.185,"libc_s":0.784,"rtlib_s":1.228,"goembed_s":1.373},"status":"discard","description":"refine LLVM version cache key to resolved compiler path","timestamp":1777036705652,"segment":2,"confidence":5.0909090909090855,"iterationTokens":1185,"asi":{"hypothesis":"Keying the LLVM-version cache by resolved compiler path and not storing empty failures is safer if PATH or compiler availability changes within a long process.","result":"Run passed but primary metric was unchanged at 21.8s compared with current best; this is a correctness refinement rather than a speed win.","rollback_reason":"No primary metric improvement under experiment rules, though the idea may be worth applying manually if cache safety concerns arise.","next_action_hint":"Keep the simpler cached version for now or revisit if review requests PATH-sensitive cache behavior."}}
{"run":38,"commit":"e3f8e08","metric":21.3,"metrics":{"internal_build_s":21.3,"crosscompile_s":0,"compile_s":0,"libc_s":0,"rtlib_s":0,"goembed_s":0},"status":"discard","description":"profiled internal/build after coverage-preserving speedups and LLVM version cache","timestamp":1777036755871,"segment":2,"confidence":4.977777777777771,"iterationTokens":823,"asi":{"hypothesis":"Measure remaining internal/build bottlenecks after restoring full ModeTest coverage and caching LLVM version detection.","slow_tests":"TestTest 8.20s, TestExtest 4.66s, TestLdFlagsRewriteVars 2.01s, TestBuildDo_DepFingerprintAndVersion 1.37s, TestRunPrintfWithStdioNobuf 1.11s, TestLdFlagsRewriteVarsMainAlias 1.05s.","rollback_reason":"Profiling-only command is not the full uncached core benchmark.","next_action_hint":"Coverage-preserving next steps likely require product-level build/test speedups rather than narrowing test scopes."}}
{"run":39,"commit":"e3f8e08","metric":24.3,"metrics":{"internal_build_s":23.562,"crosscompile_s":3.035,"compile_s":2.592,"libc_s":3.876,"rtlib_s":1.658,"goembed_s":3.428},"status":"discard","description":"add explicit cross-context LLVM version cache test","timestamp":1777036919138,"segment":2,"confidence":4.666666666666663,"iterationTokens":4103,"asi":{"hypothesis":"Add a focused unit test proving LLVM version detection is cached across build contexts so the product optimization has direct coverage without reducing existing coverage.","result":"Run passed but primary metric regressed from 21.8s to 24.3s due noise and the additional process-spawning unit test overhead.","rollback_reason":"No primary metric improvement under the experiment loop; adding this test may still be review-desirable but hurts the speed target.","next_action_hint":"If reviewers require coverage for the cache, add a lighter injectable detector instead of spawning a shell helper."}}
{"run":40,"commit":"e3f8e08","metric":21.5,"metrics":{"internal_build_s":20.956,"crosscompile_s":1.245,"compile_s":1.071,"libc_s":0.835,"rtlib_s":1.471,"goembed_s":1.344},"status":"discard","description":"confirmation rerun for coverage-preserving current state","timestamp":1777036987821,"segment":2,"confidence":4.666666666666663,"iterationTokens":1161,"asi":{"hypothesis":"Confirm the current coverage-preserving state (full ModeTest scopes plus fmt-free rewrite fixture, build-only redundant smoke, and LLVM version cache) remains stable.","result":"Run passed in 21.5s, close to the kept 21.8s and substantially below the original 28.1s baseline.","rollback_reason":"No new code change; confirmation was slightly faster but does not require a separate code commit.","next_action_hint":"Continue looking for product-level optimizations that preserve test scope."}}
{"run":41,"commit":"e3f8e08","metric":23.8,"metrics":{"internal_build_s":23.026,"crosscompile_s":1.06,"compile_s":1.261,"libc_s":2.39,"rtlib_s":1.859,"goembed_s":1.364},"status":"discard","description":"remove go work sync subprocess from dependency fingerprint test","timestamp":1777037095185,"segment":2,"confidence":4.666666666666663,"iterationTokens":2405,"asi":{"hypothesis":"The dependency fingerprint test can likely rely on the handwritten go.work and module files without running go work sync, preserving coverage while avoiding an external go subprocess.","result":"Run passed, but primary metric regressed from current best 21.8s to 23.8s; any subprocess saving is lost in noise or not on the critical path.","rollback_reason":"No speed improvement under the benchmark.","next_action_hint":"Leave go work sync in place for clarity/stability unless optimizing this test in isolation."}}
{"type":"config","name":"Optimize Go CI build/test subset","metricName":"go_ci_subset_seconds","metricUnit":"s","bestDirection":"lower"}
{"run":42,"commit":"ec9335e","metric":25.4,"metrics":{"internal_build_s":22.767,"crosscompile_s":1.706,"compile_s":1.192,"libc_s":2.958,"rtlib_s":2.106,"goembed_s":2.528},"status":"keep","description":"baseline Go CI subset including explicit go build before tests","timestamp":1777037276276,"segment":3,"confidence":null,"iterationTokens":137,"asi":{"hypothesis":"Measure a CI-like sequence with the explicit go build step followed by the stable test subset so we can evaluate whether the build step is redundant with go test."}}
{"run":43,"commit":"5249483","metric":24.6,"metrics":{"internal_build_s":24.021,"crosscompile_s":0.353,"compile_s":1.155,"libc_s":1.246,"rtlib_s":1.488,"goembed_s":1.689},"status":"keep","description":"drop redundant explicit go build before go test in Go CI/local CI","timestamp":1777037341654,"segment":3,"confidence":null,"iterationTokens":791,"asi":{"hypothesis":"go test ./... already compiles all packages (including packages without tests), so the separate Go CI/local CI go build ./... step is redundant for coverage and can be removed to reduce CI wall time.","result":"CI-like subset improved from 25.4s to 24.6s while preserving test execution coverage; the measured gain is modest here because build artifacts were warm, but CI should avoid an entire redundant build step."}}
{"run":44,"commit":"179d0b6","metric":23.7,"metrics":{"internal_build_s":23.115,"crosscompile_s":0.444,"compile_s":0.615,"libc_s":1.046,"rtlib_s":1.671,"goembed_s":1.491},"status":"keep","description":"confirmation rerun for removing redundant go build step","timestamp":1777037386834,"segment":3,"confidence":2.1250000000000067,"iterationTokens":674,"asi":{"hypothesis":"Confirm removing the explicit go build step remains faster on the CI-like subset.","result":"Repeat run passed and improved to 23.7s versus 25.4s baseline."}}
{"run":45,"commit":"00d3265","metric":22.4,"metrics":{"internal_build_s":21.816,"crosscompile_s":0.757,"compile_s":0.463,"libc_s":0.505,"rtlib_s":1.125,"goembed_s":0.794},"status":"keep","description":"avoid installing torch in Go workflow where only numpy is needed","timestamp":1777037494083,"segment":3,"confidence":3.5294117647058765,"iterationTokens":3026,"asi":{"hypothesis":"The Go workflow runs Go tests, not demos; repository references show torch is only used by the _demo/py/tensor demo, while Go test coverage needs numpy/python embedding. Removing torch from this workflow preserves coverage and avoids a very large CI dependency installation.","result":"Stable Go subset still passed; primary subset timing also improved to 22.4s, though the main expected win is reduced CI setup time not captured by the Go-test-only benchmark."}}
{"type":"config","name":"Optimize llgo CI install step","metricName":"llgo_install_seconds","metricUnit":"s","bestDirection":"lower"}
{"run":46,"commit":"662934d","metric":1.7,"metrics":{"install_all_s":1.7},"status":"keep","description":"baseline installing all repository commands/packages as in llgo workflow","timestamp":1777037580358,"segment":4,"confidence":null,"iterationTokens":110,"asi":{"hypothesis":"Measure the current llgo workflow install step, which runs go install ./... even though jobs only need the llgo binary."}}
{"run":47,"commit":"5ed5fbc","metric":1.3,"metrics":{"install_all_s":1.7,"install_llgo_s":1.3},"status":"keep","description":"install only llgo command in llgo workflow jobs","timestamp":1777037621473,"segment":4,"confidence":null,"iterationTokens":666,"asi":{"hypothesis":"llgo workflow jobs only invoke the llgo command after installation; installing every repository command with go install ./... is redundant. Installing ./cmd/llgo preserves coverage while reducing install work.","result":"Install benchmark improved from 1.7s to 1.3s locally; CI benefit should scale with cold caches and repeated jobs."}}
{"run":48,"commit":"5ed5fbc","metric":1.3,"metrics":{"install_all_s":1.7,"install_llgo_s":1.3},"status":"discard","description":"confirmation rerun for installing only llgo command","timestamp":1777037641131,"segment":4,"confidence":null,"iterationTokens":402,"asi":{"hypothesis":"Confirm go install ./cmd/llgo timing is stable for llgo workflow install optimization.","result":"Repeat install completed in 1.3s, matching kept result.","rollback_reason":"No new code change and metric ties current best.","next_action_hint":"Keep workflow change; continue looking for other repeated CI setup/install work."}}
{"run":49,"commit":"5ed5fbc","metric":1.3,"metrics":{"install_all_s":1.7,"install_llgo_s":1.3},"status":"discard","description":"install only llgo command in targets workflow too","timestamp":1777037683604,"segment":4,"confidence":null,"iterationTokens":873,"asi":{"hypothesis":"The targets workflow also only needs the llgo command to run embedded target builds, so replacing go install ./... with go install ./cmd/llgo preserves coverage and saves install work.","result":"Install command passed at 1.3s, but primary metric ties current best because the same command was already measured.","rollback_reason":"No primary improvement relative to current best under experiment rules, though the workflow edit is logically the same optimization.","next_action_hint":"Apply this change together with the llgo workflow install narrowing during final cleanup if desired."}}
{"type":"config","name":"Optimize aggregate workflow llgo install commands","metricName":"aggregate_install_seconds","metricUnit":"s","bestDirection":"lower"}
{"run":50,"commit":"539cac7","metric":7.5,"metrics":{"cmd_installs":4,"all_installs":1},"status":"keep","description":"baseline aggregate install work across llgo and targets workflows","timestamp":1777037735291,"segment":5,"confidence":null,"iterationTokens":143,"asi":{"hypothesis":"Measure aggregate install time for the current workflow state: four llgo.yml jobs install ./cmd/llgo, while targets.yml still installs ./... ."}}
{"run":51,"commit":"e125f41","metric":7.3,"metrics":{"cmd_installs":5,"all_installs":0},"status":"keep","description":"install only llgo command in targets workflow aggregate","timestamp":1777037770465,"segment":5,"confidence":null,"iterationTokens":414,"asi":{"hypothesis":"The targets workflow only invokes llgo to build embedded target demos, so using go install ./cmd/llgo preserves coverage while reducing aggregate workflow install work.","result":"Aggregate install benchmark improved from 7.5s to 7.3s locally; cold CI should benefit more from avoiding extra command/package install work."}}
{"run":52,"commit":"e125f41","metric":7.5,"metrics":{"cmd_installs":5,"all_installs":0},"status":"discard","description":"remove demo-only Python dependency install from llgo test shard job","timestamp":1777037882572,"segment":5,"confidence":null,"iterationTokens":2290,"asi":{"hypothesis":"The llgo test shard job runs packages under ./test/... and repository search shows no numpy/torch usage there, so the demo-only Python dependency install can be removed without reducing test coverage.","result":"Install benchmark is unchanged at 7.5s because it does not measure pip setup; the workflow edit is logically beneficial but outside this metric.","rollback_reason":"No primary metric improvement in the active aggregate install benchmark.","next_action_hint":"Consider re-applying with a setup-focused benchmark or during final cleanup; expected CI win is avoiding repeated pip installs in llgo test shards."}}
{"type":"config","name":"Optimize hello workflow redundant matrix jobs","metricName":"hello_install_seconds","metricUnit":"s","bestDirection":"lower"}
{"run":53,"commit":"e470af8","metric":6.1,"metrics":{"hello_jobs":4,"covered_go_versions":1},"status":"keep","description":"baseline hello workflow install work with two Go matrix versions","timestamp":1777037986711,"segment":6,"confidence":null,"iterationTokens":128,"asi":{"hypothesis":"Measure install work for the hello workflow's current 2 OS x 2 Go matrix. The test step only runs for Go 1.24, so Go 1.21 matrix entries appear to do setup/install without executing coverage."}}
{"run":54,"commit":"e470af8","metric":8.1,"metrics":{"hello_jobs":2,"covered_go_versions":1},"status":"discard","description":"remove no-op Go 1.21 hello matrix entries","timestamp":1777038030659,"segment":6,"confidence":null,"iterationTokens":529,"asi":{"hypothesis":"The hello workflow's Go 1.21 matrix entries do not run the hello test because the only test step is gated to Go 1.24; removing those no-op jobs should preserve actual coverage and reduce CI work.","result":"Local install simulation was slower due noise (8.1s for two installs), so the active metric did not improve despite halving workflow jobs.","rollback_reason":"No primary metric improvement under this noisy local install benchmark.","next_action_hint":"This remains a strong CI-structure cleanup candidate: re-apply with a static job-count/setup-time benchmark or during final review if accepted."}}
{"type":"config","name":"Optimize hello workflow active job count","metricName":"hello_active_jobs","metricUnit":"","bestDirection":"lower"}
{"run":55,"commit":"2160a00","metric":4,"metrics":{"hello_os":2,"hello_go_versions":2},"status":"keep","description":"baseline hello workflow active matrix jobs","timestamp":1777038080964,"segment":7,"confidence":null,"iterationTokens":216,"asi":{"hypothesis":"Use active matrix job count as a direct CI resource metric for the hello workflow. Current matrix launches 2 OS x 2 Go versions, but only Go 1.24 executes the hello test step."}}
