{"run":1036,"commit":"4e8de5f","metric":0,"metrics":{"packages_tested":5,"temp_builds":1,"ideas_updated":1},"status":"keep","description":"validate cached context targetTriple","timestamp":1777226734519,"segment":515,"confidence":null,"iterationTokens":282,"asi":{"hypothesis":"Caching context.targetTriple should preserve target triple outputs, be covered by repeated-call tests, pass build/crosscompile validation, and not create a root llgo binary.","result":"Extended TestTargetTripleMethod to verify repeated cached calls and targetTripleCached. go test ./internal/build, go test ./internal/crosscompile/..., and temp-path go build -tags=dev ./cmd/llgo passed; root llgo was not created; ideas backlog records the 62ns/op to ~1ns/op benchmark."}}
{"type":"config","name":"Monitor PR after pushing cached targetTriple","metricName":"pr_check_failures","metricUnit":"","bestDirection":"lower"}
{"run":1037,"commit":"5f6e962","metric":0,"metrics":{"pending_checks":53,"passed_checks":4,"skipped_checks":0,"llgo_in_pr_diff":0},"status":"keep","description":"monitor PR after pushing cached targetTriple","timestamp":1777226794943,"segment":516,"confidence":null,"iterationTokens":451,"asi":{"hypothesis":"After pushing the cached targetTriple optimization, the PR run should start without immediate failures and root llgo should remain absent from the diff.","result":"New PR run has 0 failures, 4 passed, 53 pending, and root llgo absent from PR diff."}}
{"type":"config","name":"Replace targetTriple fmt.Sprintf with concatenation","metricName":"target_triple_func_ns_op","metricUnit":"","bestDirection":"lower"}
{"run":1038,"commit":"60aff89","metric":57,"metrics":{"target_triple_func_bytes_op":48,"target_triple_func_allocs_op":3,"runs":9},"status":"keep","description":"baseline targetTriple host function formatting","timestamp":1777226825584,"segment":517,"confidence":null,"iterationTokens":540,"asi":{"hypothesis":"The uncached first targetTriple computation still uses fmt.Sprintf for host triples; simple string concatenation may reduce first-call and test/setup overhead.","result":"BenchmarkTargetTripleHostFunc median is 57 ns/op, 48 B/op, and 3 allocs/op across 9 runs."}}
{"run":1039,"commit":"e4dc123","metric":10,"metrics":{"target_triple_func_bytes_op":0,"target_triple_func_allocs_op":0,"runs":9},"status":"keep","description":"use string concatenation for host targetTriple","timestamp":1777226895883,"segment":517,"confidence":null,"iterationTokens":1199,"asi":{"hypothesis":"Replacing fmt.Sprintf(\"%s-%s\", goarch, goos) with direct concatenation in targetTriple should reduce first-call target triple computation without changing output.","result":"internal/build tests passed. BenchmarkTargetTripleHostFunc improved from 57 ns/op, 48 B/op, 3 allocs/op to 10 ns/op, 0 B/op, 0 allocs/op across 9 runs.","next_action_hint":"Validate broad tests and temp cmd/llgo build; update ideas and push if clean."}}
{"type":"config","name":"Validate targetTriple concatenation","metricName":"validation_failures","metricUnit":"","bestDirection":"lower"}
{"run":1040,"commit":"ebf95db","metric":0,"metrics":{"packages_tested":5,"temp_builds":1,"ideas_updated":1},"status":"keep","description":"validate targetTriple concatenation","timestamp":1777226962408,"segment":518,"confidence":null,"iterationTokens":281,"asi":{"hypothesis":"Direct concatenation in targetTriple should preserve host/LLVM/ABI triple outputs, pass internal build/crosscompile validation, build cmd/llgo to a temp path, and be recorded.","result":"go test ./internal/build, go test ./internal/crosscompile/..., and temp-path go build -tags=dev ./cmd/llgo passed; root llgo was not created; ideas backlog records the 57ns/op to 10ns/op benchmark."}}
{"type":"config","name":"Monitor PR after pushing targetTriple concatenation","metricName":"pr_check_failures","metricUnit":"","bestDirection":"lower"}
{"run":1041,"commit":"1cb363d","metric":0,"metrics":{"pending_checks":45,"passed_checks":2,"skipped_checks":0,"llgo_in_pr_diff":0},"status":"keep","description":"monitor PR after pushing targetTriple concatenation","timestamp":1777227018505,"segment":519,"confidence":null,"iterationTokens":452,"asi":{"hypothesis":"After pushing targetTriple concatenation, the PR run should start without immediate failures and root llgo should remain absent from the diff.","result":"New PR run has 0 failures, 2 passed, 45 pending, and root llgo absent from PR diff."}}
{"type":"config","name":"Use string concatenation for cache archive and manifest paths","metricName":"package_paths_ns_op","metricUnit":"","bestDirection":"lower"}
{"run":1042,"commit":"158350f","metric":490,"metrics":{"package_paths_bytes_op":544,"package_paths_allocs_op":5,"runs":9},"status":"keep","description":"baseline PackagePaths archive/manifest filepath.Join","timestamp":1777227057752,"segment":520,"confidence":null,"iterationTokens":592,"asi":{"hypothesis":"PackagePaths still calls filepath.Join twice for archive and manifest file paths after computing the safe directory; direct dir+separator+filename concatenation may avoid repeated path cleanup overhead.","result":"BenchmarkPackagePathsSafe median is 490 ns/op, 544 B/op, and 5 allocs/op across 9 runs."}}
{"run":1043,"commit":"e045036","metric":241,"metrics":{"package_paths_bytes_op":384,"package_paths_allocs_op":3,"runs":9},"status":"keep","description":"use string concatenation for cache archive and manifest paths","timestamp":1777227121593,"segment":520,"confidence":null,"iterationTokens":1469,"asi":{"hypothesis":"Once packageDir returns a cleaned safe directory, archive and manifest paths can be formed by dir+separator+filename without filepath.Join's repeated cleanup, preserving path output while reducing PackagePaths overhead.","result":"internal/build tests passed. BenchmarkPackagePathsSafe improved from 490 ns/op, 544 B/op, 5 allocs/op to 241 ns/op, 384 B/op, 3 allocs/op across 9 runs.","next_action_hint":"Validate PackagePaths tests and broad build/crosscompile/temp cmd build; record in ideas and push if clean."}}
{"type":"config","name":"Validate cache PackagePaths path concatenation","metricName":"validation_failures","metricUnit":"","bestDirection":"lower"}
{"run":1044,"commit":"a5612b7","metric":0,"metrics":{"packages_tested":5,"temp_builds":1,"ideas_updated":1},"status":"keep","description":"validate cache PackagePaths path concatenation","timestamp":1777227193159,"segment":521,"confidence":null,"iterationTokens":279,"asi":{"hypothesis":"String-concatenating cache archive/manifest paths after packageDir should preserve PackagePaths outputs and cache behavior while reducing filepath.Join overhead.","result":"Existing PackagePaths tests passed via go test ./internal/build; go test ./internal/crosscompile/... and temp-path go build -tags=dev ./cmd/llgo passed; root llgo was not created; ideas backlog records the 490ns/op to 241ns/op PackagePaths improvement."}}
{"type":"config","name":"Monitor PR after pushing PackagePaths path concatenation","metricName":"pr_check_failures","metricUnit":"","bestDirection":"lower"}
{"run":1045,"commit":"bfdd269","metric":0,"metrics":{"pending_checks":45,"passed_checks":2,"skipped_checks":0,"llgo_in_pr_diff":0},"status":"keep","description":"monitor PR after pushing PackagePaths path concatenation","timestamp":1777227252373,"segment":522,"confidence":null,"iterationTokens":453,"asi":{"hypothesis":"After pushing PackagePaths archive/manifest path concatenation, the PR run should start without immediate failures and root llgo should remain absent from the diff.","result":"New PR run has 0 failures, 2 passed, 45 pending, and root llgo absent from PR diff."}}
{"type":"config","name":"Use byte loop for safe cache path component checks","metricName":"package_paths_ns_op","metricUnit":"","bestDirection":"lower"}
{"run":1046,"commit":"704d742","metric":234,"metrics":{"package_paths_bytes_op":384,"package_paths_allocs_op":3,"runs":9},"status":"keep","description":"baseline PackagePaths safe component checks","timestamp":1777227291295,"segment":523,"confidence":null,"iterationTokens":591,"asi":{"hypothesis":"PackagePaths still spends time checking safe ASCII components with range-based rune iteration; benchmark before switching isSafeComponent to byte iteration.","result":"BenchmarkPackagePathsSafe median is 234 ns/op, 384 B/op, and 3 allocs/op across 9 runs."}}
{"run":1047,"commit":"704d742","metric":221,"metrics":{"package_paths_bytes_op":384,"package_paths_allocs_op":3,"runs":9},"status":"discard","description":"use byte loop for safe cache path component checks","timestamp":1777227363657,"segment":523,"confidence":null,"iterationTokens":1446,"asi":{"hypothesis":"isSafeComponent only allows ASCII-safe cache path characters, so byte iteration should avoid rune decoding overhead in PackagePaths safe-path checks.","result":"internal/build tests passed and PackagePaths moved from 234 ns/op to 221 ns/op with unchanged allocations, but the absolute ~13ns gain is too small for a semantic-risky Unicode handling change in path sanitization.","rollback_reason":"Noise-level improvement and potential reviewer concern around changing unicode iteration semantics, even though both reject non-ASCII.","next_action_hint":"Do not revisit isSafeComponent byte iteration unless PackagePaths dominates a larger end-to-end profile."}}
{"type":"config","name":"Record rejected isSafeComponent byte loop","metricName":"validation_failures","metricUnit":"","bestDirection":"lower"}
{"run":1048,"commit":"bb7adce","metric":0,"metrics":{"ideas_updated":1},"status":"keep","description":"record rejected isSafeComponent byte loop","timestamp":1777227401168,"segment":524,"confidence":null,"iterationTokens":172,"asi":{"hypothesis":"Record the rejected isSafeComponent byte-iteration experiment so future loops do not repeat a tiny path-sanitization micro-optimization with unicode semantics churn.","result":"Ideas backlog now records the 234ns/op to 221ns/op noise-level result and rejection reason."}}
{"type":"config","name":"Use strconv.Itoa for AbiMode manifest input","metricName":"collect_common_ns_op","metricUnit":"","bestDirection":"lower"}
{"run":1049,"commit":"27193e2","metric":95,"metrics":{"collect_common_bytes_op":80,"collect_common_allocs_op":4,"runs":9},"status":"keep","description":"baseline collectCommonInputs AbiMode formatting","timestamp":1777227441105,"segment":525,"confidence":null,"iterationTokens":716,"asi":{"hypothesis":"collectCommonInputs formats AbiMode with fmt.Sprintf per package; replacing it with strconv.Itoa should reduce manifest input collection overhead.","result":"BenchmarkCollectCommonInputs median is 95 ns/op, 80 B/op, and 4 allocs/op across 9 runs."}}
{"run":1050,"commit":"27193e2","metric":65,"metrics":{"collect_common_bytes_op":80,"collect_common_allocs_op":4,"runs":9},"status":"discard","description":"use strconv.Itoa for AbiMode manifest input","timestamp":1777227504346,"segment":525,"confidence":null,"iterationTokens":1368,"asi":{"hypothesis":"strconv.Itoa should avoid fmt.Sprintf overhead when formatting AbiMode in collectCommonInputs.","result":"internal/build tests passed and benchmark improved from 95 ns/op to 65 ns/op, but the absolute gain is only ~30ns per package with unchanged allocations; adding another import is not worthwhile for real build wall time.","rollback_reason":"Noise-level absolute gain and no allocation reduction; not a meaningful optimization target.","next_action_hint":"Do not revisit AbiMode formatting unless collectCommonInputs appears in a larger profile."}}
{"type":"config","name":"Record rejected AbiMode Itoa experiment","metricName":"validation_failures","metricUnit":"","bestDirection":"lower"}
{"run":1051,"commit":"45a4a01","metric":0,"metrics":{"ideas_updated":1},"status":"keep","description":"record rejected AbiMode Itoa experiment","timestamp":1777227546238,"segment":526,"confidence":null,"iterationTokens":171,"asi":{"hypothesis":"Record the rejected AbiMode strconv.Itoa experiment so future loops do not repeat a 30ns/no-allocation collectCommonInputs change.","result":"Ideas backlog now records the 95ns/op to 65ns/op result and rejection reason."}}
{"type":"config","name":"Reuse cache path file prefix in PackagePaths","metricName":"package_paths_ns_op","metricUnit":"","bestDirection":"lower"}
{"run":1052,"commit":"caba2a0","metric":234,"metrics":{"package_paths_bytes_op":384,"package_paths_allocs_op":3,"runs":9},"status":"keep","description":"baseline PackagePaths duplicated file prefix concatenation","timestamp":1777227589704,"segment":527,"confidence":null,"iterationTokens":590,"asi":{"hypothesis":"PackagePaths concatenates dir+separator+fingerprint twice for archive and manifest; benchmark before trying to reuse a common file prefix string.","result":"BenchmarkPackagePathsSafe median is 234 ns/op, 384 B/op, and 3 allocs/op across 9 runs."}}
{"run":1053,"commit":"caba2a0","metric":251,"metrics":{"package_paths_bytes_op":528,"package_paths_allocs_op":4,"runs":9},"status":"discard","description":"reuse cache file prefix in PackagePaths","timestamp":1777227663871,"segment":527,"confidence":null,"iterationTokens":1514,"asi":{"hypothesis":"Building a shared dir+separator+fingerprint file prefix once might avoid duplicated concatenation work for archive and manifest paths.","result":"internal/build tests passed, but BenchmarkPackagePathsSafe regressed from 234 ns/op, 384 B/op, 3 allocs/op to 251 ns/op, 528 B/op, 4 allocs/op because the prefix itself becomes an extra allocation.","rollback_reason":"Primary metric and allocations worsened.","next_action_hint":"Keep direct archive/manifest concatenations; do not reuse an intermediate filePrefix string."}}
{"type":"config","name":"Record rejected PackagePaths filePrefix reuse","metricName":"validation_failures","metricUnit":"","bestDirection":"lower"}
{"run":1054,"commit":"caba2a0","metric":1,"metrics":{"ideas_updated":0},"status":"crash","description":"record rejected PackagePaths filePrefix reuse","timestamp":1777227705790,"segment":528,"confidence":null,"iterationTokens":171,"asi":{"hypothesis":"Record the rejected PackagePaths intermediate filePrefix experiment in the ideas backlog.","result":"Validation assertion failed because the backlog text uses backticks around `dir+separator+fingerprint` rather than the literal token filePrefix.","rollback_reason":"Harness assertion bug; the backlog edit itself may be present.","next_action_hint":"Retry validation by checking for 'dir+separator+fingerprint' and the 234ns->251ns result."}}
{"run":1055,"commit":"9882f2c","metric":0,"metrics":{"ideas_updated":1},"status":"keep","description":"record rejected PackagePaths filePrefix reuse","timestamp":1777227728991,"segment":528,"confidence":null,"iterationTokens":526,"asi":{"hypothesis":"Record the rejected PackagePaths intermediate prefix experiment so future loops keep the direct archive/manifest concatenations.","result":"Ideas backlog records that reusing `dir+separator+fingerprint` regressed from 234ns/op to 251ns/op and increased allocations/bytes."}}
{"type":"config","name":"Monitor PR while PackagePaths path concatenation CI progresses","metricName":"pr_check_failures","metricUnit":"","bestDirection":"lower"}
{"run":1056,"commit":"73e341e","metric":0,"metrics":{"pending_checks":32,"passed_checks":25,"skipped_checks":0,"llgo_in_pr_diff":0},"status":"keep","description":"monitor PR while PackagePaths path concatenation CI progresses","timestamp":1777227787167,"segment":529,"confidence":null,"iterationTokens":450,"asi":{"hypothesis":"The PR run after PackagePaths path concatenation should continue without failures as jobs complete, and root llgo should stay absent from the diff.","result":"Current PR checks: 0 failures, 32 pending, 25 passed, 0 skipped; root llgo absent from PR diff.","next_action_hint":"Poll later for final status; continue local A/B experiments only with clear local evidence."}}
{"type":"config","name":"Cache cacheManager package directories","metricName":"package_paths_pair_ns_op","metricUnit":"","bestDirection":"lower"}
{"run":1057,"commit":"e7c855a","metric":470,"metrics":{"package_paths_pair_bytes_op":768,"package_paths_pair_allocs_op":6,"runs":9},"status":"keep","description":"baseline repeated PackagePaths same package","timestamp":1777227845889,"segment":530,"confidence":null,"iterationTokens":628,"asi":{"hypothesis":"tryLoadFromCache and saveToCache can call PackagePaths for the same target/package/fingerprint; caching package directories inside cacheManager may reduce repeated sanitization/path joining.","result":"BenchmarkPackagePathsSamePackageTwice median is 470 ns/op, 768 B/op, and 6 allocs/op across 9 runs."}}
{"run":1058,"commit":"e7c855a","metric":449,"metrics":{"package_paths_pair_bytes_op":1280,"package_paths_pair_allocs_op":9,"runs":9},"status":"discard","description":"cache cacheManager package directories","timestamp":1777227910278,"segment":530,"confidence":null,"iterationTokens":1781,"asi":{"hypothesis":"Caching package directories in cacheManager could avoid repeated target/package sanitization when PackagePaths is called for the same package during cache load/save.","result":"internal/build tests passed and two-call wall time moved from 470 ns/op to 449 ns/op, but bytes/allocs regressed significantly from 768 B/6 allocs to 1280 B/9 allocs due map setup; this is not worthwhile and may hinder future parallelism with mutable cacheManager state.","rollback_reason":"Allocation regression and added mutable map state outweigh a tiny two-call wall-time improvement.","next_action_hint":"Do not add cacheManager packageDir maps unless a broader cache-path profile shows repeated PackagePaths dominates and concurrency requirements are clear."}}
{"type":"config","name":"Record rejected cacheManager packageDir map","metricName":"validation_failures","metricUnit":"","bestDirection":"lower"}
{"run":1059,"commit":"8f136c3","metric":0,"metrics":{"ideas_updated":1},"status":"keep","description":"record rejected cacheManager packageDir map","timestamp":1777227944167,"segment":531,"confidence":null,"iterationTokens":185,"asi":{"hypothesis":"Record the rejected cacheManager package directory map so future loops avoid adding mutable state for a tiny repeated PackagePaths gain with allocation regression.","result":"Ideas backlog now records the 470ns/op to 449ns/op result, 6->9 allocation regression, bytes regression, and future-parallelism concern."}}
{"type":"config","name":"Re-evaluate hoisting cache root clean after PackagePaths optimizations","metricName":"package_paths_ns_op","metricUnit":"","bestDirection":"lower"}
{"run":1060,"commit":"d23d88e","metric":235,"metrics":{"package_paths_bytes_op":384,"package_paths_allocs_op":3,"runs":9},"status":"keep","description":"baseline PackagePaths before root clean re-evaluation","timestamp":1777228006724,"segment":532,"confidence":null,"iterationTokens":597,"asi":{"hypothesis":"After PackagePaths archive/manifest path concatenation, filepath.Clean(cm.root) may be a larger fraction of PackagePaths cost; establish a fresh baseline before re-evaluating root clean hoisting despite an earlier pre-optimization rejection.","result":"BenchmarkPackagePathsSafe median is 235 ns/op, 384 B/op, and 3 allocs/op across 9 runs."}}
{"run":1061,"commit":"d23d88e","metric":226,"metrics":{"package_paths_bytes_op":384,"package_paths_allocs_op":3,"runs":9},"status":"discard","description":"hoist cache root Clean after PackagePaths optimizations","timestamp":1777228071503,"segment":532,"confidence":null,"iterationTokens":1352,"asi":{"hypothesis":"Cleaning the cache root once in newCacheManager may now improve PackagePaths after other path-construction optimizations made filepath.Clean(cm.root) a larger fraction of the remaining cost.","result":"internal/build tests passed and PackagePaths moved from 235 ns/op to 226 ns/op with unchanged allocations, but the absolute ~9ns gain is too small and repeats an earlier rejected path with test/direct-construction semantics concerns.","rollback_reason":"Noise-level improvement; not enough to justify changing cacheManager root invariants.","next_action_hint":"Keep packageDir root cleaning in place unless a larger end-to-end profile shows PackagePaths root cleaning as material."}}
{"type":"config","name":"Record rejected root clean re-evaluation","metricName":"validation_failures","metricUnit":"","bestDirection":"lower"}
{"run":1062,"commit":"d23d88e","metric":1,"metrics":{"ideas_updated":0},"status":"crash","description":"record rejected root clean re-evaluation","timestamp":1777228108435,"segment":533,"confidence":null,"iterationTokens":171,"asi":{"hypothesis":"Record the rejected cache root Clean re-evaluation in ideas backlog.","result":"Validation assertion failed because the text did not contain the exact 'root cleaning' phrase, although the edit likely recorded the 235ns->226ns result.","rollback_reason":"Harness assertion bug only.","next_action_hint":"Retry validation by checking for filepath.Clean(cm.root) and 235ns->226ns."}}
{"run":1063,"commit":"fd563cf","metric":0,"metrics":{"ideas_updated":1},"status":"keep","description":"record rejected root clean re-evaluation","timestamp":1777228127858,"segment":533,"confidence":null,"iterationTokens":450,"asi":{"hypothesis":"Record the rejected post-optimization cache root clean hoist so future loops avoid repeating it.","result":"Ideas backlog records the earlier 728ns->740ns rejection and the later 235ns->226ns too-small re-evaluation."}}
{"type":"config","name":"Directly concatenate cache package directories","metricName":"package_paths_ns_op","metricUnit":"","bestDirection":"lower"}
