{"run":198,"commit":"02d9897","metric":0,"metrics":{"workflow_files_checked":8,"action_files_checked":5},"status":"keep","description":"validate CI YAML after pip and setup-deps changes","timestamp":1777051334803,"segment":100,"confidence":null,"iterationTokens":179,"asi":{"hypothesis":"Parse all workflow/action YAML after pip install flag changes and setup-deps apt array consolidation.","result":"All workflow/action YAML parsed successfully."}}
{"type":"config","name":"Monitor PR checks before pushing setup-deps pip batch","metricName":"pr_check_failures","metricUnit":"","bestDirection":"lower"}
{"run":199,"commit":"8d34517","metric":0,"metrics":{"pending_checks":9},"status":"keep","description":"monitor PR checks before pushing setup-deps and pip batch","timestamp":1777051383399,"segment":101,"confidence":null,"iterationTokens":173,"asi":{"hypothesis":"Before pushing the next setup-deps/pip optimization batch, ensure existing PR CI has no failures requiring attention.","result":"No failed checks observed; 9 checks still pending in summary."}}
{"type":"config","name":"Monitor PR checks after setup-deps pip push","metricName":"pr_check_failures","metricUnit":"","bestDirection":"lower"}
{"run":200,"commit":"fbad30f","metric":0,"metrics":{"pending_checks":9},"status":"keep","description":"monitor PR checks immediately after setup-deps pip push","timestamp":1777051431275,"segment":102,"confidence":null,"iterationTokens":172,"asi":{"hypothesis":"Immediately check CI after pushing setup-deps and pip optimizations to catch early failures.","result":"No failed checks observed; 9 checks pending immediately after push."}}
{"type":"config","name":"Combine setup-go verify into download step","metricName":"setup_go_action_steps","metricUnit":"","bestDirection":"lower"}
{"run":201,"commit":"9276340","metric":2,"metrics":{"setup_go_actions":1},"status":"keep","description":"baseline setup-go composite action has separate verify step","timestamp":1777051482397,"segment":103,"confidence":null,"iterationTokens":139,"asi":{"hypothesis":"The custom setup-go composite action can print go version at the end of its setup step and remove the separate verify step, preserving diagnostics while reducing one composite action step each time it is used."}}
{"run":202,"commit":"59495c9","metric":1,"metrics":{"setup_go_actions":1},"status":"keep","description":"combine setup-go verify into setup step","timestamp":1777051547975,"segment":103,"confidence":null,"iterationTokens":1589,"asi":{"hypothesis":"Printing go version inside the setup-go action's main step preserves verification diagnostics and removes a separate composite action step for every custom setup-go use.","result":"setup-go action step count dropped from 2 to 1."}}
{"type":"config","name":"Validate setup-go shell syntax after step combine","metricName":"setup_go_shell_syntax_failures","metricUnit":"","bestDirection":"lower"}
{"run":203,"commit":"50146fe","metric":0,"metrics":{"setup_go_shell_blocks_checked":1},"status":"keep","description":"validate setup-go shell syntax after combining verify step","timestamp":1777051583151,"segment":104,"confidence":null,"iterationTokens":238,"asi":{"hypothesis":"Run bash -n on the setup-go action shell script after moving verification into the main setup step.","result":"setup-go shell block passed bash -n."}}
{"type":"config","name":"Monitor PR checks after setup-go local changes","metricName":"pr_check_failures","metricUnit":"","bestDirection":"lower"}
{"run":204,"commit":"3d63d95","metric":1,"metrics":{"pending_checks":9,"failed_checks":1},"status":"keep","description":"monitor PR checks found build-cache macOS failure","timestamp":1777051636447,"segment":105,"confidence":null,"iterationTokens":171,"asi":{"hypothesis":"Check pushed CI while local setup-go changes are accumulating; failures must be inspected and fixed before more optimization.","result":"Detected failing build-cache (macos-latest, 19) check in the currently pushed CI run.","next_action_hint":"Inspect build-cache macOS failed log with gh run view and fix or revert the responsible pushed workflow change."}}
{"type":"config","name":"Use HTTPS apt.llvm.org source for CI reliability","metricName":"apt_llvm_http_sources","metricUnit":"","bestDirection":"lower"}
{"run":205,"commit":"5b7d21c","metric":1,"metrics":{"failed_ci_checks":1},"status":"keep","description":"baseline setup-deps uses HTTP apt.llvm.org source","timestamp":1777051725399,"segment":106,"confidence":null,"iterationTokens":147,"asi":{"hypothesis":"The observed build-cache Ubuntu CI failure timed out fetching LLVM packages over http://apt.llvm.org. Switching the apt source to https://apt.llvm.org may avoid HTTP connectivity issues while keeping the same repository and packages.","result":"CI failure log shows apt package fetches failing on http://apt.llvm.org with connection timeouts."}}
{"run":206,"commit":"0603760","metric":0,"metrics":{"failed_ci_checks":1},"status":"keep","description":"use HTTPS apt.llvm.org source in setup-deps","timestamp":1777051766404,"segment":106,"confidence":null,"iterationTokens":550,"asi":{"hypothesis":"Using https://apt.llvm.org for the apt source keeps the same LLVM repository but may avoid the observed CI timeout fetching packages over HTTP.","result":"setup-deps action YAML parses and HTTP apt.llvm source count dropped from 1 to 0."}}
{"type":"config","name":"Validate setup-deps shell after HTTPS apt source","metricName":"setup_deps_shell_syntax_failures","metricUnit":"","bestDirection":"lower"}
{"run":207,"commit":"1c2bcc6","metric":0,"metrics":{"setup_deps_shell_blocks_checked":2},"status":"keep","description":"validate setup-deps shell after HTTPS apt source","timestamp":1777051807228,"segment":107,"confidence":null,"iterationTokens":323,"asi":{"hypothesis":"Run bash -n on setup-deps shell blocks after switching apt.llvm.org source to HTTPS.","result":"Both setup-deps shell blocks passed bash -n."}}
{"type":"config","name":"Validate all CI YAML before CI fix push","metricName":"ci_yaml_failures","metricUnit":"","bestDirection":"lower"}
{"run":208,"commit":"5f78fe8","metric":0,"metrics":{"workflow_files_checked":8,"action_files_checked":5},"status":"keep","description":"validate all CI YAML before pushing apt.llvm CI fix","timestamp":1777051845379,"segment":108,"confidence":null,"iterationTokens":177,"asi":{"hypothesis":"Parse all workflow/action YAML before pushing the apt.llvm HTTPS CI fix and accumulated setup-go changes.","result":"All workflow/action YAML parsed successfully."}}
{"type":"config","name":"Monitor PR checks after apt.llvm HTTPS fix push","metricName":"pr_check_failures","metricUnit":"","bestDirection":"lower"}
{"run":209,"commit":"5daa86a","metric":0,"metrics":{"pending_checks":9},"status":"keep","description":"monitor PR checks immediately after apt.llvm HTTPS fix push","timestamp":1777051904564,"segment":109,"confidence":null,"iterationTokens":173,"asi":{"hypothesis":"Immediately check CI after pushing the apt.llvm HTTPS fix; the prior failed run should be superseded by new pending checks.","result":"No failed checks observed on the new run; 9 checks pending immediately after push."}}
{"run":210,"commit":"985071b","metric":0,"metrics":{"pending_checks":9},"status":"keep","description":"monitor PR checks after apt.llvm HTTPS fix has run longer","timestamp":1777052111218,"segment":109,"confidence":null,"iterationTokens":790,"asi":{"hypothesis":"Check whether the apt.llvm HTTPS fix resolves early setup failures after the new run has had a few minutes to progress.","result":"No failed checks observed; build-cache Ubuntu no longer appears in the pending/fail summary, while 9 other checks remain pending."}}
{"type":"config","name":"Monitor build-cache macOS after apt fix","metricName":"build_cache_failures","metricUnit":"","bestDirection":"lower"}
{"run":211,"commit":"bd4c770","metric":0,"metrics":{"build_cache_checks":2},"status":"keep","description":"verify build-cache checks pass after apt.llvm HTTPS fix","timestamp":1777052292845,"segment":110,"confidence":null,"iterationTokens":169,"asi":{"hypothesis":"Specifically confirm the previously failing build-cache workflow passes after switching apt.llvm.org to HTTPS.","result":"Both Ubuntu and macOS build-cache checks passed."}}
{"type":"config","name":"Monitor all PR checks after build-cache recovery","metricName":"pr_check_failures","metricUnit":"","bestDirection":"lower"}
{"run":212,"commit":"458620b","metric":0,"metrics":{"pending_checks":9},"status":"keep","description":"monitor all PR checks after build-cache recovery","timestamp":1777052326172,"segment":111,"confidence":null,"iterationTokens":171,"asi":{"hypothesis":"After confirming build-cache recovered, check all PR checks for remaining failures before more optimization.","result":"No failed checks observed; 9 checks still pending."}}
{"type":"config","name":"Remove setup-goreleaser sysroot tree diagnostic","metricName":"setup_goreleaser_tree_steps","metricUnit":"","bestDirection":"lower"}
{"run":213,"commit":"a1989b6","metric":1,"metrics":{"setup_goreleaser_actions":1},"status":"keep","description":"baseline setup-goreleaser prints full sysroot tree","timestamp":1777052383163,"segment":112,"confidence":null,"iterationTokens":148,"asi":{"hypothesis":"The setup-goreleaser action ends with a diagnostic tree .sysroot step. Removing it preserves release build behavior while avoiding an extra composite step and potentially large directory listing."}}
{"run":214,"commit":"7f30a1b","metric":0,"metrics":{"setup_goreleaser_actions":1},"status":"keep","description":"remove setup-goreleaser sysroot tree diagnostic","timestamp":1777052413751,"segment":112,"confidence":null,"iterationTokens":429,"asi":{"hypothesis":"Dropping the final tree .sysroot diagnostic from setup-goreleaser removes an extra composite action step and log-heavy directory traversal without changing restored caches or build inputs.","result":"setup-goreleaser action YAML parses and tree diagnostic count dropped from 1 to 0."}}
{"type":"config","name":"Update setup-goreleaser to setup-go v6","metricName":"setup_go_v5_sites","metricUnit":"","bestDirection":"lower"}
{"run":215,"commit":"dfea357","metric":1,"metrics":{"setup_go_external_sites":3},"status":"keep","description":"baseline setup-goreleaser still uses setup-go v5","timestamp":1777052443808,"segment":113,"confidence":null,"iterationTokens":132,"asi":{"hypothesis":"Updating the remaining actions/setup-go@v5 usage to v6 keeps CI actions current and consistent with other workflows. This is primarily maintenance/reliability rather than benchmark-specific speed."}}
{"run":216,"commit":"918e2c0","metric":0,"metrics":{"setup_go_external_sites":3},"status":"keep","description":"update setup-goreleaser to setup-go v6","timestamp":1777052480950,"segment":113,"confidence":null,"iterationTokens":411,"asi":{"hypothesis":"Switching setup-goreleaser from actions/setup-go@v5 to v6 aligns it with the rest of CI without changing requested Go version or release build behavior.","result":"setup-goreleaser YAML parses and setup-go@v5 sites dropped from 1 to 0."}}
{"type":"config","name":"Validate all CI YAML before goreleaser push","metricName":"ci_yaml_failures","metricUnit":"","bestDirection":"lower"}
{"run":217,"commit":"97584fc","metric":0,"metrics":{"workflow_files_checked":8,"action_files_checked":5},"status":"keep","description":"validate all CI YAML before pushing goreleaser changes","timestamp":1777052531732,"segment":114,"confidence":null,"iterationTokens":178,"asi":{"hypothesis":"Parse all workflow/action YAML before pushing setup-goreleaser maintenance and diagnostic-trimming changes.","result":"All workflow/action YAML parsed successfully."}}
{"type":"config","name":"Monitor PR checks before pushing goreleaser batch","metricName":"pr_check_failures","metricUnit":"","bestDirection":"lower"}
{"run":218,"commit":"021f4b3","metric":0,"metrics":{"pending_checks":9},"status":"keep","description":"monitor PR checks before pushing goreleaser batch","timestamp":1777052563760,"segment":115,"confidence":null,"iterationTokens":172,"asi":{"hypothesis":"Before pushing the setup-goreleaser batch, ensure the current PR run has no failures needing attention.","result":"No failed checks observed; 9 checks still pending."}}
{"type":"config","name":"Monitor PR checks after goreleaser batch push","metricName":"pr_check_failures","metricUnit":"","bestDirection":"lower"}
{"run":219,"commit":"edd85d3","metric":0,"metrics":{"pending_checks":9},"status":"keep","description":"monitor PR checks immediately after goreleaser batch push","timestamp":1777052608896,"segment":116,"confidence":null,"iterationTokens":172,"asi":{"hypothesis":"Immediately check CI after pushing setup-goreleaser changes to catch early workflow/action failures.","result":"No failed checks observed; 9 checks pending immediately after push."}}
{"run":220,"commit":"a48db5b","metric":0,"metrics":{"pending_checks":9},"status":"keep","description":"monitor PR checks after resume from context limit","timestamp":1777052682904,"segment":116,"confidence":null,"iterationTokens":854,"asi":{"hypothesis":"Resume by checking PR CI first; any failure should preempt further optimization.","result":"No failed checks observed; 9 checks still pending in summary."}}
{"type":"config","name":"Remove release artifact extraction listing diagnostic","metricName":"release_artifact_ls_diagnostics","metricUnit":"","bestDirection":"lower"}
{"run":221,"commit":"a34ee26","metric":1,"metrics":{"release_workflows":1},"status":"keep","description":"baseline release artifact extraction lists archive contents","timestamp":1777052729757,"segment":117,"confidence":null,"iterationTokens":141,"asi":{"hypothesis":"The release artifact test job lists the extracted release directory only for diagnostics. Removing that ls avoids extra filesystem traversal/logging while preserving extraction and PATH setup."}}
{"run":222,"commit":"d3d4613","metric":0,"metrics":{"release_workflows":1},"status":"keep","description":"remove release artifact extraction listing diagnostic","timestamp":1777052777256,"segment":117,"confidence":null,"iterationTokens":454,"asi":{"hypothesis":"Removing ls -la release-llgo keeps the release artifact extraction and PATH behavior unchanged while reducing log/output work in each artifact smoke job.","result":"release-build workflow YAML parses and release artifact ls diagnostics dropped from 1 to 0."}}
{"type":"config","name":"Validate all CI YAML after release diagnostic removal","metricName":"ci_yaml_failures","metricUnit":"","bestDirection":"lower"}
{"run":223,"commit":"838d3c0","metric":0,"metrics":{"workflow_files_checked":8,"action_files_checked":5},"status":"keep","description":"validate all CI YAML after release diagnostic removal","timestamp":1777052816229,"segment":118,"confidence":null,"iterationTokens":177,"asi":{"hypothesis":"Parse all workflow/action YAML after removing the release artifact ls diagnostic.","result":"All workflow/action YAML parsed successfully."}}
{"type":"config","name":"Monitor PR checks after release diagnostic removal","metricName":"pr_check_failures","metricUnit":"","bestDirection":"lower"}
{"run":224,"commit":"4e6f125","metric":0,"metrics":{"pending_checks":9},"status":"keep","description":"monitor PR checks after local release diagnostic removal","timestamp":1777052849548,"segment":119,"confidence":null,"iterationTokens":170,"asi":{"hypothesis":"Check pushed CI while local release diagnostic cleanup is accumulating; failures should be addressed before more changes.","result":"No failed checks observed; 9 checks still pending in summary."}}
{"type":"config","name":"Remove standalone clang information diagnostic step","metricName":"standalone_clang_info_steps","metricUnit":"","bestDirection":"lower"}
{"run":225,"commit":"938cb63","metric":1,"metrics":{"go_workflows":1},"status":"keep","description":"baseline Go workflow has standalone clang diagnostic step","timestamp":1777052906464,"segment":120,"confidence":null,"iterationTokens":135,"asi":{"hypothesis":"The Go workflow has a separate Clang information step that only prints PATH/clang version. Removing it avoids an extra workflow step while setup/test failures still diagnose missing clang, and setup-deps already handles installing LLVM."}}
{"run":226,"commit":"adc0d9a","metric":0,"metrics":{"go_workflows":1},"status":"keep","description":"remove standalone clang information diagnostic step","timestamp":1777052933732,"segment":120,"confidence":null,"iterationTokens":406,"asi":{"hypothesis":"Removing the standalone clang diagnostic from go.yml reduces workflow step overhead without affecting test coverage or dependency installation.","result":"go workflow YAML parses and standalone clang diagnostic steps dropped from 1 to 0."}}
{"type":"config","name":"Combine setup-embed QEMU verification into install step","metricName":"setup_embed_action_steps","metricUnit":"","bestDirection":"lower"}
{"run":227,"commit":"990dec9","metric":4,"metrics":{"setup_embed_actions":1},"status":"keep","description":"baseline setup-embed-deps has separate QEMU verify step","timestamp":1777052979537,"segment":121,"confidence":null,"iterationTokens":145,"asi":{"hypothesis":"The setup-embed-deps composite action can verify qemu-system-* immediately after installing and adding QEMU to GITHUB_PATH, reducing one composite action step while preserving diagnostics."}}
{"run":228,"commit":"b21e65f","metric":3,"metrics":{"setup_embed_actions":1},"status":"keep","description":"combine setup-embed QEMU verification into install step","timestamp":1777053028270,"segment":121,"confidence":null,"iterationTokens":1060,"asi":{"hypothesis":"Running qemu-system-* --version using the freshly installed bin path inside the install step preserves verification diagnostics and removes the separate verify action step.","result":"setup-embed-deps action YAML parses and composite action step count dropped from 4 to 3."}}
{"type":"config","name":"Validate setup-embed shell syntax after step combine","metricName":"setup_embed_shell_syntax_failures","metricUnit":"","bestDirection":"lower"}
{"run":229,"commit":"77a15d7","metric":0,"metrics":{"setup_embed_shell_blocks_checked":3},"status":"keep","description":"validate setup-embed shell syntax after combining QEMU verify","timestamp":1777053061472,"segment":122,"confidence":null,"iterationTokens":284,"asi":{"hypothesis":"Run bash -n over setup-embed-deps shell blocks after combining QEMU verification into the install step.","result":"All setup-embed-deps shell blocks passed bash -n."}}
{"type":"config","name":"Validate all CI YAML before diagnostic-step push","metricName":"ci_yaml_failures","metricUnit":"","bestDirection":"lower"}
{"run":230,"commit":"be2016b","metric":0,"metrics":{"workflow_files_checked":8,"action_files_checked":5},"status":"keep","description":"validate all CI YAML before pushing diagnostic step reductions","timestamp":1777053104673,"segment":123,"confidence":null,"iterationTokens":177,"asi":{"hypothesis":"Parse all workflow/action YAML before pushing diagnostic-step reduction changes.","result":"All workflow/action YAML parsed successfully."}}
{"type":"config","name":"Monitor PR checks after diagnostic step push","metricName":"pr_check_failures","metricUnit":"","bestDirection":"lower"}
{"run":231,"commit":"1585327","metric":0,"metrics":{"pending_checks":9},"status":"keep","description":"monitor PR checks immediately after diagnostic step push","timestamp":1777053153128,"segment":124,"confidence":null,"iterationTokens":170,"asi":{"hypothesis":"Immediately check CI after pushing diagnostic-step reductions to catch workflow/action failures.","result":"No failed checks observed; 9 checks pending immediately after push."}}
{"run":232,"commit":"99a7816","metric":0,"metrics":{"pending_checks":9},"status":"keep","description":"monitor PR checks after diagnostic step push has run longer","timestamp":1777053376829,"segment":124,"confidence":null,"iterationTokens":952,"asi":{"hypothesis":"Wait a few minutes after the diagnostic-step push to ensure setup and early workflow jobs do not fail.","result":"No failed checks observed; 9 checks still pending in summary."}}
{"type":"config","name":"Remove verbose flag from _xtool build smoke","metricName":"llgo_xtool_verbose_build_flags","metricUnit":"","bestDirection":"lower"}
{"run":233,"commit":"72843c3","metric":1,"metrics":{"llgo_workflows":1},"status":"keep","description":"baseline _xtool build smoke uses verbose llgo build","timestamp":1777053486523,"segment":125,"confidence":null,"iterationTokens":148,"asi":{"hypothesis":"The llgo workflow's _xtool build smoke test uses llgo build -v ./..., which increases log output without changing coverage. Removing -v should preserve the build smoke while reducing logging overhead."}}
{"run":234,"commit":"61097ce","metric":0,"metrics":{"llgo_workflows":1},"status":"keep","description":"remove verbose flag from _xtool build smoke","timestamp":1777053521135,"segment":125,"confidence":null,"iterationTokens":423,"asi":{"hypothesis":"Dropping -v from the _xtool llgo build keeps the same package build smoke coverage while reducing CI log volume and minor output work.","result":"llgo workflow YAML parses and _xtool verbose build flags dropped from 1 to 0."}}
{"type":"config","name":"Remove verbose flag from test-helloworld ESP build","metricName":"helloworld_verbose_llgo_build_flags","metricUnit":"","bestDirection":"lower"}
{"run":235,"commit":"29f6add","metric":1,"metrics":{"test_helloworld_actions":1},"status":"keep","description":"baseline test-helloworld ESP build uses verbose llgo build","timestamp":1777053561400,"segment":126,"confidence":null,"iterationTokens":144,"asi":{"hypothesis":"The test-helloworld action's ESP32 build uses llgo build -v but only checks that the output ELF exists. Removing -v preserves coverage while reducing log output in hello/release artifact jobs."}}
