{"run":557,"commit":"ef5be1e","metric":0,"metrics":{"pending_checks":36,"split_macos_intel_over15_jobs":0,"split_macos_intel_completed_jobs":0,"split_macos_intel_max_seconds":0},"status":"keep","description":"resume monitoring ESP serial case shard with 36 checks pending","timestamp":1777110646356,"segment":274,"confidence":null,"iterationTokens":882,"asi":{"hypothesis":"Resume after context-limit stop; ESP serial case sharding should continue without failures and split jobs should complete under 15m.","result":"No failed checks observed; 36 checks pending and no macOS Intel split jobs completed yet in current run."}}
{"run":558,"commit":"4972c93","metric":0,"metrics":{"pending_checks":28,"split_macos_intel_over15_jobs":0,"split_macos_intel_completed_jobs":0,"split_macos_intel_max_seconds":0},"status":"keep","description":"monitor ESP serial case shard with 28 checks pending","timestamp":1777110963282,"segment":274,"confidence":null,"iterationTokens":1297,"asi":{"hypothesis":"Continue monitoring ESP serial case-sharded run; failures should remain zero as jobs progress.","result":"No failed checks observed; 28 checks pending."}}
{"run":559,"commit":"115aa04","metric":0,"metrics":{"pending_checks":23,"split_macos_intel_over15_jobs":0,"split_macos_intel_completed_jobs":3,"split_macos_intel_max_seconds":655},"status":"keep","description":"monitor ESP serial case shard with three split jobs completed","timestamp":1777111279448,"segment":274,"confidence":null,"iterationTokens":1305,"asi":{"hypothesis":"Case-sharded ESP serial smoke and embedded-demo shards should complete under 15m with no failures.","result":"No failed checks observed; 23 checks pending. Three macOS Intel split jobs completed under 15m, max 655s."}}
{"run":560,"commit":"7d1d7cf","metric":0,"metrics":{"pending_checks":21,"split_macos_intel_over15_jobs":0,"split_macos_intel_completed_jobs":3,"split_macos_intel_max_seconds":655},"status":"keep","description":"monitor ESP serial case shard with 21 checks pending","timestamp":1777111593423,"segment":274,"confidence":null,"iterationTokens":1363,"asi":{"hypothesis":"Continue monitoring the ESP serial case-sharded run; no failures should appear while remaining macOS jobs complete.","result":"No failed checks observed; 21 checks pending. Completed macOS Intel split jobs remain under 15m."}}
{"run":561,"commit":"762b85c","metric":0,"metrics":{"pending_checks":18,"split_macos_intel_over15_jobs":1,"split_macos_intel_completed_jobs":6,"split_macos_intel_max_seconds":1015},"status":"keep","description":"monitor ESP serial case shard with one over-15 split job observed","timestamp":1777111911772,"segment":274,"confidence":null,"iterationTokens":1357,"asi":{"hypothesis":"ESP serial case sharding should reduce the formerly slow ESP32-C3 serial job; if another split job is over target, identify it after this monitor cycle and wait for full run before changing.","result":"No failed checks observed; 18 checks pending. Six macOS Intel split jobs completed, one over 15m at 1015s."}}
{"run":562,"commit":"086beb9","metric":0,"metrics":{"pending_checks":15,"split_macos_intel_over15_jobs":1,"split_macos_intel_completed_jobs":7,"split_macos_intel_max_seconds":1015},"status":"keep","description":"monitor ESP serial case shard with seven split jobs completed","timestamp":1777112245522,"segment":274,"confidence":null,"iterationTokens":2934,"asi":{"hypothesis":"Continue monitoring full run before acting on one over-15 embedded-demo shard, since macOS runner variability may affect a single job.","result":"No failed checks observed; 15 checks pending. Seven macOS Intel split jobs completed; one Go 1.21 esp32c3-basic embedded shard is over target at 1015s."}}
{"run":563,"commit":"36299c4","metric":0,"metrics":{"pending_checks":12,"split_macos_intel_over15_jobs":1,"split_macos_intel_completed_jobs":8,"split_macos_intel_max_seconds":1015},"status":"keep","description":"monitor ESP serial case shard with 12 checks pending","timestamp":1777112565583,"segment":274,"confidence":null,"iterationTokens":1411,"asi":{"hypothesis":"Continue monitoring; remaining ESP32-C3 serial case shards and host demos should complete without failures.","result":"No failed checks observed; 12 checks pending. Eight macOS Intel split jobs completed; one over-target embedded-demo shard remains at 1015s."}}
{"run":564,"commit":"c10d44e","metric":0,"metrics":{"pending_checks":10,"split_macos_intel_over15_jobs":1,"split_macos_intel_completed_jobs":10,"split_macos_intel_max_seconds":1015},"status":"keep","description":"monitor ESP serial case shard with ten split jobs completed","timestamp":1777112880928,"segment":274,"confidence":null,"iterationTokens":1415,"asi":{"hypothesis":"Continue monitoring the full ESP serial case-sharded run; no failures should appear as remaining macOS Intel jobs complete.","result":"No failed checks observed; 10 checks pending. Ten macOS Intel split jobs completed; one over-target embedded-demo shard remains at 1015s."}}
{"run":565,"commit":"70a8044","metric":0,"metrics":{"pending_checks":7,"split_macos_intel_over15_jobs":1,"split_macos_intel_completed_jobs":11,"split_macos_intel_max_seconds":1015},"status":"keep","description":"monitor ESP serial case shard with seven checks pending","timestamp":1777113197538,"segment":274,"confidence":null,"iterationTokens":1393,"asi":{"hypothesis":"Continue monitoring final pending jobs; ESP serial case shard should remain failure-free and completed split jobs mostly under 15m.","result":"No failed checks observed; 7 checks pending. Eleven macOS Intel split jobs completed; one over-target embedded-demo shard remains at 1015s."}}
{"run":566,"commit":"e2ef21f","metric":0,"metrics":{"pending_checks":3,"split_macos_intel_over15_jobs":2,"split_macos_intel_completed_jobs":15,"split_macos_intel_max_seconds":1031},"status":"keep","description":"final monitor ESP serial case shard before stopping","timestamp":1777113513938,"segment":274,"confidence":null,"iterationTokens":1328,"asi":{"hypothesis":"Finish the current monitoring cycle before stopping per user request; report final observed state rather than continuing experiments.","result":"No failed checks observed; 3 checks pending. Fifteen macOS Intel split jobs completed; two exceeded 15m in this run, max 1031s."}}
{"run":567,"commit":"a9dd741","metric":0,"metrics":{"pending_checks":3,"split_macos_intel_over15_jobs":2,"split_macos_intel_completed_jobs":15,"split_macos_intel_max_seconds":1031},"status":"keep","description":"resume monitoring ESP serial case shard with three checks pending","timestamp":1777113557680,"segment":274,"confidence":null,"iterationTokens":2904,"asi":{"hypothesis":"Resume after context-limit stop; final pending macOS Intel main/host-demo checks should complete without failures. Avoid changing code until full run outcome is known.","result":"No failed checks observed; 3 checks pending. Fifteen macOS Intel split jobs completed, two over 15m with max 1031s."}}
{"run":568,"commit":"778e7cc","metric":0,"metrics":{"pending_checks":1,"split_macos_intel_over15_jobs":2,"split_macos_intel_completed_jobs":17,"split_macos_intel_max_seconds":1031},"status":"keep","description":"monitor ESP serial case shard with one host-demo check pending","timestamp":1777113873219,"segment":274,"confidence":null,"iterationTokens":1175,"asi":{"hypothesis":"Continue monitoring final host-demo check; failures should stay zero while final duration picture settles.","result":"No failed checks observed; only llgo-host-demos-macos-intel Go 1.24 remains pending. Seventeen macOS Intel split jobs completed, two over 15m with max 1031s."}}
{"run":569,"commit":"c46c4e9","metric":0,"metrics":{"pending_checks":0,"split_macos_intel_over15_jobs":2,"split_macos_intel_completed_jobs":18,"split_macos_intel_max_seconds":1031},"status":"keep","description":"monitor ESP serial case shard run completed without failures","timestamp":1777114130487,"segment":274,"confidence":null,"iterationTokens":1121,"asi":{"hypothesis":"Confirm the full ESP serial case-sharded run completes without failures and measure final macOS Intel split durations.","result":"Full PR run completed with zero failures and zero pending checks. Eighteen macOS Intel split jobs completed; two remain over 15m with max 1031s (~17m11s)."}}
{"run":570,"commit":"3c44953","metric":0,"metrics":{"pending_checks":0,"split_macos_intel_over15_jobs":2,"split_macos_intel_completed_jobs":18,"split_macos_intel_max_seconds":1031},"status":"keep","description":"monitor ESP serial case shard run complete with two over-target jobs","timestamp":1777114474562,"segment":274,"confidence":null,"iterationTokens":5528,"asi":{"hypothesis":"Confirm full ESP serial case-sharded run outcome before further changes.","result":"Full run completed with zero failures and zero pending checks. Eighteen macOS Intel split jobs completed; two remain over 15m, max 1031s."}}
{"type":"config","name":"Eliminate remaining macOS Intel over-15 split jobs","metricName":"split_macos_intel_over15_jobs","metricUnit":"","bestDirection":"lower"}
{"run":571,"commit":"3302c1c","metric":2,"metrics":{"split_macos_intel_max_seconds":1031},"status":"keep","description":"baseline after ESP serial case shard still has two over-15 split jobs","timestamp":1777114514139,"segment":275,"confidence":null,"iterationTokens":320,"asi":{"hypothesis":"Two macOS Intel split jobs remain over 15m: Go 1.21 esp32c3-basic embedded demo shard 1 and Go 1.24 ESP32-C3 startup smoke. Further coverage-preserving sharding/splitting should eliminate them."}}
{"run":572,"commit":"569ee1d","metric":0,"metrics":{"split_macos_intel_max_seconds":780,"fake_demo_shard0_cases":9,"fake_demo_shard1_cases":8,"fake_demo_shard2_cases":8,"fake_demo_sharded_cases":25},"status":"keep","description":"split remaining slow embedded demo and startup smoke jobs","timestamp":1777114574196,"segment":275,"confidence":null,"iterationTokens":6299,"asi":{"hypothesis":"Increase only the slow Go 1.21 esp32c3-basic embedded demo target from 2 to 3 shards, and split Go 1.24 startup smoke into linker and float scopes. Both changes preserve coverage while targeting the two observed >15m jobs.","result":"Workflow YAML and shell syntax pass. Fake embedded demo validation covers all 25 esp32c3-basic cases across 3 shards (9/8/8), and invalid startup scope is rejected."}}
{"type":"config","name":"Validate workflows after final macOS split refinements","metricName":"workflow_validation_failures","metricUnit":"","bestDirection":"lower"}
{"run":573,"commit":"1566f40","metric":0,"metrics":{"workflow_files_checked":8,"action_files_checked":5,"shell_scripts_checked":4,"crosscompile_packages_tested":1},"status":"keep","description":"validate workflows after final macOS split refinements","timestamp":1777114607265,"segment":276,"confidence":null,"iterationTokens":284,"asi":{"hypothesis":"Before pushing final split refinements, validate workflows/actions, all edited shell scripts, and crosscompile retry tests.","result":"All workflow/action YAML parsed; test_demo.sh, ESP serial, ESP32-C3 startup, and install-esp-qemu scripts passed bash -n; internal/crosscompile tests passed."}}
{"type":"config","name":"Monitor PR after final split refinement push","metricName":"pr_check_failures","metricUnit":"","bestDirection":"lower"}
{"run":574,"commit":"d65b691","metric":0,"metrics":{"pending_checks":44},"status":"keep","description":"monitor PR immediately after final split refinement push","timestamp":1777114645215,"segment":277,"confidence":null,"iterationTokens":240,"asi":{"hypothesis":"After pushing the final split refinements and ideas update, the new PR run should start without immediate failures.","result":"No failed checks observed; 44 checks pending after workflow fan-out."}}
{"run":575,"commit":"d65b691","metric":1,"metrics":{"pending_checks":35,"split_macos_intel_over15_jobs":0,"split_macos_intel_completed_jobs":0,"split_macos_intel_max_seconds":0},"status":"checks_failed","description":"monitor final split refinement run found macOS test failure","timestamp":1777114969704,"segment":277,"confidence":null,"iterationTokens":1122,"asi":{"hypothesis":"New run after final split refinements should stay failure-free while macOS Intel split jobs start.","result":"One failure appeared: test (macos-latest, 19) after 1m8s.","rollback_reason":"CI failure appeared in a non-macOS-Intel-split job; need inspect logs to determine whether transient setup/dependency issue or regression.","next_action_hint":"Fetch failed job 73004430486 logs. If unrelated transient setup failure, rerun; if caused by recent script/workflow edits, fix or revert."}}
{"type":"config","name":"Increase ESP QEMU retry budget","metricName":"qemu_download_retries","metricUnit":"","bestDirection":"higher"}
{"run":576,"commit":"ac5be68","metric":3,"metrics":{},"status":"keep","description":"baseline ESP QEMU retry budget insufficient for 502 burst","timestamp":1777115015060,"segment":278,"confidence":null,"iterationTokens":169,"asi":{"hypothesis":"The latest macOS test failure was an ESP QEMU release download returning 502 for all retry attempts. Current curl retry budget of 3 may be insufficient for short GitHub release outage bursts."}}
{"run":577,"commit":"0a77bdb","metric":5,"metrics":{"qemu_retry_delay_seconds":5},"status":"keep","description":"increase ESP QEMU download retry budget","timestamp":1777115036334,"segment":278,"confidence":null,"iterationTokens":527,"asi":{"hypothesis":"Increase ESP QEMU curl retry budget from 3 to 5 attempts and delay from 2s to 5s to survive repeated transient 502s from GitHub release downloads. This affects only setup retry behavior and preserves test coverage.","result":"install-esp-qemu.sh passes bash -n and now uses --retry 5 --retry-delay 5."}}
{"type":"config","name":"Validate after ESP QEMU retry budget increase","metricName":"validation_failures","metricUnit":"","bestDirection":"lower"}
{"run":578,"commit":"31a0a70","metric":0,"metrics":{"workflow_files_checked":8,"action_files_checked":5,"shell_scripts_checked":4,"crosscompile_packages_tested":1},"status":"keep","description":"validate after ESP QEMU retry budget increase","timestamp":1777115063245,"segment":279,"confidence":null,"iterationTokens":281,"asi":{"hypothesis":"Before pushing the QEMU retry budget increase, validate workflows/actions, edited shell scripts, and crosscompile package tests.","result":"All workflow/action YAML parsed; install-esp-qemu.sh, test_demo.sh, ESP serial, and ESP32-C3 startup scripts passed bash -n; internal/crosscompile tests passed."}}
{"type":"config","name":"Monitor PR after QEMU retry budget push","metricName":"pr_check_failures","metricUnit":"","bestDirection":"lower"}
{"run":579,"commit":"78dcd73","metric":0,"metrics":{"pending_checks":11},"status":"keep","description":"monitor PR after pushing QEMU retry budget increase","timestamp":1777115099617,"segment":280,"confidence":null,"iterationTokens":241,"asi":{"hypothesis":"After pushing QEMU retry budget increase, the new run should start without immediate failures and should better tolerate GitHub release 502 bursts.","result":"No failed checks observed; 11 checks pending immediately after push."}}
{"run":580,"commit":"0cb53c6","metric":0,"metrics":{"pending_checks":38,"split_macos_intel_over15_jobs":0,"split_macos_intel_completed_jobs":0,"split_macos_intel_max_seconds":0},"status":"keep","description":"monitor QEMU retry run after workflow fan-out","timestamp":1777115419044,"segment":280,"confidence":null,"iterationTokens":1080,"asi":{"hypothesis":"After workflow fan-out, QEMU retry run should remain failure-free while macOS Intel split jobs start.","result":"No failed checks observed; 38 checks pending."}}
{"run":581,"commit":"9b88390","metric":0,"metrics":{"pending_checks":30,"split_macos_intel_over15_jobs":0,"split_macos_intel_completed_jobs":1,"split_macos_intel_max_seconds":560},"status":"keep","description":"monitor QEMU retry run with first split job completed","timestamp":1777115788501,"segment":280,"confidence":null,"iterationTokens":1281,"asi":{"hypothesis":"Continue monitoring QEMU retry run; first completed macOS Intel split jobs should be under 15m after final sharding/scope split.","result":"No failed checks observed; 30 checks pending. One macOS Intel split job completed under 15m at 560s."}}
{"run":582,"commit":"c78463a","metric":0,"metrics":{"pending_checks":26,"split_macos_intel_over15_jobs":0,"split_macos_intel_completed_jobs":4,"split_macos_intel_max_seconds":720},"status":"keep","description":"monitor QEMU retry run with four split jobs completed","timestamp":1777116106132,"segment":280,"confidence":null,"iterationTokens":1338,"asi":{"hypothesis":"Continue monitoring; completed macOS Intel split jobs should stay under 15m with final refinements.","result":"No failed checks observed; 26 checks pending. Four macOS Intel split jobs completed under 15m; max completed split job is 720s."}}
{"run":583,"commit":"dd19419","metric":0,"metrics":{"pending_checks":25,"split_macos_intel_over15_jobs":0,"split_macos_intel_completed_jobs":4,"split_macos_intel_max_seconds":720},"status":"keep","description":"monitor QEMU retry run with 25 checks pending","timestamp":1777116422322,"segment":280,"confidence":null,"iterationTokens":1336,"asi":{"hypothesis":"Continue monitoring final refined run; no failures and no over-15 completed split jobs should appear.","result":"No failed checks observed; 25 checks pending. Four macOS Intel split jobs completed under 15m, max 720s."}}
{"run":584,"commit":"17a99aa","metric":0,"metrics":{"pending_checks":20,"split_macos_intel_over15_jobs":0,"split_macos_intel_completed_jobs":8,"split_macos_intel_max_seconds":848},"status":"keep","description":"monitor QEMU retry run with eight split jobs completed","timestamp":1777116738082,"segment":280,"confidence":null,"iterationTokens":1349,"asi":{"hypothesis":"Continue monitoring refined run; final refinements should keep completed split jobs below 15m.","result":"No failed checks observed; 20 checks pending. Eight macOS Intel split jobs completed under 15m, max 848s."}}
{"run":585,"commit":"8bb6321","metric":0,"metrics":{"pending_checks":20,"split_macos_intel_over15_jobs":0,"split_macos_intel_completed_jobs":8,"split_macos_intel_max_seconds":848},"status":"keep","description":"monitor QEMU retry run still waiting on macOS jobs","timestamp":1777117055993,"segment":280,"confidence":null,"iterationTokens":1365,"asi":{"hypothesis":"Continue monitoring; pending macOS jobs may be queued/running, with no new completions during this interval.","result":"No failed checks observed; 20 checks pending. Eight macOS Intel split jobs completed under 15m, max 848s."}}
{"run":586,"commit":"6b146c6","metric":0,"metrics":{"pending_checks":16,"split_macos_intel_over15_jobs":0,"split_macos_intel_completed_jobs":11,"split_macos_intel_max_seconds":848},"status":"keep","description":"monitor QEMU retry run with eleven split jobs completed","timestamp":1777117374019,"segment":280,"confidence":null,"iterationTokens":1382,"asi":{"hypothesis":"Continue monitoring final refined run; more macOS Intel split jobs should complete under target.","result":"No failed checks observed; 16 checks pending. Eleven macOS Intel split jobs completed under 15m, max 848s."}}
{"run":587,"commit":"cf91596","metric":0,"metrics":{"pending_checks":13,"split_macos_intel_over15_jobs":0,"split_macos_intel_completed_jobs":13,"split_macos_intel_max_seconds":848},"status":"keep","description":"monitor QEMU retry run with thirteen split jobs completed","timestamp":1777117691462,"segment":280,"confidence":null,"iterationTokens":1373,"asi":{"hypothesis":"Continue monitoring final refined run; completed macOS Intel split jobs should remain below 15m.","result":"No failed checks observed; 13 checks pending. Thirteen macOS Intel split jobs completed under 15m, max 848s."}}
{"run":588,"commit":"ba04971","metric":0,"metrics":{"pending_checks":10,"split_macos_intel_over15_jobs":0,"split_macos_intel_completed_jobs":14,"split_macos_intel_max_seconds":848},"status":"keep","description":"monitor QEMU retry run with fourteen split jobs completed","timestamp":1777118009714,"segment":280,"confidence":null,"iterationTokens":1376,"asi":{"hypothesis":"Continue monitoring final refined run; no failures and no over-15 completed split jobs should appear.","result":"No failed checks observed; 10 checks pending. Fourteen macOS Intel split jobs completed under 15m, max 848s."}}
{"run":589,"commit":"a6e9a1c","metric":0,"metrics":{"pending_checks":7,"split_macos_intel_over15_jobs":0,"split_macos_intel_completed_jobs":16,"split_macos_intel_max_seconds":848},"status":"keep","description":"monitor QEMU retry run with sixteen split jobs completed","timestamp":1777119508863,"segment":280,"confidence":null,"iterationTokens":1377,"asi":{"hypothesis":"Finish the current monitoring cycle before answering user status question; completed macOS Intel split jobs should remain under 15m.","result":"No failed checks observed; 7 checks pending. Sixteen macOS Intel split jobs completed under 15m, max 848s."}}
{"run":590,"commit":"5daefcd","metric":0,"metrics":{"pending_checks":0,"split_macos_intel_over15_jobs":0,"split_macos_intel_completed_jobs":20,"split_macos_intel_max_seconds":848},"status":"keep","description":"monitor QEMU retry run completed with all split jobs under 15m","timestamp":1777119602817,"segment":280,"confidence":null,"iterationTokens":1377,"asi":{"hypothesis":"After final sharding/scope split and increased QEMU retry budget, the full PR run should finish failure-free with all macOS Intel split jobs under 15 minutes.","result":"Full PR run completed with zero failures and zero pending checks. Twenty macOS Intel split jobs completed; none exceeded 15m, max 848s (~14m08s)."}}
{"type":"config","name":"Split remaining macOS Go coverage/emulator >20m job","metricName":"macos_go_combined_jobs_over20","metricUnit":"","bestDirection":"lower"}
