{"run":982,"commit":"523aca8","metric":740,"metrics":{"package_paths_bytes_op":672,"package_paths_allocs_op":7,"runs":9},"status":"discard","description":"hoist cache root filepath.Clean out of packageDir","timestamp":1777220831025,"segment":480,"confidence":null,"iterationTokens":1862,"asi":{"hypothesis":"Cleaning the cache root once in newCacheManager should avoid repeated filepath.Clean work inside cacheManager.packageDir/PackagePaths.","result":"internal/build tests passed, but BenchmarkPackagePathsSafe regressed/noised from 728 ns/op to 740 ns/op with unchanged allocations.","rollback_reason":"No clear improvement; filepath.Join/clean of the full generated path dominates and the source change is not justified.","next_action_hint":"Do not revisit cache root clean hoisting unless a larger PackagePaths profile shows root cleaning as significant."}}
{"type":"config","name":"Record rejected cache root clean hoist","metricName":"validation_failures","metricUnit":"","bestDirection":"lower"}
{"run":983,"commit":"fb34ceb","metric":0,"metrics":{"ideas_updated":1},"status":"keep","description":"record rejected cache root clean hoist","timestamp":1777220854620,"segment":481,"confidence":null,"iterationTokens":173,"asi":{"hypothesis":"Record the rejected cache root clean hoist so future loops avoid repeating a PackagePaths micro-optimization that did not improve wall time.","result":"Ideas backlog now records the 728ns/op to 740ns/op PackagePaths result and unchanged allocations."}}
{"type":"config","name":"Monitor PR while readManifest CI run progresses","metricName":"pr_check_failures","metricUnit":"","bestDirection":"lower"}
{"run":984,"commit":"5d2e816","metric":0,"metrics":{"pending_checks":42,"passed_checks":15,"skipped_checks":0,"llgo_in_pr_diff":0},"status":"keep","description":"monitor PR while readManifest CI progresses","timestamp":1777220903124,"segment":482,"confidence":null,"iterationTokens":448,"asi":{"hypothesis":"The PR run after readManifest optimization should continue without failures as Linux and embedded jobs complete, and root llgo should remain absent from the diff.","result":"Current PR checks: 0 failures, 42 pending, 15 passed, 0 skipped; root llgo absent from PR diff.","next_action_hint":"Poll later for final status; do not infer runtime from partial CI."}}
{"type":"config","name":"Optimize pkgSFiles no-assembly directory check","metricName":"collect_package_ns_op","metricUnit":"","bestDirection":"lower"}
{"run":985,"commit":"0a2c30c","metric":31549,"metrics":{"collect_package_bytes_op":4048,"collect_package_allocs_op":25,"runs":9},"status":"keep","description":"baseline collectPackageInputs no assembly files","timestamp":1777220993281,"segment":483,"confidence":null,"iterationTokens":791,"asi":{"hypothesis":"pkgSFiles uses two filepath.Glob calls for directories with no .s/.S files; replacing that fast path with a single os.ReadDir scan may reduce collectPackageInputs overhead for the common no-assembly case.","result":"BenchmarkCollectPackageInputsNoAsmFiles median is 31549 ns/op, 4048 B/op, and 25 allocs/op across 9 runs."}}
{"run":986,"commit":"7e15cd1","metric":14089,"metrics":{"collect_package_bytes_op":1840,"collect_package_allocs_op":12,"runs":9},"status":"keep","description":"use single ReadDir scan for pkgSFiles no-asm fast path","timestamp":1777221062559,"segment":483,"confidence":null,"iterationTokens":2214,"asi":{"hypothesis":"A single os.ReadDir scan can replace two filepath.Glob calls in pkgSFiles' common no-.s/.S fast path, reducing collectPackageInputs filesystem overhead without changing when go list is used for directories containing assembly files.","result":"internal/build tests passed. BenchmarkCollectPackageInputsNoAsmFiles improved from 31549 ns/op, 4048 B/op, 25 allocs/op to 14089 ns/op, 1840 B/op, 12 allocs/op across 9 runs.","next_action_hint":"Add focused tests for dirHasAsmFile no asm, .s, .S, and unreadable/error fallback if possible; then run broader validation and temp cmd/llgo build."}}
{"type":"config","name":"Validate pkgSFiles no-asm ReadDir optimization","metricName":"validation_failures","metricUnit":"","bestDirection":"lower"}
{"run":987,"commit":"e84210b","metric":0,"metrics":{"packages_tested":5,"temp_builds":1},"status":"keep","description":"validate pkgSFiles no-asm ReadDir optimization","timestamp":1777221132098,"segment":484,"confidence":null,"iterationTokens":234,"asi":{"hypothesis":"The pkgSFiles ReadDir fast path should preserve behavior for empty/no-asm dirs, lowercase .s, uppercase .S, and read-error fallback, while passing build/crosscompile tests and cmd/llgo build.","result":"Added TestDirHasAsmFile for empty/no asm, .s, .S, and missing-dir fallback. go test ./internal/build, go test ./internal/crosscompile/..., and temp-path go build -tags=dev ./cmd/llgo passed; root llgo was not created."}}
{"type":"config","name":"Record kept pkgSFiles ReadDir optimization","metricName":"validation_failures","metricUnit":"","bestDirection":"lower"}
{"run":988,"commit":"facd63e","metric":0,"metrics":{"ideas_updated":1},"status":"keep","description":"record kept pkgSFiles ReadDir optimization","timestamp":1777221158236,"segment":485,"confidence":null,"iterationTokens":181,"asi":{"hypothesis":"Record the kept pkgSFiles no-assembly fast-path optimization and its benchmark so future loops focus on other fingerprint/package-input costs.","result":"Ideas backlog now records the 31549ns/op to 14089ns/op collectPackageInputs improvement and test coverage for dirHasAsmFile behavior."}}
{"type":"config","name":"Monitor PR after pushing pkgSFiles ReadDir optimization","metricName":"pr_check_failures","metricUnit":"","bestDirection":"lower"}
{"run":989,"commit":"b602bde","metric":0,"metrics":{"pending_checks":13,"passed_checks":2,"skipped_checks":0,"llgo_in_pr_diff":0},"status":"keep","description":"monitor PR after pushing pkgSFiles ReadDir optimization","timestamp":1777221202188,"segment":486,"confidence":null,"iterationTokens":454,"asi":{"hypothesis":"After pushing the pkgSFiles ReadDir optimization, the PR run should start without immediate failures and root llgo should remain absent from the diff.","result":"New PR run has 0 failures, 2 passed, 13 pending, and root llgo absent from PR diff."}}
{"type":"config","name":"Cache negative pkgSFiles no-assembly results","metricName":"pkg_sfiles_pair_ns_op","metricUnit":"","bestDirection":"lower"}
{"run":990,"commit":"55d7b78","metric":23459,"metrics":{"pkg_sfiles_pair_bytes_op":2912,"pkg_sfiles_pair_allocs_op":18,"runs":9},"status":"keep","description":"baseline repeated pkgSFiles no-asm lookup","timestamp":1777221257932,"segment":487,"confidence":null,"iterationTokens":754,"asi":{"hypothesis":"After replacing Glob with ReadDir, packages without assembly still pay the no-asm directory scan on both collectFingerprint and compilePkgSFiles for cache misses because negative results are not cached; benchmark two lookups on the same package.","result":"BenchmarkPkgSFilesNoAsmTwice median is 23459 ns/op, 2912 B/op, and 18 allocs/op across 9 runs."}}
{"run":991,"commit":"39d99ba","metric":12378,"metrics":{"pkg_sfiles_pair_bytes_op":1856,"pkg_sfiles_pair_allocs_op":11,"runs":9},"status":"keep","description":"cache negative pkgSFiles no-asm results","timestamp":1777221318084,"segment":487,"confidence":null,"iterationTokens":1856,"asi":{"hypothesis":"Caching nil pkgSFiles results for directories without .s/.S files should avoid repeating the ReadDir fast-path scan when collectFingerprint and compilePkgSFiles both query the same cache-miss package.","result":"internal/build tests passed. BenchmarkPkgSFilesNoAsmTwice improved from 23459 ns/op, 2912 B/op, 18 allocs/op to 12378 ns/op, 1856 B/op, 11 allocs/op across 9 runs.","next_action_hint":"Check single collectPackageInputs/no-asm behavior to ensure allocating the cache map earlier does not regress one-shot cache-hit paths too much."}}
{"type":"config","name":"Check single collectPackageInputs after negative pkgSFiles cache","metricName":"collect_package_ns_op","metricUnit":"","bestDirection":"lower"}
{"run":992,"commit":"4741f98","metric":13517,"metrics":{"collect_package_bytes_op":2240,"collect_package_allocs_op":14,"runs":9},"status":"keep","description":"check single collectPackageInputs after negative pkgSFiles cache","timestamp":1777221369336,"segment":488,"confidence":null,"iterationTokens":802,"asi":{"hypothesis":"Caching nil pkgSFiles results should not materially regress one-shot collectPackageInputs/no-assembly behavior despite allocating the sfiles cache map earlier.","result":"BenchmarkCollectPackageInputsNoAsmFiles with the cache reset each iteration was 13517 ns/op, 2240 B/op, and 14 allocs/op across 9 runs; still far faster than the original Glob baseline (31549 ns/op) and in the same band as the ReadDir-only result (14089 ns/op).","next_action_hint":"Proceed with validation and tests for negative cache behavior."}}
{"type":"config","name":"Validate negative pkgSFiles cache","metricName":"validation_failures","metricUnit":"","bestDirection":"lower"}
{"run":993,"commit":"777b5bb","metric":0,"metrics":{"packages_tested":5,"temp_builds":1},"status":"keep","description":"validate negative pkgSFiles cache","timestamp":1777221423359,"segment":489,"confidence":null,"iterationTokens":230,"asi":{"hypothesis":"Negative pkgSFiles results should be explicitly cached and remain covered by tests while build/crosscompile and cmd/llgo checks pass.","result":"Added TestPkgSFilesCachesNoAsmResult. go test ./internal/build, go test ./internal/crosscompile/..., and temp-path go build -tags=dev ./cmd/llgo passed; root llgo was not created."}}
{"type":"config","name":"Record kept negative pkgSFiles cache","metricName":"validation_failures","metricUnit":"","bestDirection":"lower"}
{"run":994,"commit":"ba5327e","metric":0,"metrics":{"ideas_updated":1},"status":"keep","description":"record kept negative pkgSFiles cache","timestamp":1777221451316,"segment":490,"confidence":null,"iterationTokens":184,"asi":{"hypothesis":"Record the kept negative pkgSFiles cache optimization so future loops account for the collectFingerprint+compilePkgSFiles two-lookup improvement.","result":"Ideas backlog now records the 23459ns/op to 12378ns/op two-lookup benchmark and cache-entry test."}}
{"type":"config","name":"Monitor PR after pushing negative pkgSFiles cache","metricName":"pr_check_failures","metricUnit":"","bestDirection":"lower"}
{"run":995,"commit":"1b180de","metric":0,"metrics":{"pending_checks":13,"passed_checks":1,"skipped_checks":0,"llgo_in_pr_diff":0},"status":"keep","description":"monitor PR after pushing negative pkgSFiles cache","timestamp":1777221501452,"segment":491,"confidence":null,"iterationTokens":453,"asi":{"hypothesis":"After pushing the negative pkgSFiles cache optimization, the PR run should start without immediate failures and root llgo should remain absent from the diff.","result":"New PR run has 0 failures, 1 passed, 13 pending, and root llgo absent from PR diff."}}
{"type":"config","name":"Avoid os.ReadDir sorting in dirHasAsmFile","metricName":"dir_has_asm_ns_op","metricUnit":"","bestDirection":"lower"}
{"run":996,"commit":"5e5257d","metric":18121,"metrics":{"dir_has_asm_bytes_op":4296,"dir_has_asm_allocs_op":60,"runs":9},"status":"keep","description":"baseline dirHasAsmFile using os.ReadDir","timestamp":1777221554338,"segment":492,"confidence":null,"iterationTokens":638,"asi":{"hypothesis":"dirHasAsmFile uses os.ReadDir, which sorts all entries even though the fast path only needs to know whether any .s/.S file exists; benchmark before switching to unsorted directory name reading.","result":"BenchmarkDirHasAsmFileNoAsm with 24 non-asm files is 18121 ns/op, 4296 B/op, and 60 allocs/op across 9 runs."}}
{"run":997,"commit":"f8650dd","metric":17687,"metrics":{"dir_has_asm_bytes_op":2760,"dir_has_asm_allocs_op":36,"runs":9},"status":"keep","description":"use unsorted Readdirnames in dirHasAsmFile","timestamp":1777221632533,"segment":492,"confidence":null,"iterationTokens":1534,"asi":{"hypothesis":"dirHasAsmFile only needs entry names and can avoid os.ReadDir's sorted DirEntry allocation by using File.Readdirnames, preserving the same .s/.S detection and error fallback.","result":"internal/build tests passed. BenchmarkDirHasAsmFileNoAsm with 24 non-asm files improved from 18121 ns/op, 4296 B/op, 60 allocs/op to 17687 ns/op, 2760 B/op, 36 allocs/op across 9 runs; wall-time gain is modest but allocation reduction is clear and sorting avoidance should help larger directories.","next_action_hint":"Run collectPackageInputs/no-asm validation and broad tests before deciding whether to push; discard if end-to-end package input collection regresses."}}
{"type":"config","name":"Check collectPackageInputs after Readdirnames dir scan","metricName":"collect_package_ns_op","metricUnit":"","bestDirection":"lower"}
{"run":998,"commit":"27aa61a","metric":13075,"metrics":{"collect_package_bytes_op":2176,"collect_package_allocs_op":13,"runs":9},"status":"keep","description":"check collectPackageInputs after Readdirnames dir scan","timestamp":1777221679188,"segment":493,"confidence":null,"iterationTokens":801,"asi":{"hypothesis":"Replacing os.ReadDir with Readdirnames in dirHasAsmFile should not regress the package input collection path that calls pkgSFiles for no-assembly packages.","result":"BenchmarkCollectPackageInputsNoAsmFiles with cache reset each iteration was 13075 ns/op, 2176 B/op, and 13 allocs/op across 9 runs, slightly better than the previous negative-cache check (13517 ns/op, 2240 B/op, 14 allocs/op) and much faster than the original Glob baseline."}}
{"type":"config","name":"Validate and record Readdirnames dir scan optimization","metricName":"validation_failures","metricUnit":"","bestDirection":"lower"}
{"run":999,"commit":"5e240b6","metric":0,"metrics":{"packages_tested":5,"temp_builds":1,"ideas_updated":1},"status":"keep","description":"validate and record Readdirnames dir scan optimization","timestamp":1777221740389,"segment":494,"confidence":null,"iterationTokens":290,"asi":{"hypothesis":"The Readdirnames dirHasAsmFile optimization should preserve covered .s/.S/error behavior, pass internal build/crosscompile tests and temp cmd/llgo build, and be recorded with both direct and collectPackageInputs benchmarks.","result":"go test ./internal/build, go test ./internal/crosscompile/..., and temp-path go build -tags=dev ./cmd/llgo passed; root llgo was not created; ideas backlog records the 18121ns/op to 17687ns/op direct scan improvement and collectPackageInputs check."}}
{"type":"config","name":"Monitor PR after pushing Readdirnames dir scan optimization","metricName":"pr_check_failures","metricUnit":"","bestDirection":"lower"}
{"run":1000,"commit":"8d268a9","metric":0,"metrics":{"pending_checks":45,"passed_checks":1,"skipped_checks":0,"llgo_in_pr_diff":0},"status":"keep","description":"monitor PR after pushing Readdirnames dir scan optimization","timestamp":1777221792817,"segment":495,"confidence":null,"iterationTokens":454,"asi":{"hypothesis":"After pushing the Readdirnames dir scan optimization, the PR run should start without immediate failures and root llgo should remain absent from the diff.","result":"New PR run has 0 failures, 1 passed, 45 pending, and root llgo absent from PR diff."}}
{"type":"config","name":"Skip overlay map lookup in digestFilesWithOverlay when empty","metricName":"digest_files_ns_op","metricUnit":"","bestDirection":"lower"}
{"run":1001,"commit":"c60dec5","metric":1159,"metrics":{"digest_files_bytes_op":384,"digest_files_allocs_op":3,"runs":9},"status":"keep","description":"baseline single-file digest with nil overlay","timestamp":1777221832171,"segment":496,"confidence":null,"iterationTokens":652,"asi":{"hypothesis":"digestFilesWithOverlay does a map lookup for every file even when the overlay map is nil/empty; skipping that branch may help common package input collection with no overlays.","result":"BenchmarkDigestFilesWithOverlaySingleNoOverlay median is 1159 ns/op, 384 B/op, and 3 allocs/op across 9 runs."}}
{"run":1002,"commit":"c60dec5","metric":1171,"metrics":{"digest_files_bytes_op":384,"digest_files_allocs_op":3,"runs":9},"status":"discard","description":"skip overlay map lookup when overlay is empty","timestamp":1777221888489,"segment":496,"confidence":null,"iterationTokens":2021,"asi":{"hypothesis":"Branching once on len(overlay)==0 should avoid per-file nil map lookups in the common no-overlay digestFilesWithOverlay path.","result":"internal/build tests passed, but BenchmarkDigestFilesWithOverlaySingleNoOverlay regressed/noised from 1159 ns/op to 1171 ns/op with unchanged allocations; the extra branch/code duplication did not help.","rollback_reason":"Primary benchmark worsened and the source duplication is not justified.","next_action_hint":"Do not revisit overlay nil fast-path unless profiles show map lookup overhead with larger file lists."}}
{"type":"config","name":"Record rejected digestFiles overlay fast path","metricName":"validation_failures","metricUnit":"","bestDirection":"lower"}
{"run":1003,"commit":"74c2cbb","metric":0,"metrics":{"ideas_updated":1},"status":"keep","description":"record rejected digestFiles overlay fast path","timestamp":1777221915651,"segment":497,"confidence":null,"iterationTokens":176,"asi":{"hypothesis":"Record the rejected len(overlay)==0 digestFilesWithOverlay branch so future loops do not repeat a no-allocation, slower fast path.","result":"Ideas backlog now records the 1159ns/op to 1171ns/op no-overlay digest benchmark regression."}}
{"type":"config","name":"Monitor PR while Readdirnames CI run progresses","metricName":"pr_check_failures","metricUnit":"","bestDirection":"lower"}
{"run":1004,"commit":"61b5a16","metric":0,"metrics":{"pending_checks":44,"passed_checks":13,"skipped_checks":0,"llgo_in_pr_diff":0},"status":"keep","description":"monitor PR while Readdirnames CI progresses","timestamp":1777221942100,"segment":498,"confidence":null,"iterationTokens":449,"asi":{"hypothesis":"The PR run after Readdirnames optimization should continue without failures as jobs complete, and root llgo should remain absent from the diff.","result":"Current PR checks: 0 failures, 44 pending, 13 passed, 0 skipped; root llgo absent from PR diff.","next_action_hint":"Poll later for final status; do not use partial CI as a performance benchmark."}}
{"run":1005,"commit":"bcdc97a","metric":0,"metrics":{"pending_checks":40,"passed_checks":17,"skipped_checks":0,"llgo_in_pr_diff":0},"status":"keep","description":"monitor PR after three minutes of Readdirnames CI","timestamp":1777222177756,"segment":498,"confidence":null,"iterationTokens":2296,"asi":{"hypothesis":"The Readdirnames PR run should continue progressing without failures, and root llgo should remain absent from the diff.","result":"After three minutes: 0 failures, 40 pending, 17 passed, 0 skipped; root llgo absent from PR diff.","next_action_hint":"Continue polling later; most long macOS/embedded jobs are still pending."}}
{"type":"config","name":"Avoid strings.HasSuffix in dirHasAsmFile","metricName":"dir_has_asm_ns_op","metricUnit":"","bestDirection":"lower"}
{"run":1006,"commit":"d9ddea8","metric":17265,"metrics":{"dir_has_asm_bytes_op":2760,"dir_has_asm_allocs_op":36,"runs":9},"status":"keep","description":"baseline dirHasAsmFile suffix checks","timestamp":1777222273275,"segment":499,"confidence":null,"iterationTokens":637,"asi":{"hypothesis":"dirHasAsmFile scans file names and currently calls strings.HasSuffix twice per entry; establish a fresh baseline before trying a manual two-byte suffix check.","result":"BenchmarkDirHasAsmFileNoAsm median is 17265 ns/op, 2760 B/op, and 36 allocs/op across 9 runs."}}
{"run":1007,"commit":"d9ddea8","metric":17698,"metrics":{"dir_has_asm_bytes_op":2760,"dir_has_asm_allocs_op":36,"runs":9},"status":"discard","description":"manual suffix check in dirHasAsmFile","timestamp":1777222341619,"segment":499,"confidence":null,"iterationTokens":1889,"asi":{"hypothesis":"Replacing two strings.HasSuffix calls with an inline two-byte suffix check should reduce per-entry name scan overhead in dirHasAsmFile.","result":"internal/build tests passed, but BenchmarkDirHasAsmFileNoAsm regressed/noised from 17265 ns/op to 17698 ns/op with unchanged allocations.","rollback_reason":"No clear improvement; strings.HasSuffix is already cheap and clearer.","next_action_hint":"Keep strings.HasSuffix in dirHasAsmFile; focus on higher-level file scanning/package-input costs."}}
{"type":"config","name":"Record rejected dirHasAsmFile manual suffix check","metricName":"validation_failures","metricUnit":"","bestDirection":"lower"}
{"run":1008,"commit":"2b21f0e","metric":0,"metrics":{"ideas_updated":1},"status":"keep","description":"record rejected dirHasAsmFile manual suffix check","timestamp":1777222367556,"segment":500,"confidence":null,"iterationTokens":178,"asi":{"hypothesis":"Record the rejected manual suffix check so future loops do not repeat a clarity-reducing dirHasAsmFile micro-optimization.","result":"Ideas backlog now records the 17265ns/op to 17698ns/op regression with unchanged allocations."}}
{"type":"config","name":"Monitor PR after Readdirnames source run during continued loop","metricName":"pr_check_failures","metricUnit":"","bestDirection":"lower"}
