{"run":310,"commit":"f5ceb8a","metric":0,"metrics":{"workflow_files_checked":8,"action_files_checked":5,"shell_scripts_checked":3},"status":"keep","description":"validate scripts and YAML before buildcache iwasm push","timestamp":1777058447174,"segment":178,"confidence":null,"iterationTokens":206,"asi":{"hypothesis":"Parse workflow/action YAML and run bash -n over modified buildcache/sysroot/iwasm scripts before pushing buildcache iwasm fallback changes.","result":"YAML parse and shell syntax checks passed."}}
{"run":311,"commit":"f05b840","metric":0,"metrics":{"workflow_files_checked":0,"action_files_checked":0,"shell_scripts_checked":0,"pending_checks":9},"status":"keep","description":"incidental PR check monitor during script validation segment","timestamp":1777058651369,"segment":178,"confidence":null,"iterationTokens":595,"asi":{"hypothesis":"Monitor pushed CI while local buildcache script changes are validated; this run occurred under the current script/YAML validation segment and is logged accordingly.","result":"No failed PR checks observed; 9 checks still pending in summary."}}
{"type":"config","name":"Monitor PR checks after buildcache iwasm push","metricName":"pr_check_failures","metricUnit":"","bestDirection":"lower"}
{"run":312,"commit":"a29bed8","metric":0,"metrics":{"pending_checks":9},"status":"keep","description":"monitor PR checks immediately after buildcache iwasm push","timestamp":1777058716085,"segment":179,"confidence":null,"iterationTokens":173,"asi":{"hypothesis":"Immediately check CI after pushing buildcache PATH iwasm fallback and related script/workflow changes.","result":"No failed checks observed; 9 checks pending immediately after push."}}
{"run":313,"commit":"49d5289","metric":0,"metrics":{"pending_checks":9,"build_cache_checks_passed":2},"status":"keep","description":"monitor PR checks and build-cache after iwasm fallback push","timestamp":1777058920033,"segment":179,"confidence":null,"iterationTokens":804,"asi":{"hypothesis":"Wait a few minutes after pushing PATH iwasm fallback to verify the build-cache workflow still passes and check for early failures.","result":"No failed checks observed; both build-cache checks passed."}}
{"type":"config","name":"Monitor PR checks while exploring further optimizations","metricName":"pr_check_failures","metricUnit":"","bestDirection":"lower"}
{"run":314,"commit":"76ff910","metric":0,"metrics":{"pending_checks":1},"status":"keep","description":"monitor PR checks while exploring further optimizations","timestamp":1777059012000,"segment":180,"confidence":null,"iterationTokens":173,"asi":{"hypothesis":"Check for failures as the latest pushed CI nears completion before continuing further optimization.","result":"No failed checks observed; 1 check remains pending."}}
{"run":315,"commit":"08ec6bb","metric":0,"metrics":{"pending_checks":9},"status":"keep","description":"monitor PR checks after additional wait","timestamp":1777059157279,"segment":180,"confidence":null,"iterationTokens":381,"asi":{"hypothesis":"Wait longer for PR checks to finish or reveal failures while preserving optimization context.","result":"No failed checks observed; long-running llgo/test checks remain pending."}}
{"type":"config","name":"Record deferred build-cache iwasm cache idea","metricName":"ideas_backlog_updates","metricUnit":"","bestDirection":"higher"}
{"run":316,"commit":"0c56716","metric":1,"metrics":{"ideas_file_entries":3},"status":"keep","description":"record deferred build-cache iwasm cache idea","timestamp":1777059226958,"segment":181,"confidence":null,"iterationTokens":121,"asi":{"hypothesis":"Caching the build-cache iwasm binary may be a larger, promising CI optimization but needs careful workflow design; record it for future exploration rather than implementing hastily.","result":"Added one iwasm cache idea to autoresearch.ideas.md."}}
{"type":"config","name":"Monitor PR checks after ideas update","metricName":"pr_check_failures","metricUnit":"","bestDirection":"lower"}
{"run":317,"commit":"7f81e28","metric":0,"metrics":{"pending_checks":9},"status":"keep","description":"monitor PR checks after ideas update","timestamp":1777059274138,"segment":182,"confidence":null,"iterationTokens":196,"asi":{"hypothesis":"Keep monitoring PR CI while ideas backlog updates and local commits accumulate.","result":"No failed checks observed; 9 checks still pending in summary."}}
{"run":318,"commit":"0a52391","metric":0,"metrics":{"pending_checks":9},"status":"keep","description":"monitor PR checks after further wait","timestamp":1777059501543,"segment":182,"confidence":null,"iterationTokens":1701,"asi":{"hypothesis":"Continue monitoring the latest pushed run for failures while long macOS/test jobs finish.","result":"No failed checks observed; 9 checks remain pending in summary."}}
{"run":319,"commit":"3355fbb","metric":0,"metrics":{"pending_checks":9},"status":"keep","description":"monitor PR checks while no local code changes pending","timestamp":1777059745423,"segment":182,"confidence":null,"iterationTokens":2433,"asi":{"hypothesis":"Continue monitoring the latest pushed CI while no local code changes are pending, to catch failures from recent workflow/script changes.","result":"No failed checks observed; 9 long-running checks remain pending in summary."}}
{"type":"config","name":"Quiet cargs demo library unzip","metricName":"verbose_unzip_cargs_sites","metricUnit":"","bestDirection":"lower"}
{"run":320,"commit":"ba5269e","metric":1,"metrics":{"llgo_workflows":1},"status":"keep","description":"baseline cargs demo library unzip is verbose","timestamp":1777059778568,"segment":183,"confidence":null,"iterationTokens":145,"asi":{"hypothesis":"The llgo workflow unzips the cargs demo library archive with default verbose output. Using unzip -q preserves extracted files while reducing log output."}}
{"type":"config","name":"Restore full package build coverage for go install sites","metricName":"coverage_sensitive_cmd_llgo_installs","metricUnit":"","bestDirection":"lower"}
{"run":321,"commit":"d0dcc51","metric":5,"metrics":{"workflow_files":2},"status":"keep","description":"baseline coverage-sensitive install sites narrowed to cmd/llgo","timestamp":1777069116508,"segment":184,"confidence":null,"iterationTokens":178,"asi":{"hypothesis":"Some go install ./... sites intentionally provide host package build coverage across CI matrices; changing them to ./cmd/llgo may reduce coverage. Count the narrowed sites before restoring them with comments."}}
{"run":322,"commit":"e93a0d9","metric":0,"metrics":{"restored_install_comments":5,"workflow_files":2},"status":"keep","description":"restore coverage-sensitive go install ./... sites with comments","timestamp":1777069187314,"segment":184,"confidence":null,"iterationTokens":4137,"asi":{"hypothesis":"Restore coverage-sensitive go install ./... uses in llgo/targets workflows and add explicit comments so future optimization passes do not narrow them to ./cmd/llgo without coverage analysis.","result":"YAML parses; coverage-sensitive ./cmd/llgo count dropped from 5 to 0 and five explanatory comments were added."}}
{"type":"config","name":"Record CI duration prioritization ideas","metricName":"ci_duration_ideas_recorded","metricUnit":"","bestDirection":"higher"}
{"run":323,"commit":"5c56145","metric":5,"metrics":{"macos_duration_idea_mentions":4},"status":"keep","description":"record CI duration prioritization ideas","timestamp":1777069284361,"segment":185,"confidence":null,"iterationTokens":112,"asi":{"hypothesis":"Future optimization should focus on high-duration macOS runner-minute bottlenecks rather than many low-impact micro-optimizations. Record the latest PR run's largest jobs and step-level bottlenecks in the ideas backlog.","result":"Added CI duration focus and four macOS-specific follow-up ideas to autoresearch.ideas.md."}}
{"type":"config","name":"Analyze macOS llgo test shard durations","metricName":"macos_shard_spread_seconds","metricUnit":"s","bestDirection":"lower"}
{"run":324,"commit":"0ffed6a","metric":154,"metrics":{"macos_shard_max_seconds":778},"status":"keep","description":"baseline macOS llgo test shard wall-time spread","timestamp":1777069373129,"segment":186,"confidence":null,"iterationTokens":351,"asi":{"hypothesis":"MacOS llgo test shards are high runner-minute consumers; quantify current wall-time imbalance before considering coverage-preserving shard rebalancing.","result":"Latest PR run macOS llgo test shards ranged from 10m24s to 12m58s, spread 154s."}}
{"type":"config","name":"Weighted shard assignment for macOS llgo test packages","metricName":"predicted_shard_spread_seconds","metricUnit":"s","bestDirection":"lower"}
{"run":325,"commit":"5ce6377","metric":130,"metrics":{"predicted_shard_max_seconds":629},"status":"keep","description":"baseline modulo sharding historical package spread","timestamp":1777069478232,"segment":187,"confidence":null,"iterationTokens":287,"asi":{"hypothesis":"The current alphabetical modulo sharding preserves coverage but may leave macOS llgo test wall time imbalanced. Use package timings from the latest CI logs as a historical baseline for a coverage-preserving rebalancing experiment.","result":"Historical per-package totals under current modulo assignment were [617,629,583,499], spread 130s."}}
{"run":326,"commit":"4a0ef19","metric":48,"metrics":{"predicted_shard_max_seconds":606},"status":"keep","description":"weighted llgo test shard assignment for slow macOS packages","timestamp":1777069569041,"segment":187,"confidence":null,"iterationTokens":3565,"asi":{"hypothesis":"Replace alphabetical modulo with deterministic weighted sharding for the known slow LLGo test packages. This keeps the go list ./test/... package set identical while reducing macOS shard wall-time imbalance and max shard time.","result":"YAML parses; local coverage check confirms every go list package is assigned exactly once. Historical CI package timings predict spread improvement from 130s to 48s and max shard from 629s to 606s."}}
{"type":"config","name":"Validate workflow syntax after weighted sharding","metricName":"workflow_validation_failures","metricUnit":"","bestDirection":"lower"}
{"run":327,"commit":"224a006","metric":0,"metrics":{"workflow_files_checked":8,"action_files_checked":5,"shell_steps_checked":1},"status":"keep","description":"validate workflow YAML and weighted shard shell syntax","timestamp":1777069585187,"segment":188,"confidence":null,"iterationTokens":277,"asi":{"hypothesis":"After adding weighted sharding logic to llgo.yml, validate all workflow/action YAML and bash syntax for the modified run step before pushing.","result":"All workflow/action YAML parsed and the extracted llgo test run step passed bash -n."}}
{"type":"config","name":"Monitor PR checks before weighted-shard push","metricName":"pr_check_failures","metricUnit":"","bestDirection":"lower"}
{"run":328,"commit":"1a22033","metric":0,"metrics":{"pending_checks":0},"status":"keep","description":"monitor PR checks before weighted-shard push","timestamp":1777069603923,"segment":189,"confidence":null,"iterationTokens":243,"asi":{"hypothesis":"Before pushing restored go install coverage and weighted sharding, confirm the currently pushed PR run is clean.","result":"No failed or pending checks observed on current PR run."}}
{"type":"config","name":"Monitor PR checks after weighted-shard push","metricName":"pr_check_failures","metricUnit":"","bestDirection":"lower"}
{"run":329,"commit":"5a74a88","metric":0,"metrics":{"pending_checks":32},"status":"keep","description":"monitor PR checks immediately after weighted-shard push","timestamp":1777069661284,"segment":190,"confidence":null,"iterationTokens":243,"asi":{"hypothesis":"Immediately check PR CI after pushing restored install coverage and weighted llgo test sharding.","result":"No failed checks observed; 32 checks pending immediately after push."}}
{"run":330,"commit":"ad4e563","metric":0,"metrics":{"pending_checks":21},"status":"keep","description":"monitor PR checks after weighted-shard push has run briefly","timestamp":1777069918463,"segment":190,"confidence":null,"iterationTokens":19114,"asi":{"hypothesis":"Wait a few minutes after pushing weighted sharding to catch syntax or early workflow failures.","result":"No failed checks observed; pending checks dropped from 32 to 21."}}
{"type":"config","name":"Prune tried macOS shard idea","metricName":"stale_ideas_pruned","metricUnit":"","bestDirection":"higher"}
{"run":331,"commit":"29ccda1","metric":1,"metrics":{"ideas_entries":8},"status":"keep","description":"prune tried macOS shard rebalancing idea","timestamp":1777069960320,"segment":191,"confidence":null,"iterationTokens":118,"asi":{"hypothesis":"The macOS llgo shard rebalancing idea has now been implemented, so replace the stale exploration note with a monitoring/follow-up note.","result":"Updated autoresearch.ideas.md to monitor the weighted shard assignment instead of suggesting the already-tried modulo rebalancing."}}
{"type":"config","name":"Monitor weighted-shard PR checks for failures","metricName":"pr_check_failures","metricUnit":"","bestDirection":"lower"}
{"run":332,"commit":"6b714ef","metric":0,"metrics":{"pending_checks":16},"status":"keep","description":"monitor weighted-shard PR checks after more runtime","timestamp":1777070165933,"segment":192,"confidence":null,"iterationTokens":248,"asi":{"hypothesis":"Continue monitoring the weighted-shard push for failures as the macOS/Ubuntu test jobs progress.","result":"No failed checks observed; pending checks dropped to 16."}}
{"type":"config","name":"Skip ineffective torch install on macOS demo jobs","metricName":"macos_uncovered_torch_install_sites","metricUnit":"","bestDirection":"lower"}
{"run":333,"commit":"943897b","metric":1,"metrics":{"macos_demo_jobs_with_torch_install":4},"status":"keep","description":"baseline torch installed on macOS demo jobs despite tensor skip","timestamp":1777070252365,"segment":193,"confidence":null,"iterationTokens":200,"asi":{"hypothesis":"CI logs show macOS demo jobs install torch but then skip ./_demo/py/tensor because python3 cannot import torch. Installing torch on macOS is therefore setup overhead without coverage; keep torch on Linux where tensor runs."}}
{"run":334,"commit":"3b1e027","metric":0,"metrics":{"macos_demo_jobs_with_torch_install":0},"status":"keep","description":"skip torch install on macOS demo jobs where tensor is skipped","timestamp":1777070267559,"segment":193,"confidence":null,"iterationTokens":854,"asi":{"hypothesis":"Conditionally installing torch only on Linux preserves ./_demo/py/tensor coverage where it currently runs, while avoiding ineffective torch setup on macOS jobs that skip the tensor demo.","result":"llgo.yml parses, the extracted dependency step passes bash -n, and macOS-uncovered torch install sites dropped from 1 to 0."}}
{"run":335,"commit":"a4872a0","metric":0,"metrics":{"macos_demo_jobs_with_torch_install":0,"pr_check_failures":0,"pending_checks":11},"status":"keep","description":"monitor pushed CI while local torch change waits","timestamp":1777070473166,"segment":193,"confidence":null,"iterationTokens":558,"asi":{"hypothesis":"Monitor the already-pushed weighted-shard CI for failures before pushing the local macOS torch-install optimization.","result":"No failed checks observed; 11 checks remain pending."}}
{"type":"config","name":"Measure weighted macOS shard CI result","metricName":"macos_shard_max_seconds","metricUnit":"s","bestDirection":"lower"}
{"run":336,"commit":"ac5d47d","metric":779,"metrics":{"macos_shard_spread_seconds":249,"pr_check_failures":0,"pending_checks":8,"macos_shards_completed":3},"status":"keep","description":"measure partial weighted macOS shard CI result","timestamp":1777070760816,"segment":194,"confidence":null,"iterationTokens":447,"asi":{"hypothesis":"Measure the pushed weighted shard assignment on live CI to see whether macOS shard max time improves in practice.","result":"Three of four macOS shards completed: 8m50s, 9m50s, 12m59s; one still pending. No failures observed. Current partial max is not improved yet, so wait for full data before changing weights again.","next_action_hint":"When all four shards finish, compare full max/spread against prior 12m58s/154s wall-clock baseline before deciding whether to keep or adjust weights."}}
{"run":337,"commit":"ac5d47d","metric":779,"metrics":{"macos_shard_spread_seconds":269,"pr_check_failures":0,"pending_checks":5,"macos_shards_completed":4},"status":"discard","description":"full weighted macOS shard result did not improve max time","timestamp":1777070962081,"segment":194,"confidence":null,"iterationTokens":1227,"asi":{"hypothesis":"The pushed weighted shard assignment should reduce live macOS max shard time and spread.","result":"All four macOS shards passed, but live max was 12m59s versus prior 12m58s and spread worsened to 269s because shard 3 remained much slower.","rollback_reason":"Primary max shard time did not improve in live CI; need adjust or revert weighted assignment rather than treating predicted historical balance as sufficient.","next_action_hint":"Fetch new shard logs, inspect actual per-package durations/assignments, then either adjust weights to reduce shard 3 or revert to modulo if no robust improvement is possible."}}
{"type":"config","name":"Revert non-improving weighted shard assignment","metricName":"weighted_sharding_sites","metricUnit":"","bestDirection":"lower"}
{"run":338,"commit":"7a8e01d","metric":1,"metrics":{"weighted_shard_configs":1},"status":"keep","description":"baseline weighted sharding still present after live CI miss","timestamp":1777071016536,"segment":195,"confidence":null,"iterationTokens":154,"asi":{"hypothesis":"Since live CI did not improve max macOS shard time, count the weighted sharding config before reverting to simpler modulo assignment."}}
{"run":339,"commit":"71e1630","metric":0,"metrics":{"weighted_shard_configs":0},"status":"keep","description":"revert weighted sharding after live CI showed no max-time win","timestamp":1777071038199,"segment":195,"confidence":null,"iterationTokens":1335,"asi":{"hypothesis":"Reverting the non-improving weighted shard assignment restores simpler deterministic modulo sharding and avoids maintaining hard-coded weights that did not reduce live max macOS shard time.","result":"llgo.yml parses, extracted run step passes bash -n, and weighted sharding sites dropped from 1 to 0."}}
{"type":"config","name":"Record weighted sharding dead end","metricName":"dead_end_notes_recorded","metricUnit":"","bestDirection":"higher"}
{"run":340,"commit":"5a44540","metric":1,"metrics":{"ideas_entries":8},"status":"keep","description":"record weighted sharding dead end in ideas backlog","timestamp":1777071058417,"segment":196,"confidence":null,"iterationTokens":124,"asi":{"hypothesis":"Preserve the lesson from the failed weighted-sharding experiment so future loops do not repeat hard-coded weights from a single CI run.","result":"Updated autoresearch.ideas.md with weighted sharding dead-end note."}}
{"type":"config","name":"Validate workflows before torch-only push","metricName":"workflow_validation_failures","metricUnit":"","bestDirection":"lower"}
{"run":341,"commit":"268fb2d","metric":0,"metrics":{"workflow_files_checked":8,"action_files_checked":5,"shell_steps_checked":2},"status":"keep","description":"validate workflows before pushing macOS torch optimization","timestamp":1777071075516,"segment":197,"confidence":null,"iterationTokens":368,"asi":{"hypothesis":"Before pushing the macOS torch-install optimization and weighted-shard revert, validate all workflow/action YAML and modified shell snippets.","result":"All workflow/action YAML parsed and both extracted llgo.yml shell steps passed bash -n."}}
{"type":"config","name":"Monitor PR before torch optimization push","metricName":"pr_check_failures","metricUnit":"","bestDirection":"lower"}
{"run":342,"commit":"f46e591","metric":0,"metrics":{"pending_checks":5},"status":"keep","description":"monitor PR before pushing macOS torch optimization","timestamp":1777071094010,"segment":198,"confidence":null,"iterationTokens":241,"asi":{"hypothesis":"Confirm the currently pushed weighted-shard run has no failures before pushing the local torch optimization and weighted-shard revert.","result":"No failed checks observed; 5 long macOS checks still pending."}}
{"type":"config","name":"Monitor PR after torch optimization push","metricName":"pr_check_failures","metricUnit":"","bestDirection":"lower"}
{"run":343,"commit":"940a7bd","metric":0,"metrics":{"pending_checks":14},"status":"keep","description":"monitor PR immediately after macOS torch optimization push","timestamp":1777071137798,"segment":199,"confidence":null,"iterationTokens":241,"asi":{"hypothesis":"Immediately check CI after pushing macOS torch optimization and reverting non-improving weighted sharding.","result":"No failed checks observed; 14 checks pending immediately after push."}}
{"run":344,"commit":"7affe0d","metric":0,"metrics":{"pending_checks":23},"status":"keep","description":"monitor PR after macOS torch optimization has run briefly","timestamp":1777071338333,"segment":199,"confidence":null,"iterationTokens":1815,"asi":{"hypothesis":"Continue monitoring the torch optimization push for early failures, especially llgo demo jobs affected by conditional torch install.","result":"No failed checks observed; 23 checks pending in the new run."}}
{"type":"config","name":"Enable macOS Go cache in custom setup-go","metricName":"macos_setup_go_cache_steps","metricUnit":"","bestDirection":"higher"}
