{"run":126,"commit":"414f0c7","metric":1,"metrics":{"fake_demo_cases":84,"expected_failures":1},"status":"keep","description":"validate demo runner reports one fake failing case","timestamp":1777044939513,"segment":50,"confidence":null,"iterationTokens":258,"asi":{"hypothesis":"Use a fake llgo that fails only _demo/go/sync to validate the parallel demo runner still aggregates failures and exits non-zero without losing the failing label.","result":"Fake run reported 83/84 tests passed and listed exactly ./_demo/go/sync as failed."}}
{"type":"config","name":"Skip redundant setup-go in llgo main matrix for Go 1.24","metricName":"redundant_main_setup_go_jobs","metricUnit":"","bestDirection":"lower"}
{"run":127,"commit":"f27381c","metric":3,"metrics":{"llgo_main_os":3,"go_versions":2},"status":"keep","description":"baseline redundant setup-go testing step in llgo main Go 1.24 jobs","timestamp":1777045219485,"segment":51,"confidence":null,"iterationTokens":198,"asi":{"hypothesis":"The llgo main job builds llgo with Go 1.24.2, then always runs setup-go for matrix.go. For the Go 1.24.2 matrix entries across 3 OSes, this second setup-go is redundant and can be skipped without reducing coverage."}}
{"run":128,"commit":"2ce1f3b","metric":0,"metrics":{"llgo_main_os":3,"go_versions":2},"status":"keep","description":"skip setup-go testing step for llgo main Go 1.24 jobs","timestamp":1777045295344,"segment":51,"confidence":null,"iterationTokens":588,"asi":{"hypothesis":"Adding a condition to the llgo main job's second setup-go step skips it when matrix.go is already the build Go version (1.24.2), preserving the 1.21 coverage path while saving setup/cache work in 3 Go 1.24 jobs.","result":"redundant_main_setup_go_jobs dropped from 3 to 0 and workflow YAML parses."}}
{"type":"config","name":"Validate workflow YAML after setup-go condition","metricName":"workflow_yaml_failures","metricUnit":"","bestDirection":"lower"}
{"run":129,"commit":"54e3e42","metric":0,"metrics":{"workflow_files_checked":8},"status":"keep","description":"validate workflow YAML after setup-go condition","timestamp":1777045720081,"segment":52,"confidence":null,"iterationTokens":163,"asi":{"hypothesis":"Validate workflow YAML syntax after adding a conditional setup-go step in the llgo main workflow job."}}
{"type":"config","name":"Harden demo runner LLGO_DEMO_JOBS validation","metricName":"invalid_demo_jobs_hang_risk","metricUnit":"","bestDirection":"lower"}
{"run":130,"commit":"c233dcc","metric":1,"metrics":{"demo_runner_scripts":1},"status":"keep","description":"baseline demo runner lacks LLGO_DEMO_JOBS validation","timestamp":1777046177785,"segment":53,"confidence":null,"iterationTokens":156,"asi":{"hypothesis":"The opt-in parallel demo runner should sanitize LLGO_DEMO_JOBS because 0 or nonnumeric values can cause bad arithmetic or an infinite scheduling loop. Add validation to fall back to sequential mode."}}
{"run":131,"commit":"bf29e4f","metric":0,"metrics":{"demo_runner_scripts":1,"fake_demo_cases":84,"invalid_jobs_status":0},"status":"keep","description":"validate LLGO_DEMO_JOBS and fall back to sequential mode","timestamp":1777046237252,"segment":53,"confidence":null,"iterationTokens":691,"asi":{"hypothesis":"Validating LLGO_DEMO_JOBS prevents nonpositive or nonnumeric opt-in values from hanging or breaking the demo runner, while preserving default sequential CI behavior.","result":"bash -n passed; LLGO_DEMO_JOBS=0 fake demo run warned, fell back to sequential, and completed 84/84."}}
{"type":"config","name":"Validate demo runner nonnumeric LLGO_DEMO_JOBS fallback","metricName":"nonnumeric_demo_jobs_failures","metricUnit":"","bestDirection":"lower"}
{"run":132,"commit":"3a4509f","metric":0,"metrics":{"fake_demo_cases":84,"invalid_jobs_status":0},"status":"keep","description":"validate nonnumeric LLGO_DEMO_JOBS fallback in demo runner","timestamp":1777046273081,"segment":54,"confidence":null,"iterationTokens":240,"asi":{"hypothesis":"Confirm the new LLGO_DEMO_JOBS validator also handles nonnumeric values by falling back to sequential mode rather than tripping bash arithmetic.","result":"LLGO_DEMO_JOBS=abc fake demo run warned, ran sequentially, and completed 84/84."}}
{"type":"config","name":"Validate demo runner parallel opt-in still works","metricName":"parallel_fake_demo_failures","metricUnit":"","bestDirection":"lower"}
{"run":133,"commit":"3233dd2","metric":0,"metrics":{"fake_demo_cases":84,"demo_jobs":4},"status":"keep","description":"validate fake demo runner parallel opt-in still passes","timestamp":1777046300604,"segment":55,"confidence":null,"iterationTokens":226,"asi":{"hypothesis":"After adding LLGO_DEMO_JOBS validation, verify a valid parallel opt-in value still exercises the scheduler and completes a fake all-pass demo run.","result":"LLGO_DEMO_JOBS=4 fake demo run completed 84/84."}}
{"type":"config","name":"Validate workflow scripts before next push","metricName":"workflow_script_failures","metricUnit":"","bestDirection":"lower"}
{"run":134,"commit":"2c96546","metric":0,"metrics":{"workflow_files_checked":8,"shell_scripts_checked":2},"status":"keep","description":"validate workflow scripts before next push","timestamp":1777046325622,"segment":56,"confidence":null,"iterationTokens":177,"asi":{"hypothesis":"Run shell and YAML syntax checks before pushing the next workflow/demo-runner optimization batch.","result":"bash -n on test_demo/local_ci and YAML parse across workflows passed."}}
{"type":"config","name":"Monitor PR checks before pushing next batch","metricName":"pr_check_failures","metricUnit":"","bestDirection":"lower"}
{"run":135,"commit":"a2dcc1a","metric":0,"metrics":{"pending_checks":7},"status":"keep","description":"monitor PR checks before pushing next batch","timestamp":1777046354641,"segment":57,"confidence":null,"iterationTokens":170,"asi":{"hypothesis":"Check current PR CI after the previous pushed batch; if failures appear, pause optimization and fix them before pushing more changes.","result":"No failed checks observed; 7 macOS-heavy checks still pending."}}
{"type":"config","name":"Validate host demo CI remains sequential after runner hardening","metricName":"ci_host_demo_parallel_optins","metricUnit":"","bestDirection":"lower"}
{"run":136,"commit":"6944b35","metric":0,"metrics":{"llgo_workflow_files":1},"status":"keep","description":"validate host demo CI remains sequential after runner hardening","timestamp":1777046430591,"segment":58,"confidence":null,"iterationTokens":148,"asi":{"hypothesis":"Ensure the portable/validated parallel demo runner remains opt-in only and CI does not set LLGO_DEMO_JOBS after the earlier _demo/go/sync segfault.","result":"No LLGO_DEMO_JOBS opt-ins in llgo workflow."}}
{"type":"config","name":"Skip custom setup-go download when matching Go already exists","metricName":"unconditional_custom_setup_go_downloads","metricUnit":"","bestDirection":"lower"}
{"run":137,"commit":"3c3cb66","metric":1,"metrics":{"custom_setup_go_actions":1},"status":"keep","description":"baseline custom setup-go always downloads requested Go","timestamp":1777047064484,"segment":59,"confidence":null,"iterationTokens":147,"asi":{"hypothesis":"The custom setup-go action always downloads and untars Go even when a matching Go version is already on the runner PATH. Add a fast path to reuse the existing toolchain when the exact version matches."}}
{"run":138,"commit":"f92cb01","metric":0,"metrics":{"custom_setup_go_actions":1},"status":"keep","description":"reuse matching Go in custom setup-go action","timestamp":1777047094866,"segment":59,"confidence":null,"iterationTokens":540,"asi":{"hypothesis":"A fast path in the custom setup-go action can skip network download, sudo removal, and untar work when the runner already has the exact requested Go version on PATH, preserving fallback behavior when it does not.","result":"Composite action YAML parses and unconditional download marker dropped from 1 to 0."}}
{"type":"config","name":"Validate setup-go existing-version fast path condition","metricName":"setup_go_fast_path_failures","metricUnit":"","bestDirection":"lower"}
{"run":139,"commit":"d5e8f0a","metric":0,"metrics":{"current_go_version_matches":1},"status":"keep","description":"validate setup-go fast path matches current exact Go version","timestamp":1777047133664,"segment":60,"confidence":null,"iterationTokens":150,"asi":{"hypothesis":"Test the exact-version grep used by the setup-go fast path against the current local Go toolchain to ensure the predicate succeeds for a matching version."}}
{"type":"config","name":"Validate setup-go fast path rejects nonmatching version","metricName":"setup_go_false_match_risk","metricUnit":"","bestDirection":"lower"}
{"run":140,"commit":"f54d2bb","metric":0,"metrics":{"synthetic_nonmatching_versions":1},"status":"keep","description":"validate setup-go fast path rejects nonmatching version","timestamp":1777047157915,"segment":61,"confidence":null,"iterationTokens":142,"asi":{"hypothesis":"Check the setup-go fast-path predicate does not match an obviously different Go version, preserving the download fallback path when the requested version is absent."}}
{"type":"config","name":"Extend setup-go fast path to existing /usr/local/go","metricName":"setup_go_local_existing_fast_path_missing","metricUnit":"","bestDirection":"lower"}
{"run":141,"commit":"8a2a967","metric":1,"metrics":{"custom_setup_go_actions":1},"status":"keep","description":"baseline setup-go fast path only checks PATH go","timestamp":1777047203392,"segment":62,"confidence":null,"iterationTokens":151,"asi":{"hypothesis":"If PATH points to a different Go but /usr/local/go already has the requested version, the custom setup-go action can still skip the download by adding /usr/local/go/bin to GITHUB_PATH."}}
{"run":142,"commit":"9383960","metric":0,"metrics":{"custom_setup_go_actions":1},"status":"keep","description":"reuse matching /usr/local/go in custom setup-go action","timestamp":1777047236770,"segment":62,"confidence":null,"iterationTokens":656,"asi":{"hypothesis":"Checking /usr/local/go/bin/go before downloading expands the setup-go fast path to runner states where PATH points elsewhere but the requested toolchain is already installed in the standard location.","result":"Composite action YAML parses; missing /usr/local fast-path marker dropped from 1 to 0."}}
{"type":"config","name":"Validate composite action and workflows after setup-go fast path","metricName":"ci_yaml_failures","metricUnit":"","bestDirection":"lower"}
{"run":143,"commit":"973cad3","metric":0,"metrics":{"workflow_files_checked":8,"action_files_checked":5},"status":"keep","description":"validate workflows and composite actions after setup-go fast path","timestamp":1777047271049,"segment":63,"confidence":null,"iterationTokens":179,"asi":{"hypothesis":"Parse all workflow and composite action YAML files after adding setup-go fast paths to catch syntax regressions before pushing.","result":"All workflow/action YAML parsed."}}
{"type":"config","name":"Validate setup-go action shell script syntax","metricName":"setup_go_shell_syntax_failures","metricUnit":"","bestDirection":"lower"}
{"run":144,"commit":"973cad3","metric":0,"metrics":{},"status":"crash","description":"attempt setup-go action shell syntax validation with missing PyYAML","timestamp":1777047300723,"segment":64,"confidence":null,"iterationTokens":240,"asi":{"hypothesis":"Validate the setup-go composite action shell block with bash -n after substituting the action expression.","rollback_reason":"The validation harness used Python yaml, but PyYAML is not installed in the local environment; no product code issue.","next_action_hint":"Retry the syntax validation using Ruby's built-in YAML parser instead of PyYAML."}}
{"run":145,"commit":"a1b3f3b","metric":0,"metrics":{"setup_go_shell_blocks_checked":1},"status":"keep","description":"validate setup-go action shell script syntax with Ruby YAML","timestamp":1777047325574,"segment":64,"confidence":null,"iterationTokens":559,"asi":{"hypothesis":"Validate the setup-go composite action's download/setup shell block with bash -n after substituting the GitHub expression, using Ruby YAML to avoid extra local dependencies.","result":"bash -n passed for the setup-go action shell block."}}
{"type":"config","name":"Monitor PR checks after setup-go fast path batch","metricName":"pr_check_failures","metricUnit":"","bestDirection":"lower"}
{"run":146,"commit":"1556d63","metric":0,"metrics":{"pending_checks":9},"status":"keep","description":"monitor PR checks before pushing setup-go fast path batch","timestamp":1777047357044,"segment":65,"confidence":null,"iterationTokens":172,"asi":{"hypothesis":"Check PR CI before pushing another batch; fix failures first if present.","result":"No failed checks observed; 9 checks still pending, mostly macOS/test aggregate jobs."}}
{"run":147,"commit":"4e023f2","metric":0,"metrics":{"pending_checks":9},"status":"keep","description":"monitor PR checks after context resume","timestamp":1777047473243,"segment":65,"confidence":null,"iterationTokens":172,"asi":{"hypothesis":"Resume by checking PR CI first; if any failures are present, prioritize fixing them before more optimization.","result":"No failed checks observed; 9 test checks still pending."}}
{"type":"config","name":"Remove duplicate Ubuntu dependency install entry","metricName":"duplicate_apt_packages_in_setup_deps","metricUnit":"","bestDirection":"lower"}
{"run":148,"commit":"939cd61","metric":1,"metrics":{"setup_deps_actions":1},"status":"keep","description":"baseline duplicate Ubuntu apt dependency in setup-deps","timestamp":1777047535869,"segment":66,"confidence":null,"iterationTokens":188,"asi":{"hypothesis":"The Ubuntu setup-deps action installs libcjson-dev in both common and optional dependency commands. Removing the duplicate optional entry preserves installed packages while saving one redundant apt package request."}}
{"run":149,"commit":"e724766","metric":0,"metrics":{"setup_deps_actions":1},"status":"keep","description":"remove duplicate libcjson-dev from Ubuntu optional deps","timestamp":1777047565362,"segment":66,"confidence":null,"iterationTokens":540,"asi":{"hypothesis":"Since libcjson-dev is already installed with common Ubuntu dependencies, removing it from the optional demo dependency list preserves availability while avoiding a duplicate apt install argument.","result":"setup-deps action YAML parses and duplicate apt package count dropped from 1 to 0."}}
{"type":"config","name":"Validate setup-deps action shell syntax","metricName":"setup_deps_shell_syntax_failures","metricUnit":"","bestDirection":"lower"}
{"run":150,"commit":"392599b","metric":0,"metrics":{"setup_deps_shell_blocks_checked":2},"status":"keep","description":"validate setup-deps action shell blocks after dependency dedupe","timestamp":1777047596360,"segment":67,"confidence":null,"iterationTokens":307,"asi":{"hypothesis":"Run bash -n over setup-deps composite action shell blocks after removing a duplicate apt dependency entry to catch syntax regressions in array syntax.","result":"Both setup-deps shell blocks passed bash -n."}}
{"run":151,"commit":"79213ce","metric":0,"metrics":{"setup_deps_shell_blocks_checked":0,"pending_checks":9},"status":"keep","description":"incidental PR check monitor during setup-deps validation segment","timestamp":1777047833065,"segment":67,"confidence":null,"iterationTokens":1374,"asi":{"hypothesis":"While waiting after the latest push, check whether PR failures appeared; this does not change setup-deps validation but must be logged for the experiment run.","result":"No failed PR checks observed; 9 checks still pending."}}
{"type":"config","name":"Monitor PR checks after resume","metricName":"pr_check_failures","metricUnit":"","bestDirection":"lower"}
{"run":152,"commit":"bec3b84","metric":0,"metrics":{"pending_checks":9},"status":"keep","description":"monitor PR checks after second context resume","timestamp":1777048010418,"segment":68,"confidence":null,"iterationTokens":168,"asi":{"hypothesis":"Start by checking PR CI; failures should preempt further optimization work.","result":"No failed checks observed; 9 checks still pending."}}
{"type":"config","name":"Skip redundant package index updates before embedded deps","metricName":"redundant_embed_dep_update_sites","metricUnit":"","bestDirection":"lower"}
{"run":153,"commit":"1dc7ac1","metric":2,"metrics":{"embed_dep_call_sites":2},"status":"keep","description":"baseline embedded deps action repeats package index updates after setup-deps","timestamp":1777048061656,"segment":69,"confidence":null,"iterationTokens":207,"asi":{"hypothesis":"go.yml and llgo.yml run setup-deps immediately before setup-embed-deps. setup-deps already performs brew/apt update, so those call sites can ask setup-embed-deps to skip its package index update while preserving installed dependencies."}}
{"run":154,"commit":"33694f2","metric":0,"metrics":{"embed_dep_call_sites":2},"status":"keep","description":"skip redundant package index updates before embedded deps","timestamp":1777048123344,"segment":69,"confidence":null,"iterationTokens":1008,"asi":{"hypothesis":"Adding a skip-package-update input to setup-embed-deps lets go.yml and llgo.yml avoid duplicate brew/apt update calls after setup-deps, without changing which embedded dependencies are installed or standalone action behavior.","result":"Workflow/action YAML parses; redundant embed dependency update call sites dropped from 2 to 0."}}
{"type":"config","name":"Validate setup-embed-deps shell syntax","metricName":"setup_embed_shell_syntax_failures","metricUnit":"","bestDirection":"lower"}
{"run":155,"commit":"50bd2cf","metric":0,"metrics":{"setup_embed_shell_blocks_checked":3},"status":"keep","description":"validate setup-embed-deps shell blocks after skip update input","timestamp":1777048151832,"segment":70,"confidence":null,"iterationTokens":283,"asi":{"hypothesis":"Run bash -n on setup-embed-deps composite action shell blocks after adding the skip-package-update conditional to ensure action shell syntax is valid.","result":"All setup-embed-deps shell blocks passed bash -n."}}
{"type":"config","name":"Validate CI YAML/actions before next push","metricName":"ci_yaml_failures","metricUnit":"","bestDirection":"lower"}
{"run":156,"commit":"c5981f5","metric":0,"metrics":{"workflow_files_checked":8,"action_files_checked":5},"status":"keep","description":"validate CI YAML and actions before pushing dependency setup changes","timestamp":1777048183581,"segment":71,"confidence":null,"iterationTokens":176,"asi":{"hypothesis":"Parse all workflow and composite action YAML files before pushing the setup-deps/setup-embed dependency setup optimizations.","result":"All workflow/action YAML parsed successfully."}}
{"type":"config","name":"Monitor PR checks after dependency setup push","metricName":"pr_check_failures","metricUnit":"","bestDirection":"lower"}
{"run":157,"commit":"e778e00","metric":0,"metrics":{"pending_checks":9},"status":"keep","description":"monitor PR checks immediately after dependency setup push","timestamp":1777048234359,"segment":72,"confidence":null,"iterationTokens":170,"asi":{"hypothesis":"After pushing the dependency setup optimizations, immediately check for early CI failures before continuing.","result":"No failed checks observed; 9 checks pending immediately after push."}}
{"type":"config","name":"Remove duplicate stdlib coverage check from Go workflow","metricName":"duplicate_std_cover_steps","metricUnit":"","bestDirection":"lower"}
{"run":158,"commit":"ef6cb57","metric":1,"metrics":{"std_cover_sites":2},"status":"keep","description":"baseline duplicate stdlib coverage check in Go workflow","timestamp":1777048307386,"segment":73,"confidence":null,"iterationTokens":182,"asi":{"hypothesis":"The Go workflow and the dedicated Stdlib Coverage workflow both run doc/_readme/scripts/check_std_cover.sh on macOS and Ubuntu. Keeping the dedicated workflow preserves coverage while removing the duplicate Go workflow step shortens the already-heavy Go job."}}
{"run":159,"commit":"315c3d1","metric":0,"metrics":{"std_cover_sites":1},"status":"keep","description":"remove duplicate stdlib coverage check from Go workflow","timestamp":1777048355260,"segment":73,"confidence":null,"iterationTokens":451,"asi":{"hypothesis":"Removing check_std_cover.sh from the Go workflow avoids duplicate work because the dedicated Stdlib Coverage workflow still runs the same script on macOS and Ubuntu for PRs and pushes.","result":"Go and stdlib workflow YAML parse; duplicate stdlib coverage sites dropped from 1 to 0 while one dedicated site remains."}}
{"type":"config","name":"Monitor PR checks after stdlib duplicate removal","metricName":"pr_check_failures","metricUnit":"","bestDirection":"lower"}
{"run":160,"commit":"e081d54","metric":0,"metrics":{"pending_checks":9},"status":"keep","description":"monitor PR checks after dependency setup batch has run longer","timestamp":1777048597856,"segment":74,"confidence":null,"iterationTokens":175,"asi":{"hypothesis":"Check for CI failures after the pushed dependency setup batch has had a few minutes to run before continuing with more workflow changes.","result":"No failed checks observed; 9 checks still pending in the summarized output."}}
{"type":"config","name":"Combine duplicate WAMR install workflow steps","metricName":"wamr_install_steps","metricUnit":"","bestDirection":"lower"}
{"run":161,"commit":"e32fcc9","metric":2,"metrics":{"build_cache_workflows":1},"status":"keep","description":"baseline build-cache workflow has duplicate WAMR install steps","timestamp":1777048705654,"segment":75,"confidence":null,"iterationTokens":139,"asi":{"hypothesis":"The build-cache workflow has separate macOS and Ubuntu WAMR install steps with nearly identical bodies. Combining them into one conditional shell step preserves both platform builds while reducing workflow step overhead and maintenance duplication."}}
