{"run":722,"commit":"0659637","metric":0,"metrics":{"crosscompile_packages_tested":4,"compile_jobs_tests":1},"status":"keep","description":"add coverage for CompileGroup parallelism override","timestamp":1777194561253,"segment":307,"confidence":null,"iterationTokens":201,"asi":{"hypothesis":"The kept CompileGroup parallelism should include direct test coverage for LLGO_COMPILE_JOBS override and invalid values, plus compatibility with sequential LLGO_COMPILE_JOBS=1.","result":"internal/crosscompile/... passed and LLGO_COMPILE_JOBS=1 go test ./internal/crosscompile/compile passed."}}
{"type":"config","name":"Optimize LLGo external compile parallelism","metricName":"compile_group_ms","metricUnit":"ms","bestDirection":"lower"}
{"run":723,"commit":"77bf29c","metric":905.4,"metrics":{"compile_group_files":64},"status":"keep","description":"baseline sequential override for 64-file CompileGroup","timestamp":1777194585691,"segment":308,"confidence":null,"iterationTokens":535,"asi":{"hypothesis":"Use LLGO_COMPILE_JOBS=1 as a sequential baseline on a larger 64-file CompileGroup workload to quantify parallelism benefit after adding the configurable scheduler.","result":"Sequential override baseline was 905.4ms for 64 C files."}}
{"run":724,"commit":"927b808","metric":175.3,"metrics":{"compile_group_files":64},"status":"keep","description":"measure default parallel CompileGroup on 64-file workload","timestamp":1777194598439,"segment":308,"confidence":null,"iterationTokens":1718,"asi":{"hypothesis":"Default CompileGroup parallelism capped at min(GOMAXPROCS,8) should substantially outperform LLGO_COMPILE_JOBS=1 while compiling independent source files.","result":"Default parallel CompileGroup completed 64 C files in 175.3ms versus 905.4ms sequential override."}}
{"run":725,"commit":"1e76145","metric":173.1,"metrics":{"compile_group_files":64},"status":"keep","description":"avoid per-file compiler command logging by default","timestamp":1777194635465,"segment":308,"confidence":332.86363636363376,"iterationTokens":3032,"asi":{"hypothesis":"CompileGroup currently prints every clang command unconditionally, adding log I/O overhead and very large logs for libc/compiler-rt builds. Make per-file command logging opt-in via CompileOptions.Verbose or LLGO_COMPILE_VERBOSE while retaining group-level progress output.","result":"compile package tests pass. 64-file parallel CompileGroup benchmark improved slightly from 175.3ms to 173.1ms and per-file command logs disappeared."}}
{"type":"config","name":"Validate CompileGroup verbose and jobs controls","metricName":"validation_failures","metricUnit":"","bestDirection":"lower"}
{"run":726,"commit":"3d0e1a6","metric":0,"metrics":{"crosscompile_packages_tested":4,"compile_control_tests":2},"status":"keep","description":"validate CompileGroup verbose and jobs controls","timestamp":1777194699376,"segment":309,"confidence":null,"iterationTokens":193,"asi":{"hypothesis":"Add direct coverage for the new CompileGroup controls: LLGO_COMPILE_JOBS validation and opt-in per-file verbose logging via CompileOptions.Verbose/LLGO_COMPILE_VERBOSE.","result":"internal/crosscompile/... passed; LLGO_COMPILE_JOBS=1 compile package test passed."}}
{"type":"config","name":"Check Go build impact of CompileGroup controls","metricName":"go_build_ms","metricUnit":"ms","bestDirection":"lower"}
{"run":727,"commit":"e93357e","metric":10400.7,"metrics":{"go_build_min_ms":10221.5,"go_build_max_ms":10412.9,"runs":3},"status":"keep","description":"check go build impact after CompileGroup parallelism","timestamp":1777194765724,"segment":310,"confidence":null,"iterationTokens":397,"asi":{"hypothesis":"Adding CompileGroup parallelism imports/runtime controls should not significantly regress the clean Go build improvements from file-list refactors.","result":"Median clean go build -a -tags=dev ./cmd/llgo was 10400.7ms after CompileGroup controls. This is still faster than the original 10594.3ms go-build baseline but slower than the best file-list-only sample; treat as noise/tradeoff because CompileGroup parallelism targets LLGo external compile stage, not Go tool frontend."}}
{"type":"config","name":"Validate and record CompileGroup parallelism notes","metricName":"validation_failures","metricUnit":"","bestDirection":"lower"}
{"run":728,"commit":"7ad18d2","metric":0,"metrics":{"ideas_updated":1},"status":"keep","description":"record CompileGroup parallelism in ideas backlog","timestamp":1777194803069,"segment":311,"confidence":null,"iterationTokens":197,"asi":{"hypothesis":"Update the ideas backlog so future work does not re-discover external-process CompileGroup parallelism and focuses on harder package-level dependency-aware scheduling.","result":"CompileGroup notes now record LLGO_COMPILE_JOBS, LLGO_COMPILE_VERBOSE, and 905ms-to-173ms benchmark result."}}
{"type":"config","name":"Monitor PR after pure compile performance changes","metricName":"pr_check_failures","metricUnit":"","bestDirection":"lower"}
{"run":729,"commit":"117f9ff","metric":0,"metrics":{"pending_checks":17},"status":"keep","description":"monitor PR immediately after pure compile perf push","timestamp":1777194860899,"segment":312,"confidence":null,"iterationTokens":240,"asi":{"hypothesis":"Pushing pure compile-performance changes should not introduce immediate CI workflow failures; monitoring is for health only, not CI speed optimization.","result":"No failed checks observed immediately after push; 17 checks pending."}}
{"type":"config","name":"Optimize Go build by removing YAML manifest dependency","metricName":"go_build_ms","metricUnit":"ms","bestDirection":"lower"}
{"run":730,"commit":"7ad18d2","metric":10328.2,"metrics":{"go_build_min_ms":10246.8,"go_build_max_ms":10386.6,"runs":3},"status":"discard","description":"try replacing YAML manifest serialization with JSON","timestamp":1777195108945,"segment":313,"confidence":null,"iterationTokens":411,"asi":{"hypothesis":"Removing gopkg.in/yaml.v3 from the cmd/llgo build graph could reduce clean go build time because prior profiling showed yaml.v3 compile around 170ms.","result":"internal/build and internal/crosscompile tests passed and clean go build median was 10328.2ms, but user questioned the format change. This changes cache manifest format semantics and compatibility more than desired for a compile-speed experiment.","rollback_reason":"Avoid changing cache manifest format from YAML to JSON without explicit design agreement; the optimization is not worth the compatibility/semantics churn.","next_action_hint":"Revert/avoid YAML-to-JSON. Keep YAML manifest format; continue with safer compile-speed work such as external compile parallelism and dependency reductions that preserve file formats."}}
{"type":"config","name":"Optimize Go build by simplifying llgo command dispatcher","metricName":"go_build_ms","metricUnit":"ms","bestDirection":"lower"}
{"run":731,"commit":"7ad18d2","metric":0,"metrics":{"go_build_min_ms":0,"go_build_max_ms":0,"runs":0,"dispatcher_smoke_tests":0},"status":"crash","description":"try simplifying llgo command dispatcher to remove cobra dependency","timestamp":1777195337237,"segment":314,"confidence":null,"iterationTokens":589,"asi":{"hypothesis":"Replacing the generated cobra/xcmd dispatcher with a small hand-written dispatcher could remove github.com/goplus/cobra from the cmd/llgo dependency graph and improve clean go build time while preserving core subcommands.","result":"Validation command failed before benchmarking; likely a smoke test expectation or command behavior mismatch. Need inspect/reproduce before considering this risky generated-file change.","rollback_reason":"Dispatcher rewrite did not pass local validation on first attempt and touches generated command wiring, so revert before inspection.","next_action_hint":"If revisiting, reproduce failures with visible output and compare exact help/flag behavior; avoid this change unless CLI compatibility is proven."}}
{"type":"config","name":"Optimize Go build dispatcher dependencies","metricName":"go_build_ms","metricUnit":"ms","bestDirection":"lower"}
{"run":732,"commit":"1f58898","metric":10382.9,"metrics":{"go_build_min_ms":10247.1,"go_build_max_ms":10577.2,"runs":3},"status":"keep","description":"baseline go build with xgo/cobra dispatcher","timestamp":1777195415647,"segment":315,"confidence":null,"iterationTokens":395,"asi":{"hypothesis":"Establish a fresh clean go build baseline before retrying command dispatcher dependency reduction. YAML manifest format remains unchanged.","result":"Median clean go build -a -tags=dev ./cmd/llgo was 10382.9ms with the existing xgo/cobra dispatcher and previously kept compile-speed changes."}}
{"run":733,"commit":"1f58898","metric":10474.6,"metrics":{"go_build_min_ms":10432.9,"go_build_max_ms":10476.8,"runs":3,"dispatcher_smoke_tests":4},"status":"discard","description":"replace xgo/cobra dispatcher with small hand dispatcher","timestamp":1777195486886,"segment":315,"confidence":null,"iterationTokens":1954,"asi":{"hypothesis":"A small hand-written dispatcher can remove github.com/goplus/cobra/xcmd and qiniu/stringutil from cmd/llgo's dependency graph while preserving core CLI behavior, reducing clean Go build time.","result":"Command/internal tests and smoke checks for version/help/help build/build -h passed, and cobra/stringutil left the dependency graph, but clean go build median regressed to 10474.6ms versus 10382.9ms baseline. Likely noise or lost generated-code optimizations; not worth changing generated command wiring.","rollback_reason":"Primary metric worsened and the change touches generated command code, increasing maintenance risk.","next_action_hint":"Do not pursue dispatcher replacement unless a larger, repeatable benchmark win appears. Continue with non-CLI dependency reductions or compile-stage parallelism."}}
{"type":"config","name":"Tune CompileGroup parallelism cap","metricName":"compile_group_ms","metricUnit":"ms","bestDirection":"lower"}
{"run":734,"commit":"a696a3a","metric":241.5,"metrics":{"compile_group_files":96},"status":"keep","description":"baseline CompileGroup cap 8 on 96-file workload","timestamp":1777195586183,"segment":316,"confidence":null,"iterationTokens":534,"asi":{"hypothesis":"Before changing CompileGroup default parallelism cap, establish a 96-file external compile workload baseline with the current effective cap of 8 jobs.","result":"LLGO_COMPILE_JOBS=8 completed 96 C files in 241.5ms."}}
{"run":735,"commit":"a696a3a","metric":0,"metrics":{"compile_group_files":96,"best_jobs":0},"status":"crash","description":"tune CompileGroup jobs failed due temp go run package path","timestamp":1777195601191,"segment":316,"confidence":null,"iterationTokens":982,"asi":{"hypothesis":"Compare LLGO_COMPILE_JOBS values 4,8,12,16 on a 96-file workload to see whether the default cap should change.","result":"The tuning command failed because go run of a temp file outside the module could not import the internal compile package.","rollback_reason":"Invalid benchmark harness location; no code change.","next_action_hint":"Retry by writing the benchmark harness under a temporary directory inside the module so it can import internal/crosscompile/compile."}}
{"run":736,"commit":"1c7228c","metric":155,"metrics":{"compile_group_files":96,"best_jobs":16},"status":"keep","description":"tune CompileGroup jobs on 96-file workload","timestamp":1777195623935,"segment":316,"confidence":null,"iterationTokens":1308,"asi":{"hypothesis":"For external clang subprocesses, a cap above 8 may improve throughput on highly parallel machines without touching in-process LLVM state. Measure 4/8/12/16 jobs on a 96-file workload before changing defaults.","result":"Best tested value was 16 jobs: medians 4=411.1ms, 8=234.8ms, 12=197.9ms, 16=155.0ms. This suggests the current default cap 8 is conservative for this host, but changing default needs caution for smaller/CI machines."}}
{"run":737,"commit":"e33b64d","metric":164.8,"metrics":{"compile_group_files":96,"best_jobs":16},"status":"keep","description":"raise default CompileGroup job cap to 16","timestamp":1777195667444,"segment":316,"confidence":8.826530612244888,"iterationTokens":1677,"asi":{"hypothesis":"Raising the default external CompileGroup cap from 8 to 16 should improve high-core machines while still respecting runtime.GOMAXPROCS and allowing LLGO_COMPILE_JOBS to lower concurrency for constrained or problematic libraries.","result":"compile package tests pass. Default 96-file CompileGroup benchmark improved from the cap-8 baseline 241.5ms to 164.8ms."}}
{"type":"config","name":"Validate CompileGroup cap 16","metricName":"validation_failures","metricUnit":"","bestDirection":"lower"}
{"run":738,"commit":"401dd48","metric":0,"metrics":{"crosscompile_packages_tested":4,"compile_jobs_cap":16},"status":"keep","description":"validate CompileGroup cap 16 across crosscompile tests","timestamp":1777195719276,"segment":317,"confidence":null,"iterationTokens":176,"asi":{"hypothesis":"The higher default CompileGroup cap should remain safe across crosscompile unit tests and still honor LLGO_COMPILE_JOBS=1 sequential override.","result":"internal/crosscompile/... passed and LLGO_COMPILE_JOBS=1 go test ./internal/crosscompile/compile passed."}}
{"run":739,"commit":"66ddec4","metric":0,"metrics":{"crosscompile_packages_tested":4,"compile_jobs_cap":16,"ideas_updated":1},"status":"keep","description":"record CompileGroup cap tuning in ideas","timestamp":1777195752199,"segment":317,"confidence":null,"iterationTokens":871,"asi":{"hypothesis":"Update the ideas backlog to reflect that external CompileGroup parallelism is implemented and tuned to cap 16 so future work focuses on remaining package-level scheduling/dependency reductions.","result":"Ideas now record min(GOMAXPROCS,16), LLGO_COMPILE_JOBS, LLGO_COMPILE_VERBOSE, and 96-file 241.5ms-to-164.8ms tuning result."}}
{"type":"config","name":"Optimize multi-group external compile scheduling","metricName":"compile_config_ms","metricUnit":"ms","bestDirection":"lower"}
{"run":740,"commit":"d1dd228","metric":233.5,"metrics":{"compile_config_groups":4,"compile_config_files":96},"status":"keep","description":"baseline sequential multi-group CompileConfig scheduling","timestamp":1777195815297,"segment":318,"confidence":null,"iterationTokens":612,"asi":{"hypothesis":"compileWithConfig currently compiles archive groups sequentially. A synthetic 4-group/96-file workload establishes the group-barrier cost before trying a shared scheduler.","result":"Sequential group scheduling completed in 233.5ms for 4 groups and 96 C files with the current per-group parallelism."}}
{"run":741,"commit":"8be8841","metric":189.5,"metrics":{"compile_config_groups":4,"compile_config_files":96},"status":"keep","description":"share CompileConfig worker pool across archive groups","timestamp":1777196446829,"segment":318,"confidence":null,"iterationTokens":5817,"asi":{"hypothesis":"compileWithConfig had a barrier between CompileGroup archives: each group used its own worker pool and had to finish before the next group started. A CompileConfig-level shared worker pool can compile independent C/ASM files from all groups under one job budget, then archive groups deterministically in config order.","result":"internal/crosscompile/compile and internal/crosscompile tests pass. Synthetic 4-group/96-file CompileConfig benchmark improved from 233.5ms to 189.5ms."}}
{"type":"config","name":"Validate shared CompileConfig scheduling","metricName":"validation_failures","metricUnit":"","bestDirection":"lower"}
{"run":742,"commit":"4b002e4","metric":0,"metrics":{"crosscompile_packages_tested":4,"compile_config_tests":1},"status":"keep","description":"validate shared CompileConfig scheduling with tests","timestamp":1777196526027,"segment":319,"confidence":null,"iterationTokens":191,"asi":{"hypothesis":"The shared CompileConfig worker pool should have direct unit coverage for multi-group archives and remain compatible with sequential LLGO_COMPILE_JOBS=1.","result":"internal/crosscompile/... passed, LLGO_COMPILE_JOBS=1 compile package test passed, and a multi-group CompileConfig test verifies both archives and symbols."}}
{"type":"config","name":"Check Go build after shared CompileConfig scheduling","metricName":"go_build_ms","metricUnit":"ms","bestDirection":"lower"}
{"run":743,"commit":"233d191","metric":10349.9,"metrics":{"go_build_min_ms":10306.7,"go_build_max_ms":10432.3,"runs":3},"status":"keep","description":"check clean go build after shared CompileConfig scheduling","timestamp":1777197285021,"segment":320,"confidence":null,"iterationTokens":191,"asi":{"hypothesis":"The shared CompileConfig scheduling refactor should not materially regress clean Go compilation of cmd/llgo, even though its runtime benefit is mainly for LLGo crosscompile external C/ASM builds.","result":"Median clean go build -a -tags=dev ./cmd/llgo was 10349.9ms over 3 runs (min 10306.7ms, max 10432.3ms), slightly below the recent xgo/cobra baseline 10382.9ms and within expected noise."}}
{"type":"config","name":"Record shared CompileConfig scheduling notes","metricName":"validation_failures","metricUnit":"","bestDirection":"lower"}
{"run":744,"commit":"6ff5ef1","metric":0,"metrics":{"ideas_updated":1},"status":"keep","description":"record shared CompileConfig scheduling in ideas","timestamp":1777197303051,"segment":321,"confidence":null,"iterationTokens":188,"asi":{"hypothesis":"Document the completed shared CompileConfig worker-pool optimization so future pure compile work focuses on dependency graph reduction or safe package scheduling rather than redoing external compile scheduling.","result":"Ideas backlog now records CompileConfig.Compile shared worker pool, 233.5ms-to-189.5ms synthetic benchmark, and validation scope."}}
{"type":"config","name":"Monitor PR after shared CompileConfig scheduling push","metricName":"pr_check_failures","metricUnit":"","bestDirection":"lower"}
{"run":745,"commit":"86973e7","metric":0,"metrics":{"pending_checks":18,"passed_checks":0,"skipped_checks":0},"status":"keep","description":"monitor PR immediately after shared CompileConfig push","timestamp":1777197337417,"segment":322,"confidence":null,"iterationTokens":373,"asi":{"hypothesis":"The shared CompileConfig scheduling and cap-16 changes should not produce immediate PR check failures after pushing; monitoring is for health, not CI speed optimization.","result":"No failed PR checks immediately after push; 18 checks pending."}}
{"type":"config","name":"Preserve CompileGroup skip behavior with invalid env","metricName":"skip_invalid_env_failures","metricUnit":"","bestDirection":"lower"}
{"run":746,"commit":"d0f94b9","metric":1,"metrics":{"test_exit_code":1},"status":"keep","description":"baseline invalid LLGO_COMPILE_JOBS affects skipped compile","timestamp":1777197407546,"segment":323,"confidence":null,"iterationTokens":215,"asi":{"hypothesis":"The shared CompileConfig refactor may have changed skip behavior by parsing LLGO_COMPILE_JOBS before checking whether every archive is already compiled. Establish that current behavior fails with invalid env even when a group is skipped.","result":"LLGO_COMPILE_JOBS=bad go test ./internal/crosscompile/compile -run TestCompile/Skip_compile failed; skipped archive path now returns invalid env error. The broader package run also exposed TestCompileConfigMultipleGroups inheriting the invalid env."}}
{"run":747,"commit":"9c914af","metric":0,"metrics":{"test_exit_code":0,"compile_skip_tests":1,"crosscompile_packages_tested":4},"status":"keep","description":"preserve skipped compile behavior with invalid jobs env","timestamp":1777197469198,"segment":323,"confidence":null,"iterationTokens":1640,"asi":{"hypothesis":"Delay LLGO_COMPILE_JOBS parsing until there is at least one source file to compile so already-built archives preserve the old fast skip behavior even if the env override is invalid.","result":"Added TestCompileSkipDoesNotReadJobs. LLGO_COMPILE_JOBS=bad skip test passed, sequential compile-package tests passed, and internal/crosscompile/... passed."}}
{"type":"config","name":"Pre-push local validation after skipped compile fix","metricName":"validation_failures","metricUnit":"","bestDirection":"lower"}
{"run":748,"commit":"f3db5e9","metric":0,"metrics":{"crosscompile_packages_tested":4,"cmd_llgo_build":1},"status":"keep","description":"local validation before pushing skipped compile fix","timestamp":1777197488365,"segment":324,"confidence":null,"iterationTokens":173,"asi":{"hypothesis":"Before pushing the skipped-compile correctness fix to trigger CI, run relevant local crosscompile tests and a dev llgo command build as requested.","result":"go test ./internal/crosscompile/... passed and go build -tags=dev ./cmd/llgo passed locally."}}
{"type":"config","name":"Monitor PR after locally validated skipped compile fix push","metricName":"pr_check_failures","metricUnit":"","bestDirection":"lower"}
{"run":749,"commit":"0e880d5","metric":0,"metrics":{"pending_checks":11,"passed_checks":0,"skipped_checks":0},"status":"keep","description":"monitor PR after locally validated skipped compile fix push","timestamp":1777197521815,"segment":325,"confidence":null,"iterationTokens":348,"asi":{"hypothesis":"After local validation and push, the skipped-compile fix should not show immediate CI check failures.","result":"No failed PR checks immediately after push; 11 checks pending."}}
{"type":"config","name":"Profile clean go build package compile hotspots","metricName":"profile_wall_ms","metricUnit":"ms","bestDirection":"lower"}
