{"run":1142,"commit":"037fe6e","metric":145,"metrics":{"append_simple_metadata_bytes_op":368,"append_simple_metadata_allocs_op":2,"runs":9},"status":"keep","description":"baseline append simple metadata before final-builder attempt","timestamp":1777232371071,"segment":594,"confidence":null,"iterationTokens":658,"asi":{"hypothesis":"appendManifestMetadata currently builds simple metadata and then concatenates it with the manifest; constructing the final manifest in one builder may remove an allocation and reduce bytes.","result":"Baseline appendManifestMetadata simple metadata median: 145 ns/op, 368 B/op, 2 allocs/op across 9 runs."}}
{"run":1143,"commit":"91052a8","metric":121,"metrics":{"append_simple_metadata_bytes_op":256,"append_simple_metadata_allocs_op":1,"runs":9},"status":"keep","description":"build final manifest directly for simple metadata append","timestamp":1777232449624,"segment":594,"confidence":null,"iterationTokens":3264,"asi":{"hypothesis":"For simple generated metadata, appendManifestMetadata can build the final manifest in one strings.Builder instead of building metadata then concatenating, reducing allocation and copy work while preserving complex-YAML fallback behavior.","result":"internal/build tests passed. appendManifestMetadata simple metadata improved from 145 ns/op, 368 B/op, 2 allocs/op to 121 ns/op, 256 B/op, 1 alloc/op across 9 runs.","next_action_hint":"Validate broad tests and temp cmd/llgo build before pushing; update ideas backlog."}}
{"type":"config","name":"Validate direct simple metadata append","metricName":"validation_failures","metricUnit":"","bestDirection":"lower"}
{"run":1144,"commit":"4da60a2","metric":0,"metrics":{"packages_tested":5,"temp_builds":1},"status":"keep","description":"validate direct simple metadata append","timestamp":1777232519608,"segment":595,"confidence":null,"iterationTokens":294,"asi":{"hypothesis":"Direct final-manifest building for simple metadata should preserve metadata-before-deps, missing trailing newline behavior, YAML fallback helpers, and cmd/llgo build health.","result":"Added TestAppendManifestMetadataSimple covering metadata-before-deps insertion, no-trailing-newline behavior, parseability, and no-deps separator insertion. go test ./internal/build, go test ./internal/crosscompile/..., and temp-path go build -tags=dev ./cmd/llgo passed; root llgo was not created."}}
{"type":"config","name":"Record direct simple metadata append optimization","metricName":"validation_failures","metricUnit":"","bestDirection":"lower"}
{"run":1145,"commit":"5074ed9","metric":0,"metrics":{"ideas_updated":1},"status":"keep","description":"record direct simple metadata append optimization","timestamp":1777232550906,"segment":596,"confidence":null,"iterationTokens":177,"asi":{"hypothesis":"Record the direct simple metadata append optimization so future loops know the remaining metadata append allocation/copy was addressed.","result":"Ideas backlog records the 146ns/op to 121ns/op improvement, 2-to-1 allocation reduction, and behavioral coverage."}}
{"type":"config","name":"Monitor PR after pushing direct simple metadata append","metricName":"pr_check_failures","metricUnit":"","bestDirection":"lower"}
{"run":1146,"commit":"9b4cd53","metric":0,"metrics":{"pending_checks":46,"passed_checks":2,"skipped_checks":0,"llgo_in_pr_diff":0},"status":"keep","description":"monitor PR after pushing direct simple metadata append","timestamp":1777232601801,"segment":597,"confidence":null,"iterationTokens":452,"asi":{"hypothesis":"After pushing direct simple metadata append, the new PR run should start without immediate failures and root llgo should remain absent from the diff.","result":"New PR checks: 0 failures, 46 pending, 2 passed, 0 skipped; root llgo absent from PR diff.","next_action_hint":"Poll later for completion; continue local A/B experiments before further source pushes."}}
{"type":"config","name":"Skip duplicate cache directory creation during saveToCache","metricName":"save_to_cache_metadata_ns_op","metricUnit":"","bestDirection":"lower"}
{"run":1147,"commit":"0d5f8ef","metric":294094,"metrics":{"save_to_cache_metadata_bytes_op":38405,"save_to_cache_metadata_allocs_op":40,"runs":9},"status":"keep","description":"baseline saveToCache duplicate mkdir checks","timestamp":1777232652588,"segment":598,"confidence":null,"iterationTokens":949,"asi":{"hypothesis":"saveToCache ensures the cache directory before copying archive and writing manifest, but copyFileAtomic and writeManifest each call MkdirAll again; skipping those duplicate directory checks on the saveToCache path may reduce cache-save syscalls.","result":"Baseline saveToCache with simple metadata and small archive after direct metadata append: 294094 ns/op, 38405 B/op, 40 allocs/op."}}
{"run":1148,"commit":"0d5f8ef","metric":293454,"metrics":{"save_to_cache_metadata_bytes_op":37669,"save_to_cache_metadata_allocs_op":36,"runs":9},"status":"discard","description":"skip duplicate cache directory creation during saveToCache","timestamp":1777232743297,"segment":598,"confidence":null,"iterationTokens":2368,"asi":{"hypothesis":"saveToCache already ensures the cache directory, so using no-Mkdir variants for archive copy and manifest write may avoid duplicate directory syscalls in cache saves.","result":"internal/build tests passed and allocations dropped from 40 to 36, but saveToCache wall time only moved from 294094 ns/op to 293454 ns/op (~0.2%), well within file-I/O benchmark noise and not worth extra helper surface.","rollback_reason":"Noise-level primary improvement with added code complexity; overfitting to a syscall-heavy microbenchmark risk.","next_action_hint":"Keep copyFileAtomic/writeManifest simple; only revisit duplicate MkdirAll if an end-to-end cache-save profile shows directory creation as material."}}
{"type":"config","name":"Record rejected no-Mkdir saveToCache helpers","metricName":"validation_failures","metricUnit":"","bestDirection":"lower"}
{"run":1149,"commit":"82550b2","metric":0,"metrics":{"ideas_updated":1},"status":"keep","description":"record rejected no-Mkdir saveToCache helpers","timestamp":1777232772616,"segment":599,"confidence":null,"iterationTokens":184,"asi":{"hypothesis":"Record the rejected no-Mkdir saveToCache helper split so future loops do not add helper complexity for a noise-level cache-save microbenchmark result.","result":"Ideas backlog records the 294094ns->293454ns noise-level result and allocation drop 40->36."}}
{"type":"config","name":"Monitor PR direct simple metadata append progress","metricName":"pr_check_failures","metricUnit":"","bestDirection":"lower"}
{"run":1150,"commit":"5bc37fc","metric":0,"metrics":{"pending_checks":42,"passed_checks":16,"skipped_checks":0,"llgo_in_pr_diff":0},"status":"keep","description":"monitor PR direct simple metadata append progress","timestamp":1777232800394,"segment":600,"confidence":null,"iterationTokens":447,"asi":{"hypothesis":"The PR run after direct simple metadata append should continue progressing without failures and root llgo should stay absent from the diff.","result":"Current PR checks: 0 failures, 42 pending, 16 passed, 0 skipped; root llgo absent from PR diff.","next_action_hint":"Poll later for completion; continue local build-performance experiments."}}
{"type":"config","name":"Manual scan for simple metadata scalar guard","metricName":"parse_comma_linkargs_metadata_ns_op","metricUnit":"","bestDirection":"lower"}
{"run":1151,"commit":"6ac82c3","metric":189,"metrics":{"parse_comma_linkargs_metadata_bytes_op":128,"parse_comma_linkargs_metadata_allocs_op":3,"append_simple_metadata_ns_op":118,"append_simple_metadata_bytes_op":256,"append_simple_metadata_allocs_op":1,"runs":9},"status":"keep","description":"baseline simple metadata scalar guard","timestamp":1777232855889,"segment":601,"confidence":null,"iterationTokens":889,"asi":{"hypothesis":"isSimpleMetadataScalar uses strings.ContainsAny for every simple link arg during parse/emit; a manual byte scan might reduce scalar guard overhead in the metadata fast path.","result":"Baseline comma link_args parse: 189 ns/op, 128 B/op, 3 allocs/op. Baseline direct append simple metadata: 118 ns/op, 256 B/op, 1 alloc/op."}}
{"run":1152,"commit":"6ac82c3","metric":180,"metrics":{"parse_comma_linkargs_metadata_bytes_op":128,"parse_comma_linkargs_metadata_allocs_op":3,"append_simple_metadata_ns_op":104,"append_simple_metadata_bytes_op":256,"append_simple_metadata_allocs_op":1,"runs":9},"status":"discard","description":"manual scan for simple metadata scalar guard","timestamp":1777232940300,"segment":601,"confidence":null,"iterationTokens":1769,"asi":{"hypothesis":"Replacing strings.ContainsAny in isSimpleMetadataScalar with a manual byte switch may reduce simple metadata parse/emit fast-path overhead.","result":"internal/build tests passed and comma link_args parse moved from 189 ns/op to 180 ns/op; append simple metadata moved from 118 ns/op to 104 ns/op. Allocations were unchanged.","rollback_reason":"Absolute improvement is only 9-14ns with a longer manual character switch; not meaningful enough for maintainability and overfitting risk.","next_action_hint":"Keep strings.ContainsAny for readability unless a profile shows scalar validation itself is material."}}
{"type":"config","name":"Record rejected manual metadata scalar scan","metricName":"validation_failures","metricUnit":"","bestDirection":"lower"}
{"run":1153,"commit":"c50b0c6","metric":0,"metrics":{"ideas_updated":1},"status":"keep","description":"record rejected manual metadata scalar scan","timestamp":1777232973185,"segment":602,"confidence":null,"iterationTokens":180,"asi":{"hypothesis":"Record the rejected manual simple-metadata scalar scan so future loops do not replace strings.ContainsAny for a tiny fast-path microbenchmark win.","result":"Ideas backlog records the 189ns->180ns parse and 118ns->104ns append results plus readability/overfitting rejection rationale."}}
{"type":"config","name":"Monitor PR direct metadata append later progress","metricName":"pr_check_failures","metricUnit":"","bestDirection":"lower"}
{"run":1154,"commit":"dbaa3a5","metric":0,"metrics":{"pending_checks":37,"passed_checks":21,"skipped_checks":0,"llgo_in_pr_diff":0},"status":"keep","description":"monitor PR direct metadata append later progress","timestamp":1777233002927,"segment":603,"confidence":null,"iterationTokens":447,"asi":{"hypothesis":"The PR run after direct simple metadata append should keep progressing without failures and root llgo should remain absent from the diff.","result":"Current PR checks: 0 failures, 37 pending, 21 passed, 0 skipped; root llgo absent from PR diff.","next_action_hint":"Poll later for completion; continue local A/B experiments only with meaningful source hypotheses."}}
{"type":"config","name":"Check clean cmd llgo go-build after direct metadata append","metricName":"clean_go_build_ms","metricUnit":"ms","bestDirection":"lower"}
{"run":1155,"commit":"3e555a7","metric":10220,"metrics":{"runs":3},"status":"keep","description":"check clean cmd/llgo go-build after direct metadata append","timestamp":1777233108330,"segment":604,"confidence":null,"iterationTokens":417,"asi":{"hypothesis":"After direct simple metadata append, isolated clean go build of cmd/llgo should remain healthy and in the recent improved/noise band without creating a root llgo binary.","result":"Three isolated clean go build samples were 10960ms, 10140ms, and 10220ms; median 10220ms. This remains below the original 10594ms baseline but is noisy, so use as a health/plausibility check only. Root llgo was not created."}}
{"type":"config","name":"Monitor PR after clean build health check","metricName":"pr_check_failures","metricUnit":"","bestDirection":"lower"}
{"run":1156,"commit":"e416879","metric":0,"metrics":{"pending_checks":35,"passed_checks":27,"skipped_checks":0,"llgo_in_pr_diff":0},"status":"keep","description":"monitor PR after clean build health check","timestamp":1777233140328,"segment":605,"confidence":null,"iterationTokens":447,"asi":{"hypothesis":"The PR run after direct simple metadata append should keep progressing after the local clean-build health check, and root llgo should remain absent from the diff.","result":"Current PR checks: 0 failures, 35 pending, 27 passed, 0 skipped; root llgo absent from PR diff.","next_action_hint":"Poll later for completion; continue local build-performance experiments."}}
{"type":"config","name":"Avoid fmt.Sprintf in cgo preamble line directives","metricName":"parse_cgo_preamble_ns_op","metricUnit":"","bestDirection":"lower"}
{"run":1157,"commit":"0f9e636","metric":853,"metrics":{"parse_cgo_preamble_bytes_op":1313,"parse_cgo_preamble_allocs_op":30,"runs":9},"status":"keep","description":"baseline cgo preamble line directive formatting","timestamp":1777233224674,"segment":606,"confidence":null,"iterationTokens":695,"asi":{"hypothesis":"parseCgoPreamble uses fmt.Sprintf for each #line directive; direct strconv formatting may reduce allocations in cgo package processing without changing generated preamble text.","result":"Baseline parseCgoPreamble median: 853 ns/op, 1313 B/op, 30 allocs/op."}}
{"run":1158,"commit":"b710086","metric":799,"metrics":{"parse_cgo_preamble_bytes_op":1288,"parse_cgo_preamble_allocs_op":29,"runs":9},"status":"keep","description":"avoid fmt.Sprintf in cgo preamble line directives","timestamp":1777233325677,"segment":606,"confidence":null,"iterationTokens":2532,"asi":{"hypothesis":"parseCgoPreamble can write #line directives with direct strconv formatting instead of fmt.Sprintf, reducing allocation work in cgo package processing while preserving Go-quoted filenames.","result":"internal/build tests passed. parseCgoPreamble improved from 853 ns/op, 1313 B/op, 30 allocs/op to 799 ns/op, 1288 B/op, 29 allocs/op across 9 runs.","next_action_hint":"Add a focused test for #line directive output with quoted filenames, then run broader validation before pushing if kept."}}
{"type":"config","name":"Validate cgo preamble line directive formatting","metricName":"validation_failures","metricUnit":"","bestDirection":"lower"}
{"run":1159,"commit":"b710086","metric":1,"metrics":{"packages_tested":0,"temp_builds":0},"status":"crash","description":"validate cgo preamble line directive formatting","timestamp":1777233403641,"segment":607,"confidence":null,"iterationTokens":299,"asi":{"hypothesis":"Direct strconv formatting for cgo #line directives should preserve exact output when filenames require quoting.","result":"Validation failed in the new focused test: parseCgoPreamble output included an extra trailing blank line because the input preamble ended with a newline and parseCgoPreamble preserves that as an empty line. internal/build did not complete, so broader validation and temp build were not reached.","rollback_reason":"Test expectation bug for existing parseCgoPreamble newline-preservation behavior.","next_action_hint":"Fix expected string to include the preserved blank line, rerun internal/build/crosscompile/temp build validation."}}
{"run":1160,"commit":"605b076","metric":0,"metrics":{"packages_tested":5,"temp_builds":1},"status":"keep","description":"validate cgo preamble line directive formatting","timestamp":1777233471037,"segment":607,"confidence":null,"iterationTokens":4065,"asi":{"hypothesis":"Direct strconv formatting for cgo #line directives should preserve quoted filename output and pass broader build/crosscompile validation.","result":"Added TestParseCgoPreambleLineDirectives covering quoted filenames and preserved trailing blank line. go test ./internal/build, go test ./internal/crosscompile/..., and temp-path go build -tags=dev ./cmd/llgo passed; root llgo was not created."}}
{"type":"config","name":"Record cgo preamble line directive formatting","metricName":"validation_failures","metricUnit":"","bestDirection":"lower"}
{"run":1161,"commit":"77db1a6","metric":0,"metrics":{"ideas_updated":1},"status":"keep","description":"record cgo preamble line directive formatting","timestamp":1777233514074,"segment":608,"confidence":null,"iterationTokens":181,"asi":{"hypothesis":"Record the kept cgo preamble #line directive formatting optimization so future loops know fmt.Sprintf in parseCgoPreamble has been addressed.","result":"Ideas backlog records the 853ns/op to 799ns/op benchmark improvement and quoted-filename test coverage."}}
{"type":"config","name":"Monitor PR after pushing cgo preamble formatting","metricName":"pr_check_failures","metricUnit":"","bestDirection":"lower"}
{"run":1162,"commit":"eb0a6fd","metric":0,"metrics":{"pending_checks":18,"passed_checks":3,"skipped_checks":0,"llgo_in_pr_diff":0},"status":"keep","description":"monitor PR after pushing cgo preamble formatting","timestamp":1777233566957,"segment":609,"confidence":null,"iterationTokens":453,"asi":{"hypothesis":"After pushing cgo preamble #line formatting, the new PR run should start without immediate failures and root llgo should remain absent from the diff.","result":"New PR checks: 0 failures, 18 pending, 3 passed, 0 skipped; root llgo absent from PR diff.","next_action_hint":"Poll later for completion; continue local A/B experiments before further source pushes."}}
{"type":"config","name":"Avoid strings.Split in cgo preamble parsing","metricName":"parse_cgo_preamble_ns_op","metricUnit":"","bestDirection":"lower"}
{"run":1163,"commit":"06cefe7","metric":780,"metrics":{"parse_cgo_preamble_bytes_op":1288,"parse_cgo_preamble_allocs_op":29,"runs":9},"status":"keep","description":"baseline cgo preamble line splitting","timestamp":1777233602758,"segment":610,"confidence":null,"iterationTokens":694,"asi":{"hypothesis":"After direct #line formatting, parseCgoPreamble still allocates a slice with strings.Split over the preamble text; scanning lines manually may reduce allocation work.","result":"Baseline parseCgoPreamble median after #line formatting: 780 ns/op, 1288 B/op, 29 allocs/op."}}
{"run":1164,"commit":"e4da16c","metric":749,"metrics":{"parse_cgo_preamble_bytes_op":1208,"parse_cgo_preamble_allocs_op":28,"runs":9},"status":"keep","description":"avoid strings.Split in cgo preamble parsing","timestamp":1777233692487,"segment":610,"confidence":null,"iterationTokens":2288,"asi":{"hypothesis":"Scanning cgo preamble text line-by-line avoids strings.Split's line-slice allocation while preserving the existing trailing-empty-line behavior.","result":"internal/build tests passed. parseCgoPreamble improved from 780 ns/op, 1288 B/op, 29 allocs/op to 749 ns/op, 1208 B/op, 28 allocs/op across 9 runs.","next_action_hint":"Run broad validation before pushing; existing TestParseCgoPreambleLineDirectives covers trailing blank-line preservation."}}
{"type":"config","name":"Validate cgo preamble line scanning","metricName":"validation_failures","metricUnit":"","bestDirection":"lower"}
{"run":1165,"commit":"73380dc","metric":0,"metrics":{"packages_tested":5,"temp_builds":1},"status":"keep","description":"validate cgo preamble line scanning","timestamp":1777233752437,"segment":611,"confidence":null,"iterationTokens":295,"asi":{"hypothesis":"Manual line scanning in parseCgoPreamble should preserve cgo directive parsing, line directives, trailing blank line behavior, and cmd/llgo build health.","result":"go test ./internal/build, go test ./internal/crosscompile/..., and temp-path go build -tags=dev ./cmd/llgo passed; root llgo was not created."}}
{"type":"config","name":"Record cgo preamble line scanning","metricName":"validation_failures","metricUnit":"","bestDirection":"lower"}
{"run":1166,"commit":"870d990","metric":0,"metrics":{"ideas_updated":1},"status":"keep","description":"record cgo preamble line scanning","timestamp":1777233788665,"segment":612,"confidence":null,"iterationTokens":178,"asi":{"hypothesis":"Record the kept parseCgoPreamble line-scanning optimization and its measured impact to avoid repeating strings.Split work.","result":"Ideas backlog records the 780ns/op to 749ns/op improvement, 1288B to 1208B reduction, and allocation drop from 29 to 28."}}
{"type":"config","name":"Monitor PR after pushing cgo preamble line scanning","metricName":"pr_check_failures","metricUnit":"","bestDirection":"lower"}
{"run":1167,"commit":"d2f9740","metric":0,"metrics":{"pending_checks":49,"passed_checks":2,"skipped_checks":0,"llgo_in_pr_diff":0},"status":"keep","description":"monitor PR after pushing cgo preamble line scanning","timestamp":1777233856029,"segment":613,"confidence":null,"iterationTokens":454,"asi":{"hypothesis":"After pushing cgo preamble line scanning, the new PR run should start without immediate failures and root llgo should remain absent from the diff.","result":"New PR checks: 0 failures, 49 pending, 2 passed, 0 skipped; root llgo absent from PR diff.","next_action_hint":"Poll later for completion; continue local A/B experiments before further source pushes."}}
{"type":"config","name":"Optimize cgo directive parsing without SplitN","metricName":"parse_cgo_decl_ns_op","metricUnit":"","bestDirection":"lower"}
{"run":1168,"commit":"faefa10","metric":161,"metrics":{"parse_cgo_decl_bytes_op":224,"parse_cgo_decl_allocs_op":9,"parse_cgo_decl_ldflags_ns_op":130,"parse_cgo_decl_ldflags_bytes_op":192,"parse_cgo_decl_ldflags_allocs_op":8,"runs":9},"status":"keep","description":"baseline parseCgoDecl string splitting","timestamp":1777233902478,"segment":614,"confidence":null,"iterationTokens":798,"asi":{"hypothesis":"parseCgoDecl uses strings.SplitN and several TrimSpace calls to separate '#cgo', optional tag, flag kind, and args; manual index slicing may reduce cgo directive overhead.","result":"Baseline parseCgoDecl CFLAGS median: 161 ns/op, 224 B/op, 9 allocs/op. LDFLAGS median: 130 ns/op, 192 B/op, 8 allocs/op."}}
