{"run":1064,"commit":"df57f89","metric":232,"metrics":{"package_paths_bytes_op":384,"package_paths_allocs_op":3,"runs":9},"status":"keep","description":"baseline PackagePaths packageDir filepath.Join","timestamp":1777228196756,"segment":534,"confidence":null,"iterationTokens":588,"asi":{"hypothesis":"packageDir still uses filepath.Join(root,target,pkgPath) after sanitizing target/pkg components; direct separator concatenation may avoid path cleanup overhead if we preserve root edge cases.","result":"BenchmarkPackagePathsSafe median is 232 ns/op, 384 B/op, and 3 allocs/op across 9 runs."}}
{"run":1065,"commit":"198aad1","metric":189,"metrics":{"package_paths_bytes_op":384,"package_paths_allocs_op":3,"runs":9},"status":"keep","description":"directly concatenate cache package directories","timestamp":1777228255827,"segment":534,"confidence":null,"iterationTokens":1471,"asi":{"hypothesis":"After target/pkg path components are sanitized, packageDir can build root/target/pkg with separator concatenation instead of filepath.Join while preserving root '.', empty, and trailing-separator edge cases.","result":"internal/build tests passed. BenchmarkPackagePathsSafe improved from 232 ns/op to 189 ns/op with unchanged allocations across 9 runs.","next_action_hint":"Add tests comparing PackagePaths output for normal root plus root edge cases (empty/dot/trailing separator/root slash) before broad validation and push."}}
{"type":"config","name":"Validate direct cache packageDir concatenation","metricName":"validation_failures","metricUnit":"","bestDirection":"lower"}
{"run":1066,"commit":"189f75c","metric":0,"metrics":{"packages_tested":5,"temp_builds":1,"ideas_updated":1},"status":"keep","description":"validate direct cache packageDir concatenation","timestamp":1777228331675,"segment":535,"confidence":null,"iterationTokens":274,"asi":{"hypothesis":"Direct packageDir concatenation should match filepath.Join for root edge cases, pass cache/build tests and temp cmd/llgo build, and be recorded before pushing.","result":"Added TestJoinCachePath comparing empty, dot, absolute normal, trailing-separator, and root-separator roots with filepath.Join. go test ./internal/build, go test ./internal/crosscompile/..., and temp-path go build -tags=dev ./cmd/llgo passed; root llgo was not created; ideas backlog records the 232ns/op to 189ns/op PackagePaths improvement."}}
{"type":"config","name":"Monitor PR after pushing direct packageDir concatenation","metricName":"pr_check_failures","metricUnit":"","bestDirection":"lower"}
{"run":1067,"commit":"854bd78","metric":0,"metrics":{"pending_checks":17,"passed_checks":3,"skipped_checks":0,"llgo_in_pr_diff":0},"status":"keep","description":"monitor PR after pushing direct packageDir concatenation","timestamp":1777228403110,"segment":536,"confidence":null,"iterationTokens":453,"asi":{"hypothesis":"After pushing direct packageDir concatenation, the PR run should start without immediate failures and root llgo should remain absent from the diff.","result":"New PR run has 0 failures, 3 passed, 17 pending, and root llgo absent from PR diff."}}
{"type":"config","name":"Avoid string copy when hashing unsafe cache path components","metricName":"sanitize_component_ns_op","metricUnit":"","bestDirection":"lower"}
{"run":1068,"commit":"9a71b82","metric":68,"metrics":{"sanitize_component_bytes_op":96,"sanitize_component_allocs_op":3,"runs":9},"status":"keep","description":"baseline unsafe cache path component sanitization","timestamp":1777228444526,"segment":537,"confidence":null,"iterationTokens":540,"asi":{"hypothesis":"sanitizeComponent hashes unsafe path components using sha256.Sum256([]byte(s)); reusing the existing read-only string byte view could avoid a copy for unusual package/target components that must be hashed.","result":"BenchmarkSanitizeComponentUnsafe median is 68 ns/op, 96 B/op, and 3 allocs/op across 9 runs."}}
{"run":1069,"commit":"9a71b82","metric":57,"metrics":{"sanitize_component_bytes_op":32,"sanitize_component_allocs_op":2,"runs":9},"status":"discard","description":"avoid string copy when hashing unsafe cache path components","timestamp":1777228514332,"segment":537,"confidence":null,"iterationTokens":1156,"asi":{"hypothesis":"Using readOnlyStringBytes in sanitizeComponent should avoid copying unsafe component strings before SHA-256 hashing.","result":"internal/build tests passed and unsafe-component benchmark improved from 68 ns/op, 96 B/op, 3 allocs/op to 57 ns/op, 32 B/op, 2 allocs/op, but unsafe components are rare and the absolute gain is only ~11ns.","rollback_reason":"Narrow rare-path optimization not worth extending unsafe helper use into cache path sanitization.","next_action_hint":"Keep readOnlyStringBytes limited to hot manifest fingerprint/read paths unless unsafe component hashing shows up in profiles."}}
{"type":"config","name":"Record rejected unsafe sanitizeComponent hashing","metricName":"validation_failures","metricUnit":"","bestDirection":"lower"}
{"run":1070,"commit":"4ba2684","metric":0,"metrics":{"ideas_updated":1},"status":"keep","description":"record rejected unsafe sanitizeComponent hashing","timestamp":1777228546650,"segment":538,"confidence":null,"iterationTokens":172,"asi":{"hypothesis":"Record the rejected unsafe sanitizeComponent hashing experiment to avoid broadening unsafe use for rare path components in future loops.","result":"Ideas backlog now records the 68ns/op to 57ns/op rare-path result and rejection reason."}}
{"type":"config","name":"Monitor PR while direct packageDir concatenation CI progresses","metricName":"pr_check_failures","metricUnit":"","bestDirection":"lower"}
{"run":1071,"commit":"44784f4","metric":0,"metrics":{"pending_checks":42,"passed_checks":15,"skipped_checks":0,"llgo_in_pr_diff":0},"status":"keep","description":"monitor PR while direct packageDir concatenation CI progresses","timestamp":1777228587547,"segment":539,"confidence":null,"iterationTokens":450,"asi":{"hypothesis":"The PR run after direct packageDir concatenation should keep progressing without failures, and root llgo should stay absent from the diff.","result":"Current PR checks: 0 failures, 42 pending, 15 passed, 0 skipped; root llgo absent from PR diff.","next_action_hint":"Poll later for final status; continue only local A/B experiments before pushing further source changes."}}
{"type":"config","name":"Check clean cmd llgo go-build after cache-path optimizations","metricName":"clean_go_build_ms","metricUnit":"ms","bestDirection":"lower"}
{"run":1072,"commit":"2aa4551","metric":10170,"metrics":{"runs":3},"status":"keep","description":"check clean cmd/llgo go-build after cache-path optimizations","timestamp":1777228685723,"segment":540,"confidence":null,"iterationTokens":422,"asi":{"hypothesis":"After kept cache-path and targetTriple source optimizations, a clean isolated go build of cmd/llgo should remain healthy and plausibly in the improved/noise band without creating a root llgo binary.","result":"Three isolated clean go build samples were 11630ms, 10010ms, and 10170ms; median 10170ms. This is below the original 10594ms baseline but the samples remain noisy, so use only as a health/plausibility check rather than a sole optimization proof. Root llgo was not created."}}
{"type":"config","name":"Monitor PR after clean build health check","metricName":"pr_check_failures","metricUnit":"","bestDirection":"lower"}
{"run":1073,"commit":"81acbe2","metric":0,"metrics":{"pending_checks":41,"passed_checks":16,"skipped_checks":0,"llgo_in_pr_diff":0},"status":"keep","description":"monitor PR after clean build health check","timestamp":1777228719525,"segment":541,"confidence":null,"iterationTokens":447,"asi":{"hypothesis":"The PR run after direct packageDir concatenation should continue progressing without failures after the local clean-build health check, and root llgo should remain absent from the diff.","result":"Current PR checks: 0 failures, 41 pending, 16 passed, 0 skipped; root llgo absent from PR diff.","next_action_hint":"Poll later for final status; avoid further pushes without locally validated source improvements."}}
{"run":1074,"commit":"57f3d51","metric":0,"metrics":{"pending_checks":36,"passed_checks":25,"skipped_checks":0,"llgo_in_pr_diff":0},"status":"keep","description":"monitor PR after resuming loop","timestamp":1777228952720,"segment":541,"confidence":null,"iterationTokens":447,"asi":{"hypothesis":"The pushed direct packageDir concatenation should continue through PR checks without failures, and root llgo must remain absent from the PR diff.","result":"Current PR checks after resuming loop: 0 failures, 36 pending, 25 passed, 0 skipped; root llgo absent from PR diff.","next_action_hint":"Continue local build-performance experiments; poll PR later for final status."}}
{"type":"config","name":"Cache sorted build tags for package fingerprints","metricName":"collect_common_tags_ns_op","metricUnit":"","bestDirection":"lower"}
{"run":1075,"commit":"5e4d73d","metric":79,"metrics":{"collect_common_tags_bytes_op":64,"collect_common_tags_allocs_op":1,"collect_common_build_tags_ns_op":9399,"collect_common_build_tags_bytes_op":40057,"collect_common_build_tags_allocs_op":123,"runs":9},"status":"keep","description":"baseline collectCommonInputs build tags","timestamp":1777229000313,"segment":542,"confidence":null,"iterationTokens":941,"asi":{"hypothesis":"collectCommonInputs splits the same build tag string for every package fingerprint; caching sorted build tags on the context may remove repeated strings.Split allocation and per-package sorting work without changing manifest YAML.","result":"Baseline collectCommonInputs with tags median: 79 ns/op, 64 B/op, 1 alloc/op. collectCommonInputs+Build with tags median: 9399 ns/op, 40057 B/op, 123 allocs/op."}}
{"run":1076,"commit":"735f91a","metric":36,"metrics":{"collect_common_tags_bytes_op":0,"collect_common_tags_allocs_op":0,"collect_common_build_tags_ns_op":9278,"collect_common_build_tags_bytes_op":39993,"collect_common_build_tags_allocs_op":122,"runs":9},"status":"keep","description":"cache sorted build tags for package fingerprints","timestamp":1777229090830,"segment":542,"confidence":null,"iterationTokens":4177,"asi":{"hypothesis":"Caching the sorted build tag slice on the build context avoids repeated strings.Split allocation and sorting work in collectCommonInputs for every package fingerprint while keeping the manifest YAML representation stable.","result":"internal/build tests passed. collectCommonInputs with tags improved from 79 ns/op, 64 B/op, 1 alloc/op to 36 ns/op, 0 B/op, 0 alloc/op. collectCommonInputs+Build improved modestly from 9399 ns/op, 40057 B/op, 123 allocs/op to 9278 ns/op, 39993 B/op, 122 allocs/op.","next_action_hint":"Run broader validation and a temp cmd/llgo build; consider whether shared slice aliasing is acceptable given current sequential fingerprinting."}}
{"type":"config","name":"Validate cached build tags for package fingerprints","metricName":"validation_failures","metricUnit":"","bestDirection":"lower"}
{"run":1077,"commit":"16d79ac","metric":0,"metrics":{"packages_tested":5,"temp_builds":1},"status":"keep","description":"validate cached build tags for package fingerprints","timestamp":1777229141692,"segment":543,"confidence":null,"iterationTokens":276,"asi":{"hypothesis":"Cached sorted build tags should preserve manifest behavior, pass package tests, and build cmd/llgo without producing a root llgo artifact.","result":"go test ./internal/build, go test ./internal/crosscompile/..., and temp-path go build -tags=dev ./cmd/llgo passed; root llgo was not created."}}
{"type":"config","name":"Record cached build tags optimization","metricName":"validation_failures","metricUnit":"","bestDirection":"lower"}
{"run":1078,"commit":"febab23","metric":0,"metrics":{"ideas_updated":1},"status":"keep","description":"record cached build tags optimization","timestamp":1777229166010,"segment":544,"confidence":null,"iterationTokens":179,"asi":{"hypothesis":"Record the kept cached build-tag optimization so future loops know tag splitting/sorting has already been addressed.","result":"Ideas backlog records the 79ns/op to 36ns/op collectCommonInputs improvement and the smaller collectCommonInputs+Build improvement."}}
{"type":"config","name":"Monitor PR after pushing cached build tags","metricName":"pr_check_failures","metricUnit":"","bestDirection":"lower"}
{"run":1079,"commit":"11c5ffb","metric":0,"metrics":{"pending_checks":17,"passed_checks":3,"skipped_checks":0,"llgo_in_pr_diff":0},"status":"keep","description":"monitor PR after pushing cached build tags","timestamp":1777229234615,"segment":545,"confidence":null,"iterationTokens":451,"asi":{"hypothesis":"After pushing cached build tags, the new PR run should start without immediate failures and root llgo should remain absent from the diff.","result":"New PR checks: 0 failures, 17 pending, 3 passed, 0 skipped; root llgo absent from PR diff.","next_action_hint":"Poll later; continue local A/B experiments before any further source push."}}
{"type":"config","name":"Avoid copying immutable crosscompile flag slices in manifests","metricName":"collect_common_flags_ns_op","metricUnit":"","bestDirection":"lower"}
{"run":1080,"commit":"c9b57d2","metric":85,"metrics":{"collect_common_flags_bytes_op":176,"collect_common_flags_allocs_op":3,"collect_common_build_flags_ns_op":15298,"collect_common_build_flags_bytes_op":44005,"collect_common_build_flags_allocs_op":240,"runs":9},"status":"keep","description":"baseline collectCommonInputs crosscompile flags","timestamp":1777229277088,"segment":546,"confidence":null,"iterationTokens":1146,"asi":{"hypothesis":"collectCommonInputs copies crosscompile CCFLAGS/CFLAGS/LDFLAGS slices for every package manifest; these config slices are immutable during a build, so assigning them directly may remove repeated allocations while preserving manifest YAML content.","result":"Baseline collectCommonInputs with representative crosscompile flags median: 85 ns/op, 176 B/op, 3 allocs/op. collectCommonInputs+Build median: 15298 ns/op, 44005 B/op, 240 allocs/op."}}
{"run":1081,"commit":"c9b57d2","metric":36,"metrics":{"collect_common_flags_bytes_op":0,"collect_common_flags_allocs_op":0,"collect_common_build_flags_ns_op":15363,"collect_common_build_flags_bytes_op":43829,"collect_common_build_flags_allocs_op":237,"runs":9},"status":"discard","description":"avoid copying immutable crosscompile flag slices in manifests","timestamp":1777229380583,"segment":546,"confidence":null,"iterationTokens":2609,"asi":{"hypothesis":"Assigning immutable crosscompile flag slices directly into manifest common sections can remove repeated per-package slice-copy allocations without changing YAML content.","result":"internal/build tests passed and collectCommonInputs with representative flags improved from 85 ns/op, 176 B/op, 3 allocs/op to 36 ns/op, 0 B/op, 0 allocs/op. However collectCommonInputs+Build did not improve (15298 ns/op baseline vs 15363 ns/op changed), indicating the micro-win is swallowed by YAML manifest construction; the aliasing semantics are not worth keeping.","rollback_reason":"No primary end-to-end manifest-build improvement and introduces shared-slice aliasing assumptions for flag config.","next_action_hint":"Do not assign crosscompile flag slices directly unless a broader embedded-build profile shows collectCommonInputs slice copies as material; prefer immutable-copy clarity."}}
{"type":"config","name":"Record rejected direct crosscompile flag slices","metricName":"validation_failures","metricUnit":"","bestDirection":"lower"}
{"run":1082,"commit":"374b257","metric":0,"metrics":{"ideas_updated":1},"status":"keep","description":"record rejected direct crosscompile flag slices","timestamp":1777229406097,"segment":547,"confidence":null,"iterationTokens":185,"asi":{"hypothesis":"Record the rejected direct crosscompile flag slice assignment so future loops do not trade copy clarity for a flags-only microbenchmark win that did not improve full manifest Build.","result":"Ideas backlog records the 85ns->36ns flags-only win, 3->0 allocs, the 15298ns->15363ns collect+Build non-improvement, and aliasing-risk rationale."}}
{"type":"config","name":"Skip manifest build tag sorting when already sorted","metricName":"manifest_build_tags_ns_op","metricUnit":"","bestDirection":"lower"}
{"run":1083,"commit":"0dccb1a","metric":5487,"metrics":{"manifest_build_tags_bytes_op":18784,"manifest_build_tags_allocs_op":95,"manifest_build_unsorted_tags_ns_op":5452,"manifest_build_unsorted_tags_bytes_op":18784,"manifest_build_unsorted_tags_allocs_op":95,"runs":9},"status":"keep","description":"baseline manifest Build sorted tags","timestamp":1777229444656,"segment":548,"confidence":null,"iterationTokens":942,"asi":{"hypothesis":"After caching build tags sorted on the context, manifestBuilder.Build may spend unnecessary time sorting an already sorted BuildTags slice for every package; guard sorting with StringsAreSorted if it helps.","result":"Baseline sorted-tag Manifest Build median: 5487 ns/op, 18784 B/op, 95 allocs/op; unsorted-tag baseline was similar at 5452 ns/op."}}
{"run":1084,"commit":"0dccb1a","metric":5564,"metrics":{"manifest_build_tags_bytes_op":18784,"manifest_build_tags_allocs_op":95,"manifest_build_unsorted_tags_ns_op":5515,"manifest_build_unsorted_tags_bytes_op":18784,"manifest_build_unsorted_tags_allocs_op":95,"runs":9},"status":"discard","description":"skip manifest build tag sorting when already sorted","timestamp":1777229503199,"segment":548,"confidence":null,"iterationTokens":1722,"asi":{"hypothesis":"Guarding BuildTags sorting with sort.StringsAreSorted should avoid re-sorting the cached sorted build-tag slice in manifestBuilder.Build.","result":"internal/build tests passed, but sorted-tag Manifest Build regressed/noised from 5487 ns/op to 5564 ns/op; unsorted-tag benchmark also worsened from 5452 ns/op to 5515 ns/op.","rollback_reason":"Primary metric worsened; StringsAreSorted guard adds overhead instead of helping for tiny tag slices under YAML-dominated Build.","next_action_hint":"Keep the simple unconditional sort.Strings in manifestBuilder.Build."}}
{"type":"config","name":"Record rejected manifest build tag sort guard","metricName":"validation_failures","metricUnit":"","bestDirection":"lower"}
{"run":1085,"commit":"7a02699","metric":0,"metrics":{"ideas_updated":1},"status":"keep","description":"record rejected manifest build tag sort guard","timestamp":1777229521620,"segment":549,"confidence":null,"iterationTokens":174,"asi":{"hypothesis":"Record the rejected manifest BuildTags sort guard so future loops do not add StringsAreSorted around tiny tag slices.","result":"Ideas backlog records the sorted-tag 5487ns->5564ns regression/noise and the unsorted-tag 5452ns->5515ns regression."}}
{"type":"config","name":"Monitor PR while cached build tags CI progresses","metricName":"pr_check_failures","metricUnit":"","bestDirection":"lower"}
{"run":1086,"commit":"3e16231","metric":0,"metrics":{"pending_checks":41,"passed_checks":16,"skipped_checks":0,"llgo_in_pr_diff":0},"status":"keep","description":"monitor PR while cached build tags CI progresses","timestamp":1777229541480,"segment":550,"confidence":null,"iterationTokens":448,"asi":{"hypothesis":"The PR run after cached build tags should continue progressing without failures, and root llgo must stay absent from the PR diff.","result":"Current PR checks: 0 failures, 41 pending, 16 passed, 0 skipped; root llgo absent from PR diff.","next_action_hint":"Poll later for final status; continue local-only A/B experiments before further pushes."}}
{"type":"config","name":"Cache common environment manifest inputs","metricName":"collect_env_ns_op","metricUnit":"","bestDirection":"lower"}
{"run":1087,"commit":"e3b6f05","metric":608,"metrics":{"collect_env_bytes_op":1184,"collect_env_allocs_op":7,"collect_env_build_ns_op":10210,"collect_env_build_bytes_op":40241,"collect_env_build_allocs_op":134,"runs":9},"status":"keep","description":"baseline collectEnvInputs","timestamp":1777229585490,"segment":551,"confidence":null,"iterationTokens":1018,"asi":{"hypothesis":"collectEnvInputs recomputes identical environment manifest inputs for every package, including env.Version, runtime.Version, getLLVMVersion, and several os.Getenv calls; caching an envSection on the build context may remove repeated work while preserving per-build semantics.","result":"Baseline collectEnvInputs median: 608 ns/op, 1184 B/op, 7 allocs/op. collectEnvInputs+Common+Build median: 10210 ns/op, 40241 B/op, 134 allocs/op."}}
{"run":1088,"commit":"57b2415","metric":13,"metrics":{"collect_env_bytes_op":0,"collect_env_allocs_op":0,"collect_env_build_ns_op":9503,"collect_env_build_bytes_op":39055,"collect_env_build_allocs_op":127,"runs":9},"status":"keep","description":"cache common environment manifest inputs","timestamp":1777229673203,"segment":551,"confidence":null,"iterationTokens":3846,"asi":{"hypothesis":"Environment-related manifest inputs are per-build constants, so caching envSection on the build context should avoid repeated env.Version, runtime.Version, getLLVMVersion, and os.Getenv work for every package fingerprint.","result":"internal/build tests passed. collectEnvInputs improved from 608 ns/op, 1184 B/op, 7 allocs/op to 13 ns/op, 0 B/op, 0 allocs/op. collectEnvInputs+Common+Build improved from 10210 ns/op, 40241 B/op, 134 allocs/op to 9503 ns/op, 39055 B/op, 127 allocs/op.","next_action_hint":"Run broader validation and a temp cmd/llgo build before pushing."}}
{"type":"config","name":"Validate cached environment manifest inputs","metricName":"validation_failures","metricUnit":"","bestDirection":"lower"}
