{"run":861,"commit":"2feea18","metric":1,"metrics":{"pending_checks":1,"passed_checks":61,"skipped_checks":1,"llgo_in_pr_diff":0},"status":"keep","description":"monitor PR after QEMU rerun likely complete","timestamp":1777207099566,"segment":409,"confidence":null,"iterationTokens":449,"asi":{"hypothesis":"Re-check PR after waiting; the only remaining source-independent issues should be codecov/patch and possibly the rerun still pending.","result":"Status unchanged: 61 passed, 1 pending macOS Intel esp32 rerun, 1 skipped release, only codecov/patch failing, and root llgo absent from PR diff.","next_action_hint":"Continue source optimization locally; do not push further code unless local A/B shows clear gains and local tests pass."}}
{"type":"config","name":"Improve crosscompile patch coverage for PR checks","metricName":"compile_pkg_coverage_pct","metricUnit":"","bestDirection":"higher"}
{"run":862,"commit":"6755462","metric":70.4,"metrics":{},"status":"keep","description":"baseline compile package coverage for Codecov patch fix","timestamp":1777207297365,"segment":410,"confidence":null,"iterationTokens":271,"asi":{"hypothesis":"Codecov patch is failing because new CompileConfig/CompileGroup lines are undercovered, especially compileSingleGroupTasks. Establish local compile package coverage before adding targeted tests.","result":"go test ./internal/crosscompile/compile -cover reports 70.4% statement coverage; local function coverage earlier showed compileSingleGroupTasks at 0%."}}
{"run":863,"commit":"78c2658","metric":95.2,"metrics":{"crosscompile_pkg_coverage_pct":77.5},"status":"keep","description":"add targeted coverage for CompileConfig parallel paths","timestamp":1777207411041,"segment":410,"confidence":null,"iterationTokens":3271,"asi":{"hypothesis":"Adding tests for the previously uncovered single-group parallel worker path, parallel error paths, singleTaskGroup helper, and compileWithConfig error propagation should raise patch coverage enough to fix codecov/patch without reducing runtime/build coverage.","result":"Local coverage improved: internal/crosscompile/compile package coverage rose from 70.4% to 95.2%, and internal/crosscompile package coverage is 77.5%. go test ./internal/crosscompile/... passed.","next_action_hint":"Run focused sequential override and temp cmd/llgo build checks, then push this coverage-only CI fix if all pass."}}
{"type":"config","name":"Validate coverage fix locally before push","metricName":"validation_failures","metricUnit":"","bestDirection":"lower"}
{"run":864,"commit":"3613580","metric":0,"metrics":{"packages_tested":4,"temp_builds":1},"status":"keep","description":"validate coverage fix locally before push","timestamp":1777207428742,"segment":411,"confidence":null,"iterationTokens":219,"asi":{"hypothesis":"The coverage-only test additions should pass focused crosscompile tests, sequential override mode, and a temp-path cmd/llgo dev build without recreating the root llgo binary.","result":"LLGO_COMPILE_JOBS=1 go test ./internal/crosscompile/compile, go test ./internal/crosscompile/..., and go build -o <tmp> -tags=dev ./cmd/llgo all passed; root llgo was not created."}}
{"type":"config","name":"Monitor PR after pushing coverage fix","metricName":"pr_check_failures","metricUnit":"","bestDirection":"lower"}
{"run":865,"commit":"9c9b1e4","metric":0,"metrics":{"pending_checks":53,"passed_checks":4,"skipped_checks":0,"llgo_in_pr_diff":0},"status":"keep","description":"monitor PR after pushing coverage fix","timestamp":1777207527174,"segment":412,"confidence":null,"iterationTokens":450,"asi":{"hypothesis":"After pushing the local coverage fix, PR checks should restart without immediate source failures and root llgo should remain absent from the diff.","result":"New PR run started: 0 failures, 4 passed, 53 pending, root llgo absent from PR diff. Need continue monitoring until codecov/patch and crosscompile checks complete."}}
{"run":866,"commit":"0050f8f","metric":0,"metrics":{"pending_checks":49,"passed_checks":8,"skipped_checks":0,"llgo_in_pr_diff":0},"status":"keep","description":"monitor PR one minute after coverage fix push","timestamp":1777207616630,"segment":412,"confidence":null,"iterationTokens":1101,"asi":{"hypothesis":"The coverage-fix PR run should continue progressing without immediate failures.","result":"After one minute, PR has 0 failures, 8 passed, 49 pending; root llgo remains absent by prior diff check and no source diff changes were made locally."}}
{"run":867,"commit":"affbe8c","metric":0,"metrics":{"pending_checks":44,"passed_checks":13,"skipped_checks":0,"llgo_in_pr_diff":0},"status":"keep","description":"monitor PR three minutes after coverage fix push","timestamp":1777207754940,"segment":412,"confidence":null,"iterationTokens":1346,"asi":{"hypothesis":"The coverage-fix PR run should continue progressing without failures, and root llgo should remain absent from the diff.","result":"0 failures, 13 passed, 44 pending, root llgo absent from PR diff."}}
{"type":"config","name":"Avoid double manifest YAML build during fingerprint collection","metricName":"collect_fingerprint_ns_op","metricUnit":"","bestDirection":"lower"}
{"run":868,"commit":"9c9b1e4","metric":0,"metrics":{"runs":0},"status":"crash","description":"baseline collectFingerprint manifest benchmark harness","timestamp":1777207883499,"segment":413,"confidence":null,"iterationTokens":927,"asi":{"hypothesis":"Benchmark collectFingerprint to test whether avoiding the current Build()+Fingerprint() double YAML marshal would speed LLGo cache fingerprinting.","result":"The Go benchmark itself ran and showed about 123–124µs/op, but the shell harness failed while parsing output because Python stdin mixed parser code with benchmark text.","rollback_reason":"Harness parsing bug; no source changes should be inferred.","next_action_hint":"Retry with benchmark output saved to a temp file and parse that file. Also ensure the temporary benchmark file is removed before logging."}}
{"run":869,"commit":"b1cd7ee","metric":126488,"metrics":{"collect_fingerprint_allocs_op":1311,"runs":7},"status":"keep","description":"baseline collectFingerprint double manifest build","timestamp":1777207908570,"segment":413,"confidence":null,"iterationTokens":1546,"asi":{"hypothesis":"collectFingerprint currently calls m.Build() and then m.Fingerprint(), and Fingerprint calls Build again. Benchmark current behavior before hashing the already-built manifest string.","result":"Synthetic collectFingerprint benchmark median was 126488 ns/op and 1311 allocs/op across 7 runs."}}
{"run":870,"commit":"d25cb36","metric":69680,"metrics":{"collect_fingerprint_allocs_op":676,"runs":7},"status":"keep","description":"hash already-built manifest in collectFingerprint","timestamp":1777207978060,"segment":413,"confidence":null,"iterationTokens":1771,"asi":{"hypothesis":"collectFingerprint can avoid a second YAML marshal/allocation pass by hashing the manifest string it just built instead of calling m.Fingerprint(), which rebuilds the manifest.","result":"go test ./internal/build passed. Synthetic collectFingerprint benchmark improved from 126488 ns/op and 1311 allocs/op to 69680 ns/op and 676 allocs/op across 7 runs, roughly halving manifest fingerprint overhead with identical manifest content semantics.","next_action_hint":"Validate broader internal/build and temp cmd/llgo build before considering push after current CI settles."}}
{"type":"config","name":"Validate manifest fingerprint optimization locally","metricName":"validation_failures","metricUnit":"","bestDirection":"lower"}
{"run":871,"commit":"3789ffa","metric":0,"metrics":{"packages_tested":5,"temp_builds":1},"status":"keep","description":"validate manifest fingerprint optimization locally","timestamp":1777208024199,"segment":414,"confidence":null,"iterationTokens":206,"asi":{"hypothesis":"Hashing the already-built manifest should preserve cache manifest/fingerprint behavior while reducing duplicate YAML work; validate relevant packages and cmd/llgo temp build.","result":"go test ./internal/build, go test ./internal/crosscompile/..., and go build -o <tmp> -tags=dev ./cmd/llgo all passed; root llgo was not created."}}
{"run":872,"commit":"775c0ba","metric":0,"metrics":{"packages_tested":1,"temp_builds":1},"status":"keep","description":"validate fingerprint hash equivalence assertion","timestamp":1777208085017,"segment":414,"confidence":null,"iterationTokens":2734,"asi":{"hypothesis":"Add a focused assertion that collectFingerprint's stored fingerprint equals the hash of the stored manifest, then re-run internal/build tests and a temp cmd/llgo build.","result":"go test ./internal/build and go build -o <tmp> -tags=dev ./cmd/llgo passed; root llgo was not created."}}
{"type":"config","name":"Record kept manifest fingerprint optimization","metricName":"validation_failures","metricUnit":"","bestDirection":"lower"}
{"run":873,"commit":"cc778c0","metric":0,"metrics":{"ideas_updated":1},"status":"keep","description":"record kept manifest fingerprint optimization","timestamp":1777208113696,"segment":415,"confidence":null,"iterationTokens":168,"asi":{"hypothesis":"Record the kept collectFingerprint duplicate-YAML elimination so future loops know it is complete and benchmarked.","result":"Ideas backlog now records the manifest fingerprint optimization and its synthetic benchmark improvement."}}
{"type":"config","name":"Monitor PR after pushing fingerprint optimization","metricName":"pr_check_failures","metricUnit":"","bestDirection":"lower"}
{"run":874,"commit":"225062c","metric":0,"metrics":{"pending_checks":17,"passed_checks":3,"skipped_checks":0,"llgo_in_pr_diff":0},"status":"keep","description":"monitor PR after pushing fingerprint optimization","timestamp":1777208169495,"segment":416,"confidence":null,"iterationTokens":450,"asi":{"hypothesis":"After pushing the fingerprint optimization on top of the coverage fix, the new PR run should start without immediate failures and root llgo should stay absent from the diff.","result":"New PR run has 0 failures, 3 passed, 17 pending, root llgo absent from PR diff. Fewer checks are currently listed because the run is still starting."}}
{"run":875,"commit":"93974d4","metric":0,"metrics":{"pending_checks":45,"passed_checks":12,"skipped_checks":0,"llgo_in_pr_diff":0},"status":"keep","description":"monitor PR two minutes after fingerprint optimization push","timestamp":1777208314662,"segment":416,"confidence":null,"iterationTokens":1024,"asi":{"hypothesis":"The latest PR run should expand to the full check set and continue without failures after the fingerprint optimization push.","result":"0 failures, 12 passed, 45 pending, root llgo absent from PR diff."}}
{"run":876,"commit":"6838eeb","metric":0,"metrics":{"pending_checks":40,"passed_checks":17,"skipped_checks":0,"llgo_in_pr_diff":0},"status":"keep","description":"monitor PR five minutes after fingerprint optimization push","timestamp":1777208521892,"segment":416,"confidence":null,"iterationTokens":1189,"asi":{"hypothesis":"Latest PR run should keep progressing without failures after coverage and fingerprint changes.","result":"0 failures, 17 passed, 40 pending, root llgo absent from PR diff."}}
{"run":877,"commit":"c3765e6","metric":0,"metrics":{"pending_checks":31,"passed_checks":30,"skipped_checks":0,"llgo_in_pr_diff":0},"status":"keep","description":"monitor PR nine minutes after fingerprint optimization push","timestamp":1777208789209,"segment":416,"confidence":null,"iterationTokens":971,"asi":{"hypothesis":"Latest PR run should continue progressing; codecov should eventually report after coverage uploads.","result":"0 failures, 30 passed, 31 pending, root llgo absent from PR diff."}}
{"run":878,"commit":"64bfef5","metric":0,"metrics":{"pending_checks":25,"passed_checks":38,"skipped_checks":0,"llgo_in_pr_diff":0},"status":"keep","description":"monitor PR fourteen minutes after fingerprint optimization push","timestamp":1777209166539,"segment":416,"confidence":null,"iterationTokens":4180,"asi":{"hypothesis":"Latest PR run should remain failure-free while longer macOS/embedded checks continue.","result":"0 failures, 38 passed, 25 pending, root llgo absent from PR diff."}}
{"type":"config","name":"Verify codecov patch after coverage fix","metricName":"codecov_failures","metricUnit":"","bestDirection":"lower"}
{"run":879,"commit":"66e01e0","metric":0,"metrics":{"codecov_patch_pct":95.95,"codecov_project_pct":88.5},"status":"keep","description":"verify codecov patch after coverage fix","timestamp":1777209202134,"segment":417,"confidence":null,"iterationTokens":462,"asi":{"hypothesis":"Targeted crosscompile coverage tests should fix the prior codecov/patch failure without reducing project coverage.","result":"codecov/patch is now success at 95.95% diff hit vs 87.70% target; codecov/project is success at 88.50% (+0.79%)."}}
{"type":"config","name":"Monitor PR after codecov patch success","metricName":"pr_check_failures","metricUnit":"","bestDirection":"lower"}
{"run":880,"commit":"95f00d1","metric":0,"metrics":{"pending_checks":23,"passed_checks":40,"skipped_checks":1,"llgo_in_pr_diff":0},"status":"keep","description":"monitor PR after codecov patch success","timestamp":1777209222425,"segment":418,"confidence":null,"iterationTokens":447,"asi":{"hypothesis":"After confirming codecov patch success, remaining PR checks should be only pending long-running jobs with no failures.","result":"0 failures, 40 passed, 23 pending, 1 skipped release, root llgo absent from PR diff."}}
{"run":881,"commit":"1ee06a2","metric":0,"metrics":{"pending_checks":20,"passed_checks":43,"skipped_checks":1,"llgo_in_pr_diff":0},"status":"keep","description":"monitor PR after more long-running checks complete","timestamp":1777209540509,"segment":418,"confidence":null,"iterationTokens":1063,"asi":{"hypothesis":"Long-running checks should continue completing without failures after codecov patch success.","result":"0 failures, 43 passed, 20 pending, 1 skipped release, root llgo absent from PR diff."}}
{"run":882,"commit":"78028b3","metric":0,"metrics":{"pending_checks":15,"passed_checks":48,"skipped_checks":1,"llgo_in_pr_diff":0},"status":"keep","description":"monitor PR as emulator checks finish","timestamp":1777209980424,"segment":418,"confidence":null,"iterationTokens":1053,"asi":{"hypothesis":"After emulator checks finish, PR should still have no failures and only long macOS/embedded jobs pending.","result":"0 failures, 48 passed, 15 pending, 1 skipped release, root llgo absent from PR diff."}}
{"run":883,"commit":"5b564ba","metric":0,"metrics":{"pending_checks":9,"passed_checks":54,"skipped_checks":1,"llgo_in_pr_diff":0},"status":"keep","description":"monitor PR with nine checks remaining","timestamp":1777210357948,"segment":418,"confidence":null,"iterationTokens":1057,"asi":{"hypothesis":"Remaining long macOS/host-demo checks should continue completing without failures.","result":"0 failures, 54 passed, 9 pending, 1 skipped release, root llgo absent from PR diff."}}
{"run":884,"commit":"07c973f","metric":0,"metrics":{"pending_checks":4,"passed_checks":59,"skipped_checks":1,"llgo_in_pr_diff":0},"status":"keep","description":"monitor PR with four checks remaining","timestamp":1777210807191,"segment":418,"confidence":null,"iterationTokens":1614,"asi":{"hypothesis":"The last long macOS/host-demo checks should continue completing without failures.","result":"0 failures, 59 passed, 4 pending, 1 skipped release, root llgo absent from PR diff."}}
{"run":885,"commit":"58706af","metric":0,"metrics":{"pending_checks":2,"passed_checks":61,"skipped_checks":1,"llgo_in_pr_diff":0},"status":"keep","description":"monitor PR with two checks remaining","timestamp":1777211125074,"segment":418,"confidence":null,"iterationTokens":1040,"asi":{"hypothesis":"Only the final two macOS llgo checks remain; PR should still be failure-free.","result":"0 failures, 61 passed, 2 pending macOS llgo checks, 1 skipped release, root llgo absent from PR diff."}}
{"run":886,"commit":"ae131dd","metric":0,"metrics":{"pending_checks":0,"passed_checks":63,"skipped_checks":1,"llgo_in_pr_diff":0},"status":"keep","description":"monitor PR final all checks complete","timestamp":1777211384461,"segment":418,"confidence":null,"iterationTokens":1012,"asi":{"hypothesis":"Final PR check state after coverage fix and fingerprint optimization should have no failures or pending jobs, with root llgo absent from diff.","result":"All current PR checks completed: 0 failures, 0 pending, 63 passed, 1 skipped release. codecov/patch and codecov/project are both passing, and root llgo remains absent from PR diff."}}
{"type":"config","name":"Skip cache manifest remarshal when metadata is empty","metricName":"save_to_cache_ns_op","metricUnit":"","bestDirection":"lower"}
{"run":887,"commit":"eae78e1","metric":314572,"metrics":{"save_to_cache_allocs_op":247,"runs":7},"status":"keep","description":"baseline saveToCache empty metadata remarshal","timestamp":1777211529972,"segment":419,"confidence":null,"iterationTokens":846,"asi":{"hypothesis":"saveToCache decodes and re-marshals the whole manifest even when there is no metadata to add. Benchmark empty-metadata cache save before skipping that work.","result":"Synthetic BenchmarkSaveToCacheEmptyMetadata median was 314572 ns/op and 247 allocs/op across 7 runs."}}
{"run":888,"commit":"0c9ebe9","metric":295421,"metrics":{"save_to_cache_allocs_op":42,"runs":7},"status":"keep","description":"skip saveToCache manifest remarshal for empty metadata","timestamp":1777211586294,"segment":419,"confidence":null,"iterationTokens":1972,"asi":{"hypothesis":"When LinkArgs/NeedRt/NeedPyInit metadata are empty, saveToCache can write the already-built manifest directly and avoid decoding/re-marshaling YAML.","result":"go test ./internal/build passed. Synthetic empty-metadata saveToCache benchmark improved from 314572 ns/op and 247 allocs/op to 295421 ns/op and 42 allocs/op across 7 runs. Wall-time gain is modest (~6%) because file copy/write dominate, but allocation reduction is large and behavior for non-empty metadata is unchanged.","next_action_hint":"Add/verify a test that empty-metadata cache manifests remain identical to pkg.Manifest, then run local validation before pushing."}}
{"type":"config","name":"Validate empty-metadata cache manifest preservation","metricName":"validation_failures","metricUnit":"","bestDirection":"lower"}
{"run":889,"commit":"368e567","metric":0,"metrics":{"packages_tested":1,"temp_builds":1},"status":"keep","description":"validate empty-metadata cache manifest preservation","timestamp":1777211670108,"segment":420,"confidence":null,"iterationTokens":216,"asi":{"hypothesis":"The empty-metadata saveToCache fast path should preserve the exact previously-built manifest when there is no metadata to append.","result":"Added assertion in TestSaveToCache_Success that the written manifest equals pkg.Manifest for empty metadata. go test ./internal/build and temp-path go build -tags=dev ./cmd/llgo passed; root llgo was not created."}}
{"type":"config","name":"Record kept saveToCache empty metadata optimization","metricName":"validation_failures","metricUnit":"","bestDirection":"lower"}
{"run":890,"commit":"9d82eb0","metric":0,"metrics":{"ideas_updated":1},"status":"keep","description":"record kept saveToCache empty metadata optimization","timestamp":1777211694376,"segment":421,"confidence":null,"iterationTokens":181,"asi":{"hypothesis":"Record the kept empty-metadata saveToCache fast path so future iterations understand it is complete and benchmarked.","result":"Ideas backlog now records the saveToCache empty-metadata benchmark improvement and allocation reduction."}}
{"type":"config","name":"Monitor PR after pushing saveToCache optimization","metricName":"pr_check_failures","metricUnit":"","bestDirection":"lower"}
{"run":891,"commit":"bcadff4","metric":0,"metrics":{"pending_checks":53,"passed_checks":4,"skipped_checks":0,"llgo_in_pr_diff":0},"status":"keep","description":"monitor PR after pushing saveToCache optimization","timestamp":1777211778740,"segment":422,"confidence":null,"iterationTokens":452,"asi":{"hypothesis":"After pushing the saveToCache empty-metadata fast path, the PR run should start without immediate failures and root llgo should remain absent from the diff.","result":"New PR run has 0 failures, 4 passed, 53 pending, and root llgo absent from PR diff."}}
{"type":"config","name":"Fast path manifest metadata parse when absent","metricName":"parse_manifest_metadata_ns_op","metricUnit":"","bestDirection":"lower"}
{"run":892,"commit":"c78a36d","metric":50702,"metrics":{"parse_manifest_metadata_allocs_op":905,"runs":7},"status":"keep","description":"baseline parseManifestMetadata without metadata","timestamp":1777211823084,"segment":423,"confidence":null,"iterationTokens":724,"asi":{"hypothesis":"Cache-hit metadata parsing decodes the whole YAML manifest even when modern manifests have no metadata section. Benchmark current parseManifestMetadata on a representative no-metadata manifest before adding a safe absence fast path.","result":"BenchmarkParseManifestMetadataNoMetadata median was 50702 ns/op and 905 allocs/op across 7 runs."}}
{"run":893,"commit":"50521c5","metric":714,"metrics":{"parse_manifest_metadata_allocs_op":1,"runs":7},"status":"keep","description":"fast path parseManifestMetadata when metadata absent","timestamp":1777211886715,"segment":423,"confidence":null,"iterationTokens":1871,"asi":{"hypothesis":"Modern YAML manifests without a top-level metadata section can return empty cache metadata without unmarshalling the whole YAML document, while legacy INI manifests still fall back to the legacy parser.","result":"go test ./internal/build passed. BenchmarkParseManifestMetadataNoMetadata improved from 50702 ns/op and 905 allocs/op to 714 ns/op and 1 alloc/op across 7 runs.","next_action_hint":"Add focused tests for no-metadata YAML, metadata YAML, and legacy INI metadata before pushing."}}
