{"run":56,"commit":"c6b157e","metric":2,"metrics":{"hello_os":2,"hello_go_versions":1},"status":"keep","description":"remove no-op Go 1.21 hello workflow jobs","timestamp":1777038125553,"segment":7,"confidence":null,"iterationTokens":596,"asi":{"hypothesis":"The Go 1.21 hello matrix entries perform checkout/setup/install but skip the only hello test step due to the Go 1.24 condition. Removing them halves active hello jobs without reducing actual executed test coverage.","result":"hello_active_jobs dropped from 4 to 2; the Go 1.24 hello test still runs on both Linux and macOS."}}
{"type":"config","name":"Optimize llgo test shard redundant setup-go steps","metricName":"test_job_setup_go_steps","metricUnit":"","bestDirection":"lower"}
{"run":57,"commit":"6f9b1ae","metric":2,"metrics":{"test_go_versions":1},"status":"keep","description":"baseline setup-go steps in llgo test shard job","timestamp":1777038166207,"segment":8,"confidence":null,"iterationTokens":168,"asi":{"hypothesis":"The llgo test shard job has a single Go version in its matrix but still runs setup-go twice (build and testing), so step count can capture redundant setup work."}}
{"run":58,"commit":"dbc8638","metric":1,"metrics":{"test_go_versions":1},"status":"keep","description":"remove redundant setup-go step from llgo test shard job","timestamp":1777038203831,"segment":8,"confidence":null,"iterationTokens":440,"asi":{"hypothesis":"Because the llgo test shard matrix only uses Go 1.24.2, the build setup-go step already provides the same Go version for testing. Removing the second setup-go step preserves coverage and saves repeated CI setup/cache work across all shards.","result":"test_job_setup_go_steps dropped from 2 to 1 in the shard job."}}
{"type":"config","name":"Optimize llgo test shard Python dependency setup","metricName":"test_job_python_deps","metricUnit":"","bestDirection":"lower"}
{"run":59,"commit":"7fb1cc6","metric":2,"metrics":{"test_import_refs":0},"status":"keep","description":"baseline Python dependency count in llgo test shard job","timestamp":1777038246973,"segment":9,"confidence":null,"iterationTokens":182,"asi":{"hypothesis":"The llgo test shard job installs numpy and torch even though ./test/... has no numpy/torch/python imports; dependency count is a proxy for redundant CI setup work."}}
{"run":60,"commit":"9540abe","metric":0,"metrics":{"test_import_refs":0},"status":"keep","description":"remove demo-only Python dependency install from llgo test shard job","timestamp":1777038311309,"segment":9,"confidence":null,"iterationTokens":774,"asi":{"hypothesis":"The llgo test shard job only runs llgo test over ./test/...; repository search shows no numpy/torch/python imports there, so removing the demo-only pip install preserves actual test coverage while eliminating redundant setup in every shard.","result":"test_job_python_deps dropped from 2 to 0."}}
{"type":"config","name":"Optimize llgo test shard unused matrix dimensions","metricName":"unused_test_matrix_dims","metricUnit":"","bestDirection":"lower"}
{"run":61,"commit":"e38956a","metric":1,"metrics":{"test_jobs":8},"status":"keep","description":"baseline unused go matrix dimension in llgo test shard job","timestamp":1777038336127,"segment":10,"confidence":null,"iterationTokens":179,"asi":{"hypothesis":"After removing the redundant setup-go testing step, the llgo test shard job's go matrix dimension is unused and only adds workflow complexity."}}
{"run":62,"commit":"3517aa8","metric":0,"metrics":{"test_jobs":8},"status":"keep","description":"remove unused go matrix dimension from llgo test shard job","timestamp":1777038364641,"segment":10,"confidence":null,"iterationTokens":450,"asi":{"hypothesis":"The llgo test shard job now uses a fixed Go 1.24.2 setup and no longer references matrix.go, so removing the unused matrix dimension preserves job count and coverage while simplifying workflow expansion.","result":"unused_test_matrix_dims dropped from 1 to 0; test_jobs remains 2 OS x 4 shards = 8."}}
{"type":"config","name":"Optimize hello workflow redundant setup-go step","metricName":"hello_setup_go_steps","metricUnit":"","bestDirection":"lower"}
{"run":63,"commit":"d10fcd1","metric":2,"metrics":{"hello_go_versions":1},"status":"keep","description":"baseline setup-go steps in hello workflow","timestamp":1777038411154,"segment":11,"confidence":null,"iterationTokens":162,"asi":{"hypothesis":"After removing the no-op Go 1.21 hello matrix entries, the hello workflow has only Go 1.24.2 but still runs setup-go twice."}}
{"run":64,"commit":"967b0a1","metric":1,"metrics":{"hello_go_versions":1},"status":"keep","description":"remove redundant setup-go testing step from hello workflow","timestamp":1777038439891,"segment":11,"confidence":null,"iterationTokens":435,"asi":{"hypothesis":"The hello workflow now only tests Go 1.24.2, so the build setup-go step already provides the same Go version for the hello test. Removing the second setup-go preserves coverage and saves setup time.","result":"hello_setup_go_steps dropped from 2 to 1."}}
{"type":"config","name":"Validate current coverage-preserving core subset","metricName":"core_validation_seconds","metricUnit":"s","bestDirection":"lower"}
{"run":65,"commit":"102beab","metric":26.2,"metrics":{"internal_build_s":25.266,"crosscompile_s":1.375,"compile_s":0.732,"libc_s":0.864,"rtlib_s":2.065,"goembed_s":2.443},"status":"keep","description":"validation baseline for current coverage-preserving core subset","timestamp":1777038537779,"segment":12,"confidence":null,"iterationTokens":126,"asi":{"hypothesis":"Re-establish a validation baseline for the stable core test subset after workflow-focused CI changes, ensuring current code changes still pass without reducing ModeTest scopes."}}
{"run":66,"commit":"beb110c","metric":24.5,"metrics":{"internal_build_s":23.742,"crosscompile_s":3.521,"compile_s":3.981,"libc_s":2.993,"rtlib_s":1.791,"goembed_s":2.21},"status":"keep","description":"cache pkg-config cgo flag lookups within process","timestamp":1777038691083,"segment":12,"confidence":null,"iterationTokens":3922,"asi":{"hypothesis":"Repeated cgo pkg-config directives for the same package and environment spawn pkg-config twice each time. Caching parsed cflags/ldflags by package name and pkg-config environment preserves coverage/correctness while reducing repeated subprocess work in builds and tests.","result":"Stable core validation subset improved from 26.2s to 24.5s; expected to help cgo-heavy CI/demo builds."}}
{"run":67,"commit":"8815cb3","metric":22.7,"metrics":{"internal_build_s":22.092,"crosscompile_s":0.43,"compile_s":1,"libc_s":1.325,"rtlib_s":1.032,"goembed_s":1.183},"status":"keep","description":"confirmation rerun for pkg-config cgo cache","timestamp":1777038735392,"segment":12,"confidence":2.0588235294117654,"iterationTokens":635,"asi":{"hypothesis":"Confirm pkg-config cgo flag cache remains stable and beneficial on repeated core validation run.","result":"Repeat run passed and improved to 22.7s versus 26.2s validation baseline."}}
{"run":68,"commit":"8815cb3","metric":25.5,"metrics":{"internal_build_s":24.782,"crosscompile_s":1.256,"compile_s":0.766,"libc_s":1.656,"rtlib_s":2.654,"goembed_s":3.087},"status":"discard","description":"move cgo directive comment back above parseCgoDecl","timestamp":1777038855907,"segment":12,"confidence":4.117647058823531,"iterationTokens":3486,"asi":{"hypothesis":"Keep the pkg-config cache code readable by moving the cgo directive format comment back to parseCgoDecl.","result":"Run passed, but metric regressed relative to current best due noise; this is a formatting/readability-only change.","rollback_reason":"No primary improvement under experiment rules, though this cleanup may be desirable in final review.","next_action_hint":"If the comment remains misplaced in final diff, re-apply readability fix during cleanup."}}
{"type":"config","name":"Optimize hello workflow unused matrix dimension","metricName":"unused_hello_matrix_dims","metricUnit":"","bestDirection":"lower"}
{"run":69,"commit":"e4d38da","metric":1,"metrics":{"hello_jobs":2},"status":"keep","description":"baseline unused hello go matrix dimension","timestamp":1777038918942,"segment":13,"confidence":null,"iterationTokens":172,"asi":{"hypothesis":"After narrowing hello to Go 1.24 only and removing the second setup-go, the go matrix dimension is no longer needed; it can be simplified to a fixed version input without changing job count or coverage."}}
{"run":70,"commit":"a947d6c","metric":0,"metrics":{"hello_jobs":2},"status":"keep","description":"remove unused go matrix dimension from hello workflow","timestamp":1777038983099,"segment":13,"confidence":null,"iterationTokens":906,"asi":{"hypothesis":"The hello workflow now has a single Go version, so using a fixed go-version input removes an unused matrix dimension without changing the two OS jobs or reducing coverage. Also kept the cgo pkg-config cache comment attached to parseCgoDecl for readability.","result":"unused_hello_matrix_dims dropped from 1 to 0; hello_jobs remains 2."}}
{"type":"config","name":"Final current core validation after CI workflow cleanups","metricName":"final_core_seconds","metricUnit":"s","bestDirection":"lower"}
{"run":71,"commit":"5b06d0e","metric":21.7,"metrics":{"internal_build_s":21.164,"crosscompile_s":0.844,"compile_s":0.694,"libc_s":0.896,"rtlib_s":1.23,"goembed_s":1.103},"status":"keep","description":"final validation baseline for current core subset","timestamp":1777039071949,"segment":14,"confidence":null,"iterationTokens":128,"asi":{"hypothesis":"Validate the current accumulated coverage-preserving product/test changes after workflow cleanup experiments by rerunning the stable core test subset."}}
{"type":"config","name":"Improve LLVM version cache failure behavior","metricName":"llvm_empty_cache_stores","metricUnit":"","bestDirection":"lower"}
{"run":72,"commit":"e2bc446","metric":0,"metrics":{"static_detector_flawed":1},"status":"keep","description":"attempted baseline for LLVM empty-cache store check but detector was flawed","timestamp":1777039121211,"segment":15,"confidence":null,"iterationTokens":179,"asi":{"hypothesis":"Check whether getLLVMVersion stores empty detection results in the global cache; intended as a correctness/safety cleanup metric.","result":"The static detector returned 0 because it matched the early non-empty context cache guard, so this baseline is not useful.","next_action_hint":"If pursuing, use a more precise detector or simply inspect/edit getLLVMVersion manually."}}
{"type":"config","name":"Avoid caching empty LLVM version detections","metricName":"empty_llvm_global_store_sites","metricUnit":"","bestDirection":"lower"}
{"run":73,"commit":"29b6e75","metric":1,"metrics":{"get_llvm_version_sites":1},"status":"keep","description":"baseline empty LLVM version global cache store site","timestamp":1777039150570,"segment":16,"confidence":null,"iterationTokens":209,"asi":{"hypothesis":"getLLVMVersion currently stores the detected version in the global cache even when detection returns an empty string, which can make a transient clang lookup failure sticky for the process."}}
{"run":74,"commit":"f01d86d","metric":0,"metrics":{"get_llvm_version_sites":1},"status":"keep","description":"avoid globally caching empty LLVM version detection results","timestamp":1777039194052,"segment":16,"confidence":null,"iterationTokens":544,"asi":{"hypothesis":"Only cache non-empty LLVM version detections globally so transient clang lookup failures are not sticky; contexts still return the empty value for the current call, preserving behavior while improving robustness.","result":"empty_llvm_global_store_sites dropped from 1 to 0."}}
{"type":"config","name":"Post-cache-safety core validation","metricName":"post_safety_core_seconds","metricUnit":"s","bestDirection":"lower"}
{"run":75,"commit":"a9160ce","metric":23.3,"metrics":{"internal_build_s":22.558,"crosscompile_s":2.353,"compile_s":1.463,"libc_s":1.815,"rtlib_s":1.012,"goembed_s":2.624},"status":"keep","description":"validation baseline after LLVM cache safety tweak","timestamp":1777039250136,"segment":17,"confidence":null,"iterationTokens":127,"asi":{"hypothesis":"Validate stable core subset after changing LLVM version cache to avoid storing empty detections.","result":"Core subset passed."}}
{"type":"config","name":"Improve pkg-config cache environment key coverage","metricName":"pkg_config_untracked_env_classes","metricUnit":"","bestDirection":"lower"}
{"run":76,"commit":"d92cb3d","metric":1,"metrics":{"selected_pkg_config_envs":3},"status":"keep","description":"baseline pkg-config cache only tracks selected environment variables","timestamp":1777039318307,"segment":18,"confidence":null,"iterationTokens":184,"asi":{"hypothesis":"The pkg-config cache key currently tracks selected environment variables; untracked PKG_CONFIG_* variables such as sysroot settings could make cached flags stale if they change within a process."}}
{"run":77,"commit":"71db940","metric":0,"metrics":{"selected_pkg_config_envs":0},"status":"keep","description":"include all PKG_CONFIG environment variables in cache key","timestamp":1777039358723,"segment":18,"confidence":null,"iterationTokens":612,"asi":{"hypothesis":"Keying cached pkg-config results by all PKG_CONFIG* environment variables plus PATH prevents stale cache hits when sysroot, libdir, path, or other pkg-config controls change within a process, preserving correctness of the speed optimization.","result":"pkg_config_untracked_env_classes dropped from 1 to 0."}}
{"type":"config","name":"Validate pkg-config cache env-key final core","metricName":"envkey_core_seconds","metricUnit":"s","bestDirection":"lower"}
{"run":78,"commit":"628a041","metric":23.8,"metrics":{"internal_build_s":23.065,"crosscompile_s":1.474,"compile_s":1.256,"libc_s":1.616,"rtlib_s":1.98,"goembed_s":1.807},"status":"keep","description":"validation baseline after pkg-config env-key cache safety","timestamp":1777039416528,"segment":19,"confidence":null,"iterationTokens":128,"asi":{"hypothesis":"Validate stable core subset after broadening the pkg-config cache key to include all PKG_CONFIG* environment variables.","result":"Core subset passed."}}
{"type":"config","name":"Optimize targets workflow step count","metricName":"targets_build_steps","metricUnit":"","bestDirection":"lower"}
{"run":79,"commit":"4043059","metric":2,"metrics":{"target_variants":2},"status":"keep","description":"baseline separate targets workflow build steps","timestamp":1777039472771,"segment":20,"confidence":null,"iterationTokens":136,"asi":{"hypothesis":"The targets workflow builds two target variants in separate GitHub Actions steps, which adds step overhead while not increasing coverage beyond running both commands."}}
{"run":80,"commit":"60c2674","metric":1,"metrics":{"target_variants":2},"status":"keep","description":"combine targets workflow build variants into one step","timestamp":1777039501690,"segment":20,"confidence":null,"iterationTokens":425,"asi":{"hypothesis":"Running both target build variants in one step preserves coverage (both build.sh empty and build.sh defer still execute) while reducing GitHub Actions step overhead.","result":"targets_build_steps dropped from 2 to 1."}}
{"type":"config","name":"Validate shell syntax for CI scripts","metricName":"shell_syntax_failures","metricUnit":"","bestDirection":"lower"}
{"run":81,"commit":"d6805ae","metric":0,"metrics":{"scripts_checked":2},"status":"keep","description":"baseline shell syntax validation for changed CI scripts","timestamp":1777039562929,"segment":21,"confidence":null,"iterationTokens":148,"asi":{"hypothesis":"Validate shell syntax for modified CI helper scripts after workflow/test speed changes."}}
{"type":"config","name":"End-to-end stable core regression check","metricName":"stable_core_seconds","metricUnit":"s","bestDirection":"lower"}
{"run":82,"commit":"8fbb3c6","metric":24.1,"metrics":{"internal_build_s":23.514,"crosscompile_s":0.654,"compile_s":2.29,"libc_s":1.31,"rtlib_s":0.917,"goembed_s":2.56},"status":"keep","description":"end-to-end stable core regression check after CI and cache optimizations","timestamp":1777039645233,"segment":22,"confidence":null,"iterationTokens":126,"asi":{"hypothesis":"Run the stable core subset as a final regression check after accumulated workflow and build-cache related optimizations.","result":"Stable core subset passed."}}
{"run":83,"commit":"8fbb3c6","metric":26.8,"metrics":{"internal_build_s":26.266,"crosscompile_s":0.333,"compile_s":0.68,"libc_s":0.434,"rtlib_s":0.722,"goembed_s":0.956},"status":"discard","description":"repeat stable core subset after pruning stale ideas","timestamp":1777039744372,"segment":22,"confidence":null,"iterationTokens":126,"asi":{"hypothesis":"Confirm current stable core timing after pruning stale ideas from the backlog; no code change intended beyond autoresearch metadata.","result":"Run passed but was slower than stable_core_seconds baseline 24.1s, likely noise in internal/build integration tests.","rollback_reason":"No primary improvement; metadata-only pruning should not be committed as an optimization.","next_action_hint":"Continue exploring coverage-preserving optimizations; avoid relying on small timing deltas."}}
{"run":84,"commit":"8fbb3c6","metric":22.8,"metrics":{"internal_build_s":22.8,"crosscompile_s":0,"compile_s":0,"libc_s":0,"rtlib_s":0,"goembed_s":0},"status":"discard","description":"profile current internal/build test timings","timestamp":1777039808286,"segment":22,"confidence":null,"iterationTokens":923,"asi":{"hypothesis":"Measure current internal/build per-test timings to identify remaining bottlenecks while preserving full test coverage.","slow_tests":"TestTest 8.31s, TestExtest 5.17s, TestLdFlagsRewriteVars 2.41s, TestBuildDo_DepFingerprintAndVersion 1.39s, TestRunPrintfWithStdioNobuf 1.14s, TestLdFlagsRewriteVarsMainAlias 1.21s.","rollback_reason":"Profiling-only command is not the full stable core benchmark.","next_action_hint":"Remaining bottlenecks are ModeTest integration tests; reducing them without losing coverage likely requires product-level test build speedups or safe result caching rather than narrowing fixture scope."}}
{"type":"config","name":"Cover LLVM version cache without subprocess helper","metricName":"llvm_cache_test_subprocesses","metricUnit":"","bestDirection":"lower"}
{"run":85,"commit":"49ef53d","metric":0,"metrics":{"cache_test_exists":0},"status":"keep","description":"baseline for LLVM cache test subprocess count","timestamp":1777039904133,"segment":23,"confidence":null,"iterationTokens":923,"asi":{"hypothesis":"Establish a baseline before considering adding coverage for the LLVM version global cache without introducing subprocess-heavy tests. No such test currently exists, so subprocess count is 0."}}
{"type":"config","name":"Fix PR CI cl select interleaving failure","metricName":"cl_select_test_failures","metricUnit":"","bestDirection":"lower"}
{"run":86,"commit":"1f349a8","metric":1,"metrics":{"cl_select_seconds":3.4},"status":"keep","description":"baseline reproduces PR CI select interleaving failure","timestamp":1777040033306,"segment":24,"confidence":null,"iterationTokens":136,"asi":{"hypothesis":"Reproduce the failing PR CI test locally. The select fixture was updated during rebase to output deterministic send and receive checks, but the allowed-output list in cl/compile_test.go was not updated.","error_details":"TestRunFromTestgoSelectAllowsKnownInterleavings fails on output 100\\n200\\nch1\\nch2\\nexit\\n."}}
{"run":87,"commit":"a6fb9eb","metric":0,"metrics":{"cl_select_seconds":2.9},"status":"keep","description":"accept updated deterministic select fixture output in cl test","timestamp":1777040080488,"segment":24,"confidence":null,"iterationTokens":698,"asi":{"hypothesis":"Adding the updated select fixture output to the allowed-output set fixes the PR CI failure without reducing coverage; it reflects the current test fixture behavior after rebasing/updating cl/_testgo/select.","result":"Focused cl select test now passes."}}
{"type":"config","name":"Validate cl package after PR CI select fix","metricName":"cl_package_failures","metricUnit":"","bestDirection":"lower"}
{"run":88,"commit":"70dbd6b","metric":0,"metrics":{"cl_seconds":251.7},"status":"keep","description":"validate full cl package after select CI fix","timestamp":1777040369093,"segment":25,"confidence":null,"iterationTokens":119,"asi":{"hypothesis":"Run the full cl package tests to ensure the PR CI failure is fixed and no adjacent cl tests regress.","result":"go test ./cl passed in 251.7s."}}
{"type":"config","name":"Validate GitHub workflow YAML syntax","metricName":"workflow_yaml_failures","metricUnit":"","bestDirection":"lower"}
{"run":89,"commit":"cc1d8bf","metric":0,"metrics":{"workflow_files_checked":8},"status":"keep","description":"baseline workflow YAML syntax validation","timestamp":1777041343836,"segment":26,"confidence":null,"iterationTokens":162,"asi":{"hypothesis":"Validate that recent CI workflow edits remain syntactically valid YAML before continuing optimization."}}
{"type":"config","name":"Add lightweight LLVM version cache coverage","metricName":"llvm_cache_coverage_tests","metricUnit":"","bestDirection":"higher"}
{"run":90,"commit":"bd8652a","metric":0,"metrics":{"collect_test_files":1},"status":"keep","description":"baseline no explicit cross-context LLVM cache test","timestamp":1777041389763,"segment":27,"confidence":null,"iterationTokens":138,"asi":{"hypothesis":"The LLVM version global cache optimization lacks a direct lightweight test. Baseline count of explicit cross-context cache tests is zero."}}
