{"run":454,"commit":"14f3e6c","metric":2,"metrics":{"embedded_demo_job_seconds_go121":987},"status":"keep","description":"baseline macOS Intel embedded demo job runs both targets","timestamp":1777090129597,"segment":247,"confidence":null,"iterationTokens":195,"asi":{"hypothesis":"The macOS Intel embedded demo Go 1.21 split job is still above the 15m target because it runs both embedded targets. Splitting by target should preserve coverage and bring each embedded demo job under 15m."}}
{"run":455,"commit":"8d17c08","metric":1,"metrics":{"embedded_demo_job_seconds_go121":494,"fake_esp32_target_mentions":90,"fake_esp32c3_target_mentions":90},"status":"keep","description":"split macOS Intel embedded demos by target with local fake validation","timestamp":1777090190155,"segment":247,"confidence":null,"iterationTokens":2472,"asi":{"hypothesis":"Add an LLGO_EMBEDDED_TARGETS filter and split the macOS Intel embedded demo job by target. Local fake-llgo validation ensures the script runs the same embedded directory set for each target subset without requiring local QEMU.","result":"llgo.yml parses, test_demo.sh passes bash -n, fake validation exercised 90 directories for esp32 and 90 for esp32c3-basic. Each split target is predicted to be roughly half of the prior 16m27s Go 1.21 embedded job, plus unchanged setup, targeting under 15m."}}
{"type":"config","name":"Validate workflows after embedded target split","metricName":"workflow_validation_failures","metricUnit":"","bestDirection":"lower"}
{"run":456,"commit":"2aae06a","metric":0,"metrics":{"workflow_files_checked":8,"action_files_checked":5,"shell_scripts_checked":1},"status":"keep","description":"validate workflows after embedded target split","timestamp":1777090222723,"segment":248,"confidence":null,"iterationTokens":200,"asi":{"hypothesis":"Before submitting the target-split embedded demo refinement, validate workflow/action YAML and script syntax.","result":"All workflow/action YAML parsed and test_demo.sh passed bash -n."}}
{"type":"config","name":"Monitor PR after embedded target split push","metricName":"pr_check_failures","metricUnit":"","bestDirection":"lower"}
{"run":457,"commit":"f1644f0","metric":0,"metrics":{"pending_checks":38},"status":"keep","description":"monitor PR immediately after embedded target split push","timestamp":1777090260575,"segment":249,"confidence":null,"iterationTokens":244,"asi":{"hypothesis":"Immediately check CI after splitting macOS Intel embedded demos by target to bring the remaining 16m27s job under 15m.","result":"No failed checks observed; 38 checks pending immediately after push."}}
{"run":458,"commit":"706a6b0","metric":0,"metrics":{"pending_checks":29},"status":"keep","description":"monitor embedded target split after jobs started","timestamp":1777090460533,"segment":249,"confidence":null,"iterationTokens":892,"asi":{"hypothesis":"Wait for workflows to fan out after embedded target split and check for early failures.","result":"No failed checks observed; 29 checks pending."}}
{"run":459,"commit":"1d30491","metric":0,"metrics":{"pending_checks":24},"status":"keep","description":"monitor embedded target split after more runtime","timestamp":1777090777554,"segment":249,"confidence":null,"iterationTokens":907,"asi":{"hypothesis":"Continue monitoring embedded target split for failures while long jobs run.","result":"No failed checks observed; 24 checks remain pending."}}
{"run":460,"commit":"29c9f9c","metric":0,"metrics":{"pending_checks":18},"status":"keep","description":"monitor embedded target split with 18 checks pending","timestamp":1777091099639,"segment":249,"confidence":null,"iterationTokens":947,"asi":{"hypothesis":"Continue monitoring the target-split run; new embedded jobs should complete under 15m if the split is effective.","result":"No failed checks observed; 18 checks remain pending."}}
{"run":461,"commit":"997a897","metric":0,"metrics":{"pending_checks":14},"status":"keep","description":"monitor embedded target split with 14 checks pending","timestamp":1777091427177,"segment":249,"confidence":null,"iterationTokens":1429,"asi":{"hypothesis":"Continue monitoring the target-split embedded jobs and refined macOS Intel split for failures.","result":"No failed checks observed; 14 checks remain pending."}}
{"run":462,"commit":"7a9b636","metric":0,"metrics":{"pending_checks":12},"status":"keep","description":"monitor embedded target split with 12 checks pending","timestamp":1777091746463,"segment":249,"confidence":null,"iterationTokens":968,"asi":{"hypothesis":"Continue monitoring target-split run; still waiting for split macOS Intel and macOS test jobs.","result":"No failed checks observed; 12 checks remain pending."}}
{"type":"config","name":"Split macOS Intel embedded smoke by smoke type","metricName":"macos_intel_smoke_checks_per_job","metricUnit":"","bestDirection":"lower"}
{"run":463,"commit":"384f526","metric":3,"metrics":{"smoke_job_seconds_go121":1039},"status":"keep","description":"baseline macOS Intel smoke job combines export and ESP checks","timestamp":1777091798190,"segment":250,"confidence":null,"iterationTokens":194,"asi":{"hypothesis":"The refined smoke split still has a Go 1.21 smoke job over 15m because export and ESP emulator checks are combined. Splitting smoke by type should keep each task under 15m while preserving coverage."}}
{"run":464,"commit":"6d12e11","metric":2,"metrics":{"smoke_job_seconds_go121":780,"split_macos_intel_smoke_matrix_jobs":4},"status":"keep","description":"split macOS Intel embedded smoke checks by smoke type","timestamp":1777091847482,"segment":250,"confidence":null,"iterationTokens":2859,"asi":{"hypothesis":"Split macOS Intel embedded smoke into export-only and ESP-only jobs. Live step timings predict export-only and ESP-only jobs under 15m each, preserving all smoke checks while addressing the 17m19s Go 1.21 smoke job.","result":"llgo.yml parses and smoke matrix split is present with export/esp variants."}}
{"type":"config","name":"Validate workflows after smoke type split","metricName":"workflow_validation_failures","metricUnit":"","bestDirection":"lower"}
{"run":465,"commit":"d1e1807","metric":0,"metrics":{"workflow_files_checked":8,"action_files_checked":5,"shell_scripts_checked":1},"status":"keep","description":"validate workflows after smoke type split","timestamp":1777091868266,"segment":251,"confidence":null,"iterationTokens":200,"asi":{"hypothesis":"Before pushing the smoke-type split, validate all workflow/action YAML and script syntax.","result":"All workflow/action YAML parsed and test_demo.sh passed bash -n."}}
{"type":"config","name":"Monitor PR after smoke type split push","metricName":"pr_check_failures","metricUnit":"","bestDirection":"lower"}
{"run":466,"commit":"6a9bdb3","metric":0,"metrics":{"pending_checks":15},"status":"keep","description":"monitor PR immediately after smoke type split push","timestamp":1777091907479,"segment":252,"confidence":null,"iterationTokens":244,"asi":{"hypothesis":"Immediately check CI after pushing the smoke-type split intended to get remaining macOS Intel split tasks under 15m.","result":"No failed checks observed; 15 checks pending immediately after push."}}
{"run":467,"commit":"bf51f21","metric":0,"metrics":{"pending_checks":32},"status":"keep","description":"monitor smoke type split after jobs started","timestamp":1777092108394,"segment":252,"confidence":null,"iterationTokens":859,"asi":{"hypothesis":"Wait for workflows to fan out after smoke-type split and check for early failures.","result":"No failed checks observed; 32 checks pending."}}
{"run":468,"commit":"504703b","metric":0,"metrics":{"pending_checks":29},"status":"keep","description":"monitor smoke type split after more runtime","timestamp":1777092428174,"segment":252,"confidence":null,"iterationTokens":898,"asi":{"hypothesis":"Continue monitoring smoke-type split; new export/ESP matrix jobs are visible and pending.","result":"No failed checks observed; 29 checks pending."}}
{"run":469,"commit":"2416ba8","metric":0,"metrics":{"pending_checks":22},"status":"keep","description":"monitor smoke type split with 22 checks pending","timestamp":1777092752030,"segment":252,"confidence":null,"iterationTokens":959,"asi":{"hypothesis":"Continue monitoring smoke-type and target-split macOS Intel jobs for failures and durations.","result":"No failed checks observed; 22 checks pending."}}
{"run":470,"commit":"48fe2d7","metric":0,"metrics":{"pending_checks":14},"status":"keep","description":"monitor smoke type split with 14 checks pending","timestamp":1777093089835,"segment":252,"confidence":null,"iterationTokens":1549,"asi":{"hypothesis":"Continue monitoring split jobs; the first target-split embedded job has passed under 15m, and remaining jobs should do the same.","result":"No failed checks observed; 14 checks pending."}}
{"run":471,"commit":"bc3c24f","metric":0,"metrics":{"pending_checks":12,"split_macos_intel_over15_jobs":0,"split_macos_intel_completed_jobs":3,"split_macos_intel_max_seconds":734},"status":"keep","description":"measure partial split jobs after smoke type split","timestamp":1777093407514,"segment":252,"confidence":null,"iterationTokens":1172,"asi":{"hypothesis":"Measure completed split jobs after adding embedded target and smoke type splits; completed split jobs should be under 15m.","result":"No failures. Three split jobs completed and all are under 15m so far; max completed split job is 734s."}}
{"run":472,"commit":"c177caf","metric":0,"metrics":{"pending_checks":10,"split_macos_intel_over15_jobs":0,"split_macos_intel_completed_jobs":3,"split_macos_intel_max_seconds":734},"status":"keep","description":"monitor smoke type split with ten checks pending","timestamp":1777093728783,"segment":252,"confidence":null,"iterationTokens":1039,"asi":{"hypothesis":"Continue monitoring until all split macOS Intel jobs complete and confirm no split job exceeds 15m.","result":"No failures. Three split jobs completed under 15m; ten checks remain pending."}}
{"run":473,"commit":"d9ec77e","metric":0,"metrics":{"pending_checks":7,"split_macos_intel_over15_jobs":0,"split_macos_intel_completed_jobs":6,"split_macos_intel_max_seconds":794},"status":"keep","description":"monitor smoke type split with six split jobs completed","timestamp":1777094047231,"segment":252,"confidence":null,"iterationTokens":1038,"asi":{"hypothesis":"The target and smoke splits should keep completed macOS Intel split jobs below 15m.","result":"No failures. Six split jobs completed and all are under 15m; max completed split job is 794s."}}
{"run":474,"commit":"072b6e4","metric":0,"metrics":{"pending_checks":5,"split_macos_intel_over15_jobs":0,"split_macos_intel_completed_jobs":7,"split_macos_intel_max_seconds":847},"status":"keep","description":"monitor smoke type split with seven split jobs completed","timestamp":1777094367356,"segment":252,"confidence":null,"iterationTokens":1035,"asi":{"hypothesis":"Continue monitoring to final completion; completed macOS Intel split jobs should remain under 15m.","result":"No failures. Seven split jobs completed under 15m; max completed split job is 847s."}}
{"run":475,"commit":"220ae11","metric":0,"metrics":{"pending_checks":0,"split_macos_intel_over15_jobs":1,"split_macos_intel_completed_jobs":10,"split_macos_intel_max_seconds":1040},"status":"keep","description":"monitor smoke type split completed with one over-15 job remaining","timestamp":1777095294586,"segment":252,"confidence":null,"iterationTokens":1034,"asi":{"hypothesis":"Confirm the target+smoke split completes without failures and measure whether all macOS Intel split jobs are under the 15m target.","result":"Full CI run completed with no failures. Ten macOS Intel split jobs completed; one remains over 15m with max 1040s (~17m20s). Need identify the remaining over-15 job and decide whether to split or optimize it further."}}
{"type":"config","name":"Split macOS Intel host demos from main llgo job","metricName":"macos_intel_main_host_demo_steps","metricUnit":"","bestDirection":"lower"}
{"run":476,"commit":"9f9faca","metric":1,"metrics":{"macos_intel_main_go124_seconds":1040},"status":"keep","description":"baseline macOS Intel main llgo still runs host demos","timestamp":1777095357783,"segment":253,"confidence":null,"iterationTokens":171,"asi":{"hypothesis":"After embedded and smoke splits, the only remaining over-15 job is macOS Intel Go 1.24 main llgo at 17m20s, dominated by host demos. Splitting host demos out should leave main coverage/build checks and host demo checks each under 15m."}}
{"run":477,"commit":"989962f","metric":0,"metrics":{"macos_intel_main_go124_seconds":468,"split_macos_intel_host_jobs":1,"predicted_macos_intel_host_seconds":840},"status":"keep","description":"split macOS Intel host demos from main llgo job","timestamp":1777095408114,"segment":253,"confidence":null,"iterationTokens":2791,"asi":{"hypothesis":"Move macOS Intel host demos and cargs RPATH check into a dedicated host-demo job. The main macOS Intel llgo job keeps go install ./... coverage plus small checks; live step timings predict both the main and host-demo jobs under 15m.","result":"llgo.yml parses and test_demo.sh passes bash -n; macOS Intel main jobs no longer run host demos, and a dedicated host demo job is present."}}
{"type":"config","name":"Validate workflows after host demo split","metricName":"workflow_validation_failures","metricUnit":"","bestDirection":"lower"}
{"run":478,"commit":"2a570a4","metric":0,"metrics":{"workflow_files_checked":8,"action_files_checked":5,"shell_scripts_checked":1},"status":"keep","description":"validate workflows after host demo split","timestamp":1777095438243,"segment":254,"confidence":null,"iterationTokens":200,"asi":{"hypothesis":"Before submitting the macOS Intel host-demo split, validate all workflows/actions and demo scheduler syntax.","result":"All workflow/action YAML parsed and test_demo.sh passed bash -n."}}
{"type":"config","name":"Monitor PR after host demo split push","metricName":"pr_check_failures","metricUnit":"","bestDirection":"lower"}
{"run":479,"commit":"c5003f2","metric":0,"metrics":{"pending_checks":42},"status":"keep","description":"monitor PR immediately after host demo split push","timestamp":1777095536763,"segment":255,"confidence":null,"iterationTokens":244,"asi":{"hypothesis":"Check for early CI failures after pushing the macOS Intel host-demo split.","result":"No failed checks observed; 42 checks pending after workflow fan-out."}}
{"run":480,"commit":"79d5bcb","metric":0,"metrics":{"pending_checks":30,"split_macos_intel_over15_jobs":0,"split_macos_intel_completed_jobs":0,"split_macos_intel_max_seconds":0},"status":"keep","description":"monitor host demo split with 30 checks pending","timestamp":1777095847203,"segment":255,"confidence":null,"iterationTokens":244,"asi":{"hypothesis":"Wait for the host-demo split CI run to progress and watch for early failures.","result":"No failed checks observed; 30 checks pending, macOS Intel split jobs still running."}}
{"run":481,"commit":"79d5bcb","metric":1,"metrics":{"pending_checks":24,"split_macos_intel_over15_jobs":0,"split_macos_intel_completed_jobs":0,"split_macos_intel_max_seconds":0},"status":"checks_failed","description":"monitor host demo split found ubuntu llgo failure","timestamp":1777096168406,"segment":255,"confidence":null,"iterationTokens":1042,"asi":{"hypothesis":"Continue monitoring host-demo split; failures should remain zero while macOS Intel split jobs run.","result":"One failure appeared: llgo (ubuntu-latest, 19, 1.21.13).","rollback_reason":"CI failure appeared during monitoring; need inspect logs to determine whether related to host-demo split or pre-existing/flaky.","next_action_hint":"Fetch failed job logs for job 72990023575, reproduce or identify cause, then fix or revert the responsible change."}}
{"run":482,"commit":"c74db6e","metric":1,"metrics":{"pending_checks":24,"split_macos_intel_over15_jobs":0,"split_macos_intel_completed_jobs":0,"split_macos_intel_max_seconds":0},"status":"keep","description":"rerun transient ubuntu llgo compiler-rt download failure","timestamp":1777096238168,"segment":255,"confidence":null,"iterationTokens":27603,"asi":{"hypothesis":"The ubuntu Go 1.21 llgo failure was a transient GitHub 502 while downloading compiler-rt xtensa archive, not caused by the macOS host-demo split. Rerunning failed jobs should clear it.","result":"Triggered gh run rerun --failed for run 24923769223; failed status still visible immediately after rerun request while checks remain pending."}}
{"run":483,"commit":"487dff5","metric":1,"metrics":{"pending_checks":19,"split_macos_intel_over15_jobs":0,"split_macos_intel_completed_jobs":1,"split_macos_intel_max_seconds":866},"status":"keep","description":"monitor after rerunning transient ubuntu failure","timestamp":1777096550055,"segment":255,"confidence":null,"iterationTokens":1595,"asi":{"hypothesis":"After rerun request, PR checks should eventually replace the stale failed ubuntu check and continue macOS split jobs.","result":"No new macOS Intel split failure; one split job completed under 15m at 866s. The stale ubuntu failed check is still reported while 19 checks remain pending."}}
{"run":484,"commit":"3fa1bdb","metric":1,"metrics":{"pending_checks":16,"split_macos_intel_over15_jobs":0,"split_macos_intel_completed_jobs":2,"split_macos_intel_max_seconds":866},"status":"keep","description":"monitor rerun with two split jobs completed","timestamp":1777096870147,"segment":255,"confidence":null,"iterationTokens":1303,"asi":{"hypothesis":"Continue monitoring the rerun and split-job durations; stale ubuntu failure should clear after rerun completes.","result":"One stale ubuntu failure remains reported; 16 checks pending. Two macOS Intel split jobs completed under 15m, max 866s."}}
{"type":"config","name":"Retry transient crosscompile downloads","metricName":"download_retry_successes","metricUnit":"","bestDirection":"higher"}
{"run":485,"commit":"a3adf73","metric":0,"metrics":{},"status":"keep","description":"baseline crosscompile download has no retry","timestamp":1777096921172,"segment":256,"confidence":null,"iterationTokens":150,"asi":{"hypothesis":"The ubuntu CI failure was caused by a transient 502 when downloading compiler-rt. Baseline downloadFile fails immediately on non-200 status, making embedded CI vulnerable to transient upstream errors."}}
{"run":486,"commit":"73ad193","metric":1,"metrics":{},"status":"keep","description":"retry transient crosscompile archive downloads","timestamp":1777096948511,"segment":256,"confidence":null,"iterationTokens":2104,"asi":{"hypothesis":"Retry crosscompile archive downloads so transient upstream 502/connection errors do not fail embedded CI immediately. This directly addresses the ubuntu Go 1.21 failure downloading compiler-rt.","result":"Focused crosscompile download tests pass, including a new transient 502-then-success retry test."}}
{"type":"config","name":"Validate crosscompile retry fix","metricName":"validation_failures","metricUnit":"","bestDirection":"lower"}
{"run":487,"commit":"0c35add","metric":0,"metrics":{"crosscompile_packages_tested":4},"status":"keep","description":"validate crosscompile retry fix","timestamp":1777096963386,"segment":257,"confidence":null,"iterationTokens":158,"asi":{"hypothesis":"Run the broader crosscompile package tests and workflow YAML parse before pushing the download retry fix.","result":"internal/crosscompile/... tests passed and llgo workflow YAML parsed."}}
{"type":"config","name":"Monitor PR after download retry fix","metricName":"pr_check_failures","metricUnit":"","bestDirection":"lower"}
{"run":488,"commit":"a380250","metric":0,"metrics":{"pending_checks":16},"status":"keep","description":"monitor PR after pushing download retry fix","timestamp":1777096984089,"segment":258,"confidence":null,"iterationTokens":239,"asi":{"hypothesis":"After pushing the crosscompile download retry fix, the new PR run should start without immediate failures and should eventually replace the transient failed run.","result":"No failed checks observed on the new run; 16 checks pending."}}
{"run":489,"commit":"485ae30","metric":0,"metrics":{"pending_checks":31,"split_macos_intel_over15_jobs":0,"split_macos_intel_completed_jobs":0,"split_macos_intel_max_seconds":0},"status":"keep","description":"monitor download retry run after workflow fan-out","timestamp":1777097299572,"segment":258,"confidence":null,"iterationTokens":1103,"asi":{"hypothesis":"Continue monitoring the new run after workflow fan-out; failures should remain zero.","result":"No failed checks observed; 31 checks pending and macOS Intel split jobs are running."}}
{"run":490,"commit":"2ddfafa","metric":0,"metrics":{"pending_checks":23,"split_macos_intel_over15_jobs":0,"split_macos_intel_completed_jobs":0,"split_macos_intel_max_seconds":0},"status":"keep","description":"monitor download retry run with 23 checks pending","timestamp":1777097612861,"segment":258,"confidence":null,"iterationTokens":1077,"asi":{"hypothesis":"Continue monitoring the new retry-fix run; no failures should appear while split macOS Intel jobs are pending.","result":"No failed checks observed; 23 checks pending."}}
{"run":491,"commit":"42a3817","metric":0,"metrics":{"pending_checks":15,"split_macos_intel_over15_jobs":0,"split_macos_intel_completed_jobs":0,"split_macos_intel_max_seconds":0},"status":"keep","description":"resume monitoring retry-fix run with 15 checks pending","timestamp":1777097657278,"segment":258,"confidence":null,"iterationTokens":2902,"asi":{"hypothesis":"Resume after context-limit stop; retry-fix run should continue without failures and macOS Intel split jobs should complete under 15m.","result":"No failed checks observed; 15 checks remain pending, no macOS Intel split jobs completed yet in the current run."}}
