{"run":1169,"commit":"faefa10","metric":153,"metrics":{"parse_cgo_decl_bytes_op":192,"parse_cgo_decl_allocs_op":8,"parse_cgo_decl_ldflags_ns_op":122,"parse_cgo_decl_ldflags_bytes_op":160,"parse_cgo_decl_ldflags_allocs_op":7,"runs":9},"status":"discard","description":"optimize cgo directive parsing without SplitN","timestamp":1777234010572,"segment":614,"confidence":null,"iterationTokens":2003,"asi":{"hypothesis":"Replacing strings.SplitN with strings.IndexByte in parseCgoDecl can avoid a small slice allocation while preserving the existing first-token-ignored behavior.","result":"internal/build tests passed and parseCgoDecl CFLAGS improved from 161 ns/op, 224 B/op, 9 allocs/op to 153 ns/op, 192 B/op, 8 allocs/op; LDFLAGS improved from 130 ns/op to 122 ns/op. The absolute win is only ~8ns per cgo directive.","rollback_reason":"Too small to justify code churn in low-frequency cgo directive parsing.","next_action_hint":"Keep parseCgoDecl readability; do not micro-optimize directive tokenization unless cgo parsing appears in an end-to-end profile."}}
{"type":"config","name":"Record rejected parseCgoDecl SplitN replacement","metricName":"validation_failures","metricUnit":"","bestDirection":"lower"}
{"run":1170,"commit":"2c0871d","metric":0,"metrics":{"ideas_updated":1},"status":"keep","description":"record rejected parseCgoDecl SplitN replacement","timestamp":1777234047929,"segment":615,"confidence":null,"iterationTokens":182,"asi":{"hypothesis":"Record the rejected parseCgoDecl SplitN replacement so future loops avoid spending effort on an 8ns cgo directive parser micro-win.","result":"Ideas backlog records the 161ns->153ns result and too-small rejection."}}
{"type":"config","name":"Monitor PR cgo preamble scanning progress","metricName":"pr_check_failures","metricUnit":"","bestDirection":"lower"}
{"run":1171,"commit":"07b6375","metric":0,"metrics":{"pending_checks":42,"passed_checks":16,"skipped_checks":0,"llgo_in_pr_diff":0},"status":"keep","description":"monitor PR cgo preamble scanning progress","timestamp":1777234083858,"segment":616,"confidence":null,"iterationTokens":448,"asi":{"hypothesis":"The PR run after cgo preamble line scanning should keep progressing without failures and root llgo should remain absent from the diff.","result":"Current PR checks: 0 failures, 42 pending, 16 passed, 0 skipped; root llgo absent from PR diff.","next_action_hint":"Poll later for completion; continue local experiments with meaningful source hypotheses."}}
{"type":"config","name":"Pre-grow cgo preamble builder","metricName":"parse_cgo_preamble_ns_op","metricUnit":"","bestDirection":"lower"}
{"run":1172,"commit":"dedac77","metric":750,"metrics":{"parse_cgo_preamble_bytes_op":1208,"parse_cgo_preamble_allocs_op":28,"runs":9},"status":"keep","description":"baseline cgo preamble builder growth","timestamp":1777234134697,"segment":617,"confidence":null,"iterationTokens":692,"asi":{"hypothesis":"parseCgoPreamble writes predictable output roughly proportional to input text plus line directives; pre-growing the strings.Builder might reduce reallocations.","result":"Baseline parseCgoPreamble median before builder Grow: 750 ns/op, 1208 B/op, 28 allocs/op."}}
{"run":1173,"commit":"725cc4a","metric":673,"metrics":{"parse_cgo_preamble_bytes_op":944,"parse_cgo_preamble_allocs_op":23,"runs":9},"status":"keep","description":"pre-grow cgo preamble builder","timestamp":1777234195253,"segment":617,"confidence":null,"iterationTokens":1365,"asi":{"hypothesis":"Pre-growing the cgo preamble strings.Builder to the input size plus line-directive headroom should avoid repeated builder reallocations while preserving output.","result":"internal/build tests passed. parseCgoPreamble improved from 750 ns/op, 1208 B/op, 28 allocs/op to 673 ns/op, 944 B/op, 23 allocs/op across 9 runs.","next_action_hint":"Run broad validation before pushing; consider whether the +64 headroom is sufficient/conservative for typical directive output."}}
{"type":"config","name":"Validate cgo preamble builder pre-grow","metricName":"validation_failures","metricUnit":"","bestDirection":"lower"}
{"run":1174,"commit":"ade31c1","metric":0,"metrics":{"packages_tested":5,"temp_builds":1},"status":"keep","description":"validate cgo preamble builder pre-grow","timestamp":1777234249848,"segment":618,"confidence":null,"iterationTokens":289,"asi":{"hypothesis":"Pre-growing the cgo preamble builder should preserve output and pass focused/broad validation plus temp cmd/llgo build.","result":"go test ./internal/build, go test ./internal/crosscompile/..., and temp-path go build -tags=dev ./cmd/llgo passed; root llgo was not created."}}
{"type":"config","name":"Record cgo preamble builder pre-grow","metricName":"validation_failures","metricUnit":"","bestDirection":"lower"}
{"run":1175,"commit":"734e6a6","metric":0,"metrics":{"ideas_updated":1},"status":"keep","description":"record cgo preamble builder pre-grow","timestamp":1777234289437,"segment":619,"confidence":null,"iterationTokens":183,"asi":{"hypothesis":"Record the cgo preamble builder pre-grow optimization so future loops know builder allocation has been reduced.","result":"Ideas backlog records the 750ns/op to 673ns/op improvement and allocation drop from 28 to 23."}}
{"type":"config","name":"Monitor PR after pushing cgo builder pre-grow","metricName":"pr_check_failures","metricUnit":"","bestDirection":"lower"}
{"run":1176,"commit":"ece5dce","metric":0,"metrics":{"pending_checks":46,"passed_checks":2,"skipped_checks":0,"llgo_in_pr_diff":0},"status":"keep","description":"monitor PR after pushing cgo builder pre-grow","timestamp":1777234357790,"segment":620,"confidence":null,"iterationTokens":453,"asi":{"hypothesis":"After pushing the cgo preamble builder pre-grow, the new PR run should start without immediate failures and root llgo should remain absent from the diff.","result":"New PR checks: 0 failures, 46 pending, 2 passed, 0 skipped; root llgo absent from PR diff.","next_action_hint":"Poll later for completion; continue local A/B experiments before further source pushes."}}
{"type":"config","name":"Monitor PR cgo builder pre-grow progress","metricName":"pr_check_failures","metricUnit":"","bestDirection":"lower"}
{"run":1177,"commit":"23ee7e3","metric":0,"metrics":{"pending_checks":53,"passed_checks":5,"skipped_checks":0,"llgo_in_pr_diff":0},"status":"keep","description":"monitor PR cgo builder pre-grow progress","timestamp":1777234393303,"segment":621,"confidence":null,"iterationTokens":448,"asi":{"hypothesis":"The PR run after cgo builder pre-grow should continue without failures and root llgo should stay absent from the diff.","result":"Current PR checks: 0 failures, 53 pending, 5 passed, 0 skipped; root llgo absent from PR diff.","next_action_hint":"Poll later for completion; continue local experiments with clear local evidence."}}
{"type":"config","name":"Monitor PR cgo builder pre-grow later progress","metricName":"pr_check_failures","metricUnit":"","bestDirection":"lower"}
{"run":1178,"commit":"2e5ed9b","metric":0,"metrics":{"pending_checks":49,"passed_checks":9,"skipped_checks":0,"llgo_in_pr_diff":0},"status":"keep","description":"monitor PR cgo builder pre-grow later progress","timestamp":1777234451884,"segment":622,"confidence":null,"iterationTokens":449,"asi":{"hypothesis":"The PR run after cgo builder pre-grow should continue without failures and root llgo should remain absent from the diff.","result":"Current PR checks: 0 failures, 49 pending, 9 passed, 0 skipped; root llgo absent from PR diff.","next_action_hint":"Poll later for completion; continue local A/B only for meaningful source hypotheses."}}
{"type":"config","name":"Check clean cmd llgo go-build after cgo preamble changes","metricName":"clean_go_build_ms","metricUnit":"ms","bestDirection":"lower"}
{"run":1179,"commit":"94b2ec6","metric":10200,"metrics":{"runs":3},"status":"keep","description":"check clean cmd/llgo go-build after cgo preamble changes","timestamp":1777234512680,"segment":623,"confidence":null,"iterationTokens":419,"asi":{"hypothesis":"After cgo preamble parsing micro-optimizations, isolated clean go build of cmd/llgo should remain healthy and in the recent improved/noise band without creating a root llgo binary.","result":"Three isolated clean go build samples were 11090ms, 10120ms, and 10200ms; median 10200ms. This remains below the original 10594ms baseline but samples are noisy, so use as a health/plausibility check only. Root llgo was not created."}}
{"type":"config","name":"Monitor PR after cgo clean-build health check","metricName":"pr_check_failures","metricUnit":"","bestDirection":"lower"}
{"run":1180,"commit":"f27cd36","metric":0,"metrics":{"pending_checks":42,"passed_checks":16,"skipped_checks":0,"llgo_in_pr_diff":0},"status":"keep","description":"monitor PR after cgo clean-build health check","timestamp":1777234541005,"segment":624,"confidence":null,"iterationTokens":449,"asi":{"hypothesis":"The PR run after cgo preamble builder pre-grow should continue progressing after the clean-build health check, and root llgo should remain absent from the diff.","result":"Current PR checks: 0 failures, 42 pending, 16 passed, 0 skipped; root llgo absent from PR diff.","next_action_hint":"Poll later for completion; continue local build-performance experiments."}}
{"type":"config","name":"Monitor PR cgo builder pre-grow continued","metricName":"pr_check_failures","metricUnit":"","bestDirection":"lower"}
{"run":1181,"commit":"120c3bd","metric":0,"metrics":{"pending_checks":41,"passed_checks":17,"skipped_checks":0,"llgo_in_pr_diff":0},"status":"keep","description":"monitor PR cgo builder pre-grow continued","timestamp":1777234573207,"segment":625,"confidence":null,"iterationTokens":448,"asi":{"hypothesis":"The PR run after cgo builder pre-grow should keep progressing without failures and root llgo should remain absent from the diff.","result":"Current PR checks: 0 failures, 41 pending, 17 passed, 0 skipped; root llgo absent from PR diff.","next_action_hint":"Poll later for completion; continue local A/B experiments."}}
{"type":"config","name":"Manual parse cgo extern symbol names","metricName":"collect_cgo_symbols_ns_op","metricUnit":"","bestDirection":"lower"}
{"run":1182,"commit":"275a33e","metric":1900,"metrics":{"collect_cgo_symbols_bytes_op":1881,"collect_cgo_symbols_allocs_op":20,"runs":9},"status":"keep","description":"baseline collectCgoSymbols regexp parsing","timestamp":1777234665460,"segment":626,"confidence":null,"iterationTokens":729,"asi":{"hypothesis":"collectCgoSymbols uses a regexp to parse generated _cgo_* symbol names for every extern; a manual parser for the fixed generated format may reduce cgo setup cost while preserving Cmalloc and __cgo callback handling.","result":"Baseline collectCgoSymbols median for representative externs: 1900 ns/op, 1881 B/op, 20 allocs/op."}}
{"run":1183,"commit":"0b7ccfe","metric":634,"metrics":{"collect_cgo_symbols_bytes_op":984,"collect_cgo_symbols_allocs_op":6,"runs":9},"status":"keep","description":"manual parse cgo extern symbol names","timestamp":1777234733768,"segment":626,"confidence":null,"iterationTokens":2472,"asi":{"hypothesis":"The generated _cgo_hash_(Cfunc|C2func|Cmacro)_name format is simple enough to parse with string indexes instead of a regexp, reducing collectCgoSymbols overhead while preserving malloc fix and __cgo callback handling.","result":"internal/build tests passed. collectCgoSymbols improved from 1900 ns/op, 1881 B/op, 20 allocs/op to 634 ns/op, 984 B/op, 6 allocs/op across 9 runs.","next_action_hint":"Add focused tests for malformed _cgo symbols and Cmalloc fix, then validate broadly before pushing."}}
{"type":"config","name":"Validate manual cgo extern symbol parsing","metricName":"validation_failures","metricUnit":"","bestDirection":"lower"}
{"run":1184,"commit":"fe859f4","metric":0,"metrics":{"packages_tested":5,"temp_builds":1},"status":"keep","description":"validate manual cgo extern symbol parsing","timestamp":1777234840746,"segment":627,"confidence":null,"iterationTokens":308,"asi":{"hypothesis":"Manual cgo extern symbol parsing should preserve package-prefix stripping, Cmalloc fix, __cgo callback handling, reject malformed generated names, and build cleanly.","result":"Extended TestCollectCgoSymbolsStripsPackagePrefix with malformed generated names and direct parseCgoExternSymbol coverage. go test ./internal/build, go test ./internal/crosscompile/..., and temp-path go build -tags=dev ./cmd/llgo passed; root llgo was not created."}}
{"type":"config","name":"Record manual cgo extern symbol parsing","metricName":"validation_failures","metricUnit":"","bestDirection":"lower"}
{"run":1185,"commit":"5d0e1f5","metric":0,"metrics":{"ideas_updated":1},"status":"keep","description":"record manual cgo extern symbol parsing","timestamp":1777234893799,"segment":628,"confidence":null,"iterationTokens":180,"asi":{"hypothesis":"Record the manual collectCgoSymbols parser optimization so future loops know the regexp dependency in this hot cgo helper has been removed.","result":"Ideas backlog records the 1900ns/op to 634ns/op improvement, allocation drop from 20 to 6, and malformed-name/Cmalloc test coverage."}}
{"type":"config","name":"Monitor PR after pushing manual cgo extern parsing","metricName":"pr_check_failures","metricUnit":"","bestDirection":"lower"}
{"run":1186,"commit":"db2e199","metric":0,"metrics":{"pending_checks":54,"passed_checks":4,"skipped_checks":0,"llgo_in_pr_diff":0},"status":"keep","description":"monitor PR after pushing manual cgo extern parsing","timestamp":1777234987158,"segment":629,"confidence":null,"iterationTokens":453,"asi":{"hypothesis":"After pushing manual cgo extern symbol parsing, the new PR run should start without immediate failures and root llgo should remain absent from the diff.","result":"New PR checks: 0 failures, 54 pending, 4 passed, 0 skipped; root llgo absent from PR diff.","next_action_hint":"Poll later for completion; continue local A/B experiments before further source pushes."}}
{"type":"config","name":"Check clean cmd llgo go-build after manual cgo extern parsing","metricName":"clean_go_build_ms","metricUnit":"ms","bestDirection":"lower"}
{"run":1187,"commit":"6a0a867","metric":10280,"metrics":{"runs":3},"status":"keep","description":"check clean cmd/llgo go-build after manual cgo extern parsing","timestamp":1777235047943,"segment":630,"confidence":null,"iterationTokens":419,"asi":{"hypothesis":"After removing regexp-based cgo extern parsing from internal/build, isolated clean go build of cmd/llgo should remain healthy and in the recent improved/noise band without creating a root llgo binary.","result":"Three isolated clean go build samples were 10940ms, 10160ms, and 10280ms; median 10280ms. This remains below the original 10594ms baseline but is noisy, so use as a health/plausibility check only. Root llgo was not created."}}
{"type":"config","name":"Monitor PR after cgo extern clean-build check","metricName":"pr_check_failures","metricUnit":"","bestDirection":"lower"}
{"run":1188,"commit":"6981b6a","metric":0,"metrics":{"pending_checks":44,"passed_checks":14,"skipped_checks":0,"llgo_in_pr_diff":0},"status":"keep","description":"monitor PR after cgo extern clean-build check","timestamp":1777235081270,"segment":631,"confidence":null,"iterationTokens":449,"asi":{"hypothesis":"The PR run after manual cgo extern parsing should keep progressing after the clean-build health check, and root llgo should remain absent from the diff.","result":"Current PR checks: 0 failures, 44 pending, 14 passed, 0 skipped; root llgo absent from PR diff.","next_action_hint":"Poll later for completion; continue local experiments only with clear evidence."}}
{"type":"config","name":"Monitor PR manual cgo extern parsing progress","metricName":"pr_check_failures","metricUnit":"","bestDirection":"lower"}
{"run":1189,"commit":"364443f","metric":0,"metrics":{"pending_checks":41,"passed_checks":17,"skipped_checks":0,"llgo_in_pr_diff":0},"status":"keep","description":"monitor PR manual cgo extern parsing progress","timestamp":1777235139695,"segment":632,"confidence":null,"iterationTokens":448,"asi":{"hypothesis":"The PR run after manual cgo extern parsing should continue progressing without failures and root llgo should remain absent from the diff.","result":"Current PR checks: 0 failures, 41 pending, 17 passed, 0 skipped; root llgo absent from PR diff.","next_action_hint":"Poll later for completion; continue local A/B experiments before further source pushes."}}
{"type":"config","name":"Monitor PR manual cgo extern parsing later progress","metricName":"pr_check_failures","metricUnit":"","bestDirection":"lower"}
{"run":1190,"commit":"dc854de","metric":0,"metrics":{"pending_checks":41,"passed_checks":17,"skipped_checks":0,"llgo_in_pr_diff":0},"status":"keep","description":"monitor PR manual cgo extern parsing later progress","timestamp":1777235174353,"segment":633,"confidence":null,"iterationTokens":449,"asi":{"hypothesis":"The PR run after manual cgo extern parsing should keep progressing without failures and root llgo should remain absent from the diff.","result":"Current PR checks: 0 failures, 41 pending, 17 passed, 0 skipped; root llgo absent from PR diff.","next_action_hint":"Poll later for completion; continue local experiments."}}
{"type":"config","name":"Optimize cached pkg-config key construction","metricName":"cached_pkg_config_hit_ns_op","metricUnit":"","bestDirection":"lower"}
{"run":1191,"commit":"bef5df3","metric":383,"metrics":{"cached_pkg_config_hit_bytes_op":2096,"cached_pkg_config_hit_allocs_op":4,"runs":9},"status":"keep","description":"baseline cached pkg-config hit","timestamp":1777235224721,"segment":634,"confidence":null,"iterationTokens":808,"asi":{"hypothesis":"cachedPkgConfig cache hits still rebuild a key from PATH and PKG_CONFIG environment variables; optimizing key construction or caching the environment suffix might reduce repeated cgo pkg-config directive overhead.","result":"Baseline cachedPkgConfig hit median: 383 ns/op, 2096 B/op, 4 allocs/op."}}
{"type":"config","name":"Record skipped cached pkg-config key optimization","metricName":"validation_failures","metricUnit":"","bestDirection":"lower"}
{"run":1192,"commit":"4fe8736","metric":0,"metrics":{"ideas_updated":1,"pr_body_updated":1},"status":"keep","description":"record skipped cached pkg-config key optimization and PR runtime update","timestamp":1777249075336,"segment":635,"confidence":null,"iterationTokens":178,"asi":{"hypothesis":"Record that cachedPkgConfig key construction was skipped because preserving exact environment-sensitive semantics via os.Environ dominates the measured hit cost, and verify the requested additive PR runtime section was added.","result":"Ideas backlog records cachedPkgConfig as not pursued; PR body now includes the post cgo parsing runtime snapshot with total runner time 5h30m27s and wall time 53m03s.","next_action_hint":"Do not push metadata-only commits if it would unnecessarily rerun PR CI; current PR source head remains 5d0e1f58."}}
{"type":"config","name":"Optimize cgo extern parser constants","metricName":"collect_cgo_symbols_ns_op","metricUnit":"","bestDirection":"lower"}
{"run":1193,"commit":"126fbe9","metric":628,"metrics":{"collect_cgo_symbols_bytes_op":984,"collect_cgo_symbols_allocs_op":6,"runs":9},"status":"keep","description":"baseline cgo extern parser constants","timestamp":1777250467543,"segment":636,"confidence":null,"iterationTokens":728,"asi":{"hypothesis":"parseCgoExternSymbol currently builds candidate marker strings while scanning fixed generated cgo symbol kinds; replacing those with constant prefix checks might reduce collectCgoSymbols allocations and time.","result":"Baseline collectCgoSymbols median before constant prefix switch: 628 ns/op, 984 B/op, 6 allocs/op."}}
{"run":1194,"commit":"474a410","metric":536,"metrics":{"collect_cgo_symbols_bytes_op":984,"collect_cgo_symbols_allocs_op":6,"runs":9},"status":"keep","description":"use constant prefixes in cgo extern parser","timestamp":1777250520919,"segment":636,"confidence":null,"iterationTokens":1655,"asi":{"hypothesis":"Avoiding per-candidate marker construction in parseCgoExternSymbol should speed up fixed-format cgo extern symbol parsing without semantic changes.","result":"internal/build tests passed. collectCgoSymbols improved from 628 ns/op to 536 ns/op across 9 runs; bytes and allocations remained 984 B/op and 6 allocs/op.","next_action_hint":"Validate broadly before pushing; if keeping, record as a minor follow-up to manual cgo extern parsing."}}
{"type":"config","name":"Validate cgo extern constant prefix parser","metricName":"validation_failures","metricUnit":"","bestDirection":"lower"}
{"run":1195,"commit":"20be716","metric":0,"metrics":{"packages_tested":5,"temp_builds":1},"status":"keep","description":"validate cgo extern constant prefix parser","timestamp":1777250571533,"segment":637,"confidence":null,"iterationTokens":264,"asi":{"hypothesis":"Constant-prefix cgo extern parser should preserve behavior and pass focused/broad validation plus temp cmd/llgo build without creating a root llgo binary.","result":"go test ./internal/build, go test ./internal/crosscompile/..., and temp-path go build -tags=dev ./cmd/llgo passed; root llgo was not created."}}
{"type":"config","name":"Record cgo extern constant prefix parser","metricName":"validation_failures","metricUnit":"","bestDirection":"lower"}
{"run":1196,"commit":"33a53a9","metric":0,"metrics":{"ideas_updated":1},"status":"keep","description":"record cgo extern constant prefix parser","timestamp":1777250595466,"segment":638,"confidence":null,"iterationTokens":178,"asi":{"hypothesis":"Record the cgo extern constant-prefix parser follow-up so future loops know this micro-path has been tried and kept.","result":"Ideas backlog records the 628ns/op to 536ns/op follow-up improvement with unchanged allocations."}}
