{"type":"config","name":"Validate manifest metadata parse fast path","metricName":"validation_failures","metricUnit":"","bestDirection":"lower"}
{"run":894,"commit":"9ce65d8","metric":0,"metrics":{"packages_tested":1,"temp_builds":1},"status":"keep","description":"validate manifest metadata parse fast path","timestamp":1777211942900,"segment":424,"confidence":null,"iterationTokens":215,"asi":{"hypothesis":"The parseManifestMetadata no-metadata fast path must preserve YAML metadata and legacy INI metadata behavior while avoiding YAML unmarshal only when safe.","result":"Added TestParseManifestMetadata covering modern YAML without metadata, modern YAML with metadata, and legacy INI metadata. go test ./internal/build and temp-path go build -tags=dev ./cmd/llgo passed; root llgo was not created."}}
{"type":"config","name":"Record kept parseManifestMetadata fast path","metricName":"validation_failures","metricUnit":"","bestDirection":"lower"}
{"run":895,"commit":"7e3bb8d","metric":0,"metrics":{"ideas_updated":1},"status":"keep","description":"record kept parseManifestMetadata fast path","timestamp":1777211969671,"segment":425,"confidence":null,"iterationTokens":179,"asi":{"hypothesis":"Record the kept no-metadata parseManifestMetadata fast path so future loops know this cache-hit path has been optimized and tested.","result":"Ideas backlog now records the parseManifestMetadata no-metadata benchmark improvement and compatibility tests."}}
{"type":"config","name":"Monitor PR after pushing parseManifestMetadata fast path","metricName":"pr_check_failures","metricUnit":"","bestDirection":"lower"}
{"run":896,"commit":"61261fe","metric":0,"metrics":{"pending_checks":17,"passed_checks":2,"skipped_checks":0,"llgo_in_pr_diff":0},"status":"keep","description":"monitor PR after pushing parseManifestMetadata fast path","timestamp":1777212028316,"segment":426,"confidence":null,"iterationTokens":453,"asi":{"hypothesis":"After pushing the parseManifestMetadata no-metadata fast path, the PR run should start without immediate failures and root llgo should remain absent from the diff.","result":"New PR run has 0 failures, 2 passed, 17 pending, and root llgo absent from PR diff. Fewer checks are listed because the workflow set is still starting."}}
{"run":897,"commit":"98ac77e","metric":0,"metrics":{"pending_checks":45,"passed_checks":12,"skipped_checks":0,"llgo_in_pr_diff":0},"status":"keep","description":"monitor PR two minutes after parseManifestMetadata push","timestamp":1777212166176,"segment":426,"confidence":null,"iterationTokens":1009,"asi":{"hypothesis":"The latest PR run should expand to the full check set and continue without failures after the parseManifestMetadata fast path push.","result":"0 failures, 12 passed, 45 pending, root llgo absent from PR diff."}}
{"type":"config","name":"Avoid metadata allocation in empty saveToCache path","metricName":"save_to_cache_ns_op","metricUnit":"","bestDirection":"lower"}
{"run":898,"commit":"35eec16","metric":292258,"metrics":{"save_to_cache_allocs_op":42,"runs":7},"status":"keep","description":"baseline empty saveToCache after parse fast path","timestamp":1777212211747,"segment":427,"confidence":null,"iterationTokens":846,"asi":{"hypothesis":"After the empty-metadata saveToCache fast path, there may still be a small avoidable metadata struct allocation; establish current baseline before moving metadata construction into the non-empty branch.","result":"BenchmarkSaveToCacheEmptyMetadata median was 292258 ns/op and 42 allocs/op across 7 runs."}}
{"run":899,"commit":"35eec16","metric":291919,"metrics":{"save_to_cache_allocs_op":41,"runs":7},"status":"discard","description":"defer manifestMetadata allocation until needed","timestamp":1777212266421,"segment":427,"confidence":null,"iterationTokens":1653,"asi":{"hypothesis":"Moving manifestMetadata allocation into the non-empty metadata branch should remove one allocation from empty-metadata saveToCache.","result":"internal/build tests passed and allocs dropped from 42 to 41, but wall-time median moved only from 292258ns to 291919ns (0.1%), far below noise; this is not a clear local improvement.","rollback_reason":"User requested obvious improvements before pushing; a one-allocation/noise-level micro-change is not worth code churn.","next_action_hint":"Do not pursue more tiny saveToCache allocation tweaks unless they improve wall time clearly or appear in an allocation profile."}}
{"type":"config","name":"Record rejected saveToCache one-allocation tweak","metricName":"validation_failures","metricUnit":"","bestDirection":"lower"}
{"run":900,"commit":"1e0dba9","metric":0,"metrics":{"ideas_updated":1},"status":"keep","description":"record rejected saveToCache one-allocation tweak","timestamp":1777212299678,"segment":428,"confidence":null,"iterationTokens":171,"asi":{"hypothesis":"Record the rejected one-allocation saveToCache tweak to avoid repeating a noise-level wall-time experiment.","result":"Ideas backlog now notes that deferring manifestMetadata allocation saved one allocation but only changed wall time by about 0.1%, so it was rejected."}}
{"type":"config","name":"Monitor PR while parse fast path CI progresses","metricName":"pr_check_failures","metricUnit":"","bestDirection":"lower"}
{"run":901,"commit":"2acfbdb","metric":0,"metrics":{"pending_checks":42,"passed_checks":15,"skipped_checks":0,"llgo_in_pr_diff":0},"status":"keep","description":"monitor PR while parse fast path CI progresses","timestamp":1777212328799,"segment":429,"confidence":null,"iterationTokens":448,"asi":{"hypothesis":"The parseManifestMetadata fast path PR run should continue without failures while local discarded micro-tweak has no source effect.","result":"0 failures, 15 passed, 42 pending, root llgo absent from PR diff."}}
{"type":"config","name":"Avoid full manifest remarshal when saving metadata","metricName":"save_to_cache_metadata_ns_op","metricUnit":"","bestDirection":"lower"}
{"run":902,"commit":"31b2ee4","metric":428810,"metrics":{"save_to_cache_metadata_allocs_op":1371,"runs":7},"status":"keep","description":"baseline saveToCache with non-empty metadata","timestamp":1777212382619,"segment":430,"confidence":null,"iterationTokens":932,"asi":{"hypothesis":"saveToCache still decodes and re-marshals the full manifest when metadata is non-empty. Establish a benchmark before trying to marshal only the metadata block into the already-built manifest.","result":"BenchmarkSaveToCacheWithMetadata median was 428810 ns/op and 1371 allocs/op across 7 runs."}}
{"run":903,"commit":"31b2ee4","metric":0,"metrics":{"save_to_cache_metadata_allocs_op":0,"runs":0},"status":"crash","description":"append metadata block without full manifest remarshal first attempt","timestamp":1777212414161,"segment":430,"confidence":null,"iterationTokens":2016,"asi":{"hypothesis":"Saving non-empty metadata can avoid full manifest decode/re-marshal by marshaling only the metadata block and inserting it into the existing manifest.","result":"First edit did not compile because the refactor used err in saveToCache without declaring it in the new branch (collect.go undefined: err).","rollback_reason":"Compilation failure; revert the partial edit and retry with a properly scoped err declaration.","next_action_hint":"Use manifestWithMeta, err := appendManifestMetadata(...) or declare var err error before the metadata branch, then rerun tests and benchmark."}}
{"run":904,"commit":"406ecc8","metric":317801,"metrics":{"save_to_cache_metadata_allocs_op":102,"runs":7},"status":"keep","description":"append metadata block without full manifest remarshal","timestamp":1777212485039,"segment":430,"confidence":null,"iterationTokens":2032,"asi":{"hypothesis":"For non-empty cache metadata, saveToCache can marshal only the metadata block and insert it into the already-built manifest, avoiding full manifest decode/re-marshal while preserving YAML metadata semantics.","result":"go test ./internal/build passed. BenchmarkSaveToCacheWithMetadata improved from 428810 ns/op and 1371 allocs/op to 317801 ns/op and 102 allocs/op across 7 runs.","next_action_hint":"Add focused test comparing parsed metadata and metadata-before-deps placement, then run local validation before pushing."}}
{"type":"config","name":"Validate saveToCache metadata insertion","metricName":"validation_failures","metricUnit":"","bestDirection":"lower"}
{"run":905,"commit":"1c3ba50","metric":0,"metrics":{"packages_tested":1,"temp_builds":1},"status":"keep","description":"validate saveToCache metadata insertion","timestamp":1777212558110,"segment":431,"confidence":null,"iterationTokens":215,"asi":{"hypothesis":"The metadata-block insertion optimization must preserve cache metadata parsing and keep metadata before deps in manifests with dependencies.","result":"Added TestSaveToCache_WithMetadata covering metadata insertion before deps and parseManifestMetadata results. go test ./internal/build and temp-path go build -tags=dev ./cmd/llgo passed; root llgo was not created."}}
{"type":"config","name":"Record kept saveToCache metadata insertion","metricName":"validation_failures","metricUnit":"","bestDirection":"lower"}
{"run":906,"commit":"70eacad","metric":0,"metrics":{"ideas_updated":1},"status":"keep","description":"record kept saveToCache metadata insertion","timestamp":1777212583540,"segment":432,"confidence":null,"iterationTokens":181,"asi":{"hypothesis":"Record the kept non-empty metadata saveToCache optimization and benchmark so future loops know this cache-save path is complete.","result":"Ideas backlog now records the metadata-block insertion benchmark improvement and validation constraints."}}
{"type":"config","name":"Monitor PR after pushing metadata save optimization","metricName":"pr_check_failures","metricUnit":"","bestDirection":"lower"}
{"run":907,"commit":"2c3794e","metric":0,"metrics":{"pending_checks":45,"passed_checks":2,"skipped_checks":0,"llgo_in_pr_diff":0},"status":"keep","description":"monitor PR after pushing metadata save optimization","timestamp":1777212637875,"segment":433,"confidence":null,"iterationTokens":451,"asi":{"hypothesis":"After pushing the non-empty metadata saveToCache optimization, the PR run should start without immediate failures and root llgo should remain absent from the diff.","result":"New PR run has 0 failures, 2 passed, 45 pending, and root llgo absent from PR diff."}}
{"run":908,"commit":"8749145","metric":0,"metrics":{"pending_checks":43,"passed_checks":14,"skipped_checks":0,"llgo_in_pr_diff":0},"status":"keep","description":"monitor PR two minutes after metadata save push","timestamp":1777212779011,"segment":433,"confidence":null,"iterationTokens":988,"asi":{"hypothesis":"The latest PR run should continue progressing without failures after the metadata saveToCache optimization push.","result":"0 failures, 14 passed, 43 pending, root llgo absent from PR diff."}}
{"type":"config","name":"Parse only metadata YAML section on cache hit","metricName":"parse_manifest_metadata_ns_op","metricUnit":"","bestDirection":"lower"}
{"run":909,"commit":"bed0650","metric":64467,"metrics":{"parse_manifest_metadata_allocs_op":973,"runs":7},"status":"keep","description":"baseline parseManifestMetadata with metadata","timestamp":1777212832270,"segment":434,"confidence":null,"iterationTokens":799,"asi":{"hypothesis":"When modern YAML manifests include metadata, parseManifestMetadata still unmarshals the full manifest. Benchmark current behavior before slicing out and unmarshalling only the top-level metadata section.","result":"BenchmarkParseManifestMetadataWithMetadata median was 64467 ns/op and 973 allocs/op across 7 runs."}}
{"run":910,"commit":"0171534","metric":7831,"metrics":{"parse_manifest_metadata_allocs_op":104,"runs":7},"status":"keep","description":"parse only metadata YAML section on cache hit","timestamp":1777212906840,"segment":434,"confidence":null,"iterationTokens":2783,"asi":{"hypothesis":"For modern manifests with metadata, parseManifestMetadata can unmarshal just the top-level metadata section instead of the full manifest, preserving legacy fallback for INI manifests.","result":"go test ./internal/build passed. BenchmarkParseManifestMetadataWithMetadata improved from 64467 ns/op and 973 allocs/op to 7831 ns/op and 104 allocs/op across 7 runs.","next_action_hint":"Add focused tests for yamlMetadataSection with metadata before deps and metadata at start, then validate cmd/llgo build before pushing."}}
{"type":"config","name":"Validate metadata section slicing","metricName":"validation_failures","metricUnit":"","bestDirection":"lower"}
{"run":911,"commit":"b386652","metric":0,"metrics":{"packages_tested":1,"temp_builds":1},"status":"keep","description":"validate metadata section slicing","timestamp":1777212970755,"segment":435,"confidence":null,"iterationTokens":213,"asi":{"hypothesis":"The metadata-section parsing fast path should correctly slice top-level metadata whether it appears after env/common/package sections or at the start of a metadata-only YAML document, without including following deps.","result":"Extended TestParseManifestMetadata to check yamlMetadataSection slicing before deps and at document start. go test ./internal/build and temp-path go build -tags=dev ./cmd/llgo passed; root llgo was not created."}}
{"type":"config","name":"Record kept metadata-section parse optimization","metricName":"validation_failures","metricUnit":"","bestDirection":"lower"}
{"run":912,"commit":"91f2519","metric":0,"metrics":{"ideas_updated":1},"status":"keep","description":"record kept metadata-section parse optimization","timestamp":1777212997851,"segment":436,"confidence":null,"iterationTokens":180,"asi":{"hypothesis":"Record the kept metadata-section parse optimization so future iterations know both no-metadata and metadata cache-hit paths are optimized.","result":"Ideas backlog now records the metadata-section unmarshal benchmark improvement."}}
{"type":"config","name":"Monitor PR after pushing metadata parse optimization","metricName":"pr_check_failures","metricUnit":"","bestDirection":"lower"}
{"run":913,"commit":"788dae3","metric":0,"metrics":{"pending_checks":17,"passed_checks":2,"skipped_checks":0,"llgo_in_pr_diff":0},"status":"keep","description":"monitor PR after pushing metadata parse optimization","timestamp":1777213062549,"segment":437,"confidence":null,"iterationTokens":451,"asi":{"hypothesis":"After pushing the metadata-section parse fast path, the PR run should start without immediate failures and root llgo should remain absent from the diff.","result":"New PR run has 0 failures, 2 passed, 17 pending, and root llgo absent from PR diff. Fewer checks are listed because the workflow set is still starting."}}
{"run":914,"commit":"c2f82d5","metric":0,"metrics":{"pending_checks":43,"passed_checks":14,"skipped_checks":0,"llgo_in_pr_diff":0},"status":"keep","description":"monitor PR two minutes after metadata parse push","timestamp":1777213203737,"segment":437,"confidence":null,"iterationTokens":1003,"asi":{"hypothesis":"The latest PR run should expand to the full check set and continue without failures after the metadata parse optimization push.","result":"0 failures, 14 passed, 43 pending, root llgo absent from PR diff."}}
{"type":"config","name":"Skip file digest sorting for single file","metricName":"digest_files_ns_op","metricUnit":"","bestDirection":"lower"}
{"run":915,"commit":"a69d70b","metric":5368,"metrics":{"digest_files_allocs_op":4,"runs":7},"status":"keep","description":"baseline single-file digestFilesWithOverlay","timestamp":1777213250890,"segment":438,"confidence":null,"iterationTokens":599,"asi":{"hypothesis":"digestFilesWithOverlay always calls sort.Slice even for one file; many packages have small file lists, so skipping sorting for len<=1 may reduce fingerprint overhead.","result":"BenchmarkDigestFilesWithOverlaySingleFile median was 5368 ns/op and 4 allocs/op across 7 runs, with notable noise from filesystem stat calls."}}
{"run":916,"commit":"9f45e15","metric":1382,"metrics":{"digest_files_allocs_op":3,"runs":7},"status":"keep","description":"skip digestFilesWithOverlay sort for one file","timestamp":1777213315218,"segment":438,"confidence":null,"iterationTokens":1294,"asi":{"hypothesis":"Skipping sort.Slice when digestFilesWithOverlay has zero or one file avoids reflect/closure overhead for common tiny file lists without changing output ordering.","result":"go test ./internal/build passed. Single-file digestFilesWithOverlay benchmark improved from 5368 ns/op and 4 allocs/op to 1382 ns/op and 3 allocs/op across 7 runs.","next_action_hint":"Validate with existing digest determinism tests and temp cmd/llgo build before pushing; consider similar len>1 guard for dependency sorting if benchmarks show it matters."}}
{"type":"config","name":"Validate single-file digest sorting guard","metricName":"validation_failures","metricUnit":"","bestDirection":"lower"}
{"run":917,"commit":"c88defb","metric":0,"metrics":{"packages_tested":1,"temp_builds":1},"status":"keep","description":"validate single-file digest sorting guard","timestamp":1777213380255,"segment":439,"confidence":null,"iterationTokens":198,"asi":{"hypothesis":"The len>1 sorting guard in digestFilesWithOverlay should preserve existing deterministic output behavior while speeding small file lists.","result":"go test ./internal/build, including existing digest ordering/determinism tests, and temp-path go build -tags=dev ./cmd/llgo passed; root llgo was not created."}}
{"type":"config","name":"Record kept single-file digest sort guard","metricName":"validation_failures","metricUnit":"","bestDirection":"lower"}
{"run":918,"commit":"c91b929","metric":0,"metrics":{"ideas_updated":1},"status":"keep","description":"record kept single-file digest sort guard","timestamp":1777213408595,"segment":440,"confidence":null,"iterationTokens":181,"asi":{"hypothesis":"Record the kept digestFilesWithOverlay len<=1 sort guard to avoid repeating small-file fingerprint experiments.","result":"Ideas backlog now records the single-file digestFilesWithOverlay benchmark improvement."}}
{"type":"config","name":"Monitor PR after pushing digest sort guard","metricName":"pr_check_failures","metricUnit":"","bestDirection":"lower"}
{"run":919,"commit":"1cd3f69","metric":0,"metrics":{"pending_checks":45,"passed_checks":2,"skipped_checks":0,"llgo_in_pr_diff":0},"status":"keep","description":"monitor PR after pushing digest sort guard","timestamp":1777213469926,"segment":441,"confidence":null,"iterationTokens":451,"asi":{"hypothesis":"After pushing the digestFilesWithOverlay single-file sort guard, the PR run should start without immediate failures and root llgo should remain absent from the diff.","result":"New PR run has 0 failures, 2 passed, 45 pending, and root llgo absent from PR diff."}}
{"run":920,"commit":"11bc1b0","metric":0,"metrics":{"pending_checks":43,"passed_checks":14,"skipped_checks":0,"llgo_in_pr_diff":0},"status":"keep","description":"monitor PR two minutes after digest sort guard push","timestamp":1777213610147,"segment":441,"confidence":null,"iterationTokens":1001,"asi":{"hypothesis":"The digest sort guard PR run should expand and continue without failures.","result":"0 failures, 14 passed, 43 pending, root llgo absent from PR diff."}}
{"type":"config","name":"Skip dependency sorting for single import","metricName":"collect_deps_ns_op","metricUnit":"","bestDirection":"lower"}
{"run":921,"commit":"f25e893","metric":104,"metrics":{"collect_deps_allocs_op":3,"runs":7},"status":"keep","description":"baseline collectDependencyInputs single import","timestamp":1777213641883,"segment":442,"confidence":null,"iterationTokens":749,"asi":{"hypothesis":"collectDependencyInputs sorts the dependency slice even for a single import; benchmark before adding a len>1 guard similar to digestFilesWithOverlay.","result":"Synthetic single-import collectDependencyInputs benchmark median was 104 ns/op and 3 allocs/op across 7 runs. Baseline is already tiny, so only clear changes should be kept."}}
{"run":922,"commit":"f25e893","metric":71,"metrics":{"collect_deps_allocs_op":2,"runs":7},"status":"discard","description":"skip dependency sort for one import","timestamp":1777213706769,"segment":442,"confidence":null,"iterationTokens":1426,"asi":{"hypothesis":"Adding a len>1 guard around collectDependencyInputs sorting should reduce tiny single-import fingerprint overhead.","result":"internal/build tests passed and the microbenchmark improved from 104ns/3 allocs to 71ns/2 allocs, but the absolute gain is only ~33ns and not meaningful for real build wall time.","rollback_reason":"Improvement is too small in absolute terms; avoid code churn for a micro-optimization that is unlikely to affect user-visible build speed.","next_action_hint":"Do not revisit dependency sort guards unless a profile shows collectDependencyInputs sorting overhead is material."}}
{"type":"config","name":"Record rejected dependency sort guard","metricName":"validation_failures","metricUnit":"","bestDirection":"lower"}
{"run":923,"commit":"fc6626d","metric":0,"metrics":{"ideas_updated":1},"status":"keep","description":"record rejected dependency sort guard","timestamp":1777213730690,"segment":443,"confidence":null,"iterationTokens":170,"asi":{"hypothesis":"Record the rejected collectDependencyInputs single-import sort guard because it improved a tiny microbenchmark but not enough to matter.","result":"Ideas backlog now notes the 104ns->71ns dependency sort guard was rejected for too-small absolute gain."}}
{"type":"config","name":"Monitor PR while digest guard CI progresses","metricName":"pr_check_failures","metricUnit":"","bestDirection":"lower"}
