{"run":345,"commit":"4d0de4d","metric":0,"metrics":{"setup_go_actions":1},"status":"keep","description":"baseline custom setup-go has no macOS Go cache","timestamp":1777071378538,"segment":200,"confidence":null,"iterationTokens":154,"asi":{"hypothesis":"Many high-duration macOS jobs repeatedly compile Go packages and download modules using the custom setup-go action. Adding a macOS-only Go build/module cache may reduce macOS runner time across repeated PR runs without changing test coverage."}}
{"run":346,"commit":"0741299","metric":1,"metrics":{"setup_go_actions":1},"status":"keep","description":"enable macOS Go module/build cache in custom setup-go","timestamp":1777071394778,"segment":200,"confidence":null,"iterationTokens":616,"asi":{"hypothesis":"A macOS-only actions/cache step in the custom setup-go action can reduce repeated macOS Go module downloads and host package compile time across PR pushes while avoiding Ubuntu cache overhead.","result":"setup-go action YAML parses and macOS cache step count increased from 0 to 1."}}
{"type":"config","name":"Validate workflows after setup-go cache","metricName":"workflow_validation_failures","metricUnit":"","bestDirection":"lower"}
{"run":347,"commit":"1189210","metric":0,"metrics":{"workflow_files_checked":8,"action_files_checked":5},"status":"keep","description":"validate workflow/action YAML after setup-go cache","timestamp":1777071409701,"segment":201,"confidence":null,"iterationTokens":188,"asi":{"hypothesis":"Adding a uses: actions/cache step inside the composite setup-go action should remain valid workflow/action YAML.","result":"All workflow and action YAML files parsed successfully."}}
{"run":348,"commit":"87b175f","metric":0,"metrics":{"workflow_files_checked":0,"action_files_checked":0,"pending_checks":15},"status":"keep","description":"monitor PR while setup-go cache waits locally","timestamp":1777071605784,"segment":201,"confidence":null,"iterationTokens":474,"asi":{"hypothesis":"Monitor the currently pushed torch optimization run for failures before pushing the local setup-go cache change.","result":"No failed checks observed; 15 checks pending."}}
{"type":"config","name":"Monitor PR after setup-go cache push","metricName":"pr_check_failures","metricUnit":"","bestDirection":"lower"}
{"run":349,"commit":"b7542ac","metric":0,"metrics":{"pending_checks":12},"status":"keep","description":"monitor PR immediately after setup-go cache push","timestamp":1777071632042,"segment":202,"confidence":null,"iterationTokens":242,"asi":{"hypothesis":"Immediately check CI after pushing the macOS-only setup-go cache addition.","result":"No failed checks observed; 12 checks pending immediately after push."}}
{"run":350,"commit":"50317a0","metric":0,"metrics":{"pending_checks":22},"status":"keep","description":"monitor PR after setup-go cache push has started jobs","timestamp":1777071828203,"segment":202,"confidence":null,"iterationTokens":846,"asi":{"hypothesis":"Wait a few minutes after setup-go cache push to catch early composite-action or cache-step failures.","result":"No failed checks observed; jobs have expanded to 22 pending as workflows progress."}}
{"run":351,"commit":"3f145db","metric":0,"metrics":{"pending_checks":16},"status":"keep","description":"monitor PR after setup-go cache push has run longer","timestamp":1777072099635,"segment":202,"confidence":null,"iterationTokens":1894,"asi":{"hypothesis":"Continue monitoring setup-go cache push for failures after more workflow runtime, especially macOS jobs using the composite action cache step.","result":"No failed checks observed; 16 checks remain pending."}}
{"type":"config","name":"Measure early macOS install job duration after setup-go cache","metricName":"macos_install_job_seconds","metricUnit":"s","bestDirection":"lower"}
{"run":352,"commit":"f562e71","metric":328,"metrics":{"macos_install_jobs_measured":3},"status":"keep","description":"measure early macOS install jobs after setup-go cache","timestamp":1777072133509,"segment":203,"confidence":null,"iterationTokens":338,"asi":{"hypothesis":"The macOS-only setup-go cache should at least not break early macOS install jobs and may reduce their duration compared with previous snapshots.","result":"Three macOS install checks passed with total duration 328s: local_install 1m58s, local_install_full 1m42s, remote_install 1m48s."}}
{"run":353,"commit":"eec38d9","metric":0,"metrics":{"macos_install_jobs_measured":0,"pr_check_failures":0,"pending_checks":14},"status":"keep","description":"monitor PR during macOS install-duration segment","timestamp":1777072398099,"segment":203,"confidence":null,"iterationTokens":724,"asi":{"hypothesis":"Continue monitoring the setup-go cache PR run for failures while long macOS jobs continue; this monitoring run occurred under the install-duration segment.","result":"No failed checks observed; 14 checks remain pending."}}
{"type":"config","name":"Monitor setup-go cache PR checks","metricName":"pr_check_failures","metricUnit":"","bestDirection":"lower"}
{"run":354,"commit":"d9ebd21","metric":0,"metrics":{"pending_checks":12},"status":"keep","description":"monitor setup-go cache PR checks after more runtime","timestamp":1777072691786,"segment":204,"confidence":null,"iterationTokens":811,"asi":{"hypothesis":"Continue monitoring the setup-go cache push for failures while long macOS jobs run.","result":"No failed checks observed; 12 checks remain pending."}}
{"type":"config","name":"Skip explicit Homebrew update in macOS setup-deps","metricName":"explicit_brew_update_steps","metricUnit":"","bestDirection":"lower"}
{"run":355,"commit":"f471ed0","metric":1,"metrics":{"setup_deps_actions":1},"status":"keep","description":"baseline macOS setup-deps runs explicit brew update","timestamp":1777072753643,"segment":205,"confidence":null,"iterationTokens":155,"asi":{"hypothesis":"The macOS setup-deps action spends significant time running brew update in every job. GitHub hosted runners generally have sufficiently current Homebrew metadata; disabling auto-update and removing the explicit update may save scarce macOS runner minutes without changing installed dependencies."}}
{"run":356,"commit":"6966504","metric":0,"metrics":{"setup_deps_actions":1,"homebrew_no_auto_update":1},"status":"keep","description":"skip explicit brew update in macOS setup-deps","timestamp":1777072774102,"segment":205,"confidence":null,"iterationTokens":605,"asi":{"hypothesis":"Removing explicit brew update and setting HOMEBREW_NO_AUTO_UPDATE should reduce macOS dependency setup time across many jobs while keeping the same brew install list.","result":"setup-deps action YAML parses; explicit brew update count dropped from 1 to 0 and HOMEBREW_NO_AUTO_UPDATE is set."}}
{"type":"config","name":"Validate workflows after brew update removal","metricName":"workflow_validation_failures","metricUnit":"","bestDirection":"lower"}
{"run":357,"commit":"e1afa98","metric":0,"metrics":{"workflow_files_checked":8,"action_files_checked":5},"status":"keep","description":"validate workflows after brew update removal","timestamp":1777072793762,"segment":206,"confidence":null,"iterationTokens":188,"asi":{"hypothesis":"Removing brew update and adding HOMEBREW_NO_AUTO_UPDATE should leave all workflow/action YAML valid before pushing.","result":"All workflow/action YAML files parsed successfully."}}
{"run":358,"commit":"8ad512a","metric":0,"metrics":{"workflow_files_checked":0,"action_files_checked":0,"pending_checks":10},"status":"keep","description":"monitor PR before brew update removal push","timestamp":1777072808259,"segment":206,"confidence":null,"iterationTokens":472,"asi":{"hypothesis":"Check the currently pushed setup-go cache run before pushing brew update removal, so existing failures can be addressed first.","result":"No failed checks observed; 10 macOS-heavy checks remain pending."}}
{"type":"config","name":"Monitor PR after brew update removal push","metricName":"pr_check_failures","metricUnit":"","bestDirection":"lower"}
{"run":359,"commit":"8ad512a","metric":0,"metrics":{"pending_checks":0},"status":"crash","description":"monitor PR immediately after brew update removal push hit GitHub TLS timeout","timestamp":1777072846699,"segment":207,"confidence":null,"iterationTokens":242,"asi":{"hypothesis":"Immediately check CI after pushing brew update removal.","error":"gh pr checks printed GitHub GraphQL TLS handshake timeout, so parsed failure/pending counts are invalid.","rollback_reason":"No code rollback needed; this was a transient monitoring/API failure, not a workflow result.","next_action_hint":"Retry gh pr checks with set -e so API errors fail the experiment instead of producing empty metrics."}}
{"run":360,"commit":"8ad512a","metric":0,"metrics":{"pending_checks":0},"status":"crash","description":"retry PR monitor after brew update removal push hit gh exit 8","timestamp":1777072865415,"segment":207,"confidence":null,"iterationTokens":871,"asi":{"hypothesis":"Retry PR check monitoring with set -e after the previous GitHub API TLS timeout.","error":"gh pr checks exited with code 8 before producing metrics, likely transient GitHub/API issue.","rollback_reason":"No workflow/code result was obtained; keep code and retry monitoring later.","next_action_hint":"Retry gh pr checks after a short delay; if API errors persist, use gh run list or gh api endpoints as fallback."}}
{"run":361,"commit":"39a1afc","metric":0,"metrics":{"pending_checks":31},"status":"keep","description":"monitor PR after brew update removal push with pending-aware gh handling","timestamp":1777072888119,"segment":207,"confidence":null,"iterationTokens":917,"asi":{"hypothesis":"Use pending-aware gh pr checks handling because gh exits nonzero while checks are pending; verify brew update removal push has no immediate failures.","result":"No failed checks observed; 31 checks pending after push."}}
{"run":362,"commit":"fe0f860","metric":0,"metrics":{"pending_checks":19},"status":"keep","description":"monitor brew update removal push after setup jobs progressed","timestamp":1777073085774,"segment":207,"confidence":null,"iterationTokens":968,"asi":{"hypothesis":"If removing brew update breaks macOS dependency setup, failures should appear early as setup-deps jobs start.","result":"No failed checks observed; pending checks dropped to 19, suggesting early setup jobs are not failing."}}
{"type":"config","name":"Measure early macOS setup after brew update removal","metricName":"macos_setup_sensitive_seconds","metricUnit":"s","bestDirection":"lower"}
{"run":363,"commit":"86e82ff","metric":662,"metrics":{"macos_setup_sensitive_jobs":6},"status":"keep","description":"measure early macOS jobs after brew update removal","timestamp":1777073127825,"segment":208,"confidence":null,"iterationTokens":365,"asi":{"hypothesis":"Early macOS jobs that exercise setup-deps should pass and show lower durations after removing brew update.","result":"Six macOS setup-sensitive jobs passed; total duration 662s. build-cache macOS was 2m37s versus earlier 3m01s, and hello macOS was 1m53s versus earlier 2m23s."}}
{"run":364,"commit":"162e129","metric":0,"metrics":{"macos_setup_sensitive_jobs":0,"pr_check_failures":0,"pending_checks":16},"status":"keep","description":"monitor brew update removal PR during macOS setup measurement segment","timestamp":1777073385779,"segment":208,"confidence":null,"iterationTokens":638,"asi":{"hypothesis":"Continue monitoring the brew update removal PR run for failures while long macOS/test jobs execute.","result":"No failed checks observed; 16 checks remain pending."}}
{"type":"config","name":"Monitor brew update removal full PR run","metricName":"pr_check_failures","metricUnit":"","bestDirection":"lower"}
{"run":365,"commit":"3b6c971","metric":0,"metrics":{"pending_checks":10},"status":"keep","description":"monitor brew update removal full PR run after long macOS jobs progress","timestamp":1777073650007,"segment":209,"confidence":null,"iterationTokens":351,"asi":{"hypothesis":"Continue monitoring the brew update removal run until long macOS jobs either pass or reveal dependency/setup issues.","result":"No failed checks observed; 10 checks remain pending."}}
{"run":366,"commit":"266d652","metric":0,"metrics":{"pending_checks":8},"status":"keep","description":"monitor brew update removal full PR run after additional wait","timestamp":1777073973460,"segment":209,"confidence":null,"iterationTokens":1652,"asi":{"hypothesis":"Keep monitoring the brew update removal run; remaining jobs are long macOS-heavy jobs, so dependency setup failures should already have appeared if present.","result":"No failed checks observed; 8 long macOS-heavy checks remain pending."}}
{"run":367,"commit":"582b737","metric":0,"metrics":{"pending_checks":4},"status":"keep","description":"monitor brew update removal full PR run near completion","timestamp":1777074296731,"segment":209,"confidence":null,"iterationTokens":1088,"asi":{"hypothesis":"Continue monitoring until the macOS-heavy jobs from brew update removal and setup-go cache changes complete.","result":"No failed checks observed; only 4 macOS-heavy checks remain pending."}}
{"run":368,"commit":"d576859","metric":0,"metrics":{"pending_checks":3},"status":"keep","description":"monitor brew update removal full PR run with only intel macOS pending","timestamp":1777074574576,"segment":209,"confidence":null,"iterationTokens":699,"asi":{"hypothesis":"The remaining risk after brew update removal is long macOS Intel jobs; continue monitoring for failures.","result":"No failed checks observed; only 3 macOS Intel checks remain pending."}}
{"type":"config","name":"Measure completed macOS job durations after setup changes","metricName":"macos_completed_runner_seconds","metricUnit":"s","bestDirection":"lower"}
{"run":369,"commit":"b730937","metric":1228,"metrics":{"macos_completed_jobs":5},"status":"keep","description":"measure completed macOS job durations after setup changes","timestamp":1777074616700,"segment":210,"confidence":null,"iterationTokens":379,"asi":{"hypothesis":"Torch-on-Linux-only plus setup-deps/setup-go changes should reduce several completed macOS job durations without reducing coverage.","result":"Selected completed macOS jobs total 1228s; macOS llgo Go 1.21/1.24 jobs are 6m34s and 7m57s, materially below earlier 8m38s/9m58s snapshots."}}
{"type":"config","name":"Monitor final macOS Intel checks after setup changes","metricName":"pr_check_failures","metricUnit":"","bestDirection":"lower"}
{"run":370,"commit":"3f1cd12","metric":0,"metrics":{"pending_checks":2},"status":"keep","description":"monitor final macOS Intel checks after setup changes","timestamp":1777074952241,"segment":211,"confidence":null,"iterationTokens":251,"asi":{"hypothesis":"Continue monitoring the last long macOS Intel llgo demo jobs after brew update removal and torch optimization.","result":"No failed checks observed; only the two macOS Intel llgo demo jobs remain pending."}}
{"run":371,"commit":"d39069c","metric":0,"metrics":{"pending_checks":1},"status":"keep","description":"monitor final macOS Intel checks after one completed","timestamp":1777075266814,"segment":211,"confidence":null,"iterationTokens":591,"asi":{"hypothesis":"Wait for macOS Intel llgo demo jobs to finish after setup optimizations.","result":"No failed checks observed; one macOS Intel llgo job remains pending."}}
{"run":372,"commit":"ab8b0c9","metric":0,"metrics":{"pending_checks":0},"status":"keep","description":"monitor final macOS Intel checks after setup changes completed","timestamp":1777075590553,"segment":211,"confidence":null,"iterationTokens":827,"asi":{"hypothesis":"Confirm the full PR run after setup-go cache, macOS torch skip, and brew update removal finishes without failures.","result":"No failed or pending checks observed; full PR run completed successfully."}}
{"type":"config","name":"Summarize final CI durations after macOS setup optimizations","metricName":"macos_top_job_seconds","metricUnit":"s","bestDirection":"lower"}
{"run":373,"commit":"eae2fd8","metric":1671,"metrics":{"macos_passed_jobs":19},"status":"keep","description":"summarize final CI durations after macOS setup optimizations","timestamp":1777075620185,"segment":212,"confidence":null,"iterationTokens":359,"asi":{"hypothesis":"Record final completed PR run durations after macOS setup optimizations to guide next high-impact work.","result":"Full PR run passed. Longest macOS job remains macos-15-intel llgo at 1671s (~27m51s), so future large gains still require addressing Intel demo workload rather than setup micro-optimizations."}}
{"type":"config","name":"Monitor PR after pushing duration logs","metricName":"pr_check_failures","metricUnit":"","bestDirection":"lower"}
{"run":374,"commit":"9f1f8b4","metric":0,"metrics":{"pending_checks":33},"status":"keep","description":"monitor PR immediately after pushing duration logs","timestamp":1777075654591,"segment":213,"confidence":null,"iterationTokens":243,"asi":{"hypothesis":"Immediately check CI after pushing monitoring/duration commits; no code changes beyond already-passing setup optimizations should introduce failures.","result":"No failed checks observed; 33 checks pending immediately after push."}}
{"type":"config","name":"Parallelize embedded demos on macOS Intel only","metricName":"macos_intel_embedded_demo_parallel_jobs","metricUnit":"","bestDirection":"higher"}
{"run":375,"commit":"4d28c3c","metric":1,"metrics":{"embedded_demo_steps":1},"status":"keep","description":"baseline embedded demos are sequential on macOS Intel","timestamp":1777075681433,"segment":214,"confidence":null,"iterationTokens":194,"asi":{"hypothesis":"The longest macOS Intel llgo job spends ~11m in embedded demos. Parallelizing only embedded demo builds on macOS Intel with a low job count may preserve coverage and avoid the prior host-demo _demo/go/sync parallelism issue."}}
{"run":376,"commit":"17ed188","metric":2,"metrics":{"embedded_demo_steps":1},"status":"keep","description":"parallelize embedded demos on macOS Intel only","timestamp":1777075700923,"segment":214,"confidence":null,"iterationTokens":676,"asi":{"hypothesis":"Setting LLGO_DEMO_JOBS=2 only for embedded demos on macos-15-intel preserves the same demo/target coverage while reducing the slowest runner's embedded demo wall time; host demos remain sequential to avoid the known _demo/go/sync host parallelism segfault.","result":"llgo.yml parses and test_demo.sh passes bash -n; macOS Intel embedded demo parallel job count increased from 1 to 2."}}
{"type":"config","name":"Validate workflows before embedded demo parallel push","metricName":"workflow_validation_failures","metricUnit":"","bestDirection":"lower"}
{"run":377,"commit":"7419956","metric":0,"metrics":{"workflow_files_checked":8,"action_files_checked":5,"shell_scripts_checked":1},"status":"keep","description":"validate workflows before embedded demo parallel push","timestamp":1777075717834,"segment":215,"confidence":null,"iterationTokens":201,"asi":{"hypothesis":"Before pushing macOS Intel embedded demo parallelism, validate all workflow/action YAML and the demo scheduler shell syntax.","result":"All workflow/action YAML parsed and test_demo.sh passed bash -n."}}
{"type":"config","name":"Monitor PR after embedded demo parallel push","metricName":"pr_check_failures","metricUnit":"","bestDirection":"lower"}
{"run":378,"commit":"e52b665","metric":0,"metrics":{"pending_checks":4},"status":"keep","description":"monitor PR immediately after embedded demo parallel push","timestamp":1777075756371,"segment":216,"confidence":null,"iterationTokens":244,"asi":{"hypothesis":"Immediately check CI after pushing macOS Intel embedded-demo-only parallelism.","result":"No failed checks observed; initial check snapshot shows 4 pending checks."}}
{"run":379,"commit":"870afad","metric":0,"metrics":{"pending_checks":23},"status":"keep","description":"monitor embedded demo parallel PR after jobs started","timestamp":1777075952641,"segment":216,"confidence":null,"iterationTokens":624,"asi":{"hypothesis":"Wait for workflows to start after embedded demo parallel push and check for early failures.","result":"No failed checks observed; 23 checks pending as workflows fan out."}}
{"run":380,"commit":"9f4eb14","metric":0,"metrics":{"pending_checks":18},"status":"keep","description":"monitor embedded demo parallel PR after more runtime","timestamp":1777076268538,"segment":216,"confidence":null,"iterationTokens":896,"asi":{"hypothesis":"Continue monitoring embedded-demo-only parallelism for early failures as macOS and test jobs progress.","result":"No failed checks observed; 18 checks remain pending."}}
{"run":381,"commit":"0e48f42","metric":0,"metrics":{"pending_checks":13},"status":"keep","description":"monitor embedded demo parallel PR as long jobs continue","timestamp":1777076583173,"segment":216,"confidence":null,"iterationTokens":957,"asi":{"hypothesis":"Continue monitoring the embedded-demo-only parallelism PR run; failure would likely show in macOS Intel llgo jobs or other macOS setup-sensitive jobs.","result":"No failed checks observed; 13 checks remain pending."}}
{"run":382,"commit":"f7a7d9f","metric":0,"metrics":{"pending_checks":9},"status":"keep","description":"monitor embedded demo parallel PR with nine checks pending","timestamp":1777076913703,"segment":216,"confidence":null,"iterationTokens":970,"asi":{"hypothesis":"Continue monitoring embedded-demo-only parallelism until macOS llgo jobs complete.","result":"No failed checks observed; 9 checks remain pending."}}
{"run":383,"commit":"440505f","metric":0,"metrics":{"pending_checks":7},"status":"keep","description":"monitor embedded demo parallel PR with seven checks pending","timestamp":1777077232618,"segment":216,"confidence":null,"iterationTokens":1043,"asi":{"hypothesis":"Continue monitoring the embedded-demo-only parallelism run; macOS llgo and artifact checks are still the critical path.","result":"No failed checks observed; 7 checks remain pending."}}
