{"run":619,"commit":"8b75366","metric":0,"metrics":{"pending_checks":12,"go_split_completed_jobs":4,"go_split_over15_jobs":0,"go_split_max_seconds":664,"split_macos_intel_over15_jobs":0,"split_macos_intel_completed_jobs":9,"split_macos_intel_max_seconds":746,"all_completed_over15_jobs":0},"status":"keep","description":"monitor Ubuntu Go split with 12 checks pending","timestamp":1777126236846,"segment":286,"confidence":null,"iterationTokens":1755,"asi":{"hypothesis":"Continue monitoring resumed run; no failures or over-15 completed jobs should appear.","result":"No failed checks observed; 12 checks pending. All four Go workflow split jobs and nine macOS Intel split jobs completed under 15m. No completed jobs over 15m."}}
{"run":620,"commit":"8b75366","metric":1,"metrics":{"pending_checks":7,"go_split_completed_jobs":4,"go_split_over15_jobs":0,"go_split_max_seconds":664,"split_macos_intel_over15_jobs":0,"split_macos_intel_completed_jobs":13,"split_macos_intel_max_seconds":746,"all_completed_over15_jobs":0},"status":"checks_failed","description":"monitor Ubuntu Go split found embedded startup failure","timestamp":1777126554554,"segment":286,"confidence":null,"iterationTokens":1764,"asi":{"hypothesis":"Continue monitoring resumed run; no failures or over-15 completed jobs should appear.","result":"One failure appeared: llgo-embedded-smoke-macos-intel (19, 1.21.13, startup) failed after 5m08s. All completed timed jobs remain under 15m.","rollback_reason":"CI failure appeared in an embedded smoke job; inspect logs to determine whether transient external dependency/QEMU issue or regression from recent workflow splits.","next_action_hint":"Fetch failed job 73011087661 logs before changing code. If unrelated transient setup/download failure, rerun or monitor; if recent workflow split caused it, fix or revert."}}
{"type":"config","name":"Add retry to custom Go download setup","metricName":"setup_go_download_retries","metricUnit":"","bestDirection":"higher"}
{"run":621,"commit":"b4dccd0","metric":0,"metrics":{},"status":"keep","description":"baseline custom setup-go has no curl retry","timestamp":1777126589930,"segment":287,"confidence":null,"iterationTokens":157,"asi":{"hypothesis":"The latest failure was a transient connection reset while downloading Go in the custom setup-go action. The action currently uses plain curl without retry, so it is vulnerable to transient network resets."}}
{"run":622,"commit":"6a4d2c9","metric":5,"metrics":{"setup_go_retry_delay_seconds":5},"status":"keep","description":"add retry to custom setup-go download","timestamp":1777126604213,"segment":287,"confidence":null,"iterationTokens":528,"asi":{"hypothesis":"Add curl retry handling to the custom setup-go action so transient Go tarball download connection resets do not fail CI immediately. This changes only setup resilience and preserves coverage.","result":"setup-go action YAML parses and now uses curl --retry 5 --retry-all-errors --retry-delay 5 -fL."}}
{"type":"config","name":"Validate workflows after setup-go retry","metricName":"workflow_validation_failures","metricUnit":"","bestDirection":"lower"}
{"run":623,"commit":"8b18254","metric":0,"metrics":{"workflow_files_checked":9,"action_files_checked":5,"shell_scripts_checked":4},"status":"keep","description":"validate workflows after setup-go retry","timestamp":1777126628148,"segment":288,"confidence":null,"iterationTokens":363,"asi":{"hypothesis":"Before pushing setup-go retry, validate all workflow/action YAML and relevant shell scripts and assert setup-go has the retry flags.","result":"All workflow/action YAML parsed; relevant shell scripts passed bash -n; setup-go action contains curl retry flags."}}
{"type":"config","name":"Monitor PR after setup-go retry push","metricName":"pr_check_failures","metricUnit":"","bestDirection":"lower"}
{"run":624,"commit":"6473fa2","metric":0,"metrics":{"pending_checks":18},"status":"keep","description":"monitor PR immediately after setup-go retry push","timestamp":1777126654335,"segment":289,"confidence":null,"iterationTokens":240,"asi":{"hypothesis":"After pushing setup-go curl retry, the new PR run should start without immediate failures and retry transient Go download errors if they recur.","result":"No failed checks observed; 18 checks pending immediately after push."}}
{"run":625,"commit":"a0317c2","metric":0,"metrics":{"pending_checks":40,"go_split_completed_jobs":0,"go_split_over15_jobs":0,"go_split_max_seconds":0,"split_macos_intel_over15_jobs":0,"split_macos_intel_completed_jobs":0,"split_macos_intel_max_seconds":0,"all_completed_over15_jobs":0},"status":"keep","description":"monitor setup-go retry run after workflow fan-out","timestamp":1777126968386,"segment":289,"confidence":null,"iterationTokens":1347,"asi":{"hypothesis":"After workflow fan-out, setup-go retry run should remain failure-free while jobs start.","result":"No failed checks observed; 40 checks pending. Targeted Go and macOS Intel jobs are still pending."}}
{"run":626,"commit":"12ddc79","metric":0,"metrics":{"pending_checks":33,"go_split_completed_jobs":1,"go_split_over15_jobs":0,"go_split_max_seconds":598,"split_macos_intel_over15_jobs":0,"split_macos_intel_completed_jobs":0,"split_macos_intel_max_seconds":0,"all_completed_over15_jobs":0},"status":"keep","description":"monitor setup-go retry run with first Go split job completed","timestamp":1777127284954,"segment":289,"confidence":null,"iterationTokens":1644,"asi":{"hypothesis":"Continue monitoring setup-go retry run; split Go workflow jobs should complete under 15m and no failures should appear.","result":"No failed checks observed; 33 checks pending. One Go split job completed under 15m at 598s. No completed job over 15m."}}
{"run":627,"commit":"d03225f","metric":0,"metrics":{"pending_checks":27,"go_split_completed_jobs":4,"go_split_over15_jobs":0,"go_split_max_seconds":754,"split_macos_intel_over15_jobs":0,"split_macos_intel_completed_jobs":0,"split_macos_intel_max_seconds":0,"all_completed_over15_jobs":0},"status":"keep","description":"monitor setup-go retry run with all Go split jobs completed","timestamp":1777127599245,"segment":289,"confidence":null,"iterationTokens":1718,"asi":{"hypothesis":"All four Go workflow split jobs should complete under 15m after setup-go retry push.","result":"No failed checks observed; 27 checks pending. All four Go split jobs completed under 15m, max 754s (~12m34s). No completed jobs over 15m."}}
{"run":628,"commit":"36eba06","metric":0,"metrics":{"pending_checks":24,"go_split_completed_jobs":4,"go_split_over15_jobs":0,"go_split_max_seconds":754,"split_macos_intel_over15_jobs":0,"split_macos_intel_completed_jobs":2,"split_macos_intel_max_seconds":846,"all_completed_over15_jobs":0},"status":"keep","description":"monitor setup-go retry run with two macOS Intel split jobs completed","timestamp":1777127919005,"segment":289,"confidence":null,"iterationTokens":1746,"asi":{"hypothesis":"Continue monitoring setup-go retry run; macOS Intel split jobs should remain under 15m.","result":"No failed checks observed; 24 checks pending. All four Go split jobs completed under 15m. Two macOS Intel split jobs completed under 15m, max 846s. No completed jobs over 15m."}}
{"run":629,"commit":"c0b202b","metric":0,"metrics":{"pending_checks":22,"go_split_completed_jobs":4,"go_split_over15_jobs":0,"go_split_max_seconds":754,"split_macos_intel_over15_jobs":0,"split_macos_intel_completed_jobs":3,"split_macos_intel_max_seconds":846,"all_completed_over15_jobs":0},"status":"keep","description":"monitor setup-go retry run with 22 checks pending","timestamp":1777128239383,"segment":289,"confidence":null,"iterationTokens":1763,"asi":{"hypothesis":"Continue monitoring setup-go retry run; no failures or over-15 completed jobs should appear.","result":"No failed checks observed; 22 checks pending. All four Go split jobs and three macOS Intel split jobs completed under 15m. No completed jobs over 15m."}}
{"run":630,"commit":"4ff0b04","metric":0,"metrics":{"pending_checks":18,"go_split_completed_jobs":4,"go_split_over15_jobs":0,"go_split_max_seconds":754,"split_macos_intel_over15_jobs":0,"split_macos_intel_completed_jobs":6,"split_macos_intel_max_seconds":846,"all_completed_over15_jobs":0},"status":"keep","description":"monitor setup-go retry run with 18 checks pending","timestamp":1777128560954,"segment":289,"confidence":null,"iterationTokens":1728,"asi":{"hypothesis":"Continue monitoring setup-go retry run; targeted split jobs should remain below 15m as more finish.","result":"No failed checks observed; 18 checks pending. All four Go split jobs and six macOS Intel split jobs completed under 15m. No completed jobs over 15m."}}
{"run":631,"commit":"54c1579","metric":0,"metrics":{"pending_checks":16,"go_split_completed_jobs":4,"go_split_over15_jobs":0,"go_split_max_seconds":754,"split_macos_intel_over15_jobs":0,"split_macos_intel_completed_jobs":8,"split_macos_intel_max_seconds":846,"all_completed_over15_jobs":0},"status":"keep","description":"monitor setup-go retry run with 16 checks pending","timestamp":1777128878874,"segment":289,"confidence":null,"iterationTokens":1781,"asi":{"hypothesis":"Finish the current monitoring cycle before stopping per user request; targeted split jobs should remain under 15m and failure-free.","result":"No failed checks observed; 16 checks pending. All four Go split jobs and eight macOS Intel split jobs completed under 15m. No completed jobs over 15m."}}
{"run":632,"commit":"8828715","metric":0,"metrics":{"pending_checks":14,"go_split_completed_jobs":4,"go_split_over15_jobs":0,"go_split_max_seconds":754,"split_macos_intel_over15_jobs":0,"split_macos_intel_completed_jobs":9,"split_macos_intel_max_seconds":846,"all_completed_over15_jobs":0},"status":"keep","description":"resume monitoring setup-go retry run with 14 checks pending","timestamp":1777128918218,"segment":289,"confidence":null,"iterationTokens":14369,"asi":{"hypothesis":"Resume after context-limit stop by reading ideas/logs and checking current PR state; targeted Go workflow and macOS Intel split jobs should remain under 15m with no failures.","result":"No failed checks observed; 14 checks pending. All four Go split jobs and nine macOS Intel split jobs completed under 15m. No completed jobs over 15m."}}
{"run":633,"commit":"fc421e7","metric":0,"metrics":{"pending_checks":13,"go_split_completed_jobs":4,"go_split_over15_jobs":0,"go_split_max_seconds":754,"split_macos_intel_over15_jobs":0,"split_macos_intel_completed_jobs":9,"split_macos_intel_max_seconds":846,"all_completed_over15_jobs":0},"status":"keep","description":"monitor setup-go retry run with 13 checks pending","timestamp":1777129235222,"segment":289,"confidence":null,"iterationTokens":1807,"asi":{"hypothesis":"Continue monitoring setup-go retry run; pending macOS jobs should complete without failures or over-15 durations.","result":"No failed checks observed; 13 checks pending. All four Go split jobs and nine macOS Intel split jobs completed under 15m. No completed jobs over 15m."}}
{"run":634,"commit":"9181efd","metric":0,"metrics":{"pending_checks":8,"go_split_completed_jobs":4,"go_split_over15_jobs":0,"go_split_max_seconds":754,"split_macos_intel_over15_jobs":0,"split_macos_intel_completed_jobs":14,"split_macos_intel_max_seconds":846,"all_completed_over15_jobs":0},"status":"keep","description":"monitor setup-go retry run with eight checks pending","timestamp":1777129557908,"segment":289,"confidence":null,"iterationTokens":1755,"asi":{"hypothesis":"Continue monitoring setup-go retry run; final macOS jobs should remain under 15m and no failures should appear.","result":"No failed checks observed; 8 checks pending. All four Go split jobs and fourteen macOS Intel split jobs completed under 15m. No completed jobs over 15m."}}
{"run":635,"commit":"14f279b","metric":0,"metrics":{"pending_checks":5,"go_split_completed_jobs":4,"go_split_over15_jobs":0,"go_split_max_seconds":754,"split_macos_intel_over15_jobs":0,"split_macos_intel_completed_jobs":16,"split_macos_intel_max_seconds":846,"all_completed_over15_jobs":0},"status":"keep","description":"monitor setup-go retry run with five checks pending","timestamp":1777129880709,"segment":289,"confidence":null,"iterationTokens":1700,"asi":{"hypothesis":"Continue monitoring setup-go retry run; remaining macOS Intel split jobs should complete under 15m without failures.","result":"No failed checks observed; 5 checks pending. All four Go split jobs and sixteen macOS Intel split jobs completed under 15m. No completed jobs over 15m."}}
{"run":636,"commit":"29293fe","metric":0,"metrics":{"pending_checks":2,"go_split_completed_jobs":4,"go_split_over15_jobs":0,"go_split_max_seconds":754,"split_macos_intel_over15_jobs":0,"split_macos_intel_completed_jobs":19,"split_macos_intel_max_seconds":846,"all_completed_over15_jobs":0},"status":"keep","description":"monitor setup-go retry run with two checks pending","timestamp":1777130200237,"segment":289,"confidence":null,"iterationTokens":1583,"asi":{"hypothesis":"Continue monitoring setup-go retry run; final two checks should complete without failures, with targeted jobs under 15m.","result":"No failed checks observed; 2 checks pending. All four Go split jobs and nineteen macOS Intel split jobs completed under 15m. No completed jobs over 15m."}}
{"run":637,"commit":"8937a80","metric":0,"metrics":{"pending_checks":1,"go_split_completed_jobs":4,"go_split_over15_jobs":0,"go_split_max_seconds":754,"split_macos_intel_over15_jobs":0,"split_macos_intel_completed_jobs":19,"split_macos_intel_max_seconds":846,"all_completed_over15_jobs":0},"status":"keep","description":"monitor setup-go retry run with one host demo pending","timestamp":1777130519683,"segment":289,"confidence":null,"iterationTokens":1460,"asi":{"hypothesis":"Continue monitoring setup-go retry run; only one host-demo check remains and should complete without failures.","result":"No failed checks observed; 1 check pending. All four Go split jobs and nineteen macOS Intel split jobs completed under 15m. No completed jobs over 15m."}}
{"run":638,"commit":"a40ebc8","metric":0,"metrics":{"pending_checks":0,"go_split_completed_jobs":4,"go_split_over15_jobs":0,"go_split_max_seconds":754,"split_macos_intel_over15_jobs":1,"split_macos_intel_completed_jobs":20,"split_macos_intel_max_seconds":973,"all_completed_over15_jobs":1},"status":"keep","description":"monitor setup-go retry run completed without failures","timestamp":1777130839092,"segment":289,"confidence":null,"iterationTokens":1421,"asi":{"hypothesis":"The full setup-go retry run should complete without failures, with Go workflow split jobs under 15m and most macOS Intel split jobs under 15m; avoid further splitting unless repeated runs show stable over-target behavior.","result":"Full PR run completed with zero failures and zero pending checks. All four Go split jobs completed under 15m, max 754s (~12m34s). Twenty macOS Intel split jobs completed; one host-demo job exceeded 15m at 973s (~16m13s), likely runner variability compared with prior all-under-15 run."}}
{"type":"config","name":"Shard slow macOS Intel Go 1.21 host demos","metricName":"macos_host_demo_over15_jobs","metricUnit":"","bestDirection":"lower"}
{"run":639,"commit":"266ca8d","metric":1,"metrics":{"macos_host_demo_completed_jobs":2,"macos_host_demo_max_seconds":973},"status":"keep","description":"baseline Go 1.21 host demos exceeded 15m once","timestamp":1777130898222,"segment":290,"confidence":null,"iterationTokens":341,"asi":{"hypothesis":"The latest complete run has one remaining over-15 job: macOS Intel Go 1.21 host demos at 973s. Host demo sharding already exists in test_demo.sh and can split coverage without enabling unsafe parallelism.","result":"llgo-host-demos-macos-intel Go 1.21 took 16m13s; Go 1.24 took 9m21s."}}
{"run":640,"commit":"3b51d9b","metric":0,"metrics":{"macos_host_demo_completed_jobs":3,"macos_host_demo_max_seconds":487,"fake_host_shard0_cases":42,"fake_host_shard1_cases":42,"fake_host_sharded_cases":84,"fake_host_all_cases":84},"status":"keep","description":"shard slow Go 1.21 host demo job","timestamp":1777130934150,"segment":290,"confidence":null,"iterationTokens":1558,"asi":{"hypothesis":"Shard only macOS Intel Go 1.21 host demos into two sequential jobs using the existing LLGO_DEMO_SHARD mechanism. This preserves coverage, avoids unsafe LLGO_DEMO_JOBS parallelism, and should split the 973s job into sub-15m halves despite setup overhead.","result":"llgo.yml parses; test_demo.sh passes bash -n. Fake llgo validation shows local host demo selection is split evenly across two shards (42+42=84), preserving all selected host demo cases."}}
{"type":"config","name":"Validate workflows after host demo sharding","metricName":"workflow_validation_failures","metricUnit":"","bestDirection":"lower"}
{"run":641,"commit":"47466b1","metric":0,"metrics":{"workflow_files_checked":9,"action_files_checked":5,"shell_scripts_checked":4},"status":"keep","description":"validate workflows after host demo sharding","timestamp":1777130957894,"segment":291,"confidence":null,"iterationTokens":421,"asi":{"hypothesis":"Before pushing host demo sharding, validate all workflow/action YAML, relevant shell scripts, and llgo.yml structural assertions for the Go 1.21 host-demo shards.","result":"All workflow/action YAML parsed; relevant shell scripts passed bash -n; llgo.yml contains Go 1.21 host demo shard matrix entries and exports LLGO_DEMO_SHARD_INDEX/TOTAL."}}
{"type":"config","name":"Monitor PR after host demo sharding push","metricName":"pr_check_failures","metricUnit":"","bestDirection":"lower"}
{"run":642,"commit":"d13dc05","metric":0,"metrics":{"pending_checks":46},"status":"keep","description":"monitor PR immediately after host demo sharding push","timestamp":1777130990569,"segment":292,"confidence":null,"iterationTokens":241,"asi":{"hypothesis":"After pushing Go 1.21 host demo sharding, the new PR run should start without immediate failures and include sharded host-demo matrix entries.","result":"No failed checks observed; 46 checks pending immediately after push."}}
{"run":643,"commit":"d94db52","metric":0,"metrics":{"pending_checks":40,"go_split_completed_jobs":0,"go_split_over15_jobs":0,"go_split_max_seconds":0,"split_macos_intel_over15_jobs":0,"split_macos_intel_completed_jobs":0,"split_macos_intel_max_seconds":0,"macos_host_demo_over15_jobs":0,"macos_host_demo_completed_jobs":0,"macos_host_demo_max_seconds":0,"all_completed_over15_jobs":0},"status":"keep","description":"monitor host demo shard run after workflow fan-out","timestamp":1777131310668,"segment":292,"confidence":null,"iterationTokens":1527,"asi":{"hypothesis":"After workflow fan-out, host demo shard run should remain failure-free while jobs start.","result":"No failed checks observed; 40 checks pending. Targeted Go, macOS Intel, and host-demo jobs are still pending."}}
{"run":644,"commit":"054d0a0","metric":0,"metrics":{"pending_checks":34,"go_split_completed_jobs":1,"go_split_over15_jobs":0,"go_split_max_seconds":618,"split_macos_intel_over15_jobs":0,"split_macos_intel_completed_jobs":0,"split_macos_intel_max_seconds":0,"macos_host_demo_over15_jobs":0,"macos_host_demo_completed_jobs":0,"macos_host_demo_max_seconds":0,"all_completed_over15_jobs":0},"status":"keep","description":"monitor host demo shard run with first Go split job completed","timestamp":1777131633066,"segment":292,"confidence":null,"iterationTokens":1916,"asi":{"hypothesis":"Continue monitoring host demo shard run; split jobs should remain under 15m and no failures should appear.","result":"No failed checks observed; 34 checks pending. One Go split job completed under 15m; host-demo jobs still pending."}}
{"run":645,"commit":"aefae3d","metric":0,"metrics":{"pending_checks":26,"go_split_completed_jobs":4,"go_split_over15_jobs":0,"go_split_max_seconds":669,"split_macos_intel_over15_jobs":0,"split_macos_intel_completed_jobs":2,"split_macos_intel_max_seconds":682,"macos_host_demo_over15_jobs":0,"macos_host_demo_completed_jobs":0,"macos_host_demo_max_seconds":0,"all_completed_over15_jobs":0},"status":"keep","description":"monitor host demo shard run with all Go split jobs completed","timestamp":1777131960456,"segment":292,"confidence":null,"iterationTokens":1980,"asi":{"hypothesis":"Go split jobs should complete under 15m and host demo shard jobs should start without failures.","result":"No failed checks observed; 26 checks pending. All four Go split jobs completed under 15m, max 669s. Two macOS Intel split jobs completed under 15m; host-demo shards are pending."}}
{"run":646,"commit":"69314f8","metric":0,"metrics":{"pending_checks":22,"go_split_completed_jobs":4,"go_split_over15_jobs":0,"go_split_max_seconds":669,"split_macos_intel_over15_jobs":0,"split_macos_intel_completed_jobs":5,"split_macos_intel_max_seconds":682,"macos_host_demo_over15_jobs":0,"macos_host_demo_completed_jobs":0,"macos_host_demo_max_seconds":0,"all_completed_over15_jobs":0},"status":"keep","description":"monitor host demo shard run with 22 checks pending","timestamp":1777132280524,"segment":292,"confidence":null,"iterationTokens":2013,"asi":{"hypothesis":"Continue monitoring host demo shard run; no failures or over-15 completed jobs should appear as macOS jobs progress.","result":"No failed checks observed; 22 checks pending. All four Go split jobs and five macOS Intel split jobs completed under 15m; host-demo shards are still pending."}}
