{"run":924,"commit":"9b54e8b","metric":0,"metrics":{"pending_checks":41,"passed_checks":16,"skipped_checks":0,"llgo_in_pr_diff":0},"status":"keep","description":"monitor PR while digest guard CI progresses","timestamp":1777213758919,"segment":444,"confidence":null,"iterationTokens":447,"asi":{"hypothesis":"The digestFilesWithOverlay sort guard PR run should continue without failures while local dependency-sort micro-change has been reverted.","result":"0 failures, 16 passed, 41 pending, root llgo absent from PR diff."}}
{"type":"config","name":"Avoid sortDeps clone for single dependency","metricName":"manifest_build_ns_op","metricUnit":"","bestDirection":"lower"}
{"run":925,"commit":"2427545","metric":7425,"metrics":{"manifest_build_allocs_op":105,"runs":7},"status":"keep","description":"baseline manifest Build with single dependency","timestamp":1777213795837,"segment":445,"confidence":null,"iterationTokens":585,"asi":{"hypothesis":"sortDeps clones the dependency slice even for one dependency. Benchmark manifest Build with a single dep before returning the original slice for len==1.","result":"BenchmarkManifestBuildSingleDep median was 7425 ns/op and 105 allocs/op across 7 runs."}}
{"run":926,"commit":"2427545","metric":6854,"metrics":{"manifest_build_allocs_op":103,"runs":7},"status":"discard","description":"avoid sortDeps clone for single dependency","timestamp":1777213871917,"segment":445,"confidence":null,"iterationTokens":1269,"asi":{"hypothesis":"Returning the original dependency slice for len==1 should avoid a clone allocation in manifest Build for single-dependency packages.","result":"internal/build tests passed and BenchmarkManifestBuildSingleDep improved from 7425ns/105 allocs to 6854ns/103 allocs, but the absolute median gain is only ~0.57µs and unlikely to matter in real builds.","rollback_reason":"Too small in absolute terms for user-visible build speed; avoid adding aliasing assumptions to sortDeps for a tiny microbenchmark gain.","next_action_hint":"Do not revisit sortDeps len==1 unless a full fingerprint profile shows manifest dependency sorting/cloning is material."}}
{"type":"config","name":"Record rejected sortDeps single-dep clone skip","metricName":"validation_failures","metricUnit":"","bestDirection":"lower"}
{"run":927,"commit":"c73e411","metric":0,"metrics":{"ideas_updated":1},"status":"keep","description":"record rejected sortDeps single-dep clone skip","timestamp":1777213907202,"segment":446,"confidence":null,"iterationTokens":175,"asi":{"hypothesis":"Record the rejected sortDeps len==1 experiment to avoid repeating a tiny aliasing-sensitive micro-optimization.","result":"Ideas backlog now notes the 7425ns->6854ns sortDeps single-dep clone skip was rejected because the absolute gain is too small."}}
{"type":"config","name":"Monitor PR after local tiny sort experiments","metricName":"pr_check_failures","metricUnit":"","bestDirection":"lower"}
{"run":928,"commit":"4a810a0","metric":0,"metrics":{"pending_checks":35,"passed_checks":22,"skipped_checks":0,"llgo_in_pr_diff":0},"status":"keep","description":"monitor PR after local tiny sort experiments","timestamp":1777213938761,"segment":447,"confidence":null,"iterationTokens":447,"asi":{"hypothesis":"The pushed digestFilesWithOverlay sort guard PR run should continue without failures; local tiny sort experiments were reverted except ideas metadata.","result":"0 failures, 22 passed, 35 pending, root llgo absent from PR diff."}}
{"type":"config","name":"Hoist collectEnvInputs env var list","metricName":"collect_env_ns_op","metricUnit":"","bestDirection":"lower"}
{"run":929,"commit":"43fe761","metric":734,"metrics":{"collect_env_allocs_op":7,"runs":7},"status":"keep","description":"baseline collectEnvInputs env var list","timestamp":1777213983053,"segment":448,"confidence":null,"iterationTokens":605,"asi":{"hypothesis":"collectEnvInputs constructs the same environment-variable slice for every package fingerprint; hoisting it may reduce per-package overhead.","result":"BenchmarkCollectEnvInputs median was 734 ns/op and 7 allocs/op across 7 runs. Baseline is already small; only clear changes should be kept."}}
{"run":930,"commit":"43fe761","metric":730,"metrics":{"collect_env_allocs_op":7,"runs":7},"status":"discard","description":"hoist collectEnvInputs env var list","timestamp":1777214050418,"segment":448,"confidence":null,"iterationTokens":1447,"asi":{"hypothesis":"Hoisting collectEnvInputs' constant env-var list to a package-level array should avoid recreating the same slice per package fingerprint.","result":"internal/build tests passed, but benchmark only moved from 734ns to 730ns with unchanged allocations, a noise-level result.","rollback_reason":"No meaningful performance improvement; avoid package-level variable churn.","next_action_hint":"Do not revisit collectEnvInputs env-var list hoisting; its overhead is not material."}}
{"type":"config","name":"Record rejected collectEnvInputs hoist","metricName":"validation_failures","metricUnit":"","bestDirection":"lower"}
{"run":931,"commit":"9b85791","metric":0,"metrics":{"ideas_updated":1},"status":"keep","description":"record rejected collectEnvInputs hoist","timestamp":1777214080034,"segment":449,"confidence":null,"iterationTokens":172,"asi":{"hypothesis":"Record the rejected collectEnvInputs env-var list hoist to avoid repeating an unchanged-allocation/noise-level experiment.","result":"Ideas backlog now notes the 734ns->730ns hoist was rejected."}}
{"type":"config","name":"Monitor PR after collectEnvInputs experiment reverted","metricName":"pr_check_failures","metricUnit":"","bestDirection":"lower"}
{"run":932,"commit":"d7e36d8","metric":0,"metrics":{"pending_checks":32,"passed_checks":29,"skipped_checks":0,"llgo_in_pr_diff":0},"status":"keep","description":"monitor PR after collectEnvInputs experiment reverted","timestamp":1777214110452,"segment":450,"confidence":null,"iterationTokens":448,"asi":{"hypothesis":"Pushed digest sort guard run should continue progressing without failures; local collectEnvInputs experiment was reverted and only ideas metadata changed locally.","result":"0 failures, 29 passed, 32 pending, root llgo absent from PR diff."}}
{"type":"config","name":"Use slices.SortFunc for file digest sorting","metricName":"digest_files_ns_op","metricUnit":"","bestDirection":"lower"}
{"run":933,"commit":"c8e0fd8","metric":10849,"metrics":{"digest_files_allocs_op":20,"runs":7},"status":"keep","description":"baseline multi-file digest sorting","timestamp":1777214168945,"segment":451,"confidence":null,"iterationTokens":679,"asi":{"hypothesis":"For multi-file lists, digestFilesWithOverlay still uses reflect-based sort.Slice. Benchmark before trying slices.SortFunc on fileDigest.Path.","result":"BenchmarkDigestFilesWithOverlayEightFiles median was 10849 ns/op and 20 allocs/op across 7 runs."}}
{"run":934,"commit":"c8e0fd8","metric":10501,"metrics":{"digest_files_allocs_op":17,"runs":7},"status":"discard","description":"use slices.SortFunc for fileDigest sorting","timestamp":1777214234038,"segment":451,"confidence":null,"iterationTokens":1706,"asi":{"hypothesis":"Replacing sort.Slice with slices.SortFunc for multi-file digest sorting should avoid reflect-based sort overhead.","result":"internal/build tests passed and allocations dropped from 20 to 17, but wall-time median only improved from 10849ns to 10501ns (~0.35µs), which is too small/noisy for real build impact.","rollback_reason":"Absolute wall-time gain is too small and adding a new import/change is not justified.","next_action_hint":"Do not revisit fileDigest sort implementation unless full fingerprint profiles show sorting dominates for large file lists."}}
{"type":"config","name":"Record rejected fileDigest SortFunc experiment","metricName":"validation_failures","metricUnit":"","bestDirection":"lower"}
{"run":935,"commit":"2abc733","metric":0,"metrics":{"ideas_updated":1},"status":"keep","description":"record rejected fileDigest SortFunc experiment","timestamp":1777214260661,"segment":452,"confidence":null,"iterationTokens":175,"asi":{"hypothesis":"Record the rejected slices.SortFunc fileDigest sorting experiment to avoid repeating a tiny allocation-only-ish improvement.","result":"Ideas backlog now notes the 10849ns->10501ns SortFunc result was rejected as too small in absolute wall time."}}
{"type":"config","name":"Monitor PR after SortFunc experiment reverted","metricName":"pr_check_failures","metricUnit":"","bestDirection":"lower"}
{"run":936,"commit":"2e89739","metric":0,"metrics":{"pending_checks":28,"passed_checks":34,"skipped_checks":0,"llgo_in_pr_diff":0},"status":"keep","description":"monitor PR after SortFunc experiment reverted","timestamp":1777214302312,"segment":453,"confidence":null,"iterationTokens":175,"asi":{"hypothesis":"The pushed digestFilesWithOverlay sort guard PR run should continue without failures while local SortFunc experiment was reverted and only ideas metadata changed locally.","result":"0 failures, 34 passed, 28 pending, root llgo absent from PR diff.","next_action_hint":"User asked to fetch latest PR build times and add one more comparison to the PR while preserving the existing two comparisons."}}
{"run":937,"commit":"e9d5ee5","metric":0,"metrics":{"pending_checks":23,"passed_checks":40,"skipped_checks":1,"llgo_in_pr_diff":0},"status":"keep","description":"monitor PR before collecting latest build times","timestamp":1777214646716,"segment":453,"confidence":null,"iterationTokens":5429,"asi":{"hypothesis":"Before adding the latest build-time comparison to the PR, wait for the current PR run to progress enough to collect complete timings.","result":"After 5 minutes, current run still has 0 failures, 40 passed, 23 pending, 1 skipped, and root llgo absent from PR diff. Need wait for remaining macOS/embedded jobs before computing final latest runtime comparison."}}
{"run":938,"commit":"ca31e6d","metric":0,"metrics":{"pending_checks":15,"passed_checks":48,"skipped_checks":1,"llgo_in_pr_diff":0},"status":"keep","description":"monitor PR while latest build-time run completes","timestamp":1777215272215,"segment":453,"confidence":null,"iterationTokens":1132,"asi":{"hypothesis":"The latest PR run must complete before collecting final build-time comparison numbers for the PR body.","result":"After another 10 minutes, current run still has 0 failures, 48 passed, 15 pending, 1 skipped, root llgo absent from PR diff."}}
{"run":939,"commit":"7c34512","metric":0,"metrics":{"pending_checks":7,"passed_checks":56,"skipped_checks":1,"llgo_in_pr_diff":0},"status":"keep","description":"monitor PR with seven checks remaining before timing update","timestamp":1777215902740,"segment":453,"confidence":null,"iterationTokens":1021,"asi":{"hypothesis":"The latest PR run should continue completing without failures before timing data is finalized for the PR body.","result":"0 failures, 56 passed, 7 pending, 1 skipped, root llgo absent from PR diff."}}
{"run":940,"commit":"c231e4c","metric":0,"metrics":{"pending_checks":3,"passed_checks":60,"skipped_checks":1,"llgo_in_pr_diff":0},"status":"keep","description":"monitor PR with three checks remaining before timing update","timestamp":1777216346740,"segment":453,"confidence":null,"iterationTokens":1034,"asi":{"hypothesis":"The latest PR run should be nearly complete before collecting final runtime metrics for the PR body.","result":"0 failures, 60 passed, 3 pending, 1 skipped, root llgo absent from PR diff."}}
{"run":941,"commit":"84c6a6e","metric":0,"metrics":{"pending_checks":2,"passed_checks":61,"skipped_checks":1,"llgo_in_pr_diff":0},"status":"keep","description":"monitor PR with two checks remaining before timing update","timestamp":1777216673866,"segment":453,"confidence":null,"iterationTokens":994,"asi":{"hypothesis":"The final pending host-demo checks should complete soon before collecting latest runtime metrics for the PR body.","result":"0 failures, 61 passed, 2 pending, 1 skipped, root llgo absent from PR diff."}}
{"run":942,"commit":"9407a46","metric":0,"metrics":{"pending_checks":0,"passed_checks":63,"skipped_checks":1,"llgo_in_pr_diff":0},"status":"keep","description":"monitor PR final state before timing update","timestamp":1777216934045,"segment":453,"confidence":null,"iterationTokens":1002,"asi":{"hypothesis":"The latest PR run should complete successfully before updating the PR body with current runtime metrics.","result":"All checks complete: 0 failures, 0 pending, 63 passed, 1 skipped, root llgo absent from PR diff."}}
{"run":943,"commit":"c936cf9","metric":0,"metrics":{"pending_checks":0,"passed_checks":63,"skipped_checks":1,"llgo_in_pr_diff":0,"latest_non_skipped_jobs":61,"latest_skipped_jobs":1,"latest_longest_job_seconds":940,"latest_total_runner_seconds":19867,"latest_wall_seconds":3279},"status":"keep","description":"collect latest PR runtime metrics for body update","timestamp":1777216981640,"segment":453,"confidence":null,"iterationTokens":2284,"asi":{"hypothesis":"Fetch the completed current-head PR run timings from GitHub Actions job startedAt/completedAt timestamps so the PR body can be updated with a third comparison while preserving existing comparison sections.","result":"Latest head c91b929 run IDs 24958910767, 24958910771, 24958910772, 24958910760, 24958910769, 24958910777, 24958910775, 24958910774: 61 non-skipped jobs, 1 skipped, longest job 15m40s, total runner time 5h31m07s, end-to-end wall time 54m39s."}}
{"type":"config","name":"Verify PR body latest runtime comparison update","metricName":"pr_body_update_failures","metricUnit":"","bestDirection":"lower"}
{"run":944,"commit":"938dc37","metric":0,"metrics":{"latest_wall_seconds":3279,"latest_total_runner_seconds":19867,"latest_longest_job_seconds":940},"status":"keep","description":"verify PR body latest runtime comparison update","timestamp":1777217039958,"segment":454,"confidence":null,"iterationTokens":361,"asi":{"hypothesis":"The PR body update should preserve the existing CI Runtime Comparison and Workflow-Level Comparison sections while adding exactly one latest-head runtime comparison section.","result":"Verified PR body contains the original two comparison sections plus new 'Latest PR Head Runtime (additional snapshot)' for c91b929. Latest metrics included: wall 54m39s, total runner 5h31m07s, longest job 15m40s."}}
{"type":"config","name":"Avoid empty otherFiles slice allocation in collectPackageInputs","metricName":"collect_package_ns_op","metricUnit":"","bestDirection":"lower"}
{"run":945,"commit":"bb328ad","metric":30717,"metrics":{"collect_package_allocs_op":25,"runs":7},"status":"keep","description":"baseline collectPackageInputs no other files","timestamp":1777217096875,"segment":455,"confidence":null,"iterationTokens":760,"asi":{"hypothesis":"collectPackageInputs copies p.OtherFiles even when it is empty before appending selected .s files. Benchmark package fingerprint input collection for a package with one Go file and no other files before avoiding the empty copy.","result":"BenchmarkCollectPackageInputsNoOtherFiles median was 30717 ns/op and 25 allocs/op across 7 runs. This includes filesystem glob/stat overhead, so only clear changes should be kept."}}
{"run":946,"commit":"bb328ad","metric":30287,"metrics":{"collect_package_allocs_op":25,"runs":7},"status":"discard","description":"avoid empty p.OtherFiles copy in collectPackageInputs","timestamp":1777217166143,"segment":455,"confidence":null,"iterationTokens":2029,"asi":{"hypothesis":"Only copying p.OtherFiles when non-empty should avoid unnecessary work for packages with no OtherFiles/SFiles in fingerprint collection.","result":"internal/build tests passed, but benchmark moved from 30717ns to 30287ns with unchanged allocations; the ~0.43µs gain is too small/noisy relative to filesystem glob/stat overhead.","rollback_reason":"Not a clear local improvement and adds branching/code churn for negligible wall-time impact.","next_action_hint":"Do not revisit p.OtherFiles copy avoidance unless collectPackageInputs allocation profiles show it matters."}}
{"type":"config","name":"Record rejected collectPackageInputs otherFiles tweak","metricName":"validation_failures","metricUnit":"","bestDirection":"lower"}
{"run":947,"commit":"e9c29b3","metric":0,"metrics":{"ideas_updated":1},"status":"keep","description":"record rejected collectPackageInputs otherFiles tweak","timestamp":1777217206586,"segment":456,"confidence":null,"iterationTokens":175,"asi":{"hypothesis":"Record the rejected collectPackageInputs p.OtherFiles copy avoidance so future loops avoid repeating a negligible/no-allocation experiment.","result":"Ideas backlog now notes the 30717ns->30287ns p.OtherFiles copy tweak was rejected."}}
{"type":"config","name":"Optimize newlib ESP file-list joining","metricName":"newlib_config_ns_op","metricUnit":"","bestDirection":"lower"}
{"run":948,"commit":"938dc37","metric":0,"metrics":{"runs":0},"status":"crash","description":"baseline newlib ESP config joining benchmark harness","timestamp":1777217294946,"segment":457,"confidence":null,"iterationTokens":555,"asi":{"hypothesis":"Benchmark Newlib ESP compile config construction to see whether joinFileList/path normalization overhead is a promising LLGo target-build optimization path.","result":"The Go benchmark ran at roughly 113–122µs/op, but the parser expected allocation columns that were absent because the benchmark did not call b.ReportAllocs().","rollback_reason":"Harness parsing bug; no source changes should be inferred.","next_action_hint":"Retry with b.ReportAllocs() in the temporary benchmark."}}
{"run":949,"commit":"15acb64","metric":112251,"metrics":{"newlib_config_allocs_op":1418,"runs":7},"status":"keep","description":"baseline newlib ESP config joining","timestamp":1777217314914,"segment":457,"confidence":null,"iterationTokens":1025,"asi":{"hypothesis":"Newlib ESP compile config construction repeatedly joins thousands of file-list entries; benchmark before optimizing joinFileList path normalization for LLGo target-build setup.","result":"BenchmarkNewlibESP32CompileConfigRISCV median was 112251 ns/op and 1418 allocs/op across 7 runs."}}
{"run":950,"commit":"6b8e5ea","metric":53352,"metrics":{"newlib_config_allocs_op":1424,"runs":7},"status":"keep","description":"use prefix concatenation in newlib joinFileList","timestamp":1777217346204,"segment":457,"confidence":null,"iterationTokens":1764,"asi":{"hypothesis":"newlib joinFileList joins thousands of known relative slash-separated paths under one root; precomputing a root prefix and concatenating filepath.FromSlash(item) should avoid per-entry filepath.Join cleanup overhead while preserving generated paths for relative file-list entries.","result":"libc tests passed. BenchmarkNewlibESP32CompileConfigRISCV improved from 112251 ns/op to 53352 ns/op across 7 runs; allocations were similar/slightly higher (1418 to 1424) because path strings still dominate.","next_action_hint":"Add/verify tests comparing joinFileList output with filepath.Join for normal roots and trailing separators, then run broader crosscompile tests and temp cmd/llgo build before pushing."}}
{"type":"config","name":"Validate newlib joinFileList prefix optimization","metricName":"validation_failures","metricUnit":"","bestDirection":"lower"}
{"run":951,"commit":"feaca96","metric":0,"metrics":{"packages_tested":4,"temp_builds":1},"status":"keep","description":"validate newlib joinFileList prefix optimization","timestamp":1777217426562,"segment":458,"confidence":null,"iterationTokens":245,"asi":{"hypothesis":"The prefix-concatenation joinFileList optimization should match filepath.Join for normal and trailing-separator roots, pass crosscompile tests, and not affect cmd/llgo dev build output.","result":"Added TestJoinFileList comparing optimized output with filepath.Join. go test ./internal/crosscompile/compile/libc, go test ./internal/crosscompile/..., and temp-path go build -tags=dev ./cmd/llgo passed; root llgo was not created."}}
{"run":952,"commit":"830064c","metric":0,"metrics":{"packages_tested":1,"temp_builds":0,"newlib_config_ns_op":56504,"newlib_config_allocs_op":1424,"runs":7},"status":"keep","description":"validate cleaned-root newlib joinFileList optimization","timestamp":1777217491701,"segment":458,"confidence":null,"iterationTokens":1665,"asi":{"hypothesis":"Clean the root once before prefix concatenation so joinFileList remains closer to filepath.Join semantics for non-canonical roots while preserving most of the benchmark gain.","result":"libc tests passed. Newlib config benchmark was 56504 ns/op and 1424 allocs/op, still roughly 2x faster than original 112251 ns/op while using filepath.Clean once per list instead of filepath.Join per entry.","next_action_hint":"Run broader validation again after adding ideas entry, then push if clean."}}
{"type":"config","name":"Validate and record newlib joinFileList optimization","metricName":"validation_failures","metricUnit":"","bestDirection":"lower"}
{"run":953,"commit":"f50ec04","metric":0,"metrics":{"packages_tested":4,"temp_builds":1,"ideas_updated":1},"status":"keep","description":"validate and record newlib joinFileList optimization","timestamp":1777217564453,"segment":459,"confidence":null,"iterationTokens":273,"asi":{"hypothesis":"The newlib joinFileList prefix-concatenation optimization should pass broad crosscompile validation, temp-path cmd/llgo build, root binary guard, and be recorded in the ideas backlog.","result":"go test ./internal/crosscompile/compile/libc, go test ./internal/crosscompile/..., and temp-path go build -tags=dev ./cmd/llgo passed; root llgo was not created; ideas backlog records the 112251ns/op to ~56504ns/op improvement."}}
{"type":"config","name":"Monitor PR after pushing newlib joinFileList optimization","metricName":"pr_check_failures","metricUnit":"","bestDirection":"lower"}
