{"run":525,"commit":"b3bd610","metric":0,"metrics":{"pending_checks":27,"split_macos_intel_over15_jobs":0,"split_macos_intel_completed_jobs":0,"split_macos_intel_max_seconds":0},"status":"keep","description":"monitor embedded demo shard with 27 checks pending","timestamp":1777104590323,"segment":267,"confidence":null,"iterationTokens":1061,"asi":{"hypothesis":"Continue monitoring the sharded embedded-demo run; no failures should appear before split jobs complete.","result":"No failed checks observed; 27 checks pending."}}
{"run":526,"commit":"b3bd610","metric":1,"metrics":{"pending_checks":24,"split_macos_intel_over15_jobs":0,"split_macos_intel_completed_jobs":1,"split_macos_intel_max_seconds":463},"status":"checks_failed","description":"monitor embedded demo shard found esp32 failure","timestamp":1777104905163,"segment":267,"confidence":null,"iterationTokens":1046,"asi":{"hypothesis":"The targeted sharding should not affect the unsharded Go 1.21 esp32 embedded job.","result":"A failure appeared in llgo-embedded-macos-intel (19, 1.21.13, esp32) after 2m37s.","rollback_reason":"CI failure occurred after the shard change; inspect logs to determine if this is related to matrix rewrite, transient download, or an independent flaky embedded demo issue.","next_action_hint":"Fetch job 72996557831 logs. If failure is transient upstream/download, add/rely on retry or rerun; if matrix/env change broke unsharded esp32, fix or revert."}}
{"run":527,"commit":"ca95148","metric":1,"metrics":{"pending_checks":24,"split_macos_intel_over15_jobs":0,"split_macos_intel_completed_jobs":1,"split_macos_intel_max_seconds":463},"status":"keep","description":"rerun transient setup-go DNS failure in embedded demo shard run","timestamp":1777104944502,"segment":267,"confidence":null,"iterationTokens":5976,"asi":{"hypothesis":"The failed Go 1.21 esp32 embedded job failed in actions/setup-go due transient DNS (ENOTFOUND raw.githubusercontent.com/go.dev), unrelated to the sharding logic. Rerunning failed jobs should clear it.","result":"Triggered gh run rerun --failed for run 24926243858; stale failed status still visible immediately after rerun request."}}
{"run":528,"commit":"6f51699","metric":1,"metrics":{"pending_checks":19,"split_macos_intel_over15_jobs":0,"split_macos_intel_completed_jobs":3,"split_macos_intel_max_seconds":785},"status":"keep","description":"monitor rerun with stale setup-go DNS failure still visible","timestamp":1777105265296,"segment":267,"confidence":null,"iterationTokens":1983,"asi":{"hypothesis":"After rerun request, the stale setup-go DNS failure may remain reported until rerun completes; monitor split durations meanwhile.","result":"Stale Go 1.21 esp32 setup-go DNS failure is still reported. No new failures identified; three macOS Intel split jobs completed under 15m, max 785s."}}
{"run":529,"commit":"e854cbc","metric":1,"metrics":{"pending_checks":17,"split_macos_intel_over15_jobs":0,"split_macos_intel_completed_jobs":5,"split_macos_intel_max_seconds":785},"status":"keep","description":"monitor rerun with five split jobs completed","timestamp":1777105612519,"segment":267,"confidence":null,"iterationTokens":1308,"asi":{"hypothesis":"Continue monitoring while the rerun is queued; completed macOS Intel split jobs should stay under 15m.","result":"Stale setup-go DNS failure remains reported. Five macOS Intel split jobs completed under 15m, max 785s; 17 checks pending."}}
{"run":530,"commit":"464d217","metric":1,"metrics":{"pending_checks":15,"split_macos_intel_over15_jobs":0,"split_macos_intel_completed_jobs":5,"split_macos_intel_max_seconds":785},"status":"keep","description":"resume monitoring rerun with stale setup-go DNS failure","timestamp":1777105704306,"segment":267,"confidence":null,"iterationTokens":1018,"asi":{"hypothesis":"Resume after context-limit stop; stale setup-go DNS failure should clear after rerun completes, while sharded macOS Intel jobs continue under 15m.","result":"Stale setup-go DNS failure still reported; 15 checks pending. Five macOS Intel split jobs completed under 15m, max 785s."}}
{"run":531,"commit":"5c8ab09","metric":1,"metrics":{"pending_checks":12,"split_macos_intel_over15_jobs":0,"split_macos_intel_completed_jobs":8,"split_macos_intel_max_seconds":785},"status":"keep","description":"monitor rerun with eight split jobs completed","timestamp":1777106023367,"segment":267,"confidence":null,"iterationTokens":1135,"asi":{"hypothesis":"Continue monitoring while stale setup-go DNS failure remains; completed split jobs should stay below 15m.","result":"Stale setup-go DNS failure still reported; 12 checks pending. Eight macOS Intel split jobs completed under 15m, max 785s."}}
{"run":532,"commit":"15a8392","metric":1,"metrics":{"pending_checks":9,"split_macos_intel_over15_jobs":0,"split_macos_intel_completed_jobs":9,"split_macos_intel_max_seconds":785},"status":"keep","description":"monitor rerun with nine split jobs completed","timestamp":1777106342507,"segment":267,"confidence":null,"iterationTokens":1100,"asi":{"hypothesis":"Continue monitoring; all completed macOS Intel split jobs should remain below 15m while stale setup-go failure awaits rerun replacement.","result":"Stale setup-go DNS failure still reported; 9 checks pending. Nine macOS Intel split jobs completed under 15m, max 785s."}}
{"run":533,"commit":"ef20403","metric":1,"metrics":{"pending_checks":8,"split_macos_intel_over15_jobs":0,"split_macos_intel_completed_jobs":10,"split_macos_intel_max_seconds":785},"status":"keep","description":"monitor rerun with ten split jobs completed","timestamp":1777106667502,"segment":267,"confidence":null,"iterationTokens":1279,"asi":{"hypothesis":"Continue monitoring the sharded run despite stale setup-go DNS failure; completed split jobs should remain under 15m.","result":"Stale setup-go DNS failure still reported; 8 checks pending. Ten macOS Intel split jobs completed under 15m, max 785s."}}
{"run":534,"commit":"1944cbb","metric":1,"metrics":{"pending_checks":4,"split_macos_intel_over15_jobs":0,"split_macos_intel_completed_jobs":13,"split_macos_intel_max_seconds":785},"status":"keep","description":"monitor rerun with thirteen split jobs completed","timestamp":1777106984161,"segment":267,"confidence":null,"iterationTokens":1101,"asi":{"hypothesis":"Continue monitoring final pending main and host-demo jobs while stale setup-go DNS failure remains; split durations should stay under 15m.","result":"Stale setup-go DNS failure still reported; 4 checks pending. Thirteen macOS Intel split jobs completed under 15m, max 785s."}}
{"run":535,"commit":"21233be","metric":1,"metrics":{"pending_checks":0,"split_macos_intel_over15_jobs":0,"split_macos_intel_completed_jobs":16,"split_macos_intel_max_seconds":837},"status":"keep","description":"monitor sharded run completed with stale setup-go DNS failure","timestamp":1777107301059,"segment":267,"confidence":null,"iterationTokens":1119,"asi":{"hypothesis":"The targeted embedded demo shard should bring all macOS Intel split jobs under 15m; remaining failure is expected to be stale setup-go DNS unrelated to code changes.","result":"All checks completed except the stale failed Go 1.21 esp32 setup-go DNS job remains reported. Sixteen macOS Intel split jobs completed and all are under 15m; max completed split job is 837s. Main macOS Intel jobs completed in 3m27s and 4m47s."}}
{"run":536,"commit":"23c50a9","metric":0,"metrics":{"pending_checks":1,"split_macos_intel_over15_jobs":0,"split_macos_intel_completed_jobs":15,"split_macos_intel_max_seconds":837},"status":"keep","description":"rerun failed setup-go DNS job directly","timestamp":1777107325479,"segment":267,"confidence":null,"iterationTokens":1320,"asi":{"hypothesis":"Directly rerun the failed setup-go DNS job so the stale failed check is replaced without changing code.","result":"Direct job rerun succeeded in clearing failures; one replacement llgo-embedded-macos-intel Go 1.21 esp32 job is now pending."}}
{"run":537,"commit":"1fcc072","metric":0,"metrics":{"pending_checks":1,"split_macos_intel_over15_jobs":0,"split_macos_intel_completed_jobs":16,"split_macos_intel_max_seconds":837},"status":"keep","description":"monitor direct rerun with one embedded job pending","timestamp":1777107641323,"segment":267,"confidence":null,"iterationTokens":974,"asi":{"hypothesis":"Direct rerun should keep failures at zero while the replacement embedded Go 1.21 esp32 job executes.","result":"No failed checks observed; one replacement embedded job remains pending. Sixteen macOS Intel split jobs completed under 15m, max 837s."}}
{"run":538,"commit":"b05a50b","metric":0,"metrics":{"pending_checks":0,"split_macos_intel_over15_jobs":0,"split_macos_intel_completed_jobs":17,"split_macos_intel_max_seconds":837},"status":"keep","description":"monitor sharded embedded-demo run completed under target","timestamp":1777107957996,"segment":267,"confidence":null,"iterationTokens":1073,"asi":{"hypothesis":"Confirm direct rerun clears the transient setup-go DNS failure and all macOS Intel split jobs stay below the 15m target after sharding slow Go 1.21 esp32c3 demos.","result":"Full PR run now has zero failures and zero pending checks. Seventeen macOS Intel split jobs completed; all are under 15m, with max 837s (~13m57s)."}}
{"type":"config","name":"Monitor PR after pushing monitoring commits","metricName":"pr_check_failures","metricUnit":"","bestDirection":"lower"}
{"run":539,"commit":"ec817c5","metric":0,"metrics":{"pending_checks":41},"status":"keep","description":"monitor PR immediately after pushing monitor commits","timestamp":1777107986839,"segment":268,"confidence":null,"iterationTokens":239,"asi":{"hypothesis":"Pushing accumulated monitoring commits should start a new run without immediate failures.","result":"No failed checks observed; 41 checks pending after workflow fan-out."}}
{"run":540,"commit":"ec817c5","metric":3,"metrics":{"pending_checks":35,"split_macos_intel_over15_jobs":0,"split_macos_intel_completed_jobs":0,"split_macos_intel_max_seconds":0},"status":"checks_failed","description":"monitor new run found build-cache and hello failures","timestamp":1777108313299,"segment":268,"confidence":null,"iterationTokens":1126,"asi":{"hypothesis":"New run after pushing monitoring commits should remain failure-free; any failures need immediate triage before more optimization.","result":"Three failures appeared: build-cache macOS, build-cache Ubuntu, and hello macOS.","rollback_reason":"CI failures appeared in non-macOS-Intel-split jobs after push; need inspect logs to determine if transient dependency/download issue or a regression from recent changes.","next_action_hint":"Fetch failed job logs for build-cache macOS/Ubuntu and hello macOS; if transient external download, rerun or add retry; if related to workflow/script changes, fix or revert."}}
{"type":"config","name":"Increase crosscompile download retry budget","metricName":"download_retry_attempts","metricUnit":"","bestDirection":"higher"}
{"run":541,"commit":"7e1b819","metric":3,"metrics":{"observed_hello_esp_clang_502_attempts":3},"status":"keep","description":"baseline crosscompile retry budget still insufficient for repeated 502s","timestamp":1777108367619,"segment":269,"confidence":null,"iterationTokens":168,"asi":{"hypothesis":"The new hello macOS failure showed ESP Clang downloads returning 502 for all three attempts. Baseline crosscompile download retry budget of 3 attempts may be too low for transient GitHub release outages."}}
{"run":542,"commit":"2a75e4c","metric":5,"metrics":{"observed_hello_esp_clang_502_attempts":3,"download_retry_delay_seconds":2},"status":"keep","description":"increase crosscompile download retry budget","timestamp":1777108385825,"segment":269,"confidence":null,"iterationTokens":551,"asi":{"hypothesis":"Increase archive download attempts from 3 to 5 and retry delay from 1s to 2s so transient GitHub release 502 bursts do not fail ESP Clang/compiler-rt downloads immediately. This preserves coverage and only affects failure/retry paths.","result":"Focused crosscompile download tests pass."}}
{"type":"config","name":"Validate increased crosscompile retry budget","metricName":"validation_failures","metricUnit":"","bestDirection":"lower"}
{"run":543,"commit":"735fcc5","metric":0,"metrics":{"crosscompile_packages_tested":4},"status":"keep","description":"validate increased crosscompile retry budget","timestamp":1777108411326,"segment":270,"confidence":null,"iterationTokens":159,"asi":{"hypothesis":"Validate the broader crosscompile package after changing retry constants and parse the llgo workflow before pushing.","result":"internal/crosscompile/... tests passed and llgo workflow YAML parsed."}}
{"type":"config","name":"Monitor PR after increased retry push","metricName":"pr_check_failures","metricUnit":"","bestDirection":"lower"}
{"run":544,"commit":"2ffe25d","metric":0,"metrics":{"pending_checks":11},"status":"keep","description":"monitor PR after pushing increased retry budget","timestamp":1777108435622,"segment":271,"confidence":null,"iterationTokens":239,"asi":{"hypothesis":"After pushing the increased crosscompile retry budget, the new PR run should start without immediate failures and should be more resilient to GitHub release 502s.","result":"No failed checks observed; 11 checks pending immediately after push."}}
{"run":545,"commit":"70c97f6","metric":0,"metrics":{"pending_checks":36,"split_macos_intel_over15_jobs":0,"split_macos_intel_completed_jobs":0,"split_macos_intel_max_seconds":0},"status":"keep","description":"monitor increased retry run after workflow fan-out","timestamp":1777108751349,"segment":271,"confidence":null,"iterationTokens":1072,"asi":{"hypothesis":"After workflow fan-out, increased retry run should remain failure-free while jobs start.","result":"No failed checks observed; 36 checks pending."}}
{"run":546,"commit":"73bcb79","metric":0,"metrics":{"pending_checks":30,"split_macos_intel_over15_jobs":0,"split_macos_intel_completed_jobs":0,"split_macos_intel_max_seconds":0},"status":"keep","description":"monitor increased retry run with 30 checks pending","timestamp":1777109067090,"segment":271,"confidence":null,"iterationTokens":1247,"asi":{"hypothesis":"Continue monitoring increased-retry run; failures should stay zero and split jobs will complete later.","result":"No failed checks observed; 30 checks pending."}}
{"run":547,"commit":"33c467b","metric":0,"metrics":{"pending_checks":25,"split_macos_intel_over15_jobs":0,"split_macos_intel_completed_jobs":1,"split_macos_intel_max_seconds":657},"status":"keep","description":"monitor increased retry run with first split job completed","timestamp":1777109381982,"segment":271,"confidence":null,"iterationTokens":1315,"asi":{"hypothesis":"Continue monitoring increased-retry run; first macOS Intel split completions should be under 15m.","result":"No failed checks observed; 25 checks pending. One macOS Intel split job completed under 15m at 657s."}}
{"run":548,"commit":"9045b49","metric":0,"metrics":{"pending_checks":21,"split_macos_intel_over15_jobs":0,"split_macos_intel_completed_jobs":2,"split_macos_intel_max_seconds":657},"status":"keep","description":"monitor increased retry run with two split jobs completed","timestamp":1777109700923,"segment":271,"confidence":null,"iterationTokens":1348,"asi":{"hypothesis":"Continue monitoring increased-retry run; failures should remain zero while macOS Intel split jobs complete.","result":"No failed checks observed; 21 checks pending. Two macOS Intel split jobs completed under 15m, max 657s."}}
{"run":549,"commit":"75f8118","metric":0,"metrics":{"pending_checks":18,"split_macos_intel_over15_jobs":1,"split_macos_intel_completed_jobs":4,"split_macos_intel_max_seconds":1036},"status":"keep","description":"monitor increased retry run with one over-15 split job observed","timestamp":1777110017407,"segment":271,"confidence":null,"iterationTokens":1356,"asi":{"hypothesis":"The sharded embedded-demo run should keep macOS Intel split jobs under 15m; if a completed job is over target, identify it after logging and avoid premature changes until the full run completes.","result":"No failed checks observed; 18 checks pending. Four macOS Intel split jobs completed, one over 15m at 1036s."}}
{"type":"config","name":"Shard slow ESP32-C3 serial smoke cases","metricName":"esp_serial_case_shard_total","metricUnit":"","bestDirection":"higher"}
{"run":550,"commit":"53ce16a","metric":1,"metrics":{"macos_intel_go121_esp32c3_serial_seconds":1036,"esp32c3_serial_step_seconds":660},"status":"keep","description":"baseline ESP32-C3 serial smoke cases are unsharded","timestamp":1777110064952,"segment":272,"confidence":null,"iterationTokens":172,"asi":{"hypothesis":"A later run showed Go 1.21 ESP32-C3 serial smoke at 17m16s, dominated by an 11m serial step over three cases. Case-sharding the slow target should preserve coverage while getting each job below 15m."}}
{"run":551,"commit":"53ce16a","metric":0,"metrics":{"macos_intel_go121_esp32c3_serial_seconds":1036,"esp32c3_serial_step_seconds":660,"fake_serial_sharded_cases":0},"status":"crash","description":"attempt case-shard validation with inadequate fake llgo","timestamp":1777110151369,"segment":272,"confidence":null,"iterationTokens":4386,"asi":{"hypothesis":"Validate ESP serial case sharding with a fake llgo before keeping the workflow change.","result":"Validation command failed because the fake llgo produced no expected emulator output, causing the script's output-tail assertions to fail. This is a validation harness issue, not yet evidence against case sharding.","rollback_reason":"run_experiment exited non-zero during validation; revert partial case-shard edits and retry with a static selection-count validation or a fake llgo that emits expected tails.","next_action_hint":"Reapply case-shard edits, then validate by parsing selected case directories or using a fake llgo that prints each case's expect.txt content."}}
{"run":552,"commit":"53ce16a","metric":2,"metrics":{"macos_intel_go121_esp32c3_serial_seconds":1036,"esp32c3_serial_step_seconds":660,"fake_serial_shard0_cases":2,"fake_serial_shard1_cases":1,"fake_serial_sharded_cases":3},"status":"crash","description":"attempt case-shard validation with wrong invalid-env assertion","timestamp":1777110199459,"segment":272,"confidence":null,"iterationTokens":3797,"asi":{"hypothesis":"Revalidate ESP serial case sharding using static case selection and invalid-env checking.","result":"Static selection metrics were correct (2+1=3 cases), but the invalid-env assertion expected a TOTAL error while the script correctly failed earlier on missing INDEX.","rollback_reason":"run_experiment exited non-zero due to an overly specific validation assertion; revert partial edits and retry with a valid shard selection-only validation or correct invalid-env assertion.","next_action_hint":"Reapply case-shard edits; validate bash/YAML and static shard case counts, plus invalid env with both shard index and total set to test total=0."}}
{"run":553,"commit":"5932d0f","metric":2,"metrics":{"macos_intel_go121_esp32c3_serial_seconds":650,"esp32c3_serial_step_seconds":330,"fake_serial_shard0_cases":2,"fake_serial_shard1_cases":1,"fake_serial_sharded_cases":3},"status":"keep","description":"shard slow ESP32-C3 serial smoke cases","timestamp":1777110233021,"segment":272,"confidence":null,"iterationTokens":2802,"asi":{"hypothesis":"Shard only the slow Go 1.21 ESP32-C3 serial smoke job by testcase. This preserves all three serial smoke cases across two jobs and should bring each job below 15m despite setup overhead.","result":"Workflow YAML and shell syntax pass. Static validation shows shard 0 selects 2 cases, shard 1 selects 1 case, covering all 3 cases; invalid shard total is rejected."}}
{"type":"config","name":"Validate workflows after ESP serial case shard","metricName":"workflow_validation_failures","metricUnit":"","bestDirection":"lower"}
{"run":554,"commit":"607ac18","metric":0,"metrics":{"workflow_files_checked":8,"action_files_checked":5,"shell_scripts_checked":3,"crosscompile_packages_tested":1},"status":"keep","description":"validate workflows after ESP serial case shard","timestamp":1777110262137,"segment":273,"confidence":null,"iterationTokens":266,"asi":{"hypothesis":"Before pushing ESP serial case sharding, validate workflows/actions, edited shell scripts, and crosscompile tests after recent retry changes.","result":"All workflow/action YAML parsed; test_demo.sh, test-esp-serial-startup.sh, and install-esp-qemu.sh passed bash -n; internal/crosscompile tests passed."}}
{"type":"config","name":"Monitor PR after ESP serial case shard push","metricName":"pr_check_failures","metricUnit":"","bestDirection":"lower"}
{"run":555,"commit":"125dc71","metric":0,"metrics":{"pending_checks":16},"status":"keep","description":"monitor PR immediately after ESP serial case shard push","timestamp":1777110295385,"segment":274,"confidence":null,"iterationTokens":241,"asi":{"hypothesis":"After pushing ESP serial case sharding, the new run should start without immediate failures.","result":"No failed checks observed; 16 checks pending."}}
{"run":556,"commit":"8bd752a","metric":0,"metrics":{"pending_checks":37,"split_macos_intel_over15_jobs":0,"split_macos_intel_completed_jobs":0,"split_macos_intel_max_seconds":0},"status":"keep","description":"monitor ESP serial case shard after workflow fan-out","timestamp":1777110611996,"segment":274,"confidence":null,"iterationTokens":1082,"asi":{"hypothesis":"After workflow fan-out, ESP serial case sharding should show no immediate failures.","result":"No failed checks observed; 37 checks pending and macOS Intel split jobs are still running."}}
