{"run":236,"commit":"1667d15","metric":0,"metrics":{"test_helloworld_actions":1},"status":"keep","description":"remove verbose flag from test-helloworld ESP build","timestamp":1777053588718,"segment":126,"confidence":null,"iterationTokens":449,"asi":{"hypothesis":"Dropping -v from the ESP32 build in test-helloworld keeps the same build and output-file assertion while reducing log volume across hello and release artifact smoke jobs.","result":"test-helloworld action YAML parses and verbose llgo build flags dropped from 1 to 0."}}
{"type":"config","name":"Monitor PR checks after verbose build flag removals","metricName":"pr_check_failures","metricUnit":"","bestDirection":"lower"}
{"run":237,"commit":"c94e08b","metric":0,"metrics":{"pending_checks":9},"status":"keep","description":"monitor PR checks after local verbose build flag removals","timestamp":1777053635004,"segment":127,"confidence":null,"iterationTokens":172,"asi":{"hypothesis":"Check currently pushed CI while local verbose-build reductions are accumulating; failures should be handled before pushing more changes.","result":"No failed checks observed; 9 checks still pending in summary."}}
{"type":"config","name":"Remove doc workflow shell tracing","metricName":"doc_workflow_set_x_sites","metricUnit":"","bestDirection":"lower"}
{"run":238,"commit":"fd6c8f3","metric":11,"metrics":{"doc_workflows":1},"status":"keep","description":"baseline doc workflow uses shell xtrace in many steps","timestamp":1777053662962,"segment":128,"confidence":null,"iterationTokens":133,"asi":{"hypothesis":"The Docs workflow uses set -x in many shell snippets, increasing log volume without changing executed commands. Removing xtrace should preserve behavior while reducing CI log overhead."}}
{"run":239,"commit":"80de21e","metric":0,"metrics":{"doc_workflows":1},"status":"keep","description":"remove shell xtrace from doc workflow steps","timestamp":1777053684999,"segment":128,"confidence":null,"iterationTokens":451,"asi":{"hypothesis":"Removing set -x from doc workflow shell snippets reduces log volume while preserving the same scripts and commands.","result":"doc workflow YAML parses and set -x sites dropped from 11 to 0."}}
{"type":"config","name":"Validate CI YAML before logging-reduction push","metricName":"ci_yaml_failures","metricUnit":"","bestDirection":"lower"}
{"run":240,"commit":"21942fd","metric":0,"metrics":{"workflow_files_checked":8,"action_files_checked":5},"status":"keep","description":"validate CI YAML before pushing logging reductions","timestamp":1777053722078,"segment":129,"confidence":null,"iterationTokens":177,"asi":{"hypothesis":"Parse all workflow/action YAML before pushing logging and diagnostic reductions.","result":"All workflow/action YAML parsed successfully."}}
{"type":"config","name":"Monitor PR checks before pushing logging reductions","metricName":"pr_check_failures","metricUnit":"","bestDirection":"lower"}
{"run":241,"commit":"0499139","metric":0,"metrics":{"pending_checks":9},"status":"keep","description":"monitor PR checks before pushing logging reductions","timestamp":1777053763741,"segment":130,"confidence":null,"iterationTokens":170,"asi":{"hypothesis":"Before pushing logging reductions, ensure the currently pushed CI has no failures that need attention.","result":"No failed checks observed; 9 checks still pending in summary."}}
{"type":"config","name":"Monitor PR checks after logging-reduction push","metricName":"pr_check_failures","metricUnit":"","bestDirection":"lower"}
{"run":242,"commit":"936b3ce","metric":0,"metrics":{"pending_checks":9},"status":"keep","description":"monitor PR checks immediately after logging-reduction push","timestamp":1777053802947,"segment":131,"confidence":null,"iterationTokens":171,"asi":{"hypothesis":"Immediately check CI after pushing logging reductions to catch early workflow/action failures.","result":"No failed checks observed; 9 checks pending immediately after push."}}
{"type":"config","name":"Remove verbose flag from embedded emulator go test","metricName":"embedded_go_test_verbose_flags","metricUnit":"","bestDirection":"lower"}
{"run":243,"commit":"b0bea50","metric":1,"metrics":{"go_workflows":1},"status":"keep","description":"baseline embedded emulator step uses verbose go test","timestamp":1777053841344,"segment":132,"confidence":null,"iterationTokens":145,"asi":{"hypothesis":"The Go workflow's embedded emulator targeted test uses go test -v for a single test. Removing -v preserves the test and failure output while reducing CI log output."}}
{"run":244,"commit":"f020a53","metric":0,"metrics":{"go_workflows":1},"status":"keep","description":"remove verbose flag from embedded emulator go test","timestamp":1777053869165,"segment":132,"confidence":null,"iterationTokens":424,"asi":{"hypothesis":"Dropping -v from the targeted embedded emulator go test keeps the same TestRunEmbedEmulator execution while reducing log output.","result":"go workflow YAML parses and embedded go test verbose flags dropped from 1 to 0."}}
{"type":"config","name":"Validate CI YAML after embedded verbose removal","metricName":"ci_yaml_failures","metricUnit":"","bestDirection":"lower"}
{"run":245,"commit":"7a21a89","metric":0,"metrics":{"workflow_files_checked":8,"action_files_checked":5},"status":"keep","description":"validate CI YAML after embedded verbose removal","timestamp":1777053900464,"segment":133,"confidence":null,"iterationTokens":176,"asi":{"hypothesis":"Parse all workflow/action YAML after removing -v from the embedded emulator go test step.","result":"All workflow/action YAML parsed successfully."}}
{"run":246,"commit":"b03cd20","metric":0,"metrics":{"workflow_files_checked":0,"action_files_checked":0,"pending_checks":9},"status":"keep","description":"incidental PR check monitor during CI YAML validation segment","timestamp":1777054100381,"segment":133,"confidence":null,"iterationTokens":352,"asi":{"hypothesis":"Monitor pushed CI while local embedded verbose change is accumulating; this run occurred under the current CI YAML validation segment and is logged accordingly.","result":"No failed PR checks observed; 9 checks still pending in summary."}}
{"type":"config","name":"Record deferred build-cache parallelization idea","metricName":"ideas_backlog_updates","metricUnit":"","bestDirection":"higher"}
{"run":247,"commit":"4b2e012","metric":1,"metrics":{"ideas_file_entries":2},"status":"keep","description":"record deferred isolated-cache buildcache parallelization idea","timestamp":1777054173901,"segment":134,"confidence":null,"iterationTokens":115,"asi":{"hypothesis":"Build-cache mode parallelization may be promising but needs careful isolated-cache validation; record it in the ideas backlog rather than risk a flaky CI change now.","result":"Added one deferred build-cache parallelization idea to autoresearch.ideas.md."}}
{"type":"config","name":"Use no-install-recommends for CI apt installs","metricName":"ci_apt_installs_missing_no_recommends","metricUnit":"","bestDirection":"lower"}
{"run":248,"commit":"4ef985b","metric":3,"metrics":{"ci_apt_install_sites":3},"status":"keep","description":"baseline CI apt installs omit no-install-recommends","timestamp":1777054201491,"segment":135,"confidence":null,"iterationTokens":203,"asi":{"hypothesis":"Adding --no-install-recommends to CI apt installs can reduce package download/install work while preserving explicitly listed dependencies. This is a real CI setup optimization, not benchmark-specific."}}
{"run":249,"commit":"baa41a5","metric":0,"metrics":{"ci_apt_install_sites":3},"status":"keep","description":"use no-install-recommends for CI apt installs in actions","timestamp":1777054258138,"segment":135,"confidence":null,"iterationTokens":994,"asi":{"hypothesis":"Adding --no-install-recommends to setup-deps and setup-embed-deps apt installs should reduce package install work while keeping all explicitly required packages installed.","result":"Action YAML parses and CI apt install sites missing --no-install-recommends dropped from 3 to 0."}}
{"type":"config","name":"Validate setup action shell syntax after no-install-recommends","metricName":"setup_action_shell_syntax_failures","metricUnit":"","bestDirection":"lower"}
{"run":250,"commit":"046253a","metric":0,"metrics":{"setup_shell_blocks_checked":5},"status":"keep","description":"validate setup action shell syntax after no-install-recommends","timestamp":1777054289721,"segment":136,"confidence":null,"iterationTokens":365,"asi":{"hypothesis":"Run bash -n over setup-deps and setup-embed-deps shell blocks after adding --no-install-recommends to apt installs.","result":"All setup action shell blocks passed bash -n."}}
{"type":"config","name":"Validate all CI YAML before apt/logging push","metricName":"ci_yaml_failures","metricUnit":"","bestDirection":"lower"}
{"run":251,"commit":"f2d9d4c","metric":0,"metrics":{"workflow_files_checked":8,"action_files_checked":5},"status":"keep","description":"validate all CI YAML before pushing apt and logging changes","timestamp":1777054351877,"segment":137,"confidence":null,"iterationTokens":178,"asi":{"hypothesis":"Parse all workflow/action YAML before pushing apt no-install-recommends and logging reductions.","result":"All workflow/action YAML parsed successfully."}}
{"type":"config","name":"Monitor PR checks before apt/logging push","metricName":"pr_check_failures","metricUnit":"","bestDirection":"lower"}
{"run":252,"commit":"835e5b1","metric":0,"metrics":{"pending_checks":9},"status":"keep","description":"monitor PR checks before pushing apt and logging changes","timestamp":1777054382595,"segment":138,"confidence":null,"iterationTokens":171,"asi":{"hypothesis":"Before pushing the apt/logging batch, ensure the current PR run has no failures needing attention.","result":"No failed checks observed; 9 checks still pending in summary."}}
{"type":"config","name":"Monitor PR checks after apt/logging push","metricName":"pr_check_failures","metricUnit":"","bestDirection":"lower"}
{"run":253,"commit":"b7a7fbd","metric":0,"metrics":{"pending_checks":9},"status":"keep","description":"monitor PR checks immediately after apt/logging push","timestamp":1777054426178,"segment":139,"confidence":null,"iterationTokens":171,"asi":{"hypothesis":"Immediately check CI after pushing apt no-install-recommends and logging reductions to catch early workflow/action failures.","result":"No failed checks observed; 9 checks pending immediately after push."}}
{"run":254,"commit":"2e17410","metric":0,"metrics":{"pending_checks":9},"status":"keep","description":"monitor PR checks after apt/logging push has run longer","timestamp":1777054621369,"segment":139,"confidence":null,"iterationTokens":756,"asi":{"hypothesis":"Wait a few minutes after the apt/logging push to catch early setup failures, especially from --no-install-recommends changes.","result":"No failed checks observed; 9 checks still pending in summary."}}
{"type":"config","name":"Avoid real clang spawn in TestGetLLVMVersion","metricName":"real_clang_spawns_in_llvm_tests","metricUnit":"","bestDirection":"lower"}
{"run":255,"commit":"13e9af3","metric":1,"metrics":{"llvm_version_tests":2},"status":"keep","description":"baseline TestGetLLVMVersion may spawn real clang","timestamp":1777054666507,"segment":140,"confidence":null,"iterationTokens":181,"asi":{"hypothesis":"TestGetLLVMVersion can inject detectLLVMVersionFunc instead of invoking the real clang --version path. This preserves getLLVMVersion caching coverage while making internal/build tests faster and less environment-dependent."}}
{"run":256,"commit":"a21b176","metric":0,"metrics":{"llvm_version_tests":2,"focused_test_seconds":1.8},"status":"keep","description":"inject LLVM detector in TestGetLLVMVersion","timestamp":1777054703523,"segment":140,"confidence":null,"iterationTokens":821,"asi":{"hypothesis":"Injecting detectLLVMVersionFunc in TestGetLLVMVersion avoids a real clang --version subprocess while preserving single-context caching assertions.","result":"Focused LLVM version tests passed and real-clang-spawn risk metric dropped from 1 to 0."}}
{"type":"config","name":"Validate internal/build after LLVM test injection","metricName":"internal_build_failures","metricUnit":"","bestDirection":"lower"}
{"run":257,"commit":"63db6e0","metric":0,"metrics":{"internal_build_s":24.339},"status":"keep","description":"validate internal/build after LLVM test injection","timestamp":1777054749831,"segment":141,"confidence":null,"iterationTokens":118,"asi":{"hypothesis":"Run the full internal/build package after changing LLVM version tests to use the injected detector and reset global caches.","result":"internal/build passed."}}
{"type":"config","name":"Monitor PR checks after LLVM test injection","metricName":"pr_check_failures","metricUnit":"","bestDirection":"lower"}
{"run":258,"commit":"53c80c9","metric":0,"metrics":{"pending_checks":9},"status":"keep","description":"monitor PR checks after local LLVM test injection","timestamp":1777054820118,"segment":142,"confidence":null,"iterationTokens":170,"asi":{"hypothesis":"Check currently pushed CI while local LLVM test injection and apt/logging changes accumulate; failures should be fixed before pushing more.","result":"No failed checks observed; 9 checks still pending in summary."}}
{"type":"config","name":"Vet internal/build after LLVM test injection","metricName":"internal_build_vet_failures","metricUnit":"","bestDirection":"lower"}
{"run":259,"commit":"1e6ba25","metric":0,"metrics":{"vet_packages":1},"status":"keep","description":"go vet internal/build after LLVM test injection","timestamp":1777054856248,"segment":143,"confidence":null,"iterationTokens":106,"asi":{"hypothesis":"Run go vet on internal/build after modifying LLVM cache tests with sync.Map resets and injected detector.","result":"go vet ./internal/build passed."}}
{"run":260,"commit":"a385ca5","metric":0,"metrics":{"vet_packages":0,"pending_checks":9},"status":"keep","description":"incidental PR check monitor during internal/build vet segment","timestamp":1777055069631,"segment":143,"confidence":null,"iterationTokens":348,"asi":{"hypothesis":"Check pushed CI while local internal/build test changes accumulate; this run occurred under the vet segment and is logged accordingly.","result":"No failed PR checks observed; 9 checks still pending in summary."}}
{"type":"config","name":"Validate stable core before next push","metricName":"stable_core_failures","metricUnit":"","bestDirection":"lower"}
{"run":261,"commit":"54d3317","metric":0,"metrics":{"internal_build_s":27.151,"crosscompile_s":1.254,"compile_s":2.08,"libc_s":1.56,"rtlib_s":2.722,"goembed_s":2.35},"status":"keep","description":"validate stable core before next push","timestamp":1777055146018,"segment":144,"confidence":null,"iterationTokens":127,"asi":{"hypothesis":"Run the stable core subset before pushing local workflow and internal/build test changes.","result":"Stable core subset passed."}}
{"type":"config","name":"Monitor PR checks after stable-core push","metricName":"pr_check_failures","metricUnit":"","bestDirection":"lower"}
{"run":262,"commit":"788ddc6","metric":0,"metrics":{"pending_checks":9},"status":"keep","description":"monitor PR checks immediately after stable-core push","timestamp":1777055195986,"segment":145,"confidence":null,"iterationTokens":170,"asi":{"hypothesis":"Immediately check CI after pushing local workflow/test changes and stable-core validation commit.","result":"No failed checks observed; 9 checks pending immediately after push."}}
{"run":263,"commit":"216398c","metric":0,"metrics":{"pending_checks":9},"status":"keep","description":"monitor PR checks after stable-core push has run longer","timestamp":1777055393226,"segment":145,"confidence":null,"iterationTokens":789,"asi":{"hypothesis":"Wait a few minutes after the stable-core push to catch early CI failures from workflow/action changes.","result":"No failed checks observed; 9 checks still pending in summary."}}
{"type":"config","name":"Monitor PR checks after resume","metricName":"pr_check_failures","metricUnit":"","bestDirection":"lower"}
{"run":264,"commit":"4a8027a","metric":0,"metrics":{"pending_checks":9},"status":"keep","description":"monitor PR checks after context resume","timestamp":1777055462388,"segment":146,"confidence":null,"iterationTokens":168,"asi":{"hypothesis":"Resume by checking PR CI first; any failure should be fixed before additional optimization.","result":"No failed checks observed; 9 checks still pending in summary."}}
{"type":"config","name":"Combine Ubuntu LLVM and common apt installs","metricName":"ubuntu_setup_deps_apt_install_commands","metricUnit":"","bestDirection":"lower"}
{"run":265,"commit":"d149b79","metric":2,"metrics":{"setup_deps_actions":1},"status":"keep","description":"baseline Ubuntu setup-deps still has separate LLVM and common apt installs","timestamp":1777055506893,"segment":147,"confidence":null,"iterationTokens":157,"asi":{"hypothesis":"After adding the LLVM apt repository and updating package indexes, setup-deps can install LLVM packages and common/demo packages in a single apt-get invocation by appending LLVM package names to the same deps array. This reduces apt resolver/install overhead while preserving package coverage."}}
{"run":266,"commit":"f2f3e34","metric":1,"metrics":{"setup_deps_actions":1},"status":"keep","description":"combine Ubuntu LLVM and common apt installs","timestamp":1777055547987,"segment":147,"confidence":null,"iterationTokens":962,"asi":{"hypothesis":"Appending requested LLVM packages to the common deps array lets setup-deps run apt-get update once and apt-get install once, reducing resolver/install overhead while explicitly installing the same packages.","result":"setup-deps YAML parses and Ubuntu setup-deps apt install commands dropped from 2 to 1."}}
{"type":"config","name":"Validate setup-deps shell after apt install consolidation","metricName":"setup_deps_shell_syntax_failures","metricUnit":"","bestDirection":"lower"}
{"run":267,"commit":"64f5ccb","metric":0,"metrics":{"setup_deps_shell_blocks_checked":2},"status":"keep","description":"validate setup-deps shell after apt install consolidation","timestamp":1777055575938,"segment":148,"confidence":null,"iterationTokens":323,"asi":{"hypothesis":"Run bash -n over setup-deps shell blocks after consolidating Ubuntu LLVM/common apt installs.","result":"Both setup-deps shell blocks passed bash -n."}}
{"type":"config","name":"Monitor PR checks after apt install consolidation","metricName":"pr_check_failures","metricUnit":"","bestDirection":"lower"}
{"run":268,"commit":"b9071de","metric":0,"metrics":{"pending_checks":9},"status":"keep","description":"monitor PR checks after local apt install consolidation","timestamp":1777055630958,"segment":149,"confidence":null,"iterationTokens":170,"asi":{"hypothesis":"Check currently pushed CI while local apt install consolidation accumulates; any failure should be fixed before pushing.","result":"No failed checks observed; 9 checks still pending in summary."}}
{"type":"config","name":"Combine macOS common and optional brew installs","metricName":"macos_setup_deps_brew_install_commands","metricUnit":"","bestDirection":"lower"}
{"run":269,"commit":"75855c2","metric":4,"metrics":{"setup_deps_actions":1},"status":"keep","description":"baseline macOS setup-deps uses multiple brew install invocations","timestamp":1777055673709,"segment":150,"confidence":null,"iterationTokens":163,"asi":{"hypothesis":"The macOS setup-deps branch installs common and optional Homebrew formulas in separate brew install invocations. Building a formula array and appending optional demo formulas should preserve installed formulas while reducing brew invocation overhead."}}
{"run":270,"commit":"0d3e658","metric":3,"metrics":{"setup_deps_actions":1},"status":"keep","description":"combine macOS common and optional brew installs","timestamp":1777055710050,"segment":150,"confidence":null,"iterationTokens":1414,"asi":{"hypothesis":"Appending cjson/sqlite to the common macOS formula array when demo deps are enabled reduces one brew install invocation while keeping python@3.12 separate because its install is allowed to fail.","result":"setup-deps YAML parses and macOS brew install invocations dropped from 4 to 3."}}
{"type":"config","name":"Validate setup-deps shell after brew install combine","metricName":"setup_deps_shell_syntax_failures","metricUnit":"","bestDirection":"lower"}
{"run":271,"commit":"9f77167","metric":0,"metrics":{"setup_deps_shell_blocks_checked":2},"status":"keep","description":"validate setup-deps shell after brew install combine","timestamp":1777055732647,"segment":151,"confidence":null,"iterationTokens":323,"asi":{"hypothesis":"Run bash -n over setup-deps shell blocks after combining macOS brew formula arrays.","result":"Both setup-deps shell blocks passed bash -n."}}
{"type":"config","name":"Validate CI YAML before setup-deps consolidation push","metricName":"ci_yaml_failures","metricUnit":"","bestDirection":"lower"}
{"run":272,"commit":"0171f7a","metric":0,"metrics":{"workflow_files_checked":8,"action_files_checked":5},"status":"keep","description":"validate all CI YAML before setup-deps consolidation push","timestamp":1777055758908,"segment":152,"confidence":null,"iterationTokens":178,"asi":{"hypothesis":"Parse all workflow/action YAML before pushing setup-deps brew/apt install consolidation changes.","result":"All workflow/action YAML parsed successfully."}}
{"type":"config","name":"Monitor PR checks before setup-deps consolidation push","metricName":"pr_check_failures","metricUnit":"","bestDirection":"lower"}
