{"run":419,"commit":"aa88095","metric":314,"metrics":{"coverage_profile_bytes":0},"status":"keep","description":"local coverage-only timing for macOS Go >20m job","timestamp":1777083271171,"segment":234,"confidence":null,"iterationTokens":177,"asi":{"hypothesis":"Before changing the >20m macOS Go job, locally validate the coverage portion independently. If coverage alone is well under 15m locally and about 11m in CI, the >20m issue is the combined coverage+emulator job structure, not coverage itself.","result":"Local go test -coverprofile ./... passed in 314s (~5m14s). Local emulator timing remains blocked by QEMU esp32 support."}}
{"type":"config","name":"Local host demo timing for >20m macOS Intel llgo job","metricName":"local_host_demo_seconds","metricUnit":"s","bestDirection":"lower"}
{"run":420,"commit":"8210c72","metric":0,"metrics":{"local_host_demo_passed":83,"local_host_demo_total":84},"status":"crash","description":"local host demo timing failed due missing llama2 model","timestamp":1777083437639,"segment":235,"confidence":null,"iterationTokens":159,"asi":{"hypothesis":"Locally time the host demo portion of the >20m macOS Intel llgo job before considering CI job splitting.","error":"Host demo run completed 83/84 cases but failed ./_demo/c/llama2-c because the CI-only model artifact is not present locally.","rollback_reason":"No code changes; local validation needs either the model artifact or an explicit local-only skip matching coverage accounting.","next_action_hint":"Download or stub the llama2 model artifact locally, or use CI log step timing rather than claiming a local full host-demo timing."}}
{"run":421,"commit":"5c8dbc1","metric":115,"metrics":{"local_host_demo_passed":84,"local_host_demo_total":84},"status":"keep","description":"local host demo timing after downloading model artifact","timestamp":1777083583960,"segment":235,"confidence":null,"iterationTokens":1436,"asi":{"hypothesis":"Locally validate the host demo portion of the >20m macOS Intel llgo job before considering coverage-preserving job restructuring.","result":"With the same llama2 model artifact present, sequential host demos passed locally: 84/84 in 115s. This supports that host demos can be isolated as a sub-15m workload, though Intel CI timing must still be checked before pushing structural changes."}}
{"type":"config","name":"Monitor PR while doing local-only validation","metricName":"pr_check_failures","metricUnit":"","bestDirection":"lower"}
{"run":422,"commit":"b1a7525","metric":0,"metrics":{"pending_checks":5},"status":"keep","description":"monitor PR while doing local-only validation","timestamp":1777083626476,"segment":236,"confidence":null,"iterationTokens":244,"asi":{"hypothesis":"While doing local-only validation for >20m-task optimizations, continue monitoring the already-pushed revert run for failures.","result":"No failed checks observed; 5 macOS-heavy checks remain pending."}}
{"type":"config","name":"Identify current over-20-minute CI tasks","metricName":"over20_ci_tasks","metricUnit":"","bestDirection":"lower"}
{"run":423,"commit":"393d380","metric":0,"metrics":{"max_passed_ci_seconds":1097},"status":"keep","description":"identify current over-20-minute completed CI tasks","timestamp":1777083654627,"segment":237,"confidence":null,"iterationTokens":337,"asi":{"hypothesis":"After user clarified the optimization target, focus only on completed CI tasks over 20 minutes and ignore micro-optimizations.","result":"At this snapshot no completed passing task exceeds 20 minutes yet, but several macOS llgo tasks are still pending and likely candidates."}}
{"run":424,"commit":"b0bcf16","metric":0,"metrics":{"max_passed_ci_seconds":1097,"pending_checks":2},"status":"keep","description":"monitor pending over-20-minute candidate tasks","timestamp":1777083974972,"segment":237,"confidence":null,"iterationTokens":717,"asi":{"hypothesis":"Wait for pending macOS-heavy tasks to complete before deciding whether further >20m optimization is necessary.","result":"No failed checks observed; only two macOS llgo checks remain pending."}}
{"run":425,"commit":"f5b8624","metric":2,"metrics":{"pr_check_failures":0,"pending_checks":0,"max_passed_ci_seconds":1410},"status":"keep","description":"identify remaining over-20-minute tasks after revert run completed","timestamp":1777084291595,"segment":237,"confidence":null,"iterationTokens":793,"asi":{"hypothesis":"Once the revert run completes, identify only the tasks still above the user's 20-minute threshold and target them toward under 15 minutes.","result":"Full run passed. Only two tasks remain >20m: llgo macos-15-intel Go 1.21 at 23m30s and Go 1.24 at 23m19s. These are now the sole optimization targets."}}
{"type":"config","name":"Split macOS Intel embedded demos into sub-15m job","metricName":"macos_intel_combined_demo_steps","metricUnit":"","bestDirection":"lower"}
{"run":426,"commit":"7d8cf30","metric":1,"metrics":{"over20_ci_tasks":2},"status":"keep","description":"baseline macOS Intel llgo jobs combine host and embedded demos","timestamp":1777084353075,"segment":238,"confidence":null,"iterationTokens":174,"asi":{"hypothesis":"The only remaining >20m tasks are macOS Intel llgo jobs, where host demos (~6.7m) and embedded demos (~11.1m) run sequentially. Splitting embedded demos into a separate macOS Intel job should preserve coverage and make each job target <15m."}}
{"run":427,"commit":"08cc178","metric":0,"metrics":{"over20_ci_tasks":0,"split_macos_intel_embedded_jobs":1,"predicted_split_max_demo_seconds":671},"status":"keep","description":"split macOS Intel embedded demos into separate sub-15m job","timestamp":1777084391797,"segment":238,"confidence":null,"iterationTokens":3421,"asi":{"hypothesis":"For the only remaining >20m tasks, move macOS Intel embedded demos into a separate job and skip them in the original macOS Intel llgo job. The original job keeps host package build coverage and host demos; the new job preserves embedded demo coverage. CI-observed host (~6.7m) and embedded (~11.1m) step timings target sub-15m jobs.","result":"llgo.yml parses, test_demo.sh passes bash -n, and structural marker shows macOS Intel host+embedded are no longer combined."}}
{"type":"config","name":"Validate workflows after macOS Intel llgo split","metricName":"workflow_validation_failures","metricUnit":"","bestDirection":"lower"}
{"run":428,"commit":"939229b","metric":0,"metrics":{"workflow_files_checked":8,"action_files_checked":5,"shell_scripts_checked":1},"status":"keep","description":"validate workflows after macOS Intel llgo split","timestamp":1777084424341,"segment":239,"confidence":null,"iterationTokens":203,"asi":{"hypothesis":"Before any CI submission, validate syntax for the macOS Intel llgo embedded split across all workflows/actions and the demo scheduler.","result":"All workflow/action YAML parsed and test_demo.sh passed bash -n."}}
{"type":"config","name":"Monitor PR before submitting macOS Intel llgo split","metricName":"pr_check_failures","metricUnit":"","bestDirection":"lower"}
{"run":429,"commit":"8e4b227","metric":0,"metrics":{"pending_checks":0},"status":"keep","description":"monitor PR before submitting macOS Intel llgo split","timestamp":1777084484481,"segment":240,"confidence":null,"iterationTokens":247,"asi":{"hypothesis":"Before submitting the locally validated macOS Intel llgo split, ensure the current PR run is clean.","result":"No failed or pending checks observed on the current PR run."}}
{"type":"config","name":"Monitor PR after macOS Intel llgo split push","metricName":"pr_check_failures","metricUnit":"","bestDirection":"lower"}
{"run":430,"commit":"ef3d8ce","metric":0,"metrics":{"pending_checks":34},"status":"keep","description":"monitor PR immediately after macOS Intel llgo split push","timestamp":1777084525373,"segment":241,"confidence":null,"iterationTokens":247,"asi":{"hypothesis":"Immediately check CI after pushing the locally validated macOS Intel llgo split targeting the only remaining >20m tasks.","result":"No failed checks observed; 34 checks pending immediately after push."}}
{"run":431,"commit":"9b6cfdd","metric":0,"metrics":{"pending_checks":26},"status":"keep","description":"monitor macOS Intel llgo split after jobs started","timestamp":1777084724604,"segment":241,"confidence":null,"iterationTokens":905,"asi":{"hypothesis":"Wait for workflows to fan out after macOS Intel llgo split and check for early failures including the new llgo-embedded-macos-intel job.","result":"No failed checks observed; 26 checks pending."}}
{"run":432,"commit":"6cfc066","metric":0,"metrics":{"pending_checks":23},"status":"keep","description":"monitor macOS Intel llgo split after more runtime","timestamp":1777085042837,"segment":241,"confidence":null,"iterationTokens":925,"asi":{"hypothesis":"Continue monitoring macOS Intel llgo split for early failures; new split jobs should start and complete independently.","result":"No failed checks observed; 23 checks remain pending."}}
{"run":433,"commit":"358b14f","metric":0,"metrics":{"pending_checks":15},"status":"keep","description":"monitor macOS Intel llgo split with 15 checks pending","timestamp":1777085367367,"segment":241,"confidence":null,"iterationTokens":966,"asi":{"hypothesis":"Continue monitoring the split; remaining pending checks include both new llgo-embedded-macos-intel jobs and the shortened main macOS Intel llgo job.","result":"No failed checks observed; 15 checks remain pending."}}
{"run":434,"commit":"ee4fb82","metric":0,"metrics":{"pending_checks":9},"status":"keep","description":"monitor macOS Intel llgo split with 9 checks pending","timestamp":1777085687440,"segment":241,"confidence":null,"iterationTokens":948,"asi":{"hypothesis":"Continue monitoring until the split macOS Intel jobs complete, to verify the >20m tasks become sub-15m tasks without failures.","result":"No failed checks observed; 9 checks remain pending."}}
{"type":"config","name":"Measure split macOS Intel jobs against 15m target","metricName":"split_macos_intel_over15_jobs","metricUnit":"","bestDirection":"lower"}
{"run":435,"commit":"d5c59ce","metric":1,"metrics":{"split_macos_intel_completed_jobs":2,"split_macos_intel_max_seconds":925},"status":"keep","description":"measure split macOS Intel jobs against 15m target while main jobs pending","timestamp":1777085770885,"segment":242,"confidence":null,"iterationTokens":409,"asi":{"hypothesis":"The macOS Intel llgo split should move the former >20m jobs under the user's 15m target.","result":"Both new embedded split jobs passed, but Go 1.21 took 15m25s, slightly over target; main macOS Intel llgo jobs are still pending. Need full data before deciding whether to tweak setup or parallelism."}}
{"run":436,"commit":"b6cbc99","metric":0,"metrics":{"split_macos_intel_completed_jobs":2,"split_macos_intel_max_seconds":925,"pending_checks":6},"status":"keep","description":"monitor split macOS Intel run while main jobs pending","timestamp":1777086088642,"segment":242,"confidence":null,"iterationTokens":743,"asi":{"hypothesis":"Continue monitoring the macOS Intel split run; remaining main macOS Intel jobs must finish under 15m for the split to meet the user's target.","result":"No failed checks observed; 6 checks remain pending including both main macOS Intel llgo jobs."}}
{"run":437,"commit":"9f520cf","metric":1,"metrics":{"pending_checks":3,"pr_check_failures":0,"split_macos_intel_completed_jobs":2,"split_macos_intel_max_seconds":925},"status":"keep","description":"measure split macOS Intel jobs while main jobs still pending","timestamp":1777086411378,"segment":242,"confidence":null,"iterationTokens":1136,"asi":{"hypothesis":"Recompute the actual over-15 count for split macOS Intel jobs while waiting for the main jobs, correcting the prior monitoring metric.","result":"Only the two embedded split jobs have completed; Go 1.21 embedded remains 15m25s and thus one split job is slightly over the 15m target. Main macOS Intel jobs still pending."}}
{"run":438,"commit":"3960bf9","metric":1,"metrics":{"pending_checks":2,"pr_check_failures":0,"split_macos_intel_completed_jobs":2,"split_macos_intel_max_seconds":925},"status":"keep","description":"monitor split macOS Intel jobs with two pending","timestamp":1777086731169,"segment":242,"confidence":null,"iterationTokens":1028,"asi":{"hypothesis":"Continue waiting for the main macOS Intel split jobs; final decision depends on all four split jobs and the 15m target.","result":"No failures; two main macOS Intel llgo jobs still pending. Completed embedded Go 1.21 remains slightly over 15m."}}
{"run":439,"commit":"3960bf9","metric":2,"metrics":{"pending_checks":1,"pr_check_failures":0,"split_macos_intel_completed_jobs":3,"split_macos_intel_max_seconds":1250},"status":"discard","description":"initial macOS Intel embedded split does not meet 15m target","timestamp":1777087084294,"segment":242,"confidence":null,"iterationTokens":2155,"asi":{"hypothesis":"Splitting only embedded demos out of macOS Intel llgo should bring the former >20m jobs under 15m.","result":"Partial live data shows this is insufficient: main Go 1.21 still took 20m50s and embedded Go 1.21 took 15m25s. The target is not met.","rollback_reason":"Primary over-15 job count worsened versus the target; need a finer split of host demos vs embedded/export/ESP checks or local-validated alternative before keeping.","next_action_hint":"Inspect macOS Intel Go 1.21 step durations, move other embedded-target checks out of the main host job, and reduce setup overhead for the embedded split before re-submitting."}}
{"type":"config","name":"Split macOS Intel embedded smoke checks from main llgo job","metricName":"macos_intel_main_embedded_smoke_steps","metricUnit":"","bestDirection":"lower"}
{"run":440,"commit":"47cbad8","metric":1,"metrics":{"macos_intel_main_seconds_after_first_split":1250},"status":"keep","description":"baseline macOS Intel main llgo still runs embedded smoke checks","timestamp":1777087141643,"segment":243,"confidence":null,"iterationTokens":177,"asi":{"hypothesis":"After splitting embedded demos, the macOS Intel main llgo Go 1.21 job still exceeds 20m because it runs embedded export/ESP smoke checks. Splitting those into their own job should bring the main host job below 15m while preserving coverage."}}
{"run":441,"commit":"900c310","metric":0,"metrics":{"macos_intel_main_seconds_after_first_split":655,"split_macos_intel_smoke_jobs":1,"predicted_macos_intel_smoke_seconds":800},"status":"keep","description":"split macOS Intel embedded smoke checks from main llgo job","timestamp":1777087176673,"segment":243,"confidence":null,"iterationTokens":1610,"asi":{"hypothesis":"Move macOS Intel embedded export/ESP smoke checks out of the main llgo job into a dedicated split job. Using live CI step timings, this should reduce the main macOS Intel job to ~11m and keep the new smoke job under ~14m, preserving coverage while targeting sub-15m tasks.","result":"llgo.yml parses, test_demo.sh passes bash -n, and embedded smoke checks are no longer part of the macOS Intel main llgo job."}}
{"type":"config","name":"Validate workflows after macOS Intel smoke split","metricName":"workflow_validation_failures","metricUnit":"","bestDirection":"lower"}
{"run":442,"commit":"b4da9af","metric":0,"metrics":{"workflow_files_checked":8,"action_files_checked":5,"shell_scripts_checked":1},"status":"keep","description":"validate workflows after macOS Intel smoke split","timestamp":1777087207082,"segment":244,"confidence":null,"iterationTokens":202,"asi":{"hypothesis":"Before submitting the refined macOS Intel split, validate all workflow/action YAML and demo scheduler syntax.","result":"All workflow/action YAML parsed and test_demo.sh passed bash -n."}}
{"type":"config","name":"Prune macOS Intel split idea after implementation","metricName":"stale_ideas_pruned","metricUnit":"","bestDirection":"higher"}
{"run":443,"commit":"7642865","metric":1,"metrics":{"ideas_entries":8},"status":"keep","description":"record macOS Intel llgo split status in ideas backlog","timestamp":1777087241006,"segment":245,"confidence":null,"iterationTokens":123,"asi":{"hypothesis":"Prune the stale generic macOS Intel slowness idea now that a concrete split has been implemented, and record what still needs live CI monitoring.","result":"Updated autoresearch.ideas.md with the host/embedded/smoke split status and the initial insufficient split lesson."}}
{"type":"config","name":"Monitor PR after refined macOS Intel split push","metricName":"pr_check_failures","metricUnit":"","bestDirection":"lower"}
{"run":444,"commit":"b6677c0","metric":0,"metrics":{"pending_checks":36},"status":"keep","description":"monitor PR immediately after refined macOS Intel split push","timestamp":1777087280069,"segment":246,"confidence":null,"iterationTokens":246,"asi":{"hypothesis":"Immediately check CI after pushing the refined macOS Intel host/embedded/smoke split targeting all formerly >20m tasks under 15m.","result":"No failed checks observed; 36 checks pending immediately after push."}}
{"run":445,"commit":"3abd09c","metric":0,"metrics":{"pending_checks":24},"status":"keep","description":"monitor refined macOS Intel split after jobs started","timestamp":1777087482334,"segment":246,"confidence":null,"iterationTokens":904,"asi":{"hypothesis":"Wait for workflows to fan out after refined macOS Intel split and check for early failures in the new embedded/smoke jobs.","result":"No failed checks observed; 24 checks pending."}}
{"run":446,"commit":"f466982","metric":0,"metrics":{"pending_checks":20},"status":"keep","description":"monitor refined macOS Intel split after more runtime","timestamp":1777087834150,"segment":246,"confidence":null,"iterationTokens":907,"asi":{"hypothesis":"Continue monitoring the refined macOS Intel split for failures while long checks run.","result":"No failed checks observed; 20 checks remain pending."}}
{"run":447,"commit":"eb4bb92","metric":0,"metrics":{"pending_checks":15},"status":"keep","description":"monitor refined macOS Intel split with 15 checks pending","timestamp":1777088154772,"segment":246,"confidence":null,"iterationTokens":957,"asi":{"hypothesis":"Continue monitoring refined split; new embedded smoke job is still pending and should complete under 15m if prediction holds.","result":"No failed checks observed; 15 checks remain pending."}}
{"run":448,"commit":"35b7030","metric":0,"metrics":{"pending_checks":11},"status":"keep","description":"monitor refined macOS Intel split with 11 checks pending","timestamp":1777088469062,"segment":246,"confidence":null,"iterationTokens":941,"asi":{"hypothesis":"Continue monitoring refined split toward the under-15m target.","result":"No failed checks observed; 11 checks remain pending."}}
{"run":449,"commit":"e55f892","metric":0,"metrics":{"pending_checks":9,"split_macos_intel_over15_jobs":1,"split_macos_intel_completed_jobs":4,"split_macos_intel_max_seconds":987},"status":"keep","description":"monitor refined split with four split jobs completed","timestamp":1777088820083,"segment":246,"confidence":null,"iterationTokens":2376,"asi":{"hypothesis":"Measure the refined split as split jobs complete; only main macOS Intel jobs remain pending.","result":"No failures. Four split jobs completed; one is over 15m: llgo-embedded-macos-intel Go 1.21 at 16m27s. Embedded smoke jobs are under 15m."}}
{"run":450,"commit":"aa1f345","metric":0,"metrics":{"pending_checks":6,"split_macos_intel_over15_jobs":1,"split_macos_intel_completed_jobs":4,"split_macos_intel_max_seconds":987},"status":"keep","description":"monitor refined split while main macOS Intel jobs remain pending","timestamp":1777089141046,"segment":246,"confidence":null,"iterationTokens":1062,"asi":{"hypothesis":"Continue monitoring refined split until the main macOS Intel jobs complete and we can assess all former >20m tasks.","result":"No failures; 6 checks pending, including both main macOS Intel jobs."}}
{"run":451,"commit":"28e3e9e","metric":0,"metrics":{"pending_checks":2,"split_macos_intel_over15_jobs":1,"split_macos_intel_completed_jobs":5,"split_macos_intel_max_seconds":987},"status":"keep","description":"monitor refined split with five split jobs completed","timestamp":1777089480571,"segment":246,"confidence":null,"iterationTokens":1689,"asi":{"hypothesis":"Continue assessing whether all refined macOS Intel split jobs meet the 15m target.","result":"No failures. Five split jobs completed; only embedded Go 1.21 is over 15m at 16m27s. One main macOS Intel job still pending."}}
{"run":452,"commit":"b839e46","metric":0,"metrics":{"pending_checks":1,"split_macos_intel_over15_jobs":1,"split_macos_intel_completed_jobs":5,"split_macos_intel_max_seconds":987},"status":"keep","description":"monitor refined split with only macOS Intel Go 1.21 main pending","timestamp":1777089750489,"segment":246,"confidence":null,"iterationTokens":1440,"asi":{"hypothesis":"Wait for the last macOS Intel main job to complete; all other split jobs except embedded Go 1.21 are under 15m.","result":"No failures. Only the macOS Intel Go 1.21 main job remains pending."}}
{"run":453,"commit":"4346acc","metric":0,"metrics":{"pending_checks":0,"split_macos_intel_over15_jobs":2,"split_macos_intel_completed_jobs":6,"split_macos_intel_max_seconds":1062},"status":"keep","description":"monitor refined split completed with no failures","timestamp":1777090075507,"segment":246,"confidence":null,"iterationTokens":1067,"asi":{"hypothesis":"Confirm the refined macOS Intel split completes and measure whether it hits the <15m target.","result":"Full PR run completed without failures. The split reduced the former 23m+ jobs, but two split jobs remain over 15m: main Go 1.21 at 17m42s and embedded Go 1.21 at 16m27s. Further work should focus only on these two Go 1.21 macOS Intel jobs."}}
{"type":"config","name":"Split macOS Intel embedded demos by target","metricName":"macos_intel_embedded_demo_targets_per_job","metricUnit":"","bestDirection":"lower"}
