{"run":699,"commit":"bc68b7f","metric":0,"metrics":{"pending_checks":43,"build_cache_completed_jobs":1,"build_cache_max_seconds":170,"cross_compile_completed_jobs":0,"cross_compile_max_seconds":0,"all_completed_over15_jobs":0},"status":"keep","description":"monitor rerun after fan-out waiting for cross-compile","timestamp":1777161440762,"segment":303,"confidence":null,"iterationTokens":1183,"asi":{"hypothesis":"The rerun should remain failure-free while waiting for cross-compile; build-cache should continue finishing quickly.","result":"No failures; 43 pending. One build-cache job completed in 170s; cross-compile not completed yet; no completed jobs over 15m."}}
{"run":700,"commit":"8942d69","metric":0,"metrics":{"pending_checks":36,"build_cache_completed_jobs":2,"build_cache_max_seconds":240,"cross_compile_completed_jobs":0,"cross_compile_max_seconds":0,"all_completed_over15_jobs":0},"status":"keep","description":"monitor rerun with both build-cache jobs done","timestamp":1777161757159,"segment":303,"confidence":null,"iterationTokens":1429,"asi":{"hypothesis":"Continue monitoring rerun for cross-compile cache hit and failures; build-cache may vary but should remain well below 15m.","result":"No failures; 36 pending. Both build-cache jobs completed, max 240s; cross-compile still pending; no completed jobs over 15m."}}
{"run":701,"commit":"3a1a4b6","metric":0,"metrics":{"pending_checks":28,"build_cache_completed_jobs":2,"build_cache_max_seconds":240,"cross_compile_completed_jobs":1,"cross_compile_max_seconds":94,"all_completed_over15_jobs":0},"status":"keep","description":"monitor rerun with cross-compile completed faster","timestamp":1777162075751,"segment":303,"confidence":null,"iterationTokens":1520,"asi":{"hypothesis":"The second run after iwasm cache save should allow cross-compile to complete at least as fast as the first run, ideally hitting the iwasm cache.","result":"No failures; 28 pending. Cross-compile completed in 94s versus previous 101s; no completed jobs over 15m. Need inspect logs to confirm cache hit versus runner variability."}}
{"run":702,"commit":"4514b47","metric":0,"metrics":{"pending_checks":28,"build_cache_completed_jobs":2,"build_cache_max_seconds":240,"cross_compile_completed_jobs":1,"cross_compile_max_seconds":94,"all_completed_over15_jobs":0,"cross_compile_cache_hit":1,"cross_compile_built_iwasm":0,"cross_compile_saved_iwasm_cache":0},"status":"keep","description":"confirm cross-compile iwasm cache hit on rerun","timestamp":1777162092477,"segment":303,"confidence":null,"iterationTokens":1527,"asi":{"hypothesis":"Inspect the rerun cross-compile log to confirm the new iwasm cache actually hit and skipped the WAMR build.","result":"Confirmed cache hit for macOS-ARM64-iwasm-WAMR-2.4.4; Install wamr was skipped, no iwasm build/save occurred, and cross-compile completed in 94s."}}
{"run":703,"commit":"6400cdb","metric":0,"metrics":{"pending_checks":24,"build_cache_completed_jobs":2,"build_cache_max_seconds":240,"cross_compile_completed_jobs":1,"cross_compile_max_seconds":94,"go_split_completed_jobs":4,"go_split_over15_jobs":0,"split_macos_intel_completed_jobs":3,"split_macos_intel_over15_jobs":0,"all_completed_over15_jobs":0,"cross_compile_cache_hit":1,"cross_compile_built_iwasm":0,"cross_compile_saved_iwasm_cache":0},"status":"keep","description":"monitor rerun after confirming cross-compile cache hit","timestamp":1777162413699,"segment":303,"confidence":null,"iterationTokens":1901,"asi":{"hypothesis":"Continue monitoring rerun after confirmed iwasm cache hit; no failures or over-15 completed jobs should appear.","result":"No failures; 24 pending. Cross-compile cache hit remains confirmed at 94s; all four Go split jobs completed with none over 15m; three macOS Intel split jobs completed with none over 15m."}}
{"run":704,"commit":"126cecb","metric":0,"metrics":{"pending_checks":23,"build_cache_completed_jobs":2,"build_cache_max_seconds":240,"cross_compile_completed_jobs":1,"cross_compile_max_seconds":94,"go_split_completed_jobs":4,"go_split_over15_jobs":0,"split_macos_intel_completed_jobs":4,"split_macos_intel_over15_jobs":0,"all_completed_over15_jobs":0,"cross_compile_cache_hit":1,"cross_compile_built_iwasm":0,"cross_compile_saved_iwasm_cache":0},"status":"keep","description":"monitor rerun with four macOS Intel jobs done","timestamp":1777162730211,"segment":303,"confidence":null,"iterationTokens":2026,"asi":{"hypothesis":"Continue monitoring rerun; macOS Intel jobs should complete without failures or over-15 regressions.","result":"No failures; 23 pending. Four macOS Intel split jobs completed with none over 15m; no completed jobs over 15m."}}
{"run":705,"commit":"43239c2","metric":0,"metrics":{"pending_checks":20,"build_cache_completed_jobs":2,"build_cache_max_seconds":240,"cross_compile_completed_jobs":1,"cross_compile_max_seconds":94,"go_split_completed_jobs":4,"go_split_over15_jobs":0,"split_macos_intel_completed_jobs":6,"split_macos_intel_over15_jobs":0,"all_completed_over15_jobs":0,"cross_compile_cache_hit":1,"cross_compile_built_iwasm":0,"cross_compile_saved_iwasm_cache":0},"status":"keep","description":"monitor rerun with six macOS Intel jobs done","timestamp":1777163050152,"segment":303,"confidence":null,"iterationTokens":1997,"asi":{"hypothesis":"Continue monitoring rerun; more macOS Intel jobs should complete while remaining failure-free.","result":"No failures; 20 pending. Six macOS Intel split jobs completed with none over 15m; no completed jobs over 15m. Cross-compile cache hit remains validated at 94s."}}
{"type":"config","name":"Optimize pure LLGo compilation throughput","metricName":"compile_ms","metricUnit":"ms","bestDirection":"lower"}
{"run":706,"commit":"43239c2","metric":0,"metrics":{"compile_min_ms":0,"compile_max_ms":0,"workload_count":2},"status":"crash","description":"baseline pure LLGo compile benchmark command failed","timestamp":1777191745203,"segment":304,"confidence":null,"iterationTokens":437,"asi":{"hypothesis":"Establish a pure LLGo compilation benchmark independent of CI workflow timing.","result":"Benchmark command failed because llgo build was invoked with -o and multiple packages, which is invalid or unsupported for this workload.","rollback_reason":"Invalid benchmark command, not a code regression.","next_action_hint":"User clarified the new target should be go build efficiency; switch benchmark to local go build/go install of LLGo packages rather than llgo build."}}
{"type":"config","name":"Optimize Go build efficiency for LLGo compiler","metricName":"go_build_ms","metricUnit":"ms","bestDirection":"lower"}
{"run":707,"commit":"d61e2c4","metric":10594.3,"metrics":{"go_build_min_ms":10574.8,"go_build_max_ms":10877.2,"runs":3},"status":"keep","description":"baseline clean go build of cmd/llgo","timestamp":1777191808781,"segment":305,"confidence":null,"iterationTokens":404,"asi":{"hypothesis":"Switch target to local Go build efficiency for the LLGo compiler. Baseline clean builds of ./cmd/llgo with isolated caches establish the primary metric before exploring compile-stage decomposition and safe parallelism.","result":"Median clean go build -a -tags=dev ./cmd/llgo time across 3 runs was 10594.3ms."}}
{"run":708,"commit":"d61e2c4","metric":13580,"metrics":{"go_build_min_ms":10574.8,"go_build_max_ms":10877.2,"runs":1,"timed_compile_invocations":310,"slowest_pkg_compile_ms":693},"status":"discard","description":"profile clean go build package compile timings with toolexec wrapper","timestamp":1777191934686,"segment":305,"confidence":null,"iterationTokens":29618,"asi":{"hypothesis":"Decompose go build into package compile timings to find bottlenecks before changing code or attempting parallelization.","result":"toolexec instrumentation overhead made total go_build_ms worse (13580ms), so discard as optimization result, but ASI preserved useful diagnostics: 310 compile invocations; slowest observed compile was internal/build around 693ms, followed by archive/zip, golang.org/x/tools/go/ssa, github.com/goplus/llgo/ssa, github.com/goplus/llvm, archive/tar, cobra/pflag, yaml.v3 around 173-217ms in truncated output.","rollback_reason":"Profiling command was diagnostic and slower due instrumentation overhead; no code change to keep.","next_action_hint":"Use diagnostics to target internal/build/package graph rather than CI changes. Consider package splitting or reducing heavy imports only if it lowers clean go build median."}}
{"run":709,"commit":"123099e","metric":10350.9,"metrics":{"go_build_min_ms":10319.3,"go_build_max_ms":10459.6,"runs":3,"timed_compile_invocations":0,"slowest_pkg_compile_ms":0},"status":"keep","description":"reduce Go compile cost of newlib ESP file lists","timestamp":1777192083530,"segment":305,"confidence":1,"iterationTokens":10857,"asi":{"hypothesis":"The clean Go build bottleneck includes internal/crosscompile/compile/libc, where newlibesp.go contains thousands of filepath.Join composite literal entries. Replacing those large AST-heavy file list literals with compact raw string lists expanded at runtime should reduce Go compiler frontend work without changing generated paths or runtime behavior.","result":"internal/crosscompile/compile/libc tests pass. Median clean go build -a -tags=dev ./cmd/llgo improved from 10594.3ms to 10350.9ms (~2.3%)."}}
{"run":710,"commit":"123099e","metric":10350.9,"metrics":{"go_build_min_ms":10319.3,"go_build_max_ms":10459.6,"runs":3,"timed_compile_invocations":0,"slowest_pkg_compile_ms":0,"filepath_join_count":81,"join_file_list_uses":9},"status":"discard","description":"validate newlib file-list refactor with crosscompile tests","timestamp":1777192130732,"segment":305,"confidence":2,"iterationTokens":1213,"asi":{"hypothesis":"Validate that compact raw-string file lists preserve crosscompile config behavior.","result":"internal/crosscompile/... tests passed. newlibesp.go filepath.Join occurrences reduced to 81 and 9 file list call sites use joinFileList.","rollback_reason":"No primary metric rerun improvement beyond already-kept experiment; this was validation only, so marked discard to avoid extra non-improving commit.","next_action_hint":"Continue optimizing other large generated/static file lists such as compiler-rt if profiling shows benefit."}}
{"run":711,"commit":"123099e","metric":10424,"metrics":{"go_build_min_ms":10305.6,"go_build_max_ms":10494.5,"runs":3,"timed_compile_invocations":0,"slowest_pkg_compile_ms":0,"filepath_join_count":5,"join_file_list_uses":1},"status":"discard","description":"also compact picolibc file list","timestamp":1777192246255,"segment":305,"confidence":3.329685362517078,"iterationTokens":11242,"asi":{"hypothesis":"Apply the same compact raw-string file-list representation to picolibc.go to further reduce Go compiler AST work.","result":"internal/crosscompile/compile/libc tests passed, but median clean go build was 10424.0ms, worse than the prior kept 10350.9ms newlib-only result and within noise relative to baseline.","rollback_reason":"Primary metric regressed compared with current best; picolibc list is much smaller than newlib and did not provide a reliable additional win.","next_action_hint":"Leave picolibc as-is. Look for larger wins via package-level dependency reductions or safe parallelism in LLGo build, not tiny list refactors."}}
{"run":712,"commit":"123099e","metric":10509.5,"metrics":{"go_build_min_ms":10326.1,"go_build_max_ms":17124.8,"runs":10,"timed_compile_invocations":0,"slowest_pkg_compile_ms":0,"filepath_join_count":81,"join_file_list_uses":9,"best_p":8,"p_values_tested":5},"status":"discard","description":"diagnose go build -p parallelism sensitivity","timestamp":1777192458368,"segment":305,"confidence":2.100992662926188,"iterationTokens":5024,"asi":{"hypothesis":"Before adding custom parallelism, measure Go's existing package compile parallelism with -p values to avoid overfitting or duplicating built-in behavior.","result":"On this machine p=8 was best among 1,2,4,8,16 with median 10509.5ms over 2 runs each; p=16 was about baseline. Since the best -p result is worse than the kept source change (10350.9ms) and -p is environment-specific, do not encode a hard-coded parallelism change.","rollback_reason":"Diagnostic only and not a source improvement over current best.","next_action_hint":"For actual parallel compile capability, target LLGo's own buildAllPkgs/buildPkg pipeline with dependency-aware scheduling and guard LLVM/C ABI thread-safety; do not change Go build -p defaults."}}
{"run":713,"commit":"123099e","metric":10501.2,"metrics":{"go_build_min_ms":10475.3,"go_build_max_ms":11036.8,"runs":3,"timed_compile_invocations":0,"slowest_pkg_compile_ms":0,"filepath_join_count":81,"join_file_list_uses":9,"best_p":0,"p_values_tested":0},"status":"discard","description":"move newlib ESP file lists to embedded text files","timestamp":1777192538340,"segment":305,"confidence":2.614393125671358,"iterationTokens":2309,"asi":{"hypothesis":"Moving the large newlib ESP file lists out of Go raw string literals and into embedded text files should further reduce Go parser/type-checker work.","result":"internal/crosscompile/compile/libc tests passed, but median clean go build was 10501.2ms, worse than the kept raw-string refactor (10350.9ms). The embed machinery and extra files did not pay off on this benchmark.","rollback_reason":"Primary metric regressed versus current best and added complexity/files.","next_action_hint":"Keep raw string lists rather than go:embed for this data. Seek larger wins elsewhere."}}
{"run":714,"commit":"123099e","metric":10350.9,"metrics":{"go_build_min_ms":10319.3,"go_build_max_ms":10459.6,"runs":3,"timed_compile_invocations":0,"slowest_pkg_compile_ms":0,"filepath_join_count":81,"join_file_list_uses":9,"best_p":0,"p_values_tested":0,"ideas_updated":1},"status":"discard","description":"validate kept go build optimization and update ideas","timestamp":1777192601163,"segment":305,"confidence":2.1790510295434022,"iterationTokens":1569,"asi":{"hypothesis":"Validate the kept newlib file-list refactor and record the new pure go build optimization direction plus rejected ideas.","result":"internal/crosscompile/... tests passed and ideas now record baseline, kept result, rejected picolibc/embed/-p experiments, and future direction for dependency-graph and LLGo build pipeline parallelism.","rollback_reason":"Validation/ideas update does not improve the primary metric beyond the already-kept source change, so avoid committing it as a performance result.","next_action_hint":"If preserving ideas update is desired, reapply or keep separately; continue with dependency graph reduction or LLGo buildAllPkgs parallelism experiments."}}
{"run":715,"commit":"0647f3c","metric":10301.1,"metrics":{"go_build_min_ms":10234.3,"go_build_max_ms":10470.5,"runs":3,"timed_compile_invocations":0,"slowest_pkg_compile_ms":0,"filepath_join_count":3,"join_file_list_uses":6,"best_p":0,"p_values_tested":0,"ideas_updated":1},"status":"keep","description":"compact compiler-rt file lists for faster Go builds","timestamp":1777192728692,"segment":305,"confidence":3.7979274611398464,"iterationTokens":3057,"asi":{"hypothesis":"compiler_rt.go still has ~200 filepath.Join entries in file-list literals. Compacting them into raw string lists should reduce Go compiler frontend work, similar to newlibesp.go, while preserving the exact resolved paths.","result":"rtlib and crosscompile tests pass. Median clean go build -a -tags=dev ./cmd/llgo improved to 10301.1ms versus previous kept 10350.9ms and baseline 10594.3ms."}}
{"run":716,"commit":"0647f3c","metric":10301.1,"metrics":{"go_build_min_ms":10234.3,"go_build_max_ms":10470.5,"runs":3,"timed_compile_invocations":0,"slowest_pkg_compile_ms":0,"filepath_join_count":3,"join_file_list_uses":6,"best_p":0,"p_values_tested":0,"ideas_updated":1},"status":"discard","description":"validate compact file-list go build optimizations","timestamp":1777192792574,"segment":305,"confidence":3.3954834973942987,"iterationTokens":1643,"asi":{"hypothesis":"Validate the kept newlib/compiler-rt file-list refactors across all crosscompile packages and update ideas with the pure go build target.","result":"internal/crosscompile/... tests passed. Ideas updated to record the new pure go build target, kept optimizations, and rejected experiments.","rollback_reason":"Validation/ideas update does not improve primary metric beyond the already-kept code change; autoresearch files are preserved separately.","next_action_hint":"Continue with package graph reduction or safe dependency-aware LLGo build pipeline parallelism."}}
{"run":717,"commit":"0647f3c","metric":12850.1,"metrics":{"go_build_min_ms":10234.3,"go_build_max_ms":10470.5,"runs":1,"timed_compile_invocations":310,"slowest_pkg_compile_ms":634,"filepath_join_count":3,"join_file_list_uses":6,"best_p":0,"p_values_tested":0,"ideas_updated":1},"status":"discard","description":"profile go build after compact file-list refactors","timestamp":1777192839241,"segment":305,"confidence":3.4292397660818588,"iterationTokens":4132,"asi":{"hypothesis":"Re-profile clean go build after file-list refactors to identify the next bottleneck for source-level compile-speed work.","result":"Instrumentation overhead made total time 12850ms, so not an optimization. Useful diagnostics: 310 compile invocations; top compile packages now include go/types 634ms, runtime 550ms, net 510ms, github.com/goplus/plan9asm 475ms, net/http 427ms, x/tools/internal/stdlib 271ms, crypto/tls 266ms, x/sys/unix 261ms, archive/tar 251ms, archive/zip 237ms, x/tools/go/ssa 226ms, llgo/ssa 210ms, llvm 204ms, internal/build 143ms.","rollback_reason":"Diagnostic only; slower due toolexec wrapper overhead.","next_action_hint":"Remaining largest local targets are plan9asm/ssa/cl/internal/build; stdlib net/http/archive costs come through crosscompile fetch and are harder to remove without architectural lazy loading."}}
{"run":718,"commit":"0647f3c","metric":10332.1,"metrics":{"go_build_min_ms":10147.3,"go_build_max_ms":10448.8,"runs":5,"timed_compile_invocations":0,"slowest_pkg_compile_ms":0,"filepath_join_count":3,"join_file_list_uses":6,"best_p":0,"p_values_tested":0,"ideas_updated":1},"status":"discard","description":"confirm compact file-list go build speed with five runs","timestamp":1777192948764,"segment":305,"confidence":3.3954834973942987,"iterationTokens":2920,"asi":{"hypothesis":"Re-run the kept source optimization with five clean-cache builds to check robustness against noise.","result":"Five-run median was 10332.1ms with min 10147.3ms and max 10448.8ms. This remains faster than the 10594.3ms baseline and close to the prior 10301.1ms three-run result.","rollback_reason":"Confirmation run only; no new source improvement over current best.","next_action_hint":"Treat the file-list refactor as likely real but modest. Continue seeking larger architectural wins."}}
{"type":"config","name":"Optimize LLGo external compile parallelism","metricName":"compile_group_ms","metricUnit":"ms","bestDirection":"lower"}
{"run":719,"commit":"579351a","metric":528,"metrics":{"compile_group_files":32},"status":"keep","description":"baseline sequential CompileGroup compiling 32 C files","timestamp":1777194428833,"segment":306,"confidence":null,"iterationTokens":527,"asi":{"hypothesis":"Establish a pure external compile-stage benchmark for LLGo's CompileGroup before adding parallel compile capability. Workload compiles 32 independent C files into one archive with current sequential behavior.","result":"Baseline CompileGroup wall time was 528.0ms for 32 C files."}}
{"run":720,"commit":"90286e7","metric":98.5,"metrics":{"compile_group_files":32},"status":"keep","description":"parallelize CompileGroup external C/ASM compilations","timestamp":1777194466054,"segment":306,"confidence":null,"iterationTokens":3628,"asi":{"hypothesis":"CompileGroup compiles independent C/ASM files by spawning clang subprocesses sequentially. Running those subprocesses concurrently should speed library builds without sharing LLVM in-process state. Cap default jobs at min(GOMAXPROCS,8) and allow LLGO_COMPILE_JOBS override for libraries/runners that need lower concurrency.","result":"internal/crosscompile/compile tests pass. 32-file CompileGroup benchmark improved from 528.0ms to 98.5ms."}}
{"run":721,"commit":"90286e7","metric":98.5,"metrics":{"compile_group_files":32,"crosscompile_packages_tested":4,"compile_jobs_tests":1},"status":"discard","description":"validate CompileGroup parallelism and env override","timestamp":1777194521936,"segment":306,"confidence":null,"iterationTokens":2072,"asi":{"hypothesis":"Validate parallel CompileGroup across crosscompile packages and add coverage for LLGO_COMPILE_JOBS override/invalid values, including sequential override compatibility.","result":"internal/crosscompile/... passed, LLGO_COMPILE_JOBS=1 go test ./internal/crosscompile/compile passed, and compileJobs env tests were added.","rollback_reason":"Validation/test-only change does not further improve the primary metric beyond the kept parallelism code; code changes are still present because autoresearch preserves kept parent changes.","next_action_hint":"Commit tests with the kept parallelism if not already included, or run a new benchmark that exercises LLGO_COMPILE_JOBS=1 versus default."}}
{"type":"config","name":"Validate CompileGroup parallelism coverage","metricName":"validation_failures","metricUnit":"","bestDirection":"lower"}
