{"type":"config","name":"Monitor PR after pushing cgo extern constant prefix parser","metricName":"pr_check_failures","metricUnit":"","bestDirection":"lower"}
{"run":1197,"commit":"7b20508","metric":0,"metrics":{"pending_checks":54,"passed_checks":3,"skipped_checks":0,"llgo_in_pr_diff":0},"status":"keep","description":"monitor PR after pushing cgo extern constant prefix parser","timestamp":1777250647901,"segment":639,"confidence":null,"iterationTokens":454,"asi":{"hypothesis":"After pushing the cgo extern constant-prefix parser follow-up, the new PR run should start without immediate failures and root llgo should remain absent from the diff.","result":"New PR checks: 0 failures, 54 pending, 3 passed, 0 skipped; root llgo absent from PR diff.","next_action_hint":"Poll later for completion; continue only with local A/B evidence."}}
{"type":"config","name":"Optimize parseCgo single-directory no-cgo path","metricName":"parse_cgo_no_cgo_ns_op","metricUnit":"","bestDirection":"lower"}
{"run":1198,"commit":"0bc795b","metric":13178,"metrics":{"parse_cgo_no_cgo_bytes_op":2008,"parse_cgo_no_cgo_allocs_op":11,"runs":9},"status":"keep","description":"baseline parseCgo no-cgo single-dir path","timestamp":1777250764069,"segment":640,"confidence":null,"iterationTokens":873,"asi":{"hypothesis":"buildCgo calls parseCgo_ for every compiled package, including packages without cgo. The common single-directory no-cgo path currently allocates a dirs map and runs filepath.Glob; caching/scanning improvements may reduce per-package overhead.","result":"Baseline parseCgo_ no-cgo single-dir benchmark: 13178 ns/op, 2008 B/op, 11 allocs/op."}}
{"run":1199,"commit":"594cc09","metric":12366,"metrics":{"parse_cgo_no_cgo_bytes_op":1368,"parse_cgo_no_cgo_allocs_op":6,"runs":9},"status":"keep","description":"scan cgo C files with Readdirnames instead of Glob","timestamp":1777250960296,"segment":640,"confidence":null,"iterationTokens":1853,"asi":{"hypothesis":"Replacing filepath.Glob(\"*.c\") with a direct Readdirnames scan for package-local C files should reduce common no-cgo parseCgo_ overhead while preserving sorted output for actual C files.","result":"internal/build tests passed. parseCgo_ no-cgo single-dir benchmark improved from 13178 ns/op, 2008 B/op, 11 allocs/op to 12366 ns/op, 1368 B/op, 6 allocs/op across 9 runs. A single-dir map-hoist variant was also tried and did not help (12271 ns/op vs 12120-12366 ns/op noise), so it was not kept.","next_action_hint":"Add focused tests for dirCFiles ordering, _test.c exclusion, directories ending in .c, and empty relative dir behavior; validate broadly before pushing."}}
{"run":1200,"commit":"d3cb237","metric":11615,"metrics":{"parse_cgo_no_cgo_bytes_op":1368,"parse_cgo_no_cgo_allocs_op":6,"runs":9},"status":"keep","description":"test dirCFiles cgo scan semantics","timestamp":1777251068231,"segment":640,"confidence":2.081225033288948,"iterationTokens":4577,"asi":{"hypothesis":"The direct Readdirnames C-file scanner should preserve filepath.Glob-visible semantics: sorted .c files, _test.c exclusion, directory exclusion, and empty relative directory handling.","result":"Added TestDirCFiles coverage for sorted output, _test.c exclusion, directory named .c exclusion, no-trailing-separator dir input, and empty dir relative to cwd. Focused tests passed; no-cgo parseCgo_ confirmation median was 11615 ns/op, 1368 B/op, 6 allocs/op.","next_action_hint":"Run broad validation before pushing; update ideas if kept."}}
{"type":"config","name":"Validate direct cgo C-file scanner","metricName":"validation_failures","metricUnit":"","bestDirection":"lower"}
{"run":1201,"commit":"33b44e2","metric":0,"metrics":{"packages_tested":5,"temp_builds":1},"status":"keep","description":"validate direct cgo C-file scanner","timestamp":1777251115518,"segment":641,"confidence":null,"iterationTokens":301,"asi":{"hypothesis":"The direct Readdirnames-based cgo C-file scan should preserve behavior and pass broad validation plus temp cmd/llgo build without creating a root llgo binary.","result":"go test ./internal/build, go test ./internal/crosscompile/..., and temp-path go build -tags=dev ./cmd/llgo passed; root llgo was not created."}}
{"type":"config","name":"Record direct cgo C-file scanner","metricName":"validation_failures","metricUnit":"","bestDirection":"lower"}
{"run":1202,"commit":"6a73439","metric":0,"metrics":{"ideas_updated":1},"status":"keep","description":"record direct cgo C-file scanner","timestamp":1777251155891,"segment":642,"confidence":null,"iterationTokens":191,"asi":{"hypothesis":"Record the direct cgo C-file scanner optimization and the rejected single-dir map-hoist follow-up so future loops don't repeat it.","result":"Ideas backlog records the 13178ns/op to 11615ns/op no-cgo parseCgo_ improvement and notes that the single-dir dirs-map hoist did not help."}}
{"type":"config","name":"Monitor PR after pushing direct cgo C-file scanner","metricName":"pr_check_failures","metricUnit":"","bestDirection":"lower"}
{"run":1203,"commit":"90d7342","metric":0,"metrics":{"pending_checks":17,"passed_checks":1,"skipped_checks":0,"llgo_in_pr_diff":0},"status":"keep","description":"monitor PR after pushing direct cgo C-file scanner","timestamp":1777251206568,"segment":643,"confidence":null,"iterationTokens":454,"asi":{"hypothesis":"After pushing the direct cgo C-file scanner, the new PR run should start without immediate failures and root llgo should remain absent from the diff.","result":"New PR checks: 0 failures, 17 pending, 1 passed, 0 skipped; root llgo absent from PR diff.","next_action_hint":"Poll later for completion; continue local A/B experiments only with clear evidence."}}
{"type":"config","name":"Early return no-cgo buildCgo","metricName":"build_cgo_no_cgo_ns_op","metricUnit":"","bestDirection":"lower"}
{"run":1204,"commit":"2ee6312","metric":11778,"metrics":{"build_cgo_no_cgo_bytes_op":1744,"build_cgo_no_cgo_allocs_op":11,"runs":9},"status":"keep","description":"baseline buildCgo no-cgo path","timestamp":1777251342736,"segment":644,"confidence":null,"iterationTokens":913,"asi":{"hypothesis":"After parseCgo_ returns no C files, preambles, or cgo directives, buildCgo can return immediately and avoid tag/cflags/ldflags/incDirs and cgo symbol map setup on the common no-cgo package path.","result":"Baseline buildCgo no-cgo benchmark after direct C-file scanner: 11778 ns/op, 1744 B/op, 11 allocs/op."}}
{"run":1205,"commit":"9ebf9cd","metric":11639,"metrics":{"build_cgo_no_cgo_bytes_op":1368,"build_cgo_no_cgo_allocs_op":6,"runs":9},"status":"keep","description":"early return buildCgo for packages without cgo work","timestamp":1777251398864,"segment":644,"confidence":null,"iterationTokens":1659,"asi":{"hypothesis":"If parseCgo_ finds no C files, preambles, or cgo directives, buildCgo can return immediately and avoid empty tag/cflag/ldflag/incDir and cgo symbol setup on the common no-cgo path.","result":"internal/build tests passed. buildCgo no-cgo benchmark improved modestly from 11778 ns/op, 1744 B/op, 11 allocs/op to 11639 ns/op, 1368 B/op, 6 allocs/op across 9 runs. Wall-time delta is small, but the code is a straightforward no-work fast path for every non-cgo package.","next_action_hint":"Validate broadly; record as a small follow-up if kept."}}
{"type":"config","name":"Validate no-cgo buildCgo fast return","metricName":"validation_failures","metricUnit":"","bestDirection":"lower"}
{"run":1206,"commit":"16a2026","metric":0,"metrics":{"packages_tested":5,"temp_builds":1},"status":"keep","description":"validate no-cgo buildCgo fast return","timestamp":1777251453106,"segment":645,"confidence":null,"iterationTokens":277,"asi":{"hypothesis":"The no-cgo buildCgo fast return should preserve behavior and pass broad validation plus temp cmd/llgo build without creating a root llgo binary.","result":"go test ./internal/build, go test ./internal/crosscompile/..., and temp-path go build -tags=dev ./cmd/llgo passed; root llgo was not created."}}
{"type":"config","name":"Record no-cgo buildCgo fast return","metricName":"validation_failures","metricUnit":"","bestDirection":"lower"}
{"run":1207,"commit":"a6d74f9","metric":0,"metrics":{"ideas_updated":1},"status":"keep","description":"record no-cgo buildCgo fast return","timestamp":1777251483089,"segment":646,"confidence":null,"iterationTokens":182,"asi":{"hypothesis":"Record the no-cgo buildCgo fast return so future loops know this per-package empty-work path is handled.","result":"Ideas backlog records the modest 11778ns/op to 11639ns/op no-cgo buildCgo improvement and allocation drop from 11 to 6."}}
{"type":"config","name":"Monitor PR after pushing no-cgo buildCgo fast return","metricName":"pr_check_failures","metricUnit":"","bestDirection":"lower"}
{"run":1208,"commit":"305830a","metric":0,"metrics":{"pending_checks":46,"passed_checks":2,"skipped_checks":0,"llgo_in_pr_diff":0},"status":"keep","description":"monitor PR after pushing no-cgo buildCgo fast return","timestamp":1777251539638,"segment":647,"confidence":null,"iterationTokens":456,"asi":{"hypothesis":"After pushing the no-cgo buildCgo fast return, the new PR run should start without immediate failures and root llgo should remain absent from the diff.","result":"New PR checks: 0 failures, 46 pending, 2 passed, 0 skipped; root llgo absent from PR diff.","next_action_hint":"Poll later for completion; continue local A/B experiments only with clear evidence."}}
{"type":"config","name":"Check clean cmd llgo go-build after cgo no-work optimizations","metricName":"clean_go_build_ms","metricUnit":"ms","bestDirection":"lower"}
{"run":1209,"commit":"a465fc4","metric":10590,"metrics":{"runs":3},"status":"keep","description":"check clean cmd/llgo go-build after cgo no-work optimizations","timestamp":1777251602504,"segment":648,"confidence":null,"iterationTokens":420,"asi":{"hypothesis":"After direct cgo C-file scanning and no-cgo buildCgo fast return, isolated clean go build of cmd/llgo should remain healthy and root llgo should not be created.","result":"Three isolated clean go build samples were 21650ms, 10590ms, and 10480ms; median 10590ms. The first sample was an outlier likely from cold module/cache setup, so treat this as a noisy health check rather than evidence of regression or improvement. Root llgo was not created."}}
{"type":"config","name":"Monitor PR cgo no-work progress","metricName":"pr_check_failures","metricUnit":"","bestDirection":"lower"}
{"run":1210,"commit":"93b0e43","metric":0,"metrics":{"pending_checks":49,"passed_checks":9,"skipped_checks":0,"llgo_in_pr_diff":0},"status":"keep","description":"monitor PR cgo no-work progress","timestamp":1777251629955,"segment":649,"confidence":null,"iterationTokens":447,"asi":{"hypothesis":"The PR run after cgo no-work optimizations should keep progressing without failures and root llgo should remain absent from the diff.","result":"Current PR checks: 0 failures, 49 pending, 9 passed, 0 skipped; root llgo absent from PR diff.","next_action_hint":"Poll later for completion; continue local experiments only with clear A/B evidence."}}
{"type":"config","name":"Skip cgo directory scan using go list no-other-files metadata","metricName":"build_cgo_no_other_ns_op","metricUnit":"","bestDirection":"lower"}
{"run":1211,"commit":"d87bb3d","metric":11908,"metrics":{"build_cgo_no_other_bytes_op":1384,"build_cgo_no_other_allocs_op":6,"runs":9},"status":"keep","description":"baseline buildCgo with no OtherFiles metadata","timestamp":1777251712725,"segment":650,"confidence":null,"iterationTokens":782,"asi":{"hypothesis":"Real LLGo package loads request NeedFiles/NeedCompiledGoFiles, so packages with no OtherFiles or IgnoredFiles can skip the filesystem .c scan entirely; this should reduce the common no-cgo buildCgo path if semantics stay tied to go list metadata.","result":"Baseline buildCgo no-other-files metadata benchmark: 11908 ns/op, 1384 B/op, 6 allocs/op."}}
{"run":1212,"commit":"7e74fa5","metric":9,"metrics":{"build_cgo_no_other_bytes_op":0,"build_cgo_no_other_allocs_op":0,"runs":9},"status":"keep","description":"skip cgo directory scan using package file metadata","timestamp":1777252441137,"segment":650,"confidence":null,"iterationTokens":2273,"asi":{"hypothesis":"For real LLGo package loads, NeedFiles/NeedCompiledGoFiles metadata tells us whether package directories contain non-Go files. If CompiledGoFiles is populated and both OtherFiles and IgnoredFiles are empty, parseCgo_ can skip the filesystem .c scan and then buildCgo's no-work fast return handles common non-cgo packages in effectively zero allocations.","result":"internal/build tests passed. buildCgo no-other-files metadata benchmark improved from 11908 ns/op, 1384 B/op, 6 allocs/op to 9 ns/op, 0 B/op, 0 allocs/op across 9 runs.","next_action_hint":"Add package-metadata focused tests proving scan is skipped only when metadata is available and no OtherFiles/IgnoredFiles exist, and that fallback scanning still finds .c files when metadata is absent or non-Go files are reported."}}
{"type":"config","name":"Validate cgo metadata scan skip","metricName":"validation_failures","metricUnit":"","bestDirection":"lower"}
{"run":1213,"commit":"b2b8283","metric":0,"metrics":{"packages_tested":5,"temp_builds":1},"status":"keep","description":"validate cgo metadata scan skip","timestamp":1777252574791,"segment":651,"confidence":null,"iterationTokens":318,"asi":{"hypothesis":"Skipping parseCgo_ directory scans based on complete package file metadata should preserve behavior: skip only when CompiledGoFiles exists and no OtherFiles/IgnoredFiles are reported, while synthetic/incomplete metadata and reported non-Go files still scan.","result":"Added TestParseCgoUsesFileMetadataForCScan covering metadata skip, fallback scan without CompiledGoFiles, and conservative scan when OtherFiles is present. go test ./internal/build, go test ./internal/crosscompile/..., and temp-path go build -tags=dev ./cmd/llgo passed; root llgo was not created."}}
{"type":"config","name":"Record cgo metadata scan skip","metricName":"validation_failures","metricUnit":"","bestDirection":"lower"}
{"run":1214,"commit":"52cba39","metric":0,"metrics":{"ideas_updated":1},"status":"keep","description":"record cgo metadata scan skip","timestamp":1777252602473,"segment":652,"confidence":null,"iterationTokens":187,"asi":{"hypothesis":"Record the parseCgo_ package metadata scan skip and its guardrails so future loops know the common no-other-files path is handled and tested.","result":"Ideas backlog records the 11908ns/op to 9ns/op no-other-files buildCgo improvement and the tests for metadata skip, fallback scan, and OtherFiles conservative scan."}}
{"type":"config","name":"Monitor PR after pushing cgo metadata scan skip","metricName":"pr_check_failures","metricUnit":"","bestDirection":"lower"}
{"run":1215,"commit":"e8f5137","metric":0,"metrics":{"pending_checks":0,"passed_checks":0,"skipped_checks":0,"llgo_in_pr_diff":0},"status":"keep","description":"monitor PR after pushing cgo metadata scan skip","timestamp":1777252666208,"segment":653,"confidence":null,"iterationTokens":453,"asi":{"hypothesis":"After pushing the cgo metadata scan skip, the PR should either start checks or remain without failures, and root llgo should remain absent from the diff.","result":"gh pr checks currently reports no checks on the improve/build-perf branch immediately after push; counted 0 failures and root llgo remains absent from PR diff.","next_action_hint":"Poll later because GitHub may not have attached the new check suite yet; verify source head and checks before considering PR runtime updates."}}
{"type":"config","name":"Check clean cmd llgo go-build after cgo metadata scan skip","metricName":"clean_go_build_ms","metricUnit":"ms","bestDirection":"lower"}
{"run":1216,"commit":"0879581","metric":14470,"metrics":{"runs":3},"status":"keep","description":"check clean cmd/llgo go-build after cgo metadata scan skip","timestamp":1777252741948,"segment":654,"confidence":null,"iterationTokens":419,"asi":{"hypothesis":"After cgo metadata scan skip, isolated clean go build of cmd/llgo should remain healthy and root llgo should not be created.","result":"Three isolated clean go build samples were 21780ms, 14300ms, and 14470ms; median 14470ms. This is much noisier/slower than recent samples, with the first run again a cold/outlier sample; treat as a noisy health signal to re-check later rather than proof of source regression. Root llgo was not created.","next_action_hint":"If subsequent local checks remain high, run paired A/B against origin/improve/build-perf before pushing more source changes."}}
{"type":"config","name":"Monitor PR cgo metadata scan skip delayed","metricName":"pr_check_failures","metricUnit":"","bestDirection":"lower"}
{"run":1217,"commit":"b929f6a","metric":0,"metrics":{"pending_checks":0,"passed_checks":0,"skipped_checks":0,"llgo_in_pr_diff":0},"status":"keep","description":"monitor PR cgo metadata scan skip delayed","timestamp":1777252770738,"segment":655,"confidence":null,"iterationTokens":491,"asi":{"hypothesis":"Delayed PR poll after cgo metadata scan skip should show checks or at least no failures, and confirm PR source head and root llgo absence.","result":"PR head is 52cba391; gh pr checks still reports no checks on improve/build-perf. Counted 0 failures and root llgo remains absent from PR diff.","next_action_hint":"Poll later or inspect Actions runs if checks remain missing; do not use this as runtime evidence."}}
{"type":"config","name":"Use package OtherFiles for cgo C-file list","metricName":"parse_cgo_other_c_ns_op","metricUnit":"","bestDirection":"lower"}
{"run":1218,"commit":"b135777","metric":18739,"metrics":{"parse_cgo_other_c_bytes_op":1872,"parse_cgo_other_c_allocs_op":13,"runs":9},"status":"keep","description":"baseline parseCgo with reported C OtherFiles","timestamp":1777252834663,"segment":656,"confidence":null,"iterationTokens":910,"asi":{"hypothesis":"When package file metadata reports OtherFiles, parseCgo_ currently falls back to scanning the source directory. Filtering reported OtherFiles directly for .c files may preserve go/packages semantics while avoiding filesystem directory scans in cgo packages.","result":"Baseline parseCgo_ with CompiledGoFiles and a reported C OtherFiles entry: 18739 ns/op, 1872 B/op, 13 allocs/op."}}
{"run":1219,"commit":"fce387f","metric":30,"metrics":{"parse_cgo_other_c_bytes_op":16,"parse_cgo_other_c_allocs_op":1,"runs":9},"status":"keep","description":"use package OtherFiles metadata for cgo C-file list","timestamp":1777252911327,"segment":656,"confidence":null,"iterationTokens":2550,"asi":{"hypothesis":"When package file metadata is complete and no IgnoredFiles are present, parseCgo_ can filter package OtherFiles directly for .c sources instead of scanning directories, preserving go/packages file selection while avoiding filesystem overhead for cgo packages.","result":"internal/build tests passed. parseCgo_ with a reported C OtherFiles entry improved from 18739 ns/op, 1872 B/op, 13 allocs/op to 30 ns/op, 16 B/op, 1 alloc/op across 9 runs.","next_action_hint":"Extend tests for pkgCFilesFromMetadata sorting, _test.c filtering, header-only OtherFiles, and IgnoredFiles fallback before broad validation/push."}}
{"type":"config","name":"Validate cgo OtherFiles metadata scanner","metricName":"validation_failures","metricUnit":"","bestDirection":"lower"}
{"run":1220,"commit":"965f3f0","metric":0,"metrics":{"packages_tested":5,"temp_builds":1},"status":"keep","description":"validate cgo OtherFiles metadata scanner","timestamp":1777252985378,"segment":657,"confidence":null,"iterationTokens":304,"asi":{"hypothesis":"Using complete package OtherFiles metadata for .c sources should preserve behavior by sorting filtered .c files, excluding _test.c, treating header-only metadata as no C work, and falling back to directory scan when IgnoredFiles or missing CompiledGoFiles make metadata less trustworthy.","result":"Added TestPkgCFilesFromMetadata and extended TestParseCgoUsesFileMetadataForCScan for metadata skip, direct OtherFiles, no-metadata fallback, and IgnoredFiles fallback. go test ./internal/build, go test ./internal/crosscompile/..., and temp-path go build -tags=dev ./cmd/llgo passed; root llgo was not created."}}
{"type":"config","name":"Record cgo OtherFiles metadata scanner","metricName":"validation_failures","metricUnit":"","bestDirection":"lower"}
